commit	strategy	symbol	sharpe	return_pct	cagr_pct	max_dd_pct	win_rate	profit_factor	trades	sortino	calmar	status	description	period
c1e7377	mtf_4h_keltner_volume_daily_hma_adx_v1	BTCUSDT	-0.7895	-0.15	-0.04	-15.29	38.4	1.17	424	-0.446	-0.0024	discard	exp#160 mtf_4h_keltner_volume_daily_hma_adx_v1	train
c1e7377	mtf_4h_keltner_volume_daily_hma_adx_v1	ETHUSDT	-0.6015	-0.99	-0.25	-16.82	39.3	1.1	427	-0.3364	-0.0148	discard	exp#160 mtf_4h_keltner_volume_daily_hma_adx_v1	train
c1e7377	mtf_4h_keltner_volume_daily_hma_adx_v1	SOLUSDT	-0.3566	-1.45	-0.37	-16.52	39.9	1.04	456	-0.2052	-0.0222	discard	exp#160 mtf_4h_keltner_volume_daily_hma_adx_v1	train
8b78905	mtf_12h_regime_chop_bb_daily_weekly_hma_v1	BTCUSDT	-0.6011	-1.59	-0.4	-17.05	34.3	1.06	239	-0.5424	-0.0234	discard	exp#161 mtf_12h_regime_chop_bb_daily_weekly_hma_v1	train
8b78905	mtf_12h_regime_chop_bb_daily_weekly_hma_v1	ETHUSDT	-0.1385	12.29	2.94	-15.86	32.8	1.15	259	-0.1345	0.1856	discard	exp#161 mtf_12h_regime_chop_bb_daily_weekly_hma_v1	train
8b78905	mtf_12h_regime_chop_bb_daily_weekly_hma_v1	SOLUSDT	0.5682	65.61	13.5	-26.53	39.5	1.51	223	0.521	0.5087	keep	exp#161 mtf_12h_regime_chop_bb_daily_weekly_hma_v1	train
8b78905	mtf_12h_regime_chop_bb_daily_weekly_hma_v1	SOLUSDT	1.2002	23.69	19.11	-8.91	42.5	1.68	73	1.2102	2.145	keep	exp#161 mtf_12h_regime_chop_bb_daily_weekly_hma_v1	test
8b78905	mtf_12h_regime_chop_bb_daily_weekly_hma_v1	BTCUSDT	-0.6011	-1.59	-0.4	-17.05	34.3	1.06	239	-0.5424	-0.0234	discard	exp#161 mtf_12h_regime_chop_bb_daily_weekly_hma_v1	train
8b78905	mtf_12h_regime_chop_bb_daily_weekly_hma_v1	ETHUSDT	-0.1385	12.29	2.94	-15.86	32.8	1.15	259	-0.1345	0.1856	discard	exp#161 mtf_12h_regime_chop_bb_daily_weekly_hma_v1	train
8b78905	mtf_12h_regime_chop_bb_daily_weekly_hma_v1	SOLUSDT	0.5682	65.61	13.5	-26.53	39.5	1.51	223	0.521	0.5087	keep	exp#161 mtf_12h_regime_chop_bb_daily_weekly_hma_v1	train
8b78905	mtf_12h_regime_chop_bb_daily_weekly_hma_v1	SOLUSDT	1.2002	23.69	19.11	-8.91	42.5	1.68	73	1.2102	2.145	keep	exp#161 mtf_12h_regime_chop_bb_daily_weekly_hma_v1	test
1bc27c9	mtf_1d_crsi_weekly_hma_chop_atr_v1	BTCUSDT	-1.2911	0.07	0.02	-6.7	44.9	1.07	89	-0.6567	0.0024	discard	exp#162 mtf_1d_crsi_weekly_hma_chop_atr_v1	train
1bc27c9	mtf_1d_crsi_weekly_hma_chop_atr_v1	ETHUSDT	-1.5067	-4.15	-1.06	-5.8	42.9	0.82	35	-0.397	-0.182	discard	exp#162 mtf_1d_crsi_weekly_hma_chop_atr_v1	train
1bc27c9	mtf_1d_crsi_weekly_hma_chop_atr_v1	SOLUSDT	-0.9873	1.36	0.34	-5.95	38.5	1.08	39	-0.3788	0.0572	discard	exp#162 mtf_1d_crsi_weekly_hma_chop_atr_v1	train
1bc27c9	mtf_1d_crsi_weekly_hma_chop_atr_v1	BTCUSDT	-1.2911	0.07	0.02	-6.7	44.9	1.07	89	-0.6567	0.0024	discard	exp#162 mtf_1d_crsi_weekly_hma_chop_atr_v1	train
1bc27c9	mtf_1d_crsi_weekly_hma_chop_atr_v1	ETHUSDT	-1.5067	-4.15	-1.06	-5.8	42.9	0.82	35	-0.397	-0.182	discard	exp#162 mtf_1d_crsi_weekly_hma_chop_atr_v1	train
1bc27c9	mtf_1d_crsi_weekly_hma_chop_atr_v1	SOLUSDT	-0.9873	1.36	0.34	-5.95	38.5	1.08	39	-0.3788	0.0572	discard	exp#162 mtf_1d_crsi_weekly_hma_chop_atr_v1	train
83d5e94	mtf_15m_crsi_4h_hma_volume_atr_v1	BTCUSDT	-8.7419	-41.25	-12.46	-42.07	49.7	0.58	1971	-1.8961	-0.2962	discard	exp#163 mtf_15m_crsi_4h_hma_volume_atr_v1	train
83d5e94	mtf_15m_crsi_4h_hma_volume_atr_v1	ETHUSDT	-7.1938	-38.39	-11.41	-38.69	52.1	0.64	1773	-1.4233	-0.295	discard	exp#163 mtf_15m_crsi_4h_hma_volume_atr_v1	train
83d5e94	mtf_15m_crsi_4h_hma_volume_atr_v1	SOLUSDT	-3.8382	-33.66	-9.79	-34.78	57.2	0.77	1487	-0.6917	-0.2815	discard	exp#163 mtf_15m_crsi_4h_hma_volume_atr_v1	train
83d5e94	mtf_15m_crsi_4h_hma_volume_atr_v1	BTCUSDT	-8.7419	-41.25	-12.46	-42.07	49.7	0.58	1971	-1.8961	-0.2962	discard	exp#163 mtf_15m_crsi_4h_hma_volume_atr_v1	train
83d5e94	mtf_15m_crsi_4h_hma_volume_atr_v1	ETHUSDT	-7.1938	-38.39	-11.41	-38.69	52.1	0.64	1773	-1.4233	-0.295	discard	exp#163 mtf_15m_crsi_4h_hma_volume_atr_v1	train
83d5e94	mtf_15m_crsi_4h_hma_volume_atr_v1	SOLUSDT	-3.8382	-33.66	-9.79	-34.78	57.2	0.77	1487	-0.6917	-0.2815	discard	exp#163 mtf_15m_crsi_4h_hma_volume_atr_v1	train
b1c8774	mtf_30m_crsi_4h_1d_hma_mean_reversion_v1	BTCUSDT	-6.3643	-57.64	-19.34	-57.7	57.4	0.76	3564	-2.6874	-0.3351	discard	exp#164 mtf_30m_crsi_4h_1d_hma_mean_reversion_v1	train
b1c8774	mtf_30m_crsi_4h_1d_hma_mean_reversion_v1	ETHUSDT	-4.6075	-51.94	-16.75	-51.94	59.7	0.82	3256	-1.8801	-0.3225	discard	exp#164 mtf_30m_crsi_4h_1d_hma_mean_reversion_v1	train
b1c8774	mtf_30m_crsi_4h_1d_hma_mean_reversion_v1	SOLUSDT	-1.6832	-27.49	-7.75	-29.13	64.8	1.01	2846	-0.7253	-0.2661	discard	exp#164 mtf_30m_crsi_4h_1d_hma_mean_reversion_v1	train
b1c8774	mtf_30m_crsi_4h_1d_hma_mean_reversion_v1	BTCUSDT	-6.3643	-57.64	-19.34	-57.7	57.4	0.76	3564	-2.6874	-0.3351	discard	exp#164 mtf_30m_crsi_4h_1d_hma_mean_reversion_v1	train
b1c8774	mtf_30m_crsi_4h_1d_hma_mean_reversion_v1	ETHUSDT	-4.6075	-51.94	-16.75	-51.94	59.7	0.82	3256	-1.8801	-0.3225	discard	exp#164 mtf_30m_crsi_4h_1d_hma_mean_reversion_v1	train
b1c8774	mtf_30m_crsi_4h_1d_hma_mean_reversion_v1	SOLUSDT	-1.6832	-27.49	-7.75	-29.13	64.8	1.01	2846	-0.7253	-0.2661	discard	exp#164 mtf_30m_crsi_4h_1d_hma_mean_reversion_v1	train
c42de96	mtf_1h_hma_4h_trend_rsi_pullback_atr_v1	BTCUSDT	-3.7849	-9.56	-2.48	-11.51	42.5	0.82	346	-0.7269	-0.2156	discard	exp#165 mtf_1h_hma_4h_trend_rsi_pullback_atr_v1	train
c42de96	mtf_1h_hma_4h_trend_rsi_pullback_atr_v1	ETHUSDT	-2.9814	-5.48	-1.4	-7.65	43.9	0.98	335	-0.6165	-0.1831	discard	exp#165 mtf_1h_hma_4h_trend_rsi_pullback_atr_v1	train
c42de96	mtf_1h_hma_4h_trend_rsi_pullback_atr_v1	SOLUSDT	-2.1045	-12.04	-3.17	-13.42	44.5	0.85	375	-0.4304	-0.2362	discard	exp#165 mtf_1h_hma_4h_trend_rsi_pullback_atr_v1	train
c42de96	mtf_1h_hma_4h_trend_rsi_pullback_atr_v1	BTCUSDT	-3.7849	-9.56	-2.48	-11.51	42.5	0.82	346	-0.7269	-0.2156	discard	exp#165 mtf_1h_hma_4h_trend_rsi_pullback_atr_v1	train
c42de96	mtf_1h_hma_4h_trend_rsi_pullback_atr_v1	ETHUSDT	-2.9814	-5.48	-1.4	-7.65	43.9	0.98	335	-0.6165	-0.1831	discard	exp#165 mtf_1h_hma_4h_trend_rsi_pullback_atr_v1	train
c42de96	mtf_1h_hma_4h_trend_rsi_pullback_atr_v1	SOLUSDT	-2.1045	-12.04	-3.17	-13.42	44.5	0.85	375	-0.4304	-0.2362	discard	exp#165 mtf_1h_hma_4h_trend_rsi_pullback_atr_v1	train
98ebc6d	mtf_1d_multi_signal_weekly_hma_ors_v1	BTCUSDT	-0.4736	4.07	1.0	-12.19	55.8	1.14	181	-0.3538	0.0822	discard	exp#168 mtf_1d_multi_signal_weekly_hma_ors_v1	train
98ebc6d	mtf_1d_multi_signal_weekly_hma_ors_v1	ETHUSDT	-0.7294	-9.98	-2.59	-21.37	51.5	0.94	169	-0.5248	-0.1214	discard	exp#168 mtf_1d_multi_signal_weekly_hma_ors_v1	train
98ebc6d	mtf_1d_multi_signal_weekly_hma_ors_v1	SOLUSDT	0.2514	36.82	8.18	-23.67	57.8	1.24	161	0.1823	0.3457	keep	exp#168 mtf_1d_multi_signal_weekly_hma_ors_v1	train
98ebc6d	mtf_1d_multi_signal_weekly_hma_ors_v1	SOLUSDT	-0.4535	-2.76	-2.27	-12.47	60.3	0.98	73	-0.3436	-0.1823	discard	exp#168 mtf_1d_multi_signal_weekly_hma_ors_v1	test
98ebc6d	mtf_1d_multi_signal_weekly_hma_ors_v1	BTCUSDT	-0.4736	4.07	1.0	-12.19	55.8	1.14	181	-0.3538	0.0822	discard	exp#168 mtf_1d_multi_signal_weekly_hma_ors_v1	train
98ebc6d	mtf_1d_multi_signal_weekly_hma_ors_v1	ETHUSDT	-0.7294	-9.98	-2.59	-21.37	51.5	0.94	169	-0.5248	-0.1214	discard	exp#168 mtf_1d_multi_signal_weekly_hma_ors_v1	train
98ebc6d	mtf_1d_multi_signal_weekly_hma_ors_v1	SOLUSDT	0.2514	36.82	8.18	-23.67	57.8	1.24	161	0.1823	0.3457	discard	exp#168 mtf_1d_multi_signal_weekly_hma_ors_v1	train
47307e0	mtf_15m_kama_rsi_4h_1h_hma_trend_v1	BTCUSDT	-10.8742	-7.78	-2.01	-7.9	35.8	0.51	285	-0.918	-0.2539	discard	exp#169 mtf_15m_kama_rsi_4h_1h_hma_trend_v1	train
47307e0	mtf_15m_kama_rsi_4h_1h_hma_trend_v1	ETHUSDT	-5.8866	-4.8	-1.22	-5.03	43.0	0.89	293	-0.6795	-0.243	discard	exp#169 mtf_15m_kama_rsi_4h_1h_hma_trend_v1	train
47307e0	mtf_15m_kama_rsi_4h_1h_hma_trend_v1	SOLUSDT	-4.7101	-5.47	-1.4	-6.48	48.2	0.87	280	-0.4238	-0.2165	discard	exp#169 mtf_15m_kama_rsi_4h_1h_hma_trend_v1	train
47307e0	mtf_15m_kama_rsi_4h_1h_hma_trend_v1	BTCUSDT	-10.8742	-7.78	-2.01	-7.9	35.8	0.51	285	-0.918	-0.2539	discard	exp#169 mtf_15m_kama_rsi_4h_1h_hma_trend_v1	train
47307e0	mtf_15m_kama_rsi_4h_1h_hma_trend_v1	ETHUSDT	-5.8866	-4.8	-1.22	-5.03	43.0	0.89	293	-0.6795	-0.243	discard	exp#169 mtf_15m_kama_rsi_4h_1h_hma_trend_v1	train
47307e0	mtf_15m_kama_rsi_4h_1h_hma_trend_v1	SOLUSDT	-4.7101	-5.47	-1.4	-6.48	48.2	0.87	280	-0.4238	-0.2165	discard	exp#169 mtf_15m_kama_rsi_4h_1h_hma_trend_v1	train
9bc2592	mtf_30m_rsi_4h_hma_volume_atr_v1	BTCUSDT	-6.3586	-89.05	-42.5	-90.09	50.4	0.82	7452	-4.1696	-0.4717	discard	exp#170 mtf_30m_rsi_4h_hma_volume_atr_v1	train
9bc2592	mtf_30m_rsi_4h_hma_volume_atr_v1	ETHUSDT	-5.6327	-90.39	-44.35	-90.84	50.7	0.83	7384	-3.6449	-0.4882	discard	exp#170 mtf_30m_rsi_4h_hma_volume_atr_v1	train
9bc2592	mtf_30m_rsi_4h_hma_volume_atr_v1	SOLUSDT	-2.5135	-79.56	-32.87	-81.84	54.8	0.92	6558	-1.4846	-0.4016	discard	exp#170 mtf_30m_rsi_4h_hma_volume_atr_v1	train
9bc2592	mtf_30m_rsi_4h_hma_volume_atr_v1	BTCUSDT	-6.3586	-89.05	-42.5	-90.09	50.4	0.82	7452	-4.1696	-0.4717	discard	exp#170 mtf_30m_rsi_4h_hma_volume_atr_v1	train
9bc2592	mtf_30m_rsi_4h_hma_volume_atr_v1	ETHUSDT	-5.6327	-90.39	-44.35	-90.84	50.7	0.83	7384	-3.6449	-0.4882	discard	exp#170 mtf_30m_rsi_4h_hma_volume_atr_v1	train
9bc2592	mtf_30m_rsi_4h_hma_volume_atr_v1	SOLUSDT	-2.5135	-79.56	-32.87	-81.84	54.8	0.92	6558	-1.4846	-0.4016	discard	exp#170 mtf_30m_rsi_4h_hma_volume_atr_v1	train
68bdb9c	mtf_1h_regime_4h_12h_hma_rsi_chop_adx_v1	BTCUSDT	-3.8433	-27.62	-7.77	-29.04	38.3	0.82	1295	-1.5349	-0.2676	discard	exp#171 mtf_1h_regime_4h_12h_hma_rsi_chop_adx_v1	train
68bdb9c	mtf_1h_regime_4h_12h_hma_rsi_chop_adx_v1	ETHUSDT	-2.8497	-25.34	-7.05	-26.56	39.9	0.9	1345	-1.2678	-0.2654	discard	exp#171 mtf_1h_regime_4h_12h_hma_rsi_chop_adx_v1	train
68bdb9c	mtf_1h_regime_4h_12h_hma_rsi_chop_adx_v1	SOLUSDT	-2.4374	-36.21	-10.67	-38.4	43.5	0.84	1249	-0.8713	-0.278	discard	exp#171 mtf_1h_regime_4h_12h_hma_rsi_chop_adx_v1	train
68bdb9c	mtf_1h_regime_4h_12h_hma_rsi_chop_adx_v1	BTCUSDT	-3.8433	-27.62	-7.77	-29.04	38.3	0.82	1295	-1.5349	-0.2676	discard	exp#171 mtf_1h_regime_4h_12h_hma_rsi_chop_adx_v1	train
68bdb9c	mtf_1h_regime_4h_12h_hma_rsi_chop_adx_v1	ETHUSDT	-2.8497	-25.34	-7.05	-26.56	39.9	0.9	1345	-1.2678	-0.2654	discard	exp#171 mtf_1h_regime_4h_12h_hma_rsi_chop_adx_v1	train
68bdb9c	mtf_1h_regime_4h_12h_hma_rsi_chop_adx_v1	SOLUSDT	-2.4374	-36.21	-10.67	-38.4	43.5	0.84	1249	-0.8713	-0.278	discard	exp#171 mtf_1h_regime_4h_12h_hma_rsi_chop_adx_v1	train
ec37bf0	mtf_4h_donchian_daily_hma_rsi_pullback_v1	BTCUSDT	-1.6159	-20.12	-5.47	-23.04	46.2	0.93	954	-1.105	-0.2372	discard	exp#172 mtf_4h_donchian_daily_hma_rsi_pullback_v1	train
ec37bf0	mtf_4h_donchian_daily_hma_rsi_pullback_v1	ETHUSDT	-1.1034	-15.39	-4.1	-19.24	46.8	0.98	968	-0.7383	-0.2129	discard	exp#172 mtf_4h_donchian_daily_hma_rsi_pullback_v1	train
ec37bf0	mtf_4h_donchian_daily_hma_rsi_pullback_v1	SOLUSDT	-1.1665	-37.24	-11.03	-37.24	46.5	0.89	994	-0.827	-0.2963	discard	exp#172 mtf_4h_donchian_daily_hma_rsi_pullback_v1	train
ec37bf0	mtf_4h_donchian_daily_hma_rsi_pullback_v1	BTCUSDT	-1.6159	-20.12	-5.47	-23.04	46.2	0.93	954	-1.105	-0.2372	discard	exp#172 mtf_4h_donchian_daily_hma_rsi_pullback_v1	train
ec37bf0	mtf_4h_donchian_daily_hma_rsi_pullback_v1	ETHUSDT	-1.1034	-15.39	-4.1	-19.24	46.8	0.98	968	-0.7383	-0.2129	discard	exp#172 mtf_4h_donchian_daily_hma_rsi_pullback_v1	train
ec37bf0	mtf_4h_donchian_daily_hma_rsi_pullback_v1	SOLUSDT	-1.1665	-37.24	-11.03	-37.24	46.5	0.89	994	-0.827	-0.2963	discard	exp#172 mtf_4h_donchian_daily_hma_rsi_pullback_v1	train
2b3c263	mtf_12h_supertrend_daily_weekly_hma_rsi_v1	BTCUSDT	-1.8528	4.45	1.09	-1.96	60.0	1.91	25	-0.3911	0.5586	discard	exp#173 mtf_12h_supertrend_daily_weekly_hma_rsi_v1	train
2b3c263	mtf_12h_supertrend_daily_weekly_hma_rsi_v1	ETHUSDT	-3.5385	-3.04	-0.77	-4.3	37.9	0.69	29	-0.7187	-0.1786	discard	exp#173 mtf_12h_supertrend_daily_weekly_hma_rsi_v1	train
2b3c263	mtf_12h_supertrend_daily_weekly_hma_rsi_v1	SOLUSDT	-3.2466	-4.81	-1.23	-5.91	34.6	0.53	26	-0.5544	-0.2079	discard	exp#173 mtf_12h_supertrend_daily_weekly_hma_rsi_v1	train
2b3c263	mtf_12h_supertrend_daily_weekly_hma_rsi_v1	BTCUSDT	-1.8528	4.45	1.09	-1.96	60.0	1.91	25	-0.3911	0.5586	discard	exp#173 mtf_12h_supertrend_daily_weekly_hma_rsi_v1	train
2b3c263	mtf_12h_supertrend_daily_weekly_hma_rsi_v1	ETHUSDT	-3.5385	-3.04	-0.77	-4.3	37.9	0.69	29	-0.7187	-0.1786	discard	exp#173 mtf_12h_supertrend_daily_weekly_hma_rsi_v1	train
2b3c263	mtf_12h_supertrend_daily_weekly_hma_rsi_v1	SOLUSDT	-3.2466	-4.81	-1.23	-5.91	34.6	0.53	26	-0.5544	-0.2079	discard	exp#173 mtf_12h_supertrend_daily_weekly_hma_rsi_v1	train
6b997f8	mtf_1d_donchian_weekly_hma_rsi_atr_v1	BTCUSDT	-1.6361	-4.49	-1.14	-10.87	49.0	0.85	49	-0.6034	-0.1049	discard	exp#174 mtf_1d_donchian_weekly_hma_rsi_atr_v1	train
6b997f8	mtf_1d_donchian_weekly_hma_rsi_atr_v1	ETHUSDT	-0.3787	13.97	3.32	-4.51	59.0	2.05	39	-0.1846	0.7373	discard	exp#174 mtf_1d_donchian_weekly_hma_rsi_atr_v1	train
6b997f8	mtf_1d_donchian_weekly_hma_rsi_atr_v1	SOLUSDT	-1.2212	-6.23	-1.6	-9.26	40.9	0.85	44	-0.4518	-0.1728	discard	exp#174 mtf_1d_donchian_weekly_hma_rsi_atr_v1	train
6b997f8	mtf_1d_donchian_weekly_hma_rsi_atr_v1	BTCUSDT	-1.6361	-4.49	-1.14	-10.87	49.0	0.85	49	-0.6034	-0.1049	discard	exp#174 mtf_1d_donchian_weekly_hma_rsi_atr_v1	train
6b997f8	mtf_1d_donchian_weekly_hma_rsi_atr_v1	ETHUSDT	-0.3787	13.97	3.32	-4.51	59.0	2.05	39	-0.1846	0.7373	discard	exp#174 mtf_1d_donchian_weekly_hma_rsi_atr_v1	train
6b997f8	mtf_1d_donchian_weekly_hma_rsi_atr_v1	SOLUSDT	-1.2212	-6.23	-1.6	-9.26	40.9	0.85	44	-0.4518	-0.1728	discard	exp#174 mtf_1d_donchian_weekly_hma_rsi_atr_v1	train
6b745a7	mtf_15m_hma_rsi_adx_1h_4h_trend_pullback_v1	BTCUSDT	-9.1598	-51.31	-16.48	-51.56	38.9	0.65	2785	-2.9898	-0.3196	discard	exp#175 mtf_15m_hma_rsi_adx_1h_4h_trend_pullback_v1	train
6b745a7	mtf_15m_hma_rsi_adx_1h_4h_trend_pullback_v1	ETHUSDT	-7.5552	-49.74	-15.81	-49.78	40.0	0.73	2775	-2.3936	-0.3176	discard	exp#175 mtf_15m_hma_rsi_adx_1h_4h_trend_pullback_v1	train
6b745a7	mtf_15m_hma_rsi_adx_1h_4h_trend_pullback_v1	SOLUSDT	-4.4062	-47.05	-14.75	-47.19	45.7	0.83	2711	-1.3278	-0.3126	discard	exp#175 mtf_15m_hma_rsi_adx_1h_4h_trend_pullback_v1	train
6b745a7	mtf_15m_hma_rsi_adx_1h_4h_trend_pullback_v1	BTCUSDT	-9.1598	-51.31	-16.48	-51.56	38.9	0.65	2785	-2.9898	-0.3196	discard	exp#175 mtf_15m_hma_rsi_adx_1h_4h_trend_pullback_v1	train
6b745a7	mtf_15m_hma_rsi_adx_1h_4h_trend_pullback_v1	ETHUSDT	-7.5552	-49.74	-15.81	-49.78	40.0	0.73	2775	-2.3936	-0.3176	discard	exp#175 mtf_15m_hma_rsi_adx_1h_4h_trend_pullback_v1	train
6b745a7	mtf_15m_hma_rsi_adx_1h_4h_trend_pullback_v1	SOLUSDT	-4.4062	-47.05	-14.75	-47.19	45.7	0.83	2711	-1.3278	-0.3126	discard	exp#175 mtf_15m_hma_rsi_adx_1h_4h_trend_pullback_v1	train
8ad2edf	mtf_30m_hma_rsi_volume_pullback_atr_v1	BTCUSDT	-8.9273	-97.38	-59.79	-97.45	37.5	0.82	14385	-9.0249	-0.6135	discard	exp#176 mtf_30m_hma_rsi_volume_pullback_atr_v1	train
8ad2edf	mtf_30m_hma_rsi_volume_pullback_atr_v1	ETHUSDT	-7.5353	-97.95	-62.17	-97.95	39.1	0.83	14661	-7.3842	-0.6347	discard	exp#176 mtf_30m_hma_rsi_volume_pullback_atr_v1	train
8ad2edf	mtf_30m_hma_rsi_volume_pullback_atr_v1	SOLUSDT	-4.637	-98.11	-63.05	-98.25	41.8	0.94	15265	-4.5649	-0.6417	discard	exp#176 mtf_30m_hma_rsi_volume_pullback_atr_v1	train
8ad2edf	mtf_30m_hma_rsi_volume_pullback_atr_v1	BTCUSDT	-8.9273	-97.38	-59.79	-97.45	37.5	0.82	14385	-9.0249	-0.6135	discard	exp#176 mtf_30m_hma_rsi_volume_pullback_atr_v1	train
8ad2edf	mtf_30m_hma_rsi_volume_pullback_atr_v1	ETHUSDT	-7.5353	-97.95	-62.17	-97.95	39.1	0.83	14661	-7.3842	-0.6347	discard	exp#176 mtf_30m_hma_rsi_volume_pullback_atr_v1	train
8ad2edf	mtf_30m_hma_rsi_volume_pullback_atr_v1	SOLUSDT	-4.637	-98.11	-63.05	-98.25	41.8	0.94	15265	-4.5649	-0.6417	discard	exp#176 mtf_30m_hma_rsi_volume_pullback_atr_v1	train
b1d4e4b	mtf_1h_crsi_4h_12h_hma_chop_atr_v1	BTCUSDT	-7.0981	-0.26	-0.07	-1.23	72.2	0.99	18	-0.2157	-0.0528	discard	exp#177 mtf_1h_crsi_4h_12h_hma_chop_atr_v1	train
b1d4e4b	mtf_1h_crsi_4h_12h_hma_chop_atr_v1	ETHUSDT	-7.6209	-0.9	-0.23	-1.73	36.6	0.86	41	-0.6772	-0.1299	discard	exp#177 mtf_1h_crsi_4h_12h_hma_chop_atr_v1	train
b1d4e4b	mtf_1h_crsi_4h_12h_hma_chop_atr_v1	SOLUSDT	-4.6771	0.44	0.11	-1.4	62.9	1.22	35	-0.3405	0.0785	discard	exp#177 mtf_1h_crsi_4h_12h_hma_chop_atr_v1	train
b1d4e4b	mtf_1h_crsi_4h_12h_hma_chop_atr_v1	BTCUSDT	-7.0981	-0.26	-0.07	-1.23	72.2	0.99	18	-0.2157	-0.0528	discard	exp#177 mtf_1h_crsi_4h_12h_hma_chop_atr_v1	train
b1d4e4b	mtf_1h_crsi_4h_12h_hma_chop_atr_v1	ETHUSDT	-7.6209	-0.9	-0.23	-1.73	36.6	0.86	41	-0.6772	-0.1299	discard	exp#177 mtf_1h_crsi_4h_12h_hma_chop_atr_v1	train
b1d4e4b	mtf_1h_crsi_4h_12h_hma_chop_atr_v1	SOLUSDT	-4.6771	0.44	0.11	-1.4	62.9	1.22	35	-0.3405	0.0785	discard	exp#177 mtf_1h_crsi_4h_12h_hma_chop_atr_v1	train
76f9b5e	mtf_4h_kama_rsi_daily_weekly_hma_pullback_v1	BTCUSDT	-1.3691	-18.26	-4.92	-22.26	34.0	0.93	852	-1.0427	-0.221	discard	exp#178 mtf_4h_kama_rsi_daily_weekly_hma_pullback_v1	train
76f9b5e	mtf_4h_kama_rsi_daily_weekly_hma_pullback_v1	ETHUSDT	-0.8955	-12.59	-3.31	-22.47	37.8	1.02	834	-0.6711	-0.1473	discard	exp#178 mtf_4h_kama_rsi_daily_weekly_hma_pullback_v1	train
76f9b5e	mtf_4h_kama_rsi_daily_weekly_hma_pullback_v1	SOLUSDT	0.2787	37.73	8.37	-16.7	40.9	1.21	772	0.2136	0.501	keep	exp#178 mtf_4h_kama_rsi_daily_weekly_hma_pullback_v1	train
76f9b5e	mtf_4h_kama_rsi_daily_weekly_hma_pullback_v1	SOLUSDT	-1.611	-10.9	-9.06	-15.22	37.0	0.85	230	-1.0903	-0.5954	discard	exp#178 mtf_4h_kama_rsi_daily_weekly_hma_pullback_v1	test
76f9b5e	mtf_4h_kama_rsi_daily_weekly_hma_pullback_v1	BTCUSDT	-1.3691	-18.26	-4.92	-22.26	34.0	0.93	852	-1.0427	-0.221	discard	exp#178 mtf_4h_kama_rsi_daily_weekly_hma_pullback_v1	train
76f9b5e	mtf_4h_kama_rsi_daily_weekly_hma_pullback_v1	ETHUSDT	-0.8955	-12.59	-3.31	-22.47	37.8	1.02	834	-0.6711	-0.1473	discard	exp#178 mtf_4h_kama_rsi_daily_weekly_hma_pullback_v1	train
76f9b5e	mtf_4h_kama_rsi_daily_weekly_hma_pullback_v1	SOLUSDT	0.2787	37.73	8.37	-16.7	40.9	1.21	772	0.2136	0.501	discard	exp#178 mtf_4h_kama_rsi_daily_weekly_hma_pullback_v1	train
ff48584	mtf_12h_fisher_daily_hma_volume_atr_v1	BTCUSDT	-2.0814	-1.12	-0.28	-3.53	45.1	1.03	113	-0.8137	-0.0795	discard	exp#179 mtf_12h_fisher_daily_hma_volume_atr_v1	train
ff48584	mtf_12h_fisher_daily_hma_volume_atr_v1	ETHUSDT	-1.6786	1.68	0.42	-3.8	47.0	1.18	100	-0.6288	0.1099	discard	exp#179 mtf_12h_fisher_daily_hma_volume_atr_v1	train
ff48584	mtf_12h_fisher_daily_hma_volume_atr_v1	SOLUSDT	-0.5863	9.41	2.28	-4.92	53.8	1.46	93	-0.2585	0.4641	discard	exp#179 mtf_12h_fisher_daily_hma_volume_atr_v1	train
ff48584	mtf_12h_fisher_daily_hma_volume_atr_v1	BTCUSDT	-2.0814	-1.12	-0.28	-3.53	45.1	1.03	113	-0.8137	-0.0795	discard	exp#179 mtf_12h_fisher_daily_hma_volume_atr_v1	train
ff48584	mtf_12h_fisher_daily_hma_volume_atr_v1	ETHUSDT	-1.6786	1.68	0.42	-3.8	47.0	1.18	100	-0.6288	0.1099	discard	exp#179 mtf_12h_fisher_daily_hma_volume_atr_v1	train
ff48584	mtf_12h_fisher_daily_hma_volume_atr_v1	SOLUSDT	-0.5863	9.41	2.28	-4.92	53.8	1.46	93	-0.2585	0.4641	discard	exp#179 mtf_12h_fisher_daily_hma_volume_atr_v1	train
c78cff9	mtf_1d_adaptive_trend_mr_weekly_hma_chop_v1	BTCUSDT	-2.8489	-11.62	-3.04	-12.2	37.5	0.33	40	-0.7251	-0.2492	discard	exp#180 mtf_1d_adaptive_trend_mr_weekly_hma_chop_v1	train
c78cff9	mtf_1d_adaptive_trend_mr_weekly_hma_chop_v1	ETHUSDT	-1.1688	0.66	0.16	-6.85	47.3	1.1	55	-0.5061	0.024	discard	exp#180 mtf_1d_adaptive_trend_mr_weekly_hma_chop_v1	train
c78cff9	mtf_1d_adaptive_trend_mr_weekly_hma_chop_v1	SOLUSDT	-0.1706	15.38	3.65	-7.79	53.1	1.87	32	-0.0609	0.4687	discard	exp#180 mtf_1d_adaptive_trend_mr_weekly_hma_chop_v1	train
c78cff9	mtf_1d_adaptive_trend_mr_weekly_hma_chop_v1	BTCUSDT	-2.8489	-11.62	-3.04	-12.2	37.5	0.33	40	-0.7251	-0.2492	discard	exp#180 mtf_1d_adaptive_trend_mr_weekly_hma_chop_v1	train
c78cff9	mtf_1d_adaptive_trend_mr_weekly_hma_chop_v1	ETHUSDT	-1.1688	0.66	0.16	-6.85	47.3	1.1	55	-0.5061	0.024	discard	exp#180 mtf_1d_adaptive_trend_mr_weekly_hma_chop_v1	train
c78cff9	mtf_1d_adaptive_trend_mr_weekly_hma_chop_v1	SOLUSDT	-0.1706	15.38	3.65	-7.79	53.1	1.87	32	-0.0609	0.4687	discard	exp#180 mtf_1d_adaptive_trend_mr_weekly_hma_chop_v1	train
0051d1a	mtf_30m_rsi_pullback_4h_hma_simple_v1	BTCUSDT	-8.6135	-86.53	-39.44	-86.56	37.7	0.78	6806	-4.9292	-0.4557	discard	exp#182 mtf_30m_rsi_pullback_4h_hma_simple_v1	train
0051d1a	mtf_30m_rsi_pullback_4h_hma_simple_v1	ETHUSDT	-7.2651	-87.72	-40.82	-88.01	39.5	0.78	6724	-4.1668	-0.4639	discard	exp#182 mtf_30m_rsi_pullback_4h_hma_simple_v1	train
0051d1a	mtf_30m_rsi_pullback_4h_hma_simple_v1	SOLUSDT	-5.6968	-92.23	-47.34	-92.32	41.4	0.79	6739	-3.3474	-0.5128	discard	exp#182 mtf_30m_rsi_pullback_4h_hma_simple_v1	train
0051d1a	mtf_30m_rsi_pullback_4h_hma_simple_v1	BTCUSDT	-8.6135	-86.53	-39.44	-86.56	37.7	0.78	6806	-4.9292	-0.4557	discard	exp#182 mtf_30m_rsi_pullback_4h_hma_simple_v1	train
0051d1a	mtf_30m_rsi_pullback_4h_hma_simple_v1	ETHUSDT	-7.2651	-87.72	-40.82	-88.01	39.5	0.78	6724	-4.1668	-0.4639	discard	exp#182 mtf_30m_rsi_pullback_4h_hma_simple_v1	train
0051d1a	mtf_30m_rsi_pullback_4h_hma_simple_v1	SOLUSDT	-5.6968	-92.23	-47.34	-92.32	41.4	0.79	6739	-3.3474	-0.5128	discard	exp#182 mtf_30m_rsi_pullback_4h_hma_simple_v1	train
9e57fa2	mtf_1h_crsi_4h_12h_hma_chop_mean_reversion_v1	BTCUSDT	-2.7702	-29.26	-8.3	-31.94	55.4	0.91	1683	-1.2496	-0.2598	discard	exp#183 mtf_1h_crsi_4h_12h_hma_chop_mean_reversion_v1	train
9e57fa2	mtf_1h_crsi_4h_12h_hma_chop_mean_reversion_v1	ETHUSDT	-1.5907	-14.7	-3.9	-19.97	55.9	1.08	1717	-0.75	-0.1953	discard	exp#183 mtf_1h_crsi_4h_12h_hma_chop_mean_reversion_v1	train
9e57fa2	mtf_1h_crsi_4h_12h_hma_chop_mean_reversion_v1	SOLUSDT	-0.687	-6.83	-1.76	-19.06	59.3	1.09	1717	-0.3042	-0.0924	discard	exp#183 mtf_1h_crsi_4h_12h_hma_chop_mean_reversion_v1	train
9e57fa2	mtf_1h_crsi_4h_12h_hma_chop_mean_reversion_v1	BTCUSDT	-2.7702	-29.26	-8.3	-31.94	55.4	0.91	1683	-1.2496	-0.2598	discard	exp#183 mtf_1h_crsi_4h_12h_hma_chop_mean_reversion_v1	train
9e57fa2	mtf_1h_crsi_4h_12h_hma_chop_mean_reversion_v1	ETHUSDT	-1.5907	-14.7	-3.9	-19.97	55.9	1.08	1717	-0.75	-0.1953	discard	exp#183 mtf_1h_crsi_4h_12h_hma_chop_mean_reversion_v1	train
