commit	strategy	symbol	sharpe	return_pct	cagr_pct	max_dd_pct	win_rate	profit_factor	trades	sortino	calmar	status	description	period
250d2fc	mtf_1h_hma_rsi_zscore_4h_trend_atr_v1	BTCUSDT	-4.0346	-23.2	-6.39	-24.9	49.8	0.71	743	-1.1371	-0.2566	discard	exp#207 mtf_1h_hma_rsi_zscore_4h_trend_atr_v1	train
250d2fc	mtf_1h_hma_rsi_zscore_4h_trend_atr_v1	ETHUSDT	-2.8088	-17.43	-4.68	-20.58	53.5	0.86	718	-0.7859	-0.2273	discard	exp#207 mtf_1h_hma_rsi_zscore_4h_trend_atr_v1	train
250d2fc	mtf_1h_hma_rsi_zscore_4h_trend_atr_v1	SOLUSDT	-1.4857	-8.75	-2.27	-17.12	55.5	0.97	605	-0.4084	-0.1327	discard	exp#207 mtf_1h_hma_rsi_zscore_4h_trend_atr_v1	train
250d2fc	mtf_1h_hma_rsi_zscore_4h_trend_atr_v1	BTCUSDT	-4.0346	-23.2	-6.39	-24.9	49.8	0.71	743	-1.1371	-0.2566	discard	exp#207 mtf_1h_hma_rsi_zscore_4h_trend_atr_v1	train
250d2fc	mtf_1h_hma_rsi_zscore_4h_trend_atr_v1	ETHUSDT	-2.8088	-17.43	-4.68	-20.58	53.5	0.86	718	-0.7859	-0.2273	discard	exp#207 mtf_1h_hma_rsi_zscore_4h_trend_atr_v1	train
250d2fc	mtf_1h_hma_rsi_zscore_4h_trend_atr_v1	SOLUSDT	-1.4857	-8.75	-2.27	-17.12	55.5	0.97	605	-0.4084	-0.1327	discard	exp#207 mtf_1h_hma_rsi_zscore_4h_trend_atr_v1	train
2c42be1	mtf_12h_donchian_daily_hma_rsi_simple_v1	BTCUSDT	-0.8135	-25.05	-6.96	-32.35	36.9	0.93	431	-0.9655	-0.2151	discard	exp#209 mtf_12h_donchian_daily_hma_rsi_simple_v1	train
2c42be1	mtf_12h_donchian_daily_hma_rsi_simple_v1	ETHUSDT	0.0894	21.94	5.08	-21.29	35.9	1.14	460	0.1139	0.2389	keep	exp#209 mtf_12h_donchian_daily_hma_rsi_simple_v1	train
2c42be1	mtf_12h_donchian_daily_hma_rsi_simple_v1	ETHUSDT	-1.5992	-24.87	-20.96	-28.16	34.9	0.78	152	-1.9621	-0.7445	discard	exp#209 mtf_12h_donchian_daily_hma_rsi_simple_v1	test
2c42be1	mtf_12h_donchian_daily_hma_rsi_simple_v1	SOLUSDT	0.807	151.57	26.05	-23.21	41.2	1.26	417	1.0133	1.1223	keep	exp#209 mtf_12h_donchian_daily_hma_rsi_simple_v1	train
2c42be1	mtf_12h_donchian_daily_hma_rsi_simple_v1	SOLUSDT	-0.0237	3.21	2.63	-22.37	39.2	1.09	143	-0.0299	0.1176	discard	exp#209 mtf_12h_donchian_daily_hma_rsi_simple_v1	test
2c42be1	mtf_12h_donchian_daily_hma_rsi_simple_v1	BTCUSDT	-0.8135	-25.05	-6.96	-32.35	36.9	0.93	431	-0.9655	-0.2151	discard	exp#209 mtf_12h_donchian_daily_hma_rsi_simple_v1	train
2c42be1	mtf_12h_donchian_daily_hma_rsi_simple_v1	ETHUSDT	0.0894	21.94	5.08	-21.29	35.9	1.14	460	0.1139	0.2389	discard	exp#209 mtf_12h_donchian_daily_hma_rsi_simple_v1	train
2c42be1	mtf_12h_donchian_daily_hma_rsi_simple_v1	SOLUSDT	0.807	151.57	26.05	-23.21	41.2	1.26	417	1.0133	1.1223	discard	exp#209 mtf_12h_donchian_daily_hma_rsi_simple_v1	train
d696fe2	mtf_1d_supertrend_weekly_hma_rsi_pullback_atr_v1	BTCUSDT	-4.3791	-5.06	-1.29	-5.06	33.3	0.26	12	-0.677	-0.2549	discard	exp#210 mtf_1d_supertrend_weekly_hma_rsi_pullback_atr_v1	train
d696fe2	mtf_1d_supertrend_weekly_hma_rsi_pullback_atr_v1	ETHUSDT	-2.6889	-1.72	-0.43	-4.13	45.5	0.78	11	-0.4285	-0.1049	discard	exp#210 mtf_1d_supertrend_weekly_hma_rsi_pullback_atr_v1	train
d696fe2	mtf_1d_supertrend_weekly_hma_rsi_pullback_atr_v1	SOLUSDT	-1.6456	6.94	1.7	-1.11	75.0	7.05	8	-0.5326	1.5239	discard	exp#210 mtf_1d_supertrend_weekly_hma_rsi_pullback_atr_v1	train
d696fe2	mtf_1d_supertrend_weekly_hma_rsi_pullback_atr_v1	BTCUSDT	-4.3791	-5.06	-1.29	-5.06	33.3	0.26	12	-0.677	-0.2549	discard	exp#210 mtf_1d_supertrend_weekly_hma_rsi_pullback_atr_v1	train
d696fe2	mtf_1d_supertrend_weekly_hma_rsi_pullback_atr_v1	ETHUSDT	-2.6889	-1.72	-0.43	-4.13	45.5	0.78	11	-0.4285	-0.1049	discard	exp#210 mtf_1d_supertrend_weekly_hma_rsi_pullback_atr_v1	train
d696fe2	mtf_1d_supertrend_weekly_hma_rsi_pullback_atr_v1	SOLUSDT	-1.6456	6.94	1.7	-1.11	75.0	7.05	8	-0.5326	1.5239	discard	exp#210 mtf_1d_supertrend_weekly_hma_rsi_pullback_atr_v1	train
3bc4c4d	mtf_15m_hma_4h_trend_1h_rsi_pullback_adx_atr_v1	BTCUSDT	-7.6232	-35.61	-10.43	-36.09	39.0	0.62	1694	-1.9288	-0.2889	discard	exp#211 mtf_15m_hma_4h_trend_1h_rsi_pullback_adx_atr_v1	train
3bc4c4d	mtf_15m_hma_4h_trend_1h_rsi_pullback_adx_atr_v1	ETHUSDT	-7.5964	-35.86	-10.52	-36.01	40.4	0.68	1712	-1.7008	-0.2921	discard	exp#211 mtf_15m_hma_4h_trend_1h_rsi_pullback_adx_atr_v1	train
3bc4c4d	mtf_15m_hma_4h_trend_1h_rsi_pullback_adx_atr_v1	SOLUSDT	-2.8469	-21.83	-5.99	-24.75	48.9	0.94	1552	-0.653	-0.2422	discard	exp#211 mtf_15m_hma_4h_trend_1h_rsi_pullback_adx_atr_v1	train
3bc4c4d	mtf_15m_hma_4h_trend_1h_rsi_pullback_adx_atr_v1	BTCUSDT	-7.6232	-35.61	-10.43	-36.09	39.0	0.62	1694	-1.9288	-0.2889	discard	exp#211 mtf_15m_hma_4h_trend_1h_rsi_pullback_adx_atr_v1	train
3bc4c4d	mtf_15m_hma_4h_trend_1h_rsi_pullback_adx_atr_v1	ETHUSDT	-7.5964	-35.86	-10.52	-36.01	40.4	0.68	1712	-1.7008	-0.2921	discard	exp#211 mtf_15m_hma_4h_trend_1h_rsi_pullback_adx_atr_v1	train
3bc4c4d	mtf_15m_hma_4h_trend_1h_rsi_pullback_adx_atr_v1	SOLUSDT	-2.8469	-21.83	-5.99	-24.75	48.9	0.94	1552	-0.653	-0.2422	discard	exp#211 mtf_15m_hma_4h_trend_1h_rsi_pullback_adx_atr_v1	train
95347c7	mtf_30m_crsi_4h_hma_adx_atr_v1	BTCUSDT	-5.3583	-33.9	-9.84	-35.88	52.1	0.81	1926	-1.5635	-0.2742	discard	exp#212 mtf_30m_crsi_4h_hma_adx_atr_v1	train
95347c7	mtf_30m_crsi_4h_hma_adx_atr_v1	ETHUSDT	-3.7498	-28.51	-8.05	-31.26	52.0	0.93	1994	-1.1756	-0.2576	discard	exp#212 mtf_30m_crsi_4h_hma_adx_atr_v1	train
95347c7	mtf_30m_crsi_4h_hma_adx_atr_v1	SOLUSDT	-1.3981	-14.39	-3.82	-19.64	56.4	1.06	2042	-0.4467	-0.1948	discard	exp#212 mtf_30m_crsi_4h_hma_adx_atr_v1	train
95347c7	mtf_30m_crsi_4h_hma_adx_atr_v1	BTCUSDT	-5.3583	-33.9	-9.84	-35.88	52.1	0.81	1926	-1.5635	-0.2742	discard	exp#212 mtf_30m_crsi_4h_hma_adx_atr_v1	train
95347c7	mtf_30m_crsi_4h_hma_adx_atr_v1	ETHUSDT	-3.7498	-28.51	-8.05	-31.26	52.0	0.93	1994	-1.1756	-0.2576	discard	exp#212 mtf_30m_crsi_4h_hma_adx_atr_v1	train
95347c7	mtf_30m_crsi_4h_hma_adx_atr_v1	SOLUSDT	-1.3981	-14.39	-3.82	-19.64	56.4	1.06	2042	-0.4467	-0.1948	discard	exp#212 mtf_30m_crsi_4h_hma_adx_atr_v1	train
67ee334	mtf_1h_kama_4h_1d_hma_rsi_pullback_atr_v1	BTCUSDT	-5.8156	-80.42	-33.5	-80.47	48.0	0.79	5611	-5.218	-0.4163	discard	exp#213 mtf_1h_kama_4h_1d_hma_rsi_pullback_atr_v1	train
67ee334	mtf_1h_kama_4h_1d_hma_rsi_pullback_atr_v1	ETHUSDT	-4.4208	-79.52	-32.74	-79.62	47.8	0.85	5567	-3.9335	-0.4112	discard	exp#213 mtf_1h_kama_4h_1d_hma_rsi_pullback_atr_v1	train
67ee334	mtf_1h_kama_4h_1d_hma_rsi_pullback_atr_v1	SOLUSDT	-2.2988	-72.14	-27.44	-77.66	48.8	0.97	5681	-2.1322	-0.3534	discard	exp#213 mtf_1h_kama_4h_1d_hma_rsi_pullback_atr_v1	train
67ee334	mtf_1h_kama_4h_1d_hma_rsi_pullback_atr_v1	BTCUSDT	-5.8156	-80.42	-33.5	-80.47	48.0	0.79	5611	-5.218	-0.4163	discard	exp#213 mtf_1h_kama_4h_1d_hma_rsi_pullback_atr_v1	train
67ee334	mtf_1h_kama_4h_1d_hma_rsi_pullback_atr_v1	ETHUSDT	-4.4208	-79.52	-32.74	-79.62	47.8	0.85	5567	-3.9335	-0.4112	discard	exp#213 mtf_1h_kama_4h_1d_hma_rsi_pullback_atr_v1	train
67ee334	mtf_1h_kama_4h_1d_hma_rsi_pullback_atr_v1	SOLUSDT	-2.2988	-72.14	-27.44	-77.66	48.8	0.97	5681	-2.1322	-0.3534	discard	exp#213 mtf_1h_kama_4h_1d_hma_rsi_pullback_atr_v1	train
8e3d236	mtf_4h_kama_daily_weekly_hma_rsi_pullback_atr_v1	BTCUSDT	-1.7084	-26.29	-7.35	-34.92	49.9	0.92	1287	-1.411	-0.2104	discard	exp#214 mtf_4h_kama_daily_weekly_hma_rsi_pullback_atr_v1	train
8e3d236	mtf_4h_kama_daily_weekly_hma_rsi_pullback_atr_v1	ETHUSDT	-2.1888	-44.32	-13.63	-44.83	49.4	0.84	1318	-1.7198	-0.304	discard	exp#214 mtf_4h_kama_daily_weekly_hma_rsi_pullback_atr_v1	train
8e3d236	mtf_4h_kama_daily_weekly_hma_rsi_pullback_atr_v1	SOLUSDT	-0.9395	-29.84	-8.51	-31.2	50.5	0.96	1352	-0.8019	-0.2728	discard	exp#214 mtf_4h_kama_daily_weekly_hma_rsi_pullback_atr_v1	train
8e3d236	mtf_4h_kama_daily_weekly_hma_rsi_pullback_atr_v1	BTCUSDT	-1.7084	-26.29	-7.35	-34.92	49.9	0.92	1287	-1.411	-0.2104	discard	exp#214 mtf_4h_kama_daily_weekly_hma_rsi_pullback_atr_v1	train
8e3d236	mtf_4h_kama_daily_weekly_hma_rsi_pullback_atr_v1	ETHUSDT	-2.1888	-44.32	-13.63	-44.83	49.4	0.84	1318	-1.7198	-0.304	discard	exp#214 mtf_4h_kama_daily_weekly_hma_rsi_pullback_atr_v1	train
8e3d236	mtf_4h_kama_daily_weekly_hma_rsi_pullback_atr_v1	SOLUSDT	-0.9395	-29.84	-8.51	-31.2	50.5	0.96	1352	-0.8019	-0.2728	discard	exp#214 mtf_4h_kama_daily_weekly_hma_rsi_pullback_atr_v1	train
ef71910	mtf_12h_ema_crossover_daily_weekly_hma_rsi_pullback_atr_v1	BTCUSDT	-2.1573	-6.52	-1.67	-9.33	42.7	0.82	157	-0.9009	-0.1793	discard	exp#215 mtf_12h_ema_crossover_daily_weekly_hma_rsi_pullback_atr_v1	train
ef71910	mtf_12h_ema_crossover_daily_weekly_hma_rsi_pullback_atr_v1	ETHUSDT	-2.9061	-16.05	-4.28	-17.13	41.5	0.55	147	-1.0375	-0.2499	discard	exp#215 mtf_12h_ema_crossover_daily_weekly_hma_rsi_pullback_atr_v1	train
ef71910	mtf_12h_ema_crossover_daily_weekly_hma_rsi_pullback_atr_v1	SOLUSDT	-1.584	-12.64	-3.34	-13.92	46.1	0.82	178	-0.7178	-0.2396	discard	exp#215 mtf_12h_ema_crossover_daily_weekly_hma_rsi_pullback_atr_v1	train
ef71910	mtf_12h_ema_crossover_daily_weekly_hma_rsi_pullback_atr_v1	BTCUSDT	-2.1573	-6.52	-1.67	-9.33	42.7	0.82	157	-0.9009	-0.1793	discard	exp#215 mtf_12h_ema_crossover_daily_weekly_hma_rsi_pullback_atr_v1	train
ef71910	mtf_12h_ema_crossover_daily_weekly_hma_rsi_pullback_atr_v1	ETHUSDT	-2.9061	-16.05	-4.28	-17.13	41.5	0.55	147	-1.0375	-0.2499	discard	exp#215 mtf_12h_ema_crossover_daily_weekly_hma_rsi_pullback_atr_v1	train
ef71910	mtf_12h_ema_crossover_daily_weekly_hma_rsi_pullback_atr_v1	SOLUSDT	-1.584	-12.64	-3.34	-13.92	46.1	0.82	178	-0.7178	-0.2396	discard	exp#215 mtf_12h_ema_crossover_daily_weekly_hma_rsi_pullback_atr_v1	train
c33e3a9	mtf_1d_donchian_weekly_hma_rsi_atr_v1	BTCUSDT	-1.6633	1.14	0.28	-4.78	44.0	1.14	75	-0.8032	0.0595	discard	exp#216 mtf_1d_donchian_weekly_hma_rsi_atr_v1	train
c33e3a9	mtf_1d_donchian_weekly_hma_rsi_atr_v1	ETHUSDT	-1.1532	-1.32	-0.33	-9.97	42.5	1.0	73	-0.5313	-0.0334	discard	exp#216 mtf_1d_donchian_weekly_hma_rsi_atr_v1	train
c33e3a9	mtf_1d_donchian_weekly_hma_rsi_atr_v1	SOLUSDT	-0.8155	-1.12	-0.28	-15.03	53.0	1.04	66	-0.3235	-0.0188	discard	exp#216 mtf_1d_donchian_weekly_hma_rsi_atr_v1	train
c33e3a9	mtf_1d_donchian_weekly_hma_rsi_atr_v1	BTCUSDT	-1.6633	1.14	0.28	-4.78	44.0	1.14	75	-0.8032	0.0595	discard	exp#216 mtf_1d_donchian_weekly_hma_rsi_atr_v1	train
c33e3a9	mtf_1d_donchian_weekly_hma_rsi_atr_v1	ETHUSDT	-1.1532	-1.32	-0.33	-9.97	42.5	1.0	73	-0.5313	-0.0334	discard	exp#216 mtf_1d_donchian_weekly_hma_rsi_atr_v1	train
c33e3a9	mtf_1d_donchian_weekly_hma_rsi_atr_v1	SOLUSDT	-0.8155	-1.12	-0.28	-15.03	53.0	1.04	66	-0.3235	-0.0188	discard	exp#216 mtf_1d_donchian_weekly_hma_rsi_atr_v1	train
cceee9d	mtf_15m_4h_hma_1h_rsi_volume_pullback_atr_v1	BTCUSDT	-14.6039	-85.79	-38.62	-85.8	35.8	0.62	7600	-6.9711	-0.4501	discard	exp#217 mtf_15m_4h_hma_1h_rsi_volume_pullback_atr_v1	train
cceee9d	mtf_15m_4h_hma_1h_rsi_volume_pullback_atr_v1	ETHUSDT	-11.3596	-85.24	-38.03	-85.26	36.1	0.7	7342	-5.2847	-0.4461	discard	exp#217 mtf_15m_4h_hma_1h_rsi_volume_pullback_atr_v1	train
cceee9d	mtf_15m_4h_hma_1h_rsi_volume_pullback_atr_v1	SOLUSDT	-6.2807	-80.13	-33.35	-80.28	39.8	0.86	7132	-2.8639	-0.4154	discard	exp#217 mtf_15m_4h_hma_1h_rsi_volume_pullback_atr_v1	train
cceee9d	mtf_15m_4h_hma_1h_rsi_volume_pullback_atr_v1	BTCUSDT	-14.6039	-85.79	-38.62	-85.8	35.8	0.62	7600	-6.9711	-0.4501	discard	exp#217 mtf_15m_4h_hma_1h_rsi_volume_pullback_atr_v1	train
cceee9d	mtf_15m_4h_hma_1h_rsi_volume_pullback_atr_v1	ETHUSDT	-11.3596	-85.24	-38.03	-85.26	36.1	0.7	7342	-5.2847	-0.4461	discard	exp#217 mtf_15m_4h_hma_1h_rsi_volume_pullback_atr_v1	train
cceee9d	mtf_15m_4h_hma_1h_rsi_volume_pullback_atr_v1	SOLUSDT	-6.2807	-80.13	-33.35	-80.28	39.8	0.86	7132	-2.8639	-0.4154	discard	exp#217 mtf_15m_4h_hma_1h_rsi_volume_pullback_atr_v1	train
00fbd7b	mtf_30m_supertrend_4h_hma_volume_rsi_atr_v1	BTCUSDT	0.0	0.0	0.0	0.0	0.0	0.0	0	0.0	0.0	discard	exp#218 mtf_30m_supertrend_4h_hma_volume_rsi_atr_v1	train
00fbd7b	mtf_30m_supertrend_4h_hma_volume_rsi_atr_v1	ETHUSDT	0.0	0.0	0.0	0.0	0.0	0.0	0	0.0	0.0	discard	exp#218 mtf_30m_supertrend_4h_hma_volume_rsi_atr_v1	train
00fbd7b	mtf_30m_supertrend_4h_hma_volume_rsi_atr_v1	SOLUSDT	0.0	0.0	0.0	0.0	0.0	0.0	0	0.0	0.0	discard	exp#218 mtf_30m_supertrend_4h_hma_volume_rsi_atr_v1	train
00fbd7b	mtf_30m_supertrend_4h_hma_volume_rsi_atr_v1	BTCUSDT	0.0	0.0	0.0	0.0	0.0	0.0	0	0.0	0.0	discard	exp#218 mtf_30m_supertrend_4h_hma_volume_rsi_atr_v1	train
00fbd7b	mtf_30m_supertrend_4h_hma_volume_rsi_atr_v1	ETHUSDT	0.0	0.0	0.0	0.0	0.0	0.0	0	0.0	0.0	discard	exp#218 mtf_30m_supertrend_4h_hma_volume_rsi_atr_v1	train
00fbd7b	mtf_30m_supertrend_4h_hma_volume_rsi_atr_v1	SOLUSDT	0.0	0.0	0.0	0.0	0.0	0.0	0	0.0	0.0	discard	exp#218 mtf_30m_supertrend_4h_hma_volume_rsi_atr_v1	train
e98c6ac	mtf_1h_roc_momentum_4h_hma_atr_v1	BTCUSDT	-2.8863	-54.79	-18.01	-56.16	39.8	0.86	2527	-2.0251	-0.3208	discard	exp#219 mtf_1h_roc_momentum_4h_hma_atr_v1	train
e98c6ac	mtf_1h_roc_momentum_4h_hma_atr_v1	ETHUSDT	-1.688	-47.67	-14.96	-49.72	40.6	0.96	3235	-1.3879	-0.3008	discard	exp#219 mtf_1h_roc_momentum_4h_hma_atr_v1	train
e98c6ac	mtf_1h_roc_momentum_4h_hma_atr_v1	SOLUSDT	-0.6341	-35.98	-10.59	-49.59	41.4	1.02	4567	-0.6301	-0.2136	discard	exp#219 mtf_1h_roc_momentum_4h_hma_atr_v1	train
e98c6ac	mtf_1h_roc_momentum_4h_hma_atr_v1	BTCUSDT	-2.8863	-54.79	-18.01	-56.16	39.8	0.86	2527	-2.0251	-0.3208	discard	exp#219 mtf_1h_roc_momentum_4h_hma_atr_v1	train
e98c6ac	mtf_1h_roc_momentum_4h_hma_atr_v1	ETHUSDT	-1.688	-47.67	-14.96	-49.72	40.6	0.96	3235	-1.3879	-0.3008	discard	exp#219 mtf_1h_roc_momentum_4h_hma_atr_v1	train
e98c6ac	mtf_1h_roc_momentum_4h_hma_atr_v1	SOLUSDT	-0.6341	-35.98	-10.59	-49.59	41.4	1.02	4567	-0.6301	-0.2136	discard	exp#219 mtf_1h_roc_momentum_4h_hma_atr_v1	train
5306619	mtf_4h_kama_daily_hma_rsi_timing_atr_v1	BTCUSDT	-1.6972	-32.61	-9.4	-36.55	36.1	0.92	1201	-1.3668	-0.2572	discard	exp#220 mtf_4h_kama_daily_hma_rsi_timing_atr_v1	train
5306619	mtf_4h_kama_daily_hma_rsi_timing_atr_v1	ETHUSDT	-2.0723	-49.81	-15.84	-50.4	33.8	0.83	1214	-1.677	-0.3143	discard	exp#220 mtf_4h_kama_daily_hma_rsi_timing_atr_v1	train
5306619	mtf_4h_kama_daily_hma_rsi_timing_atr_v1	SOLUSDT	-0.688	-25.25	-7.05	-33.47	39.1	0.99	1216	-0.5773	-0.2105	discard	exp#220 mtf_4h_kama_daily_hma_rsi_timing_atr_v1	train
5306619	mtf_4h_kama_daily_hma_rsi_timing_atr_v1	BTCUSDT	-1.6972	-32.61	-9.4	-36.55	36.1	0.92	1201	-1.3668	-0.2572	discard	exp#220 mtf_4h_kama_daily_hma_rsi_timing_atr_v1	train
5306619	mtf_4h_kama_daily_hma_rsi_timing_atr_v1	ETHUSDT	-2.0723	-49.81	-15.84	-50.4	33.8	0.83	1214	-1.677	-0.3143	discard	exp#220 mtf_4h_kama_daily_hma_rsi_timing_atr_v1	train
5306619	mtf_4h_kama_daily_hma_rsi_timing_atr_v1	SOLUSDT	-0.688	-25.25	-7.05	-33.47	39.1	0.99	1216	-0.5773	-0.2105	discard	exp#220 mtf_4h_kama_daily_hma_rsi_timing_atr_v1	train
470e2b8	mtf_12h_fisher_chop_regime_daily_hma_atr_v1	BTCUSDT	-0.7572	1.86	0.46	-9.77	48.6	1.11	481	-0.6134	0.0473	discard	exp#221 mtf_12h_fisher_chop_regime_daily_hma_atr_v1	train
470e2b8	mtf_12h_fisher_chop_regime_daily_hma_atr_v1	ETHUSDT	-0.9882	-10.9	-2.85	-19.15	46.1	0.97	482	-0.7655	-0.1486	discard	exp#221 mtf_12h_fisher_chop_regime_daily_hma_atr_v1	train
470e2b8	mtf_12h_fisher_chop_regime_daily_hma_atr_v1	SOLUSDT	-0.4615	-6.86	-1.77	-18.1	49.3	1.02	501	-0.3321	-0.0977	discard	exp#221 mtf_12h_fisher_chop_regime_daily_hma_atr_v1	train
470e2b8	mtf_12h_fisher_chop_regime_daily_hma_atr_v1	BTCUSDT	-0.7572	1.86	0.46	-9.77	48.6	1.11	481	-0.6134	0.0473	discard	exp#221 mtf_12h_fisher_chop_regime_daily_hma_atr_v1	train
470e2b8	mtf_12h_fisher_chop_regime_daily_hma_atr_v1	ETHUSDT	-0.9882	-10.9	-2.85	-19.15	46.1	0.97	482	-0.7655	-0.1486	discard	exp#221 mtf_12h_fisher_chop_regime_daily_hma_atr_v1	train
470e2b8	mtf_12h_fisher_chop_regime_daily_hma_atr_v1	SOLUSDT	-0.4615	-6.86	-1.77	-18.1	49.3	1.02	501	-0.3321	-0.0977	discard	exp#221 mtf_12h_fisher_chop_regime_daily_hma_atr_v1	train
61257d2	mtf_1d_dual_momentum_weekly_hma_atr_v1	BTCUSDT	-0.0631	17.76	4.17	-11.29	36.8	2.05	87	-0.0619	0.3695	discard	exp#222 mtf_1d_dual_momentum_weekly_hma_atr_v1	train
61257d2	mtf_1d_dual_momentum_weekly_hma_atr_v1	ETHUSDT	-0.2297	9.0	2.18	-22.28	38.7	1.46	75	-0.2164	0.0978	discard	exp#222 mtf_1d_dual_momentum_weekly_hma_atr_v1	train
61257d2	mtf_1d_dual_momentum_weekly_hma_atr_v1	SOLUSDT	0.7709	94.0	18.09	-12.19	40.0	2.79	70	0.8083	1.483	keep	exp#222 mtf_1d_dual_momentum_weekly_hma_atr_v1	train
61257d2	mtf_1d_dual_momentum_weekly_hma_atr_v1	SOLUSDT	-0.8272	-2.75	-2.27	-8.49	38.5	0.62	13	-0.6244	-0.2676	discard	exp#222 mtf_1d_dual_momentum_weekly_hma_atr_v1	test
61257d2	mtf_1d_dual_momentum_weekly_hma_atr_v1	BTCUSDT	-0.0631	17.76	4.17	-11.29	36.8	2.05	87	-0.0619	0.3695	discard	exp#222 mtf_1d_dual_momentum_weekly_hma_atr_v1	train
61257d2	mtf_1d_dual_momentum_weekly_hma_atr_v1	ETHUSDT	-0.2297	9.0	2.18	-22.28	38.7	1.46	75	-0.2164	0.0978	discard	exp#222 mtf_1d_dual_momentum_weekly_hma_atr_v1	train
61257d2	mtf_1d_dual_momentum_weekly_hma_atr_v1	SOLUSDT	0.7709	94.0	18.09	-12.19	40.0	2.79	70	0.8083	1.483	discard	exp#222 mtf_1d_dual_momentum_weekly_hma_atr_v1	train
1451449	mtf_15m_crsi_4h_hma_chop_regime_atr_v1	BTCUSDT	-11.2233	-75.39	-29.59	-75.72	52.9	0.66	6484	-4.3735	-0.3907	discard	exp#223 mtf_15m_crsi_4h_hma_chop_regime_atr_v1	train
1451449	mtf_15m_crsi_4h_hma_chop_regime_atr_v1	ETHUSDT	-9.5816	-78.33	-31.79	-78.33	54.8	0.67	6311	-3.6292	-0.4059	discard	exp#223 mtf_15m_crsi_4h_hma_chop_regime_atr_v1	train
1451449	mtf_15m_crsi_4h_hma_chop_regime_atr_v1	SOLUSDT	-6.8783	-82.36	-35.31	-82.95	57.3	0.72	6752	-2.7982	-0.4257	discard	exp#223 mtf_15m_crsi_4h_hma_chop_regime_atr_v1	train
1451449	mtf_15m_crsi_4h_hma_chop_regime_atr_v1	BTCUSDT	-11.2233	-75.39	-29.59	-75.72	52.9	0.66	6484	-4.3735	-0.3907	discard	exp#223 mtf_15m_crsi_4h_hma_chop_regime_atr_v1	train
1451449	mtf_15m_crsi_4h_hma_chop_regime_atr_v1	ETHUSDT	-9.5816	-78.33	-31.79	-78.33	54.8	0.67	6311	-3.6292	-0.4059	discard	exp#223 mtf_15m_crsi_4h_hma_chop_regime_atr_v1	train
1451449	mtf_15m_crsi_4h_hma_chop_regime_atr_v1	SOLUSDT	-6.8783	-82.36	-35.31	-82.95	57.3	0.72	6752	-2.7982	-0.4257	discard	exp#223 mtf_15m_crsi_4h_hma_chop_regime_atr_v1	train
632f949	mtf_30m_donchian_4h_hma_rsi_atr_v1	BTCUSDT	-9.3756	-79.24	-32.51	-79.31	36.9	0.69	5622	-5.2964	-0.4099	discard	exp#224 mtf_30m_donchian_4h_hma_rsi_atr_v1	train
632f949	mtf_30m_donchian_4h_hma_rsi_atr_v1	ETHUSDT	-6.7861	-76.06	-30.06	-76.07	38.9	0.81	5661	-3.8502	-0.3952	discard	exp#224 mtf_30m_donchian_4h_hma_rsi_atr_v1	train
632f949	mtf_30m_donchian_4h_hma_rsi_atr_v1	SOLUSDT	-4.4823	-76.98	-30.84	-77.57	42.6	0.88	5803	-2.7314	-0.3975	discard	exp#224 mtf_30m_donchian_4h_hma_rsi_atr_v1	train
632f949	mtf_30m_donchian_4h_hma_rsi_atr_v1	BTCUSDT	-9.3756	-79.24	-32.51	-79.31	36.9	0.69	5622	-5.2964	-0.4099	discard	exp#224 mtf_30m_donchian_4h_hma_rsi_atr_v1	train
632f949	mtf_30m_donchian_4h_hma_rsi_atr_v1	ETHUSDT	-6.7861	-76.06	-30.06	-76.07	38.9	0.81	5661	-3.8502	-0.3952	discard	exp#224 mtf_30m_donchian_4h_hma_rsi_atr_v1	train
632f949	mtf_30m_donchian_4h_hma_rsi_atr_v1	SOLUSDT	-4.4823	-76.98	-30.84	-77.57	42.6	0.88	5803	-2.7314	-0.3975	discard	exp#224 mtf_30m_donchian_4h_hma_rsi_atr_v1	train
76da2af	mtf_1h_ensemble_rsi_macd_vol_4h_12h_hma_atr_v1	BTCUSDT	-4.1426	-76.18	-30.15	-76.32	38.3	0.84	5291	-4.0479	-0.3951	discard	exp#225 mtf_1h_ensemble_rsi_macd_vol_4h_12h_hma_atr_v1	train
76da2af	mtf_1h_ensemble_rsi_macd_vol_4h_12h_hma_atr_v1	ETHUSDT	-3.0799	-73.59	-28.33	-73.66	38.9	0.9	5362	-3.0765	-0.3846	discard	exp#225 mtf_1h_ensemble_rsi_macd_vol_4h_12h_hma_atr_v1	train
76da2af	mtf_1h_ensemble_rsi_macd_vol_4h_12h_hma_atr_v1	SOLUSDT	-1.552	-66.99	-24.29	-68.37	41.2	0.98	5534	-1.4875	-0.3553	discard	exp#225 mtf_1h_ensemble_rsi_macd_vol_4h_12h_hma_atr_v1	train
76da2af	mtf_1h_ensemble_rsi_macd_vol_4h_12h_hma_atr_v1	BTCUSDT	-4.1426	-76.18	-30.15	-76.32	38.3	0.84	5291	-4.0479	-0.3951	discard	exp#225 mtf_1h_ensemble_rsi_macd_vol_4h_12h_hma_atr_v1	train
76da2af	mtf_1h_ensemble_rsi_macd_vol_4h_12h_hma_atr_v1	ETHUSDT	-3.0799	-73.59	-28.33	-73.66	38.9	0.9	5362	-3.0765	-0.3846	discard	exp#225 mtf_1h_ensemble_rsi_macd_vol_4h_12h_hma_atr_v1	train
76da2af	mtf_1h_ensemble_rsi_macd_vol_4h_12h_hma_atr_v1	SOLUSDT	-1.552	-66.99	-24.29	-68.37	41.2	0.98	5534	-1.4875	-0.3553	discard	exp#225 mtf_1h_ensemble_rsi_macd_vol_4h_12h_hma_atr_v1	train
63ae70b	mtf_4h_adx_regime_daily_weekly_hma_rsi_atr_v1	BTCUSDT	-2.902	-10.18	-2.65	-11.65	49.3	0.79	282	-0.9704	-0.2275	discard	exp#226 mtf_4h_adx_regime_daily_weekly_hma_rsi_atr_v1	train
63ae70b	mtf_4h_adx_regime_daily_weekly_hma_rsi_atr_v1	ETHUSDT	-2.5143	-11.52	-3.02	-14.25	53.3	0.79	270	-0.7372	-0.2115	discard	exp#226 mtf_4h_adx_regime_daily_weekly_hma_rsi_atr_v1	train
63ae70b	mtf_4h_adx_regime_daily_weekly_hma_rsi_atr_v1	SOLUSDT	-0.5991	5.1	1.26	-7.95	49.8	1.16	285	-0.2519	0.158	discard	exp#226 mtf_4h_adx_regime_daily_weekly_hma_rsi_atr_v1	train
63ae70b	mtf_4h_adx_regime_daily_weekly_hma_rsi_atr_v1	BTCUSDT	-2.902	-10.18	-2.65	-11.65	49.3	0.79	282	-0.9704	-0.2275	discard	exp#226 mtf_4h_adx_regime_daily_weekly_hma_rsi_atr_v1	train
63ae70b	mtf_4h_adx_regime_daily_weekly_hma_rsi_atr_v1	ETHUSDT	-2.5143	-11.52	-3.02	-14.25	53.3	0.79	270	-0.7372	-0.2115	discard	exp#226 mtf_4h_adx_regime_daily_weekly_hma_rsi_atr_v1	train
63ae70b	mtf_4h_adx_regime_daily_weekly_hma_rsi_atr_v1	SOLUSDT	-0.5991	5.1	1.26	-7.95	49.8	1.16	285	-0.2519	0.158	discard	exp#226 mtf_4h_adx_regime_daily_weekly_hma_rsi_atr_v1	train
2436fdd	mtf_12h_kama_daily_hma_rsi_atr_v1	BTCUSDT	-0.9094	-7.97	-2.06	-18.95	44.2	1.0	480	-0.7917	-0.1085	discard	exp#227 mtf_12h_kama_daily_hma_rsi_atr_v1	train
2436fdd	mtf_12h_kama_daily_hma_rsi_atr_v1	ETHUSDT	-0.852	-7.13	-1.83	-13.09	43.9	1.01	449	-0.6624	-0.14	discard	exp#227 mtf_12h_kama_daily_hma_rsi_atr_v1	train
2436fdd	mtf_12h_kama_daily_hma_rsi_atr_v1	SOLUSDT	-0.3424	4.64	1.14	-14.44	49.2	1.11	368	-0.2447	0.0792	discard	exp#227 mtf_12h_kama_daily_hma_rsi_atr_v1	train
2436fdd	mtf_12h_kama_daily_hma_rsi_atr_v1	BTCUSDT	-0.9094	-7.97	-2.06	-18.95	44.2	1.0	480	-0.7917	-0.1085	discard	exp#227 mtf_12h_kama_daily_hma_rsi_atr_v1	train
2436fdd	mtf_12h_kama_daily_hma_rsi_atr_v1	ETHUSDT	-0.852	-7.13	-1.83	-13.09	43.9	1.01	449	-0.6624	-0.14	discard	exp#227 mtf_12h_kama_daily_hma_rsi_atr_v1	train
