commit	strategy	symbol	sharpe	return_pct	cagr_pct	max_dd_pct	win_rate	profit_factor	trades	sortino	calmar	status	description	period
2fc3f15	mtf_1d_donchian_weekly_hma_rsi_filter_atr_v2	ETHUSDT	-0.0869	1.61	1.33	-18.59	29.3	1.53	58	-0.1235	0.0713	discard	exp#312 mtf_1d_donchian_weekly_hma_rsi_filter_atr_v2	test
2fc3f15	mtf_1d_donchian_weekly_hma_rsi_filter_atr_v2	SOLUSDT	0.6518	123.75	22.39	-25.46	31.8	2.41	151	0.9007	0.8793	keep	exp#312 mtf_1d_donchian_weekly_hma_rsi_filter_atr_v2	train
2fc3f15	mtf_1d_donchian_weekly_hma_rsi_filter_atr_v2	SOLUSDT	0.3017	11.91	9.7	-15.35	43.4	1.97	53	0.4036	0.6318	keep	exp#312 mtf_1d_donchian_weekly_hma_rsi_filter_atr_v2	test
2fc3f15	mtf_1d_donchian_weekly_hma_rsi_filter_atr_v2	BTCUSDT	-0.2225	1.08	0.27	-20.26	34.6	1.51	162	-0.2849	0.0132	discard	exp#312 mtf_1d_donchian_weekly_hma_rsi_filter_atr_v2	train
2fc3f15	mtf_1d_donchian_weekly_hma_rsi_filter_atr_v2	ETHUSDT	0.1179	23.8	5.48	-21.68	38.4	1.78	151	0.1552	0.253	keep	exp#312 mtf_1d_donchian_weekly_hma_rsi_filter_atr_v2	train
2fc3f15	mtf_1d_donchian_weekly_hma_rsi_filter_atr_v2	SOLUSDT	0.6518	123.75	22.39	-25.46	31.8	2.41	151	0.9007	0.8793	keep	exp#312 mtf_1d_donchian_weekly_hma_rsi_filter_atr_v2	train
2fc3f15	mtf_1d_donchian_weekly_hma_rsi_filter_atr_v2	ETHUSDT	-0.0869	1.61	1.33	-18.59	29.3	1.53	58	-0.1235	0.0713	discard	exp#312 mtf_1d_donchian_weekly_hma_rsi_filter_atr_v2	test
2fc3f15	mtf_1d_donchian_weekly_hma_rsi_filter_atr_v2	SOLUSDT	0.3017	11.91	9.7	-15.35	43.4	1.97	53	0.4036	0.6318	keep	exp#312 mtf_1d_donchian_weekly_hma_rsi_filter_atr_v2	test
b445882	mtf_15m_regime_chop_4h_hma_rsi_adaptive_atr_v1	BTCUSDT	-6.5266	-92.93	-48.46	-93.23	31.6	1.11	14389	-7.0702	-0.5198	discard	exp#313 mtf_15m_regime_chop_4h_hma_rsi_adaptive_atr_v1	train
b445882	mtf_15m_regime_chop_4h_hma_rsi_adaptive_atr_v1	ETHUSDT	-5.0826	-92.56	-47.8	-92.64	32.9	1.2	14434	-5.4777	-0.516	discard	exp#313 mtf_15m_regime_chop_4h_hma_rsi_adaptive_atr_v1	train
b445882	mtf_15m_regime_chop_4h_hma_rsi_adaptive_atr_v1	SOLUSDT	-2.8529	-90.37	-44.42	-93.33	36.7	1.33	14025	-2.9901	-0.476	discard	exp#313 mtf_15m_regime_chop_4h_hma_rsi_adaptive_atr_v1	train
b445882	mtf_15m_regime_chop_4h_hma_rsi_adaptive_atr_v1	BTCUSDT	-6.5266	-92.93	-48.46	-93.23	31.6	1.11	14389	-7.0702	-0.5198	discard	exp#313 mtf_15m_regime_chop_4h_hma_rsi_adaptive_atr_v1	train
b445882	mtf_15m_regime_chop_4h_hma_rsi_adaptive_atr_v1	ETHUSDT	-5.0826	-92.56	-47.8	-92.64	32.9	1.2	14434	-5.4777	-0.516	discard	exp#313 mtf_15m_regime_chop_4h_hma_rsi_adaptive_atr_v1	train
b445882	mtf_15m_regime_chop_4h_hma_rsi_adaptive_atr_v1	SOLUSDT	-2.8529	-90.37	-44.42	-93.33	36.7	1.33	14025	-2.9901	-0.476	discard	exp#313 mtf_15m_regime_chop_4h_hma_rsi_adaptive_atr_v1	train
d552a45	mtf_30m_kama_4h_hma_rsi_pullback_adx_atr_v1	BTCUSDT	-10.7135	-97.72	-61.18	-97.74	44.7	0.77	10888	-9.3832	-0.626	discard	exp#314 mtf_30m_kama_4h_hma_rsi_pullback_adx_atr_v1	train
d552a45	mtf_30m_kama_4h_hma_rsi_pullback_adx_atr_v1	ETHUSDT	-8.5912	-97.91	-61.99	-98.04	45.0	0.82	11106	-7.5407	-0.6322	discard	exp#314 mtf_30m_kama_4h_hma_rsi_pullback_adx_atr_v1	train
d552a45	mtf_30m_kama_4h_hma_rsi_pullback_adx_atr_v1	SOLUSDT	-4.3595	-95.75	-54.73	-96.07	48.0	0.94	11005	-3.8559	-0.5697	discard	exp#314 mtf_30m_kama_4h_hma_rsi_pullback_adx_atr_v1	train
d552a45	mtf_30m_kama_4h_hma_rsi_pullback_adx_atr_v1	BTCUSDT	-10.7135	-97.72	-61.18	-97.74	44.7	0.77	10888	-9.3832	-0.626	discard	exp#314 mtf_30m_kama_4h_hma_rsi_pullback_adx_atr_v1	train
d552a45	mtf_30m_kama_4h_hma_rsi_pullback_adx_atr_v1	ETHUSDT	-8.5912	-97.91	-61.99	-98.04	45.0	0.82	11106	-7.5407	-0.6322	discard	exp#314 mtf_30m_kama_4h_hma_rsi_pullback_adx_atr_v1	train
d552a45	mtf_30m_kama_4h_hma_rsi_pullback_adx_atr_v1	SOLUSDT	-4.3595	-95.75	-54.73	-96.07	48.0	0.94	11005	-3.8559	-0.5697	discard	exp#314 mtf_30m_kama_4h_hma_rsi_pullback_adx_atr_v1	train
b44c1fe	mtf_1h_kama_4h_hma_rsi_pullback_atr_v1	BTCUSDT	-1.329	-50.5	-16.13	-52.39	25.3	1.29	2782	-1.6361	-0.3079	discard	exp#315 mtf_1h_kama_4h_hma_rsi_pullback_atr_v1	train
b44c1fe	mtf_1h_kama_4h_hma_rsi_pullback_atr_v1	ETHUSDT	-0.4548	-21.78	-5.96	-36.37	28.3	1.44	2676	-0.5505	-0.1639	discard	exp#315 mtf_1h_kama_4h_hma_rsi_pullback_atr_v1	train
b44c1fe	mtf_1h_kama_4h_hma_rsi_pullback_atr_v1	SOLUSDT	0.2154	30.95	7.0	-35.52	29.1	1.58	2697	0.2522	0.1972	keep	exp#315 mtf_1h_kama_4h_hma_rsi_pullback_atr_v1	train
b44c1fe	mtf_1h_kama_4h_hma_rsi_pullback_atr_v1	SOLUSDT	-0.4864	-8.88	-7.36	-31.0	31.0	1.36	800	-0.5966	-0.2374	discard	exp#315 mtf_1h_kama_4h_hma_rsi_pullback_atr_v1	test
b44c1fe	mtf_1h_kama_4h_hma_rsi_pullback_atr_v1	BTCUSDT	-1.329	-50.5	-16.13	-52.39	25.3	1.29	2782	-1.6361	-0.3079	discard	exp#315 mtf_1h_kama_4h_hma_rsi_pullback_atr_v1	train
b44c1fe	mtf_1h_kama_4h_hma_rsi_pullback_atr_v1	ETHUSDT	-0.4548	-21.78	-5.96	-36.37	28.3	1.44	2676	-0.5505	-0.1639	discard	exp#315 mtf_1h_kama_4h_hma_rsi_pullback_atr_v1	train
b44c1fe	mtf_1h_kama_4h_hma_rsi_pullback_atr_v1	SOLUSDT	0.2154	30.95	7.0	-35.52	29.1	1.58	2697	0.2522	0.1972	discard	exp#315 mtf_1h_kama_4h_hma_rsi_pullback_atr_v1	train
f191e03	mtf_4h_supertrend_daily_hma_rsi_pullback_atr_v3	BTCUSDT	0.0	0.0	0.0	0.0	0.0	0.0	0	0.0	0.0	discard	exp#316 mtf_4h_supertrend_daily_hma_rsi_pullback_atr_v3	train
f191e03	mtf_4h_supertrend_daily_hma_rsi_pullback_atr_v3	ETHUSDT	0.0	0.0	0.0	0.0	0.0	0.0	0	0.0	0.0	discard	exp#316 mtf_4h_supertrend_daily_hma_rsi_pullback_atr_v3	train
f191e03	mtf_4h_supertrend_daily_hma_rsi_pullback_atr_v3	SOLUSDT	0.0	0.0	0.0	0.0	0.0	0.0	0	0.0	0.0	discard	exp#316 mtf_4h_supertrend_daily_hma_rsi_pullback_atr_v3	train
f191e03	mtf_4h_supertrend_daily_hma_rsi_pullback_atr_v3	BTCUSDT	0.0	0.0	0.0	0.0	0.0	0.0	0	0.0	0.0	discard	exp#316 mtf_4h_supertrend_daily_hma_rsi_pullback_atr_v3	train
f191e03	mtf_4h_supertrend_daily_hma_rsi_pullback_atr_v3	ETHUSDT	0.0	0.0	0.0	0.0	0.0	0.0	0	0.0	0.0	discard	exp#316 mtf_4h_supertrend_daily_hma_rsi_pullback_atr_v3	train
f191e03	mtf_4h_supertrend_daily_hma_rsi_pullback_atr_v3	SOLUSDT	0.0	0.0	0.0	0.0	0.0	0.0	0	0.0	0.0	discard	exp#316 mtf_4h_supertrend_daily_hma_rsi_pullback_atr_v3	train
7c0494e	mtf_15m_4h_hma_1h_rsi_pullback_multi_entry_atr_v1	BTCUSDT	-5.2835	-94.49	-51.58	-94.78	34.1	0.9	9809	-5.9091	-0.5442	discard	exp#319 mtf_15m_4h_hma_1h_rsi_pullback_multi_entry_atr_v1	train
7c0494e	mtf_15m_4h_hma_1h_rsi_pullback_multi_entry_atr_v1	ETHUSDT	-3.2832	-89.41	-42.98	-89.53	35.6	0.97	9933	-3.7064	-0.48	discard	exp#319 mtf_15m_4h_hma_1h_rsi_pullback_multi_entry_atr_v1	train
7c0494e	mtf_15m_4h_hma_1h_rsi_pullback_multi_entry_atr_v1	SOLUSDT	-1.2306	-76.21	-30.26	-78.34	37.9	1.04	10023	-1.408	-0.3863	discard	exp#319 mtf_15m_4h_hma_1h_rsi_pullback_multi_entry_atr_v1	train
7c0494e	mtf_15m_4h_hma_1h_rsi_pullback_multi_entry_atr_v1	BTCUSDT	-5.2835	-94.49	-51.58	-94.78	34.1	0.9	9809	-5.9091	-0.5442	discard	exp#319 mtf_15m_4h_hma_1h_rsi_pullback_multi_entry_atr_v1	train
7c0494e	mtf_15m_4h_hma_1h_rsi_pullback_multi_entry_atr_v1	ETHUSDT	-3.2832	-89.41	-42.98	-89.53	35.6	0.97	9933	-3.7064	-0.48	discard	exp#319 mtf_15m_4h_hma_1h_rsi_pullback_multi_entry_atr_v1	train
7c0494e	mtf_15m_4h_hma_1h_rsi_pullback_multi_entry_atr_v1	SOLUSDT	-1.2306	-76.21	-30.26	-78.34	37.9	1.04	10023	-1.408	-0.3863	discard	exp#319 mtf_15m_4h_hma_1h_rsi_pullback_multi_entry_atr_v1	train
50407b0	mtf_30m_ema_crossover_4h_hma_rsi_momentum_atr_v1	BTCUSDT	-2.8045	-78.22	-31.7	-80.15	27.9	1.16	5856	-3.3236	-0.3955	discard	exp#320 mtf_30m_ema_crossover_4h_hma_rsi_momentum_atr_v1	train
50407b0	mtf_30m_ema_crossover_4h_hma_rsi_momentum_atr_v1	ETHUSDT	-2.1644	-78.01	-31.54	-78.16	29.8	1.19	5703	-2.5034	-0.4036	discard	exp#320 mtf_30m_ema_crossover_4h_hma_rsi_momentum_atr_v1	train
50407b0	mtf_30m_ema_crossover_4h_hma_rsi_momentum_atr_v1	SOLUSDT	-0.8742	-64.75	-23.03	-74.88	32.1	1.34	5779	-1.0286	-0.3076	discard	exp#320 mtf_30m_ema_crossover_4h_hma_rsi_momentum_atr_v1	train
50407b0	mtf_30m_ema_crossover_4h_hma_rsi_momentum_atr_v1	BTCUSDT	-2.8045	-78.22	-31.7	-80.15	27.9	1.16	5856	-3.3236	-0.3955	discard	exp#320 mtf_30m_ema_crossover_4h_hma_rsi_momentum_atr_v1	train
50407b0	mtf_30m_ema_crossover_4h_hma_rsi_momentum_atr_v1	ETHUSDT	-2.1644	-78.01	-31.54	-78.16	29.8	1.19	5703	-2.5034	-0.4036	discard	exp#320 mtf_30m_ema_crossover_4h_hma_rsi_momentum_atr_v1	train
50407b0	mtf_30m_ema_crossover_4h_hma_rsi_momentum_atr_v1	SOLUSDT	-0.8742	-64.75	-23.03	-74.88	32.1	1.34	5779	-1.0286	-0.3076	discard	exp#320 mtf_30m_ema_crossover_4h_hma_rsi_momentum_atr_v1	train
10c6008	mtf_1h_fisher_4h_hma_chop_regime_atr_v1	BTCUSDT	-6.1897	-89.97	-43.75	-90.08	34.4	0.83	7538	-5.9104	-0.4857	discard	exp#321 mtf_1h_fisher_4h_hma_chop_regime_atr_v1	train
10c6008	mtf_1h_fisher_4h_hma_chop_regime_atr_v1	ETHUSDT	-4.2731	-85.5	-38.31	-87.14	34.7	0.95	7393	-4.256	-0.4396	discard	exp#321 mtf_1h_fisher_4h_hma_chop_regime_atr_v1	train
10c6008	mtf_1h_fisher_4h_hma_chop_regime_atr_v1	SOLUSDT	-2.2963	-80.92	-34.02	-86.63	37.2	0.99	7509	-2.2352	-0.3927	discard	exp#321 mtf_1h_fisher_4h_hma_chop_regime_atr_v1	train
10c6008	mtf_1h_fisher_4h_hma_chop_regime_atr_v1	BTCUSDT	-6.1897	-89.97	-43.75	-90.08	34.4	0.83	7538	-5.9104	-0.4857	discard	exp#321 mtf_1h_fisher_4h_hma_chop_regime_atr_v1	train
10c6008	mtf_1h_fisher_4h_hma_chop_regime_atr_v1	ETHUSDT	-4.2731	-85.5	-38.31	-87.14	34.7	0.95	7393	-4.256	-0.4396	discard	exp#321 mtf_1h_fisher_4h_hma_chop_regime_atr_v1	train
10c6008	mtf_1h_fisher_4h_hma_chop_regime_atr_v1	SOLUSDT	-2.2963	-80.92	-34.02	-86.63	37.2	0.99	7509	-2.2352	-0.3927	discard	exp#321 mtf_1h_fisher_4h_hma_chop_regime_atr_v1	train
43f00c7	mtf_4h_regime_chop_daily_hma_crsi_trend_switch_atr_v1	BTCUSDT	-0.7277	-11.59	-3.03	-28.26	45.7	1.09	728	-0.5982	-0.1074	discard	exp#322 mtf_4h_regime_chop_daily_hma_crsi_trend_switch_atr_v1	train
43f00c7	mtf_4h_regime_chop_daily_hma_crsi_trend_switch_atr_v1	ETHUSDT	-0.1256	9.4	2.27	-22.84	48.1	1.22	778	-0.1051	0.0994	discard	exp#322 mtf_4h_regime_chop_daily_hma_crsi_trend_switch_atr_v1	train
43f00c7	mtf_4h_regime_chop_daily_hma_crsi_trend_switch_atr_v1	SOLUSDT	0.145	25.65	5.9	-31.5	48.3	1.17	766	0.1181	0.1872	keep	exp#322 mtf_4h_regime_chop_daily_hma_crsi_trend_switch_atr_v1	train
43f00c7	mtf_4h_regime_chop_daily_hma_crsi_trend_switch_atr_v1	SOLUSDT	0.4381	13.62	11.08	-11.19	50.0	1.28	246	0.4191	0.99	keep	exp#322 mtf_4h_regime_chop_daily_hma_crsi_trend_switch_atr_v1	test
43f00c7	mtf_4h_regime_chop_daily_hma_crsi_trend_switch_atr_v1	BTCUSDT	-0.7277	-11.59	-3.03	-28.26	45.7	1.09	728	-0.5982	-0.1074	discard	exp#322 mtf_4h_regime_chop_daily_hma_crsi_trend_switch_atr_v1	train
43f00c7	mtf_4h_regime_chop_daily_hma_crsi_trend_switch_atr_v1	ETHUSDT	-0.1256	9.4	2.27	-22.84	48.1	1.22	778	-0.1051	0.0994	discard	exp#322 mtf_4h_regime_chop_daily_hma_crsi_trend_switch_atr_v1	train
43f00c7	mtf_4h_regime_chop_daily_hma_crsi_trend_switch_atr_v1	SOLUSDT	0.145	25.65	5.9	-31.5	48.3	1.17	766	0.1181	0.1872	keep	exp#322 mtf_4h_regime_chop_daily_hma_crsi_trend_switch_atr_v1	train
43f00c7	mtf_4h_regime_chop_daily_hma_crsi_trend_switch_atr_v1	SOLUSDT	0.4381	13.62	11.08	-11.19	50.0	1.28	246	0.4191	0.99	keep	exp#322 mtf_4h_regime_chop_daily_hma_crsi_trend_switch_atr_v1	test
e5f7fb9	mtf_12h_donchian_daily_hma_rsi_loose_atr_v1	BTCUSDT	0.1522	27.74	6.31	-14.14	31.2	1.9	189	0.1528	0.4465	keep	exp#323 mtf_12h_donchian_daily_hma_rsi_loose_atr_v1	train
e5f7fb9	mtf_12h_donchian_daily_hma_rsi_loose_atr_v1	BTCUSDT	-0.252	2.11	1.73	-10.19	37.7	1.53	69	-0.2667	0.17	discard	exp#323 mtf_12h_donchian_daily_hma_rsi_loose_atr_v1	test
e5f7fb9	mtf_12h_donchian_daily_hma_rsi_loose_atr_v1	ETHUSDT	-0.5991	-19.14	-5.17	-25.97	25.6	1.02	223	-0.5966	-0.1993	discard	exp#323 mtf_12h_donchian_daily_hma_rsi_loose_atr_v1	train
e5f7fb9	mtf_12h_donchian_daily_hma_rsi_loose_atr_v1	SOLUSDT	0.5917	94.88	18.23	-27.78	32.7	1.93	199	0.6243	0.6562	keep	exp#323 mtf_12h_donchian_daily_hma_rsi_loose_atr_v1	train
e5f7fb9	mtf_12h_donchian_daily_hma_rsi_loose_atr_v1	SOLUSDT	0.4998	16.69	13.54	-10.74	37.7	1.86	69	0.5224	1.261	keep	exp#323 mtf_12h_donchian_daily_hma_rsi_loose_atr_v1	test
e5f7fb9	mtf_12h_donchian_daily_hma_rsi_loose_atr_v1	BTCUSDT	0.1522	27.74	6.31	-14.14	31.2	1.9	189	0.1528	0.4465	keep	exp#323 mtf_12h_donchian_daily_hma_rsi_loose_atr_v1	train
e5f7fb9	mtf_12h_donchian_daily_hma_rsi_loose_atr_v1	ETHUSDT	-0.5991	-19.14	-5.17	-25.97	25.6	1.02	223	-0.5966	-0.1993	discard	exp#323 mtf_12h_donchian_daily_hma_rsi_loose_atr_v1	train
e5f7fb9	mtf_12h_donchian_daily_hma_rsi_loose_atr_v1	SOLUSDT	0.5917	94.88	18.23	-27.78	32.7	1.93	199	0.6243	0.6562	keep	exp#323 mtf_12h_donchian_daily_hma_rsi_loose_atr_v1	train
e5f7fb9	mtf_12h_donchian_daily_hma_rsi_loose_atr_v1	BTCUSDT	-0.252	2.11	1.73	-10.19	37.7	1.53	69	-0.2667	0.17	discard	exp#323 mtf_12h_donchian_daily_hma_rsi_loose_atr_v1	test
e5f7fb9	mtf_12h_donchian_daily_hma_rsi_loose_atr_v1	SOLUSDT	0.4998	16.69	13.54	-10.74	37.7	1.86	69	0.5224	1.261	keep	exp#323 mtf_12h_donchian_daily_hma_rsi_loose_atr_v1	test
fa728bd	mtf_1d_hma_crossover_weekly_bias_rsi_momentum_atr_v1	BTCUSDT	-0.193	9.68	2.34	-21.48	35.8	1.72	81	-0.1969	0.1088	discard	exp#324 mtf_1d_hma_crossover_weekly_bias_rsi_momentum_atr_v1	train
fa728bd	mtf_1d_hma_crossover_weekly_bias_rsi_momentum_atr_v1	ETHUSDT	-0.2878	0.63	0.16	-18.66	32.5	1.69	83	-0.3065	0.0084	discard	exp#324 mtf_1d_hma_crossover_weekly_bias_rsi_momentum_atr_v1	train
fa728bd	mtf_1d_hma_crossover_weekly_bias_rsi_momentum_atr_v1	SOLUSDT	0.694	101.07	19.15	-19.31	37.9	3.03	66	0.7445	0.992	keep	exp#324 mtf_1d_hma_crossover_weekly_bias_rsi_momentum_atr_v1	train
fa728bd	mtf_1d_hma_crossover_weekly_bias_rsi_momentum_atr_v1	SOLUSDT	0.0092	5.33	4.37	-9.74	33.3	1.63	21	0.0102	0.4483	keep	exp#324 mtf_1d_hma_crossover_weekly_bias_rsi_momentum_atr_v1	test
fa728bd	mtf_1d_hma_crossover_weekly_bias_rsi_momentum_atr_v1	BTCUSDT	-0.193	9.68	2.34	-21.48	35.8	1.72	81	-0.1969	0.1088	discard	exp#324 mtf_1d_hma_crossover_weekly_bias_rsi_momentum_atr_v1	train
fa728bd	mtf_1d_hma_crossover_weekly_bias_rsi_momentum_atr_v1	ETHUSDT	-0.2878	0.63	0.16	-18.66	32.5	1.69	83	-0.3065	0.0084	discard	exp#324 mtf_1d_hma_crossover_weekly_bias_rsi_momentum_atr_v1	train
fa728bd	mtf_1d_hma_crossover_weekly_bias_rsi_momentum_atr_v1	SOLUSDT	0.694	101.07	19.15	-19.31	37.9	3.03	66	0.7445	0.992	keep	exp#324 mtf_1d_hma_crossover_weekly_bias_rsi_momentum_atr_v1	train
fa728bd	mtf_1d_hma_crossover_weekly_bias_rsi_momentum_atr_v1	SOLUSDT	0.0092	5.33	4.37	-9.74	33.3	1.63	21	0.0102	0.4483	keep	exp#324 mtf_1d_hma_crossover_weekly_bias_rsi_momentum_atr_v1	test
a702b45	mtf_15m_mean_reversion_4h_hma_bb_rsi_atr_v1	BTCUSDT	-9.9052	-80.21	-33.32	-80.48	55.1	0.79	7554	-4.6637	-0.414	discard	exp#325 mtf_15m_mean_reversion_4h_hma_bb_rsi_atr_v1	train
a702b45	mtf_15m_mean_reversion_4h_hma_bb_rsi_atr_v1	ETHUSDT	-7.7549	-80.55	-33.61	-80.75	58.4	0.83	7858	-3.7108	-0.4162	discard	exp#325 mtf_15m_mean_reversion_4h_hma_bb_rsi_atr_v1	train
a702b45	mtf_15m_mean_reversion_4h_hma_bb_rsi_atr_v1	SOLUSDT	-4.5494	-79.03	-32.44	-79.27	60.6	0.89	7622	-2.2235	-0.4092	discard	exp#325 mtf_15m_mean_reversion_4h_hma_bb_rsi_atr_v1	train
a702b45	mtf_15m_mean_reversion_4h_hma_bb_rsi_atr_v1	BTCUSDT	-9.9052	-80.21	-33.32	-80.48	55.1	0.79	7554	-4.6637	-0.414	discard	exp#325 mtf_15m_mean_reversion_4h_hma_bb_rsi_atr_v1	train
a702b45	mtf_15m_mean_reversion_4h_hma_bb_rsi_atr_v1	ETHUSDT	-7.7549	-80.55	-33.61	-80.75	58.4	0.83	7858	-3.7108	-0.4162	discard	exp#325 mtf_15m_mean_reversion_4h_hma_bb_rsi_atr_v1	train
a702b45	mtf_15m_mean_reversion_4h_hma_bb_rsi_atr_v1	SOLUSDT	-4.5494	-79.03	-32.44	-79.27	60.6	0.89	7622	-2.2235	-0.4092	discard	exp#325 mtf_15m_mean_reversion_4h_hma_bb_rsi_atr_v1	train
34c9443	mtf_30m_ema_momentum_4h_hma_trend_rsi_loose_atr_v1	BTCUSDT	-2.1273	-66.67	-24.03	-68.01	28.7	1.27	4635	-2.6864	-0.3533	discard	exp#326 mtf_30m_ema_momentum_4h_hma_trend_rsi_loose_atr_v1	train
34c9443	mtf_30m_ema_momentum_4h_hma_trend_rsi_loose_atr_v1	ETHUSDT	-1.2365	-54.5	-17.88	-54.77	30.0	1.39	4686	-1.5695	-0.3265	discard	exp#326 mtf_30m_ema_momentum_4h_hma_trend_rsi_loose_atr_v1	train
34c9443	mtf_30m_ema_momentum_4h_hma_trend_rsi_loose_atr_v1	SOLUSDT	-0.4901	-43.18	-13.23	-56.91	32.4	1.46	4701	-0.6252	-0.2325	discard	exp#326 mtf_30m_ema_momentum_4h_hma_trend_rsi_loose_atr_v1	train
34c9443	mtf_30m_ema_momentum_4h_hma_trend_rsi_loose_atr_v1	BTCUSDT	-2.1273	-66.67	-24.03	-68.01	28.7	1.27	4635	-2.6864	-0.3533	discard	exp#326 mtf_30m_ema_momentum_4h_hma_trend_rsi_loose_atr_v1	train
34c9443	mtf_30m_ema_momentum_4h_hma_trend_rsi_loose_atr_v1	ETHUSDT	-1.2365	-54.5	-17.88	-54.77	30.0	1.39	4686	-1.5695	-0.3265	discard	exp#326 mtf_30m_ema_momentum_4h_hma_trend_rsi_loose_atr_v1	train
34c9443	mtf_30m_ema_momentum_4h_hma_trend_rsi_loose_atr_v1	SOLUSDT	-0.4901	-43.18	-13.23	-56.91	32.4	1.46	4701	-0.6252	-0.2325	discard	exp#326 mtf_30m_ema_momentum_4h_hma_trend_rsi_loose_atr_v1	train
58f7c10	mtf_1h_donchian_4h_hma_rsi_loose_atr_v1	BTCUSDT	-3.5151	-58.88	-19.94	-59.21	28.7	0.86	3507	-3.203	-0.3367	discard	exp#327 mtf_1h_donchian_4h_hma_rsi_loose_atr_v1	train
58f7c10	mtf_1h_donchian_4h_hma_rsi_loose_atr_v1	ETHUSDT	-2.7314	-54.95	-18.08	-54.95	31.7	0.91	3335	-2.2747	-0.3291	discard	exp#327 mtf_1h_donchian_4h_hma_rsi_loose_atr_v1	train
58f7c10	mtf_1h_donchian_4h_hma_rsi_loose_atr_v1	SOLUSDT	-2.2602	-66.73	-24.14	-68.38	33.7	0.88	3192	-1.5639	-0.353	discard	exp#327 mtf_1h_donchian_4h_hma_rsi_loose_atr_v1	train
58f7c10	mtf_1h_donchian_4h_hma_rsi_loose_atr_v1	BTCUSDT	-3.5151	-58.88	-19.94	-59.21	28.7	0.86	3507	-3.203	-0.3367	discard	exp#327 mtf_1h_donchian_4h_hma_rsi_loose_atr_v1	train
58f7c10	mtf_1h_donchian_4h_hma_rsi_loose_atr_v1	ETHUSDT	-2.7314	-54.95	-18.08	-54.95	31.7	0.91	3335	-2.2747	-0.3291	discard	exp#327 mtf_1h_donchian_4h_hma_rsi_loose_atr_v1	train
58f7c10	mtf_1h_donchian_4h_hma_rsi_loose_atr_v1	SOLUSDT	-2.2602	-66.73	-24.14	-68.38	33.7	0.88	3192	-1.5639	-0.353	discard	exp#327 mtf_1h_donchian_4h_hma_rsi_loose_atr_v1	train
67e5007	mtf_4h_regime_chop_daily_hma_adaptive_entry_atr_v1	BTCUSDT	-0.2748	0.44	0.11	-28.13	34.7	1.29	675	-0.3079	0.0039	discard	exp#328 mtf_4h_regime_chop_daily_hma_adaptive_entry_atr_v1	train
67e5007	mtf_4h_regime_chop_daily_hma_adaptive_entry_atr_v1	ETHUSDT	-0.0305	11.63	2.79	-27.07	35.3	1.33	697	-0.034	0.1031	discard	exp#328 mtf_4h_regime_chop_daily_hma_adaptive_entry_atr_v1	train
67e5007	mtf_4h_regime_chop_daily_hma_adaptive_entry_atr_v1	SOLUSDT	0.3523	55.06	11.64	-36.77	36.9	1.44	656	0.4114	0.3166	keep	exp#328 mtf_4h_regime_chop_daily_hma_adaptive_entry_atr_v1	train
67e5007	mtf_4h_regime_chop_daily_hma_adaptive_entry_atr_v1	SOLUSDT	-0.9308	-16.41	-13.71	-32.9	35.3	1.02	249	-1.0892	-0.4168	discard	exp#328 mtf_4h_regime_chop_daily_hma_adaptive_entry_atr_v1	test
67e5007	mtf_4h_regime_chop_daily_hma_adaptive_entry_atr_v1	BTCUSDT	-0.2748	0.44	0.11	-28.13	34.7	1.29	675	-0.3079	0.0039	discard	exp#328 mtf_4h_regime_chop_daily_hma_adaptive_entry_atr_v1	train
67e5007	mtf_4h_regime_chop_daily_hma_adaptive_entry_atr_v1	ETHUSDT	-0.0305	11.63	2.79	-27.07	35.3	1.33	697	-0.034	0.1031	discard	exp#328 mtf_4h_regime_chop_daily_hma_adaptive_entry_atr_v1	train
67e5007	mtf_4h_regime_chop_daily_hma_adaptive_entry_atr_v1	SOLUSDT	0.3523	55.06	11.64	-36.77	36.9	1.44	656	0.4114	0.3166	discard	exp#328 mtf_4h_regime_chop_daily_hma_adaptive_entry_atr_v1	train
0659b77	mtf_12h_donchian_daily_hma_rsi_momentum_atr_v2	BTCUSDT	-0.3575	12.17	2.91	-7.5	49.4	1.36	174	-0.1972	0.3885	discard	exp#329 mtf_12h_donchian_daily_hma_rsi_momentum_atr_v2	train
0659b77	mtf_12h_donchian_daily_hma_rsi_momentum_atr_v2	ETHUSDT	-0.8519	-4.47	-1.14	-12.08	39.7	0.98	194	-0.4886	-0.0942	discard	exp#329 mtf_12h_donchian_daily_hma_rsi_momentum_atr_v2	train
0659b77	mtf_12h_donchian_daily_hma_rsi_momentum_atr_v2	SOLUSDT	0.3583	42.76	9.34	-15.17	43.5	1.52	186	0.2234	0.616	keep	exp#329 mtf_12h_donchian_daily_hma_rsi_momentum_atr_v2	train
0659b77	mtf_12h_donchian_daily_hma_rsi_momentum_atr_v2	SOLUSDT	0.1582	7.45	6.09	-5.5	50.0	1.43	62	0.0992	1.1073	keep	exp#329 mtf_12h_donchian_daily_hma_rsi_momentum_atr_v2	test
0659b77	mtf_12h_donchian_daily_hma_rsi_momentum_atr_v2	BTCUSDT	-0.3575	12.17	2.91	-7.5	49.4	1.36	174	-0.1972	0.3885	discard	exp#329 mtf_12h_donchian_daily_hma_rsi_momentum_atr_v2	train
0659b77	mtf_12h_donchian_daily_hma_rsi_momentum_atr_v2	ETHUSDT	-0.8519	-4.47	-1.14	-12.08	39.7	0.98	194	-0.4886	-0.0942	discard	exp#329 mtf_12h_donchian_daily_hma_rsi_momentum_atr_v2	train
0659b77	mtf_12h_donchian_daily_hma_rsi_momentum_atr_v2	SOLUSDT	0.3583	42.76	9.34	-15.17	43.5	1.52	186	0.2234	0.616	keep	exp#329 mtf_12h_donchian_daily_hma_rsi_momentum_atr_v2	train
0659b77	mtf_12h_donchian_daily_hma_rsi_momentum_atr_v2	SOLUSDT	0.1582	7.45	6.09	-5.5	50.0	1.43	62	0.0992	1.1073	keep	exp#329 mtf_12h_donchian_daily_hma_rsi_momentum_atr_v2	test
8280166	mtf_1d_donchian_weekly_hma_rsi_momentum_atr_v1	BTCUSDT	-0.388	9.37	2.26	-7.76	47.1	1.42	85	-0.2363	0.2919	discard	exp#330 mtf_1d_donchian_weekly_hma_rsi_momentum_atr_v1	train
8280166	mtf_1d_donchian_weekly_hma_rsi_momentum_atr_v1	ETHUSDT	-0.9094	-6.42	-1.65	-16.22	37.7	0.89	77	-0.4408	-0.1015	discard	exp#330 mtf_1d_donchian_weekly_hma_rsi_momentum_atr_v1	train
8280166	mtf_1d_donchian_weekly_hma_rsi_momentum_atr_v1	SOLUSDT	0.449	52.32	11.13	-10.62	59.2	2.14	76	0.2899	1.048	keep	exp#330 mtf_1d_donchian_weekly_hma_rsi_momentum_atr_v1	train
8280166	mtf_1d_donchian_weekly_hma_rsi_momentum_atr_v1	SOLUSDT	-1.1119	-5.7	-4.71	-7.24	43.8	0.73	32	-0.6345	-0.6509	discard	exp#330 mtf_1d_donchian_weekly_hma_rsi_momentum_atr_v1	test
8280166	mtf_1d_donchian_weekly_hma_rsi_momentum_atr_v1	BTCUSDT	-0.388	9.37	2.26	-7.76	47.1	1.42	85	-0.2363	0.2919	discard	exp#330 mtf_1d_donchian_weekly_hma_rsi_momentum_atr_v1	train
8280166	mtf_1d_donchian_weekly_hma_rsi_momentum_atr_v1	ETHUSDT	-0.9094	-6.42	-1.65	-16.22	37.7	0.89	77	-0.4408	-0.1015	discard	exp#330 mtf_1d_donchian_weekly_hma_rsi_momentum_atr_v1	train
8280166	mtf_1d_donchian_weekly_hma_rsi_momentum_atr_v1	SOLUSDT	0.449	52.32	11.13	-10.62	59.2	2.14	76	0.2899	1.048	discard	exp#330 mtf_1d_donchian_weekly_hma_rsi_momentum_atr_v1	train
