commit	strategy	symbol	sharpe	return_pct	cagr_pct	max_dd_pct	win_rate	profit_factor	trades	sortino	calmar	status	description	period
bbc4612	mtf_4h_fisher_daily_hma_chop_regime_atr_v1	SOLUSDT	-1.7407	-38.55	-11.51	-41.63	53.6	0.76	548	-0.8523	-0.2764	discard	exp#472 mtf_4h_fisher_daily_hma_chop_regime_atr_v1	train
bbc4612	mtf_4h_fisher_daily_hma_chop_regime_atr_v1	BTCUSDT	-1.5703	-9.57	-2.49	-11.51	55.8	0.96	523	-0.8355	-0.2161	discard	exp#472 mtf_4h_fisher_daily_hma_chop_regime_atr_v1	train
bbc4612	mtf_4h_fisher_daily_hma_chop_regime_atr_v1	ETHUSDT	-1.6816	-15.89	-4.24	-18.08	52.2	0.89	521	-0.8601	-0.2343	discard	exp#472 mtf_4h_fisher_daily_hma_chop_regime_atr_v1	train
bbc4612	mtf_4h_fisher_daily_hma_chop_regime_atr_v1	SOLUSDT	-1.7407	-38.55	-11.51	-41.63	53.6	0.76	548	-0.8523	-0.2764	discard	exp#472 mtf_4h_fisher_daily_hma_chop_regime_atr_v1	train
1989f7d	mtf_12h_regime_adaptive_chop_hma_rsi_atr_v1	BTCUSDT	0.693	51.38	10.93	-9.02	61.2	1.54	348	0.6234	1.2113	keep	exp#473 mtf_12h_regime_adaptive_chop_hma_rsi_atr_v1	train
1989f7d	mtf_12h_regime_adaptive_chop_hma_rsi_atr_v1	BTCUSDT	-1.1941	-3.62	-2.99	-9.17	59.3	0.95	108	-0.8911	-0.326	discard	exp#473 mtf_12h_regime_adaptive_chop_hma_rsi_atr_v1	test
1989f7d	mtf_12h_regime_adaptive_chop_hma_rsi_atr_v1	ETHUSDT	0.273	33.92	7.58	-12.99	58.8	1.32	345	0.2391	0.5833	keep	exp#473 mtf_12h_regime_adaptive_chop_hma_rsi_atr_v1	train
1989f7d	mtf_12h_regime_adaptive_chop_hma_rsi_atr_v1	ETHUSDT	-1.4871	-12.41	-10.32	-16.67	62.1	0.81	116	-0.9951	-0.6193	discard	exp#473 mtf_12h_regime_adaptive_chop_hma_rsi_atr_v1	test
1989f7d	mtf_12h_regime_adaptive_chop_hma_rsi_atr_v1	SOLUSDT	-0.5231	-18.02	-4.86	-39.64	57.0	0.98	365	-0.4061	-0.1227	discard	exp#473 mtf_12h_regime_adaptive_chop_hma_rsi_atr_v1	train
1989f7d	mtf_12h_regime_adaptive_chop_hma_rsi_atr_v1	BTCUSDT	0.693	51.38	10.93	-9.02	61.2	1.54	348	0.6234	1.2113	discard	exp#473 mtf_12h_regime_adaptive_chop_hma_rsi_atr_v1	train
1989f7d	mtf_12h_regime_adaptive_chop_hma_rsi_atr_v1	ETHUSDT	0.273	33.92	7.58	-12.99	58.8	1.32	345	0.2391	0.5833	discard	exp#473 mtf_12h_regime_adaptive_chop_hma_rsi_atr_v1	train
1989f7d	mtf_12h_regime_adaptive_chop_hma_rsi_atr_v1	SOLUSDT	-0.5231	-18.02	-4.86	-39.64	57.0	0.98	365	-0.4061	-0.1227	discard	exp#473 mtf_12h_regime_adaptive_chop_hma_rsi_atr_v1	train
caa0126	mtf_1d_crsi_weekly_hma_mean_reversion_atr_v1	BTCUSDT	-1.5056	-18.98	-5.12	-23.69	57.6	0.7	118	-0.8183	-0.2164	discard	exp#474 mtf_1d_crsi_weekly_hma_mean_reversion_atr_v1	train
caa0126	mtf_1d_crsi_weekly_hma_mean_reversion_atr_v1	ETHUSDT	-0.953	-8.11	-2.09	-18.84	57.8	0.87	102	-0.5578	-0.1111	discard	exp#474 mtf_1d_crsi_weekly_hma_mean_reversion_atr_v1	train
caa0126	mtf_1d_crsi_weekly_hma_mean_reversion_atr_v1	SOLUSDT	-0.8502	-16.07	-4.3	-26.32	55.5	0.83	110	-0.4644	-0.1634	discard	exp#474 mtf_1d_crsi_weekly_hma_mean_reversion_atr_v1	train
caa0126	mtf_1d_crsi_weekly_hma_mean_reversion_atr_v1	BTCUSDT	-1.5056	-18.98	-5.12	-23.69	57.6	0.7	118	-0.8183	-0.2164	discard	exp#474 mtf_1d_crsi_weekly_hma_mean_reversion_atr_v1	train
caa0126	mtf_1d_crsi_weekly_hma_mean_reversion_atr_v1	ETHUSDT	-0.953	-8.11	-2.09	-18.84	57.8	0.87	102	-0.5578	-0.1111	discard	exp#474 mtf_1d_crsi_weekly_hma_mean_reversion_atr_v1	train
caa0126	mtf_1d_crsi_weekly_hma_mean_reversion_atr_v1	SOLUSDT	-0.8502	-16.07	-4.3	-26.32	55.5	0.83	110	-0.4644	-0.1634	discard	exp#474 mtf_1d_crsi_weekly_hma_mean_reversion_atr_v1	train
18526c5	mtf_15m_crsi_extreme_4h_hma_chop_regime_atr_v1	BTCUSDT	-11.0565	-87.52	-40.58	-87.86	48.5	0.81	7784	-4.9584	-0.4619	discard	exp#475 mtf_15m_crsi_extreme_4h_hma_chop_regime_atr_v1	train
18526c5	mtf_15m_crsi_extreme_4h_hma_chop_regime_atr_v1	ETHUSDT	-8.6412	-87.58	-40.66	-87.86	51.5	0.85	7897	-4.0134	-0.4628	discard	exp#475 mtf_15m_crsi_extreme_4h_hma_chop_regime_atr_v1	train
18526c5	mtf_15m_crsi_extreme_4h_hma_chop_regime_atr_v1	SOLUSDT	-5.9625	-90.03	-43.94	-90.49	54.1	0.82	7677	-2.5451	-0.4855	discard	exp#475 mtf_15m_crsi_extreme_4h_hma_chop_regime_atr_v1	train
18526c5	mtf_15m_crsi_extreme_4h_hma_chop_regime_atr_v1	BTCUSDT	-11.0565	-87.52	-40.58	-87.86	48.5	0.81	7784	-4.9584	-0.4619	discard	exp#475 mtf_15m_crsi_extreme_4h_hma_chop_regime_atr_v1	train
18526c5	mtf_15m_crsi_extreme_4h_hma_chop_regime_atr_v1	ETHUSDT	-8.6412	-87.58	-40.66	-87.86	51.5	0.85	7897	-4.0134	-0.4628	discard	exp#475 mtf_15m_crsi_extreme_4h_hma_chop_regime_atr_v1	train
18526c5	mtf_15m_crsi_extreme_4h_hma_chop_regime_atr_v1	SOLUSDT	-5.9625	-90.03	-43.94	-90.49	54.1	0.82	7677	-2.5451	-0.4855	discard	exp#475 mtf_15m_crsi_extreme_4h_hma_chop_regime_atr_v1	train
7a41a17	mtf_30m_donchian_4h_trend_volume_atr_v1	BTCUSDT	-5.6389	-68.89	-25.33	-69.2	33.7	0.73	3676	-2.7697	-0.3661	discard	exp#476 mtf_30m_donchian_4h_trend_volume_atr_v1	train
7a41a17	mtf_30m_donchian_4h_trend_volume_atr_v1	ETHUSDT	-4.7142	-68.13	-24.88	-68.3	35.6	0.78	3841	-2.3619	-0.3642	discard	exp#476 mtf_30m_donchian_4h_trend_volume_atr_v1	train
7a41a17	mtf_30m_donchian_4h_trend_volume_atr_v1	SOLUSDT	-3.5607	-79.87	-33.12	-81.42	36.8	0.82	4303	-1.8207	-0.4068	discard	exp#476 mtf_30m_donchian_4h_trend_volume_atr_v1	train
7a41a17	mtf_30m_donchian_4h_trend_volume_atr_v1	BTCUSDT	-5.6389	-68.89	-25.33	-69.2	33.7	0.73	3676	-2.7697	-0.3661	discard	exp#476 mtf_30m_donchian_4h_trend_volume_atr_v1	train
7a41a17	mtf_30m_donchian_4h_trend_volume_atr_v1	ETHUSDT	-4.7142	-68.13	-24.88	-68.3	35.6	0.78	3841	-2.3619	-0.3642	discard	exp#476 mtf_30m_donchian_4h_trend_volume_atr_v1	train
7a41a17	mtf_30m_donchian_4h_trend_volume_atr_v1	SOLUSDT	-3.5607	-79.87	-33.12	-81.42	36.8	0.82	4303	-1.8207	-0.4068	discard	exp#476 mtf_30m_donchian_4h_trend_volume_atr_v1	train
de1b727	mtf_1h_hma_crossover_4h_bias_rsi_atr_v1	BTCUSDT	-4.4949	-81.84	-34.74	-81.86	43.7	0.86	5771	-4.2839	-0.4244	discard	exp#477 mtf_1h_hma_crossover_4h_bias_rsi_atr_v1	train
de1b727	mtf_1h_hma_crossover_4h_bias_rsi_atr_v1	ETHUSDT	-3.7451	-83.57	-36.35	-84.47	44.7	0.88	5869	-3.5748	-0.4303	discard	exp#477 mtf_1h_hma_crossover_4h_bias_rsi_atr_v1	train
de1b727	mtf_1h_hma_crossover_4h_bias_rsi_atr_v1	SOLUSDT	-0.8162	-44.34	-13.68	-64.12	48.4	1.05	6151	-0.8085	-0.2133	discard	exp#477 mtf_1h_hma_crossover_4h_bias_rsi_atr_v1	train
de1b727	mtf_1h_hma_crossover_4h_bias_rsi_atr_v1	BTCUSDT	-4.4949	-81.84	-34.74	-81.86	43.7	0.86	5771	-4.2839	-0.4244	discard	exp#477 mtf_1h_hma_crossover_4h_bias_rsi_atr_v1	train
de1b727	mtf_1h_hma_crossover_4h_bias_rsi_atr_v1	ETHUSDT	-3.7451	-83.57	-36.35	-84.47	44.7	0.88	5869	-3.5748	-0.4303	discard	exp#477 mtf_1h_hma_crossover_4h_bias_rsi_atr_v1	train
de1b727	mtf_1h_hma_crossover_4h_bias_rsi_atr_v1	SOLUSDT	-0.8162	-44.34	-13.68	-64.12	48.4	1.05	6151	-0.8085	-0.2133	discard	exp#477 mtf_1h_hma_crossover_4h_bias_rsi_atr_v1	train
c0b9ca8	mtf_4h_kama_daily_hma_volume_breakout_atr_v1	BTCUSDT	-0.4064	1.76	0.44	-12.29	45.4	1.13	1222	-0.3371	0.0355	discard	exp#478 mtf_4h_kama_daily_hma_volume_breakout_atr_v1	train
c0b9ca8	mtf_4h_kama_daily_hma_volume_breakout_atr_v1	ETHUSDT	-1.1534	-32.17	-9.25	-35.53	46.1	0.94	1227	-0.8947	-0.2605	discard	exp#478 mtf_4h_kama_daily_hma_volume_breakout_atr_v1	train
c0b9ca8	mtf_4h_kama_daily_hma_volume_breakout_atr_v1	SOLUSDT	-0.3754	-15.93	-4.26	-37.78	46.3	1.07	1097	-0.2956	-0.1128	discard	exp#478 mtf_4h_kama_daily_hma_volume_breakout_atr_v1	train
c0b9ca8	mtf_4h_kama_daily_hma_volume_breakout_atr_v1	BTCUSDT	-0.4064	1.76	0.44	-12.29	45.4	1.13	1222	-0.3371	0.0355	discard	exp#478 mtf_4h_kama_daily_hma_volume_breakout_atr_v1	train
c0b9ca8	mtf_4h_kama_daily_hma_volume_breakout_atr_v1	ETHUSDT	-1.1534	-32.17	-9.25	-35.53	46.1	0.94	1227	-0.8947	-0.2605	discard	exp#478 mtf_4h_kama_daily_hma_volume_breakout_atr_v1	train
c0b9ca8	mtf_4h_kama_daily_hma_volume_breakout_atr_v1	SOLUSDT	-0.3754	-15.93	-4.26	-37.78	46.3	1.07	1097	-0.2956	-0.1128	discard	exp#478 mtf_4h_kama_daily_hma_volume_breakout_atr_v1	train
37d96b7	mtf_12h_kama_daily_hma_rsi_adx_atr_v1	BTCUSDT	-0.0356	13.61	3.24	-21.38	39.4	1.38	401	-0.0463	0.1516	discard	exp#479 mtf_12h_kama_daily_hma_rsi_adx_atr_v1	train
37d96b7	mtf_12h_kama_daily_hma_rsi_adx_atr_v1	ETHUSDT	0.0447	16.65	3.93	-20.84	37.1	1.35	407	0.0589	0.1884	keep	exp#479 mtf_12h_kama_daily_hma_rsi_adx_atr_v1	train
37d96b7	mtf_12h_kama_daily_hma_rsi_adx_atr_v1	ETHUSDT	-0.7038	-12.25	-10.2	-19.54	35.3	1.11	139	-0.8955	-0.5218	discard	exp#479 mtf_12h_kama_daily_hma_rsi_adx_atr_v1	test
37d96b7	mtf_12h_kama_daily_hma_rsi_adx_atr_v1	SOLUSDT	0.5854	109.3	20.36	-36.77	35.8	1.54	394	0.7835	0.5538	keep	exp#479 mtf_12h_kama_daily_hma_rsi_adx_atr_v1	train
37d96b7	mtf_12h_kama_daily_hma_rsi_adx_atr_v1	SOLUSDT	0.1916	8.58	7.01	-15.71	43.5	1.4	131	0.2446	0.446	keep	exp#479 mtf_12h_kama_daily_hma_rsi_adx_atr_v1	test
37d96b7	mtf_12h_kama_daily_hma_rsi_adx_atr_v1	BTCUSDT	-0.0356	13.61	3.24	-21.38	39.4	1.38	401	-0.0463	0.1516	discard	exp#479 mtf_12h_kama_daily_hma_rsi_adx_atr_v1	train
37d96b7	mtf_12h_kama_daily_hma_rsi_adx_atr_v1	ETHUSDT	0.0447	16.65	3.93	-20.84	37.1	1.35	407	0.0589	0.1884	keep	exp#479 mtf_12h_kama_daily_hma_rsi_adx_atr_v1	train
37d96b7	mtf_12h_kama_daily_hma_rsi_adx_atr_v1	SOLUSDT	0.5854	109.3	20.36	-36.77	35.8	1.54	394	0.7835	0.5538	keep	exp#479 mtf_12h_kama_daily_hma_rsi_adx_atr_v1	train
37d96b7	mtf_12h_kama_daily_hma_rsi_adx_atr_v1	ETHUSDT	-0.7038	-12.25	-10.2	-19.54	35.3	1.11	139	-0.8955	-0.5218	discard	exp#479 mtf_12h_kama_daily_hma_rsi_adx_atr_v1	test
37d96b7	mtf_12h_kama_daily_hma_rsi_adx_atr_v1	SOLUSDT	0.1916	8.58	7.01	-15.71	43.5	1.4	131	0.2446	0.446	keep	exp#479 mtf_12h_kama_daily_hma_rsi_adx_atr_v1	test
788a9b6	mtf_1d_donchian_weekly_hma_adx_rsi_atr_v1	BTCUSDT	-0.2383	4.78	1.17	-21.67	33.7	1.63	95	-0.2711	0.0542	discard	exp#480 mtf_1d_donchian_weekly_hma_adx_rsi_atr_v1	train
788a9b6	mtf_1d_donchian_weekly_hma_adx_rsi_atr_v1	ETHUSDT	-0.2945	-3.1	-0.78	-27.73	29.9	1.6	97	-0.3192	-0.0283	discard	exp#480 mtf_1d_donchian_weekly_hma_adx_rsi_atr_v1	train
788a9b6	mtf_1d_donchian_weekly_hma_adx_rsi_atr_v1	SOLUSDT	0.8059	142.37	24.87	-19.84	36.7	3.13	90	1.0271	1.2535	keep	exp#480 mtf_1d_donchian_weekly_hma_adx_rsi_atr_v1	train
788a9b6	mtf_1d_donchian_weekly_hma_adx_rsi_atr_v1	SOLUSDT	-0.6431	-6.56	-5.43	-16.31	47.6	0.66	21	-0.6231	-0.3328	discard	exp#480 mtf_1d_donchian_weekly_hma_adx_rsi_atr_v1	test
788a9b6	mtf_1d_donchian_weekly_hma_adx_rsi_atr_v1	BTCUSDT	-0.2383	4.78	1.17	-21.67	33.7	1.63	95	-0.2711	0.0542	discard	exp#480 mtf_1d_donchian_weekly_hma_adx_rsi_atr_v1	train
788a9b6	mtf_1d_donchian_weekly_hma_adx_rsi_atr_v1	ETHUSDT	-0.2945	-3.1	-0.78	-27.73	29.9	1.6	97	-0.3192	-0.0283	discard	exp#480 mtf_1d_donchian_weekly_hma_adx_rsi_atr_v1	train
788a9b6	mtf_1d_donchian_weekly_hma_adx_rsi_atr_v1	SOLUSDT	0.8059	142.37	24.87	-19.84	36.7	3.13	90	1.0271	1.2535	discard	exp#480 mtf_1d_donchian_weekly_hma_adx_rsi_atr_v1	train
52800a0	mtf_15m_kama_4h_hma_1h_adx_rsi_pullback_atr_v1	BTCUSDT	-7.4642	-98.26	-63.69	-98.35	41.4	1.06	17408	-9.5675	-0.6475	discard	exp#481 mtf_15m_kama_4h_hma_1h_adx_rsi_pullback_atr_v1	train
52800a0	mtf_15m_kama_4h_hma_1h_adx_rsi_pullback_atr_v1	ETHUSDT	-6.168	-98.52	-65.12	-98.54	42.0	1.06	17317	-7.6722	-0.6609	discard	exp#481 mtf_15m_kama_4h_hma_1h_adx_rsi_pullback_atr_v1	train
52800a0	mtf_15m_kama_4h_hma_1h_adx_rsi_pullback_atr_v1	SOLUSDT	-3.1719	-97.11	-58.93	-97.21	44.8	1.16	17607	-3.9435	-0.6063	discard	exp#481 mtf_15m_kama_4h_hma_1h_adx_rsi_pullback_atr_v1	train
52800a0	mtf_15m_kama_4h_hma_1h_adx_rsi_pullback_atr_v1	BTCUSDT	-7.4642	-98.26	-63.69	-98.35	41.4	1.06	17408	-9.5675	-0.6475	discard	exp#481 mtf_15m_kama_4h_hma_1h_adx_rsi_pullback_atr_v1	train
52800a0	mtf_15m_kama_4h_hma_1h_adx_rsi_pullback_atr_v1	ETHUSDT	-6.168	-98.52	-65.12	-98.54	42.0	1.06	17317	-7.6722	-0.6609	discard	exp#481 mtf_15m_kama_4h_hma_1h_adx_rsi_pullback_atr_v1	train
52800a0	mtf_15m_kama_4h_hma_1h_adx_rsi_pullback_atr_v1	SOLUSDT	-3.1719	-97.11	-58.93	-97.21	44.8	1.16	17607	-3.9435	-0.6063	discard	exp#481 mtf_15m_kama_4h_hma_1h_adx_rsi_pullback_atr_v1	train
f3d89b9	mtf_30m_supertrend_4h_hma_rsi_adx_atr_v1	BTCUSDT	-2.7835	-71.76	-27.12	-72.34	27.9	1.16	3957	-3.0305	-0.3748	discard	exp#482 mtf_30m_supertrend_4h_hma_rsi_adx_atr_v1	train
f3d89b9	mtf_30m_supertrend_4h_hma_rsi_adx_atr_v1	ETHUSDT	-2.3271	-75.1	-29.38	-75.76	28.1	1.15	4010	-2.5663	-0.3878	discard	exp#482 mtf_30m_supertrend_4h_hma_rsi_adx_atr_v1	train
f3d89b9	mtf_30m_supertrend_4h_hma_rsi_adx_atr_v1	SOLUSDT	-1.6452	-80.49	-33.65	-82.08	32.4	1.15	3872	-1.7401	-0.41	discard	exp#482 mtf_30m_supertrend_4h_hma_rsi_adx_atr_v1	train
f3d89b9	mtf_30m_supertrend_4h_hma_rsi_adx_atr_v1	BTCUSDT	-2.7835	-71.76	-27.12	-72.34	27.9	1.16	3957	-3.0305	-0.3748	discard	exp#482 mtf_30m_supertrend_4h_hma_rsi_adx_atr_v1	train
f3d89b9	mtf_30m_supertrend_4h_hma_rsi_adx_atr_v1	ETHUSDT	-2.3271	-75.1	-29.38	-75.76	28.1	1.15	4010	-2.5663	-0.3878	discard	exp#482 mtf_30m_supertrend_4h_hma_rsi_adx_atr_v1	train
f3d89b9	mtf_30m_supertrend_4h_hma_rsi_adx_atr_v1	SOLUSDT	-1.6452	-80.49	-33.65	-82.08	32.4	1.15	3872	-1.7401	-0.41	discard	exp#482 mtf_30m_supertrend_4h_hma_rsi_adx_atr_v1	train
4635d4b	mtf_1h_kama_4h_hma_rsi_adx_atr_v1	BTCUSDT	-2.2856	-77.8	-31.37	-78.81	29.0	1.16	4211	-3.1473	-0.3981	discard	exp#483 mtf_1h_kama_4h_hma_rsi_adx_atr_v1	train
4635d4b	mtf_1h_kama_4h_hma_rsi_adx_atr_v1	ETHUSDT	-0.8454	-49.24	-15.6	-53.79	30.6	1.36	4315	-1.173	-0.2901	discard	exp#483 mtf_1h_kama_4h_hma_rsi_adx_atr_v1	train
4635d4b	mtf_1h_kama_4h_hma_rsi_adx_atr_v1	SOLUSDT	-0.5749	-59.48	-20.29	-65.52	31.8	1.34	4145	-0.7725	-0.3097	discard	exp#483 mtf_1h_kama_4h_hma_rsi_adx_atr_v1	train
4635d4b	mtf_1h_kama_4h_hma_rsi_adx_atr_v1	BTCUSDT	-2.2856	-77.8	-31.37	-78.81	29.0	1.16	4211	-3.1473	-0.3981	discard	exp#483 mtf_1h_kama_4h_hma_rsi_adx_atr_v1	train
4635d4b	mtf_1h_kama_4h_hma_rsi_adx_atr_v1	ETHUSDT	-0.8454	-49.24	-15.6	-53.79	30.6	1.36	4315	-1.173	-0.2901	discard	exp#483 mtf_1h_kama_4h_hma_rsi_adx_atr_v1	train
4635d4b	mtf_1h_kama_4h_hma_rsi_adx_atr_v1	SOLUSDT	-0.5749	-59.48	-20.29	-65.52	31.8	1.34	4145	-0.7725	-0.3097	discard	exp#483 mtf_1h_kama_4h_hma_rsi_adx_atr_v1	train
fc0133e	mtf_4h_fisher_daily_hma_chop_regime_atr_v2	BTCUSDT	-0.7975	-15.91	-4.24	-31.5	36.1	1.05	907	-0.8484	-0.1346	discard	exp#484 mtf_4h_fisher_daily_hma_chop_regime_atr_v2	train
fc0133e	mtf_4h_fisher_daily_hma_chop_regime_atr_v2	ETHUSDT	-0.2519	1.83	0.45	-22.69	36.1	1.14	929	-0.2694	0.02	discard	exp#484 mtf_4h_fisher_daily_hma_chop_regime_atr_v2	train
fc0133e	mtf_4h_fisher_daily_hma_chop_regime_atr_v2	SOLUSDT	0.4016	58.06	12.18	-30.96	38.2	1.29	935	0.4355	0.3934	keep	exp#484 mtf_4h_fisher_daily_hma_chop_regime_atr_v2	train
fc0133e	mtf_4h_fisher_daily_hma_chop_regime_atr_v2	SOLUSDT	0.4351	13.58	11.04	-19.73	38.1	1.27	312	0.5038	0.5596	keep	exp#484 mtf_4h_fisher_daily_hma_chop_regime_atr_v2	test
fc0133e	mtf_4h_fisher_daily_hma_chop_regime_atr_v2	BTCUSDT	-0.7975	-15.91	-4.24	-31.5	36.1	1.05	907	-0.8484	-0.1346	discard	exp#484 mtf_4h_fisher_daily_hma_chop_regime_atr_v2	train
fc0133e	mtf_4h_fisher_daily_hma_chop_regime_atr_v2	ETHUSDT	-0.2519	1.83	0.45	-22.69	36.1	1.14	929	-0.2694	0.02	discard	exp#484 mtf_4h_fisher_daily_hma_chop_regime_atr_v2	train
fc0133e	mtf_4h_fisher_daily_hma_chop_regime_atr_v2	SOLUSDT	0.4016	58.06	12.18	-30.96	38.2	1.29	935	0.4355	0.3934	keep	exp#484 mtf_4h_fisher_daily_hma_chop_regime_atr_v2	train
fc0133e	mtf_4h_fisher_daily_hma_chop_regime_atr_v2	SOLUSDT	0.4351	13.58	11.04	-19.73	38.1	1.27	312	0.5038	0.5596	keep	exp#484 mtf_4h_fisher_daily_hma_chop_regime_atr_v2	test
8a7daa3	mtf_12h_supertrend_daily_hma_rsi_adx_atr_v3	BTCUSDT	-0.3551	-1.56	-0.39	-25.2	31.5	1.14	470	-0.4512	-0.0156	discard	exp#485 mtf_12h_supertrend_daily_hma_rsi_adx_atr_v3	train
8a7daa3	mtf_12h_supertrend_daily_hma_rsi_adx_atr_v3	ETHUSDT	-0.3964	-11.12	-2.9	-36.63	34.3	1.05	568	-0.5124	-0.0793	discard	exp#485 mtf_12h_supertrend_daily_hma_rsi_adx_atr_v3	train
8a7daa3	mtf_12h_supertrend_daily_hma_rsi_adx_atr_v3	SOLUSDT	0.1209	20.8	4.86	-36.83	36.5	1.19	397	0.1454	0.1318	keep	exp#485 mtf_12h_supertrend_daily_hma_rsi_adx_atr_v3	train
8a7daa3	mtf_12h_supertrend_daily_hma_rsi_adx_atr_v3	SOLUSDT	0.5502	17.93	14.53	-11.72	42.6	1.43	136	0.7287	1.2397	keep	exp#485 mtf_12h_supertrend_daily_hma_rsi_adx_atr_v3	test
8a7daa3	mtf_12h_supertrend_daily_hma_rsi_adx_atr_v3	BTCUSDT	-0.3551	-1.56	-0.39	-25.2	31.5	1.14	470	-0.4512	-0.0156	discard	exp#485 mtf_12h_supertrend_daily_hma_rsi_adx_atr_v3	train
8a7daa3	mtf_12h_supertrend_daily_hma_rsi_adx_atr_v3	ETHUSDT	-0.3964	-11.12	-2.9	-36.63	34.3	1.05	568	-0.5124	-0.0793	discard	exp#485 mtf_12h_supertrend_daily_hma_rsi_adx_atr_v3	train
8a7daa3	mtf_12h_supertrend_daily_hma_rsi_adx_atr_v3	SOLUSDT	0.1209	20.8	4.86	-36.83	36.5	1.19	397	0.1454	0.1318	keep	exp#485 mtf_12h_supertrend_daily_hma_rsi_adx_atr_v3	train
8a7daa3	mtf_12h_supertrend_daily_hma_rsi_adx_atr_v3	SOLUSDT	0.5502	17.93	14.53	-11.72	42.6	1.43	136	0.7287	1.2397	keep	exp#485 mtf_12h_supertrend_daily_hma_rsi_adx_atr_v3	test
efd70ba	mtf_1d_donchian_weekly_hma_adx_rsi_atr_v2	BTCUSDT	-0.0481	14.82	3.52	-20.19	32.7	1.48	147	-0.0596	0.1742	discard	exp#486 mtf_1d_donchian_weekly_hma_adx_rsi_atr_v2	train
efd70ba	mtf_1d_donchian_weekly_hma_adx_rsi_atr_v2	ETHUSDT	-0.2836	-4.43	-1.13	-30.19	34.9	1.03	149	-0.343	-0.0373	discard	exp#486 mtf_1d_donchian_weekly_hma_adx_rsi_atr_v2	train
efd70ba	mtf_1d_donchian_weekly_hma_adx_rsi_atr_v2	SOLUSDT	0.9267	177.96	29.23	-20.76	42.4	2.29	118	1.3106	1.4085	keep	exp#486 mtf_1d_donchian_weekly_hma_adx_rsi_atr_v2	train
efd70ba	mtf_1d_donchian_weekly_hma_adx_rsi_atr_v2	SOLUSDT	-0.5015	-7.3	-6.05	-20.88	36.7	0.99	30	-0.59	-0.2895	discard	exp#486 mtf_1d_donchian_weekly_hma_adx_rsi_atr_v2	test
efd70ba	mtf_1d_donchian_weekly_hma_adx_rsi_atr_v2	BTCUSDT	-0.0481	14.82	3.52	-20.19	32.7	1.48	147	-0.0596	0.1742	discard	exp#486 mtf_1d_donchian_weekly_hma_adx_rsi_atr_v2	train
efd70ba	mtf_1d_donchian_weekly_hma_adx_rsi_atr_v2	ETHUSDT	-0.2836	-4.43	-1.13	-30.19	34.9	1.03	149	-0.343	-0.0373	discard	exp#486 mtf_1d_donchian_weekly_hma_adx_rsi_atr_v2	train
efd70ba	mtf_1d_donchian_weekly_hma_adx_rsi_atr_v2	SOLUSDT	0.9267	177.96	29.23	-20.76	42.4	2.29	118	1.3106	1.4085	discard	exp#486 mtf_1d_donchian_weekly_hma_adx_rsi_atr_v2	train
2d19687	mtf_15m_fisher_4h_hma_chop_regime_atr_v1	BTCUSDT	-7.323	-95.07	-52.9	-95.27	24.1	0.85	12867	-7.9286	-0.5553	discard	exp#487 mtf_15m_fisher_4h_hma_chop_regime_atr_v1	train
2d19687	mtf_15m_fisher_4h_hma_chop_regime_atr_v1	ETHUSDT	-5.4367	-94.01	-50.56	-94.08	25.6	0.92	12798	-5.8389	-0.5374	discard	exp#487 mtf_15m_fisher_4h_hma_chop_regime_atr_v1	train
2d19687	mtf_15m_fisher_4h_hma_chop_regime_atr_v1	SOLUSDT	-2.6901	-89.28	-42.91	-92.84	29.1	1.05	12537	-2.8564	-0.4622	discard	exp#487 mtf_15m_fisher_4h_hma_chop_regime_atr_v1	train
2d19687	mtf_15m_fisher_4h_hma_chop_regime_atr_v1	BTCUSDT	-7.323	-95.07	-52.9	-95.27	24.1	0.85	12867	-7.9286	-0.5553	discard	exp#487 mtf_15m_fisher_4h_hma_chop_regime_atr_v1	train
2d19687	mtf_15m_fisher_4h_hma_chop_regime_atr_v1	ETHUSDT	-5.4367	-94.01	-50.56	-94.08	25.6	0.92	12798	-5.8389	-0.5374	discard	exp#487 mtf_15m_fisher_4h_hma_chop_regime_atr_v1	train
2d19687	mtf_15m_fisher_4h_hma_chop_regime_atr_v1	SOLUSDT	-2.6901	-89.28	-42.91	-92.84	29.1	1.05	12537	-2.8564	-0.4622	discard	exp#487 mtf_15m_fisher_4h_hma_chop_regime_atr_v1	train
c291879	mtf_30m_regime_fisher_chop_4h_1d_hma_atr_v1	BTCUSDT	-6.0623	-87.74	-40.85	-87.75	43.2	0.85	7799	-5.0474	-0.4655	discard	exp#488 mtf_30m_regime_fisher_chop_4h_1d_hma_atr_v1	train
c291879	mtf_30m_regime_fisher_chop_4h_1d_hma_atr_v1	ETHUSDT	-4.6119	-85.89	-38.73	-85.91	43.7	0.92	7648	-3.9037	-0.4508	discard	exp#488 mtf_30m_regime_fisher_chop_4h_1d_hma_atr_v1	train
c291879	mtf_30m_regime_fisher_chop_4h_1d_hma_atr_v1	SOLUSDT	-2.1454	-75.96	-30.08	-78.16	47.6	1.07	7677	-1.8199	-0.3849	discard	exp#488 mtf_30m_regime_fisher_chop_4h_1d_hma_atr_v1	train
c291879	mtf_30m_regime_fisher_chop_4h_1d_hma_atr_v1	BTCUSDT	-6.0623	-87.74	-40.85	-87.75	43.2	0.85	7799	-5.0474	-0.4655	discard	exp#488 mtf_30m_regime_fisher_chop_4h_1d_hma_atr_v1	train
c291879	mtf_30m_regime_fisher_chop_4h_1d_hma_atr_v1	ETHUSDT	-4.6119	-85.89	-38.73	-85.91	43.7	0.92	7648	-3.9037	-0.4508	discard	exp#488 mtf_30m_regime_fisher_chop_4h_1d_hma_atr_v1	train
c291879	mtf_30m_regime_fisher_chop_4h_1d_hma_atr_v1	SOLUSDT	-2.1454	-75.96	-30.08	-78.16	47.6	1.07	7677	-1.8199	-0.3849	discard	exp#488 mtf_30m_regime_fisher_chop_4h_1d_hma_atr_v1	train
5e4d0bc	mtf_1h_crsi_chop_4h_hma_regime_atr_v1	BTCUSDT	-3.0824	-41.23	-12.45	-42.44	61.3	0.95	3333	-1.7981	-0.2934	discard	exp#489 mtf_1h_crsi_chop_4h_hma_regime_atr_v1	train
5e4d0bc	mtf_1h_crsi_chop_4h_hma_regime_atr_v1	ETHUSDT	-2.794	-48.32	-15.22	-50.83	61.2	0.91	3287	-1.5781	-0.2995	discard	exp#489 mtf_1h_crsi_chop_4h_hma_regime_atr_v1	train
5e4d0bc	mtf_1h_crsi_chop_4h_hma_regime_atr_v1	SOLUSDT	-1.3924	-38.62	-11.53	-46.19	62.1	0.98	3402	-0.8555	-0.2497	discard	exp#489 mtf_1h_crsi_chop_4h_hma_regime_atr_v1	train
5e4d0bc	mtf_1h_crsi_chop_4h_hma_regime_atr_v1	BTCUSDT	-3.0824	-41.23	-12.45	-42.44	61.3	0.95	3333	-1.7981	-0.2934	discard	exp#489 mtf_1h_crsi_chop_4h_hma_regime_atr_v1	train
5e4d0bc	mtf_1h_crsi_chop_4h_hma_regime_atr_v1	ETHUSDT	-2.794	-48.32	-15.22	-50.83	61.2	0.91	3287	-1.5781	-0.2995	discard	exp#489 mtf_1h_crsi_chop_4h_hma_regime_atr_v1	train
5e4d0bc	mtf_1h_crsi_chop_4h_hma_regime_atr_v1	SOLUSDT	-1.3924	-38.62	-11.53	-46.19	62.1	0.98	3402	-0.8555	-0.2497	discard	exp#489 mtf_1h_crsi_chop_4h_hma_regime_atr_v1	train
6f75f97	mtf_4h_chop_regime_daily_hma_fisher_atr_v1	BTCUSDT	-0.6136	5.21	1.28	-12.69	44.5	1.29	326	-0.3174	0.1007	discard	exp#490 mtf_4h_chop_regime_daily_hma_fisher_atr_v1	train
6f75f97	mtf_4h_chop_regime_daily_hma_fisher_atr_v1	ETHUSDT	-0.2556	12.03	2.88	-9.54	44.6	1.3	332	-0.1415	0.3022	discard	exp#490 mtf_4h_chop_regime_daily_hma_fisher_atr_v1	train
6f75f97	mtf_4h_chop_regime_daily_hma_fisher_atr_v1	SOLUSDT	-0.1979	8.11	1.98	-15.61	44.1	1.1	281	-0.0981	0.1266	discard	exp#490 mtf_4h_chop_regime_daily_hma_fisher_atr_v1	train
6f75f97	mtf_4h_chop_regime_daily_hma_fisher_atr_v1	BTCUSDT	-0.6136	5.21	1.28	-12.69	44.5	1.29	326	-0.3174	0.1007	discard	exp#490 mtf_4h_chop_regime_daily_hma_fisher_atr_v1	train
