commit	strategy	symbol	sharpe	return_pct	cagr_pct	max_dd_pct	win_rate	profit_factor	trades	sortino	calmar	status	description	period
84c9feb	mtf_15m_rsi_mr_4h_hma_1h_rsi_vol_atr_v1	BTCUSDT	-12.1366	-99.62	-75.26	-99.65	45.9	0.91	23096	-12.3143	-0.7553	discard	exp#391 mtf_15m_rsi_mr_4h_hma_1h_rsi_vol_atr_v1	train
84c9feb	mtf_15m_rsi_mr_4h_hma_1h_rsi_vol_atr_v1	ETHUSDT	-9.5204	-99.59	-74.66	-99.63	47.1	0.94	23384	-9.6465	-0.7494	discard	exp#391 mtf_15m_rsi_mr_4h_hma_1h_rsi_vol_atr_v1	train
84c9feb	mtf_15m_rsi_mr_4h_hma_1h_rsi_vol_atr_v1	SOLUSDT	-4.1286	-97.87	-61.95	-98.38	50.0	1.01	24223	-4.326	-0.6298	discard	exp#391 mtf_15m_rsi_mr_4h_hma_1h_rsi_vol_atr_v1	train
84c9feb	mtf_15m_rsi_mr_4h_hma_1h_rsi_vol_atr_v1	BTCUSDT	-12.1366	-99.62	-75.26	-99.65	45.9	0.91	23096	-12.3143	-0.7553	discard	exp#391 mtf_15m_rsi_mr_4h_hma_1h_rsi_vol_atr_v1	train
84c9feb	mtf_15m_rsi_mr_4h_hma_1h_rsi_vol_atr_v1	ETHUSDT	-9.5204	-99.59	-74.66	-99.63	47.1	0.94	23384	-9.6465	-0.7494	discard	exp#391 mtf_15m_rsi_mr_4h_hma_1h_rsi_vol_atr_v1	train
84c9feb	mtf_15m_rsi_mr_4h_hma_1h_rsi_vol_atr_v1	SOLUSDT	-4.1286	-97.87	-61.95	-98.38	50.0	1.01	24223	-4.326	-0.6298	discard	exp#391 mtf_15m_rsi_mr_4h_hma_1h_rsi_vol_atr_v1	train
5162ea4	mtf_1h_hma_4h_bias_adx_rsi_pullback_atr_v1	BTCUSDT	-2.148	-70.07	-26.05	-71.98	33.9	1.07	4962	-2.7001	-0.3618	discard	exp#393 mtf_1h_hma_4h_bias_adx_rsi_pullback_atr_v1	train
5162ea4	mtf_1h_hma_4h_bias_adx_rsi_pullback_atr_v1	ETHUSDT	-1.7854	-72.87	-27.85	-74.42	34.2	1.04	5000	-2.2162	-0.3742	discard	exp#393 mtf_1h_hma_4h_bias_adx_rsi_pullback_atr_v1	train
5162ea4	mtf_1h_hma_4h_bias_adx_rsi_pullback_atr_v1	SOLUSDT	-0.6419	-56.8	-19.0	-68.33	36.4	1.15	4940	-0.7815	-0.278	discard	exp#393 mtf_1h_hma_4h_bias_adx_rsi_pullback_atr_v1	train
5162ea4	mtf_1h_hma_4h_bias_adx_rsi_pullback_atr_v1	BTCUSDT	-2.148	-70.07	-26.05	-71.98	33.9	1.07	4962	-2.7001	-0.3618	discard	exp#393 mtf_1h_hma_4h_bias_adx_rsi_pullback_atr_v1	train
5162ea4	mtf_1h_hma_4h_bias_adx_rsi_pullback_atr_v1	ETHUSDT	-1.7854	-72.87	-27.85	-74.42	34.2	1.04	5000	-2.2162	-0.3742	discard	exp#393 mtf_1h_hma_4h_bias_adx_rsi_pullback_atr_v1	train
5162ea4	mtf_1h_hma_4h_bias_adx_rsi_pullback_atr_v1	SOLUSDT	-0.6419	-56.8	-19.0	-68.33	36.4	1.15	4940	-0.7815	-0.278	discard	exp#393 mtf_1h_hma_4h_bias_adx_rsi_pullback_atr_v1	train
b27971a	mtf_4h_macd_hist_daily_hma_bollinger_regime_rsi_atr_v1	BTCUSDT	-1.5112	-36.43	-10.71	-45.13	36.8	0.93	1317	-1.3979	-0.2374	discard	exp#394 mtf_4h_macd_hist_daily_hma_bollinger_regime_rsi_atr_v1	train
b27971a	mtf_4h_macd_hist_daily_hma_bollinger_regime_rsi_atr_v1	ETHUSDT	-1.0155	-29.28	-8.3	-30.78	37.9	0.97	1315	-0.9291	-0.2697	discard	exp#394 mtf_4h_macd_hist_daily_hma_bollinger_regime_rsi_atr_v1	train
b27971a	mtf_4h_macd_hist_daily_hma_bollinger_regime_rsi_atr_v1	SOLUSDT	-0.2642	-8.1	-2.1	-28.87	41.8	1.05	1336	-0.25	-0.0726	discard	exp#394 mtf_4h_macd_hist_daily_hma_bollinger_regime_rsi_atr_v1	train
b27971a	mtf_4h_macd_hist_daily_hma_bollinger_regime_rsi_atr_v1	BTCUSDT	-1.5112	-36.43	-10.71	-45.13	36.8	0.93	1317	-1.3979	-0.2374	discard	exp#394 mtf_4h_macd_hist_daily_hma_bollinger_regime_rsi_atr_v1	train
b27971a	mtf_4h_macd_hist_daily_hma_bollinger_regime_rsi_atr_v1	ETHUSDT	-1.0155	-29.28	-8.3	-30.78	37.9	0.97	1315	-0.9291	-0.2697	discard	exp#394 mtf_4h_macd_hist_daily_hma_bollinger_regime_rsi_atr_v1	train
b27971a	mtf_4h_macd_hist_daily_hma_bollinger_regime_rsi_atr_v1	SOLUSDT	-0.2642	-8.1	-2.1	-28.87	41.8	1.05	1336	-0.25	-0.0726	discard	exp#394 mtf_4h_macd_hist_daily_hma_bollinger_regime_rsi_atr_v1	train
3760531	mtf_12h_donchian_daily_hma_adx_rsi_atr_v1	BTCUSDT	-0.6019	-12.45	-3.27	-24.18	37.4	1.06	431	-0.7474	-0.1352	discard	exp#395 mtf_12h_donchian_daily_hma_adx_rsi_atr_v1	train
3760531	mtf_12h_donchian_daily_hma_adx_rsi_atr_v1	ETHUSDT	-0.0828	9.47	2.29	-21.71	34.4	1.23	445	-0.109	0.1054	discard	exp#395 mtf_12h_donchian_daily_hma_adx_rsi_atr_v1	train
3760531	mtf_12h_donchian_daily_hma_adx_rsi_atr_v1	SOLUSDT	0.9982	194.87	31.18	-20.56	39.1	1.46	391	1.3535	1.5161	keep	exp#395 mtf_12h_donchian_daily_hma_adx_rsi_atr_v1	train
3760531	mtf_12h_donchian_daily_hma_adx_rsi_atr_v1	SOLUSDT	0.1576	7.86	6.42	-17.31	41.5	1.24	135	0.2089	0.371	keep	exp#395 mtf_12h_donchian_daily_hma_adx_rsi_atr_v1	test
3760531	mtf_12h_donchian_daily_hma_adx_rsi_atr_v1	BTCUSDT	-0.6019	-12.45	-3.27	-24.18	37.4	1.06	431	-0.7474	-0.1352	discard	exp#395 mtf_12h_donchian_daily_hma_adx_rsi_atr_v1	train
3760531	mtf_12h_donchian_daily_hma_adx_rsi_atr_v1	ETHUSDT	-0.0828	9.47	2.29	-21.71	34.4	1.23	445	-0.109	0.1054	discard	exp#395 mtf_12h_donchian_daily_hma_adx_rsi_atr_v1	train
3760531	mtf_12h_donchian_daily_hma_adx_rsi_atr_v1	SOLUSDT	0.9982	194.87	31.18	-20.56	39.1	1.46	391	1.3535	1.5161	keep	exp#395 mtf_12h_donchian_daily_hma_adx_rsi_atr_v1	train
3760531	mtf_12h_donchian_daily_hma_adx_rsi_atr_v1	SOLUSDT	0.1576	7.86	6.42	-17.31	41.5	1.24	135	0.2089	0.371	keep	exp#395 mtf_12h_donchian_daily_hma_adx_rsi_atr_v1	test
5fc3329	mtf_1d_kama_weekly_hma_chop_regime_rsi_atr_v1	BTCUSDT	-0.5923	-17.42	-4.67	-29.02	32.7	1.2	223	-0.7744	-0.161	discard	exp#396 mtf_1d_kama_weekly_hma_chop_regime_rsi_atr_v1	train
5fc3329	mtf_1d_kama_weekly_hma_chop_regime_rsi_atr_v1	ETHUSDT	-0.6906	-31.11	-8.9	-43.58	32.6	0.97	221	-0.88	-0.2041	discard	exp#396 mtf_1d_kama_weekly_hma_chop_regime_rsi_atr_v1	train
5fc3329	mtf_1d_kama_weekly_hma_chop_regime_rsi_atr_v1	SOLUSDT	0.5164	86.3	16.89	-41.87	36.6	1.72	265	0.7661	0.4035	keep	exp#396 mtf_1d_kama_weekly_hma_chop_regime_rsi_atr_v1	train
5fc3329	mtf_1d_kama_weekly_hma_chop_regime_rsi_atr_v1	SOLUSDT	0.3115	11.94	9.72	-20.22	45.7	1.29	81	0.3601	0.4809	keep	exp#396 mtf_1d_kama_weekly_hma_chop_regime_rsi_atr_v1	test
5fc3329	mtf_1d_kama_weekly_hma_chop_regime_rsi_atr_v1	BTCUSDT	-0.5923	-17.42	-4.67	-29.02	32.7	1.2	223	-0.7744	-0.161	discard	exp#396 mtf_1d_kama_weekly_hma_chop_regime_rsi_atr_v1	train
5fc3329	mtf_1d_kama_weekly_hma_chop_regime_rsi_atr_v1	ETHUSDT	-0.6906	-31.11	-8.9	-43.58	32.6	0.97	221	-0.88	-0.2041	discard	exp#396 mtf_1d_kama_weekly_hma_chop_regime_rsi_atr_v1	train
5fc3329	mtf_1d_kama_weekly_hma_chop_regime_rsi_atr_v1	SOLUSDT	0.5164	86.3	16.89	-41.87	36.6	1.72	265	0.7661	0.4035	keep	exp#396 mtf_1d_kama_weekly_hma_chop_regime_rsi_atr_v1	train
5fc3329	mtf_1d_kama_weekly_hma_chop_regime_rsi_atr_v1	SOLUSDT	0.3115	11.94	9.72	-20.22	45.7	1.29	81	0.3601	0.4809	keep	exp#396 mtf_1d_kama_weekly_hma_chop_regime_rsi_atr_v1	test
8e31114	mtf_15m_supertrend_4h_hma_1h_adx_rsi_pullback_atr_v1	BTCUSDT	-17.1776	-99.96	-86.09	-99.96	33.9	0.84	30759	-20.7997	-0.8612	discard	exp#397 mtf_15m_supertrend_4h_hma_1h_adx_rsi_pullback_atr_v1	train
8e31114	mtf_15m_supertrend_4h_hma_1h_adx_rsi_pullback_atr_v1	ETHUSDT	-4.6846	-93.4	-49.33	-93.97	30.3	1.22	12417	-5.6925	-0.525	discard	exp#397 mtf_15m_supertrend_4h_hma_1h_adx_rsi_pullback_atr_v1	train
8e31114	mtf_15m_supertrend_4h_hma_1h_adx_rsi_pullback_atr_v1	SOLUSDT	-3.5741	-96.85	-58.02	-96.93	35.5	1.14	17343	-4.4163	-0.5986	discard	exp#397 mtf_15m_supertrend_4h_hma_1h_adx_rsi_pullback_atr_v1	train
8e31114	mtf_15m_supertrend_4h_hma_1h_adx_rsi_pullback_atr_v1	BTCUSDT	-17.1776	-99.96	-86.09	-99.96	33.9	0.84	30759	-20.7997	-0.8612	discard	exp#397 mtf_15m_supertrend_4h_hma_1h_adx_rsi_pullback_atr_v1	train
8e31114	mtf_15m_supertrend_4h_hma_1h_adx_rsi_pullback_atr_v1	ETHUSDT	-4.6846	-93.4	-49.33	-93.97	30.3	1.22	12417	-5.6925	-0.525	discard	exp#397 mtf_15m_supertrend_4h_hma_1h_adx_rsi_pullback_atr_v1	train
8e31114	mtf_15m_supertrend_4h_hma_1h_adx_rsi_pullback_atr_v1	SOLUSDT	-3.5741	-96.85	-58.02	-96.93	35.5	1.14	17343	-4.4163	-0.5986	discard	exp#397 mtf_15m_supertrend_4h_hma_1h_adx_rsi_pullback_atr_v1	train
812e911	mtf_30m_supertrend_4h_hma_rsi_momentum_atr_v1	BTCUSDT	-3.0019	-87.81	-40.94	-88.71	27.9	1.26	6732	-3.9934	-0.4615	discard	exp#398 mtf_30m_supertrend_4h_hma_rsi_momentum_atr_v1	train
812e911	mtf_30m_supertrend_4h_hma_rsi_momentum_atr_v1	ETHUSDT	-2.5001	-89.5	-43.1	-89.73	28.0	1.3	6895	-3.3573	-0.4803	discard	exp#398 mtf_30m_supertrend_4h_hma_rsi_momentum_atr_v1	train
812e911	mtf_30m_supertrend_4h_hma_rsi_momentum_atr_v1	SOLUSDT	-1.3907	-88.47	-41.85	-91.81	30.7	1.38	6939	-1.8484	-0.4559	discard	exp#398 mtf_30m_supertrend_4h_hma_rsi_momentum_atr_v1	train
812e911	mtf_30m_supertrend_4h_hma_rsi_momentum_atr_v1	BTCUSDT	-3.0019	-87.81	-40.94	-88.71	27.9	1.26	6732	-3.9934	-0.4615	discard	exp#398 mtf_30m_supertrend_4h_hma_rsi_momentum_atr_v1	train
812e911	mtf_30m_supertrend_4h_hma_rsi_momentum_atr_v1	ETHUSDT	-2.5001	-89.5	-43.1	-89.73	28.0	1.3	6895	-3.3573	-0.4803	discard	exp#398 mtf_30m_supertrend_4h_hma_rsi_momentum_atr_v1	train
812e911	mtf_30m_supertrend_4h_hma_rsi_momentum_atr_v1	SOLUSDT	-1.3907	-88.47	-41.85	-91.81	30.7	1.38	6939	-1.8484	-0.4559	discard	exp#398 mtf_30m_supertrend_4h_hma_rsi_momentum_atr_v1	train
4ae693b	mtf_1h_fisher_4h_hma_volume_atr_v1	BTCUSDT	-3.0704	-71.95	-27.24	-72.82	36.4	0.97	5915	-3.3712	-0.3741	discard	exp#399 mtf_1h_fisher_4h_hma_volume_atr_v1	train
4ae693b	mtf_1h_fisher_4h_hma_volume_atr_v1	ETHUSDT	-2.8491	-78.43	-31.87	-78.88	37.2	0.97	6228	-3.1792	-0.404	discard	exp#399 mtf_1h_fisher_4h_hma_volume_atr_v1	train
4ae693b	mtf_1h_fisher_4h_hma_volume_atr_v1	SOLUSDT	-1.5418	-76.7	-30.63	-79.72	39.6	1.04	6127	-1.691	-0.3842	discard	exp#399 mtf_1h_fisher_4h_hma_volume_atr_v1	train
4ae693b	mtf_1h_fisher_4h_hma_volume_atr_v1	BTCUSDT	-3.0704	-71.95	-27.24	-72.82	36.4	0.97	5915	-3.3712	-0.3741	discard	exp#399 mtf_1h_fisher_4h_hma_volume_atr_v1	train
4ae693b	mtf_1h_fisher_4h_hma_volume_atr_v1	ETHUSDT	-2.8491	-78.43	-31.87	-78.88	37.2	0.97	6228	-3.1792	-0.404	discard	exp#399 mtf_1h_fisher_4h_hma_volume_atr_v1	train
4ae693b	mtf_1h_fisher_4h_hma_volume_atr_v1	SOLUSDT	-1.5418	-76.7	-30.63	-79.72	39.6	1.04	6127	-1.691	-0.3842	discard	exp#399 mtf_1h_fisher_4h_hma_volume_atr_v1	train
a76f536	mtf_12h_donchian_daily_hma_rsi_atr_v2	BTCUSDT	-0.2045	13.93	3.31	-9.58	41.1	1.24	309	-0.1791	0.3459	discard	exp#401 mtf_12h_donchian_daily_hma_rsi_atr_v2	train
a76f536	mtf_12h_donchian_daily_hma_rsi_atr_v2	ETHUSDT	-0.4274	2.32	0.58	-13.98	37.8	1.09	307	-0.3585	0.0412	discard	exp#401 mtf_12h_donchian_daily_hma_rsi_atr_v2	train
a76f536	mtf_12h_donchian_daily_hma_rsi_atr_v2	SOLUSDT	0.1781	29.84	6.77	-24.19	41.2	1.26	274	0.1379	0.28	keep	exp#401 mtf_12h_donchian_daily_hma_rsi_atr_v2	train
a76f536	mtf_12h_donchian_daily_hma_rsi_atr_v2	SOLUSDT	-0.2708	2.64	2.17	-8.05	44.2	1.12	86	-0.2083	0.2692	discard	exp#401 mtf_12h_donchian_daily_hma_rsi_atr_v2	test
a76f536	mtf_12h_donchian_daily_hma_rsi_atr_v2	BTCUSDT	-0.2045	13.93	3.31	-9.58	41.1	1.24	309	-0.1791	0.3459	discard	exp#401 mtf_12h_donchian_daily_hma_rsi_atr_v2	train
a76f536	mtf_12h_donchian_daily_hma_rsi_atr_v2	ETHUSDT	-0.4274	2.32	0.58	-13.98	37.8	1.09	307	-0.3585	0.0412	discard	exp#401 mtf_12h_donchian_daily_hma_rsi_atr_v2	train
a76f536	mtf_12h_donchian_daily_hma_rsi_atr_v2	SOLUSDT	0.1781	29.84	6.77	-24.19	41.2	1.26	274	0.1379	0.28	discard	exp#401 mtf_12h_donchian_daily_hma_rsi_atr_v2	train
3545fca	mtf_15m_crsi_4h_hma_chop_regime_atr_v1	BTCUSDT	-15.4887	-99.71	-76.91	-99.72	54.9	0.86	25544	-12.6453	-0.7713	discard	exp#403 mtf_15m_crsi_4h_hma_chop_regime_atr_v1	train
3545fca	mtf_15m_crsi_4h_hma_chop_regime_atr_v1	ETHUSDT	-12.8724	-99.77	-78.19	-99.78	56.8	0.84	25243	-10.5202	-0.7836	discard	exp#403 mtf_15m_crsi_4h_hma_chop_regime_atr_v1	train
3545fca	mtf_15m_crsi_4h_hma_chop_regime_atr_v1	SOLUSDT	-7.7514	-99.71	-76.98	-99.73	61.5	0.85	24648	-6.4532	-0.7719	discard	exp#403 mtf_15m_crsi_4h_hma_chop_regime_atr_v1	train
3545fca	mtf_15m_crsi_4h_hma_chop_regime_atr_v1	BTCUSDT	-15.4887	-99.71	-76.91	-99.72	54.9	0.86	25544	-12.6453	-0.7713	discard	exp#403 mtf_15m_crsi_4h_hma_chop_regime_atr_v1	train
3545fca	mtf_15m_crsi_4h_hma_chop_regime_atr_v1	ETHUSDT	-12.8724	-99.77	-78.19	-99.78	56.8	0.84	25243	-10.5202	-0.7836	discard	exp#403 mtf_15m_crsi_4h_hma_chop_regime_atr_v1	train
3545fca	mtf_15m_crsi_4h_hma_chop_regime_atr_v1	SOLUSDT	-7.7514	-99.71	-76.98	-99.73	61.5	0.85	24648	-6.4532	-0.7719	discard	exp#403 mtf_15m_crsi_4h_hma_chop_regime_atr_v1	train
7975514	mtf_30m_supertrend_4h_hma_rsi_adx_atr_v2	BTCUSDT	-4.0505	-89.21	-42.71	-89.35	33.7	1.07	7269	-5.0825	-0.478	discard	exp#404 mtf_30m_supertrend_4h_hma_rsi_adx_atr_v2	train
7975514	mtf_30m_supertrend_4h_hma_rsi_adx_atr_v2	ETHUSDT	-3.1025	-88.82	-42.2	-89.17	34.6	1.09	7399	-3.9522	-0.4733	discard	exp#404 mtf_30m_supertrend_4h_hma_rsi_adx_atr_v2	train
7975514	mtf_30m_supertrend_4h_hma_rsi_adx_atr_v2	SOLUSDT	-0.5627	-45.56	-14.16	-62.37	40.7	1.23	8326	-0.7567	-0.227	discard	exp#404 mtf_30m_supertrend_4h_hma_rsi_adx_atr_v2	train
7975514	mtf_30m_supertrend_4h_hma_rsi_adx_atr_v2	BTCUSDT	-4.0505	-89.21	-42.71	-89.35	33.7	1.07	7269	-5.0825	-0.478	discard	exp#404 mtf_30m_supertrend_4h_hma_rsi_adx_atr_v2	train
7975514	mtf_30m_supertrend_4h_hma_rsi_adx_atr_v2	ETHUSDT	-3.1025	-88.82	-42.2	-89.17	34.6	1.09	7399	-3.9522	-0.4733	discard	exp#404 mtf_30m_supertrend_4h_hma_rsi_adx_atr_v2	train
7975514	mtf_30m_supertrend_4h_hma_rsi_adx_atr_v2	SOLUSDT	-0.5627	-45.56	-14.16	-62.37	40.7	1.23	8326	-0.7567	-0.227	discard	exp#404 mtf_30m_supertrend_4h_hma_rsi_adx_atr_v2	train
f9aa7bf	mtf_1h_fisher_4h_hma_adx_trend_atr_v1	BTCUSDT	-4.758	-87.2	-40.21	-87.47	29.2	0.83	6975	-5.7343	-0.4597	discard	exp#405 mtf_1h_fisher_4h_hma_adx_trend_atr_v1	train
f9aa7bf	mtf_1h_fisher_4h_hma_adx_trend_atr_v1	ETHUSDT	-3.2634	-82.93	-35.74	-82.99	30.6	0.91	6930	-3.9616	-0.4307	discard	exp#405 mtf_1h_fisher_4h_hma_adx_trend_atr_v1	train
f9aa7bf	mtf_1h_fisher_4h_hma_adx_trend_atr_v1	SOLUSDT	-1.5747	-75.22	-29.54	-83.04	33.8	1.0	6912	-1.8249	-0.3558	discard	exp#405 mtf_1h_fisher_4h_hma_adx_trend_atr_v1	train
f9aa7bf	mtf_1h_fisher_4h_hma_adx_trend_atr_v1	BTCUSDT	-4.758	-87.2	-40.21	-87.47	29.2	0.83	6975	-5.7343	-0.4597	discard	exp#405 mtf_1h_fisher_4h_hma_adx_trend_atr_v1	train
f9aa7bf	mtf_1h_fisher_4h_hma_adx_trend_atr_v1	ETHUSDT	-3.2634	-82.93	-35.74	-82.99	30.6	0.91	6930	-3.9616	-0.4307	discard	exp#405 mtf_1h_fisher_4h_hma_adx_trend_atr_v1	train
f9aa7bf	mtf_1h_fisher_4h_hma_adx_trend_atr_v1	SOLUSDT	-1.5747	-75.22	-29.54	-83.04	33.8	1.0	6912	-1.8249	-0.3558	discard	exp#405 mtf_1h_fisher_4h_hma_adx_trend_atr_v1	train
cbc3270	mtf_4h_kama_daily_hma_bbw_regime_zscore_atr_v1	BTCUSDT	-0.2935	0.35	0.09	-17.84	28.4	1.53	638	-0.3581	0.0049	discard	exp#406 mtf_4h_kama_daily_hma_bbw_regime_zscore_atr_v1	train
cbc3270	mtf_4h_kama_daily_hma_bbw_regime_zscore_atr_v1	ETHUSDT	0.2222	34.12	7.62	-16.33	30.1	1.78	637	0.2751	0.4666	keep	exp#406 mtf_4h_kama_daily_hma_bbw_regime_zscore_atr_v1	train
cbc3270	mtf_4h_kama_daily_hma_bbw_regime_zscore_atr_v1	ETHUSDT	-0.5001	-4.86	-4.02	-16.54	27.4	1.38	215	-0.6329	-0.2427	discard	exp#406 mtf_4h_kama_daily_hma_bbw_regime_zscore_atr_v1	test
cbc3270	mtf_4h_kama_daily_hma_bbw_regime_zscore_atr_v1	SOLUSDT	0.8379	160.51	27.17	-27.22	31.3	1.99	617	1.0853	0.998	keep	exp#406 mtf_4h_kama_daily_hma_bbw_regime_zscore_atr_v1	train
cbc3270	mtf_4h_kama_daily_hma_bbw_regime_zscore_atr_v1	SOLUSDT	-0.2756	-2.04	-1.68	-22.08	34.8	1.45	210	-0.358	-0.0763	discard	exp#406 mtf_4h_kama_daily_hma_bbw_regime_zscore_atr_v1	test
cbc3270	mtf_4h_kama_daily_hma_bbw_regime_zscore_atr_v1	BTCUSDT	-0.2935	0.35	0.09	-17.84	28.4	1.53	638	-0.3581	0.0049	discard	exp#406 mtf_4h_kama_daily_hma_bbw_regime_zscore_atr_v1	train
cbc3270	mtf_4h_kama_daily_hma_bbw_regime_zscore_atr_v1	ETHUSDT	0.2222	34.12	7.62	-16.33	30.1	1.78	637	0.2751	0.4666	discard	exp#406 mtf_4h_kama_daily_hma_bbw_regime_zscore_atr_v1	train
cbc3270	mtf_4h_kama_daily_hma_bbw_regime_zscore_atr_v1	SOLUSDT	0.8379	160.51	27.17	-27.22	31.3	1.99	617	1.0853	0.998	discard	exp#406 mtf_4h_kama_daily_hma_bbw_regime_zscore_atr_v1	train
dcadb35	mtf_1d_fisher_weekly_hma_rsi_momentum_atr_v1	BTCUSDT	-0.2806	1.5	0.37	-29.36	35.7	1.36	249	-0.356	0.0127	discard	exp#408 mtf_1d_fisher_weekly_hma_rsi_momentum_atr_v1	train
dcadb35	mtf_1d_fisher_weekly_hma_rsi_momentum_atr_v1	ETHUSDT	-0.7035	-27.55	-7.74	-45.52	31.2	1.01	253	-0.8051	-0.1701	discard	exp#408 mtf_1d_fisher_weekly_hma_rsi_momentum_atr_v1	train
dcadb35	mtf_1d_fisher_weekly_hma_rsi_momentum_atr_v1	SOLUSDT	0.896	171.27	28.45	-27.05	35.3	2.39	255	1.2877	1.0516	keep	exp#408 mtf_1d_fisher_weekly_hma_rsi_momentum_atr_v1	train
dcadb35	mtf_1d_fisher_weekly_hma_rsi_momentum_atr_v1	SOLUSDT	0.3767	12.69	10.33	-17.39	40.5	1.42	84	0.4457	0.5939	keep	exp#408 mtf_1d_fisher_weekly_hma_rsi_momentum_atr_v1	test
dcadb35	mtf_1d_fisher_weekly_hma_rsi_momentum_atr_v1	BTCUSDT	-0.2806	1.5	0.37	-29.36	35.7	1.36	249	-0.356	0.0127	discard	exp#408 mtf_1d_fisher_weekly_hma_rsi_momentum_atr_v1	train
dcadb35	mtf_1d_fisher_weekly_hma_rsi_momentum_atr_v1	ETHUSDT	-0.7035	-27.55	-7.74	-45.52	31.2	1.01	253	-0.8051	-0.1701	discard	exp#408 mtf_1d_fisher_weekly_hma_rsi_momentum_atr_v1	train
dcadb35	mtf_1d_fisher_weekly_hma_rsi_momentum_atr_v1	SOLUSDT	0.896	171.27	28.45	-27.05	35.3	2.39	255	1.2877	1.0516	keep	exp#408 mtf_1d_fisher_weekly_hma_rsi_momentum_atr_v1	train
dcadb35	mtf_1d_fisher_weekly_hma_rsi_momentum_atr_v1	SOLUSDT	0.3767	12.69	10.33	-17.39	40.5	1.42	84	0.4457	0.5939	keep	exp#408 mtf_1d_fisher_weekly_hma_rsi_momentum_atr_v1	test
9c7bad6	mtf_30m_hma_trend_4h_regime_rsi_pullback_adx_atr_v1	BTCUSDT	-4.5059	-87.52	-40.59	-87.72	42.9	1.02	7838	-4.607	-0.4627	discard	exp#410 mtf_30m_hma_trend_4h_regime_rsi_pullback_adx_atr_v1	train
9c7bad6	mtf_30m_hma_trend_4h_regime_rsi_pullback_adx_atr_v1	ETHUSDT	-3.4335	-87.3	-40.32	-87.8	43.8	1.03	7861	-3.5055	-0.4593	discard	exp#410 mtf_30m_hma_trend_4h_regime_rsi_pullback_adx_atr_v1	train
9c7bad6	mtf_30m_hma_trend_4h_regime_rsi_pullback_adx_atr_v1	SOLUSDT	-1.8039	-82.61	-35.54	-83.47	47.3	1.16	7818	-1.8082	-0.4258	discard	exp#410 mtf_30m_hma_trend_4h_regime_rsi_pullback_adx_atr_v1	train
9c7bad6	mtf_30m_hma_trend_4h_regime_rsi_pullback_adx_atr_v1	BTCUSDT	-4.5059	-87.52	-40.59	-87.72	42.9	1.02	7838	-4.607	-0.4627	discard	exp#410 mtf_30m_hma_trend_4h_regime_rsi_pullback_adx_atr_v1	train
9c7bad6	mtf_30m_hma_trend_4h_regime_rsi_pullback_adx_atr_v1	ETHUSDT	-3.4335	-87.3	-40.32	-87.8	43.8	1.03	7861	-3.5055	-0.4593	discard	exp#410 mtf_30m_hma_trend_4h_regime_rsi_pullback_adx_atr_v1	train
9c7bad6	mtf_30m_hma_trend_4h_regime_rsi_pullback_adx_atr_v1	SOLUSDT	-1.8039	-82.61	-35.54	-83.47	47.3	1.16	7818	-1.8082	-0.4258	discard	exp#410 mtf_30m_hma_trend_4h_regime_rsi_pullback_adx_atr_v1	train
edbaa51	mtf_1h_supertrend_4h_hma_rsi_pullback_volume_atr_v1	BTCUSDT	-3.6715	-78.84	-32.2	-79.35	44.6	0.91	6434	-4.0666	-0.4057	discard	exp#411 mtf_1h_supertrend_4h_hma_rsi_pullback_volume_atr_v1	train
edbaa51	mtf_1h_supertrend_4h_hma_rsi_pullback_volume_atr_v1	ETHUSDT	-2.7606	-77.6	-31.22	-79.05	45.3	0.98	6578	-3.1723	-0.3949	discard	exp#411 mtf_1h_supertrend_4h_hma_rsi_pullback_volume_atr_v1	train
edbaa51	mtf_1h_supertrend_4h_hma_rsi_pullback_volume_atr_v1	SOLUSDT	-1.5673	-76.69	-30.62	-79.6	46.4	1.0	6493	-1.7227	-0.3846	discard	exp#411 mtf_1h_supertrend_4h_hma_rsi_pullback_volume_atr_v1	train
edbaa51	mtf_1h_supertrend_4h_hma_rsi_pullback_volume_atr_v1	BTCUSDT	-3.6715	-78.84	-32.2	-79.35	44.6	0.91	6434	-4.0666	-0.4057	discard	exp#411 mtf_1h_supertrend_4h_hma_rsi_pullback_volume_atr_v1	train
edbaa51	mtf_1h_supertrend_4h_hma_rsi_pullback_volume_atr_v1	ETHUSDT	-2.7606	-77.6	-31.22	-79.05	45.3	0.98	6578	-3.1723	-0.3949	discard	exp#411 mtf_1h_supertrend_4h_hma_rsi_pullback_volume_atr_v1	train
edbaa51	mtf_1h_supertrend_4h_hma_rsi_pullback_volume_atr_v1	SOLUSDT	-1.5673	-76.69	-30.62	-79.6	46.4	1.0	6493	-1.7227	-0.3846	discard	exp#411 mtf_1h_supertrend_4h_hma_rsi_pullback_volume_atr_v1	train
7751e6c	mtf_4h_kama_daily_hma_rsi_pullback_atr_v1	BTCUSDT	-0.409	-7.04	-1.81	-33.74	28.5	1.41	887	-0.5341	-0.0537	discard	exp#412 mtf_4h_kama_daily_hma_rsi_pullback_atr_v1	train
7751e6c	mtf_4h_kama_daily_hma_rsi_pullback_atr_v1	ETHUSDT	-0.1682	1.56	0.39	-27.56	28.8	1.45	891	-0.2217	0.0141	discard	exp#412 mtf_4h_kama_daily_hma_rsi_pullback_atr_v1	train
7751e6c	mtf_4h_kama_daily_hma_rsi_pullback_atr_v1	SOLUSDT	0.6426	114.59	21.12	-30.5	31.8	1.73	830	0.8799	0.6926	keep	exp#412 mtf_4h_kama_daily_hma_rsi_pullback_atr_v1	train
7751e6c	mtf_4h_kama_daily_hma_rsi_pullback_atr_v1	SOLUSDT	-0.5206	-7.67	-6.36	-30.15	26.4	1.28	314	-0.7323	-0.2109	discard	exp#412 mtf_4h_kama_daily_hma_rsi_pullback_atr_v1	test
7751e6c	mtf_4h_kama_daily_hma_rsi_pullback_atr_v1	BTCUSDT	-0.409	-7.04	-1.81	-33.74	28.5	1.41	887	-0.5341	-0.0537	discard	exp#412 mtf_4h_kama_daily_hma_rsi_pullback_atr_v1	train
7751e6c	mtf_4h_kama_daily_hma_rsi_pullback_atr_v1	ETHUSDT	-0.1682	1.56	0.39	-27.56	28.8	1.45	891	-0.2217	0.0141	discard	exp#412 mtf_4h_kama_daily_hma_rsi_pullback_atr_v1	train
7751e6c	mtf_4h_kama_daily_hma_rsi_pullback_atr_v1	SOLUSDT	0.6426	114.59	21.12	-30.5	31.8	1.73	830	0.8799	0.6926	discard	exp#412 mtf_4h_kama_daily_hma_rsi_pullback_atr_v1	train
003a52b	mtf_12h_supertrend_daily_hma_rsi_pullback_atr_v3	BTCUSDT	0.0	0.0	0.0	0.0	0.0	0.0	0	0.0	0.0	discard	exp#413 mtf_12h_supertrend_daily_hma_rsi_pullback_atr_v3	train
003a52b	mtf_12h_supertrend_daily_hma_rsi_pullback_atr_v3	ETHUSDT	0.0	0.0	0.0	0.0	0.0	0.0	0	0.0	0.0	discard	exp#413 mtf_12h_supertrend_daily_hma_rsi_pullback_atr_v3	train
003a52b	mtf_12h_supertrend_daily_hma_rsi_pullback_atr_v3	SOLUSDT	0.0	0.0	0.0	0.0	0.0	0.0	0	0.0	0.0	discard	exp#413 mtf_12h_supertrend_daily_hma_rsi_pullback_atr_v3	train
003a52b	mtf_12h_supertrend_daily_hma_rsi_pullback_atr_v3	BTCUSDT	0.0	0.0	0.0	0.0	0.0	0.0	0	0.0	0.0	discard	exp#413 mtf_12h_supertrend_daily_hma_rsi_pullback_atr_v3	train
003a52b	mtf_12h_supertrend_daily_hma_rsi_pullback_atr_v3	ETHUSDT	0.0	0.0	0.0	0.0	0.0	0.0	0	0.0	0.0	discard	exp#413 mtf_12h_supertrend_daily_hma_rsi_pullback_atr_v3	train
003a52b	mtf_12h_supertrend_daily_hma_rsi_pullback_atr_v3	SOLUSDT	0.0	0.0	0.0	0.0	0.0	0.0	0	0.0	0.0	discard	exp#413 mtf_12h_supertrend_daily_hma_rsi_pullback_atr_v3	train
0a3cffd	mtf_1d_donchian_4h_hma_rsi_momentum_atr_v1	BTCUSDT	-0.9018	-18.59	-5.01	-23.27	28.5	0.92	417	-1.0881	-0.2154	discard	exp#414 mtf_1d_donchian_4h_hma_rsi_momentum_atr_v1	train
