commit	strategy	symbol	sharpe	return_pct	cagr_pct	max_dd_pct	win_rate	profit_factor	trades	sortino	calmar	status	description	period
d19e40f	mtf_4h_donchian_volume_1d_1w_hma_rsi_pullback_v1	SOLUSDT	0.3428	36.14	8.05	-9.36	51.4	1.43	276	0.1476	0.8602	discard	exp#136 mtf_4h_donchian_volume_1d_1w_hma_rsi_pullback_v1	train
857008c	mtf_12h_crsi_daily_hma_volume_v1	BTCUSDT	-2.6215	-4.24	-1.08	-5.84	58.3	0.6	24	-0.3666	-0.1844	discard	exp#137 mtf_12h_crsi_daily_hma_volume_v1	train
857008c	mtf_12h_crsi_daily_hma_volume_v1	ETHUSDT	-3.6502	-1.43	-0.36	-3.0	46.7	0.74	15	-0.4194	-0.1201	discard	exp#137 mtf_12h_crsi_daily_hma_volume_v1	train
857008c	mtf_12h_crsi_daily_hma_volume_v1	SOLUSDT	-1.0406	9.11	2.21	-2.65	83.3	3.16	18	-0.1562	0.8356	discard	exp#137 mtf_12h_crsi_daily_hma_volume_v1	train
857008c	mtf_12h_crsi_daily_hma_volume_v1	BTCUSDT	-2.6215	-4.24	-1.08	-5.84	58.3	0.6	24	-0.3666	-0.1844	discard	exp#137 mtf_12h_crsi_daily_hma_volume_v1	train
857008c	mtf_12h_crsi_daily_hma_volume_v1	ETHUSDT	-3.6502	-1.43	-0.36	-3.0	46.7	0.74	15	-0.4194	-0.1201	discard	exp#137 mtf_12h_crsi_daily_hma_volume_v1	train
857008c	mtf_12h_crsi_daily_hma_volume_v1	SOLUSDT	-1.0406	9.11	2.21	-2.65	83.3	3.16	18	-0.1562	0.8356	discard	exp#137 mtf_12h_crsi_daily_hma_volume_v1	train
dc33f91	mtf_1d_donchian_weekly_hma_rsi_atr_v1	BTCUSDT	-1.9658	-3.02	-0.76	-6.87	44.4	0.83	36	-0.6094	-0.1113	discard	exp#138 mtf_1d_donchian_weekly_hma_rsi_atr_v1	train
dc33f91	mtf_1d_donchian_weekly_hma_rsi_atr_v1	ETHUSDT	-1.7516	-5.91	-1.51	-7.58	32.3	0.68	31	-0.5444	-0.1994	discard	exp#138 mtf_1d_donchian_weekly_hma_rsi_atr_v1	train
dc33f91	mtf_1d_donchian_weekly_hma_rsi_atr_v1	SOLUSDT	0.6638	53.93	11.43	-4.33	71.0	6.16	31	0.6797	2.6386	keep	exp#138 mtf_1d_donchian_weekly_hma_rsi_atr_v1	train
dc33f91	mtf_1d_donchian_weekly_hma_rsi_atr_v1	SOLUSDT	-2.3638	-0.69	-0.57	-2.84	33.3	0.84	6	-0.5944	-0.1998	discard	exp#138 mtf_1d_donchian_weekly_hma_rsi_atr_v1	test
dc33f91	mtf_1d_donchian_weekly_hma_rsi_atr_v1	BTCUSDT	-1.9658	-3.02	-0.76	-6.87	44.4	0.83	36	-0.6094	-0.1113	discard	exp#138 mtf_1d_donchian_weekly_hma_rsi_atr_v1	train
dc33f91	mtf_1d_donchian_weekly_hma_rsi_atr_v1	ETHUSDT	-1.7516	-5.91	-1.51	-7.58	32.3	0.68	31	-0.5444	-0.1994	discard	exp#138 mtf_1d_donchian_weekly_hma_rsi_atr_v1	train
dc33f91	mtf_1d_donchian_weekly_hma_rsi_atr_v1	SOLUSDT	0.6638	53.93	11.43	-4.33	71.0	6.16	31	0.6797	2.6386	discard	exp#138 mtf_1d_donchian_weekly_hma_rsi_atr_v1	train
784b04a	mtf_15m_supertrend_4h_hma_rsi_pullback_v1	BTCUSDT	-7.8363	-90.13	-43.97	-90.25	26.4	0.84	9126	-6.1193	-0.4872	discard	exp#139 mtf_15m_supertrend_4h_hma_rsi_pullback_v1	train
784b04a	mtf_15m_supertrend_4h_hma_rsi_pullback_v1	ETHUSDT	-6.3629	-89.16	-42.64	-89.27	27.8	0.9	9158	-4.828	-0.4776	discard	exp#139 mtf_15m_supertrend_4h_hma_rsi_pullback_v1	train
784b04a	mtf_15m_supertrend_4h_hma_rsi_pullback_v1	SOLUSDT	-2.8449	-80.78	-33.9	-87.7	31.2	1.03	8877	-2.1304	-0.3866	discard	exp#139 mtf_15m_supertrend_4h_hma_rsi_pullback_v1	train
784b04a	mtf_15m_supertrend_4h_hma_rsi_pullback_v1	BTCUSDT	-7.8363	-90.13	-43.97	-90.25	26.4	0.84	9126	-6.1193	-0.4872	discard	exp#139 mtf_15m_supertrend_4h_hma_rsi_pullback_v1	train
784b04a	mtf_15m_supertrend_4h_hma_rsi_pullback_v1	ETHUSDT	-6.3629	-89.16	-42.64	-89.27	27.8	0.9	9158	-4.828	-0.4776	discard	exp#139 mtf_15m_supertrend_4h_hma_rsi_pullback_v1	train
784b04a	mtf_15m_supertrend_4h_hma_rsi_pullback_v1	SOLUSDT	-2.8449	-80.78	-33.9	-87.7	31.2	1.03	8877	-2.1304	-0.3866	discard	exp#139 mtf_15m_supertrend_4h_hma_rsi_pullback_v1	train
249d03b	mtf_30m_fisher_4h_hma_rsi_reversal_v1	BTCUSDT	-7.49	-80.63	-33.68	-81.11	40.6	0.8	5943	-4.4757	-0.4152	discard	exp#140 mtf_30m_fisher_4h_hma_rsi_reversal_v1	train
249d03b	mtf_30m_fisher_4h_hma_rsi_reversal_v1	ETHUSDT	-5.7424	-80.43	-33.5	-80.76	42.8	0.82	5850	-3.2744	-0.4149	discard	exp#140 mtf_30m_fisher_4h_hma_rsi_reversal_v1	train
249d03b	mtf_30m_fisher_4h_hma_rsi_reversal_v1	SOLUSDT	-3.0979	-72.27	-27.53	-75.81	46.1	0.97	6045	-1.8814	-0.3632	discard	exp#140 mtf_30m_fisher_4h_hma_rsi_reversal_v1	train
249d03b	mtf_30m_fisher_4h_hma_rsi_reversal_v1	BTCUSDT	-7.49	-80.63	-33.68	-81.11	40.6	0.8	5943	-4.4757	-0.4152	discard	exp#140 mtf_30m_fisher_4h_hma_rsi_reversal_v1	train
249d03b	mtf_30m_fisher_4h_hma_rsi_reversal_v1	ETHUSDT	-5.7424	-80.43	-33.5	-80.76	42.8	0.82	5850	-3.2744	-0.4149	discard	exp#140 mtf_30m_fisher_4h_hma_rsi_reversal_v1	train
249d03b	mtf_30m_fisher_4h_hma_rsi_reversal_v1	SOLUSDT	-3.0979	-72.27	-27.53	-75.81	46.1	0.97	6045	-1.8814	-0.3632	discard	exp#140 mtf_30m_fisher_4h_hma_rsi_reversal_v1	train
68eac4f	mtf_1h_fisher_4h_hma_rsi_v1	BTCUSDT	-2.3004	-59.88	-20.42	-60.76	28.2	1.0	4019	-2.7116	-0.3362	discard	exp#141 mtf_1h_fisher_4h_hma_rsi_v1	train
68eac4f	mtf_1h_fisher_4h_hma_rsi_v1	ETHUSDT	-2.1188	-66.71	-24.06	-67.01	29.7	0.97	4066	-2.4238	-0.359	discard	exp#141 mtf_1h_fisher_4h_hma_rsi_v1	train
68eac4f	mtf_1h_fisher_4h_hma_rsi_v1	SOLUSDT	-0.5879	-38.6	-11.52	-52.73	32.8	1.1	4041	-0.6575	-0.2185	discard	exp#141 mtf_1h_fisher_4h_hma_rsi_v1	train
68eac4f	mtf_1h_fisher_4h_hma_rsi_v1	BTCUSDT	-2.3004	-59.88	-20.42	-60.76	28.2	1.0	4019	-2.7116	-0.3362	discard	exp#141 mtf_1h_fisher_4h_hma_rsi_v1	train
68eac4f	mtf_1h_fisher_4h_hma_rsi_v1	ETHUSDT	-2.1188	-66.71	-24.06	-67.01	29.7	0.97	4066	-2.4238	-0.359	discard	exp#141 mtf_1h_fisher_4h_hma_rsi_v1	train
68eac4f	mtf_1h_fisher_4h_hma_rsi_v1	SOLUSDT	-0.5879	-38.6	-11.52	-52.73	32.8	1.1	4041	-0.6575	-0.2185	discard	exp#141 mtf_1h_fisher_4h_hma_rsi_v1	train
c3411f1	mtf_4h_vol_breakout_daily_weekly_hma_v1	BTCUSDT	-3.0647	1.17	0.29	-3.16	42.9	1.29	98	-0.7848	0.0921	discard	exp#142 mtf_4h_vol_breakout_daily_weekly_hma_v1	train
c3411f1	mtf_4h_vol_breakout_daily_weekly_hma_v1	ETHUSDT	-3.1582	-5.1	-1.3	-5.69	40.2	0.76	107	-0.6162	-0.2287	discard	exp#142 mtf_4h_vol_breakout_daily_weekly_hma_v1	train
c3411f1	mtf_4h_vol_breakout_daily_weekly_hma_v1	SOLUSDT	-1.3724	1.73	0.43	-6.49	50.0	1.14	108	-0.2606	0.0664	discard	exp#142 mtf_4h_vol_breakout_daily_weekly_hma_v1	train
c3411f1	mtf_4h_vol_breakout_daily_weekly_hma_v1	BTCUSDT	-3.0647	1.17	0.29	-3.16	42.9	1.29	98	-0.7848	0.0921	discard	exp#142 mtf_4h_vol_breakout_daily_weekly_hma_v1	train
c3411f1	mtf_4h_vol_breakout_daily_weekly_hma_v1	ETHUSDT	-3.1582	-5.1	-1.3	-5.69	40.2	0.76	107	-0.6162	-0.2287	discard	exp#142 mtf_4h_vol_breakout_daily_weekly_hma_v1	train
c3411f1	mtf_4h_vol_breakout_daily_weekly_hma_v1	SOLUSDT	-1.3724	1.73	0.43	-6.49	50.0	1.14	108	-0.2606	0.0664	discard	exp#142 mtf_4h_vol_breakout_daily_weekly_hma_v1	train
cae3100	mtf_12h_donchian_daily_weekly_hma_rsi_pullback_v1	BTCUSDT	-1.8068	-3.17	-0.8	-6.33	46.5	0.89	71	-0.4967	-0.1268	discard	exp#143 mtf_12h_donchian_daily_weekly_hma_rsi_pullback_v1	train
cae3100	mtf_12h_donchian_daily_weekly_hma_rsi_pullback_v1	ETHUSDT	-0.6042	11.24	2.7	-3.03	58.5	1.86	65	-0.2021	0.8926	discard	exp#143 mtf_12h_donchian_daily_weekly_hma_rsi_pullback_v1	train
cae3100	mtf_12h_donchian_daily_weekly_hma_rsi_pullback_v1	SOLUSDT	-0.9564	3.67	0.91	-10.39	45.0	1.19	80	-0.3847	0.0874	discard	exp#143 mtf_12h_donchian_daily_weekly_hma_rsi_pullback_v1	train
cae3100	mtf_12h_donchian_daily_weekly_hma_rsi_pullback_v1	BTCUSDT	-1.8068	-3.17	-0.8	-6.33	46.5	0.89	71	-0.4967	-0.1268	discard	exp#143 mtf_12h_donchian_daily_weekly_hma_rsi_pullback_v1	train
cae3100	mtf_12h_donchian_daily_weekly_hma_rsi_pullback_v1	ETHUSDT	-0.6042	11.24	2.7	-3.03	58.5	1.86	65	-0.2021	0.8926	discard	exp#143 mtf_12h_donchian_daily_weekly_hma_rsi_pullback_v1	train
cae3100	mtf_12h_donchian_daily_weekly_hma_rsi_pullback_v1	SOLUSDT	-0.9564	3.67	0.91	-10.39	45.0	1.19	80	-0.3847	0.0874	discard	exp#143 mtf_12h_donchian_daily_weekly_hma_rsi_pullback_v1	train
457edd4	mtf_1d_supertrend_4h_hma_rsi_pullback_v1	BTCUSDT	-1.052	9.75	2.35	-0.82	70.6	5.22	17	-0.6573	2.8535	discard	exp#144 mtf_1d_supertrend_4h_hma_rsi_pullback_v1	train
457edd4	mtf_1d_supertrend_4h_hma_rsi_pullback_v1	ETHUSDT	-1.3325	6.09	1.49	-1.26	57.1	3.66	14	-0.9118	1.1848	discard	exp#144 mtf_1d_supertrend_4h_hma_rsi_pullback_v1	train
457edd4	mtf_1d_supertrend_4h_hma_rsi_pullback_v1	SOLUSDT	-0.0373	19.13	4.49	-2.46	75.0	5.85	8	-0.0212	1.8274	discard	exp#144 mtf_1d_supertrend_4h_hma_rsi_pullback_v1	train
457edd4	mtf_1d_supertrend_4h_hma_rsi_pullback_v1	BTCUSDT	-1.052	9.75	2.35	-0.82	70.6	5.22	17	-0.6573	2.8535	discard	exp#144 mtf_1d_supertrend_4h_hma_rsi_pullback_v1	train
457edd4	mtf_1d_supertrend_4h_hma_rsi_pullback_v1	ETHUSDT	-1.3325	6.09	1.49	-1.26	57.1	3.66	14	-0.9118	1.1848	discard	exp#144 mtf_1d_supertrend_4h_hma_rsi_pullback_v1	train
457edd4	mtf_1d_supertrend_4h_hma_rsi_pullback_v1	SOLUSDT	-0.0373	19.13	4.49	-2.46	75.0	5.85	8	-0.0212	1.8274	discard	exp#144 mtf_1d_supertrend_4h_hma_rsi_pullback_v1	train
8f72627	mtf_15m_4h_hma_rsi_mr_volume_v1	BTCUSDT	-7.5961	-33.19	-9.6	-34.11	38.8	0.74	1760	-1.8473	-0.2814	discard	exp#145 mtf_15m_4h_hma_rsi_mr_volume_v1	train
8f72627	mtf_15m_4h_hma_rsi_mr_volume_v1	ETHUSDT	-6.3189	-33.09	-9.56	-33.52	40.8	0.77	1714	-1.5514	-0.2853	discard	exp#145 mtf_15m_4h_hma_rsi_mr_volume_v1	train
8f72627	mtf_15m_4h_hma_rsi_mr_volume_v1	SOLUSDT	-4.1273	-35.56	-10.44	-37.05	46.1	0.86	1810	-0.9955	-0.2819	discard	exp#145 mtf_15m_4h_hma_rsi_mr_volume_v1	train
8f72627	mtf_15m_4h_hma_rsi_mr_volume_v1	BTCUSDT	-7.5961	-33.19	-9.6	-34.11	38.8	0.74	1760	-1.8473	-0.2814	discard	exp#145 mtf_15m_4h_hma_rsi_mr_volume_v1	train
8f72627	mtf_15m_4h_hma_rsi_mr_volume_v1	ETHUSDT	-6.3189	-33.09	-9.56	-33.52	40.8	0.77	1714	-1.5514	-0.2853	discard	exp#145 mtf_15m_4h_hma_rsi_mr_volume_v1	train
8f72627	mtf_15m_4h_hma_rsi_mr_volume_v1	SOLUSDT	-4.1273	-35.56	-10.44	-37.05	46.1	0.86	1810	-0.9955	-0.2819	discard	exp#145 mtf_15m_4h_hma_rsi_mr_volume_v1	train
9b9e31f	mtf_30m_4h_hma_rsi_pullback_atr_v1	BTCUSDT	-5.169	-73.98	-28.6	-74.23	33.6	0.74	3541	-2.8182	-0.3852	discard	exp#146 mtf_30m_4h_hma_rsi_pullback_atr_v1	train
9b9e31f	mtf_30m_4h_hma_rsi_pullback_atr_v1	ETHUSDT	-3.7409	-70.78	-26.49	-71.68	35.9	0.8	3562	-2.0349	-0.3696	discard	exp#146 mtf_30m_4h_hma_rsi_pullback_atr_v1	train
9b9e31f	mtf_30m_4h_hma_rsi_pullback_atr_v1	SOLUSDT	-1.9637	-61.75	-21.44	-62.76	39.4	0.95	3687	-1.0709	-0.3416	discard	exp#146 mtf_30m_4h_hma_rsi_pullback_atr_v1	train
9b9e31f	mtf_30m_4h_hma_rsi_pullback_atr_v1	BTCUSDT	-5.169	-73.98	-28.6	-74.23	33.6	0.74	3541	-2.8182	-0.3852	discard	exp#146 mtf_30m_4h_hma_rsi_pullback_atr_v1	train
9b9e31f	mtf_30m_4h_hma_rsi_pullback_atr_v1	ETHUSDT	-3.7409	-70.78	-26.49	-71.68	35.9	0.8	3562	-2.0349	-0.3696	discard	exp#146 mtf_30m_4h_hma_rsi_pullback_atr_v1	train
9b9e31f	mtf_30m_4h_hma_rsi_pullback_atr_v1	SOLUSDT	-1.9637	-61.75	-21.44	-62.76	39.4	0.95	3687	-1.0709	-0.3416	discard	exp#146 mtf_30m_4h_hma_rsi_pullback_atr_v1	train
6128015	mtf_1h_regime_chop_4h_hma_rsi_volume_v1	BTCUSDT	-3.3606	-65.68	-23.47	-68.49	35.6	0.95	4585	-3.3244	-0.3427	discard	exp#147 mtf_1h_regime_chop_4h_hma_rsi_volume_v1	train
6128015	mtf_1h_regime_chop_4h_hma_rsi_volume_v1	ETHUSDT	-2.7306	-67.08	-24.27	-69.3	37.1	0.98	4645	-2.6044	-0.3502	discard	exp#147 mtf_1h_regime_chop_4h_hma_rsi_volume_v1	train
6128015	mtf_1h_regime_chop_4h_hma_rsi_volume_v1	SOLUSDT	-0.9526	-45.88	-14.28	-65.27	39.1	1.09	4493	-0.9898	-0.2188	discard	exp#147 mtf_1h_regime_chop_4h_hma_rsi_volume_v1	train
6128015	mtf_1h_regime_chop_4h_hma_rsi_volume_v1	BTCUSDT	-3.3606	-65.68	-23.47	-68.49	35.6	0.95	4585	-3.3244	-0.3427	discard	exp#147 mtf_1h_regime_chop_4h_hma_rsi_volume_v1	train
6128015	mtf_1h_regime_chop_4h_hma_rsi_volume_v1	ETHUSDT	-2.7306	-67.08	-24.27	-69.3	37.1	0.98	4645	-2.6044	-0.3502	discard	exp#147 mtf_1h_regime_chop_4h_hma_rsi_volume_v1	train
6128015	mtf_1h_regime_chop_4h_hma_rsi_volume_v1	SOLUSDT	-0.9526	-45.88	-14.28	-65.27	39.1	1.09	4493	-0.9898	-0.2188	discard	exp#147 mtf_1h_regime_chop_4h_hma_rsi_volume_v1	train
4ea7ec6	mtf_12h_kama_adx_daily_hma_volume_v1	BTCUSDT	-1.6083	-2.34	-0.59	-7.36	49.4	0.99	158	-0.7875	-0.0802	discard	exp#149 mtf_12h_kama_adx_daily_hma_volume_v1	train
4ea7ec6	mtf_12h_kama_adx_daily_hma_volume_v1	ETHUSDT	-1.7198	-11.75	-3.08	-16.27	46.6	0.81	191	-0.8542	-0.1893	discard	exp#149 mtf_12h_kama_adx_daily_hma_volume_v1	train
4ea7ec6	mtf_12h_kama_adx_daily_hma_volume_v1	SOLUSDT	-0.4632	3.39	0.84	-13.96	52.9	1.09	206	-0.236	0.0602	discard	exp#149 mtf_12h_kama_adx_daily_hma_volume_v1	train
4ea7ec6	mtf_12h_kama_adx_daily_hma_volume_v1	BTCUSDT	-1.6083	-2.34	-0.59	-7.36	49.4	0.99	158	-0.7875	-0.0802	discard	exp#149 mtf_12h_kama_adx_daily_hma_volume_v1	train
4ea7ec6	mtf_12h_kama_adx_daily_hma_volume_v1	ETHUSDT	-1.7198	-11.75	-3.08	-16.27	46.6	0.81	191	-0.8542	-0.1893	discard	exp#149 mtf_12h_kama_adx_daily_hma_volume_v1	train
4ea7ec6	mtf_12h_kama_adx_daily_hma_volume_v1	SOLUSDT	-0.4632	3.39	0.84	-13.96	52.9	1.09	206	-0.236	0.0602	discard	exp#149 mtf_12h_kama_adx_daily_hma_volume_v1	train
8cf9e44	mtf_1d_zscore_weekly_hma_rsi_atr_v1	BTCUSDT	-1.1347	0.89	0.22	-5.36	63.6	1.11	44	-0.3649	0.0414	discard	exp#150 mtf_1d_zscore_weekly_hma_rsi_atr_v1	train
8cf9e44	mtf_1d_zscore_weekly_hma_rsi_atr_v1	ETHUSDT	-0.6127	5.96	1.46	-10.07	60.4	1.36	48	-0.2244	0.1447	discard	exp#150 mtf_1d_zscore_weekly_hma_rsi_atr_v1	train
8cf9e44	mtf_1d_zscore_weekly_hma_rsi_atr_v1	SOLUSDT	0.2208	28.94	6.58	-3.62	64.4	3.2	45	0.1397	1.8169	keep	exp#150 mtf_1d_zscore_weekly_hma_rsi_atr_v1	train
8cf9e44	mtf_1d_zscore_weekly_hma_rsi_atr_v1	SOLUSDT	0.2421	8.62	7.04	-5.97	56.5	1.76	23	0.1413	1.179	keep	exp#150 mtf_1d_zscore_weekly_hma_rsi_atr_v1	test
8cf9e44	mtf_1d_zscore_weekly_hma_rsi_atr_v1	BTCUSDT	-1.1347	0.89	0.22	-5.36	63.6	1.11	44	-0.3649	0.0414	discard	exp#150 mtf_1d_zscore_weekly_hma_rsi_atr_v1	train
8cf9e44	mtf_1d_zscore_weekly_hma_rsi_atr_v1	ETHUSDT	-0.6127	5.96	1.46	-10.07	60.4	1.36	48	-0.2244	0.1447	discard	exp#150 mtf_1d_zscore_weekly_hma_rsi_atr_v1	train
8cf9e44	mtf_1d_zscore_weekly_hma_rsi_atr_v1	SOLUSDT	0.2208	28.94	6.58	-3.62	64.4	3.2	45	0.1397	1.8169	keep	exp#150 mtf_1d_zscore_weekly_hma_rsi_atr_v1	train
8cf9e44	mtf_1d_zscore_weekly_hma_rsi_atr_v1	SOLUSDT	0.2421	8.62	7.04	-5.97	56.5	1.76	23	0.1413	1.179	keep	exp#150 mtf_1d_zscore_weekly_hma_rsi_atr_v1	test
b48e56c	mtf_15m_regime_4h_hma_1h_rsi_bbw_v1	BTCUSDT	-6.4165	-19.16	-5.18	-19.36	47.6	0.72	910	-1.0208	-0.2677	discard	exp#151 mtf_15m_regime_4h_hma_1h_rsi_bbw_v1	train
b48e56c	mtf_15m_regime_4h_hma_1h_rsi_bbw_v1	ETHUSDT	-4.8671	-18.74	-5.06	-19.32	48.3	0.81	921	-0.842	-0.2618	discard	exp#151 mtf_15m_regime_4h_hma_1h_rsi_bbw_v1	train
b48e56c	mtf_15m_regime_4h_hma_1h_rsi_bbw_v1	SOLUSDT	-3.5716	-23.48	-6.5	-24.26	47.6	0.76	840	-0.578	-0.2678	discard	exp#151 mtf_15m_regime_4h_hma_1h_rsi_bbw_v1	train
b48e56c	mtf_15m_regime_4h_hma_1h_rsi_bbw_v1	BTCUSDT	-6.4165	-19.16	-5.18	-19.36	47.6	0.72	910	-1.0208	-0.2677	discard	exp#151 mtf_15m_regime_4h_hma_1h_rsi_bbw_v1	train
b48e56c	mtf_15m_regime_4h_hma_1h_rsi_bbw_v1	ETHUSDT	-4.8671	-18.74	-5.06	-19.32	48.3	0.81	921	-0.842	-0.2618	discard	exp#151 mtf_15m_regime_4h_hma_1h_rsi_bbw_v1	train
b48e56c	mtf_15m_regime_4h_hma_1h_rsi_bbw_v1	SOLUSDT	-3.5716	-23.48	-6.5	-24.26	47.6	0.76	840	-0.578	-0.2678	discard	exp#151 mtf_15m_regime_4h_hma_1h_rsi_bbw_v1	train
3e316d6	mtf_1h_crsi_4h_hma_atr_v1	BTCUSDT	-3.5452	-10.68	-2.79	-11.43	60.2	0.88	568	-0.8242	-0.2438	discard	exp#153 mtf_1h_crsi_4h_hma_atr_v1	train
3e316d6	mtf_1h_crsi_4h_hma_atr_v1	ETHUSDT	-2.6967	-11.73	-3.07	-12.72	61.5	0.87	533	-0.6961	-0.2415	discard	exp#153 mtf_1h_crsi_4h_hma_atr_v1	train
3e316d6	mtf_1h_crsi_4h_hma_atr_v1	SOLUSDT	-1.3717	-1.99	-0.5	-10.3	64.7	1.06	467	-0.3184	-0.0489	discard	exp#153 mtf_1h_crsi_4h_hma_atr_v1	train
3e316d6	mtf_1h_crsi_4h_hma_atr_v1	BTCUSDT	-3.5452	-10.68	-2.79	-11.43	60.2	0.88	568	-0.8242	-0.2438	discard	exp#153 mtf_1h_crsi_4h_hma_atr_v1	train
3e316d6	mtf_1h_crsi_4h_hma_atr_v1	ETHUSDT	-2.6967	-11.73	-3.07	-12.72	61.5	0.87	533	-0.6961	-0.2415	discard	exp#153 mtf_1h_crsi_4h_hma_atr_v1	train
3e316d6	mtf_1h_crsi_4h_hma_atr_v1	SOLUSDT	-1.3717	-1.99	-0.5	-10.3	64.7	1.06	467	-0.3184	-0.0489	discard	exp#153 mtf_1h_crsi_4h_hma_atr_v1	train
c269c2e	mtf_4h_fisher_daily_hma_atr_reversal_v1	BTCUSDT	-0.7761	-13.32	-3.51	-23.49	45.5	1.03	931	-0.6339	-0.1495	discard	exp#154 mtf_4h_fisher_daily_hma_atr_reversal_v1	train
c269c2e	mtf_4h_fisher_daily_hma_atr_reversal_v1	ETHUSDT	-0.6336	-13.43	-3.54	-25.57	44.1	1.02	903	-0.5071	-0.1385	discard	exp#154 mtf_4h_fisher_daily_hma_atr_reversal_v1	train
c269c2e	mtf_4h_fisher_daily_hma_atr_reversal_v1	SOLUSDT	0.0841	21.29	4.96	-29.1	46.1	1.11	934	0.0732	0.1705	keep	exp#154 mtf_4h_fisher_daily_hma_atr_reversal_v1	train
c269c2e	mtf_4h_fisher_daily_hma_atr_reversal_v1	SOLUSDT	0.1702	8.01	6.54	-12.28	47.6	1.17	288	0.1522	0.5329	keep	exp#154 mtf_4h_fisher_daily_hma_atr_reversal_v1	test
c269c2e	mtf_4h_fisher_daily_hma_atr_reversal_v1	BTCUSDT	-0.7761	-13.32	-3.51	-23.49	45.5	1.03	931	-0.6339	-0.1495	discard	exp#154 mtf_4h_fisher_daily_hma_atr_reversal_v1	train
c269c2e	mtf_4h_fisher_daily_hma_atr_reversal_v1	ETHUSDT	-0.6336	-13.43	-3.54	-25.57	44.1	1.02	903	-0.5071	-0.1385	discard	exp#154 mtf_4h_fisher_daily_hma_atr_reversal_v1	train
c269c2e	mtf_4h_fisher_daily_hma_atr_reversal_v1	SOLUSDT	0.0841	21.29	4.96	-29.1	46.1	1.11	934	0.0732	0.1705	keep	exp#154 mtf_4h_fisher_daily_hma_atr_reversal_v1	train
c269c2e	mtf_4h_fisher_daily_hma_atr_reversal_v1	SOLUSDT	0.1702	8.01	6.54	-12.28	47.6	1.17	288	0.1522	0.5329	keep	exp#154 mtf_4h_fisher_daily_hma_atr_reversal_v1	test
509716c	mtf_12h_regime_supertrend_daily_hma_rsi_v1	BTCUSDT	-0.7988	-2.29	-0.58	-10.74	45.8	1.05	367	-0.6637	-0.0537	discard	exp#155 mtf_12h_regime_supertrend_daily_hma_rsi_v1	train
509716c	mtf_12h_regime_supertrend_daily_hma_rsi_v1	ETHUSDT	-1.1131	-20.13	-5.47	-27.52	43.5	0.87	375	-0.8092	-0.1987	discard	exp#155 mtf_12h_regime_supertrend_daily_hma_rsi_v1	train
509716c	mtf_12h_regime_supertrend_daily_hma_rsi_v1	SOLUSDT	-0.3862	-5.35	-1.37	-26.08	44.0	1.03	391	-0.3494	-0.0525	discard	exp#155 mtf_12h_regime_supertrend_daily_hma_rsi_v1	train
509716c	mtf_12h_regime_supertrend_daily_hma_rsi_v1	BTCUSDT	-0.7988	-2.29	-0.58	-10.74	45.8	1.05	367	-0.6637	-0.0537	discard	exp#155 mtf_12h_regime_supertrend_daily_hma_rsi_v1	train
509716c	mtf_12h_regime_supertrend_daily_hma_rsi_v1	ETHUSDT	-1.1131	-20.13	-5.47	-27.52	43.5	0.87	375	-0.8092	-0.1987	discard	exp#155 mtf_12h_regime_supertrend_daily_hma_rsi_v1	train
509716c	mtf_12h_regime_supertrend_daily_hma_rsi_v1	SOLUSDT	-0.3862	-5.35	-1.37	-26.08	44.0	1.03	391	-0.3494	-0.0525	discard	exp#155 mtf_12h_regime_supertrend_daily_hma_rsi_v1	train
95d5f45	mtf_15m_bb_4h_hma_volume_atr_v1	BTCUSDT	-12.1368	-85.63	-38.45	-85.64	44.4	0.71	8450	-5.5232	-0.449	discard	exp#157 mtf_15m_bb_4h_hma_volume_atr_v1	train
95d5f45	mtf_15m_bb_4h_hma_volume_atr_v1	ETHUSDT	-8.8856	-82.79	-35.61	-83.01	46.8	0.81	8326	-4.2362	-0.429	discard	exp#157 mtf_15m_bb_4h_hma_volume_atr_v1	train
95d5f45	mtf_15m_bb_4h_hma_volume_atr_v1	SOLUSDT	-6.3298	-86.11	-39.08	-86.13	47.2	0.83	7719	-2.6095	-0.4537	discard	exp#157 mtf_15m_bb_4h_hma_volume_atr_v1	train
95d5f45	mtf_15m_bb_4h_hma_volume_atr_v1	BTCUSDT	-12.1368	-85.63	-38.45	-85.64	44.4	0.71	8450	-5.5232	-0.449	discard	exp#157 mtf_15m_bb_4h_hma_volume_atr_v1	train
95d5f45	mtf_15m_bb_4h_hma_volume_atr_v1	ETHUSDT	-8.8856	-82.79	-35.61	-83.01	46.8	0.81	8326	-4.2362	-0.429	discard	exp#157 mtf_15m_bb_4h_hma_volume_atr_v1	train
95d5f45	mtf_15m_bb_4h_hma_volume_atr_v1	SOLUSDT	-6.3298	-86.11	-39.08	-86.13	47.2	0.83	7719	-2.6095	-0.4537	discard	exp#157 mtf_15m_bb_4h_hma_volume_atr_v1	train
50ab6f2	mtf_30m_rsi_pullback_4h_hma_atr_v1	BTCUSDT	-7.7641	-88.22	-41.44	-88.38	51.9	0.79	8248	-5.5882	-0.4689	discard	exp#158 mtf_30m_rsi_pullback_4h_hma_atr_v1	train
50ab6f2	mtf_30m_rsi_pullback_4h_hma_atr_v1	ETHUSDT	-6.546	-89.54	-43.15	-89.59	53.1	0.82	8303	-4.6434	-0.4816	discard	exp#158 mtf_30m_rsi_pullback_4h_hma_atr_v1	train
50ab6f2	mtf_30m_rsi_pullback_4h_hma_atr_v1	SOLUSDT	-4.2382	-91.69	-46.44	-91.91	54.8	0.81	8105	-3.0503	-0.5053	discard	exp#158 mtf_30m_rsi_pullback_4h_hma_atr_v1	train
50ab6f2	mtf_30m_rsi_pullback_4h_hma_atr_v1	BTCUSDT	-7.7641	-88.22	-41.44	-88.38	51.9	0.79	8248	-5.5882	-0.4689	discard	exp#158 mtf_30m_rsi_pullback_4h_hma_atr_v1	train
50ab6f2	mtf_30m_rsi_pullback_4h_hma_atr_v1	ETHUSDT	-6.546	-89.54	-43.15	-89.59	53.1	0.82	8303	-4.6434	-0.4816	discard	exp#158 mtf_30m_rsi_pullback_4h_hma_atr_v1	train
50ab6f2	mtf_30m_rsi_pullback_4h_hma_atr_v1	SOLUSDT	-4.2382	-91.69	-46.44	-91.91	54.8	0.81	8105	-3.0503	-0.5053	discard	exp#158 mtf_30m_rsi_pullback_4h_hma_atr_v1	train
14123bc	mtf_1h_dual_momentum_12h_hma_rsi_macd_atr_v1	BTCUSDT	-3.6969	-22.22	-6.09	-23.32	41.3	0.78	889	-1.1336	-0.2612	discard	exp#159 mtf_1h_dual_momentum_12h_hma_rsi_macd_atr_v1	train
14123bc	mtf_1h_dual_momentum_12h_hma_rsi_macd_atr_v1	ETHUSDT	-2.4702	-14.71	-3.9	-17.27	44.9	0.95	923	-0.9087	-0.2259	discard	exp#159 mtf_1h_dual_momentum_12h_hma_rsi_macd_atr_v1	train
14123bc	mtf_1h_dual_momentum_12h_hma_rsi_macd_atr_v1	SOLUSDT	-2.2377	-24.27	-6.74	-27.37	45.6	0.87	939	-0.7161	-0.2463	discard	exp#159 mtf_1h_dual_momentum_12h_hma_rsi_macd_atr_v1	train
14123bc	mtf_1h_dual_momentum_12h_hma_rsi_macd_atr_v1	BTCUSDT	-3.6969	-22.22	-6.09	-23.32	41.3	0.78	889	-1.1336	-0.2612	discard	exp#159 mtf_1h_dual_momentum_12h_hma_rsi_macd_atr_v1	train
14123bc	mtf_1h_dual_momentum_12h_hma_rsi_macd_atr_v1	ETHUSDT	-2.4702	-14.71	-3.9	-17.27	44.9	0.95	923	-0.9087	-0.2259	discard	exp#159 mtf_1h_dual_momentum_12h_hma_rsi_macd_atr_v1	train
14123bc	mtf_1h_dual_momentum_12h_hma_rsi_macd_atr_v1	SOLUSDT	-2.2377	-24.27	-6.74	-27.37	45.6	0.87	939	-0.7161	-0.2463	discard	exp#159 mtf_1h_dual_momentum_12h_hma_rsi_macd_atr_v1	train
c1e7377	mtf_4h_keltner_volume_daily_hma_adx_v1	BTCUSDT	-0.7895	-0.15	-0.04	-15.29	38.4	1.17	424	-0.446	-0.0024	discard	exp#160 mtf_4h_keltner_volume_daily_hma_adx_v1	train
c1e7377	mtf_4h_keltner_volume_daily_hma_adx_v1	ETHUSDT	-0.6015	-0.99	-0.25	-16.82	39.3	1.1	427	-0.3364	-0.0148	discard	exp#160 mtf_4h_keltner_volume_daily_hma_adx_v1	train
c1e7377	mtf_4h_keltner_volume_daily_hma_adx_v1	SOLUSDT	-0.3566	-1.45	-0.37	-16.52	39.9	1.04	456	-0.2052	-0.0222	discard	exp#160 mtf_4h_keltner_volume_daily_hma_adx_v1	train
