commit	strategy	symbol	sharpe	return_pct	cagr_pct	max_dd_pct	win_rate	profit_factor	trades	sortino	calmar	status	description	period
9e57fa2	mtf_1h_crsi_4h_12h_hma_chop_mean_reversion_v1	SOLUSDT	-0.687	-6.83	-1.76	-19.06	59.3	1.09	1717	-0.3042	-0.0924	discard	exp#183 mtf_1h_crsi_4h_12h_hma_chop_mean_reversion_v1	train
2a2967e	mtf_4h_crsi_daily_weekly_hma_chop_atr_v1	BTCUSDT	-1.6932	-12.61	-3.31	-21.61	57.0	0.93	581	-0.7925	-0.1534	discard	exp#184 mtf_4h_crsi_daily_weekly_hma_chop_atr_v1	train
2a2967e	mtf_4h_crsi_daily_weekly_hma_chop_atr_v1	ETHUSDT	-0.8361	-3.4	-0.86	-16.0	61.0	1.07	531	-0.3921	-0.0539	discard	exp#184 mtf_4h_crsi_daily_weekly_hma_chop_atr_v1	train
2a2967e	mtf_4h_crsi_daily_weekly_hma_chop_atr_v1	SOLUSDT	0.0067	20.16	4.72	-8.09	59.1	1.22	580	0.004	0.5835	keep	exp#184 mtf_4h_crsi_daily_weekly_hma_chop_atr_v1	train
2a2967e	mtf_4h_crsi_daily_weekly_hma_chop_atr_v1	SOLUSDT	-2.7116	-22.64	-19.04	-25.01	56.9	0.68	216	-1.491	-0.7611	discard	exp#184 mtf_4h_crsi_daily_weekly_hma_chop_atr_v1	test
2a2967e	mtf_4h_crsi_daily_weekly_hma_chop_atr_v1	BTCUSDT	-1.6932	-12.61	-3.31	-21.61	57.0	0.93	581	-0.7925	-0.1534	discard	exp#184 mtf_4h_crsi_daily_weekly_hma_chop_atr_v1	train
2a2967e	mtf_4h_crsi_daily_weekly_hma_chop_atr_v1	ETHUSDT	-0.8361	-3.4	-0.86	-16.0	61.0	1.07	531	-0.3921	-0.0539	discard	exp#184 mtf_4h_crsi_daily_weekly_hma_chop_atr_v1	train
2a2967e	mtf_4h_crsi_daily_weekly_hma_chop_atr_v1	SOLUSDT	0.0067	20.16	4.72	-8.09	59.1	1.22	580	0.004	0.5835	discard	exp#184 mtf_4h_crsi_daily_weekly_hma_chop_atr_v1	train
94f066f	mtf_1d_hma_rsi_weekly_chop_atr_v1	BTCUSDT	-1.7605	1.19	0.3	-6.25	46.2	1.19	26	-0.5379	0.0475	discard	exp#186 mtf_1d_hma_rsi_weekly_chop_atr_v1	train
94f066f	mtf_1d_hma_rsi_weekly_chop_atr_v1	ETHUSDT	-2.7147	-3.66	-0.93	-5.31	45.5	0.67	22	-0.621	-0.1744	discard	exp#186 mtf_1d_hma_rsi_weekly_chop_atr_v1	train
94f066f	mtf_1d_hma_rsi_weekly_chop_atr_v1	SOLUSDT	-0.8993	-2.97	-0.75	-10.1	62.5	0.6	24	-0.1622	-0.0747	discard	exp#186 mtf_1d_hma_rsi_weekly_chop_atr_v1	train
94f066f	mtf_1d_hma_rsi_weekly_chop_atr_v1	BTCUSDT	-1.7605	1.19	0.3	-6.25	46.2	1.19	26	-0.5379	0.0475	discard	exp#186 mtf_1d_hma_rsi_weekly_chop_atr_v1	train
94f066f	mtf_1d_hma_rsi_weekly_chop_atr_v1	ETHUSDT	-2.7147	-3.66	-0.93	-5.31	45.5	0.67	22	-0.621	-0.1744	discard	exp#186 mtf_1d_hma_rsi_weekly_chop_atr_v1	train
94f066f	mtf_1d_hma_rsi_weekly_chop_atr_v1	SOLUSDT	-0.8993	-2.97	-0.75	-10.1	62.5	0.6	24	-0.1622	-0.0747	discard	exp#186 mtf_1d_hma_rsi_weekly_chop_atr_v1	train
8811243	mtf_15m_hma_rsi_donchian_4h_trend_pullback_v2	BTCUSDT	-8.8204	-9.16	-2.37	-9.78	39.6	0.66	361	-0.9075	-0.2427	discard	exp#187 mtf_15m_hma_rsi_donchian_4h_trend_pullback_v2	train
8811243	mtf_15m_hma_rsi_donchian_4h_trend_pullback_v2	ETHUSDT	-7.3091	-12.72	-3.34	-12.88	39.2	0.53	347	-0.6435	-0.2597	discard	exp#187 mtf_15m_hma_rsi_donchian_4h_trend_pullback_v2	train
8811243	mtf_15m_hma_rsi_donchian_4h_trend_pullback_v2	SOLUSDT	-4.0224	-15.46	-4.13	-15.85	44.6	0.63	361	-0.3185	-0.2606	discard	exp#187 mtf_15m_hma_rsi_donchian_4h_trend_pullback_v2	train
8811243	mtf_15m_hma_rsi_donchian_4h_trend_pullback_v2	BTCUSDT	-8.8204	-9.16	-2.37	-9.78	39.6	0.66	361	-0.9075	-0.2427	discard	exp#187 mtf_15m_hma_rsi_donchian_4h_trend_pullback_v2	train
8811243	mtf_15m_hma_rsi_donchian_4h_trend_pullback_v2	ETHUSDT	-7.3091	-12.72	-3.34	-12.88	39.2	0.53	347	-0.6435	-0.2597	discard	exp#187 mtf_15m_hma_rsi_donchian_4h_trend_pullback_v2	train
8811243	mtf_15m_hma_rsi_donchian_4h_trend_pullback_v2	SOLUSDT	-4.0224	-15.46	-4.13	-15.85	44.6	0.63	361	-0.3185	-0.2606	discard	exp#187 mtf_15m_hma_rsi_donchian_4h_trend_pullback_v2	train
4bc33f3	mtf_1h_fisher_4h_hma_volume_adaptive_v1	BTCUSDT	-4.8241	-46.99	-14.68	-48.49	42.2	0.89	5069	-3.9853	-0.3028	discard	exp#189 mtf_1h_fisher_4h_hma_volume_adaptive_v1	train
4bc33f3	mtf_1h_fisher_4h_hma_volume_adaptive_v1	ETHUSDT	-3.5487	-69.02	-25.41	-70.42	42.5	0.93	5171	-2.9056	-0.3608	discard	exp#189 mtf_1h_fisher_4h_hma_volume_adaptive_v1	train
4bc33f3	mtf_1h_fisher_4h_hma_volume_adaptive_v1	SOLUSDT	-2.729	-77.45	-31.2	-78.89	44.6	0.93	5087	-2.1452	-0.3954	discard	exp#189 mtf_1h_fisher_4h_hma_volume_adaptive_v1	train
4bc33f3	mtf_1h_fisher_4h_hma_volume_adaptive_v1	BTCUSDT	-4.8241	-46.99	-14.68	-48.49	42.2	0.89	5069	-3.9853	-0.3028	discard	exp#189 mtf_1h_fisher_4h_hma_volume_adaptive_v1	train
4bc33f3	mtf_1h_fisher_4h_hma_volume_adaptive_v1	ETHUSDT	-3.5487	-69.02	-25.41	-70.42	42.5	0.93	5171	-2.9056	-0.3608	discard	exp#189 mtf_1h_fisher_4h_hma_volume_adaptive_v1	train
4bc33f3	mtf_1h_fisher_4h_hma_volume_adaptive_v1	SOLUSDT	-2.729	-77.45	-31.2	-78.89	44.6	0.93	5087	-2.1452	-0.3954	discard	exp#189 mtf_1h_fisher_4h_hma_volume_adaptive_v1	train
9c227cd	mtf_4h_donchian_daily_weekly_hma_rsi_momentum_v1	BTCUSDT	-1.3933	-9.17	-2.38	-13.8	39.6	0.99	656	-0.8248	-0.1721	discard	exp#190 mtf_4h_donchian_daily_weekly_hma_rsi_momentum_v1	train
9c227cd	mtf_4h_donchian_daily_weekly_hma_rsi_momentum_v1	ETHUSDT	-1.2871	-14.62	-3.88	-19.86	42.7	0.94	682	-0.7174	-0.1952	discard	exp#190 mtf_4h_donchian_daily_weekly_hma_rsi_momentum_v1	train
9c227cd	mtf_4h_donchian_daily_weekly_hma_rsi_momentum_v1	SOLUSDT	-0.7009	-15.76	-4.21	-27.06	41.5	0.97	656	-0.4307	-0.1557	discard	exp#190 mtf_4h_donchian_daily_weekly_hma_rsi_momentum_v1	train
9c227cd	mtf_4h_donchian_daily_weekly_hma_rsi_momentum_v1	BTCUSDT	-1.3933	-9.17	-2.38	-13.8	39.6	0.99	656	-0.8248	-0.1721	discard	exp#190 mtf_4h_donchian_daily_weekly_hma_rsi_momentum_v1	train
9c227cd	mtf_4h_donchian_daily_weekly_hma_rsi_momentum_v1	ETHUSDT	-1.2871	-14.62	-3.88	-19.86	42.7	0.94	682	-0.7174	-0.1952	discard	exp#190 mtf_4h_donchian_daily_weekly_hma_rsi_momentum_v1	train
9c227cd	mtf_4h_donchian_daily_weekly_hma_rsi_momentum_v1	SOLUSDT	-0.7009	-15.76	-4.21	-27.06	41.5	0.97	656	-0.4307	-0.1557	discard	exp#190 mtf_4h_donchian_daily_weekly_hma_rsi_momentum_v1	train
2549a63	mtf_12h_donchian_daily_weekly_hma_rsi_atr_v1	BTCUSDT	-0.7345	-1.63	-0.41	-11.86	48.5	1.06	344	-0.5033	-0.0346	discard	exp#191 mtf_12h_donchian_daily_weekly_hma_rsi_atr_v1	train
2549a63	mtf_12h_donchian_daily_weekly_hma_rsi_atr_v1	ETHUSDT	-0.2751	8.92	2.16	-15.9	47.5	1.16	379	-0.2022	0.1358	discard	exp#191 mtf_12h_donchian_daily_weekly_hma_rsi_atr_v1	train
2549a63	mtf_12h_donchian_daily_weekly_hma_rsi_atr_v1	SOLUSDT	0.4968	52.97	11.26	-10.26	51.4	1.4	362	0.3715	1.0975	keep	exp#191 mtf_12h_donchian_daily_weekly_hma_rsi_atr_v1	train
2549a63	mtf_12h_donchian_daily_weekly_hma_rsi_atr_v1	SOLUSDT	0.2239	8.42	6.88	-8.97	50.8	1.26	122	0.1914	0.7665	keep	exp#191 mtf_12h_donchian_daily_weekly_hma_rsi_atr_v1	test
2549a63	mtf_12h_donchian_daily_weekly_hma_rsi_atr_v1	BTCUSDT	-0.7345	-1.63	-0.41	-11.86	48.5	1.06	344	-0.5033	-0.0346	discard	exp#191 mtf_12h_donchian_daily_weekly_hma_rsi_atr_v1	train
2549a63	mtf_12h_donchian_daily_weekly_hma_rsi_atr_v1	ETHUSDT	-0.2751	8.92	2.16	-15.9	47.5	1.16	379	-0.2022	0.1358	discard	exp#191 mtf_12h_donchian_daily_weekly_hma_rsi_atr_v1	train
2549a63	mtf_12h_donchian_daily_weekly_hma_rsi_atr_v1	SOLUSDT	0.4968	52.97	11.26	-10.26	51.4	1.4	362	0.3715	1.0975	keep	exp#191 mtf_12h_donchian_daily_weekly_hma_rsi_atr_v1	train
2549a63	mtf_12h_donchian_daily_weekly_hma_rsi_atr_v1	SOLUSDT	0.2239	8.42	6.88	-8.97	50.8	1.26	122	0.1914	0.7665	keep	exp#191 mtf_12h_donchian_daily_weekly_hma_rsi_atr_v1	test
12d50eb	mtf_1d_donchian_4h_hma_rsi_atr_v1	BTCUSDT	-0.5956	6.24	1.52	-6.32	42.2	1.33	64	-0.2974	0.241	discard	exp#192 mtf_1d_donchian_4h_hma_rsi_atr_v1	train
12d50eb	mtf_1d_donchian_4h_hma_rsi_atr_v1	ETHUSDT	-1.083	-5.48	-1.4	-12.26	39.3	0.89	61	-0.4337	-0.1141	discard	exp#192 mtf_1d_donchian_4h_hma_rsi_atr_v1	train
12d50eb	mtf_1d_donchian_4h_hma_rsi_atr_v1	SOLUSDT	0.1512	27.79	6.34	-23.88	56.1	1.68	66	0.0698	0.2657	keep	exp#192 mtf_1d_donchian_4h_hma_rsi_atr_v1	train
12d50eb	mtf_1d_donchian_4h_hma_rsi_atr_v1	SOLUSDT	-0.7397	1.7	1.4	-2.83	52.4	1.2	21	-0.3374	0.4933	discard	exp#192 mtf_1d_donchian_4h_hma_rsi_atr_v1	test
12d50eb	mtf_1d_donchian_4h_hma_rsi_atr_v1	BTCUSDT	-0.5956	6.24	1.52	-6.32	42.2	1.33	64	-0.2974	0.241	discard	exp#192 mtf_1d_donchian_4h_hma_rsi_atr_v1	train
12d50eb	mtf_1d_donchian_4h_hma_rsi_atr_v1	ETHUSDT	-1.083	-5.48	-1.4	-12.26	39.3	0.89	61	-0.4337	-0.1141	discard	exp#192 mtf_1d_donchian_4h_hma_rsi_atr_v1	train
12d50eb	mtf_1d_donchian_4h_hma_rsi_atr_v1	SOLUSDT	0.1512	27.79	6.34	-23.88	56.1	1.68	66	0.0698	0.2657	discard	exp#192 mtf_1d_donchian_4h_hma_rsi_atr_v1	train
ad338f1	mtf_15m_kama_4h_hma_rsi_pullback_atr_v1	BTCUSDT	-15.1281	-96.01	-55.33	-96.02	46.0	0.76	13584	-9.3451	-0.5763	discard	exp#193 mtf_15m_kama_4h_hma_rsi_pullback_atr_v1	train
ad338f1	mtf_15m_kama_4h_hma_rsi_pullback_atr_v1	ETHUSDT	-12.0577	-96.33	-56.26	-96.36	48.7	0.8	13696	-7.5556	-0.5839	discard	exp#193 mtf_15m_kama_4h_hma_rsi_pullback_atr_v1	train
ad338f1	mtf_15m_kama_4h_hma_rsi_pullback_atr_v1	SOLUSDT	-7.5615	-96.37	-56.49	-96.44	51.7	0.81	13424	-4.566	-0.5857	discard	exp#193 mtf_15m_kama_4h_hma_rsi_pullback_atr_v1	train
ad338f1	mtf_15m_kama_4h_hma_rsi_pullback_atr_v1	BTCUSDT	-15.1281	-96.01	-55.33	-96.02	46.0	0.76	13584	-9.3451	-0.5763	discard	exp#193 mtf_15m_kama_4h_hma_rsi_pullback_atr_v1	train
ad338f1	mtf_15m_kama_4h_hma_rsi_pullback_atr_v1	ETHUSDT	-12.0577	-96.33	-56.26	-96.36	48.7	0.8	13696	-7.5556	-0.5839	discard	exp#193 mtf_15m_kama_4h_hma_rsi_pullback_atr_v1	train
ad338f1	mtf_15m_kama_4h_hma_rsi_pullback_atr_v1	SOLUSDT	-7.5615	-96.37	-56.49	-96.44	51.7	0.81	13424	-4.566	-0.5857	discard	exp#193 mtf_15m_kama_4h_hma_rsi_pullback_atr_v1	train
79de3e3	mtf_30m_supertrend_4h_hma_rsi_atr_v1	BTCUSDT	-7.7642	-62.42	-21.72	-62.82	36.9	0.73	3692	-3.9073	-0.3457	discard	exp#194 mtf_30m_supertrend_4h_hma_rsi_atr_v1	train
79de3e3	mtf_30m_supertrend_4h_hma_rsi_atr_v1	ETHUSDT	-5.8114	-61.23	-21.11	-61.57	38.3	0.79	3629	-2.7125	-0.3428	discard	exp#194 mtf_30m_supertrend_4h_hma_rsi_atr_v1	train
79de3e3	mtf_30m_supertrend_4h_hma_rsi_atr_v1	SOLUSDT	-4.2909	-62.11	-21.62	-62.12	41.8	0.82	3199	-1.7875	-0.3481	discard	exp#194 mtf_30m_supertrend_4h_hma_rsi_atr_v1	train
79de3e3	mtf_30m_supertrend_4h_hma_rsi_atr_v1	BTCUSDT	-7.7642	-62.42	-21.72	-62.82	36.9	0.73	3692	-3.9073	-0.3457	discard	exp#194 mtf_30m_supertrend_4h_hma_rsi_atr_v1	train
79de3e3	mtf_30m_supertrend_4h_hma_rsi_atr_v1	ETHUSDT	-5.8114	-61.23	-21.11	-61.57	38.3	0.79	3629	-2.7125	-0.3428	discard	exp#194 mtf_30m_supertrend_4h_hma_rsi_atr_v1	train
79de3e3	mtf_30m_supertrend_4h_hma_rsi_atr_v1	SOLUSDT	-4.2909	-62.11	-21.62	-62.12	41.8	0.82	3199	-1.7875	-0.3481	discard	exp#194 mtf_30m_supertrend_4h_hma_rsi_atr_v1	train
a403e39	mtf_1h_hma_rsi_volume_4h_1d_atr_v1	BTCUSDT	-3.7544	-65.08	-23.14	-65.49	30.9	0.88	4562	-3.2068	-0.3534	discard	exp#195 mtf_1h_hma_rsi_volume_4h_1d_atr_v1	train
a403e39	mtf_1h_hma_rsi_volume_4h_1d_atr_v1	ETHUSDT	-3.032	-64.8	-22.99	-64.85	31.6	0.9	4620	-2.6941	-0.3545	discard	exp#195 mtf_1h_hma_rsi_volume_4h_1d_atr_v1	train
a403e39	mtf_1h_hma_rsi_volume_4h_1d_atr_v1	SOLUSDT	-1.6268	-61.27	-21.19	-66.51	34.0	0.99	4618	-1.3293	-0.3186	discard	exp#195 mtf_1h_hma_rsi_volume_4h_1d_atr_v1	train
a403e39	mtf_1h_hma_rsi_volume_4h_1d_atr_v1	BTCUSDT	-3.7544	-65.08	-23.14	-65.49	30.9	0.88	4562	-3.2068	-0.3534	discard	exp#195 mtf_1h_hma_rsi_volume_4h_1d_atr_v1	train
a403e39	mtf_1h_hma_rsi_volume_4h_1d_atr_v1	ETHUSDT	-3.032	-64.8	-22.99	-64.85	31.6	0.9	4620	-2.6941	-0.3545	discard	exp#195 mtf_1h_hma_rsi_volume_4h_1d_atr_v1	train
a403e39	mtf_1h_hma_rsi_volume_4h_1d_atr_v1	SOLUSDT	-1.6268	-61.27	-21.19	-66.51	34.0	0.99	4618	-1.3293	-0.3186	discard	exp#195 mtf_1h_hma_rsi_volume_4h_1d_atr_v1	train
9845468	mtf_12h_supertrend_daily_hma_rsi_volume_atr_v1	BTCUSDT	0.0	0.0	0.0	0.0	0.0	0.0	0	0.0	0.0	discard	exp#197 mtf_12h_supertrend_daily_hma_rsi_volume_atr_v1	train
9845468	mtf_12h_supertrend_daily_hma_rsi_volume_atr_v1	ETHUSDT	0.0	0.0	0.0	0.0	0.0	0.0	0	0.0	0.0	discard	exp#197 mtf_12h_supertrend_daily_hma_rsi_volume_atr_v1	train
9845468	mtf_12h_supertrend_daily_hma_rsi_volume_atr_v1	SOLUSDT	0.0	0.0	0.0	0.0	0.0	0.0	0	0.0	0.0	discard	exp#197 mtf_12h_supertrend_daily_hma_rsi_volume_atr_v1	train
9845468	mtf_12h_supertrend_daily_hma_rsi_volume_atr_v1	BTCUSDT	0.0	0.0	0.0	0.0	0.0	0.0	0	0.0	0.0	discard	exp#197 mtf_12h_supertrend_daily_hma_rsi_volume_atr_v1	train
9845468	mtf_12h_supertrend_daily_hma_rsi_volume_atr_v1	ETHUSDT	0.0	0.0	0.0	0.0	0.0	0.0	0	0.0	0.0	discard	exp#197 mtf_12h_supertrend_daily_hma_rsi_volume_atr_v1	train
9845468	mtf_12h_supertrend_daily_hma_rsi_volume_atr_v1	SOLUSDT	0.0	0.0	0.0	0.0	0.0	0.0	0	0.0	0.0	discard	exp#197 mtf_12h_supertrend_daily_hma_rsi_volume_atr_v1	train
4974ead	mtf_1d_crsi_4h_hma_bb_regime_atr_v1	BTCUSDT	-2.0117	-17.82	-4.79	-19.72	40.4	0.63	109	-0.9543	-0.2429	discard	exp#198 mtf_1d_crsi_4h_hma_bb_regime_atr_v1	train
4974ead	mtf_1d_crsi_4h_hma_bb_regime_atr_v1	ETHUSDT	-1.6657	-9.68	-2.51	-16.08	51.9	0.78	104	-0.7781	-0.1564	discard	exp#198 mtf_1d_crsi_4h_hma_bb_regime_atr_v1	train
4974ead	mtf_1d_crsi_4h_hma_bb_regime_atr_v1	SOLUSDT	-1.4329	-14.87	-3.96	-19.34	50.0	0.75	106	-0.7191	-0.2046	discard	exp#198 mtf_1d_crsi_4h_hma_bb_regime_atr_v1	train
4974ead	mtf_1d_crsi_4h_hma_bb_regime_atr_v1	BTCUSDT	-2.0117	-17.82	-4.79	-19.72	40.4	0.63	109	-0.9543	-0.2429	discard	exp#198 mtf_1d_crsi_4h_hma_bb_regime_atr_v1	train
4974ead	mtf_1d_crsi_4h_hma_bb_regime_atr_v1	ETHUSDT	-1.6657	-9.68	-2.51	-16.08	51.9	0.78	104	-0.7781	-0.1564	discard	exp#198 mtf_1d_crsi_4h_hma_bb_regime_atr_v1	train
4974ead	mtf_1d_crsi_4h_hma_bb_regime_atr_v1	SOLUSDT	-1.4329	-14.87	-3.96	-19.34	50.0	0.75	106	-0.7191	-0.2046	discard	exp#198 mtf_1d_crsi_4h_hma_bb_regime_atr_v1	train
8bb97d4	mtf_15m_crsi_4h_hma_chop_atr_v1	BTCUSDT	-11.6977	-88.35	-41.6	-88.68	51.1	0.8	9776	-6.02	-0.4691	discard	exp#199 mtf_15m_crsi_4h_hma_chop_atr_v1	train
8bb97d4	mtf_15m_crsi_4h_hma_chop_atr_v1	ETHUSDT	-8.8164	-87.18	-40.18	-87.61	54.8	0.89	9949	-4.7267	-0.4587	discard	exp#199 mtf_15m_crsi_4h_hma_chop_atr_v1	train
8bb97d4	mtf_15m_crsi_4h_hma_chop_atr_v1	SOLUSDT	-4.4149	-81.65	-34.67	-82.63	59.8	0.95	9791	-2.3224	-0.4196	discard	exp#199 mtf_15m_crsi_4h_hma_chop_atr_v1	train
8bb97d4	mtf_15m_crsi_4h_hma_chop_atr_v1	BTCUSDT	-11.6977	-88.35	-41.6	-88.68	51.1	0.8	9776	-6.02	-0.4691	discard	exp#199 mtf_15m_crsi_4h_hma_chop_atr_v1	train
8bb97d4	mtf_15m_crsi_4h_hma_chop_atr_v1	ETHUSDT	-8.8164	-87.18	-40.18	-87.61	54.8	0.89	9949	-4.7267	-0.4587	discard	exp#199 mtf_15m_crsi_4h_hma_chop_atr_v1	train
8bb97d4	mtf_15m_crsi_4h_hma_chop_atr_v1	SOLUSDT	-4.4149	-81.65	-34.67	-82.63	59.8	0.95	9791	-2.3224	-0.4196	discard	exp#199 mtf_15m_crsi_4h_hma_chop_atr_v1	train
dc20990	mtf_30m_hma_crossover_4h_trend_rsi_atr_v1	BTCUSDT	-10.3414	-78.66	-32.05	-78.8	38.0	0.75	8253	-6.9139	-0.4068	discard	exp#200 mtf_30m_hma_crossover_4h_trend_rsi_atr_v1	train
dc20990	mtf_30m_hma_crossover_4h_trend_rsi_atr_v1	ETHUSDT	-7.601	-78.51	-31.93	-79.0	39.9	0.79	8254	-4.9792	-0.4042	discard	exp#200 mtf_30m_hma_crossover_4h_trend_rsi_atr_v1	train
dc20990	mtf_30m_hma_crossover_4h_trend_rsi_atr_v1	SOLUSDT	-3.6316	-63.97	-22.61	-67.74	44.9	0.98	8140	-2.5206	-0.3337	discard	exp#200 mtf_30m_hma_crossover_4h_trend_rsi_atr_v1	train
dc20990	mtf_30m_hma_crossover_4h_trend_rsi_atr_v1	BTCUSDT	-10.3414	-78.66	-32.05	-78.8	38.0	0.75	8253	-6.9139	-0.4068	discard	exp#200 mtf_30m_hma_crossover_4h_trend_rsi_atr_v1	train
dc20990	mtf_30m_hma_crossover_4h_trend_rsi_atr_v1	ETHUSDT	-7.601	-78.51	-31.93	-79.0	39.9	0.79	8254	-4.9792	-0.4042	discard	exp#200 mtf_30m_hma_crossover_4h_trend_rsi_atr_v1	train
dc20990	mtf_30m_hma_crossover_4h_trend_rsi_atr_v1	SOLUSDT	-3.6316	-63.97	-22.61	-67.74	44.9	0.98	8140	-2.5206	-0.3337	discard	exp#200 mtf_30m_hma_crossover_4h_trend_rsi_atr_v1	train
1ef237a	mtf_1h_regime_chop_4h_hma_rsi_macd_atr_v1	BTCUSDT	-3.2842	-50.81	-16.26	-52.16	43.3	0.84	2435	-2.1949	-0.3118	discard	exp#201 mtf_1h_regime_chop_4h_hma_rsi_macd_atr_v1	train
1ef237a	mtf_1h_regime_chop_4h_hma_rsi_macd_atr_v1	ETHUSDT	-2.3777	-48.04	-15.11	-49.28	43.0	0.9	2595	-1.7157	-0.3065	discard	exp#201 mtf_1h_regime_chop_4h_hma_rsi_macd_atr_v1	train
1ef237a	mtf_1h_regime_chop_4h_hma_rsi_macd_atr_v1	SOLUSDT	-0.5345	-11.93	-3.14	-28.72	47.5	1.06	2500	-0.382	-0.1093	discard	exp#201 mtf_1h_regime_chop_4h_hma_rsi_macd_atr_v1	train
1ef237a	mtf_1h_regime_chop_4h_hma_rsi_macd_atr_v1	BTCUSDT	-3.2842	-50.81	-16.26	-52.16	43.3	0.84	2435	-2.1949	-0.3118	discard	exp#201 mtf_1h_regime_chop_4h_hma_rsi_macd_atr_v1	train
1ef237a	mtf_1h_regime_chop_4h_hma_rsi_macd_atr_v1	ETHUSDT	-2.3777	-48.04	-15.11	-49.28	43.0	0.9	2595	-1.7157	-0.3065	discard	exp#201 mtf_1h_regime_chop_4h_hma_rsi_macd_atr_v1	train
1ef237a	mtf_1h_regime_chop_4h_hma_rsi_macd_atr_v1	SOLUSDT	-0.5345	-11.93	-3.14	-28.72	47.5	1.06	2500	-0.382	-0.1093	discard	exp#201 mtf_1h_regime_chop_4h_hma_rsi_macd_atr_v1	train
8c3dc06	mtf_4h_bb_mean_reversion_daily_hma_rsi_atr_v1	BTCUSDT	-3.308	-10.16	-2.64	-11.76	56.3	0.6	119	-0.7	-0.225	discard	exp#202 mtf_4h_bb_mean_reversion_daily_hma_rsi_atr_v1	train
8c3dc06	mtf_4h_bb_mean_reversion_daily_hma_rsi_atr_v1	ETHUSDT	-2.4848	-13.5	-3.56	-13.71	57.8	0.58	116	-0.5176	-0.2597	discard	exp#202 mtf_4h_bb_mean_reversion_daily_hma_rsi_atr_v1	train
8c3dc06	mtf_4h_bb_mean_reversion_daily_hma_rsi_atr_v1	SOLUSDT	-1.3536	-2.35	-0.6	-11.51	57.3	0.98	103	-0.3024	-0.0518	discard	exp#202 mtf_4h_bb_mean_reversion_daily_hma_rsi_atr_v1	train
8c3dc06	mtf_4h_bb_mean_reversion_daily_hma_rsi_atr_v1	BTCUSDT	-3.308	-10.16	-2.64	-11.76	56.3	0.6	119	-0.7	-0.225	discard	exp#202 mtf_4h_bb_mean_reversion_daily_hma_rsi_atr_v1	train
8c3dc06	mtf_4h_bb_mean_reversion_daily_hma_rsi_atr_v1	ETHUSDT	-2.4848	-13.5	-3.56	-13.71	57.8	0.58	116	-0.5176	-0.2597	discard	exp#202 mtf_4h_bb_mean_reversion_daily_hma_rsi_atr_v1	train
8c3dc06	mtf_4h_bb_mean_reversion_daily_hma_rsi_atr_v1	SOLUSDT	-1.3536	-2.35	-0.6	-11.51	57.3	0.98	103	-0.3024	-0.0518	discard	exp#202 mtf_4h_bb_mean_reversion_daily_hma_rsi_atr_v1	train
c080fca	mtf_12h_supertrend_roc_daily_hma_rsi_v1	BTCUSDT	-0.9873	0.02	0.0	-8.64	54.3	1.07	127	-0.437	0.0006	discard	exp#203 mtf_12h_supertrend_roc_daily_hma_rsi_v1	train
c080fca	mtf_12h_supertrend_roc_daily_hma_rsi_v1	ETHUSDT	-1.6943	-16.2	-4.33	-19.66	47.5	0.74	141	-0.7418	-0.22	discard	exp#203 mtf_12h_supertrend_roc_daily_hma_rsi_v1	train
c080fca	mtf_12h_supertrend_roc_daily_hma_rsi_v1	SOLUSDT	-0.68	-1.25	-0.32	-16.13	52.2	1.07	134	-0.3203	-0.0196	discard	exp#203 mtf_12h_supertrend_roc_daily_hma_rsi_v1	train
c080fca	mtf_12h_supertrend_roc_daily_hma_rsi_v1	BTCUSDT	-0.9873	0.02	0.0	-8.64	54.3	1.07	127	-0.437	0.0006	discard	exp#203 mtf_12h_supertrend_roc_daily_hma_rsi_v1	train
c080fca	mtf_12h_supertrend_roc_daily_hma_rsi_v1	ETHUSDT	-1.6943	-16.2	-4.33	-19.66	47.5	0.74	141	-0.7418	-0.22	discard	exp#203 mtf_12h_supertrend_roc_daily_hma_rsi_v1	train
c080fca	mtf_12h_supertrend_roc_daily_hma_rsi_v1	SOLUSDT	-0.68	-1.25	-0.32	-16.13	52.2	1.07	134	-0.3203	-0.0196	discard	exp#203 mtf_12h_supertrend_roc_daily_hma_rsi_v1	train
8302832	mtf_1d_fisher_4h_hma_chop_regime_atr_v1	BTCUSDT	-1.5305	-16.59	-4.43	-17.16	38.1	0.76	168	-1.1228	-0.2584	discard	exp#204 mtf_1d_fisher_4h_hma_chop_regime_atr_v1	train
8302832	mtf_1d_fisher_4h_hma_chop_regime_atr_v1	ETHUSDT	-1.0163	-17.65	-4.74	-28.37	44.9	0.86	214	-0.8526	-0.167	discard	exp#204 mtf_1d_fisher_4h_hma_chop_regime_atr_v1	train
8302832	mtf_1d_fisher_4h_hma_chop_regime_atr_v1	SOLUSDT	-1.1804	-41.89	-12.73	-44.14	42.6	0.75	270	-0.994	-0.2885	discard	exp#204 mtf_1d_fisher_4h_hma_chop_regime_atr_v1	train
8302832	mtf_1d_fisher_4h_hma_chop_regime_atr_v1	BTCUSDT	-1.5305	-16.59	-4.43	-17.16	38.1	0.76	168	-1.1228	-0.2584	discard	exp#204 mtf_1d_fisher_4h_hma_chop_regime_atr_v1	train
8302832	mtf_1d_fisher_4h_hma_chop_regime_atr_v1	ETHUSDT	-1.0163	-17.65	-4.74	-28.37	44.9	0.86	214	-0.8526	-0.167	discard	exp#204 mtf_1d_fisher_4h_hma_chop_regime_atr_v1	train
8302832	mtf_1d_fisher_4h_hma_chop_regime_atr_v1	SOLUSDT	-1.1804	-41.89	-12.73	-44.14	42.6	0.75	270	-0.994	-0.2885	discard	exp#204 mtf_1d_fisher_4h_hma_chop_regime_atr_v1	train
062b306	mtf_15m_regime_rsi_4h_1h_hma_chop_atr_v1	BTCUSDT	-10.2025	-4.48	-1.14	-4.77	48.4	0.73	221	-0.7829	-0.2391	discard	exp#205 mtf_15m_regime_rsi_4h_1h_hma_chop_atr_v1	train
062b306	mtf_15m_regime_rsi_4h_1h_hma_chop_atr_v1	ETHUSDT	-6.4637	-2.44	-0.62	-3.55	51.6	1.05	225	-0.5817	-0.1735	discard	exp#205 mtf_15m_regime_rsi_4h_1h_hma_chop_atr_v1	train
062b306	mtf_15m_regime_rsi_4h_1h_hma_chop_atr_v1	SOLUSDT	-3.8911	-1.95	-0.49	-4.34	61.8	1.04	212	-0.283	-0.1135	discard	exp#205 mtf_15m_regime_rsi_4h_1h_hma_chop_atr_v1	train
062b306	mtf_15m_regime_rsi_4h_1h_hma_chop_atr_v1	BTCUSDT	-10.2025	-4.48	-1.14	-4.77	48.4	0.73	221	-0.7829	-0.2391	discard	exp#205 mtf_15m_regime_rsi_4h_1h_hma_chop_atr_v1	train
062b306	mtf_15m_regime_rsi_4h_1h_hma_chop_atr_v1	ETHUSDT	-6.4637	-2.44	-0.62	-3.55	51.6	1.05	225	-0.5817	-0.1735	discard	exp#205 mtf_15m_regime_rsi_4h_1h_hma_chop_atr_v1	train
062b306	mtf_15m_regime_rsi_4h_1h_hma_chop_atr_v1	SOLUSDT	-3.8911	-1.95	-0.49	-4.34	61.8	1.04	212	-0.283	-0.1135	discard	exp#205 mtf_15m_regime_rsi_4h_1h_hma_chop_atr_v1	train
12a6f58	mtf_30m_kama_4h_hma_rsi_pullback_atr_v1	BTCUSDT	-7.1622	-93.25	-49.05	-93.53	43.1	0.89	11583	-7.7975	-0.5245	discard	exp#206 mtf_30m_kama_4h_hma_rsi_pullback_atr_v1	train
12a6f58	mtf_30m_kama_4h_hma_rsi_pullback_atr_v1	ETHUSDT	-6.1541	-95.08	-52.93	-95.12	43.8	0.86	11615	-6.4508	-0.5565	discard	exp#206 mtf_30m_kama_4h_hma_rsi_pullback_atr_v1	train
12a6f58	mtf_30m_kama_4h_hma_rsi_pullback_atr_v1	SOLUSDT	-2.926	-89.81	-43.64	-89.87	46.0	0.97	11901	-3.1821	-0.4856	discard	exp#206 mtf_30m_kama_4h_hma_rsi_pullback_atr_v1	train
12a6f58	mtf_30m_kama_4h_hma_rsi_pullback_atr_v1	BTCUSDT	-7.1622	-93.25	-49.05	-93.53	43.1	0.89	11583	-7.7975	-0.5245	discard	exp#206 mtf_30m_kama_4h_hma_rsi_pullback_atr_v1	train
12a6f58	mtf_30m_kama_4h_hma_rsi_pullback_atr_v1	ETHUSDT	-6.1541	-95.08	-52.93	-95.12	43.8	0.86	11615	-6.4508	-0.5565	discard	exp#206 mtf_30m_kama_4h_hma_rsi_pullback_atr_v1	train
12a6f58	mtf_30m_kama_4h_hma_rsi_pullback_atr_v1	SOLUSDT	-2.926	-89.81	-43.64	-89.87	46.0	0.97	11901	-3.1821	-0.4856	discard	exp#206 mtf_30m_kama_4h_hma_rsi_pullback_atr_v1	train
