commit	strategy	symbol	sharpe	return_pct	cagr_pct	max_dd_pct	win_rate	profit_factor	trades	sortino	calmar	status	description	period
5a5e441	mtf_12h_kama_daily_hma_chop_regime_rsi_atr_v1	SOLUSDT	0.978	228.31	34.76	-27.67	50.4	1.37	278	1.3791	1.2564	keep	exp#371 mtf_12h_kama_daily_hma_chop_regime_rsi_atr_v1	train
5a5e441	mtf_12h_kama_daily_hma_chop_regime_rsi_atr_v1	SOLUSDT	0.1762	8.11	6.63	-16.88	53.7	1.18	82	0.2087	0.3928	keep	exp#371 mtf_12h_kama_daily_hma_chop_regime_rsi_atr_v1	test
5a5e441	mtf_12h_kama_daily_hma_chop_regime_rsi_atr_v1	BTCUSDT	-0.8784	-32.15	-9.24	-33.51	47.7	0.89	277	-1.0723	-0.2759	discard	exp#371 mtf_12h_kama_daily_hma_chop_regime_rsi_atr_v1	train
5a5e441	mtf_12h_kama_daily_hma_chop_regime_rsi_atr_v1	ETHUSDT	0.1999	32.31	7.25	-18.92	51.6	1.17	277	0.2665	0.3834	keep	exp#371 mtf_12h_kama_daily_hma_chop_regime_rsi_atr_v1	train
5a5e441	mtf_12h_kama_daily_hma_chop_regime_rsi_atr_v1	SOLUSDT	0.978	228.31	34.76	-27.67	50.4	1.37	278	1.3791	1.2564	keep	exp#371 mtf_12h_kama_daily_hma_chop_regime_rsi_atr_v1	train
5a5e441	mtf_12h_kama_daily_hma_chop_regime_rsi_atr_v1	ETHUSDT	0.3504	12.71	10.35	-14.36	51.9	1.33	79	0.4708	0.7205	keep	exp#371 mtf_12h_kama_daily_hma_chop_regime_rsi_atr_v1	test
5a5e441	mtf_12h_kama_daily_hma_chop_regime_rsi_atr_v1	SOLUSDT	0.1762	8.11	6.63	-16.88	53.7	1.18	82	0.2087	0.3928	keep	exp#371 mtf_12h_kama_daily_hma_chop_regime_rsi_atr_v1	test
99bc3e7	mtf_1d_donchian_weekly_hma_chop_regime_rsi_atr_v1	BTCUSDT	-0.9427	-29.4	-8.33	-36.46	33.3	0.93	192	-1.2262	-0.2286	discard	exp#372 mtf_1d_donchian_weekly_hma_chop_regime_rsi_atr_v1	train
99bc3e7	mtf_1d_donchian_weekly_hma_chop_regime_rsi_atr_v1	ETHUSDT	-0.4038	-13.83	-3.65	-31.69	33.5	1.14	179	-0.5526	-0.1153	discard	exp#372 mtf_1d_donchian_weekly_hma_chop_regime_rsi_atr_v1	train
99bc3e7	mtf_1d_donchian_weekly_hma_chop_regime_rsi_atr_v1	SOLUSDT	0.3231	49.39	10.59	-32.87	34.2	1.47	184	0.4694	0.3223	keep	exp#372 mtf_1d_donchian_weekly_hma_chop_regime_rsi_atr_v1	train
99bc3e7	mtf_1d_donchian_weekly_hma_chop_regime_rsi_atr_v1	SOLUSDT	-0.2416	-2.45	-2.02	-23.65	32.2	1.14	59	-0.3186	-0.0853	discard	exp#372 mtf_1d_donchian_weekly_hma_chop_regime_rsi_atr_v1	test
99bc3e7	mtf_1d_donchian_weekly_hma_chop_regime_rsi_atr_v1	BTCUSDT	-0.9427	-29.4	-8.33	-36.46	33.3	0.93	192	-1.2262	-0.2286	discard	exp#372 mtf_1d_donchian_weekly_hma_chop_regime_rsi_atr_v1	train
99bc3e7	mtf_1d_donchian_weekly_hma_chop_regime_rsi_atr_v1	ETHUSDT	-0.4038	-13.83	-3.65	-31.69	33.5	1.14	179	-0.5526	-0.1153	discard	exp#372 mtf_1d_donchian_weekly_hma_chop_regime_rsi_atr_v1	train
99bc3e7	mtf_1d_donchian_weekly_hma_chop_regime_rsi_atr_v1	SOLUSDT	0.3231	49.39	10.59	-32.87	34.2	1.47	184	0.4694	0.3223	discard	exp#372 mtf_1d_donchian_weekly_hma_chop_regime_rsi_atr_v1	train
f4b0c74	mtf_15m_donchian_4h_hma_1h_rsi_volume_atr_v1	BTCUSDT	-9.2049	-98.51	-65.09	-98.57	25.2	0.85	15987	-10.7075	-0.6604	discard	exp#373 mtf_15m_donchian_4h_hma_1h_rsi_volume_atr_v1	train
f4b0c74	mtf_15m_donchian_4h_hma_1h_rsi_volume_atr_v1	ETHUSDT	-5.9716	-96.83	-57.83	-96.92	27.4	0.96	15921	-6.9519	-0.5967	discard	exp#373 mtf_15m_donchian_4h_hma_1h_rsi_volume_atr_v1	train
f4b0c74	mtf_15m_donchian_4h_hma_1h_rsi_volume_atr_v1	SOLUSDT	-2.8277	-92.77	-48.29	-95.27	30.4	1.06	15397	-3.348	-0.5068	discard	exp#373 mtf_15m_donchian_4h_hma_1h_rsi_volume_atr_v1	train
f4b0c74	mtf_15m_donchian_4h_hma_1h_rsi_volume_atr_v1	BTCUSDT	-9.2049	-98.51	-65.09	-98.57	25.2	0.85	15987	-10.7075	-0.6604	discard	exp#373 mtf_15m_donchian_4h_hma_1h_rsi_volume_atr_v1	train
f4b0c74	mtf_15m_donchian_4h_hma_1h_rsi_volume_atr_v1	ETHUSDT	-5.9716	-96.83	-57.83	-96.92	27.4	0.96	15921	-6.9519	-0.5967	discard	exp#373 mtf_15m_donchian_4h_hma_1h_rsi_volume_atr_v1	train
f4b0c74	mtf_15m_donchian_4h_hma_1h_rsi_volume_atr_v1	SOLUSDT	-2.8277	-92.77	-48.29	-95.27	30.4	1.06	15397	-3.348	-0.5068	discard	exp#373 mtf_15m_donchian_4h_hma_1h_rsi_volume_atr_v1	train
72e9ac0	mtf_30m_supertrend_4h_hma_adx_rsi_momentum_atr_v1	BTCUSDT	0.0	0.0	0.0	0.0	0.0	0.0	0	0.0	0.0	discard	exp#374 mtf_30m_supertrend_4h_hma_adx_rsi_momentum_atr_v1	train
72e9ac0	mtf_30m_supertrend_4h_hma_adx_rsi_momentum_atr_v1	ETHUSDT	0.0	0.0	0.0	0.0	0.0	0.0	0	0.0	0.0	discard	exp#374 mtf_30m_supertrend_4h_hma_adx_rsi_momentum_atr_v1	train
72e9ac0	mtf_30m_supertrend_4h_hma_adx_rsi_momentum_atr_v1	SOLUSDT	0.0	0.0	0.0	0.0	0.0	0.0	0	0.0	0.0	discard	exp#374 mtf_30m_supertrend_4h_hma_adx_rsi_momentum_atr_v1	train
72e9ac0	mtf_30m_supertrend_4h_hma_adx_rsi_momentum_atr_v1	BTCUSDT	0.0	0.0	0.0	0.0	0.0	0.0	0	0.0	0.0	discard	exp#374 mtf_30m_supertrend_4h_hma_adx_rsi_momentum_atr_v1	train
72e9ac0	mtf_30m_supertrend_4h_hma_adx_rsi_momentum_atr_v1	ETHUSDT	0.0	0.0	0.0	0.0	0.0	0.0	0	0.0	0.0	discard	exp#374 mtf_30m_supertrend_4h_hma_adx_rsi_momentum_atr_v1	train
72e9ac0	mtf_30m_supertrend_4h_hma_adx_rsi_momentum_atr_v1	SOLUSDT	0.0	0.0	0.0	0.0	0.0	0.0	0	0.0	0.0	discard	exp#374 mtf_30m_supertrend_4h_hma_adx_rsi_momentum_atr_v1	train
4369bfe	mtf_1h_crsi_4h_hma_trend_mean_reversion_atr_v1	BTCUSDT	-4.0464	-52.88	-17.16	-53.02	56.6	0.85	3460	-2.4338	-0.3236	discard	exp#375 mtf_1h_crsi_4h_hma_trend_mean_reversion_atr_v1	train
4369bfe	mtf_1h_crsi_4h_hma_trend_mean_reversion_atr_v1	ETHUSDT	-2.4732	-40.47	-12.17	-43.31	58.6	0.97	3536	-1.5046	-0.281	discard	exp#375 mtf_1h_crsi_4h_hma_trend_mean_reversion_atr_v1	train
4369bfe	mtf_1h_crsi_4h_hma_trend_mean_reversion_atr_v1	SOLUSDT	-1.1124	-29.66	-8.45	-32.08	60.1	1.02	3649	-0.7012	-0.2635	discard	exp#375 mtf_1h_crsi_4h_hma_trend_mean_reversion_atr_v1	train
4369bfe	mtf_1h_crsi_4h_hma_trend_mean_reversion_atr_v1	BTCUSDT	-4.0464	-52.88	-17.16	-53.02	56.6	0.85	3460	-2.4338	-0.3236	discard	exp#375 mtf_1h_crsi_4h_hma_trend_mean_reversion_atr_v1	train
4369bfe	mtf_1h_crsi_4h_hma_trend_mean_reversion_atr_v1	ETHUSDT	-2.4732	-40.47	-12.17	-43.31	58.6	0.97	3536	-1.5046	-0.281	discard	exp#375 mtf_1h_crsi_4h_hma_trend_mean_reversion_atr_v1	train
4369bfe	mtf_1h_crsi_4h_hma_trend_mean_reversion_atr_v1	SOLUSDT	-1.1124	-29.66	-8.45	-32.08	60.1	1.02	3649	-0.7012	-0.2635	discard	exp#375 mtf_1h_crsi_4h_hma_trend_mean_reversion_atr_v1	train
9ceae68	mtf_4h_fisher_donchian_daily_hma_volume_atr_v1	BTCUSDT	-1.365	-9.34	-2.42	-17.14	51.0	0.95	351	-0.4747	-0.1414	discard	exp#376 mtf_4h_fisher_donchian_daily_hma_volume_atr_v1	train
9ceae68	mtf_4h_fisher_donchian_daily_hma_volume_atr_v1	ETHUSDT	-2.3941	-34.27	-9.96	-34.95	44.4	0.65	403	-0.8939	-0.285	discard	exp#376 mtf_4h_fisher_donchian_daily_hma_volume_atr_v1	train
9ceae68	mtf_4h_fisher_donchian_daily_hma_volume_atr_v1	SOLUSDT	-0.2288	10.17	2.46	-12.4	54.7	1.16	386	-0.0909	0.1986	discard	exp#376 mtf_4h_fisher_donchian_daily_hma_volume_atr_v1	train
9ceae68	mtf_4h_fisher_donchian_daily_hma_volume_atr_v1	BTCUSDT	-1.365	-9.34	-2.42	-17.14	51.0	0.95	351	-0.4747	-0.1414	discard	exp#376 mtf_4h_fisher_donchian_daily_hma_volume_atr_v1	train
9ceae68	mtf_4h_fisher_donchian_daily_hma_volume_atr_v1	ETHUSDT	-2.3941	-34.27	-9.96	-34.95	44.4	0.65	403	-0.8939	-0.285	discard	exp#376 mtf_4h_fisher_donchian_daily_hma_volume_atr_v1	train
9ceae68	mtf_4h_fisher_donchian_daily_hma_volume_atr_v1	SOLUSDT	-0.2288	10.17	2.46	-12.4	54.7	1.16	386	-0.0909	0.1986	discard	exp#376 mtf_4h_fisher_donchian_daily_hma_volume_atr_v1	train
b49efe0	mtf_1d_supertrend_weekly_hma_rsi_pullback_vol_atr_v1	BTCUSDT	0.182	30.36	6.85	-21.74	41.3	2.29	75	0.2442	0.3153	keep	exp#378 mtf_1d_supertrend_weekly_hma_rsi_pullback_vol_atr_v1	train
b49efe0	mtf_1d_supertrend_weekly_hma_rsi_pullback_vol_atr_v1	BTCUSDT	-1.4787	-13.57	-11.31	-17.73	33.3	0.74	30	-1.9601	-0.6376	discard	exp#378 mtf_1d_supertrend_weekly_hma_rsi_pullback_vol_atr_v1	test
b49efe0	mtf_1d_supertrend_weekly_hma_rsi_pullback_vol_atr_v1	ETHUSDT	-0.2757	-10.75	-2.8	-30.49	39.4	1.42	71	-0.3556	-0.0919	discard	exp#378 mtf_1d_supertrend_weekly_hma_rsi_pullback_vol_atr_v1	train
b49efe0	mtf_1d_supertrend_weekly_hma_rsi_pullback_vol_atr_v1	SOLUSDT	0.5506	97.45	18.61	-42.4	41.2	3.86	68	0.7401	0.439	keep	exp#378 mtf_1d_supertrend_weekly_hma_rsi_pullback_vol_atr_v1	train
b49efe0	mtf_1d_supertrend_weekly_hma_rsi_pullback_vol_atr_v1	SOLUSDT	-0.762	-15.98	-13.35	-27.14	28.1	1.06	32	-1.0938	-0.4918	discard	exp#378 mtf_1d_supertrend_weekly_hma_rsi_pullback_vol_atr_v1	test
b49efe0	mtf_1d_supertrend_weekly_hma_rsi_pullback_vol_atr_v1	BTCUSDT	0.182	30.36	6.85	-21.74	41.3	2.29	75	0.2442	0.3153	discard	exp#378 mtf_1d_supertrend_weekly_hma_rsi_pullback_vol_atr_v1	train
b49efe0	mtf_1d_supertrend_weekly_hma_rsi_pullback_vol_atr_v1	ETHUSDT	-0.2757	-10.75	-2.8	-30.49	39.4	1.42	71	-0.3556	-0.0919	discard	exp#378 mtf_1d_supertrend_weekly_hma_rsi_pullback_vol_atr_v1	train
b49efe0	mtf_1d_supertrend_weekly_hma_rsi_pullback_vol_atr_v1	SOLUSDT	0.5506	97.45	18.61	-42.4	41.2	3.86	68	0.7401	0.439	discard	exp#378 mtf_1d_supertrend_weekly_hma_rsi_pullback_vol_atr_v1	train
eed0dfa	mtf_15m_supertrend_4h_hma_1h_rsi_adx_momentum_atr_v1	BTCUSDT	-5.5041	-93.01	-48.61	-93.25	36.0	1.03	10564	-6.1521	-0.5213	discard	exp#379 mtf_15m_supertrend_4h_hma_1h_rsi_adx_momentum_atr_v1	train
eed0dfa	mtf_15m_supertrend_4h_hma_1h_rsi_adx_momentum_atr_v1	ETHUSDT	-4.5862	-93.98	-50.5	-94.05	37.3	1.06	10616	-5.0145	-0.5369	discard	exp#379 mtf_15m_supertrend_4h_hma_1h_rsi_adx_momentum_atr_v1	train
eed0dfa	mtf_15m_supertrend_4h_hma_1h_rsi_adx_momentum_atr_v1	SOLUSDT	-2.2416	-89.19	-42.79	-92.72	38.9	1.2	10464	-2.4726	-0.4614	discard	exp#379 mtf_15m_supertrend_4h_hma_1h_rsi_adx_momentum_atr_v1	train
eed0dfa	mtf_15m_supertrend_4h_hma_1h_rsi_adx_momentum_atr_v1	BTCUSDT	-5.5041	-93.01	-48.61	-93.25	36.0	1.03	10564	-6.1521	-0.5213	discard	exp#379 mtf_15m_supertrend_4h_hma_1h_rsi_adx_momentum_atr_v1	train
eed0dfa	mtf_15m_supertrend_4h_hma_1h_rsi_adx_momentum_atr_v1	ETHUSDT	-4.5862	-93.98	-50.5	-94.05	37.3	1.06	10616	-5.0145	-0.5369	discard	exp#379 mtf_15m_supertrend_4h_hma_1h_rsi_adx_momentum_atr_v1	train
eed0dfa	mtf_15m_supertrend_4h_hma_1h_rsi_adx_momentum_atr_v1	SOLUSDT	-2.2416	-89.19	-42.79	-92.72	38.9	1.2	10464	-2.4726	-0.4614	discard	exp#379 mtf_15m_supertrend_4h_hma_1h_rsi_adx_momentum_atr_v1	train
0d322ed	mtf_30m_rsi_bb_fisher_4h_hma_trend_atr_v1	BTCUSDT	-7.944	-97.83	-61.64	-97.9	52.6	0.84	14524	-8.3146	-0.6297	discard	exp#380 mtf_30m_rsi_bb_fisher_4h_hma_trend_atr_v1	train
0d322ed	mtf_30m_rsi_bb_fisher_4h_hma_trend_atr_v1	ETHUSDT	-6.117	-97.71	-61.13	-97.78	53.7	0.89	14407	-6.3566	-0.6252	discard	exp#380 mtf_30m_rsi_bb_fisher_4h_hma_trend_atr_v1	train
0d322ed	mtf_30m_rsi_bb_fisher_4h_hma_trend_atr_v1	SOLUSDT	-4.1398	-98.52	-65.3	-98.59	55.7	0.83	14261	-4.3531	-0.6623	discard	exp#380 mtf_30m_rsi_bb_fisher_4h_hma_trend_atr_v1	train
0d322ed	mtf_30m_rsi_bb_fisher_4h_hma_trend_atr_v1	BTCUSDT	-7.944	-97.83	-61.64	-97.9	52.6	0.84	14524	-8.3146	-0.6297	discard	exp#380 mtf_30m_rsi_bb_fisher_4h_hma_trend_atr_v1	train
0d322ed	mtf_30m_rsi_bb_fisher_4h_hma_trend_atr_v1	ETHUSDT	-6.117	-97.71	-61.13	-97.78	53.7	0.89	14407	-6.3566	-0.6252	discard	exp#380 mtf_30m_rsi_bb_fisher_4h_hma_trend_atr_v1	train
0d322ed	mtf_30m_rsi_bb_fisher_4h_hma_trend_atr_v1	SOLUSDT	-4.1398	-98.52	-65.3	-98.59	55.7	0.83	14261	-4.3531	-0.6623	discard	exp#380 mtf_30m_rsi_bb_fisher_4h_hma_trend_atr_v1	train
852b49c	mtf_1h_supertrend_4h_hma_rsi_pullback_vol_atr_v1	BTCUSDT	-2.0856	-59.56	-20.27	-63.27	35.2	0.93	3456	-2.3641	-0.3203	discard	exp#381 mtf_1h_supertrend_4h_hma_rsi_pullback_vol_atr_v1	train
852b49c	mtf_1h_supertrend_4h_hma_rsi_pullback_vol_atr_v1	ETHUSDT	-0.9454	-37.35	-11.04	-48.27	36.3	1.03	3512	-1.0736	-0.2287	discard	exp#381 mtf_1h_supertrend_4h_hma_rsi_pullback_vol_atr_v1	train
852b49c	mtf_1h_supertrend_4h_hma_rsi_pullback_vol_atr_v1	SOLUSDT	-0.088	-3.19	-0.81	-49.25	36.4	1.06	3690	-0.1066	-0.0165	discard	exp#381 mtf_1h_supertrend_4h_hma_rsi_pullback_vol_atr_v1	train
852b49c	mtf_1h_supertrend_4h_hma_rsi_pullback_vol_atr_v1	BTCUSDT	-2.0856	-59.56	-20.27	-63.27	35.2	0.93	3456	-2.3641	-0.3203	discard	exp#381 mtf_1h_supertrend_4h_hma_rsi_pullback_vol_atr_v1	train
852b49c	mtf_1h_supertrend_4h_hma_rsi_pullback_vol_atr_v1	ETHUSDT	-0.9454	-37.35	-11.04	-48.27	36.3	1.03	3512	-1.0736	-0.2287	discard	exp#381 mtf_1h_supertrend_4h_hma_rsi_pullback_vol_atr_v1	train
852b49c	mtf_1h_supertrend_4h_hma_rsi_pullback_vol_atr_v1	SOLUSDT	-0.088	-3.19	-0.81	-49.25	36.4	1.06	3690	-0.1066	-0.0165	discard	exp#381 mtf_1h_supertrend_4h_hma_rsi_pullback_vol_atr_v1	train
bb426cc	mtf_4h_ema_daily_hma_rsi_pullback_atr_v1	BTCUSDT	-0.5371	0.19	0.05	-23.99	56.2	1.08	1116	-0.4963	0.002	discard	exp#382 mtf_4h_ema_daily_hma_rsi_pullback_atr_v1	train
bb426cc	mtf_4h_ema_daily_hma_rsi_pullback_atr_v1	ETHUSDT	-1.0723	-25.56	-7.12	-37.33	55.6	0.96	1152	-0.9851	-0.1906	discard	exp#382 mtf_4h_ema_daily_hma_rsi_pullback_atr_v1	train
bb426cc	mtf_4h_ema_daily_hma_rsi_pullback_atr_v1	SOLUSDT	0.7635	94.54	18.18	-15.36	61.1	1.21	1141	0.7631	1.1837	keep	exp#382 mtf_4h_ema_daily_hma_rsi_pullback_atr_v1	train
bb426cc	mtf_4h_ema_daily_hma_rsi_pullback_atr_v1	SOLUSDT	-1.773	-18.83	-15.77	-23.56	51.9	0.85	360	-1.637	-0.6692	discard	exp#382 mtf_4h_ema_daily_hma_rsi_pullback_atr_v1	test
bb426cc	mtf_4h_ema_daily_hma_rsi_pullback_atr_v1	BTCUSDT	-0.5371	0.19	0.05	-23.99	56.2	1.08	1116	-0.4963	0.002	discard	exp#382 mtf_4h_ema_daily_hma_rsi_pullback_atr_v1	train
bb426cc	mtf_4h_ema_daily_hma_rsi_pullback_atr_v1	ETHUSDT	-1.0723	-25.56	-7.12	-37.33	55.6	0.96	1152	-0.9851	-0.1906	discard	exp#382 mtf_4h_ema_daily_hma_rsi_pullback_atr_v1	train
bb426cc	mtf_4h_ema_daily_hma_rsi_pullback_atr_v1	SOLUSDT	0.7635	94.54	18.18	-15.36	61.1	1.21	1141	0.7631	1.1837	discard	exp#382 mtf_4h_ema_daily_hma_rsi_pullback_atr_v1	train
ea25d76	mtf_12h_hma_daily_hma_chop_regime_rsi_atr_v1	BTCUSDT	-0.2923	-2.89	-0.73	-29.75	41.5	1.05	426	-0.3776	-0.0245	discard	exp#383 mtf_12h_hma_daily_hma_chop_regime_rsi_atr_v1	train
ea25d76	mtf_12h_hma_daily_hma_chop_regime_rsi_atr_v1	ETHUSDT	0.2681	39.67	8.72	-27.42	41.3	1.19	438	0.3609	0.3179	keep	exp#383 mtf_12h_hma_daily_hma_chop_regime_rsi_atr_v1	train
ea25d76	mtf_12h_hma_daily_hma_chop_regime_rsi_atr_v1	ETHUSDT	-1.1519	-19.86	-16.65	-26.3	42.2	0.83	128	-1.4083	-0.6332	discard	exp#383 mtf_12h_hma_daily_hma_chop_regime_rsi_atr_v1	test
ea25d76	mtf_12h_hma_daily_hma_chop_regime_rsi_atr_v1	SOLUSDT	0.4391	72.35	14.64	-34.5	44.6	1.17	433	0.5766	0.4242	keep	exp#383 mtf_12h_hma_daily_hma_chop_regime_rsi_atr_v1	train
ea25d76	mtf_12h_hma_daily_hma_chop_regime_rsi_atr_v1	SOLUSDT	0.1224	6.52	5.34	-28.47	42.8	1.1	138	0.173	0.1875	keep	exp#383 mtf_12h_hma_daily_hma_chop_regime_rsi_atr_v1	test
ea25d76	mtf_12h_hma_daily_hma_chop_regime_rsi_atr_v1	BTCUSDT	-0.2923	-2.89	-0.73	-29.75	41.5	1.05	426	-0.3776	-0.0245	discard	exp#383 mtf_12h_hma_daily_hma_chop_regime_rsi_atr_v1	train
ea25d76	mtf_12h_hma_daily_hma_chop_regime_rsi_atr_v1	ETHUSDT	0.2681	39.67	8.72	-27.42	41.3	1.19	438	0.3609	0.3179	keep	exp#383 mtf_12h_hma_daily_hma_chop_regime_rsi_atr_v1	train
ea25d76	mtf_12h_hma_daily_hma_chop_regime_rsi_atr_v1	SOLUSDT	0.4391	72.35	14.64	-34.5	44.6	1.17	433	0.5766	0.4242	keep	exp#383 mtf_12h_hma_daily_hma_chop_regime_rsi_atr_v1	train
ea25d76	mtf_12h_hma_daily_hma_chop_regime_rsi_atr_v1	ETHUSDT	-1.1519	-19.86	-16.65	-26.3	42.2	0.83	128	-1.4083	-0.6332	discard	exp#383 mtf_12h_hma_daily_hma_chop_regime_rsi_atr_v1	test
ea25d76	mtf_12h_hma_daily_hma_chop_regime_rsi_atr_v1	SOLUSDT	0.1224	6.52	5.34	-28.47	42.8	1.1	138	0.173	0.1875	keep	exp#383 mtf_12h_hma_daily_hma_chop_regime_rsi_atr_v1	test
2515e93	mtf_1d_supertrend_weekly_hma_rsi_pullback_atr_v1	BTCUSDT	-0.295	4.3	1.06	-19.02	54.5	1.1	143	-0.3443	0.0556	discard	exp#384 mtf_1d_supertrend_weekly_hma_rsi_pullback_atr_v1	train
2515e93	mtf_1d_supertrend_weekly_hma_rsi_pullback_atr_v1	ETHUSDT	-0.288	-1.8	-0.45	-27.25	56.5	1.07	131	-0.342	-0.0167	discard	exp#384 mtf_1d_supertrend_weekly_hma_rsi_pullback_atr_v1	train
2515e93	mtf_1d_supertrend_weekly_hma_rsi_pullback_atr_v1	SOLUSDT	0.1599	28.0	6.39	-25.22	57.9	1.19	140	0.2021	0.2533	keep	exp#384 mtf_1d_supertrend_weekly_hma_rsi_pullback_atr_v1	train
2515e93	mtf_1d_supertrend_weekly_hma_rsi_pullback_atr_v1	SOLUSDT	-0.1582	1.04	0.85	-17.1	50.0	1.07	52	-0.2005	0.0499	discard	exp#384 mtf_1d_supertrend_weekly_hma_rsi_pullback_atr_v1	test
2515e93	mtf_1d_supertrend_weekly_hma_rsi_pullback_atr_v1	BTCUSDT	-0.295	4.3	1.06	-19.02	54.5	1.1	143	-0.3443	0.0556	discard	exp#384 mtf_1d_supertrend_weekly_hma_rsi_pullback_atr_v1	train
2515e93	mtf_1d_supertrend_weekly_hma_rsi_pullback_atr_v1	ETHUSDT	-0.288	-1.8	-0.45	-27.25	56.5	1.07	131	-0.342	-0.0167	discard	exp#384 mtf_1d_supertrend_weekly_hma_rsi_pullback_atr_v1	train
2515e93	mtf_1d_supertrend_weekly_hma_rsi_pullback_atr_v1	SOLUSDT	0.1599	28.0	6.39	-25.22	57.9	1.19	140	0.2021	0.2533	discard	exp#384 mtf_1d_supertrend_weekly_hma_rsi_pullback_atr_v1	train
7a1692f	mtf_15m_rsi_mr_4h_hma_trend_atr_v1	BTCUSDT	-8.9849	-95.48	-53.93	-95.63	62.0	0.86	13629	-6.1113	-0.5639	discard	exp#385 mtf_15m_rsi_mr_4h_hma_trend_atr_v1	train
7a1692f	mtf_15m_rsi_mr_4h_hma_trend_atr_v1	ETHUSDT	-7.3899	-95.86	-54.93	-95.95	63.1	0.87	13596	-5.0575	-0.5724	discard	exp#385 mtf_15m_rsi_mr_4h_hma_trend_atr_v1	train
7a1692f	mtf_15m_rsi_mr_4h_hma_trend_atr_v1	SOLUSDT	-3.9178	-93.5	-49.66	-93.73	66.3	0.87	13668	-2.6795	-0.5298	discard	exp#385 mtf_15m_rsi_mr_4h_hma_trend_atr_v1	train
7a1692f	mtf_15m_rsi_mr_4h_hma_trend_atr_v1	BTCUSDT	-8.9849	-95.48	-53.93	-95.63	62.0	0.86	13629	-6.1113	-0.5639	discard	exp#385 mtf_15m_rsi_mr_4h_hma_trend_atr_v1	train
7a1692f	mtf_15m_rsi_mr_4h_hma_trend_atr_v1	ETHUSDT	-7.3899	-95.86	-54.93	-95.95	63.1	0.87	13596	-5.0575	-0.5724	discard	exp#385 mtf_15m_rsi_mr_4h_hma_trend_atr_v1	train
7a1692f	mtf_15m_rsi_mr_4h_hma_trend_atr_v1	SOLUSDT	-3.9178	-93.5	-49.66	-93.73	66.3	0.87	13668	-2.6795	-0.5298	discard	exp#385 mtf_15m_rsi_mr_4h_hma_trend_atr_v1	train
72c81fa	mtf_30m_donchian_4h_hma_adx_rsi_atr_v1	BTCUSDT	-5.7151	-69.38	-25.63	-69.65	33.8	0.72	3647	-2.7817	-0.3679	discard	exp#386 mtf_30m_donchian_4h_hma_adx_rsi_atr_v1	train
72c81fa	mtf_30m_donchian_4h_hma_adx_rsi_atr_v1	ETHUSDT	-4.847	-69.37	-25.62	-69.54	35.7	0.77	3855	-2.4124	-0.3684	discard	exp#386 mtf_30m_donchian_4h_hma_adx_rsi_atr_v1	train
72c81fa	mtf_30m_donchian_4h_hma_adx_rsi_atr_v1	SOLUSDT	-3.6375	-80.38	-33.56	-81.83	36.5	0.82	4343	-1.8806	-0.4101	discard	exp#386 mtf_30m_donchian_4h_hma_adx_rsi_atr_v1	train
72c81fa	mtf_30m_donchian_4h_hma_adx_rsi_atr_v1	BTCUSDT	-5.7151	-69.38	-25.63	-69.65	33.8	0.72	3647	-2.7817	-0.3679	discard	exp#386 mtf_30m_donchian_4h_hma_adx_rsi_atr_v1	train
72c81fa	mtf_30m_donchian_4h_hma_adx_rsi_atr_v1	ETHUSDT	-4.847	-69.37	-25.62	-69.54	35.7	0.77	3855	-2.4124	-0.3684	discard	exp#386 mtf_30m_donchian_4h_hma_adx_rsi_atr_v1	train
72c81fa	mtf_30m_donchian_4h_hma_adx_rsi_atr_v1	SOLUSDT	-3.6375	-80.38	-33.56	-81.83	36.5	0.82	4343	-1.8806	-0.4101	discard	exp#386 mtf_30m_donchian_4h_hma_adx_rsi_atr_v1	train
7413e2b	mtf_1h_kama_4h_hma_volume_rsi_atr_v1	BTCUSDT	-3.3536	-75.0	-29.31	-75.73	47.4	0.86	4424	-3.714	-0.387	discard	exp#387 mtf_1h_kama_4h_hma_volume_rsi_atr_v1	train
7413e2b	mtf_1h_kama_4h_hma_volume_rsi_atr_v1	ETHUSDT	-1.7512	-58.68	-19.83	-60.68	49.2	0.98	4473	-2.0119	-0.3268	discard	exp#387 mtf_1h_kama_4h_hma_volume_rsi_atr_v1	train
7413e2b	mtf_1h_kama_4h_hma_volume_rsi_atr_v1	SOLUSDT	-0.647	-41.29	-12.51	-45.23	51.5	1.01	4587	-0.7346	-0.2766	discard	exp#387 mtf_1h_kama_4h_hma_volume_rsi_atr_v1	train
7413e2b	mtf_1h_kama_4h_hma_volume_rsi_atr_v1	BTCUSDT	-3.3536	-75.0	-29.31	-75.73	47.4	0.86	4424	-3.714	-0.387	discard	exp#387 mtf_1h_kama_4h_hma_volume_rsi_atr_v1	train
7413e2b	mtf_1h_kama_4h_hma_volume_rsi_atr_v1	ETHUSDT	-1.7512	-58.68	-19.83	-60.68	49.2	0.98	4473	-2.0119	-0.3268	discard	exp#387 mtf_1h_kama_4h_hma_volume_rsi_atr_v1	train
7413e2b	mtf_1h_kama_4h_hma_volume_rsi_atr_v1	SOLUSDT	-0.647	-41.29	-12.51	-45.23	51.5	1.01	4587	-0.7346	-0.2766	discard	exp#387 mtf_1h_kama_4h_hma_volume_rsi_atr_v1	train
339998f	mtf_4h_fisher_chop_regime_daily_hma_atr_v1	BTCUSDT	-1.2311	-26.07	-7.28	-27.0	40.5	0.97	1604	-1.2864	-0.2694	discard	exp#388 mtf_4h_fisher_chop_regime_daily_hma_atr_v1	train
339998f	mtf_4h_fisher_chop_regime_daily_hma_atr_v1	ETHUSDT	-0.8905	-22.89	-6.3	-25.0	41.6	1.0	1614	-0.9151	-0.2518	discard	exp#388 mtf_4h_fisher_chop_regime_daily_hma_atr_v1	train
339998f	mtf_4h_fisher_chop_regime_daily_hma_atr_v1	SOLUSDT	-0.1985	-1.43	-0.36	-31.09	41.6	1.05	1637	-0.2081	-0.0116	discard	exp#388 mtf_4h_fisher_chop_regime_daily_hma_atr_v1	train
339998f	mtf_4h_fisher_chop_regime_daily_hma_atr_v1	BTCUSDT	-1.2311	-26.07	-7.28	-27.0	40.5	0.97	1604	-1.2864	-0.2694	discard	exp#388 mtf_4h_fisher_chop_regime_daily_hma_atr_v1	train
339998f	mtf_4h_fisher_chop_regime_daily_hma_atr_v1	ETHUSDT	-0.8905	-22.89	-6.3	-25.0	41.6	1.0	1614	-0.9151	-0.2518	discard	exp#388 mtf_4h_fisher_chop_regime_daily_hma_atr_v1	train
339998f	mtf_4h_fisher_chop_regime_daily_hma_atr_v1	SOLUSDT	-0.1985	-1.43	-0.36	-31.09	41.6	1.05	1637	-0.2081	-0.0116	discard	exp#388 mtf_4h_fisher_chop_regime_daily_hma_atr_v1	train
7f2a050	mtf_1d_crsi_weekly_hma_chop_regime_atr_v1	BTCUSDT	-1.3682	-5.05	-1.29	-11.55	67.3	0.83	52	-0.4644	-0.1115	discard	exp#390 mtf_1d_crsi_weekly_hma_chop_regime_atr_v1	train
7f2a050	mtf_1d_crsi_weekly_hma_chop_regime_atr_v1	ETHUSDT	-1.3047	-9.5	-2.46	-14.92	65.2	0.72	46	-0.4487	-0.1651	discard	exp#390 mtf_1d_crsi_weekly_hma_chop_regime_atr_v1	train
7f2a050	mtf_1d_crsi_weekly_hma_chop_regime_atr_v1	SOLUSDT	-0.7056	0.4	0.1	-13.64	64.9	1.03	57	-0.2761	0.0073	discard	exp#390 mtf_1d_crsi_weekly_hma_chop_regime_atr_v1	train
7f2a050	mtf_1d_crsi_weekly_hma_chop_regime_atr_v1	BTCUSDT	-1.3682	-5.05	-1.29	-11.55	67.3	0.83	52	-0.4644	-0.1115	discard	exp#390 mtf_1d_crsi_weekly_hma_chop_regime_atr_v1	train
7f2a050	mtf_1d_crsi_weekly_hma_chop_regime_atr_v1	ETHUSDT	-1.3047	-9.5	-2.46	-14.92	65.2	0.72	46	-0.4487	-0.1651	discard	exp#390 mtf_1d_crsi_weekly_hma_chop_regime_atr_v1	train
7f2a050	mtf_1d_crsi_weekly_hma_chop_regime_atr_v1	SOLUSDT	-0.7056	0.4	0.1	-13.64	64.9	1.03	57	-0.2761	0.0073	discard	exp#390 mtf_1d_crsi_weekly_hma_chop_regime_atr_v1	train
