commit	strategy	symbol	sharpe	return_pct	cagr_pct	max_dd_pct	win_rate	profit_factor	trades	sortino	calmar	status	description	period
079ca68	mtf_1d_donchian_weekly_hma_vol_v1	BTCUSDT	-0.6074	-13.19	-3.47	-25.15	41.0	1.31	256	-0.6728	-0.1381	discard	exp#030 mtf_1d_donchian_weekly_hma_vol_v1	train
079ca68	mtf_1d_donchian_weekly_hma_vol_v1	ETHUSDT	0.2288	34.39	7.67	-19.26	45.9	2.02	255	0.2666	0.3981	discard	exp#030 mtf_1d_donchian_weekly_hma_vol_v1	train
079ca68	mtf_1d_donchian_weekly_hma_vol_v1	SOLUSDT	0.5919	97.13	18.56	-28.22	48.3	2.23	232	0.7379	0.6578	discard	exp#030 mtf_1d_donchian_weekly_hma_vol_v1	train
731dd4d	mtf_30m_supertrend_4h_1d_hma_rsi_v1	BTCUSDT	-6.1083	-93.48	-49.5	-93.66	36.4	1.41	8900	-6.4021	-0.5285	discard	exp#032 mtf_30m_supertrend_4h_1d_hma_rsi_v1	train
731dd4d	mtf_30m_supertrend_4h_1d_hma_rsi_v1	ETHUSDT	-4.1296	-89.8	-43.51	-90.51	38.0	1.6	8937	-4.2987	-0.4807	discard	exp#032 mtf_30m_supertrend_4h_1d_hma_rsi_v1	train
731dd4d	mtf_30m_supertrend_4h_1d_hma_rsi_v1	SOLUSDT	-1.4658	-73.99	-28.69	-86.86	40.3	1.91	8812	-1.5791	-0.3303	discard	exp#032 mtf_30m_supertrend_4h_1d_hma_rsi_v1	train
731dd4d	mtf_30m_supertrend_4h_1d_hma_rsi_v1	BTCUSDT	-6.1083	-93.48	-49.5	-93.66	36.4	1.41	8900	-6.4021	-0.5285	discard	exp#032 mtf_30m_supertrend_4h_1d_hma_rsi_v1	train
731dd4d	mtf_30m_supertrend_4h_1d_hma_rsi_v1	ETHUSDT	-4.1296	-89.8	-43.51	-90.51	38.0	1.6	8937	-4.2987	-0.4807	discard	exp#032 mtf_30m_supertrend_4h_1d_hma_rsi_v1	train
731dd4d	mtf_30m_supertrend_4h_1d_hma_rsi_v1	SOLUSDT	-1.4658	-73.99	-28.69	-86.86	40.3	1.91	8812	-1.5791	-0.3303	discard	exp#032 mtf_30m_supertrend_4h_1d_hma_rsi_v1	train
8a188d9	mtf_1h_donchian_4h_hma_vol_v1	BTCUSDT	-4.0523	-87.59	-40.67	-88.15	32.8	1.03	6992	-4.8504	-0.4614	discard	exp#033 mtf_1h_donchian_4h_hma_vol_v1	train
8a188d9	mtf_1h_donchian_4h_hma_vol_v1	ETHUSDT	-3.1308	-87.0	-39.97	-87.05	34.0	1.04	6944	-3.7122	-0.4592	discard	exp#033 mtf_1h_donchian_4h_hma_vol_v1	train
8a188d9	mtf_1h_donchian_4h_hma_vol_v1	SOLUSDT	-1.6531	-84.64	-37.52	-88.59	37.2	1.23	6795	-1.8949	-0.4235	discard	exp#033 mtf_1h_donchian_4h_hma_vol_v1	train
8a188d9	mtf_1h_donchian_4h_hma_vol_v1	BTCUSDT	-4.0523	-87.59	-40.67	-88.15	32.8	1.03	6992	-4.8504	-0.4614	discard	exp#033 mtf_1h_donchian_4h_hma_vol_v1	train
8a188d9	mtf_1h_donchian_4h_hma_vol_v1	ETHUSDT	-3.1308	-87.0	-39.97	-87.05	34.0	1.04	6944	-3.7122	-0.4592	discard	exp#033 mtf_1h_donchian_4h_hma_vol_v1	train
8a188d9	mtf_1h_donchian_4h_hma_vol_v1	SOLUSDT	-1.6531	-84.64	-37.52	-88.59	37.2	1.23	6795	-1.8949	-0.4235	discard	exp#033 mtf_1h_donchian_4h_hma_vol_v1	train
f964ce8	mtf_4h_fisher_daily_hma_atr_v1	BTCUSDT	-1.8265	-52.59	-17.03	-54.08	45.2	0.95	3360	-2.1221	-0.3149	discard	exp#034 mtf_4h_fisher_daily_hma_atr_v1	train
f964ce8	mtf_4h_fisher_daily_hma_atr_v1	ETHUSDT	-1.4903	-53.52	-17.44	-56.43	45.9	0.95	3376	-1.7293	-0.3091	discard	exp#034 mtf_4h_fisher_daily_hma_atr_v1	train
f964ce8	mtf_4h_fisher_daily_hma_atr_v1	SOLUSDT	-0.7688	-44.27	-13.65	-50.11	47.9	0.99	3196	-0.8939	-0.2724	discard	exp#034 mtf_4h_fisher_daily_hma_atr_v1	train
f964ce8	mtf_4h_fisher_daily_hma_atr_v1	BTCUSDT	-1.8265	-52.59	-17.03	-54.08	45.2	0.95	3360	-2.1221	-0.3149	discard	exp#034 mtf_4h_fisher_daily_hma_atr_v1	train
f964ce8	mtf_4h_fisher_daily_hma_atr_v1	ETHUSDT	-1.4903	-53.52	-17.44	-56.43	45.9	0.95	3376	-1.7293	-0.3091	discard	exp#034 mtf_4h_fisher_daily_hma_atr_v1	train
f964ce8	mtf_4h_fisher_daily_hma_atr_v1	SOLUSDT	-0.7688	-44.27	-13.65	-50.11	47.9	0.99	3196	-0.8939	-0.2724	discard	exp#034 mtf_4h_fisher_daily_hma_atr_v1	train
3f606ef	mtf_12h_supertrend_daily_crsi_donchian_v1	BTCUSDT	-0.6087	-11.21	-2.93	-18.81	51.1	1.25	362	-0.5915	-0.1558	discard	exp#035 mtf_12h_supertrend_daily_crsi_donchian_v1	train
3f606ef	mtf_12h_supertrend_daily_crsi_donchian_v1	ETHUSDT	0.2076	32.09	7.21	-21.9	59.0	2.29	371	0.2216	0.3292	keep	exp#035 mtf_12h_supertrend_daily_crsi_donchian_v1	train
3f606ef	mtf_12h_supertrend_daily_crsi_donchian_v1	ETHUSDT	-0.3324	-1.16	-0.95	-19.52	46.4	1.37	112	-0.3614	-0.0487	discard	exp#035 mtf_12h_supertrend_daily_crsi_donchian_v1	test
3f606ef	mtf_12h_supertrend_daily_crsi_donchian_v1	SOLUSDT	1.1851	247.26	36.67	-26.03	56.2	2.26	347	1.4049	1.4089	keep	exp#035 mtf_12h_supertrend_daily_crsi_donchian_v1	train
3f606ef	mtf_12h_supertrend_daily_crsi_donchian_v1	SOLUSDT	0.4028	13.37	10.87	-13.85	58.8	1.62	114	0.4867	0.7852	keep	exp#035 mtf_12h_supertrend_daily_crsi_donchian_v1	test
3f606ef	mtf_12h_supertrend_daily_crsi_donchian_v1	BTCUSDT	-0.6087	-11.21	-2.93	-18.81	51.1	1.25	362	-0.5915	-0.1558	discard	exp#035 mtf_12h_supertrend_daily_crsi_donchian_v1	train
3f606ef	mtf_12h_supertrend_daily_crsi_donchian_v1	ETHUSDT	0.2076	32.09	7.21	-21.9	59.0	2.29	371	0.2216	0.3292	keep	exp#035 mtf_12h_supertrend_daily_crsi_donchian_v1	train
3f606ef	mtf_12h_supertrend_daily_crsi_donchian_v1	SOLUSDT	1.1851	247.26	36.67	-26.03	56.2	2.26	347	1.4049	1.4089	keep	exp#035 mtf_12h_supertrend_daily_crsi_donchian_v1	train
3f606ef	mtf_12h_supertrend_daily_crsi_donchian_v1	ETHUSDT	-0.3324	-1.16	-0.95	-19.52	46.4	1.37	112	-0.3614	-0.0487	discard	exp#035 mtf_12h_supertrend_daily_crsi_donchian_v1	test
3f606ef	mtf_12h_supertrend_daily_crsi_donchian_v1	SOLUSDT	0.4028	13.37	10.87	-13.85	58.8	1.62	114	0.4867	0.7852	keep	exp#035 mtf_12h_supertrend_daily_crsi_donchian_v1	test
2014d88	mtf_15m_supertrend_4h_hma_rsi_vol_v1	BTCUSDT	-7.6081	-98.35	-64.18	-98.45	68.1	6.37	22210	-8.3189	-0.6519	discard	exp#037 mtf_15m_supertrend_4h_hma_rsi_vol_v1	train
2014d88	mtf_15m_supertrend_4h_hma_rsi_vol_v1	ETHUSDT	-6.2259	-98.59	-65.56	-98.69	69.8	6.25	22781	-6.6305	-0.6643	discard	exp#037 mtf_15m_supertrend_4h_hma_rsi_vol_v1	train
2014d88	mtf_15m_supertrend_4h_hma_rsi_vol_v1	SOLUSDT	-2.8066	-95.74	-54.72	-96.85	71.7	6.77	22587	-3.1609	-0.565	discard	exp#037 mtf_15m_supertrend_4h_hma_rsi_vol_v1	train
2014d88	mtf_15m_supertrend_4h_hma_rsi_vol_v1	BTCUSDT	-7.6081	-98.35	-64.18	-98.45	68.1	6.37	22210	-8.3189	-0.6519	discard	exp#037 mtf_15m_supertrend_4h_hma_rsi_vol_v1	train
2014d88	mtf_15m_supertrend_4h_hma_rsi_vol_v1	ETHUSDT	-6.2259	-98.59	-65.56	-98.69	69.8	6.25	22781	-6.6305	-0.6643	discard	exp#037 mtf_15m_supertrend_4h_hma_rsi_vol_v1	train
2014d88	mtf_15m_supertrend_4h_hma_rsi_vol_v1	SOLUSDT	-2.8066	-95.74	-54.72	-96.85	71.7	6.77	22587	-3.1609	-0.565	discard	exp#037 mtf_15m_supertrend_4h_hma_rsi_vol_v1	train
d35e998	mtf_30m_chop_regime_4h_hma_rsi_v2	BTCUSDT	-5.0892	-83.44	-36.22	-83.52	42.8	1.25	8579	-4.6334	-0.4337	discard	exp#038 mtf_30m_chop_regime_4h_hma_rsi_v2	train
d35e998	mtf_30m_chop_regime_4h_hma_rsi_v2	ETHUSDT	-3.8672	-82.03	-34.91	-82.12	44.0	1.36	8663	-3.6571	-0.4252	discard	exp#038 mtf_30m_chop_regime_4h_hma_rsi_v2	train
d35e998	mtf_30m_chop_regime_4h_hma_rsi_v2	SOLUSDT	-2.2818	-80.68	-33.81	-82.73	46.5	1.57	8838	-2.2034	-0.4087	discard	exp#038 mtf_30m_chop_regime_4h_hma_rsi_v2	train
d35e998	mtf_30m_chop_regime_4h_hma_rsi_v2	BTCUSDT	-5.0892	-83.44	-36.22	-83.52	42.8	1.25	8579	-4.6334	-0.4337	discard	exp#038 mtf_30m_chop_regime_4h_hma_rsi_v2	train
d35e998	mtf_30m_chop_regime_4h_hma_rsi_v2	ETHUSDT	-3.8672	-82.03	-34.91	-82.12	44.0	1.36	8663	-3.6571	-0.4252	discard	exp#038 mtf_30m_chop_regime_4h_hma_rsi_v2	train
d35e998	mtf_30m_chop_regime_4h_hma_rsi_v2	SOLUSDT	-2.2818	-80.68	-33.81	-82.73	46.5	1.57	8838	-2.2034	-0.4087	discard	exp#038 mtf_30m_chop_regime_4h_hma_rsi_v2	train
2d8091a	mtf_1h_regime_supertrend_4h_hma_rsi_v1	BTCUSDT	-2.3808	-51.06	-16.37	-55.64	48.7	1.28	3621	-2.211	-0.2943	discard	exp#039 mtf_1h_regime_supertrend_4h_hma_rsi_v1	train
2d8091a	mtf_1h_regime_supertrend_4h_hma_rsi_v1	ETHUSDT	-2.0848	-54.82	-18.02	-61.22	47.6	1.32	3595	-1.8703	-0.2944	discard	exp#039 mtf_1h_regime_supertrend_4h_hma_rsi_v1	train
2d8091a	mtf_1h_regime_supertrend_4h_hma_rsi_v1	SOLUSDT	-0.7121	-33.73	-9.81	-61.77	49.5	1.46	3572	-0.6646	-0.1589	discard	exp#039 mtf_1h_regime_supertrend_4h_hma_rsi_v1	train
2d8091a	mtf_1h_regime_supertrend_4h_hma_rsi_v1	BTCUSDT	-2.3808	-51.06	-16.37	-55.64	48.7	1.28	3621	-2.211	-0.2943	discard	exp#039 mtf_1h_regime_supertrend_4h_hma_rsi_v1	train
2d8091a	mtf_1h_regime_supertrend_4h_hma_rsi_v1	ETHUSDT	-2.0848	-54.82	-18.02	-61.22	47.6	1.32	3595	-1.8703	-0.2944	discard	exp#039 mtf_1h_regime_supertrend_4h_hma_rsi_v1	train
2d8091a	mtf_1h_regime_supertrend_4h_hma_rsi_v1	SOLUSDT	-0.7121	-33.73	-9.81	-61.77	49.5	1.46	3572	-0.6646	-0.1589	discard	exp#039 mtf_1h_regime_supertrend_4h_hma_rsi_v1	train
1817725	mtf_4h_kama_weekly_hma_rsi_pullback_v1	BTCUSDT	-0.853	-17.3	-4.64	-35.25	43.4	1.04	1352	-0.9287	-0.1317	discard	exp#040 mtf_4h_kama_weekly_hma_rsi_pullback_v1	train
1817725	mtf_4h_kama_weekly_hma_rsi_pullback_v1	ETHUSDT	-1.0285	-33.04	-9.55	-40.65	42.8	0.99	1410	-1.0809	-0.2349	discard	exp#040 mtf_4h_kama_weekly_hma_rsi_pullback_v1	train
1817725	mtf_4h_kama_weekly_hma_rsi_pullback_v1	SOLUSDT	0.5725	84.08	16.55	-22.36	46.6	1.24	1396	0.6482	0.7403	keep	exp#040 mtf_4h_kama_weekly_hma_rsi_pullback_v1	train
1817725	mtf_4h_kama_weekly_hma_rsi_pullback_v1	SOLUSDT	-0.9938	-11.72	-9.74	-21.26	44.4	0.99	457	-1.1167	-0.4583	discard	exp#040 mtf_4h_kama_weekly_hma_rsi_pullback_v1	test
1817725	mtf_4h_kama_weekly_hma_rsi_pullback_v1	BTCUSDT	-0.853	-17.3	-4.64	-35.25	43.4	1.04	1352	-0.9287	-0.1317	discard	exp#040 mtf_4h_kama_weekly_hma_rsi_pullback_v1	train
1817725	mtf_4h_kama_weekly_hma_rsi_pullback_v1	ETHUSDT	-1.0285	-33.04	-9.55	-40.65	42.8	0.99	1410	-1.0809	-0.2349	discard	exp#040 mtf_4h_kama_weekly_hma_rsi_pullback_v1	train
1817725	mtf_4h_kama_weekly_hma_rsi_pullback_v1	SOLUSDT	0.5725	84.08	16.55	-22.36	46.6	1.24	1396	0.6482	0.7403	discard	exp#040 mtf_4h_kama_weekly_hma_rsi_pullback_v1	train
0cc1419	mtf_12h_multi_regime_daily_weekly_bb_rsi_v1	BTCUSDT	-0.3634	0.6	0.15	-18.02	56.8	1.45	447	-0.382	0.0082	discard	exp#041 mtf_12h_multi_regime_daily_weekly_bb_rsi_v1	train
0cc1419	mtf_12h_multi_regime_daily_weekly_bb_rsi_v1	ETHUSDT	-0.1908	6.1	1.49	-23.22	56.6	1.46	447	-0.2073	0.0643	discard	exp#041 mtf_12h_multi_regime_daily_weekly_bb_rsi_v1	train
0cc1419	mtf_12h_multi_regime_daily_weekly_bb_rsi_v1	SOLUSDT	0.7097	110.03	20.47	-42.65	60.4	1.83	449	0.8646	0.4799	keep	exp#041 mtf_12h_multi_regime_daily_weekly_bb_rsi_v1	train
0cc1419	mtf_12h_multi_regime_daily_weekly_bb_rsi_v1	SOLUSDT	0.2402	9.76	7.96	-16.5	67.8	1.88	149	0.3082	0.4825	keep	exp#041 mtf_12h_multi_regime_daily_weekly_bb_rsi_v1	test
0cc1419	mtf_12h_multi_regime_daily_weekly_bb_rsi_v1	BTCUSDT	-0.3634	0.6	0.15	-18.02	56.8	1.45	447	-0.382	0.0082	discard	exp#041 mtf_12h_multi_regime_daily_weekly_bb_rsi_v1	train
0cc1419	mtf_12h_multi_regime_daily_weekly_bb_rsi_v1	ETHUSDT	-0.1908	6.1	1.49	-23.22	56.6	1.46	447	-0.2073	0.0643	discard	exp#041 mtf_12h_multi_regime_daily_weekly_bb_rsi_v1	train
0cc1419	mtf_12h_multi_regime_daily_weekly_bb_rsi_v1	SOLUSDT	0.7097	110.03	20.47	-42.65	60.4	1.83	449	0.8646	0.4799	keep	exp#041 mtf_12h_multi_regime_daily_weekly_bb_rsi_v1	train
0cc1419	mtf_12h_multi_regime_daily_weekly_bb_rsi_v1	SOLUSDT	0.2402	9.76	7.96	-16.5	67.8	1.88	149	0.3082	0.4825	keep	exp#041 mtf_12h_multi_regime_daily_weekly_bb_rsi_v1	test
c6dc8f2	mtf_1d_fisher_weekly_hma_supertrend_v1	BTCUSDT	-0.1813	9.31	2.25	-25.45	39.1	1.17	253	-0.1978	0.0884	discard	exp#042 mtf_1d_fisher_weekly_hma_supertrend_v1	train
c6dc8f2	mtf_1d_fisher_weekly_hma_supertrend_v1	ETHUSDT	-0.1976	4.59	1.13	-23.16	37.6	1.11	255	-0.2165	0.0487	discard	exp#042 mtf_1d_fisher_weekly_hma_supertrend_v1	train
c6dc8f2	mtf_1d_fisher_weekly_hma_supertrend_v1	SOLUSDT	0.3628	53.46	11.34	-35.28	41.3	1.33	230	0.4158	0.3215	keep	exp#042 mtf_1d_fisher_weekly_hma_supertrend_v1	train
c6dc8f2	mtf_1d_fisher_weekly_hma_supertrend_v1	SOLUSDT	-0.6558	-11.24	-9.34	-25.36	40.6	0.87	69	-0.7697	-0.3683	discard	exp#042 mtf_1d_fisher_weekly_hma_supertrend_v1	test
c6dc8f2	mtf_1d_fisher_weekly_hma_supertrend_v1	BTCUSDT	-0.1813	9.31	2.25	-25.45	39.1	1.17	253	-0.1978	0.0884	discard	exp#042 mtf_1d_fisher_weekly_hma_supertrend_v1	train
c6dc8f2	mtf_1d_fisher_weekly_hma_supertrend_v1	ETHUSDT	-0.1976	4.59	1.13	-23.16	37.6	1.11	255	-0.2165	0.0487	discard	exp#042 mtf_1d_fisher_weekly_hma_supertrend_v1	train
c6dc8f2	mtf_1d_fisher_weekly_hma_supertrend_v1	SOLUSDT	0.3628	53.46	11.34	-35.28	41.3	1.33	230	0.4158	0.3215	discard	exp#042 mtf_1d_fisher_weekly_hma_supertrend_v1	train
cebebf0	mtf_15m_crsi_4h_hma_chop_bb_v1	BTCUSDT	-7.5982	-81.55	-34.48	-81.86	37.8	0.89	7867	-4.1682	-0.4213	discard	exp#043 mtf_15m_crsi_4h_hma_chop_bb_v1	train
cebebf0	mtf_15m_crsi_4h_hma_chop_bb_v1	ETHUSDT	-5.9088	-79.66	-32.86	-79.82	40.1	0.96	7778	-3.248	-0.4117	discard	exp#043 mtf_15m_crsi_4h_hma_chop_bb_v1	train
cebebf0	mtf_15m_crsi_4h_hma_chop_bb_v1	SOLUSDT	-5.3847	-89.08	-42.64	-89.11	40.1	0.88	7539	-2.6506	-0.4785	discard	exp#043 mtf_15m_crsi_4h_hma_chop_bb_v1	train
cebebf0	mtf_15m_crsi_4h_hma_chop_bb_v1	BTCUSDT	-7.5982	-81.55	-34.48	-81.86	37.8	0.89	7867	-4.1682	-0.4213	discard	exp#043 mtf_15m_crsi_4h_hma_chop_bb_v1	train
cebebf0	mtf_15m_crsi_4h_hma_chop_bb_v1	ETHUSDT	-5.9088	-79.66	-32.86	-79.82	40.1	0.96	7778	-3.248	-0.4117	discard	exp#043 mtf_15m_crsi_4h_hma_chop_bb_v1	train
cebebf0	mtf_15m_crsi_4h_hma_chop_bb_v1	SOLUSDT	-5.3847	-89.08	-42.64	-89.11	40.1	0.88	7539	-2.6506	-0.4785	discard	exp#043 mtf_15m_crsi_4h_hma_chop_bb_v1	train
2a2661d	mtf_30m_fisher_4h_1d_hma_regime_v1	BTCUSDT	-6.493	-56.74	-18.91	-56.85	46.4	0.75	3335	-2.704	-0.3327	discard	exp#044 mtf_30m_fisher_4h_1d_hma_regime_v1	train
2a2661d	mtf_30m_fisher_4h_1d_hma_regime_v1	ETHUSDT	-5.3479	-59.17	-20.07	-59.65	47.1	0.78	3332	-2.1143	-0.3365	discard	exp#044 mtf_30m_fisher_4h_1d_hma_regime_v1	train
2a2661d	mtf_30m_fisher_4h_1d_hma_regime_v1	SOLUSDT	-3.728	-59.23	-20.17	-60.94	49.0	0.84	3207	-1.5524	-0.331	discard	exp#044 mtf_30m_fisher_4h_1d_hma_regime_v1	train
2a2661d	mtf_30m_fisher_4h_1d_hma_regime_v1	BTCUSDT	-6.493	-56.74	-18.91	-56.85	46.4	0.75	3335	-2.704	-0.3327	discard	exp#044 mtf_30m_fisher_4h_1d_hma_regime_v1	train
2a2661d	mtf_30m_fisher_4h_1d_hma_regime_v1	ETHUSDT	-5.3479	-59.17	-20.07	-59.65	47.1	0.78	3332	-2.1143	-0.3365	discard	exp#044 mtf_30m_fisher_4h_1d_hma_regime_v1	train
2a2661d	mtf_30m_fisher_4h_1d_hma_regime_v1	SOLUSDT	-3.728	-59.23	-20.17	-60.94	49.0	0.84	3207	-1.5524	-0.331	discard	exp#044 mtf_30m_fisher_4h_1d_hma_regime_v1	train
b5e30d4	mtf_1h_supertrend_4h_12h_hma_rsi_pullback_v1	BTCUSDT	-2.446	-55.19	-18.2	-59.43	73.3	6.81	5786	-2.4818	-0.3062	discard	exp#045 mtf_1h_supertrend_4h_12h_hma_rsi_pullback_v1	train
b5e30d4	mtf_1h_supertrend_4h_12h_hma_rsi_pullback_v1	ETHUSDT	-1.6679	-47.74	-14.98	-55.43	75.0	7.61	6152	-1.7097	-0.2703	discard	exp#045 mtf_1h_supertrend_4h_12h_hma_rsi_pullback_v1	train
b5e30d4	mtf_1h_supertrend_4h_12h_hma_rsi_pullback_v1	SOLUSDT	0.1147	23.6	5.46	-37.49	74.4	8.37	6179	0.1242	0.1457	keep	exp#045 mtf_1h_supertrend_4h_12h_hma_rsi_pullback_v1	train
b5e30d4	mtf_1h_supertrend_4h_12h_hma_rsi_pullback_v1	SOLUSDT	-2.5896	-32.21	-27.37	-37.69	74.0	7.62	1960	-2.74	-0.7263	discard	exp#045 mtf_1h_supertrend_4h_12h_hma_rsi_pullback_v1	test
b5e30d4	mtf_1h_supertrend_4h_12h_hma_rsi_pullback_v1	BTCUSDT	-2.446	-55.19	-18.2	-59.43	73.3	6.81	5786	-2.4818	-0.3062	discard	exp#045 mtf_1h_supertrend_4h_12h_hma_rsi_pullback_v1	train
b5e30d4	mtf_1h_supertrend_4h_12h_hma_rsi_pullback_v1	ETHUSDT	-1.6679	-47.74	-14.98	-55.43	75.0	7.61	6152	-1.7097	-0.2703	discard	exp#045 mtf_1h_supertrend_4h_12h_hma_rsi_pullback_v1	train
b5e30d4	mtf_1h_supertrend_4h_12h_hma_rsi_pullback_v1	SOLUSDT	0.1147	23.6	5.46	-37.49	74.4	8.37	6179	0.1242	0.1457	discard	exp#045 mtf_1h_supertrend_4h_12h_hma_rsi_pullback_v1	train
3782376	mtf_4h_supertrend_daily_weekly_crsi_volume_v1	BTCUSDT	-1.624	-41.29	-12.47	-50.7	50.3	1.06	1747	-1.59	-0.246	discard	exp#046 mtf_4h_supertrend_daily_weekly_crsi_volume_v1	train
3782376	mtf_4h_supertrend_daily_weekly_crsi_volume_v1	ETHUSDT	-0.6424	-15.85	-4.23	-33.13	51.4	1.12	1779	-0.6495	-0.1276	discard	exp#046 mtf_4h_supertrend_daily_weekly_crsi_volume_v1	train
3782376	mtf_4h_supertrend_daily_weekly_crsi_volume_v1	SOLUSDT	0.4244	59.74	12.48	-32.53	54.8	1.48	1778	0.4667	0.3835	keep	exp#046 mtf_4h_supertrend_daily_weekly_crsi_volume_v1	train
3782376	mtf_4h_supertrend_daily_weekly_crsi_volume_v1	SOLUSDT	-1.2012	-17.35	-14.51	-27.31	50.1	1.13	629	-1.3446	-0.5312	discard	exp#046 mtf_4h_supertrend_daily_weekly_crsi_volume_v1	test
3782376	mtf_4h_supertrend_daily_weekly_crsi_volume_v1	BTCUSDT	-1.624	-41.29	-12.47	-50.7	50.3	1.06	1747	-1.59	-0.246	discard	exp#046 mtf_4h_supertrend_daily_weekly_crsi_volume_v1	train
3782376	mtf_4h_supertrend_daily_weekly_crsi_volume_v1	ETHUSDT	-0.6424	-15.85	-4.23	-33.13	51.4	1.12	1779	-0.6495	-0.1276	discard	exp#046 mtf_4h_supertrend_daily_weekly_crsi_volume_v1	train
3782376	mtf_4h_supertrend_daily_weekly_crsi_volume_v1	SOLUSDT	0.4244	59.74	12.48	-32.53	54.8	1.48	1778	0.4667	0.3835	discard	exp#046 mtf_4h_supertrend_daily_weekly_crsi_volume_v1	train
b273e2b	mtf_12h_supertrend_daily_hma_rsi_pullback_v2	BTCUSDT	-0.0132	18.85	4.41	-17.1	39.6	1.86	164	-0.0125	0.258	discard	exp#047 mtf_12h_supertrend_daily_hma_rsi_pullback_v2	train
b273e2b	mtf_12h_supertrend_daily_hma_rsi_pullback_v2	ETHUSDT	0.2909	37.34	8.26	-16.68	45.8	2.02	155	0.293	0.4952	keep	exp#047 mtf_12h_supertrend_daily_hma_rsi_pullback_v2	train
b273e2b	mtf_12h_supertrend_daily_hma_rsi_pullback_v2	ETHUSDT	-1.0465	-10.77	-8.95	-18.36	36.2	1.15	58	-0.9976	-0.4874	discard	exp#047 mtf_12h_supertrend_daily_hma_rsi_pullback_v2	test
b273e2b	mtf_12h_supertrend_daily_hma_rsi_pullback_v2	SOLUSDT	1.2181	213.39	33.2	-22.99	37.4	3.4	131	1.2761	1.4442	keep	exp#047 mtf_12h_supertrend_daily_hma_rsi_pullback_v2	train
b273e2b	mtf_12h_supertrend_daily_hma_rsi_pullback_v2	SOLUSDT	0.4939	15.06	12.23	-14.8	45.3	1.95	53	0.6099	0.8265	keep	exp#047 mtf_12h_supertrend_daily_hma_rsi_pullback_v2	test
b273e2b	mtf_12h_supertrend_daily_hma_rsi_pullback_v2	BTCUSDT	-0.0132	18.85	4.41	-17.1	39.6	1.86	164	-0.0125	0.258	discard	exp#047 mtf_12h_supertrend_daily_hma_rsi_pullback_v2	train
b273e2b	mtf_12h_supertrend_daily_hma_rsi_pullback_v2	ETHUSDT	0.2909	37.34	8.26	-16.68	45.8	2.02	155	0.293	0.4952	keep	exp#047 mtf_12h_supertrend_daily_hma_rsi_pullback_v2	train
b273e2b	mtf_12h_supertrend_daily_hma_rsi_pullback_v2	SOLUSDT	1.2181	213.39	33.2	-22.99	37.4	3.4	131	1.2761	1.4442	keep	exp#047 mtf_12h_supertrend_daily_hma_rsi_pullback_v2	train
b273e2b	mtf_12h_supertrend_daily_hma_rsi_pullback_v2	ETHUSDT	-1.0465	-10.77	-8.95	-18.36	36.2	1.15	58	-0.9976	-0.4874	discard	exp#047 mtf_12h_supertrend_daily_hma_rsi_pullback_v2	test
b273e2b	mtf_12h_supertrend_daily_hma_rsi_pullback_v2	SOLUSDT	0.4939	15.06	12.23	-14.8	45.3	1.95	53	0.6099	0.8265	keep	exp#047 mtf_12h_supertrend_daily_hma_rsi_pullback_v2	test
a5e2929	mtf_1d_supertrend_weekly_hma_bias_rsi_v1	BTCUSDT	-0.2009	13.82	3.29	-13.04	33.3	2.05	54	-0.1764	0.2523	discard	exp#048 mtf_1d_supertrend_weekly_hma_bias_rsi_v1	train
a5e2929	mtf_1d_supertrend_weekly_hma_bias_rsi_v1	ETHUSDT	0.053	22.54	5.21	-9.0	42.2	2.71	45	0.0448	0.5795	keep	exp#048 mtf_1d_supertrend_weekly_hma_bias_rsi_v1	train
a5e2929	mtf_1d_supertrend_weekly_hma_bias_rsi_v1	ETHUSDT	-0.7813	-1.79	-1.47	-12.11	33.3	1.2	21	-0.6776	-0.1215	discard	exp#048 mtf_1d_supertrend_weekly_hma_bias_rsi_v1	test
a5e2929	mtf_1d_supertrend_weekly_hma_bias_rsi_v1	SOLUSDT	1.1646	131.06	23.38	-24.09	38.6	6.34	57	1.283	0.9704	keep	exp#048 mtf_1d_supertrend_weekly_hma_bias_rsi_v1	train
a5e2929	mtf_1d_supertrend_weekly_hma_bias_rsi_v1	SOLUSDT	-0.4167	0.98	0.81	-10.16	45.0	1.59	20	-0.4048	0.0793	discard	exp#048 mtf_1d_supertrend_weekly_hma_bias_rsi_v1	test
a5e2929	mtf_1d_supertrend_weekly_hma_bias_rsi_v1	BTCUSDT	-0.2009	13.82	3.29	-13.04	33.3	2.05	54	-0.1764	0.2523	discard	exp#048 mtf_1d_supertrend_weekly_hma_bias_rsi_v1	train
a5e2929	mtf_1d_supertrend_weekly_hma_bias_rsi_v1	ETHUSDT	0.053	22.54	5.21	-9.0	42.2	2.71	45	0.0448	0.5795	discard	exp#048 mtf_1d_supertrend_weekly_hma_bias_rsi_v1	train
a5e2929	mtf_1d_supertrend_weekly_hma_bias_rsi_v1	SOLUSDT	1.1646	131.06	23.38	-24.09	38.6	6.34	57	1.283	0.9704	discard	exp#048 mtf_1d_supertrend_weekly_hma_bias_rsi_v1	train
0d9c561	mtf_15m_kama_4h_1h_chop_rsi_pullback_v1	BTCUSDT	-4.745	-81.95	-34.84	-82.33	32.6	0.98	6856	-3.7109	-0.4232	discard	exp#049 mtf_15m_kama_4h_1h_chop_rsi_pullback_v1	train
0d9c561	mtf_15m_kama_4h_1h_chop_rsi_pullback_v1	ETHUSDT	-3.8571	-82.8	-35.62	-82.96	33.3	1.05	6968	-3.0767	-0.4294	discard	exp#049 mtf_15m_kama_4h_1h_chop_rsi_pullback_v1	train
0d9c561	mtf_15m_kama_4h_1h_chop_rsi_pullback_v1	SOLUSDT	-2.8374	-88.39	-41.76	-90.84	36.2	1.1	6870	-2.1844	-0.4597	discard	exp#049 mtf_15m_kama_4h_1h_chop_rsi_pullback_v1	train
0d9c561	mtf_15m_kama_4h_1h_chop_rsi_pullback_v1	BTCUSDT	-4.745	-81.95	-34.84	-82.33	32.6	0.98	6856	-3.7109	-0.4232	discard	exp#049 mtf_15m_kama_4h_1h_chop_rsi_pullback_v1	train
0d9c561	mtf_15m_kama_4h_1h_chop_rsi_pullback_v1	ETHUSDT	-3.8571	-82.8	-35.62	-82.96	33.3	1.05	6968	-3.0767	-0.4294	discard	exp#049 mtf_15m_kama_4h_1h_chop_rsi_pullback_v1	train
0d9c561	mtf_15m_kama_4h_1h_chop_rsi_pullback_v1	SOLUSDT	-2.8374	-88.39	-41.76	-90.84	36.2	1.1	6870	-2.1844	-0.4597	discard	exp#049 mtf_15m_kama_4h_1h_chop_rsi_pullback_v1	train
e17e852	mtf_30m_donchian_4h_1d_hma_rsi_v1	BTCUSDT	-2.8541	-68.16	-24.9	-68.32	43.8	1.19	5292	-2.4793	-0.3644	discard	exp#050 mtf_30m_donchian_4h_1d_hma_rsi_v1	train
e17e852	mtf_30m_donchian_4h_1d_hma_rsi_v1	ETHUSDT	-1.8391	-59.16	-20.07	-59.24	46.3	1.37	5563	-1.6545	-0.3388	discard	exp#050 mtf_30m_donchian_4h_1d_hma_rsi_v1	train
e17e852	mtf_30m_donchian_4h_1d_hma_rsi_v1	SOLUSDT	-0.7314	-44.9	-13.9	-53.43	49.4	1.58	5948	-0.6703	-0.2601	discard	exp#050 mtf_30m_donchian_4h_1d_hma_rsi_v1	train
e17e852	mtf_30m_donchian_4h_1d_hma_rsi_v1	BTCUSDT	-2.8541	-68.16	-24.9	-68.32	43.8	1.19	5292	-2.4793	-0.3644	discard	exp#050 mtf_30m_donchian_4h_1d_hma_rsi_v1	train
e17e852	mtf_30m_donchian_4h_1d_hma_rsi_v1	ETHUSDT	-1.8391	-59.16	-20.07	-59.24	46.3	1.37	5563	-1.6545	-0.3388	discard	exp#050 mtf_30m_donchian_4h_1d_hma_rsi_v1	train
e17e852	mtf_30m_donchian_4h_1d_hma_rsi_v1	SOLUSDT	-0.7314	-44.9	-13.9	-53.43	49.4	1.58	5948	-0.6703	-0.2601	discard	exp#050 mtf_30m_donchian_4h_1d_hma_rsi_v1	train
