commit	strategy	symbol	sharpe	return_pct	cagr_pct	max_dd_pct	win_rate	profit_factor	trades	sortino	calmar	status	description	period
2436fdd	mtf_12h_kama_daily_hma_rsi_atr_v1	SOLUSDT	-0.3424	4.64	1.14	-14.44	49.2	1.11	368	-0.2447	0.0792	discard	exp#227 mtf_12h_kama_daily_hma_rsi_atr_v1	train
1bb4dfd	mtf_1d_hma_weekly_rsi_pullback_atr_v1	BTCUSDT	-1.2997	-6.08	-1.56	-17.53	50.3	0.92	149	-0.7545	-0.0888	discard	exp#228 mtf_1d_hma_weekly_rsi_pullback_atr_v1	train
1bb4dfd	mtf_1d_hma_weekly_rsi_pullback_atr_v1	ETHUSDT	-0.5378	4.4	1.08	-8.12	48.6	1.13	146	-0.39	0.1332	discard	exp#228 mtf_1d_hma_weekly_rsi_pullback_atr_v1	train
1bb4dfd	mtf_1d_hma_weekly_rsi_pullback_atr_v1	SOLUSDT	-0.1323	15.6	3.7	-10.08	54.1	1.27	146	-0.0912	0.3675	discard	exp#228 mtf_1d_hma_weekly_rsi_pullback_atr_v1	train
1bb4dfd	mtf_1d_hma_weekly_rsi_pullback_atr_v1	BTCUSDT	-1.2997	-6.08	-1.56	-17.53	50.3	0.92	149	-0.7545	-0.0888	discard	exp#228 mtf_1d_hma_weekly_rsi_pullback_atr_v1	train
1bb4dfd	mtf_1d_hma_weekly_rsi_pullback_atr_v1	ETHUSDT	-0.5378	4.4	1.08	-8.12	48.6	1.13	146	-0.39	0.1332	discard	exp#228 mtf_1d_hma_weekly_rsi_pullback_atr_v1	train
1bb4dfd	mtf_1d_hma_weekly_rsi_pullback_atr_v1	SOLUSDT	-0.1323	15.6	3.7	-10.08	54.1	1.27	146	-0.0912	0.3675	discard	exp#228 mtf_1d_hma_weekly_rsi_pullback_atr_v1	train
e765c1c	mtf_15m_crsi_chop_1h_hma_atr_v1	BTCUSDT	-20.094	-99.77	-78.14	-99.77	47.0	0.74	25030	-15.8201	-0.7832	discard	exp#229 mtf_15m_crsi_chop_1h_hma_atr_v1	train
e765c1c	mtf_15m_crsi_chop_1h_hma_atr_v1	ETHUSDT	-16.0286	-99.77	-78.11	-99.77	49.5	0.77	24455	-12.5922	-0.7829	discard	exp#229 mtf_15m_crsi_chop_1h_hma_atr_v1	train
e765c1c	mtf_15m_crsi_chop_1h_hma_atr_v1	SOLUSDT	-11.1686	-99.88	-81.66	-99.88	53.3	0.77	25406	-8.7336	-0.8175	discard	exp#229 mtf_15m_crsi_chop_1h_hma_atr_v1	train
e765c1c	mtf_15m_crsi_chop_1h_hma_atr_v1	BTCUSDT	-20.094	-99.77	-78.14	-99.77	47.0	0.74	25030	-15.8201	-0.7832	discard	exp#229 mtf_15m_crsi_chop_1h_hma_atr_v1	train
e765c1c	mtf_15m_crsi_chop_1h_hma_atr_v1	ETHUSDT	-16.0286	-99.77	-78.11	-99.77	49.5	0.77	24455	-12.5922	-0.7829	discard	exp#229 mtf_15m_crsi_chop_1h_hma_atr_v1	train
e765c1c	mtf_15m_crsi_chop_1h_hma_atr_v1	SOLUSDT	-11.1686	-99.88	-81.66	-99.88	53.3	0.77	25406	-8.7336	-0.8175	discard	exp#229 mtf_15m_crsi_chop_1h_hma_atr_v1	train
3fbde4d	mtf_1h_regime_chop_4h_12h_hma_rsi_bb_atr_v1	BTCUSDT	-3.7164	-39.28	-11.73	-39.93	44.0	0.88	2380	-1.9793	-0.2938	discard	exp#231 mtf_1h_regime_chop_4h_12h_hma_rsi_bb_atr_v1	train
3fbde4d	mtf_1h_regime_chop_4h_12h_hma_rsi_bb_atr_v1	ETHUSDT	-2.9886	-36.98	-10.91	-38.1	46.1	0.91	2405	-1.5948	-0.2863	discard	exp#231 mtf_1h_regime_chop_4h_12h_hma_rsi_bb_atr_v1	train
3fbde4d	mtf_1h_regime_chop_4h_12h_hma_rsi_bb_atr_v1	SOLUSDT	-1.367	-28.18	-7.97	-29.26	49.0	0.98	2130	-0.713	-0.2725	discard	exp#231 mtf_1h_regime_chop_4h_12h_hma_rsi_bb_atr_v1	train
3fbde4d	mtf_1h_regime_chop_4h_12h_hma_rsi_bb_atr_v1	BTCUSDT	-3.7164	-39.28	-11.73	-39.93	44.0	0.88	2380	-1.9793	-0.2938	discard	exp#231 mtf_1h_regime_chop_4h_12h_hma_rsi_bb_atr_v1	train
3fbde4d	mtf_1h_regime_chop_4h_12h_hma_rsi_bb_atr_v1	ETHUSDT	-2.9886	-36.98	-10.91	-38.1	46.1	0.91	2405	-1.5948	-0.2863	discard	exp#231 mtf_1h_regime_chop_4h_12h_hma_rsi_bb_atr_v1	train
3fbde4d	mtf_1h_regime_chop_4h_12h_hma_rsi_bb_atr_v1	SOLUSDT	-1.367	-28.18	-7.97	-29.26	49.0	0.98	2130	-0.713	-0.2725	discard	exp#231 mtf_1h_regime_chop_4h_12h_hma_rsi_bb_atr_v1	train
d865597	mtf_4h_kama_daily_hma_atr_v1	BTCUSDT	-2.7474	-13.55	-3.58	-14.03	41.7	0.83	614	-1.3365	-0.255	discard	exp#232 mtf_4h_kama_daily_hma_atr_v1	train
d865597	mtf_4h_kama_daily_hma_atr_v1	ETHUSDT	-1.9704	-7.47	-1.92	-11.47	44.4	0.96	611	-1.0694	-0.1676	discard	exp#232 mtf_4h_kama_daily_hma_atr_v1	train
d865597	mtf_4h_kama_daily_hma_atr_v1	SOLUSDT	-1.4298	-11.45	-3.01	-16.35	47.4	0.92	568	-0.7052	-0.1839	discard	exp#232 mtf_4h_kama_daily_hma_atr_v1	train
d865597	mtf_4h_kama_daily_hma_atr_v1	BTCUSDT	-2.7474	-13.55	-3.58	-14.03	41.7	0.83	614	-1.3365	-0.255	discard	exp#232 mtf_4h_kama_daily_hma_atr_v1	train
d865597	mtf_4h_kama_daily_hma_atr_v1	ETHUSDT	-1.9704	-7.47	-1.92	-11.47	44.4	0.96	611	-1.0694	-0.1676	discard	exp#232 mtf_4h_kama_daily_hma_atr_v1	train
d865597	mtf_4h_kama_daily_hma_atr_v1	SOLUSDT	-1.4298	-11.45	-3.01	-16.35	47.4	0.92	568	-0.7052	-0.1839	discard	exp#232 mtf_4h_kama_daily_hma_atr_v1	train
0b51d57	mtf_12h_kama_daily_hma_rsi_pullback_atr_v1	BTCUSDT	-3.0814	-11.37	-2.97	-12.78	40.8	0.36	49	-0.6082	-0.2327	discard	exp#233 mtf_12h_kama_daily_hma_rsi_pullback_atr_v1	train
0b51d57	mtf_12h_kama_daily_hma_rsi_pullback_atr_v1	ETHUSDT	-1.4256	4.62	1.13	-3.81	61.1	1.43	54	-0.3833	0.2982	discard	exp#233 mtf_12h_kama_daily_hma_rsi_pullback_atr_v1	train
0b51d57	mtf_12h_kama_daily_hma_rsi_pullback_atr_v1	SOLUSDT	-0.7358	7.57	1.85	-4.19	57.1	1.42	63	-0.2038	0.441	discard	exp#233 mtf_12h_kama_daily_hma_rsi_pullback_atr_v1	train
0b51d57	mtf_12h_kama_daily_hma_rsi_pullback_atr_v1	BTCUSDT	-3.0814	-11.37	-2.97	-12.78	40.8	0.36	49	-0.6082	-0.2327	discard	exp#233 mtf_12h_kama_daily_hma_rsi_pullback_atr_v1	train
0b51d57	mtf_12h_kama_daily_hma_rsi_pullback_atr_v1	ETHUSDT	-1.4256	4.62	1.13	-3.81	61.1	1.43	54	-0.3833	0.2982	discard	exp#233 mtf_12h_kama_daily_hma_rsi_pullback_atr_v1	train
0b51d57	mtf_12h_kama_daily_hma_rsi_pullback_atr_v1	SOLUSDT	-0.7358	7.57	1.85	-4.19	57.1	1.42	63	-0.2038	0.441	discard	exp#233 mtf_12h_kama_daily_hma_rsi_pullback_atr_v1	train
b6c8c43	mtf_1d_rsi_pullback_weekly_hma_volume_atr_v1	BTCUSDT	-0.2875	9.58	2.31	-12.12	45.8	1.24	168	-0.2318	0.1909	discard	exp#234 mtf_1d_rsi_pullback_weekly_hma_volume_atr_v1	train
b6c8c43	mtf_1d_rsi_pullback_weekly_hma_volume_atr_v1	ETHUSDT	-0.4932	-4.41	-1.12	-27.28	43.2	1.07	162	-0.3819	-0.0411	discard	exp#234 mtf_1d_rsi_pullback_weekly_hma_volume_atr_v1	train
b6c8c43	mtf_1d_rsi_pullback_weekly_hma_volume_atr_v1	SOLUSDT	0.7852	103.0	19.44	-12.62	48.0	1.89	150	0.7245	1.5398	keep	exp#234 mtf_1d_rsi_pullback_weekly_hma_volume_atr_v1	train
b6c8c43	mtf_1d_rsi_pullback_weekly_hma_volume_atr_v1	SOLUSDT	-0.0243	4.25	3.48	-12.63	60.3	1.19	63	-0.0214	0.2758	discard	exp#234 mtf_1d_rsi_pullback_weekly_hma_volume_atr_v1	test
b6c8c43	mtf_1d_rsi_pullback_weekly_hma_volume_atr_v1	BTCUSDT	-0.2875	9.58	2.31	-12.12	45.8	1.24	168	-0.2318	0.1909	discard	exp#234 mtf_1d_rsi_pullback_weekly_hma_volume_atr_v1	train
b6c8c43	mtf_1d_rsi_pullback_weekly_hma_volume_atr_v1	ETHUSDT	-0.4932	-4.41	-1.12	-27.28	43.2	1.07	162	-0.3819	-0.0411	discard	exp#234 mtf_1d_rsi_pullback_weekly_hma_volume_atr_v1	train
b6c8c43	mtf_1d_rsi_pullback_weekly_hma_volume_atr_v1	SOLUSDT	0.7852	103.0	19.44	-12.62	48.0	1.89	150	0.7245	1.5398	discard	exp#234 mtf_1d_rsi_pullback_weekly_hma_volume_atr_v1	train
3493d97	mtf_15m_rsi_pullback_4h_1h_hma_atr_v1	BTCUSDT	-4.0164	-14.1	-3.73	-15.62	31.7	0.84	745	-0.8864	-0.2389	discard	exp#235 mtf_15m_rsi_pullback_4h_1h_hma_atr_v1	train
3493d97	mtf_15m_rsi_pullback_4h_1h_hma_atr_v1	ETHUSDT	-3.182	-9.94	-2.59	-11.86	37.1	0.96	685	-0.5728	-0.218	discard	exp#235 mtf_15m_rsi_pullback_4h_1h_hma_atr_v1	train
3493d97	mtf_15m_rsi_pullback_4h_1h_hma_atr_v1	SOLUSDT	-2.178	-7.92	-2.05	-13.59	37.6	1.0	612	-0.363	-0.151	discard	exp#235 mtf_15m_rsi_pullback_4h_1h_hma_atr_v1	train
3493d97	mtf_15m_rsi_pullback_4h_1h_hma_atr_v1	BTCUSDT	-4.0164	-14.1	-3.73	-15.62	31.7	0.84	745	-0.8864	-0.2389	discard	exp#235 mtf_15m_rsi_pullback_4h_1h_hma_atr_v1	train
3493d97	mtf_15m_rsi_pullback_4h_1h_hma_atr_v1	ETHUSDT	-3.182	-9.94	-2.59	-11.86	37.1	0.96	685	-0.5728	-0.218	discard	exp#235 mtf_15m_rsi_pullback_4h_1h_hma_atr_v1	train
3493d97	mtf_15m_rsi_pullback_4h_1h_hma_atr_v1	SOLUSDT	-2.178	-7.92	-2.05	-13.59	37.6	1.0	612	-0.363	-0.151	discard	exp#235 mtf_15m_rsi_pullback_4h_1h_hma_atr_v1	train
a075830	mtf_30m_fisher_4h_1d_hma_volume_atr_v1	BTCUSDT	-7.0591	-55.44	-18.31	-56.56	41.3	0.77	3506	-3.0972	-0.3237	discard	exp#236 mtf_30m_fisher_4h_1d_hma_volume_atr_v1	train
a075830	mtf_30m_fisher_4h_1d_hma_volume_atr_v1	ETHUSDT	-5.1842	-54.84	-18.04	-55.22	42.0	0.82	3334	-2.1404	-0.3266	discard	exp#236 mtf_30m_fisher_4h_1d_hma_volume_atr_v1	train
a075830	mtf_30m_fisher_4h_1d_hma_volume_atr_v1	SOLUSDT	-3.7161	-56.3	-18.76	-58.03	45.5	0.87	3281	-1.4969	-0.3233	discard	exp#236 mtf_30m_fisher_4h_1d_hma_volume_atr_v1	train
a075830	mtf_30m_fisher_4h_1d_hma_volume_atr_v1	BTCUSDT	-7.0591	-55.44	-18.31	-56.56	41.3	0.77	3506	-3.0972	-0.3237	discard	exp#236 mtf_30m_fisher_4h_1d_hma_volume_atr_v1	train
a075830	mtf_30m_fisher_4h_1d_hma_volume_atr_v1	ETHUSDT	-5.1842	-54.84	-18.04	-55.22	42.0	0.82	3334	-2.1404	-0.3266	discard	exp#236 mtf_30m_fisher_4h_1d_hma_volume_atr_v1	train
a075830	mtf_30m_fisher_4h_1d_hma_volume_atr_v1	SOLUSDT	-3.7161	-56.3	-18.76	-58.03	45.5	0.87	3281	-1.4969	-0.3233	discard	exp#236 mtf_30m_fisher_4h_1d_hma_volume_atr_v1	train
34d15bf	mtf_1h_kama_4h_hma_rsi_atr_v1	BTCUSDT	-4.6339	-43.99	-13.5	-44.32	39.8	0.79	2159	-2.1926	-0.3045	discard	exp#237 mtf_1h_kama_4h_hma_rsi_atr_v1	train
34d15bf	mtf_1h_kama_4h_hma_rsi_atr_v1	ETHUSDT	-3.2015	-36.69	-10.81	-37.58	40.7	0.9	2172	-1.6514	-0.2876	discard	exp#237 mtf_1h_kama_4h_hma_rsi_atr_v1	train
34d15bf	mtf_1h_kama_4h_hma_rsi_atr_v1	SOLUSDT	-2.3695	-41.48	-12.58	-42.06	43.6	0.89	2111	-1.1594	-0.2992	discard	exp#237 mtf_1h_kama_4h_hma_rsi_atr_v1	train
34d15bf	mtf_1h_kama_4h_hma_rsi_atr_v1	BTCUSDT	-4.6339	-43.99	-13.5	-44.32	39.8	0.79	2159	-2.1926	-0.3045	discard	exp#237 mtf_1h_kama_4h_hma_rsi_atr_v1	train
34d15bf	mtf_1h_kama_4h_hma_rsi_atr_v1	ETHUSDT	-3.2015	-36.69	-10.81	-37.58	40.7	0.9	2172	-1.6514	-0.2876	discard	exp#237 mtf_1h_kama_4h_hma_rsi_atr_v1	train
34d15bf	mtf_1h_kama_4h_hma_rsi_atr_v1	SOLUSDT	-2.3695	-41.48	-12.58	-42.06	43.6	0.89	2111	-1.1594	-0.2992	discard	exp#237 mtf_1h_kama_4h_hma_rsi_atr_v1	train
75c1e0c	mtf_4h_supertrend_daily_hma_volume_roc_atr_v1	BTCUSDT	-2.1363	-6.44	-1.65	-10.52	41.3	0.98	433	-1.0765	-0.157	discard	exp#238 mtf_4h_supertrend_daily_hma_volume_roc_atr_v1	train
75c1e0c	mtf_4h_supertrend_daily_hma_volume_roc_atr_v1	ETHUSDT	-1.9687	-4.12	-1.05	-5.77	41.3	1.01	351	-0.9943	-0.1815	discard	exp#238 mtf_4h_supertrend_daily_hma_volume_roc_atr_v1	train
75c1e0c	mtf_4h_supertrend_daily_hma_volume_roc_atr_v1	SOLUSDT	-1.8603	2.41	0.6	-3.46	48.8	1.25	123	-0.4935	0.1727	discard	exp#238 mtf_4h_supertrend_daily_hma_volume_roc_atr_v1	train
75c1e0c	mtf_4h_supertrend_daily_hma_volume_roc_atr_v1	BTCUSDT	-2.1363	-6.44	-1.65	-10.52	41.3	0.98	433	-1.0765	-0.157	discard	exp#238 mtf_4h_supertrend_daily_hma_volume_roc_atr_v1	train
75c1e0c	mtf_4h_supertrend_daily_hma_volume_roc_atr_v1	ETHUSDT	-1.9687	-4.12	-1.05	-5.77	41.3	1.01	351	-0.9943	-0.1815	discard	exp#238 mtf_4h_supertrend_daily_hma_volume_roc_atr_v1	train
75c1e0c	mtf_4h_supertrend_daily_hma_volume_roc_atr_v1	SOLUSDT	-1.8603	2.41	0.6	-3.46	48.8	1.25	123	-0.4935	0.1727	discard	exp#238 mtf_4h_supertrend_daily_hma_volume_roc_atr_v1	train
8ea5b18	mtf_12h_macd_donchian_daily_weekly_hma_volume_atr_v1	BTCUSDT	-0.1616	14.12	3.36	-11.98	45.4	1.26	361	-0.135	0.2804	discard	exp#239 mtf_12h_macd_donchian_daily_weekly_hma_volume_atr_v1	train
8ea5b18	mtf_12h_macd_donchian_daily_weekly_hma_volume_atr_v1	ETHUSDT	-0.6353	-7.08	-1.82	-21.76	42.9	1.01	396	-0.4938	-0.0836	discard	exp#239 mtf_12h_macd_donchian_daily_weekly_hma_volume_atr_v1	train
8ea5b18	mtf_12h_macd_donchian_daily_weekly_hma_volume_atr_v1	SOLUSDT	0.4957	63.15	13.07	-20.16	46.8	1.41	370	0.4106	0.6483	keep	exp#239 mtf_12h_macd_donchian_daily_weekly_hma_volume_atr_v1	train
8ea5b18	mtf_12h_macd_donchian_daily_weekly_hma_volume_atr_v1	SOLUSDT	0.217	8.58	7.01	-7.21	50.4	1.25	123	0.1769	0.9719	keep	exp#239 mtf_12h_macd_donchian_daily_weekly_hma_volume_atr_v1	test
8ea5b18	mtf_12h_macd_donchian_daily_weekly_hma_volume_atr_v1	BTCUSDT	-0.1616	14.12	3.36	-11.98	45.4	1.26	361	-0.135	0.2804	discard	exp#239 mtf_12h_macd_donchian_daily_weekly_hma_volume_atr_v1	train
8ea5b18	mtf_12h_macd_donchian_daily_weekly_hma_volume_atr_v1	ETHUSDT	-0.6353	-7.08	-1.82	-21.76	42.9	1.01	396	-0.4938	-0.0836	discard	exp#239 mtf_12h_macd_donchian_daily_weekly_hma_volume_atr_v1	train
8ea5b18	mtf_12h_macd_donchian_daily_weekly_hma_volume_atr_v1	SOLUSDT	0.4957	63.15	13.07	-20.16	46.8	1.41	370	0.4106	0.6483	keep	exp#239 mtf_12h_macd_donchian_daily_weekly_hma_volume_atr_v1	train
8ea5b18	mtf_12h_macd_donchian_daily_weekly_hma_volume_atr_v1	SOLUSDT	0.217	8.58	7.01	-7.21	50.4	1.25	123	0.1769	0.9719	keep	exp#239 mtf_12h_macd_donchian_daily_weekly_hma_volume_atr_v1	test
ed0fb5e	mtf_1d_regime_chop_weekly_hma_crsi_donchian_atr_v1	BTCUSDT	-0.7789	-3.09	-0.78	-15.99	50.7	1.01	152	-0.5853	-0.0488	discard	exp#240 mtf_1d_regime_chop_weekly_hma_crsi_donchian_atr_v1	train
ed0fb5e	mtf_1d_regime_chop_weekly_hma_crsi_donchian_atr_v1	ETHUSDT	-0.5957	-1.39	-0.35	-13.36	50.3	1.03	159	-0.449	-0.0262	discard	exp#240 mtf_1d_regime_chop_weekly_hma_crsi_donchian_atr_v1	train
ed0fb5e	mtf_1d_regime_chop_weekly_hma_crsi_donchian_atr_v1	SOLUSDT	0.4969	56.49	11.89	-11.43	57.2	1.51	145	0.4648	1.0404	keep	exp#240 mtf_1d_regime_chop_weekly_hma_crsi_donchian_atr_v1	train
ed0fb5e	mtf_1d_regime_chop_weekly_hma_crsi_donchian_atr_v1	SOLUSDT	-1.4559	-9.63	-7.99	-11.2	44.7	0.7	38	-0.9871	-0.7131	discard	exp#240 mtf_1d_regime_chop_weekly_hma_crsi_donchian_atr_v1	test
ed0fb5e	mtf_1d_regime_chop_weekly_hma_crsi_donchian_atr_v1	BTCUSDT	-0.7789	-3.09	-0.78	-15.99	50.7	1.01	152	-0.5853	-0.0488	discard	exp#240 mtf_1d_regime_chop_weekly_hma_crsi_donchian_atr_v1	train
ed0fb5e	mtf_1d_regime_chop_weekly_hma_crsi_donchian_atr_v1	ETHUSDT	-0.5957	-1.39	-0.35	-13.36	50.3	1.03	159	-0.449	-0.0262	discard	exp#240 mtf_1d_regime_chop_weekly_hma_crsi_donchian_atr_v1	train
ed0fb5e	mtf_1d_regime_chop_weekly_hma_crsi_donchian_atr_v1	SOLUSDT	0.4969	56.49	11.89	-11.43	57.2	1.51	145	0.4648	1.0404	discard	exp#240 mtf_1d_regime_chop_weekly_hma_crsi_donchian_atr_v1	train
df0596d	mtf_15m_bb_squeeze_1h_4h_hma_kama_volume_atr_v1	BTCUSDT	-18.8079	-98.98	-68.21	-98.99	34.4	0.79	19336	-14.8733	-0.689	discard	exp#241 mtf_15m_bb_squeeze_1h_4h_hma_kama_volume_atr_v1	train
df0596d	mtf_15m_bb_squeeze_1h_4h_hma_kama_volume_atr_v1	ETHUSDT	-14.239	-98.69	-66.16	-98.73	37.3	0.84	19160	-11.0284	-0.6701	discard	exp#241 mtf_15m_bb_squeeze_1h_4h_hma_kama_volume_atr_v1	train
df0596d	mtf_15m_bb_squeeze_1h_4h_hma_kama_volume_atr_v1	SOLUSDT	-8.1581	-97.93	-62.22	-98.19	42.3	0.97	18562	-6.0403	-0.6336	discard	exp#241 mtf_15m_bb_squeeze_1h_4h_hma_kama_volume_atr_v1	train
df0596d	mtf_15m_bb_squeeze_1h_4h_hma_kama_volume_atr_v1	BTCUSDT	-18.8079	-98.98	-68.21	-98.99	34.4	0.79	19336	-14.8733	-0.689	discard	exp#241 mtf_15m_bb_squeeze_1h_4h_hma_kama_volume_atr_v1	train
df0596d	mtf_15m_bb_squeeze_1h_4h_hma_kama_volume_atr_v1	ETHUSDT	-14.239	-98.69	-66.16	-98.73	37.3	0.84	19160	-11.0284	-0.6701	discard	exp#241 mtf_15m_bb_squeeze_1h_4h_hma_kama_volume_atr_v1	train
df0596d	mtf_15m_bb_squeeze_1h_4h_hma_kama_volume_atr_v1	SOLUSDT	-8.1581	-97.93	-62.22	-98.19	42.3	0.97	18562	-6.0403	-0.6336	discard	exp#241 mtf_15m_bb_squeeze_1h_4h_hma_kama_volume_atr_v1	train
8178158	mtf_30m_crsi_4h_1d_hma_adx_atr_v1	BTCUSDT	-5.051	-56.42	-18.76	-58.29	47.9	0.91	4133	-2.7063	-0.3219	discard	exp#242 mtf_30m_crsi_4h_1d_hma_adx_atr_v1	train
8178158	mtf_30m_crsi_4h_1d_hma_adx_atr_v1	ETHUSDT	-3.9644	-55.45	-18.31	-56.02	49.2	0.91	4094	-2.1425	-0.3269	discard	exp#242 mtf_30m_crsi_4h_1d_hma_adx_atr_v1	train
8178158	mtf_30m_crsi_4h_1d_hma_adx_atr_v1	SOLUSDT	-1.5405	-38.36	-11.44	-39.87	50.0	1.03	4143	-0.8433	-0.2869	discard	exp#242 mtf_30m_crsi_4h_1d_hma_adx_atr_v1	train
8178158	mtf_30m_crsi_4h_1d_hma_adx_atr_v1	BTCUSDT	-5.051	-56.42	-18.76	-58.29	47.9	0.91	4133	-2.7063	-0.3219	discard	exp#242 mtf_30m_crsi_4h_1d_hma_adx_atr_v1	train
8178158	mtf_30m_crsi_4h_1d_hma_adx_atr_v1	ETHUSDT	-3.9644	-55.45	-18.31	-56.02	49.2	0.91	4094	-2.1425	-0.3269	discard	exp#242 mtf_30m_crsi_4h_1d_hma_adx_atr_v1	train
8178158	mtf_30m_crsi_4h_1d_hma_adx_atr_v1	SOLUSDT	-1.5405	-38.36	-11.44	-39.87	50.0	1.03	4143	-0.8433	-0.2869	discard	exp#242 mtf_30m_crsi_4h_1d_hma_adx_atr_v1	train
5c4d9ef	mtf_1h_rsi_pullback_4h_hma_volume_atr_v1	BTCUSDT	-3.1174	-28.47	-8.04	-32.86	47.9	0.91	1682	-1.5741	-0.2446	discard	exp#243 mtf_1h_rsi_pullback_4h_hma_volume_atr_v1	train
5c4d9ef	mtf_1h_rsi_pullback_4h_hma_volume_atr_v1	ETHUSDT	-2.438	-30.57	-8.72	-34.29	48.8	0.92	1714	-1.1315	-0.2544	discard	exp#243 mtf_1h_rsi_pullback_4h_hma_volume_atr_v1	train
5c4d9ef	mtf_1h_rsi_pullback_4h_hma_volume_atr_v1	SOLUSDT	-1.4519	-24.09	-6.69	-30.39	51.1	0.96	1645	-0.684	-0.22	discard	exp#243 mtf_1h_rsi_pullback_4h_hma_volume_atr_v1	train
5c4d9ef	mtf_1h_rsi_pullback_4h_hma_volume_atr_v1	BTCUSDT	-3.1174	-28.47	-8.04	-32.86	47.9	0.91	1682	-1.5741	-0.2446	discard	exp#243 mtf_1h_rsi_pullback_4h_hma_volume_atr_v1	train
5c4d9ef	mtf_1h_rsi_pullback_4h_hma_volume_atr_v1	ETHUSDT	-2.438	-30.57	-8.72	-34.29	48.8	0.92	1714	-1.1315	-0.2544	discard	exp#243 mtf_1h_rsi_pullback_4h_hma_volume_atr_v1	train
5c4d9ef	mtf_1h_rsi_pullback_4h_hma_volume_atr_v1	SOLUSDT	-1.4519	-24.09	-6.69	-30.39	51.1	0.96	1645	-0.684	-0.22	discard	exp#243 mtf_1h_rsi_pullback_4h_hma_volume_atr_v1	train
93ae8d7	mtf_4h_keltner_fisher_adx_daily_weekly_hma_volume_atr_v1	BTCUSDT	-0.4881	1.31	0.33	-16.88	42.4	1.17	1107	-0.4284	0.0193	discard	exp#244 mtf_4h_keltner_fisher_adx_daily_weekly_hma_volume_atr_v1	train
93ae8d7	mtf_4h_keltner_fisher_adx_daily_weekly_hma_volume_atr_v1	ETHUSDT	-0.4088	-0.74	-0.18	-15.13	43.0	1.12	1132	-0.3588	-0.0122	discard	exp#244 mtf_4h_keltner_fisher_adx_daily_weekly_hma_volume_atr_v1	train
93ae8d7	mtf_4h_keltner_fisher_adx_daily_weekly_hma_volume_atr_v1	SOLUSDT	-0.8077	-34.96	-10.23	-39.58	42.8	0.91	1084	-0.6684	-0.2586	discard	exp#244 mtf_4h_keltner_fisher_adx_daily_weekly_hma_volume_atr_v1	train
93ae8d7	mtf_4h_keltner_fisher_adx_daily_weekly_hma_volume_atr_v1	BTCUSDT	-0.4881	1.31	0.33	-16.88	42.4	1.17	1107	-0.4284	0.0193	discard	exp#244 mtf_4h_keltner_fisher_adx_daily_weekly_hma_volume_atr_v1	train
93ae8d7	mtf_4h_keltner_fisher_adx_daily_weekly_hma_volume_atr_v1	ETHUSDT	-0.4088	-0.74	-0.18	-15.13	43.0	1.12	1132	-0.3588	-0.0122	discard	exp#244 mtf_4h_keltner_fisher_adx_daily_weekly_hma_volume_atr_v1	train
93ae8d7	mtf_4h_keltner_fisher_adx_daily_weekly_hma_volume_atr_v1	SOLUSDT	-0.8077	-34.96	-10.23	-39.58	42.8	0.91	1084	-0.6684	-0.2586	discard	exp#244 mtf_4h_keltner_fisher_adx_daily_weekly_hma_volume_atr_v1	train
fb2049d	mtf_12h_chop_regime_daily_weekly_hma_atr_v1	BTCUSDT	-0.125	17.29	4.07	-8.78	50.0	1.62	176	-0.0772	0.4635	discard	exp#245 mtf_12h_chop_regime_daily_weekly_hma_atr_v1	train
fb2049d	mtf_12h_chop_regime_daily_weekly_hma_atr_v1	ETHUSDT	-0.3207	11.34	2.72	-5.92	48.7	1.43	154	-0.1889	0.4596	discard	exp#245 mtf_12h_chop_regime_daily_weekly_hma_atr_v1	train
fb2049d	mtf_12h_chop_regime_daily_weekly_hma_atr_v1	SOLUSDT	-0.1343	8.39	2.04	-17.46	43.4	1.04	136	-0.0693	0.1169	discard	exp#245 mtf_12h_chop_regime_daily_weekly_hma_atr_v1	train
fb2049d	mtf_12h_chop_regime_daily_weekly_hma_atr_v1	BTCUSDT	-0.125	17.29	4.07	-8.78	50.0	1.62	176	-0.0772	0.4635	discard	exp#245 mtf_12h_chop_regime_daily_weekly_hma_atr_v1	train
fb2049d	mtf_12h_chop_regime_daily_weekly_hma_atr_v1	ETHUSDT	-0.3207	11.34	2.72	-5.92	48.7	1.43	154	-0.1889	0.4596	discard	exp#245 mtf_12h_chop_regime_daily_weekly_hma_atr_v1	train
fb2049d	mtf_12h_chop_regime_daily_weekly_hma_atr_v1	SOLUSDT	-0.1343	8.39	2.04	-17.46	43.4	1.04	136	-0.0693	0.1169	discard	exp#245 mtf_12h_chop_regime_daily_weekly_hma_atr_v1	train
5b16c38	mtf_1d_kama_weekly_hma_roc_momentum_atr_v1	BTCUSDT	-0.7883	-23.73	-6.55	-31.43	34.3	1.05	169	-0.9145	-0.2083	discard	exp#246 mtf_1d_kama_weekly_hma_roc_momentum_atr_v1	train
5b16c38	mtf_1d_kama_weekly_hma_roc_momentum_atr_v1	ETHUSDT	-0.1295	5.8	1.42	-28.12	41.0	1.34	156	-0.1518	0.0505	discard	exp#246 mtf_1d_kama_weekly_hma_roc_momentum_atr_v1	train
5b16c38	mtf_1d_kama_weekly_hma_roc_momentum_atr_v1	SOLUSDT	0.486	75.14	15.1	-32.61	36.7	2.02	150	0.5888	0.4629	keep	exp#246 mtf_1d_kama_weekly_hma_roc_momentum_atr_v1	train
5b16c38	mtf_1d_kama_weekly_hma_roc_momentum_atr_v1	SOLUSDT	-1.1201	-20.25	-16.98	-26.81	41.5	0.69	53	-1.2347	-0.6334	discard	exp#246 mtf_1d_kama_weekly_hma_roc_momentum_atr_v1	test
5b16c38	mtf_1d_kama_weekly_hma_roc_momentum_atr_v1	BTCUSDT	-0.7883	-23.73	-6.55	-31.43	34.3	1.05	169	-0.9145	-0.2083	discard	exp#246 mtf_1d_kama_weekly_hma_roc_momentum_atr_v1	train
5b16c38	mtf_1d_kama_weekly_hma_roc_momentum_atr_v1	ETHUSDT	-0.1295	5.8	1.42	-28.12	41.0	1.34	156	-0.1518	0.0505	discard	exp#246 mtf_1d_kama_weekly_hma_roc_momentum_atr_v1	train
5b16c38	mtf_1d_kama_weekly_hma_roc_momentum_atr_v1	SOLUSDT	0.486	75.14	15.1	-32.61	36.7	2.02	150	0.5888	0.4629	discard	exp#246 mtf_1d_kama_weekly_hma_roc_momentum_atr_v1	train
4bdbe2c	mtf_15m_rsi_pullback_4h_1h_hma_volume_atr_v2	BTCUSDT	-18.8748	-95.45	-53.83	-95.46	34.3	0.64	12150	-11.6711	-0.5639	discard	exp#247 mtf_15m_rsi_pullback_4h_1h_hma_volume_atr_v2	train
4bdbe2c	mtf_15m_rsi_pullback_4h_1h_hma_volume_atr_v2	ETHUSDT	-13.7855	-93.79	-50.1	-93.81	37.7	0.75	11730	-8.0828	-0.5341	discard	exp#247 mtf_15m_rsi_pullback_4h_1h_hma_volume_atr_v2	train
4bdbe2c	mtf_15m_rsi_pullback_4h_1h_hma_volume_atr_v2	SOLUSDT	-8.1406	-89.82	-43.65	-89.85	41.8	0.83	9956	-4.2216	-0.4858	discard	exp#247 mtf_15m_rsi_pullback_4h_1h_hma_volume_atr_v2	train
4bdbe2c	mtf_15m_rsi_pullback_4h_1h_hma_volume_atr_v2	BTCUSDT	-18.8748	-95.45	-53.83	-95.46	34.3	0.64	12150	-11.6711	-0.5639	discard	exp#247 mtf_15m_rsi_pullback_4h_1h_hma_volume_atr_v2	train
4bdbe2c	mtf_15m_rsi_pullback_4h_1h_hma_volume_atr_v2	ETHUSDT	-13.7855	-93.79	-50.1	-93.81	37.7	0.75	11730	-8.0828	-0.5341	discard	exp#247 mtf_15m_rsi_pullback_4h_1h_hma_volume_atr_v2	train
4bdbe2c	mtf_15m_rsi_pullback_4h_1h_hma_volume_atr_v2	SOLUSDT	-8.1406	-89.82	-43.65	-89.85	41.8	0.83	9956	-4.2216	-0.4858	discard	exp#247 mtf_15m_rsi_pullback_4h_1h_hma_volume_atr_v2	train
0d3f49f	mtf_30m_rsi_pullback_4h_1d_hma_volume_atr_v1	BTCUSDT	-11.6124	-88.58	-41.88	-88.7	36.7	0.72	9388	-8.5778	-0.4722	discard	exp#248 mtf_30m_rsi_pullback_4h_1d_hma_volume_atr_v1	train
