commit	strategy	symbol	sharpe	return_pct	cagr_pct	max_dd_pct	win_rate	profit_factor	trades	sortino	calmar	status	description	period
95640bc	mtf_1h_kama_4h_hma_volume_atr_v1	SOLUSDT	-0.5953	-29.54	-8.41	-35.88	40.4	1.03	4261	-0.5618	-0.2345	discard	exp#117 mtf_1h_kama_4h_hma_volume_atr_v1	train
95640bc	mtf_1h_kama_4h_hma_volume_atr_v1	BTCUSDT	-2.7123	-55.94	-18.54	-56.84	38.2	0.93	3947	-2.6143	-0.3261	discard	exp#117 mtf_1h_kama_4h_hma_volume_atr_v1	train
95640bc	mtf_1h_kama_4h_hma_volume_atr_v1	ETHUSDT	-2.1025	-55.51	-18.34	-57.51	38.7	0.97	4047	-2.0336	-0.3189	discard	exp#117 mtf_1h_kama_4h_hma_volume_atr_v1	train
95640bc	mtf_1h_kama_4h_hma_volume_atr_v1	SOLUSDT	-0.5953	-29.54	-8.41	-35.88	40.4	1.03	4261	-0.5618	-0.2345	discard	exp#117 mtf_1h_kama_4h_hma_volume_atr_v1	train
f0e6adb	mtf_4h_donchian_daily_hma_rsi_momentum_v2	BTCUSDT	-1.1685	-8.05	-2.08	-16.44	40.1	1.0	494	-0.615	-0.1264	discard	exp#118 mtf_4h_donchian_daily_hma_rsi_momentum_v2	train
f0e6adb	mtf_4h_donchian_daily_hma_rsi_momentum_v2	ETHUSDT	-1.4492	-23.31	-6.42	-27.54	39.8	0.85	543	-0.7233	-0.2332	discard	exp#118 mtf_4h_donchian_daily_hma_rsi_momentum_v2	train
f0e6adb	mtf_4h_donchian_daily_hma_rsi_momentum_v2	SOLUSDT	-0.8377	-25.89	-7.25	-31.53	40.5	0.9	573	-0.4612	-0.2298	discard	exp#118 mtf_4h_donchian_daily_hma_rsi_momentum_v2	train
f0e6adb	mtf_4h_donchian_daily_hma_rsi_momentum_v2	BTCUSDT	-1.1685	-8.05	-2.08	-16.44	40.1	1.0	494	-0.615	-0.1264	discard	exp#118 mtf_4h_donchian_daily_hma_rsi_momentum_v2	train
f0e6adb	mtf_4h_donchian_daily_hma_rsi_momentum_v2	ETHUSDT	-1.4492	-23.31	-6.42	-27.54	39.8	0.85	543	-0.7233	-0.2332	discard	exp#118 mtf_4h_donchian_daily_hma_rsi_momentum_v2	train
f0e6adb	mtf_4h_donchian_daily_hma_rsi_momentum_v2	SOLUSDT	-0.8377	-25.89	-7.25	-31.53	40.5	0.9	573	-0.4612	-0.2298	discard	exp#118 mtf_4h_donchian_daily_hma_rsi_momentum_v2	train
6772c31	mtf_12h_donchian_daily_hma_rsi_v1	BTCUSDT	-3.7093	-0.31	-0.08	-3.13	58.8	0.98	17	-0.488	-0.0251	discard	exp#119 mtf_12h_donchian_daily_hma_rsi_v1	train
6772c31	mtf_12h_donchian_daily_hma_rsi_v1	ETHUSDT	-2.8641	2.33	0.58	-3.15	50.0	1.61	24	-0.5612	0.1831	discard	exp#119 mtf_12h_donchian_daily_hma_rsi_v1	train
6772c31	mtf_12h_donchian_daily_hma_rsi_v1	SOLUSDT	-1.5977	-4.48	-1.14	-6.81	46.7	0.74	30	-0.2428	-0.1678	discard	exp#119 mtf_12h_donchian_daily_hma_rsi_v1	train
6772c31	mtf_12h_donchian_daily_hma_rsi_v1	BTCUSDT	-3.7093	-0.31	-0.08	-3.13	58.8	0.98	17	-0.488	-0.0251	discard	exp#119 mtf_12h_donchian_daily_hma_rsi_v1	train
6772c31	mtf_12h_donchian_daily_hma_rsi_v1	ETHUSDT	-2.8641	2.33	0.58	-3.15	50.0	1.61	24	-0.5612	0.1831	discard	exp#119 mtf_12h_donchian_daily_hma_rsi_v1	train
6772c31	mtf_12h_donchian_daily_hma_rsi_v1	SOLUSDT	-1.5977	-4.48	-1.14	-6.81	46.7	0.74	30	-0.2428	-0.1678	discard	exp#119 mtf_12h_donchian_daily_hma_rsi_v1	train
d54d1ba	mtf_1d_donchian_weekly_hma_rsi_v1	BTCUSDT	-0.6155	2.41	0.6	-9.69	45.9	1.23	85	-0.3422	0.0615	discard	exp#120 mtf_1d_donchian_weekly_hma_rsi_v1	train
d54d1ba	mtf_1d_donchian_weekly_hma_rsi_v1	ETHUSDT	-0.5839	1.06	0.27	-14.56	40.8	1.08	76	-0.2882	0.0182	discard	exp#120 mtf_1d_donchian_weekly_hma_rsi_v1	train
d54d1ba	mtf_1d_donchian_weekly_hma_rsi_v1	SOLUSDT	0.584	66.0	13.56	-10.62	60.3	2.26	78	0.3815	1.2763	keep	exp#120 mtf_1d_donchian_weekly_hma_rsi_v1	train
d54d1ba	mtf_1d_donchian_weekly_hma_rsi_v1	SOLUSDT	-1.1406	-5.48	-4.53	-7.02	44.8	0.73	29	-0.623	-0.6449	discard	exp#120 mtf_1d_donchian_weekly_hma_rsi_v1	test
d54d1ba	mtf_1d_donchian_weekly_hma_rsi_v1	BTCUSDT	-0.6155	2.41	0.6	-9.69	45.9	1.23	85	-0.3422	0.0615	discard	exp#120 mtf_1d_donchian_weekly_hma_rsi_v1	train
d54d1ba	mtf_1d_donchian_weekly_hma_rsi_v1	ETHUSDT	-0.5839	1.06	0.27	-14.56	40.8	1.08	76	-0.2882	0.0182	discard	exp#120 mtf_1d_donchian_weekly_hma_rsi_v1	train
d54d1ba	mtf_1d_donchian_weekly_hma_rsi_v1	SOLUSDT	0.584	66.0	13.56	-10.62	60.3	2.26	78	0.3815	1.2763	discard	exp#120 mtf_1d_donchian_weekly_hma_rsi_v1	train
7d4fc6b	mtf_15m_supertrend_4h_hma_rsi_pullback_v1	BTCUSDT	-5.1265	-94.21	-50.98	-94.38	25.5	1.26	11501	-6.4905	-0.5401	discard	exp#121 mtf_15m_supertrend_4h_hma_rsi_pullback_v1	train
7d4fc6b	mtf_15m_supertrend_4h_hma_rsi_pullback_v1	ETHUSDT	-3.6072	-92.07	-46.96	-92.19	27.7	1.34	11476	-4.5422	-0.5093	discard	exp#121 mtf_15m_supertrend_4h_hma_rsi_pullback_v1	train
7d4fc6b	mtf_15m_supertrend_4h_hma_rsi_pullback_v1	SOLUSDT	-1.5946	-84.39	-37.26	-89.27	29.8	1.5	11466	-2.0393	-0.4174	discard	exp#121 mtf_15m_supertrend_4h_hma_rsi_pullback_v1	train
7d4fc6b	mtf_15m_supertrend_4h_hma_rsi_pullback_v1	BTCUSDT	-5.1265	-94.21	-50.98	-94.38	25.5	1.26	11501	-6.4905	-0.5401	discard	exp#121 mtf_15m_supertrend_4h_hma_rsi_pullback_v1	train
7d4fc6b	mtf_15m_supertrend_4h_hma_rsi_pullback_v1	ETHUSDT	-3.6072	-92.07	-46.96	-92.19	27.7	1.34	11476	-4.5422	-0.5093	discard	exp#121 mtf_15m_supertrend_4h_hma_rsi_pullback_v1	train
7d4fc6b	mtf_15m_supertrend_4h_hma_rsi_pullback_v1	SOLUSDT	-1.5946	-84.39	-37.26	-89.27	29.8	1.5	11466	-2.0393	-0.4174	discard	exp#121 mtf_15m_supertrend_4h_hma_rsi_pullback_v1	train
9111682	mtf_30m_hma_4h_rsi_volume_v1	BTCUSDT	-6.8971	-73.94	-28.56	-74.29	46.3	0.79	5409	-4.0386	-0.3845	discard	exp#122 mtf_30m_hma_4h_rsi_volume_v1	train
9111682	mtf_30m_hma_4h_rsi_volume_v1	ETHUSDT	-4.4808	-65.03	-23.12	-65.28	49.1	0.89	5431	-2.6178	-0.3541	discard	exp#122 mtf_30m_hma_4h_rsi_volume_v1	train
9111682	mtf_30m_hma_4h_rsi_volume_v1	SOLUSDT	-1.8276	-51.04	-16.41	-59.0	52.7	1.02	5755	-1.167	-0.2782	discard	exp#122 mtf_30m_hma_4h_rsi_volume_v1	train
9111682	mtf_30m_hma_4h_rsi_volume_v1	BTCUSDT	-6.8971	-73.94	-28.56	-74.29	46.3	0.79	5409	-4.0386	-0.3845	discard	exp#122 mtf_30m_hma_4h_rsi_volume_v1	train
9111682	mtf_30m_hma_4h_rsi_volume_v1	ETHUSDT	-4.4808	-65.03	-23.12	-65.28	49.1	0.89	5431	-2.6178	-0.3541	discard	exp#122 mtf_30m_hma_4h_rsi_volume_v1	train
9111682	mtf_30m_hma_4h_rsi_volume_v1	SOLUSDT	-1.8276	-51.04	-16.41	-59.0	52.7	1.02	5755	-1.167	-0.2782	discard	exp#122 mtf_30m_hma_4h_rsi_volume_v1	train
a5fa70f	mtf_1h_hybrid_crsi_chop_4h_hma_v1	BTCUSDT	-3.5185	-43.7	-13.39	-45.79	56.7	0.89	3077	-1.9614	-0.2924	discard	exp#123 mtf_1h_hybrid_crsi_chop_4h_hma_v1	train
a5fa70f	mtf_1h_hybrid_crsi_chop_4h_hma_v1	ETHUSDT	-2.7525	-40.34	-12.12	-44.49	56.1	0.95	3089	-1.5595	-0.2724	discard	exp#123 mtf_1h_hybrid_crsi_chop_4h_hma_v1	train
a5fa70f	mtf_1h_hybrid_crsi_chop_4h_hma_v1	SOLUSDT	-1.3999	-36.28	-10.7	-39.76	57.3	0.98	3327	-0.8006	-0.269	discard	exp#123 mtf_1h_hybrid_crsi_chop_4h_hma_v1	train
a5fa70f	mtf_1h_hybrid_crsi_chop_4h_hma_v1	BTCUSDT	-3.5185	-43.7	-13.39	-45.79	56.7	0.89	3077	-1.9614	-0.2924	discard	exp#123 mtf_1h_hybrid_crsi_chop_4h_hma_v1	train
a5fa70f	mtf_1h_hybrid_crsi_chop_4h_hma_v1	ETHUSDT	-2.7525	-40.34	-12.12	-44.49	56.1	0.95	3089	-1.5595	-0.2724	discard	exp#123 mtf_1h_hybrid_crsi_chop_4h_hma_v1	train
a5fa70f	mtf_1h_hybrid_crsi_chop_4h_hma_v1	SOLUSDT	-1.3999	-36.28	-10.7	-39.76	57.3	0.98	3327	-0.8006	-0.269	discard	exp#123 mtf_1h_hybrid_crsi_chop_4h_hma_v1	train
c5b7153	mtf_4h_rsi_mr_weekly_hma_v1	BTCUSDT	-1.7492	-13.55	-3.58	-21.5	68.0	0.8	247	-0.6404	-0.1664	discard	exp#124 mtf_4h_rsi_mr_weekly_hma_v1	train
c5b7153	mtf_4h_rsi_mr_weekly_hma_v1	ETHUSDT	-2.007	-28.41	-8.02	-30.99	63.0	0.65	246	-0.7299	-0.2588	discard	exp#124 mtf_4h_rsi_mr_weekly_hma_v1	train
c5b7153	mtf_4h_rsi_mr_weekly_hma_v1	SOLUSDT	0.0906	24.05	5.56	-13.14	71.3	1.37	279	0.0367	0.4229	keep	exp#124 mtf_4h_rsi_mr_weekly_hma_v1	train
c5b7153	mtf_4h_rsi_mr_weekly_hma_v1	SOLUSDT	-1.6631	-13.41	-11.17	-18.24	67.2	0.74	116	-0.8173	-0.6121	discard	exp#124 mtf_4h_rsi_mr_weekly_hma_v1	test
c5b7153	mtf_4h_rsi_mr_weekly_hma_v1	BTCUSDT	-1.7492	-13.55	-3.58	-21.5	68.0	0.8	247	-0.6404	-0.1664	discard	exp#124 mtf_4h_rsi_mr_weekly_hma_v1	train
c5b7153	mtf_4h_rsi_mr_weekly_hma_v1	ETHUSDT	-2.007	-28.41	-8.02	-30.99	63.0	0.65	246	-0.7299	-0.2588	discard	exp#124 mtf_4h_rsi_mr_weekly_hma_v1	train
c5b7153	mtf_4h_rsi_mr_weekly_hma_v1	SOLUSDT	0.0906	24.05	5.56	-13.14	71.3	1.37	279	0.0367	0.4229	discard	exp#124 mtf_4h_rsi_mr_weekly_hma_v1	train
b414417	mtf_12h_kama_daily_weekly_hma_rsi_volume_v1	BTCUSDT	-0.7651	-12.11	-3.18	-22.22	37.7	1.06	310	-0.7801	-0.143	discard	exp#125 mtf_12h_kama_daily_weekly_hma_rsi_volume_v1	train
b414417	mtf_12h_kama_daily_weekly_hma_rsi_volume_v1	ETHUSDT	-0.3659	-1.84	-0.46	-18.88	40.7	1.12	312	-0.3751	-0.0245	discard	exp#125 mtf_12h_kama_daily_weekly_hma_rsi_volume_v1	train
b414417	mtf_12h_kama_daily_weekly_hma_rsi_volume_v1	SOLUSDT	1.074	180.8	29.58	-18.66	47.7	1.85	310	1.2104	1.585	keep	exp#125 mtf_12h_kama_daily_weekly_hma_rsi_volume_v1	train
b414417	mtf_12h_kama_daily_weekly_hma_rsi_volume_v1	SOLUSDT	0.6807	17.48	14.17	-12.24	51.5	1.5	103	0.7339	1.1583	keep	exp#125 mtf_12h_kama_daily_weekly_hma_rsi_volume_v1	test
b414417	mtf_12h_kama_daily_weekly_hma_rsi_volume_v1	BTCUSDT	-0.7651	-12.11	-3.18	-22.22	37.7	1.06	310	-0.7801	-0.143	discard	exp#125 mtf_12h_kama_daily_weekly_hma_rsi_volume_v1	train
b414417	mtf_12h_kama_daily_weekly_hma_rsi_volume_v1	ETHUSDT	-0.3659	-1.84	-0.46	-18.88	40.7	1.12	312	-0.3751	-0.0245	discard	exp#125 mtf_12h_kama_daily_weekly_hma_rsi_volume_v1	train
b414417	mtf_12h_kama_daily_weekly_hma_rsi_volume_v1	SOLUSDT	1.074	180.8	29.58	-18.66	47.7	1.85	310	1.2104	1.585	keep	exp#125 mtf_12h_kama_daily_weekly_hma_rsi_volume_v1	train
b414417	mtf_12h_kama_daily_weekly_hma_rsi_volume_v1	SOLUSDT	0.6807	17.48	14.17	-12.24	51.5	1.5	103	0.7339	1.1583	keep	exp#125 mtf_12h_kama_daily_weekly_hma_rsi_volume_v1	test
4db2e34	mtf_1d_fisher_weekly_hma_chop_regime_v1	BTCUSDT	-1.4884	-1.32	-0.33	-9.53	52.3	0.98	44	-0.5966	-0.0349	discard	exp#126 mtf_1d_fisher_weekly_hma_chop_regime_v1	train
4db2e34	mtf_1d_fisher_weekly_hma_chop_regime_v1	ETHUSDT	-1.2912	-8.82	-2.28	-10.04	48.8	0.75	43	-0.5095	-0.2273	discard	exp#126 mtf_1d_fisher_weekly_hma_chop_regime_v1	train
4db2e34	mtf_1d_fisher_weekly_hma_chop_regime_v1	SOLUSDT	-0.3552	10.09	2.44	-9.78	65.7	1.47	35	-0.1204	0.2496	discard	exp#126 mtf_1d_fisher_weekly_hma_chop_regime_v1	train
4db2e34	mtf_1d_fisher_weekly_hma_chop_regime_v1	BTCUSDT	-1.4884	-1.32	-0.33	-9.53	52.3	0.98	44	-0.5966	-0.0349	discard	exp#126 mtf_1d_fisher_weekly_hma_chop_regime_v1	train
4db2e34	mtf_1d_fisher_weekly_hma_chop_regime_v1	ETHUSDT	-1.2912	-8.82	-2.28	-10.04	48.8	0.75	43	-0.5095	-0.2273	discard	exp#126 mtf_1d_fisher_weekly_hma_chop_regime_v1	train
4db2e34	mtf_1d_fisher_weekly_hma_chop_regime_v1	SOLUSDT	-0.3552	10.09	2.44	-9.78	65.7	1.47	35	-0.1204	0.2496	discard	exp#126 mtf_1d_fisher_weekly_hma_chop_regime_v1	train
1658c43	mtf_15m_fisher_4h_hma_chop_volume_v1	BTCUSDT	-13.5156	-88.95	-42.37	-88.99	33.4	0.68	8702	-7.743	-0.4761	discard	exp#127 mtf_15m_fisher_4h_hma_chop_volume_v1	train
1658c43	mtf_15m_fisher_4h_hma_chop_volume_v1	ETHUSDT	-10.4839	-87.77	-40.88	-87.8	36.2	0.73	8415	-5.6085	-0.4656	discard	exp#127 mtf_15m_fisher_4h_hma_chop_volume_v1	train
1658c43	mtf_15m_fisher_4h_hma_chop_volume_v1	SOLUSDT	-6.3592	-83.83	-36.7	-84.09	40.8	0.83	7725	-3.204	-0.4365	discard	exp#127 mtf_15m_fisher_4h_hma_chop_volume_v1	train
1658c43	mtf_15m_fisher_4h_hma_chop_volume_v1	BTCUSDT	-13.5156	-88.95	-42.37	-88.99	33.4	0.68	8702	-7.743	-0.4761	discard	exp#127 mtf_15m_fisher_4h_hma_chop_volume_v1	train
1658c43	mtf_15m_fisher_4h_hma_chop_volume_v1	ETHUSDT	-10.4839	-87.77	-40.88	-87.8	36.2	0.73	8415	-5.6085	-0.4656	discard	exp#127 mtf_15m_fisher_4h_hma_chop_volume_v1	train
1658c43	mtf_15m_fisher_4h_hma_chop_volume_v1	SOLUSDT	-6.3592	-83.83	-36.7	-84.09	40.8	0.83	7725	-3.204	-0.4365	discard	exp#127 mtf_15m_fisher_4h_hma_chop_volume_v1	train
ae91e90	mtf_30m_kama_4h_1d_hma_chop_rsi_adx_v1	BTCUSDT	-2.9429	-57.67	-19.35	-59.06	30.8	0.9	3365	-2.5058	-0.3277	discard	exp#128 mtf_30m_kama_4h_1d_hma_chop_rsi_adx_v1	train
ae91e90	mtf_30m_kama_4h_1d_hma_chop_rsi_adx_v1	ETHUSDT	-1.9087	-49.71	-15.8	-49.78	31.7	1.0	3469	-1.7136	-0.3174	discard	exp#128 mtf_30m_kama_4h_1d_hma_chop_rsi_adx_v1	train
ae91e90	mtf_30m_kama_4h_1d_hma_chop_rsi_adx_v1	SOLUSDT	-0.3174	-9.31	-2.42	-41.28	33.7	1.15	3513	-0.3041	-0.0587	discard	exp#128 mtf_30m_kama_4h_1d_hma_chop_rsi_adx_v1	train
ae91e90	mtf_30m_kama_4h_1d_hma_chop_rsi_adx_v1	BTCUSDT	-2.9429	-57.67	-19.35	-59.06	30.8	0.9	3365	-2.5058	-0.3277	discard	exp#128 mtf_30m_kama_4h_1d_hma_chop_rsi_adx_v1	train
ae91e90	mtf_30m_kama_4h_1d_hma_chop_rsi_adx_v1	ETHUSDT	-1.9087	-49.71	-15.8	-49.78	31.7	1.0	3469	-1.7136	-0.3174	discard	exp#128 mtf_30m_kama_4h_1d_hma_chop_rsi_adx_v1	train
ae91e90	mtf_30m_kama_4h_1d_hma_chop_rsi_adx_v1	SOLUSDT	-0.3174	-9.31	-2.42	-41.28	33.7	1.15	3513	-0.3041	-0.0587	discard	exp#128 mtf_30m_kama_4h_1d_hma_chop_rsi_adx_v1	train
d736836	mtf_1h_kama_4h_12h_hma_rsi_volume_v1	BTCUSDT	-1.9699	-58.47	-19.73	-61.29	29.7	1.08	3753	-2.5113	-0.3219	discard	exp#129 mtf_1h_kama_4h_12h_hma_rsi_volume_v1	train
d736836	mtf_1h_kama_4h_12h_hma_rsi_volume_v1	ETHUSDT	-1.2163	-49.21	-15.59	-52.1	32.1	1.13	3663	-1.5561	-0.2992	discard	exp#129 mtf_1h_kama_4h_12h_hma_rsi_volume_v1	train
d736836	mtf_1h_kama_4h_12h_hma_rsi_volume_v1	SOLUSDT	-0.3309	-26.8	-7.53	-42.62	34.1	1.23	3494	-0.4121	-0.1767	discard	exp#129 mtf_1h_kama_4h_12h_hma_rsi_volume_v1	train
d736836	mtf_1h_kama_4h_12h_hma_rsi_volume_v1	BTCUSDT	-1.9699	-58.47	-19.73	-61.29	29.7	1.08	3753	-2.5113	-0.3219	discard	exp#129 mtf_1h_kama_4h_12h_hma_rsi_volume_v1	train
d736836	mtf_1h_kama_4h_12h_hma_rsi_volume_v1	ETHUSDT	-1.2163	-49.21	-15.59	-52.1	32.1	1.13	3663	-1.5561	-0.2992	discard	exp#129 mtf_1h_kama_4h_12h_hma_rsi_volume_v1	train
d736836	mtf_1h_kama_4h_12h_hma_rsi_volume_v1	SOLUSDT	-0.3309	-26.8	-7.53	-42.62	34.1	1.23	3494	-0.4121	-0.1767	discard	exp#129 mtf_1h_kama_4h_12h_hma_rsi_volume_v1	train
b4f8015	mtf_4h_regime_adaptive_daily_weekly_hma_chop_adx_v1	BTCUSDT	-0.4817	6.4	1.56	-11.56	48.3	1.2	555	-0.3244	0.1354	discard	exp#130 mtf_4h_regime_adaptive_daily_weekly_hma_chop_adx_v1	train
b4f8015	mtf_4h_regime_adaptive_daily_weekly_hma_chop_adx_v1	ETHUSDT	-1.3382	-20.7	-5.64	-25.33	43.7	0.9	568	-0.9214	-0.2225	discard	exp#130 mtf_4h_regime_adaptive_daily_weekly_hma_chop_adx_v1	train
b4f8015	mtf_4h_regime_adaptive_daily_weekly_hma_chop_adx_v1	SOLUSDT	0.4804	52.23	11.12	-19.27	50.1	1.31	543	0.331	0.5773	keep	exp#130 mtf_4h_regime_adaptive_daily_weekly_hma_chop_adx_v1	train
b4f8015	mtf_4h_regime_adaptive_daily_weekly_hma_chop_adx_v1	SOLUSDT	-0.0784	4.68	3.83	-9.39	52.1	1.15	194	-0.0605	0.4083	discard	exp#130 mtf_4h_regime_adaptive_daily_weekly_hma_chop_adx_v1	test
b4f8015	mtf_4h_regime_adaptive_daily_weekly_hma_chop_adx_v1	BTCUSDT	-0.4817	6.4	1.56	-11.56	48.3	1.2	555	-0.3244	0.1354	discard	exp#130 mtf_4h_regime_adaptive_daily_weekly_hma_chop_adx_v1	train
b4f8015	mtf_4h_regime_adaptive_daily_weekly_hma_chop_adx_v1	ETHUSDT	-1.3382	-20.7	-5.64	-25.33	43.7	0.9	568	-0.9214	-0.2225	discard	exp#130 mtf_4h_regime_adaptive_daily_weekly_hma_chop_adx_v1	train
b4f8015	mtf_4h_regime_adaptive_daily_weekly_hma_chop_adx_v1	SOLUSDT	0.4804	52.23	11.12	-19.27	50.1	1.31	543	0.331	0.5773	discard	exp#130 mtf_4h_regime_adaptive_daily_weekly_hma_chop_adx_v1	train
92a3fef	mtf_12h_supertrend_daily_hma_rsi_adx_v1	BTCUSDT	-0.2981	11.04	2.65	-17.2	50.7	1.21	531	-0.2596	0.1543	discard	exp#131 mtf_12h_supertrend_daily_hma_rsi_adx_v1	train
92a3fef	mtf_12h_supertrend_daily_hma_rsi_adx_v1	ETHUSDT	-0.219	12.13	2.9	-8.68	48.4	1.18	550	-0.2069	0.3345	discard	exp#131 mtf_12h_supertrend_daily_hma_rsi_adx_v1	train
92a3fef	mtf_12h_supertrend_daily_hma_rsi_adx_v1	SOLUSDT	0.2519	35.13	7.85	-22.17	47.5	1.22	550	0.2408	0.3539	keep	exp#131 mtf_12h_supertrend_daily_hma_rsi_adx_v1	train
92a3fef	mtf_12h_supertrend_daily_hma_rsi_adx_v1	SOLUSDT	-0.314	0.37	0.3	-14.17	45.6	1.08	182	-0.3359	0.0213	discard	exp#131 mtf_12h_supertrend_daily_hma_rsi_adx_v1	test
92a3fef	mtf_12h_supertrend_daily_hma_rsi_adx_v1	BTCUSDT	-0.2981	11.04	2.65	-17.2	50.7	1.21	531	-0.2596	0.1543	discard	exp#131 mtf_12h_supertrend_daily_hma_rsi_adx_v1	train
92a3fef	mtf_12h_supertrend_daily_hma_rsi_adx_v1	ETHUSDT	-0.219	12.13	2.9	-8.68	48.4	1.18	550	-0.2069	0.3345	discard	exp#131 mtf_12h_supertrend_daily_hma_rsi_adx_v1	train
92a3fef	mtf_12h_supertrend_daily_hma_rsi_adx_v1	SOLUSDT	0.2519	35.13	7.85	-22.17	47.5	1.22	550	0.2408	0.3539	discard	exp#131 mtf_12h_supertrend_daily_hma_rsi_adx_v1	train
bdabbd2	mtf_1d_regime_chop_weekly_hma_rsi_v1	BTCUSDT	0.0338	21.81	5.06	-13.65	50.0	1.8	84	0.0272	0.3703	keep	exp#132 mtf_1d_regime_chop_weekly_hma_rsi_v1	train
bdabbd2	mtf_1d_regime_chop_weekly_hma_rsi_v1	BTCUSDT	-1.8387	-3.86	-3.19	-5.77	41.9	0.63	31	-1.1635	-0.5521	discard	exp#132 mtf_1d_regime_chop_weekly_hma_rsi_v1	test
bdabbd2	mtf_1d_regime_chop_weekly_hma_rsi_v1	ETHUSDT	-0.3953	1.66	0.41	-19.12	44.4	1.26	90	-0.3027	0.0215	discard	exp#132 mtf_1d_regime_chop_weekly_hma_rsi_v1	train
bdabbd2	mtf_1d_regime_chop_weekly_hma_rsi_v1	SOLUSDT	0.1967	32.05	7.22	-26.69	39.1	1.88	87	0.1756	0.2706	keep	exp#132 mtf_1d_regime_chop_weekly_hma_rsi_v1	train
bdabbd2	mtf_1d_regime_chop_weekly_hma_rsi_v1	SOLUSDT	0.1242	7.24	5.92	-9.63	51.6	1.49	31	0.1184	0.6144	keep	exp#132 mtf_1d_regime_chop_weekly_hma_rsi_v1	test
bdabbd2	mtf_1d_regime_chop_weekly_hma_rsi_v1	BTCUSDT	0.0338	21.81	5.06	-13.65	50.0	1.8	84	0.0272	0.3703	keep	exp#132 mtf_1d_regime_chop_weekly_hma_rsi_v1	train
bdabbd2	mtf_1d_regime_chop_weekly_hma_rsi_v1	ETHUSDT	-0.3953	1.66	0.41	-19.12	44.4	1.26	90	-0.3027	0.0215	discard	exp#132 mtf_1d_regime_chop_weekly_hma_rsi_v1	train
bdabbd2	mtf_1d_regime_chop_weekly_hma_rsi_v1	SOLUSDT	0.1967	32.05	7.22	-26.69	39.1	1.88	87	0.1756	0.2706	keep	exp#132 mtf_1d_regime_chop_weekly_hma_rsi_v1	train
bdabbd2	mtf_1d_regime_chop_weekly_hma_rsi_v1	BTCUSDT	-1.8387	-3.86	-3.19	-5.77	41.9	0.63	31	-1.1635	-0.5521	discard	exp#132 mtf_1d_regime_chop_weekly_hma_rsi_v1	test
bdabbd2	mtf_1d_regime_chop_weekly_hma_rsi_v1	SOLUSDT	0.1242	7.24	5.92	-9.63	51.6	1.49	31	0.1184	0.6144	keep	exp#132 mtf_1d_regime_chop_weekly_hma_rsi_v1	test
ddbc4e2	mtf_15m_4h_hma_crsi_chop_regime_v1	BTCUSDT	-15.3538	-97.93	-62.1	-97.93	47.6	0.69	13755	-10.0353	-0.6341	discard	exp#133 mtf_15m_4h_hma_crsi_chop_regime_v1	train
ddbc4e2	mtf_15m_4h_hma_crsi_chop_regime_v1	ETHUSDT	-12.3382	-98.14	-63.11	-98.14	50.3	0.7	13499	-7.8772	-0.643	discard	exp#133 mtf_15m_4h_hma_crsi_chop_regime_v1	train
ddbc4e2	mtf_15m_4h_hma_crsi_chop_regime_v1	SOLUSDT	-8.7927	-98.89	-67.7	-98.89	55.2	0.75	14263	-5.6993	-0.6846	discard	exp#133 mtf_15m_4h_hma_crsi_chop_regime_v1	train
ddbc4e2	mtf_15m_4h_hma_crsi_chop_regime_v1	BTCUSDT	-15.3538	-97.93	-62.1	-97.93	47.6	0.69	13755	-10.0353	-0.6341	discard	exp#133 mtf_15m_4h_hma_crsi_chop_regime_v1	train
ddbc4e2	mtf_15m_4h_hma_crsi_chop_regime_v1	ETHUSDT	-12.3382	-98.14	-63.11	-98.14	50.3	0.7	13499	-7.8772	-0.643	discard	exp#133 mtf_15m_4h_hma_crsi_chop_regime_v1	train
ddbc4e2	mtf_15m_4h_hma_crsi_chop_regime_v1	SOLUSDT	-8.7927	-98.89	-67.7	-98.89	55.2	0.75	14263	-5.6993	-0.6846	discard	exp#133 mtf_15m_4h_hma_crsi_chop_regime_v1	train
8da3c79	mtf_30m_hma_4h_rsi_volume_pullback_v1	BTCUSDT	-5.7383	-28.64	-8.1	-28.89	43.9	0.66	1034	-1.3718	-0.2802	discard	exp#134 mtf_30m_hma_4h_rsi_volume_pullback_v1	train
8da3c79	mtf_30m_hma_4h_rsi_volume_pullback_v1	ETHUSDT	-4.3577	-21.36	-5.83	-21.55	49.8	0.82	992	-1.0132	-0.2707	discard	exp#134 mtf_30m_hma_4h_rsi_volume_pullback_v1	train
8da3c79	mtf_30m_hma_4h_rsi_volume_pullback_v1	SOLUSDT	-2.5019	-21.09	-5.77	-23.66	51.1	0.87	940	-0.5501	-0.2439	discard	exp#134 mtf_30m_hma_4h_rsi_volume_pullback_v1	train
8da3c79	mtf_30m_hma_4h_rsi_volume_pullback_v1	BTCUSDT	-5.7383	-28.64	-8.1	-28.89	43.9	0.66	1034	-1.3718	-0.2802	discard	exp#134 mtf_30m_hma_4h_rsi_volume_pullback_v1	train
8da3c79	mtf_30m_hma_4h_rsi_volume_pullback_v1	ETHUSDT	-4.3577	-21.36	-5.83	-21.55	49.8	0.82	992	-1.0132	-0.2707	discard	exp#134 mtf_30m_hma_4h_rsi_volume_pullback_v1	train
8da3c79	mtf_30m_hma_4h_rsi_volume_pullback_v1	SOLUSDT	-2.5019	-21.09	-5.77	-23.66	51.1	0.87	940	-0.5501	-0.2439	discard	exp#134 mtf_30m_hma_4h_rsi_volume_pullback_v1	train
607d53c	mtf_1h_hma_12h_rsi_volume_pullback_v1	BTCUSDT	-11.0962	-0.13	-0.03	-1.1	50.0	1.14	28	-0.6878	-0.0291	discard	exp#135 mtf_1h_hma_12h_rsi_volume_pullback_v1	train
607d53c	mtf_1h_hma_12h_rsi_volume_pullback_v1	ETHUSDT	-8.2221	-2.19	-0.55	-2.3	56.2	0.47	32	-0.4308	-0.2399	discard	exp#135 mtf_1h_hma_12h_rsi_volume_pullback_v1	train
607d53c	mtf_1h_hma_12h_rsi_volume_pullback_v1	SOLUSDT	-7.1983	-2.82	-0.72	-3.39	46.4	0.43	28	-0.3436	-0.2111	discard	exp#135 mtf_1h_hma_12h_rsi_volume_pullback_v1	train
607d53c	mtf_1h_hma_12h_rsi_volume_pullback_v1	BTCUSDT	-11.0962	-0.13	-0.03	-1.1	50.0	1.14	28	-0.6878	-0.0291	discard	exp#135 mtf_1h_hma_12h_rsi_volume_pullback_v1	train
607d53c	mtf_1h_hma_12h_rsi_volume_pullback_v1	ETHUSDT	-8.2221	-2.19	-0.55	-2.3	56.2	0.47	32	-0.4308	-0.2399	discard	exp#135 mtf_1h_hma_12h_rsi_volume_pullback_v1	train
607d53c	mtf_1h_hma_12h_rsi_volume_pullback_v1	SOLUSDT	-7.1983	-2.82	-0.72	-3.39	46.4	0.43	28	-0.3436	-0.2111	discard	exp#135 mtf_1h_hma_12h_rsi_volume_pullback_v1	train
d19e40f	mtf_4h_donchian_volume_1d_1w_hma_rsi_pullback_v1	BTCUSDT	-0.1632	18.82	4.41	-4.79	51.2	1.77	248	-0.0645	0.9211	discard	exp#136 mtf_4h_donchian_volume_1d_1w_hma_rsi_pullback_v1	train
d19e40f	mtf_4h_donchian_volume_1d_1w_hma_rsi_pullback_v1	ETHUSDT	-1.2179	-2.18	-0.55	-8.12	48.0	1.05	254	-0.397	-0.0677	discard	exp#136 mtf_4h_donchian_volume_1d_1w_hma_rsi_pullback_v1	train
d19e40f	mtf_4h_donchian_volume_1d_1w_hma_rsi_pullback_v1	SOLUSDT	0.3428	36.14	8.05	-9.36	51.4	1.43	276	0.1476	0.8602	keep	exp#136 mtf_4h_donchian_volume_1d_1w_hma_rsi_pullback_v1	train
d19e40f	mtf_4h_donchian_volume_1d_1w_hma_rsi_pullback_v1	SOLUSDT	-0.8516	-0.1	-0.09	-5.56	43.1	1.08	72	-0.3035	-0.0154	discard	exp#136 mtf_4h_donchian_volume_1d_1w_hma_rsi_pullback_v1	test
d19e40f	mtf_4h_donchian_volume_1d_1w_hma_rsi_pullback_v1	BTCUSDT	-0.1632	18.82	4.41	-4.79	51.2	1.77	248	-0.0645	0.9211	discard	exp#136 mtf_4h_donchian_volume_1d_1w_hma_rsi_pullback_v1	train
d19e40f	mtf_4h_donchian_volume_1d_1w_hma_rsi_pullback_v1	ETHUSDT	-1.2179	-2.18	-0.55	-8.12	48.0	1.05	254	-0.397	-0.0677	discard	exp#136 mtf_4h_donchian_volume_1d_1w_hma_rsi_pullback_v1	train
