commit	strategy	symbol	sharpe	return_pct	cagr_pct	max_dd_pct	win_rate	profit_factor	trades	sortino	calmar	status	description	period
0a3cffd	mtf_1d_donchian_4h_hma_rsi_momentum_atr_v1	ETHUSDT	-0.8516	-26.53	-7.42	-36.45	31.9	0.91	408	-0.9637	-0.2035	discard	exp#414 mtf_1d_donchian_4h_hma_rsi_momentum_atr_v1	train
0a3cffd	mtf_1d_donchian_4h_hma_rsi_momentum_atr_v1	SOLUSDT	-0.1829	-5.72	-1.47	-31.29	34.3	1.04	417	-0.2265	-0.0469	discard	exp#414 mtf_1d_donchian_4h_hma_rsi_momentum_atr_v1	train
0a3cffd	mtf_1d_donchian_4h_hma_rsi_momentum_atr_v1	BTCUSDT	-0.9018	-18.59	-5.01	-23.27	28.5	0.92	417	-1.0881	-0.2154	discard	exp#414 mtf_1d_donchian_4h_hma_rsi_momentum_atr_v1	train
0a3cffd	mtf_1d_donchian_4h_hma_rsi_momentum_atr_v1	ETHUSDT	-0.8516	-26.53	-7.42	-36.45	31.9	0.91	408	-0.9637	-0.2035	discard	exp#414 mtf_1d_donchian_4h_hma_rsi_momentum_atr_v1	train
0a3cffd	mtf_1d_donchian_4h_hma_rsi_momentum_atr_v1	SOLUSDT	-0.1829	-5.72	-1.47	-31.29	34.3	1.04	417	-0.2265	-0.0469	discard	exp#414 mtf_1d_donchian_4h_hma_rsi_momentum_atr_v1	train
cc61319	mtf_15m_mr_4h_hma_fisher_rsi_bb_zscore_atr_v1	BTCUSDT	-9.3715	-99.37	-71.81	-99.39	29.1	0.99	19065	-11.6472	-0.7225	discard	exp#415 mtf_15m_mr_4h_hma_fisher_rsi_bb_zscore_atr_v1	train
cc61319	mtf_15m_mr_4h_hma_fisher_rsi_bb_zscore_atr_v1	ETHUSDT	-6.7126	-98.93	-67.9	-98.94	30.3	1.09	19183	-8.3916	-0.6863	discard	exp#415 mtf_15m_mr_4h_hma_fisher_rsi_bb_zscore_atr_v1	train
cc61319	mtf_15m_mr_4h_hma_fisher_rsi_bb_zscore_atr_v1	SOLUSDT	-3.8589	-98.59	-65.69	-98.81	33.6	1.14	19304	-4.7494	-0.6648	discard	exp#415 mtf_15m_mr_4h_hma_fisher_rsi_bb_zscore_atr_v1	train
cc61319	mtf_15m_mr_4h_hma_fisher_rsi_bb_zscore_atr_v1	BTCUSDT	-9.3715	-99.37	-71.81	-99.39	29.1	0.99	19065	-11.6472	-0.7225	discard	exp#415 mtf_15m_mr_4h_hma_fisher_rsi_bb_zscore_atr_v1	train
cc61319	mtf_15m_mr_4h_hma_fisher_rsi_bb_zscore_atr_v1	ETHUSDT	-6.7126	-98.93	-67.9	-98.94	30.3	1.09	19183	-8.3916	-0.6863	discard	exp#415 mtf_15m_mr_4h_hma_fisher_rsi_bb_zscore_atr_v1	train
cc61319	mtf_15m_mr_4h_hma_fisher_rsi_bb_zscore_atr_v1	SOLUSDT	-3.8589	-98.59	-65.69	-98.81	33.6	1.14	19304	-4.7494	-0.6648	discard	exp#415 mtf_15m_mr_4h_hma_fisher_rsi_bb_zscore_atr_v1	train
fe2bc09	mtf_30m_rsi_pullback_4h_hma_zscore_atr_v1	BTCUSDT	-4.7774	-96.27	-56.08	-96.48	28.7	1.08	10592	-6.3548	-0.5812	discard	exp#416 mtf_30m_rsi_pullback_4h_hma_zscore_atr_v1	train
fe2bc09	mtf_30m_rsi_pullback_4h_hma_zscore_atr_v1	ETHUSDT	-3.4451	-95.11	-53.0	-95.15	30.2	1.13	10510	-4.5933	-0.557	discard	exp#416 mtf_30m_rsi_pullback_4h_hma_zscore_atr_v1	train
fe2bc09	mtf_30m_rsi_pullback_4h_hma_zscore_atr_v1	SOLUSDT	-1.6224	-90.85	-45.13	-94.04	32.5	1.27	10415	-2.1659	-0.4799	discard	exp#416 mtf_30m_rsi_pullback_4h_hma_zscore_atr_v1	train
fe2bc09	mtf_30m_rsi_pullback_4h_hma_zscore_atr_v1	BTCUSDT	-4.7774	-96.27	-56.08	-96.48	28.7	1.08	10592	-6.3548	-0.5812	discard	exp#416 mtf_30m_rsi_pullback_4h_hma_zscore_atr_v1	train
fe2bc09	mtf_30m_rsi_pullback_4h_hma_zscore_atr_v1	ETHUSDT	-3.4451	-95.11	-53.0	-95.15	30.2	1.13	10510	-4.5933	-0.557	discard	exp#416 mtf_30m_rsi_pullback_4h_hma_zscore_atr_v1	train
fe2bc09	mtf_30m_rsi_pullback_4h_hma_zscore_atr_v1	SOLUSDT	-1.6224	-90.85	-45.13	-94.04	32.5	1.27	10415	-2.1659	-0.4799	discard	exp#416 mtf_30m_rsi_pullback_4h_hma_zscore_atr_v1	train
3b09f48	mtf_1h_rsi_pullback_4h_hma_trend_atr_v1	BTCUSDT	-3.1352	-68.16	-24.89	-69.41	50.8	0.91	4980	-3.3625	-0.3587	discard	exp#417 mtf_1h_rsi_pullback_4h_hma_trend_atr_v1	train
3b09f48	mtf_1h_rsi_pullback_4h_hma_trend_atr_v1	ETHUSDT	-2.5008	-68.79	-25.27	-70.46	51.5	0.94	5045	-2.6932	-0.3586	discard	exp#417 mtf_1h_rsi_pullback_4h_hma_trend_atr_v1	train
3b09f48	mtf_1h_rsi_pullback_4h_hma_trend_atr_v1	SOLUSDT	-0.5289	-29.19	-8.3	-41.7	53.8	1.03	5091	-0.5648	-0.199	discard	exp#417 mtf_1h_rsi_pullback_4h_hma_trend_atr_v1	train
3b09f48	mtf_1h_rsi_pullback_4h_hma_trend_atr_v1	BTCUSDT	-3.1352	-68.16	-24.89	-69.41	50.8	0.91	4980	-3.3625	-0.3587	discard	exp#417 mtf_1h_rsi_pullback_4h_hma_trend_atr_v1	train
3b09f48	mtf_1h_rsi_pullback_4h_hma_trend_atr_v1	ETHUSDT	-2.5008	-68.79	-25.27	-70.46	51.5	0.94	5045	-2.6932	-0.3586	discard	exp#417 mtf_1h_rsi_pullback_4h_hma_trend_atr_v1	train
3b09f48	mtf_1h_rsi_pullback_4h_hma_trend_atr_v1	SOLUSDT	-0.5289	-29.19	-8.3	-41.7	53.8	1.03	5091	-0.5648	-0.199	discard	exp#417 mtf_1h_rsi_pullback_4h_hma_trend_atr_v1	train
aacc625	mtf_4h_fisher_daily_hma_chop_regime_rsi_atr_v1	BTCUSDT	-0.3087	-1.84	-0.46	-29.13	28.9	1.42	910	-0.4067	-0.0159	discard	exp#418 mtf_4h_fisher_daily_hma_chop_regime_rsi_atr_v1	train
aacc625	mtf_4h_fisher_daily_hma_chop_regime_rsi_atr_v1	ETHUSDT	-0.0962	6.65	1.62	-23.42	30.0	1.52	968	-0.1273	0.0693	discard	exp#418 mtf_4h_fisher_daily_hma_chop_regime_rsi_atr_v1	train
aacc625	mtf_4h_fisher_daily_hma_chop_regime_rsi_atr_v1	SOLUSDT	0.5603	96.46	18.47	-35.01	32.2	1.67	904	0.7614	0.5276	keep	exp#418 mtf_4h_fisher_daily_hma_chop_regime_rsi_atr_v1	train
aacc625	mtf_4h_fisher_daily_hma_chop_regime_rsi_atr_v1	SOLUSDT	-0.3254	-3.67	-3.03	-26.79	30.7	1.37	322	-0.4534	-0.1131	discard	exp#418 mtf_4h_fisher_daily_hma_chop_regime_rsi_atr_v1	test
aacc625	mtf_4h_fisher_daily_hma_chop_regime_rsi_atr_v1	BTCUSDT	-0.3087	-1.84	-0.46	-29.13	28.9	1.42	910	-0.4067	-0.0159	discard	exp#418 mtf_4h_fisher_daily_hma_chop_regime_rsi_atr_v1	train
aacc625	mtf_4h_fisher_daily_hma_chop_regime_rsi_atr_v1	ETHUSDT	-0.0962	6.65	1.62	-23.42	30.0	1.52	968	-0.1273	0.0693	discard	exp#418 mtf_4h_fisher_daily_hma_chop_regime_rsi_atr_v1	train
aacc625	mtf_4h_fisher_daily_hma_chop_regime_rsi_atr_v1	SOLUSDT	0.5603	96.46	18.47	-35.01	32.2	1.67	904	0.7614	0.5276	discard	exp#418 mtf_4h_fisher_daily_hma_chop_regime_rsi_atr_v1	train
012ca05	mtf_12h_kama_daily_hma_rsi_momentum_atr_v1	BTCUSDT	-0.9286	-32.4	-9.33	-39.57	26.4	1.17	397	-1.3017	-0.2358	discard	exp#419 mtf_12h_kama_daily_hma_rsi_momentum_atr_v1	train
012ca05	mtf_12h_kama_daily_hma_rsi_momentum_atr_v1	ETHUSDT	-0.2355	-4.73	-1.2	-27.92	28.0	1.33	350	-0.3354	-0.0431	discard	exp#419 mtf_12h_kama_daily_hma_rsi_momentum_atr_v1	train
012ca05	mtf_12h_kama_daily_hma_rsi_momentum_atr_v1	SOLUSDT	0.5324	91.34	17.68	-25.07	31.3	1.97	355	0.7698	0.7054	keep	exp#419 mtf_12h_kama_daily_hma_rsi_momentum_atr_v1	train
012ca05	mtf_12h_kama_daily_hma_rsi_momentum_atr_v1	SOLUSDT	-0.0974	0.82	0.67	-19.01	32.4	1.42	105	-0.1293	0.0353	discard	exp#419 mtf_12h_kama_daily_hma_rsi_momentum_atr_v1	test
012ca05	mtf_12h_kama_daily_hma_rsi_momentum_atr_v1	BTCUSDT	-0.9286	-32.4	-9.33	-39.57	26.4	1.17	397	-1.3017	-0.2358	discard	exp#419 mtf_12h_kama_daily_hma_rsi_momentum_atr_v1	train
012ca05	mtf_12h_kama_daily_hma_rsi_momentum_atr_v1	ETHUSDT	-0.2355	-4.73	-1.2	-27.92	28.0	1.33	350	-0.3354	-0.0431	discard	exp#419 mtf_12h_kama_daily_hma_rsi_momentum_atr_v1	train
012ca05	mtf_12h_kama_daily_hma_rsi_momentum_atr_v1	SOLUSDT	0.5324	91.34	17.68	-25.07	31.3	1.97	355	0.7698	0.7054	discard	exp#419 mtf_12h_kama_daily_hma_rsi_momentum_atr_v1	train
e7eadd6	mtf_1d_crsi_chop_regime_weekly_hma_atr_v1	BTCUSDT	-2.4061	-4.74	-1.21	-6.15	52.5	0.7	40	-0.7457	-0.1961	discard	exp#420 mtf_1d_crsi_chop_regime_weekly_hma_atr_v1	train
e7eadd6	mtf_1d_crsi_chop_regime_weekly_hma_atr_v1	ETHUSDT	-2.0034	-0.31	-0.08	-3.13	58.2	1.04	55	-0.7698	-0.025	discard	exp#420 mtf_1d_crsi_chop_regime_weekly_hma_atr_v1	train
e7eadd6	mtf_1d_crsi_chop_regime_weekly_hma_atr_v1	SOLUSDT	-1.4048	0.12	0.03	-6.42	58.7	1.02	46	-0.4713	0.0046	discard	exp#420 mtf_1d_crsi_chop_regime_weekly_hma_atr_v1	train
e7eadd6	mtf_1d_crsi_chop_regime_weekly_hma_atr_v1	BTCUSDT	-2.4061	-4.74	-1.21	-6.15	52.5	0.7	40	-0.7457	-0.1961	discard	exp#420 mtf_1d_crsi_chop_regime_weekly_hma_atr_v1	train
e7eadd6	mtf_1d_crsi_chop_regime_weekly_hma_atr_v1	ETHUSDT	-2.0034	-0.31	-0.08	-3.13	58.2	1.04	55	-0.7698	-0.025	discard	exp#420 mtf_1d_crsi_chop_regime_weekly_hma_atr_v1	train
e7eadd6	mtf_1d_crsi_chop_regime_weekly_hma_atr_v1	SOLUSDT	-1.4048	0.12	0.03	-6.42	58.7	1.02	46	-0.4713	0.0046	discard	exp#420 mtf_1d_crsi_chop_regime_weekly_hma_atr_v1	train
f64b55f	mtf_15m_supertrend_4h_hma_rsi_momentum_atr_v1	BTCUSDT	-5.0372	-82.58	-35.42	-83.03	26.0	1.2	8202	-4.8974	-0.4266	discard	exp#421 mtf_15m_supertrend_4h_hma_rsi_momentum_atr_v1	train
f64b55f	mtf_15m_supertrend_4h_hma_rsi_momentum_atr_v1	ETHUSDT	-3.8951	-80.92	-33.93	-81.17	27.0	1.27	8262	-3.675	-0.418	discard	exp#421 mtf_15m_supertrend_4h_hma_rsi_momentum_atr_v1	train
f64b55f	mtf_15m_supertrend_4h_hma_rsi_momentum_atr_v1	SOLUSDT	-1.1692	-54.85	-18.1	-73.79	29.9	1.43	7725	-1.1315	-0.2452	discard	exp#421 mtf_15m_supertrend_4h_hma_rsi_momentum_atr_v1	train
f64b55f	mtf_15m_supertrend_4h_hma_rsi_momentum_atr_v1	BTCUSDT	-5.0372	-82.58	-35.42	-83.03	26.0	1.2	8202	-4.8974	-0.4266	discard	exp#421 mtf_15m_supertrend_4h_hma_rsi_momentum_atr_v1	train
f64b55f	mtf_15m_supertrend_4h_hma_rsi_momentum_atr_v1	ETHUSDT	-3.8951	-80.92	-33.93	-81.17	27.0	1.27	8262	-3.675	-0.418	discard	exp#421 mtf_15m_supertrend_4h_hma_rsi_momentum_atr_v1	train
f64b55f	mtf_15m_supertrend_4h_hma_rsi_momentum_atr_v1	SOLUSDT	-1.1692	-54.85	-18.1	-73.79	29.9	1.43	7725	-1.1315	-0.2452	discard	exp#421 mtf_15m_supertrend_4h_hma_rsi_momentum_atr_v1	train
8076434	mtf_30m_kama_4h_hma_adx_volume_atr_v1	BTCUSDT	-4.8512	-77.35	-31.03	-77.76	35.8	0.84	6079	-3.3863	-0.3991	discard	exp#422 mtf_30m_kama_4h_hma_adx_volume_atr_v1	train
8076434	mtf_30m_kama_4h_hma_adx_volume_atr_v1	ETHUSDT	-4.4335	-81.39	-34.34	-81.49	36.1	0.83	6327	-3.1843	-0.4214	discard	exp#422 mtf_30m_kama_4h_hma_adx_volume_atr_v1	train
8076434	mtf_30m_kama_4h_hma_adx_volume_atr_v1	SOLUSDT	-2.7842	-81.34	-34.39	-82.35	40.0	0.91	6054	-1.9196	-0.4176	discard	exp#422 mtf_30m_kama_4h_hma_adx_volume_atr_v1	train
8076434	mtf_30m_kama_4h_hma_adx_volume_atr_v1	BTCUSDT	-4.8512	-77.35	-31.03	-77.76	35.8	0.84	6079	-3.3863	-0.3991	discard	exp#422 mtf_30m_kama_4h_hma_adx_volume_atr_v1	train
8076434	mtf_30m_kama_4h_hma_adx_volume_atr_v1	ETHUSDT	-4.4335	-81.39	-34.34	-81.49	36.1	0.83	6327	-3.1843	-0.4214	discard	exp#422 mtf_30m_kama_4h_hma_adx_volume_atr_v1	train
8076434	mtf_30m_kama_4h_hma_adx_volume_atr_v1	SOLUSDT	-2.7842	-81.34	-34.39	-82.35	40.0	0.91	6054	-1.9196	-0.4176	discard	exp#422 mtf_30m_kama_4h_hma_adx_volume_atr_v1	train
2d45a50	mtf_1h_trend_4h_hma_volume_rsi_multipath_atr_v1	BTCUSDT	-2.312	-70.57	-26.36	-71.73	26.8	1.19	5071	-3.2545	-0.3675	discard	exp#423 mtf_1h_trend_4h_hma_volume_rsi_multipath_atr_v1	train
2d45a50	mtf_1h_trend_4h_hma_volume_rsi_multipath_atr_v1	ETHUSDT	-1.3518	-58.91	-19.95	-59.33	28.9	1.3	4928	-1.8911	-0.3363	discard	exp#423 mtf_1h_trend_4h_hma_volume_rsi_multipath_atr_v1	train
2d45a50	mtf_1h_trend_4h_hma_volume_rsi_multipath_atr_v1	SOLUSDT	-0.101	-10.11	-2.64	-36.52	31.9	1.4	4750	-0.1371	-0.0723	discard	exp#423 mtf_1h_trend_4h_hma_volume_rsi_multipath_atr_v1	train
2d45a50	mtf_1h_trend_4h_hma_volume_rsi_multipath_atr_v1	BTCUSDT	-2.312	-70.57	-26.36	-71.73	26.8	1.19	5071	-3.2545	-0.3675	discard	exp#423 mtf_1h_trend_4h_hma_volume_rsi_multipath_atr_v1	train
2d45a50	mtf_1h_trend_4h_hma_volume_rsi_multipath_atr_v1	ETHUSDT	-1.3518	-58.91	-19.95	-59.33	28.9	1.3	4928	-1.8911	-0.3363	discard	exp#423 mtf_1h_trend_4h_hma_volume_rsi_multipath_atr_v1	train
2d45a50	mtf_1h_trend_4h_hma_volume_rsi_multipath_atr_v1	SOLUSDT	-0.101	-10.11	-2.64	-36.52	31.9	1.4	4750	-0.1371	-0.0723	discard	exp#423 mtf_1h_trend_4h_hma_volume_rsi_multipath_atr_v1	train
a4134e7	mtf_4h_donchian_daily_hma_volume_breakout_atr_v1	BTCUSDT	-0.6393	-15.07	-4.0	-28.77	27.7	1.28	795	-0.784	-0.1391	discard	exp#424 mtf_4h_donchian_daily_hma_volume_breakout_atr_v1	train
a4134e7	mtf_4h_donchian_daily_hma_volume_breakout_atr_v1	ETHUSDT	-0.2006	1.25	0.31	-21.03	30.7	1.4	801	-0.2445	0.0148	discard	exp#424 mtf_4h_donchian_daily_hma_volume_breakout_atr_v1	train
a4134e7	mtf_4h_donchian_daily_hma_volume_breakout_atr_v1	SOLUSDT	0.6168	101.86	19.28	-25.01	32.4	1.71	744	0.7639	0.771	keep	exp#424 mtf_4h_donchian_daily_hma_volume_breakout_atr_v1	train
a4134e7	mtf_4h_donchian_daily_hma_volume_breakout_atr_v1	SOLUSDT	-0.5754	-7.64	-6.33	-25.5	29.7	1.21	259	-0.7138	-0.2481	discard	exp#424 mtf_4h_donchian_daily_hma_volume_breakout_atr_v1	test
a4134e7	mtf_4h_donchian_daily_hma_volume_breakout_atr_v1	BTCUSDT	-0.6393	-15.07	-4.0	-28.77	27.7	1.28	795	-0.784	-0.1391	discard	exp#424 mtf_4h_donchian_daily_hma_volume_breakout_atr_v1	train
a4134e7	mtf_4h_donchian_daily_hma_volume_breakout_atr_v1	ETHUSDT	-0.2006	1.25	0.31	-21.03	30.7	1.4	801	-0.2445	0.0148	discard	exp#424 mtf_4h_donchian_daily_hma_volume_breakout_atr_v1	train
a4134e7	mtf_4h_donchian_daily_hma_volume_breakout_atr_v1	SOLUSDT	0.6168	101.86	19.28	-25.01	32.4	1.71	744	0.7639	0.771	discard	exp#424 mtf_4h_donchian_daily_hma_volume_breakout_atr_v1	train
cfd5c72	mtf_12h_donchian_daily_hma_rsi_momentum_atr_v1	BTCUSDT	-0.5365	-11.26	-2.94	-20.02	30.7	1.08	384	-0.6864	-0.1471	discard	exp#425 mtf_12h_donchian_daily_hma_rsi_momentum_atr_v1	train
cfd5c72	mtf_12h_donchian_daily_hma_rsi_momentum_atr_v1	ETHUSDT	-0.225	-1.73	-0.44	-18.49	29.4	1.19	378	-0.2977	-0.0236	discard	exp#425 mtf_12h_donchian_daily_hma_rsi_momentum_atr_v1	train
cfd5c72	mtf_12h_donchian_daily_hma_rsi_momentum_atr_v1	SOLUSDT	0.961	193.32	31.0	-22.58	35.4	1.73	336	1.3191	1.3731	keep	exp#425 mtf_12h_donchian_daily_hma_rsi_momentum_atr_v1	train
cfd5c72	mtf_12h_donchian_daily_hma_rsi_momentum_atr_v1	SOLUSDT	0.1955	8.76	7.15	-14.3	36.6	1.32	123	0.2636	0.5	keep	exp#425 mtf_12h_donchian_daily_hma_rsi_momentum_atr_v1	test
cfd5c72	mtf_12h_donchian_daily_hma_rsi_momentum_atr_v1	BTCUSDT	-0.5365	-11.26	-2.94	-20.02	30.7	1.08	384	-0.6864	-0.1471	discard	exp#425 mtf_12h_donchian_daily_hma_rsi_momentum_atr_v1	train
cfd5c72	mtf_12h_donchian_daily_hma_rsi_momentum_atr_v1	ETHUSDT	-0.225	-1.73	-0.44	-18.49	29.4	1.19	378	-0.2977	-0.0236	discard	exp#425 mtf_12h_donchian_daily_hma_rsi_momentum_atr_v1	train
cfd5c72	mtf_12h_donchian_daily_hma_rsi_momentum_atr_v1	SOLUSDT	0.961	193.32	31.0	-22.58	35.4	1.73	336	1.3191	1.3731	keep	exp#425 mtf_12h_donchian_daily_hma_rsi_momentum_atr_v1	train
cfd5c72	mtf_12h_donchian_daily_hma_rsi_momentum_atr_v1	SOLUSDT	0.1955	8.76	7.15	-14.3	36.6	1.32	123	0.2636	0.5	keep	exp#425 mtf_12h_donchian_daily_hma_rsi_momentum_atr_v1	test
b599ee3	mtf_1d_weekly_hma_rsi_macd_ensemble_atr_v1	BTCUSDT	-0.294	0.69	0.17	-21.58	41.7	1.06	187	-0.3591	0.008	discard	exp#426 mtf_1d_weekly_hma_rsi_macd_ensemble_atr_v1	train
b599ee3	mtf_1d_weekly_hma_rsi_macd_ensemble_atr_v1	ETHUSDT	-0.6006	-23.49	-6.48	-39.52	40.5	0.93	220	-0.7154	-0.1638	discard	exp#426 mtf_1d_weekly_hma_rsi_macd_ensemble_atr_v1	train
b599ee3	mtf_1d_weekly_hma_rsi_macd_ensemble_atr_v1	SOLUSDT	0.6213	94.79	18.21	-22.87	46.4	1.33	211	0.8423	0.7961	keep	exp#426 mtf_1d_weekly_hma_rsi_macd_ensemble_atr_v1	train
b599ee3	mtf_1d_weekly_hma_rsi_macd_ensemble_atr_v1	SOLUSDT	-1.0218	-21.03	-17.66	-30.86	36.0	0.78	75	-1.3101	-0.572	discard	exp#426 mtf_1d_weekly_hma_rsi_macd_ensemble_atr_v1	test
b599ee3	mtf_1d_weekly_hma_rsi_macd_ensemble_atr_v1	BTCUSDT	-0.294	0.69	0.17	-21.58	41.7	1.06	187	-0.3591	0.008	discard	exp#426 mtf_1d_weekly_hma_rsi_macd_ensemble_atr_v1	train
b599ee3	mtf_1d_weekly_hma_rsi_macd_ensemble_atr_v1	ETHUSDT	-0.6006	-23.49	-6.48	-39.52	40.5	0.93	220	-0.7154	-0.1638	discard	exp#426 mtf_1d_weekly_hma_rsi_macd_ensemble_atr_v1	train
b599ee3	mtf_1d_weekly_hma_rsi_macd_ensemble_atr_v1	SOLUSDT	0.6213	94.79	18.21	-22.87	46.4	1.33	211	0.8423	0.7961	discard	exp#426 mtf_1d_weekly_hma_rsi_macd_ensemble_atr_v1	train
9d346a1	mtf_15m_hma_4h_bias_rsi_pullback_adx_regime_atr_v1	BTCUSDT	-9.7864	-99.27	-70.78	-99.31	35.2	0.92	20592	-12.2357	-0.7128	discard	exp#427 mtf_15m_hma_4h_bias_rsi_pullback_adx_regime_atr_v1	train
9d346a1	mtf_15m_hma_4h_bias_rsi_pullback_adx_regime_atr_v1	ETHUSDT	-6.9898	-98.81	-67.0	-98.82	37.2	0.96	20779	-8.7592	-0.678	discard	exp#427 mtf_15m_hma_4h_bias_rsi_pullback_adx_regime_atr_v1	train
9d346a1	mtf_15m_hma_4h_bias_rsi_pullback_adx_regime_atr_v1	SOLUSDT	-3.3435	-96.72	-57.58	-97.1	39.5	1.0	20836	-4.2159	-0.593	discard	exp#427 mtf_15m_hma_4h_bias_rsi_pullback_adx_regime_atr_v1	train
9d346a1	mtf_15m_hma_4h_bias_rsi_pullback_adx_regime_atr_v1	BTCUSDT	-9.7864	-99.27	-70.78	-99.31	35.2	0.92	20592	-12.2357	-0.7128	discard	exp#427 mtf_15m_hma_4h_bias_rsi_pullback_adx_regime_atr_v1	train
9d346a1	mtf_15m_hma_4h_bias_rsi_pullback_adx_regime_atr_v1	ETHUSDT	-6.9898	-98.81	-67.0	-98.82	37.2	0.96	20779	-8.7592	-0.678	discard	exp#427 mtf_15m_hma_4h_bias_rsi_pullback_adx_regime_atr_v1	train
9d346a1	mtf_15m_hma_4h_bias_rsi_pullback_adx_regime_atr_v1	SOLUSDT	-3.3435	-96.72	-57.58	-97.1	39.5	1.0	20836	-4.2159	-0.593	discard	exp#427 mtf_15m_hma_4h_bias_rsi_pullback_adx_regime_atr_v1	train
6b99cdd	mtf_1h_crsi_4h_hma_chop_regime_mean_reversion_atr_v1	BTCUSDT	-2.8881	-6.83	-1.76	-7.91	66.0	0.91	365	-0.5274	-0.2219	discard	exp#429 mtf_1h_crsi_4h_hma_chop_regime_mean_reversion_atr_v1	train
6b99cdd	mtf_1h_crsi_4h_hma_chop_regime_mean_reversion_atr_v1	ETHUSDT	-1.6277	-1.04	-0.26	-6.06	68.8	1.15	375	-0.3089	-0.0429	discard	exp#429 mtf_1h_crsi_4h_hma_chop_regime_mean_reversion_atr_v1	train
6b99cdd	mtf_1h_crsi_4h_hma_chop_regime_mean_reversion_atr_v1	SOLUSDT	-1.7885	-14.07	-3.74	-18.52	68.4	0.82	370	-0.3445	-0.2018	discard	exp#429 mtf_1h_crsi_4h_hma_chop_regime_mean_reversion_atr_v1	train
6b99cdd	mtf_1h_crsi_4h_hma_chop_regime_mean_reversion_atr_v1	BTCUSDT	-2.8881	-6.83	-1.76	-7.91	66.0	0.91	365	-0.5274	-0.2219	discard	exp#429 mtf_1h_crsi_4h_hma_chop_regime_mean_reversion_atr_v1	train
6b99cdd	mtf_1h_crsi_4h_hma_chop_regime_mean_reversion_atr_v1	ETHUSDT	-1.6277	-1.04	-0.26	-6.06	68.8	1.15	375	-0.3089	-0.0429	discard	exp#429 mtf_1h_crsi_4h_hma_chop_regime_mean_reversion_atr_v1	train
6b99cdd	mtf_1h_crsi_4h_hma_chop_regime_mean_reversion_atr_v1	SOLUSDT	-1.7885	-14.07	-3.74	-18.52	68.4	0.82	370	-0.3445	-0.2018	discard	exp#429 mtf_1h_crsi_4h_hma_chop_regime_mean_reversion_atr_v1	train
c1a96f7	mtf_4h_kama_daily_hma_chop_regime_rsi_atr_v1	BTCUSDT	-0.8661	-25.67	-7.15	-37.93	34.1	1.01	1157	-1.0757	-0.1885	discard	exp#430 mtf_4h_kama_daily_hma_chop_regime_rsi_atr_v1	train
c1a96f7	mtf_4h_kama_daily_hma_chop_regime_rsi_atr_v1	ETHUSDT	-0.4515	-14.94	-3.97	-27.33	37.0	1.08	1247	-0.5697	-0.1451	discard	exp#430 mtf_4h_kama_daily_hma_chop_regime_rsi_atr_v1	train
c1a96f7	mtf_4h_kama_daily_hma_chop_regime_rsi_atr_v1	SOLUSDT	0.5078	81.3	16.11	-28.16	36.3	1.19	1195	0.6571	0.5719	keep	exp#430 mtf_4h_kama_daily_hma_chop_regime_rsi_atr_v1	train
c1a96f7	mtf_4h_kama_daily_hma_chop_regime_rsi_atr_v1	SOLUSDT	-1.2486	-20.63	-17.31	-35.8	34.0	0.92	394	-1.6251	-0.4836	discard	exp#430 mtf_4h_kama_daily_hma_chop_regime_rsi_atr_v1	test
c1a96f7	mtf_4h_kama_daily_hma_chop_regime_rsi_atr_v1	BTCUSDT	-0.8661	-25.67	-7.15	-37.93	34.1	1.01	1157	-1.0757	-0.1885	discard	exp#430 mtf_4h_kama_daily_hma_chop_regime_rsi_atr_v1	train
c1a96f7	mtf_4h_kama_daily_hma_chop_regime_rsi_atr_v1	ETHUSDT	-0.4515	-14.94	-3.97	-27.33	37.0	1.08	1247	-0.5697	-0.1451	discard	exp#430 mtf_4h_kama_daily_hma_chop_regime_rsi_atr_v1	train
c1a96f7	mtf_4h_kama_daily_hma_chop_regime_rsi_atr_v1	SOLUSDT	0.5078	81.3	16.11	-28.16	36.3	1.19	1195	0.6571	0.5719	discard	exp#430 mtf_4h_kama_daily_hma_chop_regime_rsi_atr_v1	train
6f3f4c2	mtf_12h_fisher_daily_hma_chop_regime_atr_v1	BTCUSDT	-0.3861	1.12	0.28	-13.85	43.6	1.17	532	-0.454	0.0201	discard	exp#431 mtf_12h_fisher_daily_hma_chop_regime_atr_v1	train
6f3f4c2	mtf_12h_fisher_daily_hma_chop_regime_atr_v1	ETHUSDT	-0.1359	9.61	2.32	-18.56	44.6	1.27	489	-0.1551	0.1251	discard	exp#431 mtf_12h_fisher_daily_hma_chop_regime_atr_v1	train
6f3f4c2	mtf_12h_fisher_daily_hma_chop_regime_atr_v1	SOLUSDT	0.3386	49.42	10.6	-28.53	41.1	1.42	528	0.3734	0.3716	keep	exp#431 mtf_12h_fisher_daily_hma_chop_regime_atr_v1	train
6f3f4c2	mtf_12h_fisher_daily_hma_chop_regime_atr_v1	SOLUSDT	-0.2312	0.64	0.52	-16.9	42.4	1.12	165	-0.2554	0.031	discard	exp#431 mtf_12h_fisher_daily_hma_chop_regime_atr_v1	test
6f3f4c2	mtf_12h_fisher_daily_hma_chop_regime_atr_v1	BTCUSDT	-0.3861	1.12	0.28	-13.85	43.6	1.17	532	-0.454	0.0201	discard	exp#431 mtf_12h_fisher_daily_hma_chop_regime_atr_v1	train
6f3f4c2	mtf_12h_fisher_daily_hma_chop_regime_atr_v1	ETHUSDT	-0.1359	9.61	2.32	-18.56	44.6	1.27	489	-0.1551	0.1251	discard	exp#431 mtf_12h_fisher_daily_hma_chop_regime_atr_v1	train
6f3f4c2	mtf_12h_fisher_daily_hma_chop_regime_atr_v1	SOLUSDT	0.3386	49.42	10.6	-28.53	41.1	1.42	528	0.3734	0.3716	discard	exp#431 mtf_12h_fisher_daily_hma_chop_regime_atr_v1	train
38dd1ab	mtf_1d_rsi_macd_weekly_hma_ensemble_atr_v1	BTCUSDT	-0.2656	3.06	0.76	-24.28	38.8	1.6	129	-0.3241	0.0312	discard	exp#432 mtf_1d_rsi_macd_weekly_hma_ensemble_atr_v1	train
38dd1ab	mtf_1d_rsi_macd_weekly_hma_ensemble_atr_v1	ETHUSDT	-0.607	-20.48	-5.57	-32.74	34.3	1.22	143	-0.703	-0.1701	discard	exp#432 mtf_1d_rsi_macd_weekly_hma_ensemble_atr_v1	train
38dd1ab	mtf_1d_rsi_macd_weekly_hma_ensemble_atr_v1	SOLUSDT	0.9429	174.56	28.84	-22.5	36.7	3.23	128	1.3254	1.2815	keep	exp#432 mtf_1d_rsi_macd_weekly_hma_ensemble_atr_v1	train
38dd1ab	mtf_1d_rsi_macd_weekly_hma_ensemble_atr_v1	SOLUSDT	0.2507	9.73	7.94	-15.8	54.3	1.77	46	0.2542	0.5024	keep	exp#432 mtf_1d_rsi_macd_weekly_hma_ensemble_atr_v1	test
38dd1ab	mtf_1d_rsi_macd_weekly_hma_ensemble_atr_v1	BTCUSDT	-0.2656	3.06	0.76	-24.28	38.8	1.6	129	-0.3241	0.0312	discard	exp#432 mtf_1d_rsi_macd_weekly_hma_ensemble_atr_v1	train
38dd1ab	mtf_1d_rsi_macd_weekly_hma_ensemble_atr_v1	ETHUSDT	-0.607	-20.48	-5.57	-32.74	34.3	1.22	143	-0.703	-0.1701	discard	exp#432 mtf_1d_rsi_macd_weekly_hma_ensemble_atr_v1	train
38dd1ab	mtf_1d_rsi_macd_weekly_hma_ensemble_atr_v1	SOLUSDT	0.9429	174.56	28.84	-22.5	36.7	3.23	128	1.3254	1.2815	keep	exp#432 mtf_1d_rsi_macd_weekly_hma_ensemble_atr_v1	train
38dd1ab	mtf_1d_rsi_macd_weekly_hma_ensemble_atr_v1	SOLUSDT	0.2507	9.73	7.94	-15.8	54.3	1.77	46	0.2542	0.5024	keep	exp#432 mtf_1d_rsi_macd_weekly_hma_ensemble_atr_v1	test
ada116d	mtf_15m_mr_4h_hma_chop_zscore_atr_v1	BTCUSDT	-10.8988	-97.8	-61.52	-97.85	59.6	0.82	15780	-10.631	-0.6287	discard	exp#433 mtf_15m_mr_4h_hma_chop_zscore_atr_v1	train
