commit	strategy	symbol	sharpe	return_pct	cagr_pct	max_dd_pct	win_rate	profit_factor	trades	sortino	calmar	status	description	period
d419a33	mtf_1d_donchian_weekly_hma_rsi_atr_v1	SOLUSDT	0.6993	58.56	12.26	-4.64	71.0	6.16	31	0.7161	2.6444	keep	exp#270 mtf_1d_donchian_weekly_hma_rsi_atr_v1	train
d419a33	mtf_1d_donchian_weekly_hma_rsi_atr_v1	SOLUSDT	-2.2216	-0.74	-0.61	-3.04	33.3	0.84	6	-0.5587	-0.2006	discard	exp#270 mtf_1d_donchian_weekly_hma_rsi_atr_v1	test
d419a33	mtf_1d_donchian_weekly_hma_rsi_atr_v1	BTCUSDT	-1.8513	-3.25	-0.82	-7.35	44.4	0.83	36	-0.574	-0.1119	discard	exp#270 mtf_1d_donchian_weekly_hma_rsi_atr_v1	train
d419a33	mtf_1d_donchian_weekly_hma_rsi_atr_v1	ETHUSDT	-1.6612	-6.34	-1.62	-8.11	32.3	0.68	31	-0.5163	-0.2004	discard	exp#270 mtf_1d_donchian_weekly_hma_rsi_atr_v1	train
d419a33	mtf_1d_donchian_weekly_hma_rsi_atr_v1	SOLUSDT	0.6993	58.56	12.26	-4.64	71.0	6.16	31	0.7161	2.6444	discard	exp#270 mtf_1d_donchian_weekly_hma_rsi_atr_v1	train
9c86d6e	mtf_15m_kama_4h_hma_1h_adx_rsi_pullback_volume_atr_v1	BTCUSDT	-18.6799	-99.92	-83.24	-99.92	30.0	0.75	28137	-19.9029	-0.8331	discard	exp#271 mtf_15m_kama_4h_hma_1h_adx_rsi_pullback_volume_atr_v1	train
9c86d6e	mtf_15m_kama_4h_hma_1h_adx_rsi_pullback_volume_atr_v1	ETHUSDT	-14.0557	-99.86	-80.57	-99.86	32.4	0.85	27570	-14.5692	-0.8069	discard	exp#271 mtf_15m_kama_4h_hma_1h_adx_rsi_pullback_volume_atr_v1	train
9c86d6e	mtf_15m_kama_4h_hma_1h_adx_rsi_pullback_volume_atr_v1	SOLUSDT	-9.0486	-99.82	-79.59	-99.84	36.8	0.93	25828	-8.6227	-0.7972	discard	exp#271 mtf_15m_kama_4h_hma_1h_adx_rsi_pullback_volume_atr_v1	train
9c86d6e	mtf_15m_kama_4h_hma_1h_adx_rsi_pullback_volume_atr_v1	BTCUSDT	-18.6799	-99.92	-83.24	-99.92	30.0	0.75	28137	-19.9029	-0.8331	discard	exp#271 mtf_15m_kama_4h_hma_1h_adx_rsi_pullback_volume_atr_v1	train
9c86d6e	mtf_15m_kama_4h_hma_1h_adx_rsi_pullback_volume_atr_v1	ETHUSDT	-14.0557	-99.86	-80.57	-99.86	32.4	0.85	27570	-14.5692	-0.8069	discard	exp#271 mtf_15m_kama_4h_hma_1h_adx_rsi_pullback_volume_atr_v1	train
9c86d6e	mtf_15m_kama_4h_hma_1h_adx_rsi_pullback_volume_atr_v1	SOLUSDT	-9.0486	-99.82	-79.59	-99.84	36.8	0.93	25828	-8.6227	-0.7972	discard	exp#271 mtf_15m_kama_4h_hma_1h_adx_rsi_pullback_volume_atr_v1	train
e285f81	mtf_30m_rsi_pullback_4h_hma_volume_atr_v2	BTCUSDT	-6.8962	-49.36	-15.65	-49.63	41.4	0.72	2827	-2.6878	-0.3154	discard	exp#272 mtf_30m_rsi_pullback_4h_hma_volume_atr_v2	train
e285f81	mtf_30m_rsi_pullback_4h_hma_volume_atr_v2	ETHUSDT	-5.914	-49.14	-15.56	-49.14	41.5	0.77	2819	-2.3106	-0.3166	discard	exp#272 mtf_30m_rsi_pullback_4h_hma_volume_atr_v2	train
e285f81	mtf_30m_rsi_pullback_4h_hma_volume_atr_v2	SOLUSDT	-2.8518	-41.37	-12.54	-43.84	44.9	0.89	2650	-1.1201	-0.2861	discard	exp#272 mtf_30m_rsi_pullback_4h_hma_volume_atr_v2	train
e285f81	mtf_30m_rsi_pullback_4h_hma_volume_atr_v2	BTCUSDT	-6.8962	-49.36	-15.65	-49.63	41.4	0.72	2827	-2.6878	-0.3154	discard	exp#272 mtf_30m_rsi_pullback_4h_hma_volume_atr_v2	train
e285f81	mtf_30m_rsi_pullback_4h_hma_volume_atr_v2	ETHUSDT	-5.914	-49.14	-15.56	-49.14	41.5	0.77	2819	-2.3106	-0.3166	discard	exp#272 mtf_30m_rsi_pullback_4h_hma_volume_atr_v2	train
e285f81	mtf_30m_rsi_pullback_4h_hma_volume_atr_v2	SOLUSDT	-2.8518	-41.37	-12.54	-43.84	44.9	0.89	2650	-1.1201	-0.2861	discard	exp#272 mtf_30m_rsi_pullback_4h_hma_volume_atr_v2	train
d0c79ab	mtf_1h_supertrend_4h_hma_rsi_pullback_volume_atr_v1	BTCUSDT	-2.3978	-46.15	-14.35	-48.68	49.3	0.95	3231	-1.9651	-0.2947	discard	exp#273 mtf_1h_supertrend_4h_hma_rsi_pullback_volume_atr_v1	train
d0c79ab	mtf_1h_supertrend_4h_hma_rsi_pullback_volume_atr_v1	ETHUSDT	-1.6897	-40.55	-12.2	-45.15	49.9	1.0	3162	-1.3368	-0.2702	discard	exp#273 mtf_1h_supertrend_4h_hma_rsi_pullback_volume_atr_v1	train
d0c79ab	mtf_1h_supertrend_4h_hma_rsi_pullback_volume_atr_v1	SOLUSDT	-0.2664	-2.29	-0.58	-34.21	53.0	1.08	3001	-0.2171	-0.017	discard	exp#273 mtf_1h_supertrend_4h_hma_rsi_pullback_volume_atr_v1	train
d0c79ab	mtf_1h_supertrend_4h_hma_rsi_pullback_volume_atr_v1	BTCUSDT	-2.3978	-46.15	-14.35	-48.68	49.3	0.95	3231	-1.9651	-0.2947	discard	exp#273 mtf_1h_supertrend_4h_hma_rsi_pullback_volume_atr_v1	train
d0c79ab	mtf_1h_supertrend_4h_hma_rsi_pullback_volume_atr_v1	ETHUSDT	-1.6897	-40.55	-12.2	-45.15	49.9	1.0	3162	-1.3368	-0.2702	discard	exp#273 mtf_1h_supertrend_4h_hma_rsi_pullback_volume_atr_v1	train
d0c79ab	mtf_1h_supertrend_4h_hma_rsi_pullback_volume_atr_v1	SOLUSDT	-0.2664	-2.29	-0.58	-34.21	53.0	1.08	3001	-0.2171	-0.017	discard	exp#273 mtf_1h_supertrend_4h_hma_rsi_pullback_volume_atr_v1	train
709d628	mtf_4h_supertrend_daily_weekly_hma_chop_regime_rsi_atr_v1	BTCUSDT	-0.6241	-3.02	-0.77	-17.4	37.0	1.24	756	-0.5803	-0.044	discard	exp#274 mtf_4h_supertrend_daily_weekly_hma_chop_regime_rsi_atr_v1	train
709d628	mtf_4h_supertrend_daily_weekly_hma_chop_regime_rsi_atr_v1	ETHUSDT	0.1753	28.55	6.48	-8.99	40.3	1.48	675	0.1659	0.7212	keep	exp#274 mtf_4h_supertrend_daily_weekly_hma_chop_regime_rsi_atr_v1	train
709d628	mtf_4h_supertrend_daily_weekly_hma_chop_regime_rsi_atr_v1	ETHUSDT	-0.4444	-0.29	-0.23	-14.07	42.7	1.28	262	-0.4426	-0.0167	discard	exp#274 mtf_4h_supertrend_daily_weekly_hma_chop_regime_rsi_atr_v1	test
709d628	mtf_4h_supertrend_daily_weekly_hma_chop_regime_rsi_atr_v1	SOLUSDT	0.5614	71.1	14.43	-26.17	38.4	1.58	658	0.5618	0.5514	keep	exp#274 mtf_4h_supertrend_daily_weekly_hma_chop_regime_rsi_atr_v1	train
709d628	mtf_4h_supertrend_daily_weekly_hma_chop_regime_rsi_atr_v1	SOLUSDT	-0.0159	4.86	3.98	-13.74	44.3	1.31	264	-0.0167	0.2897	discard	exp#274 mtf_4h_supertrend_daily_weekly_hma_chop_regime_rsi_atr_v1	test
709d628	mtf_4h_supertrend_daily_weekly_hma_chop_regime_rsi_atr_v1	BTCUSDT	-0.6241	-3.02	-0.77	-17.4	37.0	1.24	756	-0.5803	-0.044	discard	exp#274 mtf_4h_supertrend_daily_weekly_hma_chop_regime_rsi_atr_v1	train
709d628	mtf_4h_supertrend_daily_weekly_hma_chop_regime_rsi_atr_v1	ETHUSDT	0.1753	28.55	6.48	-8.99	40.3	1.48	675	0.1659	0.7212	discard	exp#274 mtf_4h_supertrend_daily_weekly_hma_chop_regime_rsi_atr_v1	train
709d628	mtf_4h_supertrend_daily_weekly_hma_chop_regime_rsi_atr_v1	SOLUSDT	0.5614	71.1	14.43	-26.17	38.4	1.58	658	0.5618	0.5514	discard	exp#274 mtf_4h_supertrend_daily_weekly_hma_chop_regime_rsi_atr_v1	train
00cba0e	mtf_12h_kama_adaptive_daily_weekly_hma_rsi_atr_v1	BTCUSDT	-0.6355	-18.75	-5.06	-30.51	28.5	1.21	323	-0.8136	-0.1658	discard	exp#275 mtf_12h_kama_adaptive_daily_weekly_hma_rsi_atr_v1	train
00cba0e	mtf_12h_kama_adaptive_daily_weekly_hma_rsi_atr_v1	ETHUSDT	-0.3061	-10.05	-2.61	-24.88	29.9	1.23	311	-0.391	-0.1051	discard	exp#275 mtf_12h_kama_adaptive_daily_weekly_hma_rsi_atr_v1	train
00cba0e	mtf_12h_kama_adaptive_daily_weekly_hma_rsi_atr_v1	SOLUSDT	0.5742	101.03	19.15	-24.32	33.9	1.89	301	0.7405	0.7875	keep	exp#275 mtf_12h_kama_adaptive_daily_weekly_hma_rsi_atr_v1	train
00cba0e	mtf_12h_kama_adaptive_daily_weekly_hma_rsi_atr_v1	SOLUSDT	0.0343	4.39	3.6	-18.2	36.3	1.37	102	0.0435	0.1975	keep	exp#275 mtf_12h_kama_adaptive_daily_weekly_hma_rsi_atr_v1	test
00cba0e	mtf_12h_kama_adaptive_daily_weekly_hma_rsi_atr_v1	BTCUSDT	-0.6355	-18.75	-5.06	-30.51	28.5	1.21	323	-0.8136	-0.1658	discard	exp#275 mtf_12h_kama_adaptive_daily_weekly_hma_rsi_atr_v1	train
00cba0e	mtf_12h_kama_adaptive_daily_weekly_hma_rsi_atr_v1	ETHUSDT	-0.3061	-10.05	-2.61	-24.88	29.9	1.23	311	-0.391	-0.1051	discard	exp#275 mtf_12h_kama_adaptive_daily_weekly_hma_rsi_atr_v1	train
00cba0e	mtf_12h_kama_adaptive_daily_weekly_hma_rsi_atr_v1	SOLUSDT	0.5742	101.03	19.15	-24.32	33.9	1.89	301	0.7405	0.7875	keep	exp#275 mtf_12h_kama_adaptive_daily_weekly_hma_rsi_atr_v1	train
00cba0e	mtf_12h_kama_adaptive_daily_weekly_hma_rsi_atr_v1	SOLUSDT	0.0343	4.39	3.6	-18.2	36.3	1.37	102	0.0435	0.1975	keep	exp#275 mtf_12h_kama_adaptive_daily_weekly_hma_rsi_atr_v1	test
6c818fd	mtf_15m_trend_4h_hma_1h_rsi_atr_v1	BTCUSDT	-13.7265	-89.16	-42.64	-89.17	36.8	0.67	7184	-6.3784	-0.4782	discard	exp#277 mtf_15m_trend_4h_hma_1h_rsi_atr_v1	train
6c818fd	mtf_15m_trend_4h_hma_1h_rsi_atr_v1	ETHUSDT	-10.3146	-88.22	-41.43	-88.23	39.3	0.74	7511	-4.8444	-0.4696	discard	exp#277 mtf_15m_trend_4h_hma_1h_rsi_atr_v1	train
6c818fd	mtf_15m_trend_4h_hma_1h_rsi_atr_v1	SOLUSDT	-5.8174	-85.21	-38.11	-85.25	41.2	0.87	7103	-2.6042	-0.447	discard	exp#277 mtf_15m_trend_4h_hma_1h_rsi_atr_v1	train
6c818fd	mtf_15m_trend_4h_hma_1h_rsi_atr_v1	BTCUSDT	-13.7265	-89.16	-42.64	-89.17	36.8	0.67	7184	-6.3784	-0.4782	discard	exp#277 mtf_15m_trend_4h_hma_1h_rsi_atr_v1	train
6c818fd	mtf_15m_trend_4h_hma_1h_rsi_atr_v1	ETHUSDT	-10.3146	-88.22	-41.43	-88.23	39.3	0.74	7511	-4.8444	-0.4696	discard	exp#277 mtf_15m_trend_4h_hma_1h_rsi_atr_v1	train
6c818fd	mtf_15m_trend_4h_hma_1h_rsi_atr_v1	SOLUSDT	-5.8174	-85.21	-38.11	-85.25	41.2	0.87	7103	-2.6042	-0.447	discard	exp#277 mtf_15m_trend_4h_hma_1h_rsi_atr_v1	train
d676e50	mtf_30m_regime_crsi_chop_4h_hma_atr_v1	BTCUSDT	-7.9271	-89.5	-43.1	-89.59	48.0	0.83	9891	-6.2273	-0.4811	discard	exp#278 mtf_30m_regime_crsi_chop_4h_hma_atr_v1	train
d676e50	mtf_30m_regime_crsi_chop_4h_hma_atr_v1	ETHUSDT	-6.4696	-90.08	-43.9	-90.08	49.0	0.84	9874	-5.1342	-0.4873	discard	exp#278 mtf_30m_regime_crsi_chop_4h_hma_atr_v1	train
d676e50	mtf_30m_regime_crsi_chop_4h_hma_atr_v1	SOLUSDT	-3.3108	-85.17	-38.06	-85.49	51.4	0.94	9714	-2.5964	-0.4453	discard	exp#278 mtf_30m_regime_crsi_chop_4h_hma_atr_v1	train
d676e50	mtf_30m_regime_crsi_chop_4h_hma_atr_v1	BTCUSDT	-7.9271	-89.5	-43.1	-89.59	48.0	0.83	9891	-6.2273	-0.4811	discard	exp#278 mtf_30m_regime_crsi_chop_4h_hma_atr_v1	train
d676e50	mtf_30m_regime_crsi_chop_4h_hma_atr_v1	ETHUSDT	-6.4696	-90.08	-43.9	-90.08	49.0	0.84	9874	-5.1342	-0.4873	discard	exp#278 mtf_30m_regime_crsi_chop_4h_hma_atr_v1	train
d676e50	mtf_30m_regime_crsi_chop_4h_hma_atr_v1	SOLUSDT	-3.3108	-85.17	-38.06	-85.49	51.4	0.94	9714	-2.5964	-0.4453	discard	exp#278 mtf_30m_regime_crsi_chop_4h_hma_atr_v1	train
aa0edaf	mtf_1h_mr_4h_hma_bollinger_rsi_atr_v1	BTCUSDT	-4.2693	-26.79	-7.5	-27.05	43.9	0.66	776	-1.0909	-0.2774	discard	exp#279 mtf_1h_mr_4h_hma_bollinger_rsi_atr_v1	train
aa0edaf	mtf_1h_mr_4h_hma_bollinger_rsi_atr_v1	ETHUSDT	-3.0455	-22.05	-6.04	-22.93	43.5	0.79	752	-0.8277	-0.2635	discard	exp#279 mtf_1h_mr_4h_hma_bollinger_rsi_atr_v1	train
aa0edaf	mtf_1h_mr_4h_hma_bollinger_rsi_atr_v1	SOLUSDT	-1.9298	-19.62	-5.33	-22.53	47.7	0.84	595	-0.4462	-0.2368	discard	exp#279 mtf_1h_mr_4h_hma_bollinger_rsi_atr_v1	train
aa0edaf	mtf_1h_mr_4h_hma_bollinger_rsi_atr_v1	BTCUSDT	-4.2693	-26.79	-7.5	-27.05	43.9	0.66	776	-1.0909	-0.2774	discard	exp#279 mtf_1h_mr_4h_hma_bollinger_rsi_atr_v1	train
aa0edaf	mtf_1h_mr_4h_hma_bollinger_rsi_atr_v1	ETHUSDT	-3.0455	-22.05	-6.04	-22.93	43.5	0.79	752	-0.8277	-0.2635	discard	exp#279 mtf_1h_mr_4h_hma_bollinger_rsi_atr_v1	train
aa0edaf	mtf_1h_mr_4h_hma_bollinger_rsi_atr_v1	SOLUSDT	-1.9298	-19.62	-5.33	-22.53	47.7	0.84	595	-0.4462	-0.2368	discard	exp#279 mtf_1h_mr_4h_hma_bollinger_rsi_atr_v1	train
f70423f	mtf_4h_donchian_daily_weekly_hma_rsi_atr_v1	BTCUSDT	-2.5783	-9.23	-2.39	-10.24	33.5	0.74	167	-0.7306	-0.2337	discard	exp#280 mtf_4h_donchian_daily_weekly_hma_rsi_atr_v1	train
f70423f	mtf_4h_donchian_daily_weekly_hma_rsi_atr_v1	ETHUSDT	-1.9034	-11.93	-3.13	-16.26	37.1	0.8	210	-0.5829	-0.1924	discard	exp#280 mtf_4h_donchian_daily_weekly_hma_rsi_atr_v1	train
f70423f	mtf_4h_donchian_daily_weekly_hma_rsi_atr_v1	SOLUSDT	-1.2198	-12.66	-3.34	-16.17	45.2	0.88	259	-0.3878	-0.2065	discard	exp#280 mtf_4h_donchian_daily_weekly_hma_rsi_atr_v1	train
f70423f	mtf_4h_donchian_daily_weekly_hma_rsi_atr_v1	BTCUSDT	-2.5783	-9.23	-2.39	-10.24	33.5	0.74	167	-0.7306	-0.2337	discard	exp#280 mtf_4h_donchian_daily_weekly_hma_rsi_atr_v1	train
f70423f	mtf_4h_donchian_daily_weekly_hma_rsi_atr_v1	ETHUSDT	-1.9034	-11.93	-3.13	-16.26	37.1	0.8	210	-0.5829	-0.1924	discard	exp#280 mtf_4h_donchian_daily_weekly_hma_rsi_atr_v1	train
f70423f	mtf_4h_donchian_daily_weekly_hma_rsi_atr_v1	SOLUSDT	-1.2198	-12.66	-3.34	-16.17	45.2	0.88	259	-0.3878	-0.2065	discard	exp#280 mtf_4h_donchian_daily_weekly_hma_rsi_atr_v1	train
dc7b837	mtf_12h_donchian_daily_hma_rsi_atr_v2	BTCUSDT	-0.2045	13.93	3.31	-9.58	41.1	1.24	309	-0.1791	0.3459	discard	exp#281 mtf_12h_donchian_daily_hma_rsi_atr_v2	train
dc7b837	mtf_12h_donchian_daily_hma_rsi_atr_v2	ETHUSDT	-0.4274	2.32	0.58	-13.98	37.8	1.09	307	-0.3585	0.0412	discard	exp#281 mtf_12h_donchian_daily_hma_rsi_atr_v2	train
dc7b837	mtf_12h_donchian_daily_hma_rsi_atr_v2	SOLUSDT	0.1781	29.84	6.77	-24.19	41.2	1.26	274	0.1379	0.28	keep	exp#281 mtf_12h_donchian_daily_hma_rsi_atr_v2	train
dc7b837	mtf_12h_donchian_daily_hma_rsi_atr_v2	SOLUSDT	-0.2708	2.64	2.17	-8.05	44.2	1.12	86	-0.2083	0.2692	discard	exp#281 mtf_12h_donchian_daily_hma_rsi_atr_v2	test
dc7b837	mtf_12h_donchian_daily_hma_rsi_atr_v2	BTCUSDT	-0.2045	13.93	3.31	-9.58	41.1	1.24	309	-0.1791	0.3459	discard	exp#281 mtf_12h_donchian_daily_hma_rsi_atr_v2	train
dc7b837	mtf_12h_donchian_daily_hma_rsi_atr_v2	ETHUSDT	-0.4274	2.32	0.58	-13.98	37.8	1.09	307	-0.3585	0.0412	discard	exp#281 mtf_12h_donchian_daily_hma_rsi_atr_v2	train
dc7b837	mtf_12h_donchian_daily_hma_rsi_atr_v2	SOLUSDT	0.1781	29.84	6.77	-24.19	41.2	1.26	274	0.1379	0.28	discard	exp#281 mtf_12h_donchian_daily_hma_rsi_atr_v2	train
d8a1146	mtf_15m_crsi_chop_4h_1h_hma_mean_reversion_atr_v1	BTCUSDT	-19.8847	-99.68	-76.16	-99.68	48.4	0.73	22951	-15.6227	-0.7641	discard	exp#283 mtf_15m_crsi_chop_4h_1h_hma_mean_reversion_atr_v1	train
d8a1146	mtf_15m_crsi_chop_4h_1h_hma_mean_reversion_atr_v1	ETHUSDT	-15.8677	-99.69	-76.44	-99.69	51.5	0.72	22672	-12.2128	-0.7668	discard	exp#283 mtf_15m_crsi_chop_4h_1h_hma_mean_reversion_atr_v1	train
d8a1146	mtf_15m_crsi_chop_4h_1h_hma_mean_reversion_atr_v1	SOLUSDT	-10.5823	-99.76	-78.02	-99.76	55.5	0.8	23174	-8.5249	-0.782	discard	exp#283 mtf_15m_crsi_chop_4h_1h_hma_mean_reversion_atr_v1	train
d8a1146	mtf_15m_crsi_chop_4h_1h_hma_mean_reversion_atr_v1	BTCUSDT	-19.8847	-99.68	-76.16	-99.68	48.4	0.73	22951	-15.6227	-0.7641	discard	exp#283 mtf_15m_crsi_chop_4h_1h_hma_mean_reversion_atr_v1	train
d8a1146	mtf_15m_crsi_chop_4h_1h_hma_mean_reversion_atr_v1	ETHUSDT	-15.8677	-99.69	-76.44	-99.69	51.5	0.72	22672	-12.2128	-0.7668	discard	exp#283 mtf_15m_crsi_chop_4h_1h_hma_mean_reversion_atr_v1	train
d8a1146	mtf_15m_crsi_chop_4h_1h_hma_mean_reversion_atr_v1	SOLUSDT	-10.5823	-99.76	-78.02	-99.76	55.5	0.8	23174	-8.5249	-0.782	discard	exp#283 mtf_15m_crsi_chop_4h_1h_hma_mean_reversion_atr_v1	train
afc3b59	mtf_1h_kama_4h_hma_rsi_pullback_atr_v1	BTCUSDT	-2.5786	-69.38	-25.62	-70.39	32.9	1.1	4575	-3.2855	-0.364	discard	exp#285 mtf_1h_kama_4h_hma_rsi_pullback_atr_v1	train
afc3b59	mtf_1h_kama_4h_hma_rsi_pullback_atr_v1	ETHUSDT	-2.114	-71.29	-26.82	-71.46	33.1	1.12	4577	-2.7137	-0.3753	discard	exp#285 mtf_1h_kama_4h_hma_rsi_pullback_atr_v1	train
afc3b59	mtf_1h_kama_4h_hma_rsi_pullback_atr_v1	SOLUSDT	-0.8402	-57.53	-19.34	-61.78	35.6	1.24	4634	-1.0537	-0.3131	discard	exp#285 mtf_1h_kama_4h_hma_rsi_pullback_atr_v1	train
afc3b59	mtf_1h_kama_4h_hma_rsi_pullback_atr_v1	BTCUSDT	-2.5786	-69.38	-25.62	-70.39	32.9	1.1	4575	-3.2855	-0.364	discard	exp#285 mtf_1h_kama_4h_hma_rsi_pullback_atr_v1	train
afc3b59	mtf_1h_kama_4h_hma_rsi_pullback_atr_v1	ETHUSDT	-2.114	-71.29	-26.82	-71.46	33.1	1.12	4577	-2.7137	-0.3753	discard	exp#285 mtf_1h_kama_4h_hma_rsi_pullback_atr_v1	train
afc3b59	mtf_1h_kama_4h_hma_rsi_pullback_atr_v1	SOLUSDT	-0.8402	-57.53	-19.34	-61.78	35.6	1.24	4634	-1.0537	-0.3131	discard	exp#285 mtf_1h_kama_4h_hma_rsi_pullback_atr_v1	train
d713cf9	mtf_4h_hma_daily_regime_donchian_rsi_atr_v1	BTCUSDT	-2.1213	-5.53	-1.41	-9.42	43.0	0.98	328	-0.8962	-0.15	discard	exp#286 mtf_4h_hma_daily_regime_donchian_rsi_atr_v1	train
d713cf9	mtf_4h_hma_daily_regime_donchian_rsi_atr_v1	ETHUSDT	-1.321	-0.56	-0.14	-5.47	45.2	1.1	341	-0.6038	-0.0258	discard	exp#286 mtf_4h_hma_daily_regime_donchian_rsi_atr_v1	train
d713cf9	mtf_4h_hma_daily_regime_donchian_rsi_atr_v1	SOLUSDT	-0.5701	5.65	1.39	-8.25	47.4	1.17	285	-0.2236	0.1684	discard	exp#286 mtf_4h_hma_daily_regime_donchian_rsi_atr_v1	train
d713cf9	mtf_4h_hma_daily_regime_donchian_rsi_atr_v1	BTCUSDT	-2.1213	-5.53	-1.41	-9.42	43.0	0.98	328	-0.8962	-0.15	discard	exp#286 mtf_4h_hma_daily_regime_donchian_rsi_atr_v1	train
d713cf9	mtf_4h_hma_daily_regime_donchian_rsi_atr_v1	ETHUSDT	-1.321	-0.56	-0.14	-5.47	45.2	1.1	341	-0.6038	-0.0258	discard	exp#286 mtf_4h_hma_daily_regime_donchian_rsi_atr_v1	train
d713cf9	mtf_4h_hma_daily_regime_donchian_rsi_atr_v1	SOLUSDT	-0.5701	5.65	1.39	-8.25	47.4	1.17	285	-0.2236	0.1684	discard	exp#286 mtf_4h_hma_daily_regime_donchian_rsi_atr_v1	train
f91ef0a	mtf_12h_donchian_daily_weekly_hma_rsi_atr_v3	BTCUSDT	0.1641	28.27	6.43	-15.65	49.2	1.24	514	0.1807	0.4106	keep	exp#287 mtf_12h_donchian_daily_weekly_hma_rsi_atr_v3	train
f91ef0a	mtf_12h_donchian_daily_weekly_hma_rsi_atr_v3	BTCUSDT	-0.7516	-1.32	-1.09	-11.23	43.5	1.11	138	-0.8632	-0.0967	discard	exp#287 mtf_12h_donchian_daily_weekly_hma_rsi_atr_v3	test
f91ef0a	mtf_12h_donchian_daily_weekly_hma_rsi_atr_v3	ETHUSDT	-0.4971	-9.03	-2.34	-29.94	46.2	1.02	530	-0.5351	-0.0781	discard	exp#287 mtf_12h_donchian_daily_weekly_hma_rsi_atr_v3	train
f91ef0a	mtf_12h_donchian_daily_weekly_hma_rsi_atr_v3	SOLUSDT	0.3859	54.97	11.62	-28.77	52.1	1.21	518	0.3776	0.4039	keep	exp#287 mtf_12h_donchian_daily_weekly_hma_rsi_atr_v3	train
f91ef0a	mtf_12h_donchian_daily_weekly_hma_rsi_atr_v3	SOLUSDT	0.516	14.97	12.16	-8.54	50.7	1.27	152	0.601	1.4233	keep	exp#287 mtf_12h_donchian_daily_weekly_hma_rsi_atr_v3	test
f91ef0a	mtf_12h_donchian_daily_weekly_hma_rsi_atr_v3	BTCUSDT	0.1641	28.27	6.43	-15.65	49.2	1.24	514	0.1807	0.4106	keep	exp#287 mtf_12h_donchian_daily_weekly_hma_rsi_atr_v3	train
f91ef0a	mtf_12h_donchian_daily_weekly_hma_rsi_atr_v3	ETHUSDT	-0.4971	-9.03	-2.34	-29.94	46.2	1.02	530	-0.5351	-0.0781	discard	exp#287 mtf_12h_donchian_daily_weekly_hma_rsi_atr_v3	train
f91ef0a	mtf_12h_donchian_daily_weekly_hma_rsi_atr_v3	SOLUSDT	0.3859	54.97	11.62	-28.77	52.1	1.21	518	0.3776	0.4039	keep	exp#287 mtf_12h_donchian_daily_weekly_hma_rsi_atr_v3	train
f91ef0a	mtf_12h_donchian_daily_weekly_hma_rsi_atr_v3	BTCUSDT	-0.7516	-1.32	-1.09	-11.23	43.5	1.11	138	-0.8632	-0.0967	discard	exp#287 mtf_12h_donchian_daily_weekly_hma_rsi_atr_v3	test
f91ef0a	mtf_12h_donchian_daily_weekly_hma_rsi_atr_v3	SOLUSDT	0.516	14.97	12.16	-8.54	50.7	1.27	152	0.601	1.4233	keep	exp#287 mtf_12h_donchian_daily_weekly_hma_rsi_atr_v3	test
0571f15	mtf_15m_crsi_4h_hma_mean_reversion_atr_v1	BTCUSDT	-14.0782	-95.38	-53.67	-95.56	50.3	0.8	12252	-8.4443	-0.5617	discard	exp#289 mtf_15m_crsi_4h_hma_mean_reversion_atr_v1	train
0571f15	mtf_15m_crsi_4h_hma_mean_reversion_atr_v1	ETHUSDT	-11.9579	-96.45	-56.62	-96.45	53.2	0.76	12079	-6.8989	-0.587	discard	exp#289 mtf_15m_crsi_4h_hma_mean_reversion_atr_v1	train
0571f15	mtf_15m_crsi_4h_hma_mean_reversion_atr_v1	SOLUSDT	-6.5275	-94.23	-51.13	-94.48	59.3	0.85	11587	-3.8506	-0.5411	discard	exp#289 mtf_15m_crsi_4h_hma_mean_reversion_atr_v1	train
0571f15	mtf_15m_crsi_4h_hma_mean_reversion_atr_v1	BTCUSDT	-14.0782	-95.38	-53.67	-95.56	50.3	0.8	12252	-8.4443	-0.5617	discard	exp#289 mtf_15m_crsi_4h_hma_mean_reversion_atr_v1	train
0571f15	mtf_15m_crsi_4h_hma_mean_reversion_atr_v1	ETHUSDT	-11.9579	-96.45	-56.62	-96.45	53.2	0.76	12079	-6.8989	-0.587	discard	exp#289 mtf_15m_crsi_4h_hma_mean_reversion_atr_v1	train
0571f15	mtf_15m_crsi_4h_hma_mean_reversion_atr_v1	SOLUSDT	-6.5275	-94.23	-51.13	-94.48	59.3	0.85	11587	-3.8506	-0.5411	discard	exp#289 mtf_15m_crsi_4h_hma_mean_reversion_atr_v1	train
bf13217	mtf_30m_supertrend_4h_hma_rsi_atr_v1	BTCUSDT	-2.3853	-64.01	-22.56	-66.26	25.6	1.18	4009	-2.3112	-0.3404	discard	exp#290 mtf_30m_supertrend_4h_hma_rsi_atr_v1	train
bf13217	mtf_30m_supertrend_4h_hma_rsi_atr_v1	ETHUSDT	-1.3074	-48.99	-15.5	-49.94	27.6	1.29	4080	-1.2392	-0.3103	discard	exp#290 mtf_30m_supertrend_4h_hma_rsi_atr_v1	train
bf13217	mtf_30m_supertrend_4h_hma_rsi_atr_v1	SOLUSDT	-0.6885	-43.26	-13.26	-62.94	28.2	1.33	4121	-0.633	-0.2107	discard	exp#290 mtf_30m_supertrend_4h_hma_rsi_atr_v1	train
bf13217	mtf_30m_supertrend_4h_hma_rsi_atr_v1	BTCUSDT	-2.3853	-64.01	-22.56	-66.26	25.6	1.18	4009	-2.3112	-0.3404	discard	exp#290 mtf_30m_supertrend_4h_hma_rsi_atr_v1	train
bf13217	mtf_30m_supertrend_4h_hma_rsi_atr_v1	ETHUSDT	-1.3074	-48.99	-15.5	-49.94	27.6	1.29	4080	-1.2392	-0.3103	discard	exp#290 mtf_30m_supertrend_4h_hma_rsi_atr_v1	train
bf13217	mtf_30m_supertrend_4h_hma_rsi_atr_v1	SOLUSDT	-0.6885	-43.26	-13.26	-62.94	28.2	1.33	4121	-0.633	-0.2107	discard	exp#290 mtf_30m_supertrend_4h_hma_rsi_atr_v1	train
4e0a994	mtf_1h_supertrend_4h_hma_rsi_volume_atr_v1	BTCUSDT	-0.7583	-18.65	-5.03	-30.99	26.6	1.45	2092	-0.7755	-0.1624	discard	exp#291 mtf_1h_supertrend_4h_hma_rsi_volume_atr_v1	train
4e0a994	mtf_1h_supertrend_4h_hma_rsi_volume_atr_v1	ETHUSDT	-0.3627	-6.79	-1.74	-28.13	26.9	1.49	2132	-0.3711	-0.062	discard	exp#291 mtf_1h_supertrend_4h_hma_rsi_volume_atr_v1	train
4e0a994	mtf_1h_supertrend_4h_hma_rsi_volume_atr_v1	SOLUSDT	0.5625	87.35	17.07	-23.95	30.2	1.6	1986	0.5791	0.7128	keep	exp#291 mtf_1h_supertrend_4h_hma_rsi_volume_atr_v1	train
4e0a994	mtf_1h_supertrend_4h_hma_rsi_volume_atr_v1	SOLUSDT	-0.9085	-13.26	-11.04	-28.66	28.7	1.3	637	-0.8825	-0.3854	discard	exp#291 mtf_1h_supertrend_4h_hma_rsi_volume_atr_v1	test
4e0a994	mtf_1h_supertrend_4h_hma_rsi_volume_atr_v1	BTCUSDT	-0.7583	-18.65	-5.03	-30.99	26.6	1.45	2092	-0.7755	-0.1624	discard	exp#291 mtf_1h_supertrend_4h_hma_rsi_volume_atr_v1	train
4e0a994	mtf_1h_supertrend_4h_hma_rsi_volume_atr_v1	ETHUSDT	-0.3627	-6.79	-1.74	-28.13	26.9	1.49	2132	-0.3711	-0.062	discard	exp#291 mtf_1h_supertrend_4h_hma_rsi_volume_atr_v1	train
4e0a994	mtf_1h_supertrend_4h_hma_rsi_volume_atr_v1	SOLUSDT	0.5625	87.35	17.07	-23.95	30.2	1.6	1986	0.5791	0.7128	discard	exp#291 mtf_1h_supertrend_4h_hma_rsi_volume_atr_v1	train
dddda5a	mtf_4h_kama_daily_hma_chop_donchian_volume_atr_v1	BTCUSDT	-0.7058	-19.35	-5.24	-30.29	27.6	1.25	913	-0.8783	-0.1729	discard	exp#292 mtf_4h_kama_daily_hma_chop_donchian_volume_atr_v1	train
dddda5a	mtf_4h_kama_daily_hma_chop_donchian_volume_atr_v1	ETHUSDT	-0.669	-26.81	-7.51	-33.21	27.7	1.21	959	-0.8326	-0.2261	discard	exp#292 mtf_4h_kama_daily_hma_chop_donchian_volume_atr_v1	train
