commit	strategy	symbol	sharpe	return_pct	cagr_pct	max_dd_pct	win_rate	profit_factor	trades	sortino	calmar	status	description	period
f59d56d	mtf_15m_4h_hma_1h_rsi_vol_pullback_atr_v1	ETHUSDT	-5.4755	-96.52	-56.82	-96.55	32.3	1.05	13684	-6.0502	-0.5885	discard	exp#451 mtf_15m_4h_hma_1h_rsi_vol_pullback_atr_v1	train
f59d56d	mtf_15m_4h_hma_1h_rsi_vol_pullback_atr_v1	SOLUSDT	-2.7278	-93.53	-49.71	-95.57	34.9	1.2	13796	-3.0062	-0.5201	discard	exp#451 mtf_15m_4h_hma_1h_rsi_vol_pullback_atr_v1	train
f59d56d	mtf_15m_4h_hma_1h_rsi_vol_pullback_atr_v1	BTCUSDT	-7.3586	-97.22	-59.21	-97.32	30.5	0.98	13868	-8.2305	-0.6083	discard	exp#451 mtf_15m_4h_hma_1h_rsi_vol_pullback_atr_v1	train
f59d56d	mtf_15m_4h_hma_1h_rsi_vol_pullback_atr_v1	ETHUSDT	-5.4755	-96.52	-56.82	-96.55	32.3	1.05	13684	-6.0502	-0.5885	discard	exp#451 mtf_15m_4h_hma_1h_rsi_vol_pullback_atr_v1	train
f59d56d	mtf_15m_4h_hma_1h_rsi_vol_pullback_atr_v1	SOLUSDT	-2.7278	-93.53	-49.71	-95.57	34.9	1.2	13796	-3.0062	-0.5201	discard	exp#451 mtf_15m_4h_hma_1h_rsi_vol_pullback_atr_v1	train
aebd815	mtf_30m_supertrend_4h_hma_rsi_pullback_atr_v1	BTCUSDT	0.0	0.0	0.0	0.0	0.0	0.0	0	0.0	0.0	discard	exp#452 mtf_30m_supertrend_4h_hma_rsi_pullback_atr_v1	train
aebd815	mtf_30m_supertrend_4h_hma_rsi_pullback_atr_v1	ETHUSDT	0.0	0.0	0.0	0.0	0.0	0.0	0	0.0	0.0	discard	exp#452 mtf_30m_supertrend_4h_hma_rsi_pullback_atr_v1	train
aebd815	mtf_30m_supertrend_4h_hma_rsi_pullback_atr_v1	SOLUSDT	0.0	0.0	0.0	0.0	0.0	0.0	0	0.0	0.0	discard	exp#452 mtf_30m_supertrend_4h_hma_rsi_pullback_atr_v1	train
aebd815	mtf_30m_supertrend_4h_hma_rsi_pullback_atr_v1	BTCUSDT	0.0	0.0	0.0	0.0	0.0	0.0	0	0.0	0.0	discard	exp#452 mtf_30m_supertrend_4h_hma_rsi_pullback_atr_v1	train
aebd815	mtf_30m_supertrend_4h_hma_rsi_pullback_atr_v1	ETHUSDT	0.0	0.0	0.0	0.0	0.0	0.0	0	0.0	0.0	discard	exp#452 mtf_30m_supertrend_4h_hma_rsi_pullback_atr_v1	train
aebd815	mtf_30m_supertrend_4h_hma_rsi_pullback_atr_v1	SOLUSDT	0.0	0.0	0.0	0.0	0.0	0.0	0	0.0	0.0	discard	exp#452 mtf_30m_supertrend_4h_hma_rsi_pullback_atr_v1	train
3d5d90e	mtf_1h_kama_4h_hma_volume_rsi_atr_v1	BTCUSDT	-2.8583	-71.47	-26.93	-72.04	42.0	0.93	5593	-3.3475	-0.3738	discard	exp#453 mtf_1h_kama_4h_hma_volume_rsi_atr_v1	train
3d5d90e	mtf_1h_kama_4h_hma_volume_rsi_atr_v1	ETHUSDT	-2.5494	-75.49	-29.66	-76.73	43.5	0.95	5725	-2.9682	-0.3865	discard	exp#453 mtf_1h_kama_4h_hma_volume_rsi_atr_v1	train
3d5d90e	mtf_1h_kama_4h_hma_volume_rsi_atr_v1	SOLUSDT	-1.0141	-62.14	-21.64	-65.86	45.1	1.0	5820	-1.1642	-0.3285	discard	exp#453 mtf_1h_kama_4h_hma_volume_rsi_atr_v1	train
3d5d90e	mtf_1h_kama_4h_hma_volume_rsi_atr_v1	BTCUSDT	-2.8583	-71.47	-26.93	-72.04	42.0	0.93	5593	-3.3475	-0.3738	discard	exp#453 mtf_1h_kama_4h_hma_volume_rsi_atr_v1	train
3d5d90e	mtf_1h_kama_4h_hma_volume_rsi_atr_v1	ETHUSDT	-2.5494	-75.49	-29.66	-76.73	43.5	0.95	5725	-2.9682	-0.3865	discard	exp#453 mtf_1h_kama_4h_hma_volume_rsi_atr_v1	train
3d5d90e	mtf_1h_kama_4h_hma_volume_rsi_atr_v1	SOLUSDT	-1.0141	-62.14	-21.64	-65.86	45.1	1.0	5820	-1.1642	-0.3285	discard	exp#453 mtf_1h_kama_4h_hma_volume_rsi_atr_v1	train
023a357	mtf_4h_fisher_daily_hma_trend_atr_v1	BTCUSDT	-2.8721	-39.34	-11.75	-39.67	37.0	0.68	782	-1.5379	-0.2963	discard	exp#454 mtf_4h_fisher_daily_hma_trend_atr_v1	train
023a357	mtf_4h_fisher_daily_hma_trend_atr_v1	ETHUSDT	-2.0106	-30.77	-8.79	-31.19	39.8	0.83	756	-1.1513	-0.2818	discard	exp#454 mtf_4h_fisher_daily_hma_trend_atr_v1	train
023a357	mtf_4h_fisher_daily_hma_trend_atr_v1	SOLUSDT	-0.6968	-15.25	-4.07	-20.36	42.9	0.99	764	-0.4523	-0.1999	discard	exp#454 mtf_4h_fisher_daily_hma_trend_atr_v1	train
023a357	mtf_4h_fisher_daily_hma_trend_atr_v1	BTCUSDT	-2.8721	-39.34	-11.75	-39.67	37.0	0.68	782	-1.5379	-0.2963	discard	exp#454 mtf_4h_fisher_daily_hma_trend_atr_v1	train
023a357	mtf_4h_fisher_daily_hma_trend_atr_v1	ETHUSDT	-2.0106	-30.77	-8.79	-31.19	39.8	0.83	756	-1.1513	-0.2818	discard	exp#454 mtf_4h_fisher_daily_hma_trend_atr_v1	train
023a357	mtf_4h_fisher_daily_hma_trend_atr_v1	SOLUSDT	-0.6968	-15.25	-4.07	-20.36	42.9	0.99	764	-0.4523	-0.1999	discard	exp#454 mtf_4h_fisher_daily_hma_trend_atr_v1	train
71a323e	mtf_12h_supertrend_daily_hma_rsi_adx_atr_v1	BTCUSDT	0.0	0.0	0.0	0.0	0.0	0.0	0	0.0	0.0	discard	exp#455 mtf_12h_supertrend_daily_hma_rsi_adx_atr_v1	train
71a323e	mtf_12h_supertrend_daily_hma_rsi_adx_atr_v1	ETHUSDT	0.0	0.0	0.0	0.0	0.0	0.0	0	0.0	0.0	discard	exp#455 mtf_12h_supertrend_daily_hma_rsi_adx_atr_v1	train
71a323e	mtf_12h_supertrend_daily_hma_rsi_adx_atr_v1	SOLUSDT	0.0	0.0	0.0	0.0	0.0	0.0	0	0.0	0.0	discard	exp#455 mtf_12h_supertrend_daily_hma_rsi_adx_atr_v1	train
71a323e	mtf_12h_supertrend_daily_hma_rsi_adx_atr_v1	BTCUSDT	0.0	0.0	0.0	0.0	0.0	0.0	0	0.0	0.0	discard	exp#455 mtf_12h_supertrend_daily_hma_rsi_adx_atr_v1	train
71a323e	mtf_12h_supertrend_daily_hma_rsi_adx_atr_v1	ETHUSDT	0.0	0.0	0.0	0.0	0.0	0.0	0	0.0	0.0	discard	exp#455 mtf_12h_supertrend_daily_hma_rsi_adx_atr_v1	train
71a323e	mtf_12h_supertrend_daily_hma_rsi_adx_atr_v1	SOLUSDT	0.0	0.0	0.0	0.0	0.0	0.0	0	0.0	0.0	discard	exp#455 mtf_12h_supertrend_daily_hma_rsi_adx_atr_v1	train
1ece022	mtf_1d_donchian_weekly_hma_rsi_atr_v1	BTCUSDT	-0.1585	14.52	3.45	-11.86	45.4	1.37	141	-0.1196	0.2909	discard	exp#456 mtf_1d_donchian_weekly_hma_rsi_atr_v1	train
1ece022	mtf_1d_donchian_weekly_hma_rsi_atr_v1	ETHUSDT	-0.5644	-3.09	-0.78	-19.59	40.1	1.02	142	-0.4059	-0.0399	discard	exp#456 mtf_1d_donchian_weekly_hma_rsi_atr_v1	train
1ece022	mtf_1d_donchian_weekly_hma_rsi_atr_v1	SOLUSDT	0.6988	84.85	16.66	-13.83	54.0	1.77	150	0.6243	1.2045	keep	exp#456 mtf_1d_donchian_weekly_hma_rsi_atr_v1	train
1ece022	mtf_1d_donchian_weekly_hma_rsi_atr_v1	SOLUSDT	-1.185	-12.08	-10.05	-17.48	42.4	0.76	66	-0.9369	-0.5747	discard	exp#456 mtf_1d_donchian_weekly_hma_rsi_atr_v1	test
1ece022	mtf_1d_donchian_weekly_hma_rsi_atr_v1	BTCUSDT	-0.1585	14.52	3.45	-11.86	45.4	1.37	141	-0.1196	0.2909	discard	exp#456 mtf_1d_donchian_weekly_hma_rsi_atr_v1	train
1ece022	mtf_1d_donchian_weekly_hma_rsi_atr_v1	ETHUSDT	-0.5644	-3.09	-0.78	-19.59	40.1	1.02	142	-0.4059	-0.0399	discard	exp#456 mtf_1d_donchian_weekly_hma_rsi_atr_v1	train
1ece022	mtf_1d_donchian_weekly_hma_rsi_atr_v1	SOLUSDT	0.6988	84.85	16.66	-13.83	54.0	1.77	150	0.6243	1.2045	discard	exp#456 mtf_1d_donchian_weekly_hma_rsi_atr_v1	train
4069e4a	mtf_30m_hma_4h_bias_rsi7_macd_momentum_atr_v1	BTCUSDT	-3.8452	-82.03	-34.91	-82.51	31.6	1.05	6130	-3.9923	-0.4231	discard	exp#458 mtf_30m_hma_4h_bias_rsi7_macd_momentum_atr_v1	train
4069e4a	mtf_30m_hma_4h_bias_rsi7_macd_momentum_atr_v1	ETHUSDT	-2.8359	-79.22	-32.5	-79.34	33.3	1.1	6143	-2.9993	-0.4096	discard	exp#458 mtf_30m_hma_4h_bias_rsi7_macd_momentum_atr_v1	train
4069e4a	mtf_30m_hma_4h_bias_rsi7_macd_momentum_atr_v1	SOLUSDT	-1.4656	-73.81	-28.56	-78.86	35.3	1.22	5987	-1.5645	-0.3622	discard	exp#458 mtf_30m_hma_4h_bias_rsi7_macd_momentum_atr_v1	train
4069e4a	mtf_30m_hma_4h_bias_rsi7_macd_momentum_atr_v1	BTCUSDT	-3.8452	-82.03	-34.91	-82.51	31.6	1.05	6130	-3.9923	-0.4231	discard	exp#458 mtf_30m_hma_4h_bias_rsi7_macd_momentum_atr_v1	train
4069e4a	mtf_30m_hma_4h_bias_rsi7_macd_momentum_atr_v1	ETHUSDT	-2.8359	-79.22	-32.5	-79.34	33.3	1.1	6143	-2.9993	-0.4096	discard	exp#458 mtf_30m_hma_4h_bias_rsi7_macd_momentum_atr_v1	train
4069e4a	mtf_30m_hma_4h_bias_rsi7_macd_momentum_atr_v1	SOLUSDT	-1.4656	-73.81	-28.56	-78.86	35.3	1.22	5987	-1.5645	-0.3622	discard	exp#458 mtf_30m_hma_4h_bias_rsi7_macd_momentum_atr_v1	train
fe8c77d	mtf_1h_fisher_4h_hma_trend_reversal_atr_v1	BTCUSDT	-3.5869	-67.9	-24.75	-68.01	45.5	0.89	4380	-3.2719	-0.3639	discard	exp#459 mtf_1h_fisher_4h_hma_trend_reversal_atr_v1	train
fe8c77d	mtf_1h_fisher_4h_hma_trend_reversal_atr_v1	ETHUSDT	-3.066	-71.54	-26.98	-72.6	45.9	0.9	4421	-2.8106	-0.3716	discard	exp#459 mtf_1h_fisher_4h_hma_trend_reversal_atr_v1	train
fe8c77d	mtf_1h_fisher_4h_hma_trend_reversal_atr_v1	SOLUSDT	-0.4233	-17.07	-4.59	-48.94	49.9	1.06	4708	-0.3986	-0.0938	discard	exp#459 mtf_1h_fisher_4h_hma_trend_reversal_atr_v1	train
fe8c77d	mtf_1h_fisher_4h_hma_trend_reversal_atr_v1	BTCUSDT	-3.5869	-67.9	-24.75	-68.01	45.5	0.89	4380	-3.2719	-0.3639	discard	exp#459 mtf_1h_fisher_4h_hma_trend_reversal_atr_v1	train
fe8c77d	mtf_1h_fisher_4h_hma_trend_reversal_atr_v1	ETHUSDT	-3.066	-71.54	-26.98	-72.6	45.9	0.9	4421	-2.8106	-0.3716	discard	exp#459 mtf_1h_fisher_4h_hma_trend_reversal_atr_v1	train
fe8c77d	mtf_1h_fisher_4h_hma_trend_reversal_atr_v1	SOLUSDT	-0.4233	-17.07	-4.59	-48.94	49.9	1.06	4708	-0.3986	-0.0938	discard	exp#459 mtf_1h_fisher_4h_hma_trend_reversal_atr_v1	train
7f375fd	mtf_4h_regime_adaptive_daily_hma_chop_rsi_atr_v1	BTCUSDT	-2.0995	-65.79	-23.54	-65.82	33.3	0.82	1779	-2.5483	-0.3576	discard	exp#460 mtf_4h_regime_adaptive_daily_hma_chop_rsi_atr_v1	train
7f375fd	mtf_4h_regime_adaptive_daily_hma_chop_rsi_atr_v1	ETHUSDT	-1.0461	-47.88	-15.04	-53.73	34.4	0.95	1717	-1.2713	-0.28	discard	exp#460 mtf_4h_regime_adaptive_daily_hma_chop_rsi_atr_v1	train
7f375fd	mtf_4h_regime_adaptive_daily_hma_chop_rsi_atr_v1	SOLUSDT	-0.1848	-17.15	-4.61	-53.02	37.6	1.09	1644	-0.2252	-0.087	discard	exp#460 mtf_4h_regime_adaptive_daily_hma_chop_rsi_atr_v1	train
7f375fd	mtf_4h_regime_adaptive_daily_hma_chop_rsi_atr_v1	BTCUSDT	-2.0995	-65.79	-23.54	-65.82	33.3	0.82	1779	-2.5483	-0.3576	discard	exp#460 mtf_4h_regime_adaptive_daily_hma_chop_rsi_atr_v1	train
7f375fd	mtf_4h_regime_adaptive_daily_hma_chop_rsi_atr_v1	ETHUSDT	-1.0461	-47.88	-15.04	-53.73	34.4	0.95	1717	-1.2713	-0.28	discard	exp#460 mtf_4h_regime_adaptive_daily_hma_chop_rsi_atr_v1	train
7f375fd	mtf_4h_regime_adaptive_daily_hma_chop_rsi_atr_v1	SOLUSDT	-0.1848	-17.15	-4.61	-53.02	37.6	1.09	1644	-0.2252	-0.087	discard	exp#460 mtf_4h_regime_adaptive_daily_hma_chop_rsi_atr_v1	train
9ff6cfb	mtf_12h_donchian_daily_hma_chop_atr_v1	BTCUSDT	-1.5553	-4.64	-1.18	-11.26	37.1	0.96	221	-0.9143	-0.105	discard	exp#461 mtf_12h_donchian_daily_hma_chop_atr_v1	train
9ff6cfb	mtf_12h_donchian_daily_hma_chop_atr_v1	ETHUSDT	-0.6082	7.09	1.73	-4.87	39.0	1.24	187	-0.376	0.3551	discard	exp#461 mtf_12h_donchian_daily_hma_chop_atr_v1	train
9ff6cfb	mtf_12h_donchian_daily_hma_chop_atr_v1	SOLUSDT	-0.5118	2.8	0.7	-12.39	43.3	1.11	141	-0.2133	0.0561	discard	exp#461 mtf_12h_donchian_daily_hma_chop_atr_v1	train
9ff6cfb	mtf_12h_donchian_daily_hma_chop_atr_v1	BTCUSDT	-1.5553	-4.64	-1.18	-11.26	37.1	0.96	221	-0.9143	-0.105	discard	exp#461 mtf_12h_donchian_daily_hma_chop_atr_v1	train
9ff6cfb	mtf_12h_donchian_daily_hma_chop_atr_v1	ETHUSDT	-0.6082	7.09	1.73	-4.87	39.0	1.24	187	-0.376	0.3551	discard	exp#461 mtf_12h_donchian_daily_hma_chop_atr_v1	train
9ff6cfb	mtf_12h_donchian_daily_hma_chop_atr_v1	SOLUSDT	-0.5118	2.8	0.7	-12.39	43.3	1.11	141	-0.2133	0.0561	discard	exp#461 mtf_12h_donchian_daily_hma_chop_atr_v1	train
f8359e3	mtf_1d_chop_regime_weekly_bias_rsi_atr_v1	BTCUSDT	-0.0295	16.57	3.91	-20.39	34.2	1.46	149	-0.0332	0.1916	discard	exp#462 mtf_1d_chop_regime_weekly_bias_rsi_atr_v1	train
f8359e3	mtf_1d_chop_regime_weekly_bias_rsi_atr_v1	ETHUSDT	-0.6542	-21.23	-5.79	-30.46	29.1	0.95	151	-0.736	-0.1901	discard	exp#462 mtf_1d_chop_regime_weekly_bias_rsi_atr_v1	train
f8359e3	mtf_1d_chop_regime_weekly_bias_rsi_atr_v1	SOLUSDT	1.5136	376.99	47.98	-17.43	47.1	3.15	119	1.9317	2.7532	keep	exp#462 mtf_1d_chop_regime_weekly_bias_rsi_atr_v1	train
f8359e3	mtf_1d_chop_regime_weekly_bias_rsi_atr_v1	SOLUSDT	-0.2316	-1.51	-1.25	-17.08	33.3	1.16	30	-0.284	-0.0729	discard	exp#462 mtf_1d_chop_regime_weekly_bias_rsi_atr_v1	test
f8359e3	mtf_1d_chop_regime_weekly_bias_rsi_atr_v1	BTCUSDT	-0.0295	16.57	3.91	-20.39	34.2	1.46	149	-0.0332	0.1916	discard	exp#462 mtf_1d_chop_regime_weekly_bias_rsi_atr_v1	train
f8359e3	mtf_1d_chop_regime_weekly_bias_rsi_atr_v1	ETHUSDT	-0.6542	-21.23	-5.79	-30.46	29.1	0.95	151	-0.736	-0.1901	discard	exp#462 mtf_1d_chop_regime_weekly_bias_rsi_atr_v1	train
f8359e3	mtf_1d_chop_regime_weekly_bias_rsi_atr_v1	SOLUSDT	1.5136	376.99	47.98	-17.43	47.1	3.15	119	1.9317	2.7532	discard	exp#462 mtf_1d_chop_regime_weekly_bias_rsi_atr_v1	train
dfb4c1e	mtf_15m_kama_4h_hma_1h_rsi_atr_v1	BTCUSDT	-6.7055	-94.52	-51.63	-94.95	31.7	0.9	11987	-7.5874	-0.5438	discard	exp#463 mtf_15m_kama_4h_hma_1h_rsi_atr_v1	train
dfb4c1e	mtf_15m_kama_4h_hma_1h_rsi_atr_v1	ETHUSDT	-4.8054	-92.56	-47.8	-92.78	33.8	0.93	11694	-5.3495	-0.5151	discard	exp#463 mtf_15m_kama_4h_hma_1h_rsi_atr_v1	train
dfb4c1e	mtf_15m_kama_4h_hma_1h_rsi_atr_v1	SOLUSDT	-2.1099	-84.54	-37.42	-86.57	36.2	0.99	11564	-2.3481	-0.4323	discard	exp#463 mtf_15m_kama_4h_hma_1h_rsi_atr_v1	train
dfb4c1e	mtf_15m_kama_4h_hma_1h_rsi_atr_v1	BTCUSDT	-6.7055	-94.52	-51.63	-94.95	31.7	0.9	11987	-7.5874	-0.5438	discard	exp#463 mtf_15m_kama_4h_hma_1h_rsi_atr_v1	train
dfb4c1e	mtf_15m_kama_4h_hma_1h_rsi_atr_v1	ETHUSDT	-4.8054	-92.56	-47.8	-92.78	33.8	0.93	11694	-5.3495	-0.5151	discard	exp#463 mtf_15m_kama_4h_hma_1h_rsi_atr_v1	train
dfb4c1e	mtf_15m_kama_4h_hma_1h_rsi_atr_v1	SOLUSDT	-2.1099	-84.54	-37.42	-86.57	36.2	0.99	11564	-2.3481	-0.4323	discard	exp#463 mtf_15m_kama_4h_hma_1h_rsi_atr_v1	train
68c24a7	mtf_30m_hma_4h_bias_rsi7_volume_atr_v1	BTCUSDT	-8.2689	-97.44	-60.01	-97.46	37.4	0.83	13919	-8.6915	-0.6158	discard	exp#464 mtf_30m_hma_4h_bias_rsi7_volume_atr_v1	train
68c24a7	mtf_30m_hma_4h_bias_rsi7_volume_atr_v1	ETHUSDT	-6.5771	-97.37	-59.75	-97.39	38.5	0.84	14216	-7.0496	-0.6135	discard	exp#464 mtf_30m_hma_4h_bias_rsi7_volume_atr_v1	train
68c24a7	mtf_30m_hma_4h_bias_rsi7_volume_atr_v1	SOLUSDT	-3.8779	-96.83	-57.96	-97.16	41.4	0.95	13884	-4.1501	-0.5966	discard	exp#464 mtf_30m_hma_4h_bias_rsi7_volume_atr_v1	train
68c24a7	mtf_30m_hma_4h_bias_rsi7_volume_atr_v1	BTCUSDT	-8.2689	-97.44	-60.01	-97.46	37.4	0.83	13919	-8.6915	-0.6158	discard	exp#464 mtf_30m_hma_4h_bias_rsi7_volume_atr_v1	train
68c24a7	mtf_30m_hma_4h_bias_rsi7_volume_atr_v1	ETHUSDT	-6.5771	-97.37	-59.75	-97.39	38.5	0.84	14216	-7.0496	-0.6135	discard	exp#464 mtf_30m_hma_4h_bias_rsi7_volume_atr_v1	train
68c24a7	mtf_30m_hma_4h_bias_rsi7_volume_atr_v1	SOLUSDT	-3.8779	-96.83	-57.96	-97.16	41.4	0.95	13884	-4.1501	-0.5966	discard	exp#464 mtf_30m_hma_4h_bias_rsi7_volume_atr_v1	train
6658a50	mtf_1h_kama_4h_hma_rsi_pullback_atr_v1	BTCUSDT	-1.7884	-63.32	-22.19	-64.85	36.1	1.11	3828	-2.2655	-0.3422	discard	exp#465 mtf_1h_kama_4h_hma_rsi_pullback_atr_v1	train
6658a50	mtf_1h_kama_4h_hma_rsi_pullback_atr_v1	ETHUSDT	-1.4879	-67.47	-24.49	-68.43	36.4	1.1	3812	-1.8967	-0.3579	discard	exp#465 mtf_1h_kama_4h_hma_rsi_pullback_atr_v1	train
6658a50	mtf_1h_kama_4h_hma_rsi_pullback_atr_v1	SOLUSDT	-0.1339	-18.47	-5.0	-54.43	38.3	1.28	3708	-0.1685	-0.0918	discard	exp#465 mtf_1h_kama_4h_hma_rsi_pullback_atr_v1	train
6658a50	mtf_1h_kama_4h_hma_rsi_pullback_atr_v1	BTCUSDT	-1.7884	-63.32	-22.19	-64.85	36.1	1.11	3828	-2.2655	-0.3422	discard	exp#465 mtf_1h_kama_4h_hma_rsi_pullback_atr_v1	train
6658a50	mtf_1h_kama_4h_hma_rsi_pullback_atr_v1	ETHUSDT	-1.4879	-67.47	-24.49	-68.43	36.4	1.1	3812	-1.8967	-0.3579	discard	exp#465 mtf_1h_kama_4h_hma_rsi_pullback_atr_v1	train
6658a50	mtf_1h_kama_4h_hma_rsi_pullback_atr_v1	SOLUSDT	-0.1339	-18.47	-5.0	-54.43	38.3	1.28	3708	-0.1685	-0.0918	discard	exp#465 mtf_1h_kama_4h_hma_rsi_pullback_atr_v1	train
01c70d5	mtf_4h_donchian_daily_hma_rsi_atr_v1	BTCUSDT	-1.4949	-33.08	-9.56	-39.36	31.2	0.91	1163	-1.5891	-0.2429	discard	exp#466 mtf_4h_donchian_daily_hma_rsi_atr_v1	train
01c70d5	mtf_4h_donchian_daily_hma_rsi_atr_v1	ETHUSDT	-0.9555	-22.16	-6.07	-28.42	33.5	0.99	1191	-0.9745	-0.2137	discard	exp#466 mtf_4h_donchian_daily_hma_rsi_atr_v1	train
01c70d5	mtf_4h_donchian_daily_hma_rsi_atr_v1	SOLUSDT	-0.7705	-27.39	-7.72	-28.9	39.6	0.96	1184	-0.677	-0.2672	discard	exp#466 mtf_4h_donchian_daily_hma_rsi_atr_v1	train
01c70d5	mtf_4h_donchian_daily_hma_rsi_atr_v1	BTCUSDT	-1.4949	-33.08	-9.56	-39.36	31.2	0.91	1163	-1.5891	-0.2429	discard	exp#466 mtf_4h_donchian_daily_hma_rsi_atr_v1	train
01c70d5	mtf_4h_donchian_daily_hma_rsi_atr_v1	ETHUSDT	-0.9555	-22.16	-6.07	-28.42	33.5	0.99	1191	-0.9745	-0.2137	discard	exp#466 mtf_4h_donchian_daily_hma_rsi_atr_v1	train
01c70d5	mtf_4h_donchian_daily_hma_rsi_atr_v1	SOLUSDT	-0.7705	-27.39	-7.72	-28.9	39.6	0.96	1184	-0.677	-0.2672	discard	exp#466 mtf_4h_donchian_daily_hma_rsi_atr_v1	train
560a623	mtf_12h_adx_regime_daily_hma_dual_mode_atr_v1	BTCUSDT	-0.2181	8.1	1.97	-16.45	38.3	1.29	350	-0.2428	0.1197	discard	exp#467 mtf_12h_adx_regime_daily_hma_dual_mode_atr_v1	train
560a623	mtf_12h_adx_regime_daily_hma_dual_mode_atr_v1	ETHUSDT	-0.5525	-15.22	-4.04	-30.31	34.0	0.99	368	-0.621	-0.1334	discard	exp#467 mtf_12h_adx_regime_daily_hma_dual_mode_atr_v1	train
560a623	mtf_12h_adx_regime_daily_hma_dual_mode_atr_v1	SOLUSDT	0.517	77.12	15.43	-21.22	42.5	1.32	334	0.5676	0.7268	keep	exp#467 mtf_12h_adx_regime_daily_hma_dual_mode_atr_v1	train
560a623	mtf_12h_adx_regime_daily_hma_dual_mode_atr_v1	SOLUSDT	-0.9784	-12.44	-10.35	-23.47	35.7	0.91	112	-0.9971	-0.4411	discard	exp#467 mtf_12h_adx_regime_daily_hma_dual_mode_atr_v1	test
560a623	mtf_12h_adx_regime_daily_hma_dual_mode_atr_v1	BTCUSDT	-0.2181	8.1	1.97	-16.45	38.3	1.29	350	-0.2428	0.1197	discard	exp#467 mtf_12h_adx_regime_daily_hma_dual_mode_atr_v1	train
560a623	mtf_12h_adx_regime_daily_hma_dual_mode_atr_v1	ETHUSDT	-0.5525	-15.22	-4.04	-30.31	34.0	0.99	368	-0.621	-0.1334	discard	exp#467 mtf_12h_adx_regime_daily_hma_dual_mode_atr_v1	train
560a623	mtf_12h_adx_regime_daily_hma_dual_mode_atr_v1	SOLUSDT	0.517	77.12	15.43	-21.22	42.5	1.32	334	0.5676	0.7268	discard	exp#467 mtf_12h_adx_regime_daily_hma_dual_mode_atr_v1	train
025bcec	mtf_1d_hma_weekly_bias_rsi_mr_atr_v1	BTCUSDT	-1.5605	-54.81	-18.01	-55.09	35.5	0.69	276	-1.9633	-0.3269	discard	exp#468 mtf_1d_hma_weekly_bias_rsi_mr_atr_v1	train
025bcec	mtf_1d_hma_weekly_bias_rsi_mr_atr_v1	ETHUSDT	-0.994	-46.41	-14.44	-52.6	40.7	0.85	305	-1.3429	-0.2745	discard	exp#468 mtf_1d_hma_weekly_bias_rsi_mr_atr_v1	train
025bcec	mtf_1d_hma_weekly_bias_rsi_mr_atr_v1	SOLUSDT	-0.7044	-52.49	-17.03	-65.59	43.5	0.77	255	-0.8421	-0.2597	discard	exp#468 mtf_1d_hma_weekly_bias_rsi_mr_atr_v1	train
025bcec	mtf_1d_hma_weekly_bias_rsi_mr_atr_v1	BTCUSDT	-1.5605	-54.81	-18.01	-55.09	35.5	0.69	276	-1.9633	-0.3269	discard	exp#468 mtf_1d_hma_weekly_bias_rsi_mr_atr_v1	train
025bcec	mtf_1d_hma_weekly_bias_rsi_mr_atr_v1	ETHUSDT	-0.994	-46.41	-14.44	-52.6	40.7	0.85	305	-1.3429	-0.2745	discard	exp#468 mtf_1d_hma_weekly_bias_rsi_mr_atr_v1	train
025bcec	mtf_1d_hma_weekly_bias_rsi_mr_atr_v1	SOLUSDT	-0.7044	-52.49	-17.03	-65.59	43.5	0.77	255	-0.8421	-0.2597	discard	exp#468 mtf_1d_hma_weekly_bias_rsi_mr_atr_v1	train
4d47c45	mtf_15m_supertrend_4h_hma_rsi7_pullback_atr_v1	BTCUSDT	-18.0668	-98.86	-67.35	-98.86	46.8	0.75	17899	-13.778	-0.6812	discard	exp#469 mtf_15m_supertrend_4h_hma_rsi7_pullback_atr_v1	train
4d47c45	mtf_15m_supertrend_4h_hma_rsi7_pullback_atr_v1	ETHUSDT	-14.8632	-99.06	-68.89	-99.06	47.3	0.76	17660	-11.0056	-0.6954	discard	exp#469 mtf_15m_supertrend_4h_hma_rsi7_pullback_atr_v1	train
4d47c45	mtf_15m_supertrend_4h_hma_rsi7_pullback_atr_v1	SOLUSDT	-9.1513	-98.87	-67.54	-98.88	50.2	0.85	17222	-6.9518	-0.6831	discard	exp#469 mtf_15m_supertrend_4h_hma_rsi7_pullback_atr_v1	train
4d47c45	mtf_15m_supertrend_4h_hma_rsi7_pullback_atr_v1	BTCUSDT	-18.0668	-98.86	-67.35	-98.86	46.8	0.75	17899	-13.778	-0.6812	discard	exp#469 mtf_15m_supertrend_4h_hma_rsi7_pullback_atr_v1	train
4d47c45	mtf_15m_supertrend_4h_hma_rsi7_pullback_atr_v1	ETHUSDT	-14.8632	-99.06	-68.89	-99.06	47.3	0.76	17660	-11.0056	-0.6954	discard	exp#469 mtf_15m_supertrend_4h_hma_rsi7_pullback_atr_v1	train
4d47c45	mtf_15m_supertrend_4h_hma_rsi7_pullback_atr_v1	SOLUSDT	-9.1513	-98.87	-67.54	-98.88	50.2	0.85	17222	-6.9518	-0.6831	discard	exp#469 mtf_15m_supertrend_4h_hma_rsi7_pullback_atr_v1	train
eadf9de	mtf_30m_kama_4h_hma_rsi_pullback_atr_v1	BTCUSDT	-4.5927	-94.69	-52.02	-95.01	34.5	0.95	8725	-5.8655	-0.5475	discard	exp#470 mtf_30m_kama_4h_hma_rsi_pullback_atr_v1	train
eadf9de	mtf_30m_kama_4h_hma_rsi_pullback_atr_v1	ETHUSDT	-3.4076	-93.88	-50.28	-93.93	35.4	0.97	8681	-4.3183	-0.5353	discard	exp#470 mtf_30m_kama_4h_hma_rsi_pullback_atr_v1	train
eadf9de	mtf_30m_kama_4h_hma_rsi_pullback_atr_v1	SOLUSDT	-1.53	-87.82	-41.05	-90.22	38.5	1.14	8469	-1.9052	-0.455	discard	exp#470 mtf_30m_kama_4h_hma_rsi_pullback_atr_v1	train
eadf9de	mtf_30m_kama_4h_hma_rsi_pullback_atr_v1	BTCUSDT	-4.5927	-94.69	-52.02	-95.01	34.5	0.95	8725	-5.8655	-0.5475	discard	exp#470 mtf_30m_kama_4h_hma_rsi_pullback_atr_v1	train
eadf9de	mtf_30m_kama_4h_hma_rsi_pullback_atr_v1	ETHUSDT	-3.4076	-93.88	-50.28	-93.93	35.4	0.97	8681	-4.3183	-0.5353	discard	exp#470 mtf_30m_kama_4h_hma_rsi_pullback_atr_v1	train
eadf9de	mtf_30m_kama_4h_hma_rsi_pullback_atr_v1	SOLUSDT	-1.53	-87.82	-41.05	-90.22	38.5	1.14	8469	-1.9052	-0.455	discard	exp#470 mtf_30m_kama_4h_hma_rsi_pullback_atr_v1	train
6896e6e	mtf_1h_hma_4h_bias_rsi7_volume_atr_v1	BTCUSDT	-5.5075	-66.29	-23.82	-66.52	40.5	0.83	4676	-4.4014	-0.358	discard	exp#471 mtf_1h_hma_4h_bias_rsi7_volume_atr_v1	train
6896e6e	mtf_1h_hma_4h_bias_rsi7_volume_atr_v1	ETHUSDT	-3.6357	-58.12	-19.57	-59.15	42.1	0.93	4573	-2.8583	-0.3308	discard	exp#471 mtf_1h_hma_4h_bias_rsi7_volume_atr_v1	train
6896e6e	mtf_1h_hma_4h_bias_rsi7_volume_atr_v1	SOLUSDT	-2.4698	-62.68	-21.92	-63.69	43.7	0.92	4114	-1.6327	-0.3442	discard	exp#471 mtf_1h_hma_4h_bias_rsi7_volume_atr_v1	train
6896e6e	mtf_1h_hma_4h_bias_rsi7_volume_atr_v1	BTCUSDT	-5.5075	-66.29	-23.82	-66.52	40.5	0.83	4676	-4.4014	-0.358	discard	exp#471 mtf_1h_hma_4h_bias_rsi7_volume_atr_v1	train
6896e6e	mtf_1h_hma_4h_bias_rsi7_volume_atr_v1	ETHUSDT	-3.6357	-58.12	-19.57	-59.15	42.1	0.93	4573	-2.8583	-0.3308	discard	exp#471 mtf_1h_hma_4h_bias_rsi7_volume_atr_v1	train
6896e6e	mtf_1h_hma_4h_bias_rsi7_volume_atr_v1	SOLUSDT	-2.4698	-62.68	-21.92	-63.69	43.7	0.92	4114	-1.6327	-0.3442	discard	exp#471 mtf_1h_hma_4h_bias_rsi7_volume_atr_v1	train
bbc4612	mtf_4h_fisher_daily_hma_chop_regime_atr_v1	BTCUSDT	-1.5703	-9.57	-2.49	-11.51	55.8	0.96	523	-0.8355	-0.2161	discard	exp#472 mtf_4h_fisher_daily_hma_chop_regime_atr_v1	train
bbc4612	mtf_4h_fisher_daily_hma_chop_regime_atr_v1	ETHUSDT	-1.6816	-15.89	-4.24	-18.08	52.2	0.89	521	-0.8601	-0.2343	discard	exp#472 mtf_4h_fisher_daily_hma_chop_regime_atr_v1	train
