commit	strategy	symbol	sharpe	return_pct	cagr_pct	max_dd_pct	win_rate	profit_factor	trades	sortino	calmar	status	description	period
0d3f49f	mtf_30m_rsi_pullback_4h_1d_hma_volume_atr_v1	ETHUSDT	-8.7679	-88.76	-42.12	-88.9	37.1	0.76	9094	-6.1306	-0.4738	discard	exp#248 mtf_30m_rsi_pullback_4h_1d_hma_volume_atr_v1	train
0d3f49f	mtf_30m_rsi_pullback_4h_1d_hma_volume_atr_v1	SOLUSDT	-5.7334	-89.4	-43.07	-89.92	38.7	0.85	8915	-4.1859	-0.479	discard	exp#248 mtf_30m_rsi_pullback_4h_1d_hma_volume_atr_v1	train
0d3f49f	mtf_30m_rsi_pullback_4h_1d_hma_volume_atr_v1	BTCUSDT	-11.6124	-88.58	-41.88	-88.7	36.7	0.72	9388	-8.5778	-0.4722	discard	exp#248 mtf_30m_rsi_pullback_4h_1d_hma_volume_atr_v1	train
0d3f49f	mtf_30m_rsi_pullback_4h_1d_hma_volume_atr_v1	ETHUSDT	-8.7679	-88.76	-42.12	-88.9	37.1	0.76	9094	-6.1306	-0.4738	discard	exp#248 mtf_30m_rsi_pullback_4h_1d_hma_volume_atr_v1	train
0d3f49f	mtf_30m_rsi_pullback_4h_1d_hma_volume_atr_v1	SOLUSDT	-5.7334	-89.4	-43.07	-89.92	38.7	0.85	8915	-4.1859	-0.479	discard	exp#248 mtf_30m_rsi_pullback_4h_1d_hma_volume_atr_v1	train
4bcf972	mtf_1h_rsi_extreme_4h_1d_hma_aligned_atr_v1	BTCUSDT	-3.6792	-12.37	-3.25	-14.17	39.4	0.84	571	-1.042	-0.2293	discard	exp#249 mtf_1h_rsi_extreme_4h_1d_hma_aligned_atr_v1	train
4bcf972	mtf_1h_rsi_extreme_4h_1d_hma_aligned_atr_v1	ETHUSDT	-2.3926	-9.88	-2.57	-12.98	43.9	0.94	578	-0.6245	-0.1979	discard	exp#249 mtf_1h_rsi_extreme_4h_1d_hma_aligned_atr_v1	train
4bcf972	mtf_1h_rsi_extreme_4h_1d_hma_aligned_atr_v1	SOLUSDT	-2.1945	-11.8	-3.1	-17.02	43.4	0.92	579	-0.6252	-0.1823	discard	exp#249 mtf_1h_rsi_extreme_4h_1d_hma_aligned_atr_v1	train
4bcf972	mtf_1h_rsi_extreme_4h_1d_hma_aligned_atr_v1	BTCUSDT	-3.6792	-12.37	-3.25	-14.17	39.4	0.84	571	-1.042	-0.2293	discard	exp#249 mtf_1h_rsi_extreme_4h_1d_hma_aligned_atr_v1	train
4bcf972	mtf_1h_rsi_extreme_4h_1d_hma_aligned_atr_v1	ETHUSDT	-2.3926	-9.88	-2.57	-12.98	43.9	0.94	578	-0.6245	-0.1979	discard	exp#249 mtf_1h_rsi_extreme_4h_1d_hma_aligned_atr_v1	train
4bcf972	mtf_1h_rsi_extreme_4h_1d_hma_aligned_atr_v1	SOLUSDT	-2.1945	-11.8	-3.1	-17.02	43.4	0.92	579	-0.6252	-0.1823	discard	exp#249 mtf_1h_rsi_extreme_4h_1d_hma_aligned_atr_v1	train
085f4ae	mtf_12h_kama_hma_slope_daily_weekly_regime_atr_v1	BTCUSDT	-0.8423	-17.05	-4.57	-19.93	40.6	1.0	330	-0.8981	-0.2291	discard	exp#251 mtf_12h_kama_hma_slope_daily_weekly_regime_atr_v1	train
085f4ae	mtf_12h_kama_hma_slope_daily_weekly_regime_atr_v1	ETHUSDT	-0.1757	5.46	1.34	-23.91	41.4	1.26	343	-0.2032	0.056	discard	exp#251 mtf_12h_kama_hma_slope_daily_weekly_regime_atr_v1	train
085f4ae	mtf_12h_kama_hma_slope_daily_weekly_regime_atr_v1	SOLUSDT	0.3572	52.21	11.12	-28.5	39.5	1.39	342	0.3958	0.3902	keep	exp#251 mtf_12h_kama_hma_slope_daily_weekly_regime_atr_v1	train
085f4ae	mtf_12h_kama_hma_slope_daily_weekly_regime_atr_v1	SOLUSDT	-0.3798	-3.35	-2.77	-13.27	42.2	1.05	90	-0.3714	-0.2084	discard	exp#251 mtf_12h_kama_hma_slope_daily_weekly_regime_atr_v1	test
085f4ae	mtf_12h_kama_hma_slope_daily_weekly_regime_atr_v1	BTCUSDT	-0.8423	-17.05	-4.57	-19.93	40.6	1.0	330	-0.8981	-0.2291	discard	exp#251 mtf_12h_kama_hma_slope_daily_weekly_regime_atr_v1	train
085f4ae	mtf_12h_kama_hma_slope_daily_weekly_regime_atr_v1	ETHUSDT	-0.1757	5.46	1.34	-23.91	41.4	1.26	343	-0.2032	0.056	discard	exp#251 mtf_12h_kama_hma_slope_daily_weekly_regime_atr_v1	train
085f4ae	mtf_12h_kama_hma_slope_daily_weekly_regime_atr_v1	SOLUSDT	0.3572	52.21	11.12	-28.5	39.5	1.39	342	0.3958	0.3902	discard	exp#251 mtf_12h_kama_hma_slope_daily_weekly_regime_atr_v1	train
2c6d8e7	mtf_1d_donchian_breakout_weekly_hma_volume_atr_v1	BTCUSDT	-0.5432	4.02	0.99	-8.5	47.8	1.16	138	-0.3544	0.1166	discard	exp#252 mtf_1d_donchian_breakout_weekly_hma_volume_atr_v1	train
2c6d8e7	mtf_1d_donchian_breakout_weekly_hma_volume_atr_v1	ETHUSDT	-0.6116	-1.57	-0.39	-13.44	42.5	1.03	134	-0.3775	-0.0294	discard	exp#252 mtf_1d_donchian_breakout_weekly_hma_volume_atr_v1	train
2c6d8e7	mtf_1d_donchian_breakout_weekly_hma_volume_atr_v1	SOLUSDT	0.589	69.03	14.07	-11.13	54.8	1.78	124	0.4525	1.2646	keep	exp#252 mtf_1d_donchian_breakout_weekly_hma_volume_atr_v1	train
2c6d8e7	mtf_1d_donchian_breakout_weekly_hma_volume_atr_v1	SOLUSDT	-1.1861	-6.24	-5.16	-8.19	44.1	0.72	34	-0.5564	-0.6301	discard	exp#252 mtf_1d_donchian_breakout_weekly_hma_volume_atr_v1	test
2c6d8e7	mtf_1d_donchian_breakout_weekly_hma_volume_atr_v1	BTCUSDT	-0.5432	4.02	0.99	-8.5	47.8	1.16	138	-0.3544	0.1166	discard	exp#252 mtf_1d_donchian_breakout_weekly_hma_volume_atr_v1	train
2c6d8e7	mtf_1d_donchian_breakout_weekly_hma_volume_atr_v1	ETHUSDT	-0.6116	-1.57	-0.39	-13.44	42.5	1.03	134	-0.3775	-0.0294	discard	exp#252 mtf_1d_donchian_breakout_weekly_hma_volume_atr_v1	train
2c6d8e7	mtf_1d_donchian_breakout_weekly_hma_volume_atr_v1	SOLUSDT	0.589	69.03	14.07	-11.13	54.8	1.78	124	0.4525	1.2646	discard	exp#252 mtf_1d_donchian_breakout_weekly_hma_volume_atr_v1	train
d092fe9	mtf_15m_fisher_4h_hma_rsi_volume_atr_v1	BTCUSDT	-13.9377	-92.74	-48.12	-92.83	41.3	0.82	11820	-8.4803	-0.5183	discard	exp#253 mtf_15m_fisher_4h_hma_rsi_volume_atr_v1	train
d092fe9	mtf_15m_fisher_4h_hma_rsi_volume_atr_v1	ETHUSDT	-10.6328	-92.12	-47.04	-92.41	43.8	0.88	11769	-6.1209	-0.509	discard	exp#253 mtf_15m_fisher_4h_hma_rsi_volume_atr_v1	train
d092fe9	mtf_15m_fisher_4h_hma_rsi_volume_atr_v1	SOLUSDT	-7.6557	-96.03	-55.51	-96.05	46.4	0.8	13310	-4.5046	-0.578	discard	exp#253 mtf_15m_fisher_4h_hma_rsi_volume_atr_v1	train
d092fe9	mtf_15m_fisher_4h_hma_rsi_volume_atr_v1	BTCUSDT	-13.9377	-92.74	-48.12	-92.83	41.3	0.82	11820	-8.4803	-0.5183	discard	exp#253 mtf_15m_fisher_4h_hma_rsi_volume_atr_v1	train
d092fe9	mtf_15m_fisher_4h_hma_rsi_volume_atr_v1	ETHUSDT	-10.6328	-92.12	-47.04	-92.41	43.8	0.88	11769	-6.1209	-0.509	discard	exp#253 mtf_15m_fisher_4h_hma_rsi_volume_atr_v1	train
d092fe9	mtf_15m_fisher_4h_hma_rsi_volume_atr_v1	SOLUSDT	-7.6557	-96.03	-55.51	-96.05	46.4	0.8	13310	-4.5046	-0.578	discard	exp#253 mtf_15m_fisher_4h_hma_rsi_volume_atr_v1	train
e1096bf	mtf_1h_crsi_chop_regime_4h_hma_atr_v1	BTCUSDT	-3.5924	-46.45	-14.47	-46.89	61.7	0.87	3132	-1.9783	-0.3085	discard	exp#255 mtf_1h_crsi_chop_regime_4h_hma_atr_v1	train
e1096bf	mtf_1h_crsi_chop_regime_4h_hma_atr_v1	ETHUSDT	-2.9355	-49.89	-15.87	-51.22	62.2	0.87	3123	-1.6573	-0.3099	discard	exp#255 mtf_1h_crsi_chop_regime_4h_hma_atr_v1	train
e1096bf	mtf_1h_crsi_chop_regime_4h_hma_atr_v1	SOLUSDT	-2.5824	-61.94	-21.53	-64.68	61.5	0.85	3250	-1.4767	-0.3329	discard	exp#255 mtf_1h_crsi_chop_regime_4h_hma_atr_v1	train
e1096bf	mtf_1h_crsi_chop_regime_4h_hma_atr_v1	BTCUSDT	-3.5924	-46.45	-14.47	-46.89	61.7	0.87	3132	-1.9783	-0.3085	discard	exp#255 mtf_1h_crsi_chop_regime_4h_hma_atr_v1	train
e1096bf	mtf_1h_crsi_chop_regime_4h_hma_atr_v1	ETHUSDT	-2.9355	-49.89	-15.87	-51.22	62.2	0.87	3123	-1.6573	-0.3099	discard	exp#255 mtf_1h_crsi_chop_regime_4h_hma_atr_v1	train
e1096bf	mtf_1h_crsi_chop_regime_4h_hma_atr_v1	SOLUSDT	-2.5824	-61.94	-21.53	-64.68	61.5	0.85	3250	-1.4767	-0.3329	discard	exp#255 mtf_1h_crsi_chop_regime_4h_hma_atr_v1	train
ffb6a05	mtf_4h_macd_momentum_daily_weekly_hma_atr_v1	BTCUSDT	-1.2517	-40.45	-12.16	-47.57	30.4	0.96	1801	-1.5045	-0.2557	discard	exp#256 mtf_4h_macd_momentum_daily_weekly_hma_atr_v1	train
ffb6a05	mtf_4h_macd_momentum_daily_weekly_hma_atr_v1	ETHUSDT	-0.9948	-41.63	-12.6	-43.77	32.4	0.96	1800	-1.1665	-0.2879	discard	exp#256 mtf_4h_macd_momentum_daily_weekly_hma_atr_v1	train
ffb6a05	mtf_4h_macd_momentum_daily_weekly_hma_atr_v1	SOLUSDT	0.0807	15.28	3.63	-34.86	34.9	1.08	1787	0.0971	0.1042	keep	exp#256 mtf_4h_macd_momentum_daily_weekly_hma_atr_v1	train
ffb6a05	mtf_4h_macd_momentum_daily_weekly_hma_atr_v1	SOLUSDT	-0.3016	-3.0	-2.47	-24.42	36.7	1.05	548	-0.3734	-0.1013	discard	exp#256 mtf_4h_macd_momentum_daily_weekly_hma_atr_v1	test
ffb6a05	mtf_4h_macd_momentum_daily_weekly_hma_atr_v1	BTCUSDT	-1.2517	-40.45	-12.16	-47.57	30.4	0.96	1801	-1.5045	-0.2557	discard	exp#256 mtf_4h_macd_momentum_daily_weekly_hma_atr_v1	train
ffb6a05	mtf_4h_macd_momentum_daily_weekly_hma_atr_v1	ETHUSDT	-0.9948	-41.63	-12.6	-43.77	32.4	0.96	1800	-1.1665	-0.2879	discard	exp#256 mtf_4h_macd_momentum_daily_weekly_hma_atr_v1	train
ffb6a05	mtf_4h_macd_momentum_daily_weekly_hma_atr_v1	SOLUSDT	0.0807	15.28	3.63	-34.86	34.9	1.08	1787	0.0971	0.1042	discard	exp#256 mtf_4h_macd_momentum_daily_weekly_hma_atr_v1	train
83eddb7	mtf_1d_crsi_chop_regime_weekly_hma_atr_v1	BTCUSDT	-1.7141	-7.5	-1.93	-10.87	52.3	0.81	107	-0.8852	-0.1775	discard	exp#258 mtf_1d_crsi_chop_regime_weekly_hma_atr_v1	train
83eddb7	mtf_1d_crsi_chop_regime_weekly_hma_atr_v1	ETHUSDT	-1.6633	-18.05	-4.86	-20.54	49.1	0.64	110	-0.8733	-0.2364	discard	exp#258 mtf_1d_crsi_chop_regime_weekly_hma_atr_v1	train
83eddb7	mtf_1d_crsi_chop_regime_weekly_hma_atr_v1	SOLUSDT	-1.4807	-19.14	-5.19	-22.02	46.4	0.71	112	-0.8228	-0.2357	discard	exp#258 mtf_1d_crsi_chop_regime_weekly_hma_atr_v1	train
83eddb7	mtf_1d_crsi_chop_regime_weekly_hma_atr_v1	BTCUSDT	-1.7141	-7.5	-1.93	-10.87	52.3	0.81	107	-0.8852	-0.1775	discard	exp#258 mtf_1d_crsi_chop_regime_weekly_hma_atr_v1	train
83eddb7	mtf_1d_crsi_chop_regime_weekly_hma_atr_v1	ETHUSDT	-1.6633	-18.05	-4.86	-20.54	49.1	0.64	110	-0.8733	-0.2364	discard	exp#258 mtf_1d_crsi_chop_regime_weekly_hma_atr_v1	train
83eddb7	mtf_1d_crsi_chop_regime_weekly_hma_atr_v1	SOLUSDT	-1.4807	-19.14	-5.19	-22.02	46.4	0.71	112	-0.8228	-0.2357	discard	exp#258 mtf_1d_crsi_chop_regime_weekly_hma_atr_v1	train
ad58c8e	mtf_15m_supertrend_4h_hma_volume_momentum_atr_v1	BTCUSDT	-5.1251	-78.52	-31.94	-78.55	37.1	0.92	7390	-5.2889	-0.4066	discard	exp#259 mtf_15m_supertrend_4h_hma_volume_momentum_atr_v1	train
ad58c8e	mtf_15m_supertrend_4h_hma_volume_momentum_atr_v1	ETHUSDT	-5.0935	-79.27	-32.54	-79.27	40.5	0.88	7191	-4.8341	-0.4105	discard	exp#259 mtf_15m_supertrend_4h_hma_volume_momentum_atr_v1	train
ad58c8e	mtf_15m_supertrend_4h_hma_volume_momentum_atr_v1	SOLUSDT	-3.1569	-56.98	-19.08	-57.2	47.1	0.97	5575	-2.3643	-0.3336	discard	exp#259 mtf_15m_supertrend_4h_hma_volume_momentum_atr_v1	train
ad58c8e	mtf_15m_supertrend_4h_hma_volume_momentum_atr_v1	BTCUSDT	-5.1251	-78.52	-31.94	-78.55	37.1	0.92	7390	-5.2889	-0.4066	discard	exp#259 mtf_15m_supertrend_4h_hma_volume_momentum_atr_v1	train
ad58c8e	mtf_15m_supertrend_4h_hma_volume_momentum_atr_v1	ETHUSDT	-5.0935	-79.27	-32.54	-79.27	40.5	0.88	7191	-4.8341	-0.4105	discard	exp#259 mtf_15m_supertrend_4h_hma_volume_momentum_atr_v1	train
ad58c8e	mtf_15m_supertrend_4h_hma_volume_momentum_atr_v1	SOLUSDT	-3.1569	-56.98	-19.08	-57.2	47.1	0.97	5575	-2.3643	-0.3336	discard	exp#259 mtf_15m_supertrend_4h_hma_volume_momentum_atr_v1	train
4d33a81	mtf_30m_donchian_breakout_4h_hma_volume_atr_v1	BTCUSDT	-8.8258	-96.86	-57.92	-96.89	32.4	0.75	11831	-8.1593	-0.5979	discard	exp#260 mtf_30m_donchian_breakout_4h_hma_volume_atr_v1	train
4d33a81	mtf_30m_donchian_breakout_4h_hma_volume_atr_v1	ETHUSDT	-6.8493	-96.79	-57.7	-96.87	33.3	0.85	12872	-6.6964	-0.5957	discard	exp#260 mtf_30m_donchian_breakout_4h_hma_volume_atr_v1	train
4d33a81	mtf_30m_donchian_breakout_4h_hma_volume_atr_v1	SOLUSDT	-5.7594	-99.08	-69.19	-99.09	35.1	0.87	14713	-5.8759	-0.6982	discard	exp#260 mtf_30m_donchian_breakout_4h_hma_volume_atr_v1	train
4d33a81	mtf_30m_donchian_breakout_4h_hma_volume_atr_v1	BTCUSDT	-8.8258	-96.86	-57.92	-96.89	32.4	0.75	11831	-8.1593	-0.5979	discard	exp#260 mtf_30m_donchian_breakout_4h_hma_volume_atr_v1	train
4d33a81	mtf_30m_donchian_breakout_4h_hma_volume_atr_v1	ETHUSDT	-6.8493	-96.79	-57.7	-96.87	33.3	0.85	12872	-6.6964	-0.5957	discard	exp#260 mtf_30m_donchian_breakout_4h_hma_volume_atr_v1	train
4d33a81	mtf_30m_donchian_breakout_4h_hma_volume_atr_v1	SOLUSDT	-5.7594	-99.08	-69.19	-99.09	35.1	0.87	14713	-5.8759	-0.6982	discard	exp#260 mtf_30m_donchian_breakout_4h_hma_volume_atr_v1	train
48b1939	mtf_1h_kama_4h_hma_macd_simple_momentum_atr_v1	BTCUSDT	-2.6752	-58.58	-19.79	-59.28	30.4	0.89	3101	-2.2595	-0.3338	discard	exp#261 mtf_1h_kama_4h_hma_macd_simple_momentum_atr_v1	train
48b1939	mtf_1h_kama_4h_hma_macd_simple_momentum_atr_v1	ETHUSDT	-1.91	-54.25	-17.77	-57.16	32.1	0.95	3204	-1.6443	-0.3108	discard	exp#261 mtf_1h_kama_4h_hma_macd_simple_momentum_atr_v1	train
48b1939	mtf_1h_kama_4h_hma_macd_simple_momentum_atr_v1	SOLUSDT	-1.1791	-56.34	-18.78	-59.49	35.3	1.01	3280	-0.9468	-0.3157	discard	exp#261 mtf_1h_kama_4h_hma_macd_simple_momentum_atr_v1	train
48b1939	mtf_1h_kama_4h_hma_macd_simple_momentum_atr_v1	BTCUSDT	-2.6752	-58.58	-19.79	-59.28	30.4	0.89	3101	-2.2595	-0.3338	discard	exp#261 mtf_1h_kama_4h_hma_macd_simple_momentum_atr_v1	train
48b1939	mtf_1h_kama_4h_hma_macd_simple_momentum_atr_v1	ETHUSDT	-1.91	-54.25	-17.77	-57.16	32.1	0.95	3204	-1.6443	-0.3108	discard	exp#261 mtf_1h_kama_4h_hma_macd_simple_momentum_atr_v1	train
48b1939	mtf_1h_kama_4h_hma_macd_simple_momentum_atr_v1	SOLUSDT	-1.1791	-56.34	-18.78	-59.49	35.3	1.01	3280	-0.9468	-0.3157	discard	exp#261 mtf_1h_kama_4h_hma_macd_simple_momentum_atr_v1	train
b8c3b53	mtf_4h_chop_regime_rsi_daily_hma_atr_v1	BTCUSDT	-2.2476	-20.18	-5.48	-21.79	37.3	0.74	365	-0.7993	-0.2517	discard	exp#262 mtf_4h_chop_regime_rsi_daily_hma_atr_v1	train
b8c3b53	mtf_4h_chop_regime_rsi_daily_hma_atr_v1	ETHUSDT	-1.9318	-19.0	-5.13	-21.89	40.9	0.8	389	-0.7728	-0.2346	discard	exp#262 mtf_4h_chop_regime_rsi_daily_hma_atr_v1	train
b8c3b53	mtf_4h_chop_regime_rsi_daily_hma_atr_v1	SOLUSDT	-0.9754	-20.22	-5.51	-27.89	43.3	0.92	700	-0.5246	-0.1976	discard	exp#262 mtf_4h_chop_regime_rsi_daily_hma_atr_v1	train
b8c3b53	mtf_4h_chop_regime_rsi_daily_hma_atr_v1	BTCUSDT	-2.2476	-20.18	-5.48	-21.79	37.3	0.74	365	-0.7993	-0.2517	discard	exp#262 mtf_4h_chop_regime_rsi_daily_hma_atr_v1	train
b8c3b53	mtf_4h_chop_regime_rsi_daily_hma_atr_v1	ETHUSDT	-1.9318	-19.0	-5.13	-21.89	40.9	0.8	389	-0.7728	-0.2346	discard	exp#262 mtf_4h_chop_regime_rsi_daily_hma_atr_v1	train
b8c3b53	mtf_4h_chop_regime_rsi_daily_hma_atr_v1	SOLUSDT	-0.9754	-20.22	-5.51	-27.89	43.3	0.92	700	-0.5246	-0.1976	discard	exp#262 mtf_4h_chop_regime_rsi_daily_hma_atr_v1	train
67a4519	mtf_12h_momentum_zscore_daily_weekly_hma_atr_v1	BTCUSDT	-0.6981	1.66	0.41	-11.26	50.3	1.1	429	-0.5792	0.0365	discard	exp#263 mtf_12h_momentum_zscore_daily_weekly_hma_atr_v1	train
67a4519	mtf_12h_momentum_zscore_daily_weekly_hma_atr_v1	ETHUSDT	-1.9739	-32.11	-9.23	-33.34	43.2	0.73	440	-1.3541	-0.2769	discard	exp#263 mtf_12h_momentum_zscore_daily_weekly_hma_atr_v1	train
67a4519	mtf_12h_momentum_zscore_daily_weekly_hma_atr_v1	SOLUSDT	-0.6522	-9.87	-2.57	-28.25	49.6	1.01	393	-0.4487	-0.0911	discard	exp#263 mtf_12h_momentum_zscore_daily_weekly_hma_atr_v1	train
67a4519	mtf_12h_momentum_zscore_daily_weekly_hma_atr_v1	BTCUSDT	-0.6981	1.66	0.41	-11.26	50.3	1.1	429	-0.5792	0.0365	discard	exp#263 mtf_12h_momentum_zscore_daily_weekly_hma_atr_v1	train
67a4519	mtf_12h_momentum_zscore_daily_weekly_hma_atr_v1	ETHUSDT	-1.9739	-32.11	-9.23	-33.34	43.2	0.73	440	-1.3541	-0.2769	discard	exp#263 mtf_12h_momentum_zscore_daily_weekly_hma_atr_v1	train
67a4519	mtf_12h_momentum_zscore_daily_weekly_hma_atr_v1	SOLUSDT	-0.6522	-9.87	-2.57	-28.25	49.6	1.01	393	-0.4487	-0.0911	discard	exp#263 mtf_12h_momentum_zscore_daily_weekly_hma_atr_v1	train
affa967	mtf_1d_hma_rsi_pullback_weekly_bias_volume_atr_v1	BTCUSDT	-0.7452	-8.01	-2.07	-15.31	37.1	1.02	291	-0.7353	-0.135	discard	exp#264 mtf_1d_hma_rsi_pullback_weekly_bias_volume_atr_v1	train
affa967	mtf_1d_hma_rsi_pullback_weekly_bias_volume_atr_v1	ETHUSDT	-1.246	-30.57	-8.72	-33.85	35.5	0.76	265	-1.0041	-0.2575	discard	exp#264 mtf_1d_hma_rsi_pullback_weekly_bias_volume_atr_v1	train
affa967	mtf_1d_hma_rsi_pullback_weekly_bias_volume_atr_v1	SOLUSDT	-0.4618	-12.84	-3.39	-22.98	40.3	0.94	248	-0.4127	-0.1475	discard	exp#264 mtf_1d_hma_rsi_pullback_weekly_bias_volume_atr_v1	train
affa967	mtf_1d_hma_rsi_pullback_weekly_bias_volume_atr_v1	BTCUSDT	-0.7452	-8.01	-2.07	-15.31	37.1	1.02	291	-0.7353	-0.135	discard	exp#264 mtf_1d_hma_rsi_pullback_weekly_bias_volume_atr_v1	train
affa967	mtf_1d_hma_rsi_pullback_weekly_bias_volume_atr_v1	ETHUSDT	-1.246	-30.57	-8.72	-33.85	35.5	0.76	265	-1.0041	-0.2575	discard	exp#264 mtf_1d_hma_rsi_pullback_weekly_bias_volume_atr_v1	train
affa967	mtf_1d_hma_rsi_pullback_weekly_bias_volume_atr_v1	SOLUSDT	-0.4618	-12.84	-3.39	-22.98	40.3	0.94	248	-0.4127	-0.1475	discard	exp#264 mtf_1d_hma_rsi_pullback_weekly_bias_volume_atr_v1	train
f688e9a	mtf_15m_rsi_mr_1h_4h_hma_atr_v1	BTCUSDT	-7.246	-4.48	-1.14	-4.87	57.4	0.91	296	-0.5786	-0.2343	discard	exp#265 mtf_15m_rsi_mr_1h_4h_hma_atr_v1	train
f688e9a	mtf_15m_rsi_mr_1h_4h_hma_atr_v1	ETHUSDT	-5.4493	-5.7	-1.46	-6.37	57.1	0.84	308	-0.436	-0.2285	discard	exp#265 mtf_15m_rsi_mr_1h_4h_hma_atr_v1	train
f688e9a	mtf_15m_rsi_mr_1h_4h_hma_atr_v1	SOLUSDT	-4.1449	-6.56	-1.69	-7.11	51.9	0.86	308	-0.3777	-0.2373	discard	exp#265 mtf_15m_rsi_mr_1h_4h_hma_atr_v1	train
f688e9a	mtf_15m_rsi_mr_1h_4h_hma_atr_v1	BTCUSDT	-7.246	-4.48	-1.14	-4.87	57.4	0.91	296	-0.5786	-0.2343	discard	exp#265 mtf_15m_rsi_mr_1h_4h_hma_atr_v1	train
f688e9a	mtf_15m_rsi_mr_1h_4h_hma_atr_v1	ETHUSDT	-5.4493	-5.7	-1.46	-6.37	57.1	0.84	308	-0.436	-0.2285	discard	exp#265 mtf_15m_rsi_mr_1h_4h_hma_atr_v1	train
f688e9a	mtf_15m_rsi_mr_1h_4h_hma_atr_v1	SOLUSDT	-4.1449	-6.56	-1.69	-7.11	51.9	0.86	308	-0.3777	-0.2373	discard	exp#265 mtf_15m_rsi_mr_1h_4h_hma_atr_v1	train
42677c0	mtf_30m_rsi_mr_4h_1d_hma_trend_atr_v1	BTCUSDT	-7.3047	-68.44	-25.06	-68.47	48.8	0.71	4139	-3.2804	-0.3661	discard	exp#266 mtf_30m_rsi_mr_4h_1d_hma_trend_atr_v1	train
42677c0	mtf_30m_rsi_mr_4h_1d_hma_trend_atr_v1	ETHUSDT	-5.8998	-68.04	-24.83	-68.07	50.3	0.79	4289	-2.7378	-0.3647	discard	exp#266 mtf_30m_rsi_mr_4h_1d_hma_trend_atr_v1	train
42677c0	mtf_30m_rsi_mr_4h_1d_hma_trend_atr_v1	SOLUSDT	-3.8211	-69.47	-25.76	-69.84	52.9	0.82	4051	-1.7009	-0.3688	discard	exp#266 mtf_30m_rsi_mr_4h_1d_hma_trend_atr_v1	train
42677c0	mtf_30m_rsi_mr_4h_1d_hma_trend_atr_v1	BTCUSDT	-7.3047	-68.44	-25.06	-68.47	48.8	0.71	4139	-3.2804	-0.3661	discard	exp#266 mtf_30m_rsi_mr_4h_1d_hma_trend_atr_v1	train
42677c0	mtf_30m_rsi_mr_4h_1d_hma_trend_atr_v1	ETHUSDT	-5.8998	-68.04	-24.83	-68.07	50.3	0.79	4289	-2.7378	-0.3647	discard	exp#266 mtf_30m_rsi_mr_4h_1d_hma_trend_atr_v1	train
42677c0	mtf_30m_rsi_mr_4h_1d_hma_trend_atr_v1	SOLUSDT	-3.8211	-69.47	-25.76	-69.84	52.9	0.82	4051	-1.7009	-0.3688	discard	exp#266 mtf_30m_rsi_mr_4h_1d_hma_trend_atr_v1	train
1f94432	mtf_1h_trend_pullback_4h_hma_roc_rsi_atr_v1	BTCUSDT	-2.5553	-18.77	-5.07	-20.76	47.8	0.84	674	-0.7143	-0.2442	discard	exp#267 mtf_1h_trend_pullback_4h_hma_roc_rsi_atr_v1	train
1f94432	mtf_1h_trend_pullback_4h_hma_roc_rsi_atr_v1	ETHUSDT	-1.6639	-17.21	-4.61	-22.04	49.0	0.96	1002	-0.6189	-0.2093	discard	exp#267 mtf_1h_trend_pullback_4h_hma_roc_rsi_atr_v1	train
1f94432	mtf_1h_trend_pullback_4h_hma_roc_rsi_atr_v1	SOLUSDT	-0.6541	-13.66	-3.62	-28.4	50.6	1.04	1955	-0.3228	-0.1274	discard	exp#267 mtf_1h_trend_pullback_4h_hma_roc_rsi_atr_v1	train
1f94432	mtf_1h_trend_pullback_4h_hma_roc_rsi_atr_v1	BTCUSDT	-2.5553	-18.77	-5.07	-20.76	47.8	0.84	674	-0.7143	-0.2442	discard	exp#267 mtf_1h_trend_pullback_4h_hma_roc_rsi_atr_v1	train
1f94432	mtf_1h_trend_pullback_4h_hma_roc_rsi_atr_v1	ETHUSDT	-1.6639	-17.21	-4.61	-22.04	49.0	0.96	1002	-0.6189	-0.2093	discard	exp#267 mtf_1h_trend_pullback_4h_hma_roc_rsi_atr_v1	train
1f94432	mtf_1h_trend_pullback_4h_hma_roc_rsi_atr_v1	SOLUSDT	-0.6541	-13.66	-3.62	-28.4	50.6	1.04	1955	-0.3228	-0.1274	discard	exp#267 mtf_1h_trend_pullback_4h_hma_roc_rsi_atr_v1	train
68c8872	mtf_4h_fisher_daily_hma_adx_momentum_atr_v1	BTCUSDT	-1.8701	-18.24	-4.91	-20.2	41.2	0.9	736	-1.0545	-0.2433	discard	exp#268 mtf_4h_fisher_daily_hma_adx_momentum_atr_v1	train
68c8872	mtf_4h_fisher_daily_hma_adx_momentum_atr_v1	ETHUSDT	-1.7861	-23.16	-6.38	-23.31	44.2	0.87	730	-1.0196	-0.2735	discard	exp#268 mtf_4h_fisher_daily_hma_adx_momentum_atr_v1	train
68c8872	mtf_4h_fisher_daily_hma_adx_momentum_atr_v1	SOLUSDT	-1.3123	-27.68	-7.81	-30.32	45.7	0.88	681	-0.7183	-0.2576	discard	exp#268 mtf_4h_fisher_daily_hma_adx_momentum_atr_v1	train
68c8872	mtf_4h_fisher_daily_hma_adx_momentum_atr_v1	BTCUSDT	-1.8701	-18.24	-4.91	-20.2	41.2	0.9	736	-1.0545	-0.2433	discard	exp#268 mtf_4h_fisher_daily_hma_adx_momentum_atr_v1	train
68c8872	mtf_4h_fisher_daily_hma_adx_momentum_atr_v1	ETHUSDT	-1.7861	-23.16	-6.38	-23.31	44.2	0.87	730	-1.0196	-0.2735	discard	exp#268 mtf_4h_fisher_daily_hma_adx_momentum_atr_v1	train
68c8872	mtf_4h_fisher_daily_hma_adx_momentum_atr_v1	SOLUSDT	-1.3123	-27.68	-7.81	-30.32	45.7	0.88	681	-0.7183	-0.2576	discard	exp#268 mtf_4h_fisher_daily_hma_adx_momentum_atr_v1	train
fbe197b	mtf_12h_kama_daily_hma_rsi_simple_v1	BTCUSDT	-0.65	-16.76	-4.48	-28.69	27.9	1.14	448	-0.8585	-0.1563	discard	exp#269 mtf_12h_kama_daily_hma_rsi_simple_v1	train
fbe197b	mtf_12h_kama_daily_hma_rsi_simple_v1	ETHUSDT	-0.5181	-19.19	-5.19	-28.77	28.4	1.06	455	-0.6774	-0.1804	discard	exp#269 mtf_12h_kama_daily_hma_rsi_simple_v1	train
fbe197b	mtf_12h_kama_daily_hma_rsi_simple_v1	SOLUSDT	0.2366	36.35	8.09	-32.39	36.4	1.37	426	0.2979	0.2498	keep	exp#269 mtf_12h_kama_daily_hma_rsi_simple_v1	train
fbe197b	mtf_12h_kama_daily_hma_rsi_simple_v1	SOLUSDT	-0.6591	-10.34	-8.59	-23.83	34.2	1.06	146	-0.8407	-0.3603	discard	exp#269 mtf_12h_kama_daily_hma_rsi_simple_v1	test
fbe197b	mtf_12h_kama_daily_hma_rsi_simple_v1	BTCUSDT	-0.65	-16.76	-4.48	-28.69	27.9	1.14	448	-0.8585	-0.1563	discard	exp#269 mtf_12h_kama_daily_hma_rsi_simple_v1	train
fbe197b	mtf_12h_kama_daily_hma_rsi_simple_v1	ETHUSDT	-0.5181	-19.19	-5.19	-28.77	28.4	1.06	455	-0.6774	-0.1804	discard	exp#269 mtf_12h_kama_daily_hma_rsi_simple_v1	train
fbe197b	mtf_12h_kama_daily_hma_rsi_simple_v1	SOLUSDT	0.2366	36.35	8.09	-32.39	36.4	1.37	426	0.2979	0.2498	discard	exp#269 mtf_12h_kama_daily_hma_rsi_simple_v1	train
d419a33	mtf_1d_donchian_weekly_hma_rsi_atr_v1	BTCUSDT	-1.8513	-3.25	-0.82	-7.35	44.4	0.83	36	-0.574	-0.1119	discard	exp#270 mtf_1d_donchian_weekly_hma_rsi_atr_v1	train
d419a33	mtf_1d_donchian_weekly_hma_rsi_atr_v1	ETHUSDT	-1.6612	-6.34	-1.62	-8.11	32.3	0.68	31	-0.5163	-0.2004	discard	exp#270 mtf_1d_donchian_weekly_hma_rsi_atr_v1	train
