commit	strategy	symbol	sharpe	return_pct	cagr_pct	max_dd_pct	win_rate	profit_factor	trades	sortino	calmar	status	description	period
8af256d	mtf_30m_supertrend_4h_hma_chop_regime_v1	ETHUSDT	-2.2796	-65.94	-23.62	-66.08	39.4	0.97	4192	-2.156	-0.3574	discard	exp#074 mtf_30m_supertrend_4h_hma_chop_regime_v1	train
8af256d	mtf_30m_supertrend_4h_hma_chop_regime_v1	SOLUSDT	-1.342	-64.77	-23.04	-66.83	40.3	1.03	4159	-1.2642	-0.3447	discard	exp#074 mtf_30m_supertrend_4h_hma_chop_regime_v1	train
cf5a7e3	mtf_1h_donchian_4h_hma_volume_v1	BTCUSDT	-5.865	-91.99	-46.81	-92.15	28.1	0.86	9351	-7.4054	-0.508	discard	exp#075 mtf_1h_donchian_4h_hma_volume_v1	train
cf5a7e3	mtf_1h_donchian_4h_hma_volume_v1	ETHUSDT	-4.3228	-90.49	-44.48	-90.58	28.9	0.91	9372	-5.5058	-0.4911	discard	exp#075 mtf_1h_donchian_4h_hma_volume_v1	train
cf5a7e3	mtf_1h_donchian_4h_hma_volume_v1	SOLUSDT	-2.2306	-86.94	-40.01	-89.84	31.4	1.01	9401	-2.7456	-0.4454	discard	exp#075 mtf_1h_donchian_4h_hma_volume_v1	train
cf5a7e3	mtf_1h_donchian_4h_hma_volume_v1	BTCUSDT	-5.865	-91.99	-46.81	-92.15	28.1	0.86	9351	-7.4054	-0.508	discard	exp#075 mtf_1h_donchian_4h_hma_volume_v1	train
cf5a7e3	mtf_1h_donchian_4h_hma_volume_v1	ETHUSDT	-4.3228	-90.49	-44.48	-90.58	28.9	0.91	9372	-5.5058	-0.4911	discard	exp#075 mtf_1h_donchian_4h_hma_volume_v1	train
cf5a7e3	mtf_1h_donchian_4h_hma_volume_v1	SOLUSDT	-2.2306	-86.94	-40.01	-89.84	31.4	1.01	9401	-2.7456	-0.4454	discard	exp#075 mtf_1h_donchian_4h_hma_volume_v1	train
02932dd	mtf_4h_supertrend_daily_hma_rsi_v1	BTCUSDT	-1.7872	-24.06	-6.65	-30.92	46.9	0.96	1275	-1.3072	-0.2152	discard	exp#076 mtf_4h_supertrend_daily_hma_rsi_v1	train
02932dd	mtf_4h_supertrend_daily_hma_rsi_v1	ETHUSDT	-1.1277	-14.12	-3.74	-29.05	48.0	1.05	1329	-0.89	-0.1287	discard	exp#076 mtf_4h_supertrend_daily_hma_rsi_v1	train
02932dd	mtf_4h_supertrend_daily_hma_rsi_v1	SOLUSDT	0.7645	79.59	15.83	-20.12	50.1	1.29	1305	0.7025	0.7868	keep	exp#076 mtf_4h_supertrend_daily_hma_rsi_v1	train
02932dd	mtf_4h_supertrend_daily_hma_rsi_v1	SOLUSDT	-1.5681	-11.14	-9.26	-13.44	46.9	0.93	390	-1.1427	-0.6887	discard	exp#076 mtf_4h_supertrend_daily_hma_rsi_v1	test
02932dd	mtf_4h_supertrend_daily_hma_rsi_v1	BTCUSDT	-1.7872	-24.06	-6.65	-30.92	46.9	0.96	1275	-1.3072	-0.2152	discard	exp#076 mtf_4h_supertrend_daily_hma_rsi_v1	train
02932dd	mtf_4h_supertrend_daily_hma_rsi_v1	ETHUSDT	-1.1277	-14.12	-3.74	-29.05	48.0	1.05	1329	-0.89	-0.1287	discard	exp#076 mtf_4h_supertrend_daily_hma_rsi_v1	train
02932dd	mtf_4h_supertrend_daily_hma_rsi_v1	SOLUSDT	0.7645	79.59	15.83	-20.12	50.1	1.29	1305	0.7025	0.7868	discard	exp#076 mtf_4h_supertrend_daily_hma_rsi_v1	train
c69cd24	mtf_12h_kama_daily_hma_rsi_v1	BTCUSDT	-1.8001	-12.99	-3.42	-16.52	43.5	0.81	260	-1.0113	-0.207	discard	exp#077 mtf_12h_kama_daily_hma_rsi_v1	train
c69cd24	mtf_12h_kama_daily_hma_rsi_v1	ETHUSDT	-1.1212	-4.56	-1.16	-12.29	46.6	0.99	247	-0.6314	-0.0945	discard	exp#077 mtf_12h_kama_daily_hma_rsi_v1	train
c69cd24	mtf_12h_kama_daily_hma_rsi_v1	SOLUSDT	-0.0738	18.21	4.29	-13.39	53.9	1.3	241	-0.0431	0.3201	discard	exp#077 mtf_12h_kama_daily_hma_rsi_v1	train
c69cd24	mtf_12h_kama_daily_hma_rsi_v1	BTCUSDT	-1.8001	-12.99	-3.42	-16.52	43.5	0.81	260	-1.0113	-0.207	discard	exp#077 mtf_12h_kama_daily_hma_rsi_v1	train
c69cd24	mtf_12h_kama_daily_hma_rsi_v1	ETHUSDT	-1.1212	-4.56	-1.16	-12.29	46.6	0.99	247	-0.6314	-0.0945	discard	exp#077 mtf_12h_kama_daily_hma_rsi_v1	train
c69cd24	mtf_12h_kama_daily_hma_rsi_v1	SOLUSDT	-0.0738	18.21	4.29	-13.39	53.9	1.3	241	-0.0431	0.3201	discard	exp#077 mtf_12h_kama_daily_hma_rsi_v1	train
c6278bc	mtf_1d_hma_crossover_weekly_rsi_pullback_v1	BTCUSDT	-0.2419	5.34	1.31	-24.5	36.1	1.82	72	-0.2655	0.0534	discard	exp#078 mtf_1d_hma_crossover_weekly_rsi_pullback_v1	train
c6278bc	mtf_1d_hma_crossover_weekly_rsi_pullback_v1	ETHUSDT	-0.305	-3.37	-0.85	-20.99	36.0	1.56	75	-0.3351	-0.0407	discard	exp#078 mtf_1d_hma_crossover_weekly_rsi_pullback_v1	train
c6278bc	mtf_1d_hma_crossover_weekly_rsi_pullback_v1	SOLUSDT	1.0686	200.26	31.76	-22.72	47.3	4.92	55	1.2792	1.3978	keep	exp#078 mtf_1d_hma_crossover_weekly_rsi_pullback_v1	train
c6278bc	mtf_1d_hma_crossover_weekly_rsi_pullback_v1	SOLUSDT	-0.3222	0.14	0.12	-13.76	50.0	1.83	16	-0.355	0.0084	discard	exp#078 mtf_1d_hma_crossover_weekly_rsi_pullback_v1	test
c6278bc	mtf_1d_hma_crossover_weekly_rsi_pullback_v1	BTCUSDT	-0.2419	5.34	1.31	-24.5	36.1	1.82	72	-0.2655	0.0534	discard	exp#078 mtf_1d_hma_crossover_weekly_rsi_pullback_v1	train
c6278bc	mtf_1d_hma_crossover_weekly_rsi_pullback_v1	ETHUSDT	-0.305	-3.37	-0.85	-20.99	36.0	1.56	75	-0.3351	-0.0407	discard	exp#078 mtf_1d_hma_crossover_weekly_rsi_pullback_v1	train
c6278bc	mtf_1d_hma_crossover_weekly_rsi_pullback_v1	SOLUSDT	1.0686	200.26	31.76	-22.72	47.3	4.92	55	1.2792	1.3978	discard	exp#078 mtf_1d_hma_crossover_weekly_rsi_pullback_v1	train
7ea7382	mtf_15m_ema_crossover_4h_hma_volume_v1	BTCUSDT	-13.9844	-95.74	-54.59	-95.84	41.0	0.75	12804	-8.7686	-0.5696	discard	exp#079 mtf_15m_ema_crossover_4h_hma_volume_v1	train
7ea7382	mtf_15m_ema_crossover_4h_hma_volume_v1	ETHUSDT	-10.5334	-95.48	-53.9	-95.5	42.9	0.79	12662	-6.449	-0.5644	discard	exp#079 mtf_15m_ema_crossover_4h_hma_volume_v1	train
7ea7382	mtf_15m_ema_crossover_4h_hma_volume_v1	SOLUSDT	-6.1155	-94.68	-52.12	-94.73	47.7	0.91	12931	-3.7916	-0.5502	discard	exp#079 mtf_15m_ema_crossover_4h_hma_volume_v1	train
7ea7382	mtf_15m_ema_crossover_4h_hma_volume_v1	BTCUSDT	-13.9844	-95.74	-54.59	-95.84	41.0	0.75	12804	-8.7686	-0.5696	discard	exp#079 mtf_15m_ema_crossover_4h_hma_volume_v1	train
7ea7382	mtf_15m_ema_crossover_4h_hma_volume_v1	ETHUSDT	-10.5334	-95.48	-53.9	-95.5	42.9	0.79	12662	-6.449	-0.5644	discard	exp#079 mtf_15m_ema_crossover_4h_hma_volume_v1	train
7ea7382	mtf_15m_ema_crossover_4h_hma_volume_v1	SOLUSDT	-6.1155	-94.68	-52.12	-94.73	47.7	0.91	12931	-3.7916	-0.5502	discard	exp#079 mtf_15m_ema_crossover_4h_hma_volume_v1	train
c8b21d2	mtf_30m_ema_rsi_4h_hma_trend_v1	BTCUSDT	-5.1352	-87.94	-41.09	-88.47	37.6	0.91	9297	-5.8293	-0.4644	discard	exp#080 mtf_30m_ema_rsi_4h_hma_trend_v1	train
c8b21d2	mtf_30m_ema_rsi_4h_hma_trend_v1	ETHUSDT	-4.2491	-89.54	-43.15	-90.04	38.5	0.91	9269	-4.6669	-0.4792	discard	exp#080 mtf_30m_ema_rsi_4h_hma_trend_v1	train
c8b21d2	mtf_30m_ema_rsi_4h_hma_trend_v1	SOLUSDT	-1.6548	-74.86	-29.29	-80.24	40.7	1.02	9525	-1.8866	-0.365	discard	exp#080 mtf_30m_ema_rsi_4h_hma_trend_v1	train
c8b21d2	mtf_30m_ema_rsi_4h_hma_trend_v1	BTCUSDT	-5.1352	-87.94	-41.09	-88.47	37.6	0.91	9297	-5.8293	-0.4644	discard	exp#080 mtf_30m_ema_rsi_4h_hma_trend_v1	train
c8b21d2	mtf_30m_ema_rsi_4h_hma_trend_v1	ETHUSDT	-4.2491	-89.54	-43.15	-90.04	38.5	0.91	9269	-4.6669	-0.4792	discard	exp#080 mtf_30m_ema_rsi_4h_hma_trend_v1	train
c8b21d2	mtf_30m_ema_rsi_4h_hma_trend_v1	SOLUSDT	-1.6548	-74.86	-29.29	-80.24	40.7	1.02	9525	-1.8866	-0.365	discard	exp#080 mtf_30m_ema_rsi_4h_hma_trend_v1	train
15c6820	mtf_1h_kama_4h_hma_rsi_pullback_v1	BTCUSDT	-1.5943	-43.05	-13.14	-44.59	28.1	1.22	2555	-1.6609	-0.2947	discard	exp#081 mtf_1h_kama_4h_hma_rsi_pullback_v1	train
15c6820	mtf_1h_kama_4h_hma_rsi_pullback_v1	ETHUSDT	-0.8213	-27.58	-7.76	-30.37	29.7	1.33	2549	-0.8612	-0.2554	discard	exp#081 mtf_1h_kama_4h_hma_rsi_pullback_v1	train
15c6820	mtf_1h_kama_4h_hma_rsi_pullback_v1	SOLUSDT	0.0367	12.84	3.08	-27.61	32.8	1.45	2577	0.037	0.1116	keep	exp#081 mtf_1h_kama_4h_hma_rsi_pullback_v1	train
15c6820	mtf_1h_kama_4h_hma_rsi_pullback_v1	SOLUSDT	-0.8854	-11.44	-9.51	-24.16	31.9	1.26	789	-0.9407	-0.3937	discard	exp#081 mtf_1h_kama_4h_hma_rsi_pullback_v1	test
15c6820	mtf_1h_kama_4h_hma_rsi_pullback_v1	BTCUSDT	-1.5943	-43.05	-13.14	-44.59	28.1	1.22	2555	-1.6609	-0.2947	discard	exp#081 mtf_1h_kama_4h_hma_rsi_pullback_v1	train
15c6820	mtf_1h_kama_4h_hma_rsi_pullback_v1	ETHUSDT	-0.8213	-27.58	-7.76	-30.37	29.7	1.33	2549	-0.8612	-0.2554	discard	exp#081 mtf_1h_kama_4h_hma_rsi_pullback_v1	train
15c6820	mtf_1h_kama_4h_hma_rsi_pullback_v1	SOLUSDT	0.0367	12.84	3.08	-27.61	32.8	1.45	2577	0.037	0.1116	discard	exp#081 mtf_1h_kama_4h_hma_rsi_pullback_v1	train
04cf6bf	mtf_4h_fisher_daily_hma_chop_regime_v2	BTCUSDT	-1.8447	-17.22	-4.62	-22.37	45.2	0.92	761	-1.0056	-0.2063	discard	exp#082 mtf_4h_fisher_daily_hma_chop_regime_v2	train
04cf6bf	mtf_4h_fisher_daily_hma_chop_regime_v2	ETHUSDT	-1.1649	-9.27	-2.4	-19.22	47.7	1.01	725	-0.6718	-0.1251	discard	exp#082 mtf_4h_fisher_daily_hma_chop_regime_v2	train
04cf6bf	mtf_4h_fisher_daily_hma_chop_regime_v2	SOLUSDT	-0.6898	-7.8	-2.02	-16.15	49.2	1.01	746	-0.4091	-0.1249	discard	exp#082 mtf_4h_fisher_daily_hma_chop_regime_v2	train
04cf6bf	mtf_4h_fisher_daily_hma_chop_regime_v2	BTCUSDT	-1.8447	-17.22	-4.62	-22.37	45.2	0.92	761	-1.0056	-0.2063	discard	exp#082 mtf_4h_fisher_daily_hma_chop_regime_v2	train
04cf6bf	mtf_4h_fisher_daily_hma_chop_regime_v2	ETHUSDT	-1.1649	-9.27	-2.4	-19.22	47.7	1.01	725	-0.6718	-0.1251	discard	exp#082 mtf_4h_fisher_daily_hma_chop_regime_v2	train
04cf6bf	mtf_4h_fisher_daily_hma_chop_regime_v2	SOLUSDT	-0.6898	-7.8	-2.02	-16.15	49.2	1.01	746	-0.4091	-0.1249	discard	exp#082 mtf_4h_fisher_daily_hma_chop_regime_v2	train
1d196aa	mtf_12h_kama_daily_hma_adx_regime_v1	BTCUSDT	-0.9092	-18.8	-5.07	-24.18	45.6	0.93	472	-0.9758	-0.2098	discard	exp#083 mtf_12h_kama_daily_hma_adx_regime_v1	train
1d196aa	mtf_12h_kama_daily_hma_adx_regime_v1	ETHUSDT	-0.404	-7.84	-2.02	-21.36	44.1	1.06	490	-0.4584	-0.0946	discard	exp#083 mtf_12h_kama_daily_hma_adx_regime_v1	train
1d196aa	mtf_12h_kama_daily_hma_adx_regime_v1	SOLUSDT	0.6764	104.02	19.59	-28.6	47.7	1.29	453	0.7674	0.685	keep	exp#083 mtf_12h_kama_daily_hma_adx_regime_v1	train
1d196aa	mtf_12h_kama_daily_hma_adx_regime_v1	SOLUSDT	-0.6056	-7.46	-6.18	-19.63	45.6	1.02	136	-0.6814	-0.3148	discard	exp#083 mtf_12h_kama_daily_hma_adx_regime_v1	test
1d196aa	mtf_12h_kama_daily_hma_adx_regime_v1	BTCUSDT	-0.9092	-18.8	-5.07	-24.18	45.6	0.93	472	-0.9758	-0.2098	discard	exp#083 mtf_12h_kama_daily_hma_adx_regime_v1	train
1d196aa	mtf_12h_kama_daily_hma_adx_regime_v1	ETHUSDT	-0.404	-7.84	-2.02	-21.36	44.1	1.06	490	-0.4584	-0.0946	discard	exp#083 mtf_12h_kama_daily_hma_adx_regime_v1	train
1d196aa	mtf_12h_kama_daily_hma_adx_regime_v1	SOLUSDT	0.6764	104.02	19.59	-28.6	47.7	1.29	453	0.7674	0.685	discard	exp#083 mtf_12h_kama_daily_hma_adx_regime_v1	train
446adbd	mtf_1d_donchian_weekly_hma_rsi_pullback_v1	BTCUSDT	-0.9915	-1.46	-0.37	-10.75	45.8	1.08	83	-0.5062	-0.0342	discard	exp#084 mtf_1d_donchian_weekly_hma_rsi_pullback_v1	train
446adbd	mtf_1d_donchian_weekly_hma_rsi_pullback_v1	ETHUSDT	-0.8177	-0.4	-0.1	-10.52	43.2	1.04	74	-0.3841	-0.0094	discard	exp#084 mtf_1d_donchian_weekly_hma_rsi_pullback_v1	train
446adbd	mtf_1d_donchian_weekly_hma_rsi_pullback_v1	SOLUSDT	0.5967	59.06	12.35	-8.86	59.7	2.78	72	0.3839	1.3933	keep	exp#084 mtf_1d_donchian_weekly_hma_rsi_pullback_v1	train
446adbd	mtf_1d_donchian_weekly_hma_rsi_pullback_v1	SOLUSDT	-1.7991	-2.08	-1.71	-4.64	35.7	0.7	14	-0.6626	-0.3683	discard	exp#084 mtf_1d_donchian_weekly_hma_rsi_pullback_v1	test
446adbd	mtf_1d_donchian_weekly_hma_rsi_pullback_v1	BTCUSDT	-0.9915	-1.46	-0.37	-10.75	45.8	1.08	83	-0.5062	-0.0342	discard	exp#084 mtf_1d_donchian_weekly_hma_rsi_pullback_v1	train
446adbd	mtf_1d_donchian_weekly_hma_rsi_pullback_v1	ETHUSDT	-0.8177	-0.4	-0.1	-10.52	43.2	1.04	74	-0.3841	-0.0094	discard	exp#084 mtf_1d_donchian_weekly_hma_rsi_pullback_v1	train
446adbd	mtf_1d_donchian_weekly_hma_rsi_pullback_v1	SOLUSDT	0.5967	59.06	12.35	-8.86	59.7	2.78	72	0.3839	1.3933	discard	exp#084 mtf_1d_donchian_weekly_hma_rsi_pullback_v1	train
a2cd11f	mtf_15m_crsi_4h_hma_chop_regime_v1	BTCUSDT	-7.8057	-36.1	-10.6	-37.72	54.5	0.72	2034	-1.7836	-0.2809	discard	exp#085 mtf_15m_crsi_4h_hma_chop_regime_v1	train
a2cd11f	mtf_15m_crsi_4h_hma_chop_regime_v1	ETHUSDT	-6.2439	-35.87	-10.52	-36.57	56.0	0.74	1904	-1.3599	-0.2876	discard	exp#085 mtf_15m_crsi_4h_hma_chop_regime_v1	train
a2cd11f	mtf_15m_crsi_4h_hma_chop_regime_v1	SOLUSDT	-3.2186	-31.88	-9.19	-32.92	60.7	0.84	1739	-0.6475	-0.2791	discard	exp#085 mtf_15m_crsi_4h_hma_chop_regime_v1	train
a2cd11f	mtf_15m_crsi_4h_hma_chop_regime_v1	BTCUSDT	-7.8057	-36.1	-10.6	-37.72	54.5	0.72	2034	-1.7836	-0.2809	discard	exp#085 mtf_15m_crsi_4h_hma_chop_regime_v1	train
a2cd11f	mtf_15m_crsi_4h_hma_chop_regime_v1	ETHUSDT	-6.2439	-35.87	-10.52	-36.57	56.0	0.74	1904	-1.3599	-0.2876	discard	exp#085 mtf_15m_crsi_4h_hma_chop_regime_v1	train
a2cd11f	mtf_15m_crsi_4h_hma_chop_regime_v1	SOLUSDT	-3.2186	-31.88	-9.19	-32.92	60.7	0.84	1739	-0.6475	-0.2791	discard	exp#085 mtf_15m_crsi_4h_hma_chop_regime_v1	train
32eadc9	mtf_30m_crsi_4h_1d_hma_chop_regime_v1	BTCUSDT	-4.1552	-20.42	-5.55	-21.78	50.9	0.72	881	-0.7696	-0.255	discard	exp#086 mtf_30m_crsi_4h_1d_hma_chop_regime_v1	train
32eadc9	mtf_30m_crsi_4h_1d_hma_chop_regime_v1	ETHUSDT	-4.3793	-14.94	-3.97	-15.65	46.7	0.82	754	-1.0167	-0.2535	discard	exp#086 mtf_30m_crsi_4h_1d_hma_chop_regime_v1	train
32eadc9	mtf_30m_crsi_4h_1d_hma_chop_regime_v1	SOLUSDT	-2.1947	-1.99	-0.5	-8.52	52.1	1.12	493	-0.4304	-0.0591	discard	exp#086 mtf_30m_crsi_4h_1d_hma_chop_regime_v1	train
32eadc9	mtf_30m_crsi_4h_1d_hma_chop_regime_v1	BTCUSDT	-4.1552	-20.42	-5.55	-21.78	50.9	0.72	881	-0.7696	-0.255	discard	exp#086 mtf_30m_crsi_4h_1d_hma_chop_regime_v1	train
32eadc9	mtf_30m_crsi_4h_1d_hma_chop_regime_v1	ETHUSDT	-4.3793	-14.94	-3.97	-15.65	46.7	0.82	754	-1.0167	-0.2535	discard	exp#086 mtf_30m_crsi_4h_1d_hma_chop_regime_v1	train
32eadc9	mtf_30m_crsi_4h_1d_hma_chop_regime_v1	SOLUSDT	-2.1947	-1.99	-0.5	-8.52	52.1	1.12	493	-0.4304	-0.0591	discard	exp#086 mtf_30m_crsi_4h_1d_hma_chop_regime_v1	train
2e5a5d4	mtf_1h_kama_4h_hma_rsi_pullback_v1	BTCUSDT	-4.033	-84.99	-37.77	-85.4	28.3	0.9	6296	-5.1636	-0.4423	discard	exp#087 mtf_1h_kama_4h_hma_rsi_pullback_v1	train
2e5a5d4	mtf_1h_kama_4h_hma_rsi_pullback_v1	ETHUSDT	-2.5801	-78.42	-31.86	-78.7	29.7	0.99	6249	-3.3794	-0.4048	discard	exp#087 mtf_1h_kama_4h_hma_rsi_pullback_v1	train
2e5a5d4	mtf_1h_kama_4h_hma_rsi_pullback_v1	SOLUSDT	-1.0689	-65.91	-23.67	-74.5	31.5	1.11	6119	-1.3846	-0.3177	discard	exp#087 mtf_1h_kama_4h_hma_rsi_pullback_v1	train
2e5a5d4	mtf_1h_kama_4h_hma_rsi_pullback_v1	BTCUSDT	-4.033	-84.99	-37.77	-85.4	28.3	0.9	6296	-5.1636	-0.4423	discard	exp#087 mtf_1h_kama_4h_hma_rsi_pullback_v1	train
2e5a5d4	mtf_1h_kama_4h_hma_rsi_pullback_v1	ETHUSDT	-2.5801	-78.42	-31.86	-78.7	29.7	0.99	6249	-3.3794	-0.4048	discard	exp#087 mtf_1h_kama_4h_hma_rsi_pullback_v1	train
2e5a5d4	mtf_1h_kama_4h_hma_rsi_pullback_v1	SOLUSDT	-1.0689	-65.91	-23.67	-74.5	31.5	1.11	6119	-1.3846	-0.3177	discard	exp#087 mtf_1h_kama_4h_hma_rsi_pullback_v1	train
5323b4d	mtf_4h_supertrend_daily_hma_rsi_adx_v1	BTCUSDT	-0.3222	3.36	0.83	-20.32	38.1	1.52	407	-0.3016	0.0408	discard	exp#088 mtf_4h_supertrend_daily_hma_rsi_adx_v1	train
5323b4d	mtf_4h_supertrend_daily_hma_rsi_adx_v1	ETHUSDT	-0.1786	8.01	1.94	-21.08	36.3	1.55	416	-0.1694	0.0922	discard	exp#088 mtf_4h_supertrend_daily_hma_rsi_adx_v1	train
5323b4d	mtf_4h_supertrend_daily_hma_rsi_adx_v1	SOLUSDT	0.5955	84.4	16.6	-22.68	43.1	2.06	418	0.5873	0.732	keep	exp#088 mtf_4h_supertrend_daily_hma_rsi_adx_v1	train
5323b4d	mtf_4h_supertrend_daily_hma_rsi_adx_v1	SOLUSDT	-0.1347	2.34	1.92	-18.57	41.3	1.6	138	-0.136	0.1034	discard	exp#088 mtf_4h_supertrend_daily_hma_rsi_adx_v1	test
5323b4d	mtf_4h_supertrend_daily_hma_rsi_adx_v1	BTCUSDT	-0.3222	3.36	0.83	-20.32	38.1	1.52	407	-0.3016	0.0408	discard	exp#088 mtf_4h_supertrend_daily_hma_rsi_adx_v1	train
5323b4d	mtf_4h_supertrend_daily_hma_rsi_adx_v1	ETHUSDT	-0.1786	8.01	1.94	-21.08	36.3	1.55	416	-0.1694	0.0922	discard	exp#088 mtf_4h_supertrend_daily_hma_rsi_adx_v1	train
5323b4d	mtf_4h_supertrend_daily_hma_rsi_adx_v1	SOLUSDT	0.5955	84.4	16.6	-22.68	43.1	2.06	418	0.5873	0.732	discard	exp#088 mtf_4h_supertrend_daily_hma_rsi_adx_v1	train
b9ec370	mtf_12h_donchian_daily_hma_volume_v1	BTCUSDT	-1.5738	5.02	1.23	-2.27	60.7	1.58	61	-0.4643	0.5432	discard	exp#089 mtf_12h_donchian_daily_hma_volume_v1	train
b9ec370	mtf_12h_donchian_daily_hma_volume_v1	ETHUSDT	-0.8479	7.65	1.86	-5.44	49.2	1.54	61	-0.2727	0.3424	discard	exp#089 mtf_12h_donchian_daily_hma_volume_v1	train
b9ec370	mtf_12h_donchian_daily_hma_volume_v1	SOLUSDT	-0.7311	-2.69	-0.68	-16.63	48.5	0.99	66	-0.1865	-0.0411	discard	exp#089 mtf_12h_donchian_daily_hma_volume_v1	train
b9ec370	mtf_12h_donchian_daily_hma_volume_v1	BTCUSDT	-1.5738	5.02	1.23	-2.27	60.7	1.58	61	-0.4643	0.5432	discard	exp#089 mtf_12h_donchian_daily_hma_volume_v1	train
b9ec370	mtf_12h_donchian_daily_hma_volume_v1	ETHUSDT	-0.8479	7.65	1.86	-5.44	49.2	1.54	61	-0.2727	0.3424	discard	exp#089 mtf_12h_donchian_daily_hma_volume_v1	train
b9ec370	mtf_12h_donchian_daily_hma_volume_v1	SOLUSDT	-0.7311	-2.69	-0.68	-16.63	48.5	0.99	66	-0.1865	-0.0411	discard	exp#089 mtf_12h_donchian_daily_hma_volume_v1	train
20b3dbd	mtf_1d_supertrend_weekly_hma_rsi_adx_v1	BTCUSDT	-0.4874	3.57	0.88	-13.56	50.3	1.11	348	-0.47	0.0649	discard	exp#090 mtf_1d_supertrend_weekly_hma_rsi_adx_v1	train
20b3dbd	mtf_1d_supertrend_weekly_hma_rsi_adx_v1	ETHUSDT	-1.3181	-29.01	-8.21	-30.88	44.6	0.81	354	-1.2099	-0.2658	discard	exp#090 mtf_1d_supertrend_weekly_hma_rsi_adx_v1	train
20b3dbd	mtf_1d_supertrend_weekly_hma_rsi_adx_v1	SOLUSDT	-0.048	14.46	3.45	-17.86	49.5	1.1	410	-0.0542	0.193	discard	exp#090 mtf_1d_supertrend_weekly_hma_rsi_adx_v1	train
20b3dbd	mtf_1d_supertrend_weekly_hma_rsi_adx_v1	BTCUSDT	-0.4874	3.57	0.88	-13.56	50.3	1.11	348	-0.47	0.0649	discard	exp#090 mtf_1d_supertrend_weekly_hma_rsi_adx_v1	train
20b3dbd	mtf_1d_supertrend_weekly_hma_rsi_adx_v1	ETHUSDT	-1.3181	-29.01	-8.21	-30.88	44.6	0.81	354	-1.2099	-0.2658	discard	exp#090 mtf_1d_supertrend_weekly_hma_rsi_adx_v1	train
20b3dbd	mtf_1d_supertrend_weekly_hma_rsi_adx_v1	SOLUSDT	-0.048	14.46	3.45	-17.86	49.5	1.1	410	-0.0542	0.193	discard	exp#090 mtf_1d_supertrend_weekly_hma_rsi_adx_v1	train
3e73d49	mtf_15m_bb_mr_4h_hma_volume_v1	BTCUSDT	-8.461	-58.57	-19.78	-59.21	51.5	0.73	3707	-2.6845	-0.3341	discard	exp#091 mtf_15m_bb_mr_4h_hma_volume_v1	train
3e73d49	mtf_15m_bb_mr_4h_hma_volume_v1	ETHUSDT	-6.3052	-54.22	-17.76	-54.3	54.6	0.82	3682	-2.0202	-0.327	discard	exp#091 mtf_15m_bb_mr_4h_hma_volume_v1	train
3e73d49	mtf_15m_bb_mr_4h_hma_volume_v1	SOLUSDT	-4.121	-59.52	-20.31	-59.59	54.6	0.81	3508	-1.2156	-0.3408	discard	exp#091 mtf_15m_bb_mr_4h_hma_volume_v1	train
3e73d49	mtf_15m_bb_mr_4h_hma_volume_v1	BTCUSDT	-8.461	-58.57	-19.78	-59.21	51.5	0.73	3707	-2.6845	-0.3341	discard	exp#091 mtf_15m_bb_mr_4h_hma_volume_v1	train
3e73d49	mtf_15m_bb_mr_4h_hma_volume_v1	ETHUSDT	-6.3052	-54.22	-17.76	-54.3	54.6	0.82	3682	-2.0202	-0.327	discard	exp#091 mtf_15m_bb_mr_4h_hma_volume_v1	train
3e73d49	mtf_15m_bb_mr_4h_hma_volume_v1	SOLUSDT	-4.121	-59.52	-20.31	-59.59	54.6	0.81	3508	-1.2156	-0.3408	discard	exp#091 mtf_15m_bb_mr_4h_hma_volume_v1	train
a5ebe66	mtf_30m_donchian_4h_hma_rsi_momentum_v1	BTCUSDT	-5.6315	-34.04	-9.89	-34.57	35.9	0.67	1295	-1.5084	-0.286	discard	exp#092 mtf_30m_donchian_4h_hma_rsi_momentum_v1	train
a5ebe66	mtf_30m_donchian_4h_hma_rsi_momentum_v1	ETHUSDT	-4.3904	-31.11	-8.9	-31.11	36.7	0.78	1375	-1.2845	-0.2861	discard	exp#092 mtf_30m_donchian_4h_hma_rsi_momentum_v1	train
a5ebe66	mtf_30m_donchian_4h_hma_rsi_momentum_v1	SOLUSDT	-2.8491	-38.84	-11.61	-40.76	39.3	0.87	1843	-1.0114	-0.2849	discard	exp#092 mtf_30m_donchian_4h_hma_rsi_momentum_v1	train
a5ebe66	mtf_30m_donchian_4h_hma_rsi_momentum_v1	BTCUSDT	-5.6315	-34.04	-9.89	-34.57	35.9	0.67	1295	-1.5084	-0.286	discard	exp#092 mtf_30m_donchian_4h_hma_rsi_momentum_v1	train
a5ebe66	mtf_30m_donchian_4h_hma_rsi_momentum_v1	ETHUSDT	-4.3904	-31.11	-8.9	-31.11	36.7	0.78	1375	-1.2845	-0.2861	discard	exp#092 mtf_30m_donchian_4h_hma_rsi_momentum_v1	train
a5ebe66	mtf_30m_donchian_4h_hma_rsi_momentum_v1	SOLUSDT	-2.8491	-38.84	-11.61	-40.76	39.3	0.87	1843	-1.0114	-0.2849	discard	exp#092 mtf_30m_donchian_4h_hma_rsi_momentum_v1	train
162faa8	mtf_1h_regime_adaptive_4h_hma_v1	BTCUSDT	-1.5017	-41.15	-12.42	-45.32	31.2	1.34	2830	-1.6262	-0.2741	discard	exp#093 mtf_1h_regime_adaptive_4h_hma_v1	train
162faa8	mtf_1h_regime_adaptive_4h_hma_v1	ETHUSDT	-0.5232	-14.29	-3.79	-22.72	33.5	1.52	2839	-0.5813	-0.1666	discard	exp#093 mtf_1h_regime_adaptive_4h_hma_v1	train
162faa8	mtf_1h_regime_adaptive_4h_hma_v1	SOLUSDT	-0.033	5.13	1.26	-28.02	36.7	1.57	2911	-0.0342	0.0451	discard	exp#093 mtf_1h_regime_adaptive_4h_hma_v1	train
162faa8	mtf_1h_regime_adaptive_4h_hma_v1	BTCUSDT	-1.5017	-41.15	-12.42	-45.32	31.2	1.34	2830	-1.6262	-0.2741	discard	exp#093 mtf_1h_regime_adaptive_4h_hma_v1	train
162faa8	mtf_1h_regime_adaptive_4h_hma_v1	ETHUSDT	-0.5232	-14.29	-3.79	-22.72	33.5	1.52	2839	-0.5813	-0.1666	discard	exp#093 mtf_1h_regime_adaptive_4h_hma_v1	train
162faa8	mtf_1h_regime_adaptive_4h_hma_v1	SOLUSDT	-0.033	5.13	1.26	-28.02	36.7	1.57	2911	-0.0342	0.0451	discard	exp#093 mtf_1h_regime_adaptive_4h_hma_v1	train
34aa031	mtf_4h_supertrend_daily_hma_rsi_macd_v2	BTCUSDT	-1.2499	-9.32	-2.42	-14.46	35.5	0.97	420	-0.698	-0.1672	discard	exp#094 mtf_4h_supertrend_daily_hma_rsi_macd_v2	train
34aa031	mtf_4h_supertrend_daily_hma_rsi_macd_v2	ETHUSDT	-0.7102	-1.12	-0.28	-11.43	37.4	1.07	478	-0.4353	-0.0246	discard	exp#094 mtf_4h_supertrend_daily_hma_rsi_macd_v2	train
34aa031	mtf_4h_supertrend_daily_hma_rsi_macd_v2	SOLUSDT	-0.2347	5.57	1.37	-19.62	40.1	1.09	479	-0.1411	0.0698	discard	exp#094 mtf_4h_supertrend_daily_hma_rsi_macd_v2	train
34aa031	mtf_4h_supertrend_daily_hma_rsi_macd_v2	BTCUSDT	-1.2499	-9.32	-2.42	-14.46	35.5	0.97	420	-0.698	-0.1672	discard	exp#094 mtf_4h_supertrend_daily_hma_rsi_macd_v2	train
34aa031	mtf_4h_supertrend_daily_hma_rsi_macd_v2	ETHUSDT	-0.7102	-1.12	-0.28	-11.43	37.4	1.07	478	-0.4353	-0.0246	discard	exp#094 mtf_4h_supertrend_daily_hma_rsi_macd_v2	train
34aa031	mtf_4h_supertrend_daily_hma_rsi_macd_v2	SOLUSDT	-0.2347	5.57	1.37	-19.62	40.1	1.09	479	-0.1411	0.0698	discard	exp#094 mtf_4h_supertrend_daily_hma_rsi_macd_v2	train
23ac239	mtf_12h_fisher_daily_hma_chop_regime_v1	BTCUSDT	-1.1038	9.88	2.39	-2.24	65.7	3.69	35	-0.2782	1.0657	discard	exp#095 mtf_12h_fisher_daily_hma_chop_regime_v1	train
