commit	strategy	symbol	sharpe	return_pct	cagr_pct	max_dd_pct	win_rate	profit_factor	trades	sortino	calmar	status	description	period
6f75f97	mtf_4h_chop_regime_daily_hma_fisher_atr_v1	ETHUSDT	-0.2556	12.03	2.88	-9.54	44.6	1.3	332	-0.1415	0.3022	discard	exp#490 mtf_4h_chop_regime_daily_hma_fisher_atr_v1	train
6f75f97	mtf_4h_chop_regime_daily_hma_fisher_atr_v1	SOLUSDT	-0.1979	8.11	1.98	-15.61	44.1	1.1	281	-0.0981	0.1266	discard	exp#490 mtf_4h_chop_regime_daily_hma_fisher_atr_v1	train
a655062	mtf_12h_donchian_daily_weekly_hma_chop_regime_atr_v1	BTCUSDT	0.147	25.57	5.86	-5.55	55.8	3.53	52	0.0735	1.0566	keep	exp#491 mtf_12h_donchian_daily_weekly_hma_chop_regime_atr_v1	train
a655062	mtf_12h_donchian_daily_weekly_hma_chop_regime_atr_v1	BTCUSDT	-2.501	-3.54	-2.92	-4.63	40.0	0.25	10	-0.8496	-0.6299	discard	exp#491 mtf_12h_donchian_daily_weekly_hma_chop_regime_atr_v1	test
a655062	mtf_12h_donchian_daily_weekly_hma_chop_regime_atr_v1	ETHUSDT	-0.3769	8.95	2.17	-11.75	47.9	1.84	48	-0.1859	0.1843	discard	exp#491 mtf_12h_donchian_daily_weekly_hma_chop_regime_atr_v1	train
a655062	mtf_12h_donchian_daily_weekly_hma_chop_regime_atr_v1	SOLUSDT	0.4429	51.23	10.94	-14.79	46.4	1.9	56	0.2596	0.7397	keep	exp#491 mtf_12h_donchian_daily_weekly_hma_chop_regime_atr_v1	train
a655062	mtf_12h_donchian_daily_weekly_hma_chop_regime_atr_v1	SOLUSDT	-1.1627	-4.1	-3.39	-11.72	27.3	0.61	11	-0.3794	-0.2892	discard	exp#491 mtf_12h_donchian_daily_weekly_hma_chop_regime_atr_v1	test
a655062	mtf_12h_donchian_daily_weekly_hma_chop_regime_atr_v1	BTCUSDT	0.147	25.57	5.86	-5.55	55.8	3.53	52	0.0735	1.0566	discard	exp#491 mtf_12h_donchian_daily_weekly_hma_chop_regime_atr_v1	train
a655062	mtf_12h_donchian_daily_weekly_hma_chop_regime_atr_v1	ETHUSDT	-0.3769	8.95	2.17	-11.75	47.9	1.84	48	-0.1859	0.1843	discard	exp#491 mtf_12h_donchian_daily_weekly_hma_chop_regime_atr_v1	train
a655062	mtf_12h_donchian_daily_weekly_hma_chop_regime_atr_v1	SOLUSDT	0.4429	51.23	10.94	-14.79	46.4	1.9	56	0.2596	0.7397	discard	exp#491 mtf_12h_donchian_daily_weekly_hma_chop_regime_atr_v1	train
49a754d	mtf_1d_supertrend_weekly_hma_rsi_adx_atr_v1	BTCUSDT	-0.101	12.08	2.89	-24.48	39.6	1.21	207	-0.1242	0.1181	discard	exp#492 mtf_1d_supertrend_weekly_hma_rsi_adx_atr_v1	train
49a754d	mtf_1d_supertrend_weekly_hma_rsi_adx_atr_v1	ETHUSDT	-0.7592	-29.77	-8.46	-32.86	29.4	0.87	238	-0.9509	-0.2573	discard	exp#492 mtf_1d_supertrend_weekly_hma_rsi_adx_atr_v1	train
49a754d	mtf_1d_supertrend_weekly_hma_rsi_adx_atr_v1	SOLUSDT	1.1466	237.18	35.65	-18.34	40.2	2.02	179	1.5521	1.9436	keep	exp#492 mtf_1d_supertrend_weekly_hma_rsi_adx_atr_v1	train
49a754d	mtf_1d_supertrend_weekly_hma_rsi_adx_atr_v1	SOLUSDT	-0.5083	-7.95	-6.59	-24.41	39.7	0.85	58	-0.669	-0.2699	discard	exp#492 mtf_1d_supertrend_weekly_hma_rsi_adx_atr_v1	test
49a754d	mtf_1d_supertrend_weekly_hma_rsi_adx_atr_v1	BTCUSDT	-0.101	12.08	2.89	-24.48	39.6	1.21	207	-0.1242	0.1181	discard	exp#492 mtf_1d_supertrend_weekly_hma_rsi_adx_atr_v1	train
49a754d	mtf_1d_supertrend_weekly_hma_rsi_adx_atr_v1	ETHUSDT	-0.7592	-29.77	-8.46	-32.86	29.4	0.87	238	-0.9509	-0.2573	discard	exp#492 mtf_1d_supertrend_weekly_hma_rsi_adx_atr_v1	train
49a754d	mtf_1d_supertrend_weekly_hma_rsi_adx_atr_v1	SOLUSDT	1.1466	237.18	35.65	-18.34	40.2	2.02	179	1.5521	1.9436	discard	exp#492 mtf_1d_supertrend_weekly_hma_rsi_adx_atr_v1	train
81133aa	mtf_15m_supertrend_4h_hma_chop_regime_rsi_atr_v1	BTCUSDT	-11.4127	-98.52	-65.16	-98.55	36.8	0.82	18875	-11.3819	-0.6612	discard	exp#493 mtf_15m_supertrend_4h_hma_chop_regime_rsi_atr_v1	train
81133aa	mtf_15m_supertrend_4h_hma_chop_regime_rsi_atr_v1	ETHUSDT	-9.1847	-98.57	-65.42	-98.58	37.5	0.86	18928	-9.0407	-0.6636	discard	exp#493 mtf_15m_supertrend_4h_hma_chop_regime_rsi_atr_v1	train
81133aa	mtf_15m_supertrend_4h_hma_chop_regime_rsi_atr_v1	SOLUSDT	-5.2912	-98.08	-62.92	-98.36	41.4	1.01	18490	-5.0228	-0.6397	discard	exp#493 mtf_15m_supertrend_4h_hma_chop_regime_rsi_atr_v1	train
81133aa	mtf_15m_supertrend_4h_hma_chop_regime_rsi_atr_v1	BTCUSDT	-11.4127	-98.52	-65.16	-98.55	36.8	0.82	18875	-11.3819	-0.6612	discard	exp#493 mtf_15m_supertrend_4h_hma_chop_regime_rsi_atr_v1	train
81133aa	mtf_15m_supertrend_4h_hma_chop_regime_rsi_atr_v1	ETHUSDT	-9.1847	-98.57	-65.42	-98.58	37.5	0.86	18928	-9.0407	-0.6636	discard	exp#493 mtf_15m_supertrend_4h_hma_chop_regime_rsi_atr_v1	train
81133aa	mtf_15m_supertrend_4h_hma_chop_regime_rsi_atr_v1	SOLUSDT	-5.2912	-98.08	-62.92	-98.36	41.4	1.01	18490	-5.0228	-0.6397	discard	exp#493 mtf_15m_supertrend_4h_hma_chop_regime_rsi_atr_v1	train
