commit	strategy	symbol	sharpe	return_pct	cagr_pct	max_dd_pct	win_rate	profit_factor	trades	sortino	calmar	status	description	period
eaa19ec	mtf_15m_kama_4h_hma_adx_filter_atr_v1	BTCUSDT	-5.4259	-91.84	-46.57	-91.89	24.9	0.97	9531	-5.4845	-0.5068	discard	exp#331 mtf_15m_kama_4h_hma_adx_filter_atr_v1	train
eaa19ec	mtf_15m_kama_4h_hma_adx_filter_atr_v1	ETHUSDT	-4.0119	-90.19	-44.05	-90.28	26.5	1.05	9588	-4.0782	-0.488	discard	exp#331 mtf_15m_kama_4h_hma_adx_filter_atr_v1	train
eaa19ec	mtf_15m_kama_4h_hma_adx_filter_atr_v1	SOLUSDT	-2.5026	-90.5	-44.62	-93.0	29.9	1.15	9480	-2.5129	-0.4798	discard	exp#331 mtf_15m_kama_4h_hma_adx_filter_atr_v1	train
eaa19ec	mtf_15m_kama_4h_hma_adx_filter_atr_v1	BTCUSDT	-5.4259	-91.84	-46.57	-91.89	24.9	0.97	9531	-5.4845	-0.5068	discard	exp#331 mtf_15m_kama_4h_hma_adx_filter_atr_v1	train
eaa19ec	mtf_15m_kama_4h_hma_adx_filter_atr_v1	ETHUSDT	-4.0119	-90.19	-44.05	-90.28	26.5	1.05	9588	-4.0782	-0.488	discard	exp#331 mtf_15m_kama_4h_hma_adx_filter_atr_v1	train
eaa19ec	mtf_15m_kama_4h_hma_adx_filter_atr_v1	SOLUSDT	-2.5026	-90.5	-44.62	-93.0	29.9	1.15	9480	-2.5129	-0.4798	discard	exp#331 mtf_15m_kama_4h_hma_adx_filter_atr_v1	train
a11605d	mtf_30m_supertrend_4h_1d_hma_chop_regime_atr_v1	BTCUSDT	-5.2052	-89.33	-42.87	-89.73	53.0	0.86	8004	-5.1491	-0.4778	discard	exp#332 mtf_30m_supertrend_4h_1d_hma_chop_regime_atr_v1	train
a11605d	mtf_30m_supertrend_4h_1d_hma_chop_regime_atr_v1	ETHUSDT	-3.0565	-80.03	-33.17	-80.32	54.4	1.02	7894	-3.0718	-0.413	discard	exp#332 mtf_30m_supertrend_4h_1d_hma_chop_regime_atr_v1	train
a11605d	mtf_30m_supertrend_4h_1d_hma_chop_regime_atr_v1	SOLUSDT	-1.7317	-77.41	-31.16	-80.21	56.1	1.03	7880	-1.7022	-0.3885	discard	exp#332 mtf_30m_supertrend_4h_1d_hma_chop_regime_atr_v1	train
a11605d	mtf_30m_supertrend_4h_1d_hma_chop_regime_atr_v1	BTCUSDT	-5.2052	-89.33	-42.87	-89.73	53.0	0.86	8004	-5.1491	-0.4778	discard	exp#332 mtf_30m_supertrend_4h_1d_hma_chop_regime_atr_v1	train
a11605d	mtf_30m_supertrend_4h_1d_hma_chop_regime_atr_v1	ETHUSDT	-3.0565	-80.03	-33.17	-80.32	54.4	1.02	7894	-3.0718	-0.413	discard	exp#332 mtf_30m_supertrend_4h_1d_hma_chop_regime_atr_v1	train
a11605d	mtf_30m_supertrend_4h_1d_hma_chop_regime_atr_v1	SOLUSDT	-1.7317	-77.41	-31.16	-80.21	56.1	1.03	7880	-1.7022	-0.3885	discard	exp#332 mtf_30m_supertrend_4h_1d_hma_chop_regime_atr_v1	train
4ae7f68	mtf_1h_crsi_chop_regime_4h_hma_adaptive_atr_v1	BTCUSDT	-1.4263	-22.88	-6.29	-24.07	46.8	1.07	2028	-1.028	-0.2614	discard	exp#333 mtf_1h_crsi_chop_regime_4h_hma_adaptive_atr_v1	train
4ae7f68	mtf_1h_crsi_chop_regime_4h_hma_adaptive_atr_v1	ETHUSDT	-1.0234	-20.28	-5.51	-27.96	49.9	1.05	1972	-0.7404	-0.1972	discard	exp#333 mtf_1h_crsi_chop_regime_4h_hma_adaptive_atr_v1	train
4ae7f68	mtf_1h_crsi_chop_regime_4h_hma_adaptive_atr_v1	SOLUSDT	-0.7289	-26.67	-7.49	-33.91	50.3	1.07	1728	-0.4519	-0.2209	discard	exp#333 mtf_1h_crsi_chop_regime_4h_hma_adaptive_atr_v1	train
4ae7f68	mtf_1h_crsi_chop_regime_4h_hma_adaptive_atr_v1	BTCUSDT	-1.4263	-22.88	-6.29	-24.07	46.8	1.07	2028	-1.028	-0.2614	discard	exp#333 mtf_1h_crsi_chop_regime_4h_hma_adaptive_atr_v1	train
4ae7f68	mtf_1h_crsi_chop_regime_4h_hma_adaptive_atr_v1	ETHUSDT	-1.0234	-20.28	-5.51	-27.96	49.9	1.05	1972	-0.7404	-0.1972	discard	exp#333 mtf_1h_crsi_chop_regime_4h_hma_adaptive_atr_v1	train
4ae7f68	mtf_1h_crsi_chop_regime_4h_hma_adaptive_atr_v1	SOLUSDT	-0.7289	-26.67	-7.49	-33.91	50.3	1.07	1728	-0.4519	-0.2209	discard	exp#333 mtf_1h_crsi_chop_regime_4h_hma_adaptive_atr_v1	train
cc359fc	mtf_4h_kama_fisher_daily_hma_volume_atr_v1	BTCUSDT	-3.6766	-1.95	-0.49	-3.82	39.5	0.8	43	-0.4498	-0.1286	discard	exp#334 mtf_4h_kama_fisher_daily_hma_volume_atr_v1	train
cc359fc	mtf_4h_kama_fisher_daily_hma_volume_atr_v1	ETHUSDT	-2.2742	-0.8	-0.2	-2.54	51.4	0.97	35	-0.2364	-0.0792	discard	exp#334 mtf_4h_kama_fisher_daily_hma_volume_atr_v1	train
cc359fc	mtf_4h_kama_fisher_daily_hma_volume_atr_v1	SOLUSDT	-1.9395	0.02	0.01	-3.92	55.9	1.09	34	-0.1999	0.0014	discard	exp#334 mtf_4h_kama_fisher_daily_hma_volume_atr_v1	train
cc359fc	mtf_4h_kama_fisher_daily_hma_volume_atr_v1	BTCUSDT	-3.6766	-1.95	-0.49	-3.82	39.5	0.8	43	-0.4498	-0.1286	discard	exp#334 mtf_4h_kama_fisher_daily_hma_volume_atr_v1	train
cc359fc	mtf_4h_kama_fisher_daily_hma_volume_atr_v1	ETHUSDT	-2.2742	-0.8	-0.2	-2.54	51.4	0.97	35	-0.2364	-0.0792	discard	exp#334 mtf_4h_kama_fisher_daily_hma_volume_atr_v1	train
cc359fc	mtf_4h_kama_fisher_daily_hma_volume_atr_v1	SOLUSDT	-1.9395	0.02	0.01	-3.92	55.9	1.09	34	-0.1999	0.0014	discard	exp#334 mtf_4h_kama_fisher_daily_hma_volume_atr_v1	train
d827752	mtf_12h_kama_weekly_hma_fisher_chop_atr_v1	BTCUSDT	0.0	0.0	0.0	0.0	0.0	0.0	0	0.0	0.0	discard	exp#335 mtf_12h_kama_weekly_hma_fisher_chop_atr_v1	train
d827752	mtf_12h_kama_weekly_hma_fisher_chop_atr_v1	ETHUSDT	0.0	0.0	0.0	0.0	0.0	0.0	0	0.0	0.0	discard	exp#335 mtf_12h_kama_weekly_hma_fisher_chop_atr_v1	train
d827752	mtf_12h_kama_weekly_hma_fisher_chop_atr_v1	SOLUSDT	0.0	0.0	0.0	0.0	0.0	0.0	0	0.0	0.0	discard	exp#335 mtf_12h_kama_weekly_hma_fisher_chop_atr_v1	train
d827752	mtf_12h_kama_weekly_hma_fisher_chop_atr_v1	BTCUSDT	0.0	0.0	0.0	0.0	0.0	0.0	0	0.0	0.0	discard	exp#335 mtf_12h_kama_weekly_hma_fisher_chop_atr_v1	train
d827752	mtf_12h_kama_weekly_hma_fisher_chop_atr_v1	ETHUSDT	0.0	0.0	0.0	0.0	0.0	0.0	0	0.0	0.0	discard	exp#335 mtf_12h_kama_weekly_hma_fisher_chop_atr_v1	train
d827752	mtf_12h_kama_weekly_hma_fisher_chop_atr_v1	SOLUSDT	0.0	0.0	0.0	0.0	0.0	0.0	0	0.0	0.0	discard	exp#335 mtf_12h_kama_weekly_hma_fisher_chop_atr_v1	train
a1976b5	mtf_1d_dual_momentum_weekly_fisher_kama_vol_v1	BTCUSDT	-1.1686	-18.09	-4.87	-34.52	42.6	0.84	195	-0.957	-0.141	discard	exp#336 mtf_1d_dual_momentum_weekly_fisher_kama_vol_v1	train
a1976b5	mtf_1d_dual_momentum_weekly_fisher_kama_vol_v1	ETHUSDT	-0.7521	-15.83	-4.22	-35.33	46.1	0.94	219	-0.6729	-0.1193	discard	exp#336 mtf_1d_dual_momentum_weekly_fisher_kama_vol_v1	train
a1976b5	mtf_1d_dual_momentum_weekly_fisher_kama_vol_v1	SOLUSDT	0.0144	18.17	4.28	-21.96	47.5	1.14	202	0.0135	0.1948	keep	exp#336 mtf_1d_dual_momentum_weekly_fisher_kama_vol_v1	train
a1976b5	mtf_1d_dual_momentum_weekly_fisher_kama_vol_v1	SOLUSDT	-0.1977	1.15	0.95	-13.8	41.0	1.09	78	-0.1829	0.0686	discard	exp#336 mtf_1d_dual_momentum_weekly_fisher_kama_vol_v1	test
a1976b5	mtf_1d_dual_momentum_weekly_fisher_kama_vol_v1	BTCUSDT	-1.1686	-18.09	-4.87	-34.52	42.6	0.84	195	-0.957	-0.141	discard	exp#336 mtf_1d_dual_momentum_weekly_fisher_kama_vol_v1	train
a1976b5	mtf_1d_dual_momentum_weekly_fisher_kama_vol_v1	ETHUSDT	-0.7521	-15.83	-4.22	-35.33	46.1	0.94	219	-0.6729	-0.1193	discard	exp#336 mtf_1d_dual_momentum_weekly_fisher_kama_vol_v1	train
a1976b5	mtf_1d_dual_momentum_weekly_fisher_kama_vol_v1	SOLUSDT	0.0144	18.17	4.28	-21.96	47.5	1.14	202	0.0135	0.1948	discard	exp#336 mtf_1d_dual_momentum_weekly_fisher_kama_vol_v1	train
8554fb7	mtf_15m_supertrend_dual_hma_4h_1h_rsi_atr_v1	BTCUSDT	0.0	0.0	0.0	0.0	0.0	0.0	0	0.0	0.0	discard	exp#337 mtf_15m_supertrend_dual_hma_4h_1h_rsi_atr_v1	train
8554fb7	mtf_15m_supertrend_dual_hma_4h_1h_rsi_atr_v1	ETHUSDT	0.0	0.0	0.0	0.0	0.0	0.0	0	0.0	0.0	discard	exp#337 mtf_15m_supertrend_dual_hma_4h_1h_rsi_atr_v1	train
8554fb7	mtf_15m_supertrend_dual_hma_4h_1h_rsi_atr_v1	SOLUSDT	0.0	0.0	0.0	0.0	0.0	0.0	0	0.0	0.0	discard	exp#337 mtf_15m_supertrend_dual_hma_4h_1h_rsi_atr_v1	train
8554fb7	mtf_15m_supertrend_dual_hma_4h_1h_rsi_atr_v1	BTCUSDT	0.0	0.0	0.0	0.0	0.0	0.0	0	0.0	0.0	discard	exp#337 mtf_15m_supertrend_dual_hma_4h_1h_rsi_atr_v1	train
8554fb7	mtf_15m_supertrend_dual_hma_4h_1h_rsi_atr_v1	ETHUSDT	0.0	0.0	0.0	0.0	0.0	0.0	0	0.0	0.0	discard	exp#337 mtf_15m_supertrend_dual_hma_4h_1h_rsi_atr_v1	train
8554fb7	mtf_15m_supertrend_dual_hma_4h_1h_rsi_atr_v1	SOLUSDT	0.0	0.0	0.0	0.0	0.0	0.0	0	0.0	0.0	discard	exp#337 mtf_15m_supertrend_dual_hma_4h_1h_rsi_atr_v1	train
f35333e	mtf_30m_keltner_4h_hma_rsi_momentum_atr_v1	BTCUSDT	-4.2133	-27.52	-7.74	-27.87	37.3	0.8	1300	-1.2314	-0.2776	discard	exp#338 mtf_30m_keltner_4h_hma_rsi_momentum_atr_v1	train
f35333e	mtf_30m_keltner_4h_hma_rsi_momentum_atr_v1	ETHUSDT	-3.4839	-29.85	-8.49	-30.15	37.6	0.85	1468	-1.1895	-0.2815	discard	exp#338 mtf_30m_keltner_4h_hma_rsi_momentum_atr_v1	train
f35333e	mtf_30m_keltner_4h_hma_rsi_momentum_atr_v1	SOLUSDT	-1.7886	-23.42	-6.48	-26.98	41.1	0.99	1769	-0.6262	-0.2401	discard	exp#338 mtf_30m_keltner_4h_hma_rsi_momentum_atr_v1	train
f35333e	mtf_30m_keltner_4h_hma_rsi_momentum_atr_v1	BTCUSDT	-4.2133	-27.52	-7.74	-27.87	37.3	0.8	1300	-1.2314	-0.2776	discard	exp#338 mtf_30m_keltner_4h_hma_rsi_momentum_atr_v1	train
f35333e	mtf_30m_keltner_4h_hma_rsi_momentum_atr_v1	ETHUSDT	-3.4839	-29.85	-8.49	-30.15	37.6	0.85	1468	-1.1895	-0.2815	discard	exp#338 mtf_30m_keltner_4h_hma_rsi_momentum_atr_v1	train
f35333e	mtf_30m_keltner_4h_hma_rsi_momentum_atr_v1	SOLUSDT	-1.7886	-23.42	-6.48	-26.98	41.1	0.99	1769	-0.6262	-0.2401	discard	exp#338 mtf_30m_keltner_4h_hma_rsi_momentum_atr_v1	train
f8d7802	mtf_4h_dual_ema_zscore_daily_hma_atr_v1	BTCUSDT	-0.7332	-5.5	-1.41	-27.31	50.3	1.05	1058	-0.6887	-0.0515	discard	exp#340 mtf_4h_dual_ema_zscore_daily_hma_atr_v1	train
f8d7802	mtf_4h_dual_ema_zscore_daily_hma_atr_v1	ETHUSDT	-0.5578	-5.86	-1.5	-25.91	49.8	1.05	1110	-0.5254	-0.0578	discard	exp#340 mtf_4h_dual_ema_zscore_daily_hma_atr_v1	train
f8d7802	mtf_4h_dual_ema_zscore_daily_hma_atr_v1	SOLUSDT	0.264	37.55	8.33	-16.98	52.4	1.13	1095	0.2549	0.4908	keep	exp#340 mtf_4h_dual_ema_zscore_daily_hma_atr_v1	train
f8d7802	mtf_4h_dual_ema_zscore_daily_hma_atr_v1	SOLUSDT	-2.9048	-31.13	-26.42	-32.8	46.0	0.72	365	-2.4941	-0.8055	discard	exp#340 mtf_4h_dual_ema_zscore_daily_hma_atr_v1	test
f8d7802	mtf_4h_dual_ema_zscore_daily_hma_atr_v1	BTCUSDT	-0.7332	-5.5	-1.41	-27.31	50.3	1.05	1058	-0.6887	-0.0515	discard	exp#340 mtf_4h_dual_ema_zscore_daily_hma_atr_v1	train
f8d7802	mtf_4h_dual_ema_zscore_daily_hma_atr_v1	ETHUSDT	-0.5578	-5.86	-1.5	-25.91	49.8	1.05	1110	-0.5254	-0.0578	discard	exp#340 mtf_4h_dual_ema_zscore_daily_hma_atr_v1	train
f8d7802	mtf_4h_dual_ema_zscore_daily_hma_atr_v1	SOLUSDT	0.264	37.55	8.33	-16.98	52.4	1.13	1095	0.2549	0.4908	discard	exp#340 mtf_4h_dual_ema_zscore_daily_hma_atr_v1	train
ab661e4	mtf_12h_regime_chop_crsi_fisher_daily_weekly_hma_atr_v1	BTCUSDT	-0.7762	-0.56	-0.14	-11.43	58.4	1.08	233	-0.5119	-0.0124	discard	exp#341 mtf_12h_regime_chop_crsi_fisher_daily_weekly_hma_atr_v1	train
ab661e4	mtf_12h_regime_chop_crsi_fisher_daily_weekly_hma_atr_v1	ETHUSDT	-1.0248	-14.2	-3.76	-24.41	58.7	0.9	264	-0.6524	-0.154	discard	exp#341 mtf_12h_regime_chop_crsi_fisher_daily_weekly_hma_atr_v1	train
ab661e4	mtf_12h_regime_chop_crsi_fisher_daily_weekly_hma_atr_v1	SOLUSDT	-1.2353	-44.72	-13.82	-50.04	54.9	0.62	257	-0.796	-0.2762	discard	exp#341 mtf_12h_regime_chop_crsi_fisher_daily_weekly_hma_atr_v1	train
ab661e4	mtf_12h_regime_chop_crsi_fisher_daily_weekly_hma_atr_v1	BTCUSDT	-0.7762	-0.56	-0.14	-11.43	58.4	1.08	233	-0.5119	-0.0124	discard	exp#341 mtf_12h_regime_chop_crsi_fisher_daily_weekly_hma_atr_v1	train
ab661e4	mtf_12h_regime_chop_crsi_fisher_daily_weekly_hma_atr_v1	ETHUSDT	-1.0248	-14.2	-3.76	-24.41	58.7	0.9	264	-0.6524	-0.154	discard	exp#341 mtf_12h_regime_chop_crsi_fisher_daily_weekly_hma_atr_v1	train
ab661e4	mtf_12h_regime_chop_crsi_fisher_daily_weekly_hma_atr_v1	SOLUSDT	-1.2353	-44.72	-13.82	-50.04	54.9	0.62	257	-0.796	-0.2762	discard	exp#341 mtf_12h_regime_chop_crsi_fisher_daily_weekly_hma_atr_v1	train
b3dc9e4	mtf_15m_crsi_4h_hma_chop_regime_atr_v1	BTCUSDT	-14.0758	-92.65	-47.95	-92.72	49.1	0.76	19513	-9.1397	-0.5172	discard	exp#343 mtf_15m_crsi_4h_hma_chop_regime_atr_v1	train
b3dc9e4	mtf_15m_crsi_4h_hma_chop_regime_atr_v1	ETHUSDT	-11.6071	-92.89	-48.39	-92.91	49.9	0.78	19579	-7.6833	-0.5208	discard	exp#343 mtf_15m_crsi_4h_hma_chop_regime_atr_v1	train
b3dc9e4	mtf_15m_crsi_4h_hma_chop_regime_atr_v1	SOLUSDT	-7.1961	-93.56	-49.76	-93.68	52.1	0.8	20117	-4.728	-0.5311	discard	exp#343 mtf_15m_crsi_4h_hma_chop_regime_atr_v1	train
b3dc9e4	mtf_15m_crsi_4h_hma_chop_regime_atr_v1	BTCUSDT	-14.0758	-92.65	-47.95	-92.72	49.1	0.76	19513	-9.1397	-0.5172	discard	exp#343 mtf_15m_crsi_4h_hma_chop_regime_atr_v1	train
b3dc9e4	mtf_15m_crsi_4h_hma_chop_regime_atr_v1	ETHUSDT	-11.6071	-92.89	-48.39	-92.91	49.9	0.78	19579	-7.6833	-0.5208	discard	exp#343 mtf_15m_crsi_4h_hma_chop_regime_atr_v1	train
b3dc9e4	mtf_15m_crsi_4h_hma_chop_regime_atr_v1	SOLUSDT	-7.1961	-93.56	-49.76	-93.68	52.1	0.8	20117	-4.728	-0.5311	discard	exp#343 mtf_15m_crsi_4h_hma_chop_regime_atr_v1	train
2910cc1	mtf_30m_kama_4h_hma_rsi_pullback_atr_v1	BTCUSDT	-6.4831	-96.23	-55.96	-96.28	29.3	0.85	10364	-7.9387	-0.5812	discard	exp#344 mtf_30m_kama_4h_hma_rsi_pullback_atr_v1	train
2910cc1	mtf_30m_kama_4h_hma_rsi_pullback_atr_v1	ETHUSDT	-4.6559	-94.72	-52.09	-94.99	31.1	0.93	10267	-5.8279	-0.5484	discard	exp#344 mtf_30m_kama_4h_hma_rsi_pullback_atr_v1	train
2910cc1	mtf_30m_kama_4h_hma_rsi_pullback_atr_v1	SOLUSDT	-2.3549	-91.35	-45.9	-93.69	35.0	1.04	10039	-2.871	-0.4899	discard	exp#344 mtf_30m_kama_4h_hma_rsi_pullback_atr_v1	train
2910cc1	mtf_30m_kama_4h_hma_rsi_pullback_atr_v1	BTCUSDT	-6.4831	-96.23	-55.96	-96.28	29.3	0.85	10364	-7.9387	-0.5812	discard	exp#344 mtf_30m_kama_4h_hma_rsi_pullback_atr_v1	train
2910cc1	mtf_30m_kama_4h_hma_rsi_pullback_atr_v1	ETHUSDT	-4.6559	-94.72	-52.09	-94.99	31.1	0.93	10267	-5.8279	-0.5484	discard	exp#344 mtf_30m_kama_4h_hma_rsi_pullback_atr_v1	train
2910cc1	mtf_30m_kama_4h_hma_rsi_pullback_atr_v1	SOLUSDT	-2.3549	-91.35	-45.9	-93.69	35.0	1.04	10039	-2.871	-0.4899	discard	exp#344 mtf_30m_kama_4h_hma_rsi_pullback_atr_v1	train
8f4e293	mtf_1h_hma_crossover_4h_trend_rsi_momentum_atr_v1	BTCUSDT	-2.1227	-58.97	-19.98	-60.08	27.7	1.06	3947	-2.5797	-0.3325	discard	exp#345 mtf_1h_hma_crossover_4h_trend_rsi_momentum_atr_v1	train
8f4e293	mtf_1h_hma_crossover_4h_trend_rsi_momentum_atr_v1	ETHUSDT	-1.5266	-55.18	-18.19	-55.94	28.6	1.07	3902	-1.8492	-0.3252	discard	exp#345 mtf_1h_hma_crossover_4h_trend_rsi_momentum_atr_v1	train
8f4e293	mtf_1h_hma_crossover_4h_trend_rsi_momentum_atr_v1	SOLUSDT	-0.3674	-26.0	-7.28	-45.62	31.8	1.19	3792	-0.4329	-0.1596	discard	exp#345 mtf_1h_hma_crossover_4h_trend_rsi_momentum_atr_v1	train
8f4e293	mtf_1h_hma_crossover_4h_trend_rsi_momentum_atr_v1	BTCUSDT	-2.1227	-58.97	-19.98	-60.08	27.7	1.06	3947	-2.5797	-0.3325	discard	exp#345 mtf_1h_hma_crossover_4h_trend_rsi_momentum_atr_v1	train
8f4e293	mtf_1h_hma_crossover_4h_trend_rsi_momentum_atr_v1	ETHUSDT	-1.5266	-55.18	-18.19	-55.94	28.6	1.07	3902	-1.8492	-0.3252	discard	exp#345 mtf_1h_hma_crossover_4h_trend_rsi_momentum_atr_v1	train
8f4e293	mtf_1h_hma_crossover_4h_trend_rsi_momentum_atr_v1	SOLUSDT	-0.3674	-26.0	-7.28	-45.62	31.8	1.19	3792	-0.4329	-0.1596	discard	exp#345 mtf_1h_hma_crossover_4h_trend_rsi_momentum_atr_v1	train
fc1d170	mtf_4h_adx_trend_daily_hma_rsi_volume_atr_v1	BTCUSDT	-2.3575	-49.81	-15.84	-56.69	34.0	0.87	1890	-2.4315	-0.2794	discard	exp#346 mtf_4h_adx_trend_daily_hma_rsi_volume_atr_v1	train
fc1d170	mtf_4h_adx_trend_daily_hma_rsi_volume_atr_v1	ETHUSDT	-1.2861	-34.68	-10.11	-44.25	35.9	0.97	1908	-1.3689	-0.2284	discard	exp#346 mtf_4h_adx_trend_daily_hma_rsi_volume_atr_v1	train
fc1d170	mtf_4h_adx_trend_daily_hma_rsi_volume_atr_v1	SOLUSDT	-0.4015	-13.94	-3.7	-29.06	38.5	1.03	1851	-0.4244	-0.1272	discard	exp#346 mtf_4h_adx_trend_daily_hma_rsi_volume_atr_v1	train
fc1d170	mtf_4h_adx_trend_daily_hma_rsi_volume_atr_v1	BTCUSDT	-2.3575	-49.81	-15.84	-56.69	34.0	0.87	1890	-2.4315	-0.2794	discard	exp#346 mtf_4h_adx_trend_daily_hma_rsi_volume_atr_v1	train
fc1d170	mtf_4h_adx_trend_daily_hma_rsi_volume_atr_v1	ETHUSDT	-1.2861	-34.68	-10.11	-44.25	35.9	0.97	1908	-1.3689	-0.2284	discard	exp#346 mtf_4h_adx_trend_daily_hma_rsi_volume_atr_v1	train
fc1d170	mtf_4h_adx_trend_daily_hma_rsi_volume_atr_v1	SOLUSDT	-0.4015	-13.94	-3.7	-29.06	38.5	1.03	1851	-0.4244	-0.1272	discard	exp#346 mtf_4h_adx_trend_daily_hma_rsi_volume_atr_v1	train
a43b317	mtf_12h_dual_supertrend_daily_hma_rsi_momentum_atr_v1	BTCUSDT	-0.4951	-15.54	-4.14	-37.58	28.5	1.32	351	-0.6314	-0.1101	discard	exp#347 mtf_12h_dual_supertrend_daily_hma_rsi_momentum_atr_v1	train
a43b317	mtf_12h_dual_supertrend_daily_hma_rsi_momentum_atr_v1	ETHUSDT	-0.2876	-11.8	-3.09	-34.72	27.4	1.29	372	-0.3845	-0.089	discard	exp#347 mtf_12h_dual_supertrend_daily_hma_rsi_momentum_atr_v1	train
a43b317	mtf_12h_dual_supertrend_daily_hma_rsi_momentum_atr_v1	SOLUSDT	0.6526	125.51	22.64	-32.91	33.2	1.97	310	0.853	0.6879	keep	exp#347 mtf_12h_dual_supertrend_daily_hma_rsi_momentum_atr_v1	train
a43b317	mtf_12h_dual_supertrend_daily_hma_rsi_momentum_atr_v1	SOLUSDT	-0.2208	-3.7	-3.05	-27.86	32.5	1.29	120	-0.3079	-0.1095	discard	exp#347 mtf_12h_dual_supertrend_daily_hma_rsi_momentum_atr_v1	test
a43b317	mtf_12h_dual_supertrend_daily_hma_rsi_momentum_atr_v1	BTCUSDT	-0.4951	-15.54	-4.14	-37.58	28.5	1.32	351	-0.6314	-0.1101	discard	exp#347 mtf_12h_dual_supertrend_daily_hma_rsi_momentum_atr_v1	train
a43b317	mtf_12h_dual_supertrend_daily_hma_rsi_momentum_atr_v1	ETHUSDT	-0.2876	-11.8	-3.09	-34.72	27.4	1.29	372	-0.3845	-0.089	discard	exp#347 mtf_12h_dual_supertrend_daily_hma_rsi_momentum_atr_v1	train
a43b317	mtf_12h_dual_supertrend_daily_hma_rsi_momentum_atr_v1	SOLUSDT	0.6526	125.51	22.64	-32.91	33.2	1.97	310	0.853	0.6879	discard	exp#347 mtf_12h_dual_supertrend_daily_hma_rsi_momentum_atr_v1	train
bb75883	mtf_1d_kama_weekly_hma_rsi_momentum_atr_v1	BTCUSDT	-0.1553	8.03	1.95	-23.82	35.8	1.59	212	-0.1962	0.0819	discard	exp#348 mtf_1d_kama_weekly_hma_rsi_momentum_atr_v1	train
bb75883	mtf_1d_kama_weekly_hma_rsi_momentum_atr_v1	ETHUSDT	-0.9642	-39.64	-11.86	-46.4	31.0	0.85	187	-1.0587	-0.2555	discard	exp#348 mtf_1d_kama_weekly_hma_rsi_momentum_atr_v1	train
bb75883	mtf_1d_kama_weekly_hma_rsi_momentum_atr_v1	SOLUSDT	0.9052	179.41	29.4	-26.42	41.7	2.38	216	1.2146	1.1131	keep	exp#348 mtf_1d_kama_weekly_hma_rsi_momentum_atr_v1	train
bb75883	mtf_1d_kama_weekly_hma_rsi_momentum_atr_v1	SOLUSDT	0.6129	17.76	14.39	-12.1	47.9	1.69	48	0.616	1.1896	keep	exp#348 mtf_1d_kama_weekly_hma_rsi_momentum_atr_v1	test
bb75883	mtf_1d_kama_weekly_hma_rsi_momentum_atr_v1	BTCUSDT	-0.1553	8.03	1.95	-23.82	35.8	1.59	212	-0.1962	0.0819	discard	exp#348 mtf_1d_kama_weekly_hma_rsi_momentum_atr_v1	train
bb75883	mtf_1d_kama_weekly_hma_rsi_momentum_atr_v1	ETHUSDT	-0.9642	-39.64	-11.86	-46.4	31.0	0.85	187	-1.0587	-0.2555	discard	exp#348 mtf_1d_kama_weekly_hma_rsi_momentum_atr_v1	train
bb75883	mtf_1d_kama_weekly_hma_rsi_momentum_atr_v1	SOLUSDT	0.9052	179.41	29.4	-26.42	41.7	2.38	216	1.2146	1.1131	keep	exp#348 mtf_1d_kama_weekly_hma_rsi_momentum_atr_v1	train
bb75883	mtf_1d_kama_weekly_hma_rsi_momentum_atr_v1	SOLUSDT	0.6129	17.76	14.39	-12.1	47.9	1.69	48	0.616	1.1896	keep	exp#348 mtf_1d_kama_weekly_hma_rsi_momentum_atr_v1	test
498b57b	mtf_15m_supertrend_4h_hma_rsi_atr_v2	BTCUSDT	0.0	0.0	0.0	0.0	0.0	0.0	0	0.0	0.0	discard	exp#349 mtf_15m_supertrend_4h_hma_rsi_atr_v2	train
498b57b	mtf_15m_supertrend_4h_hma_rsi_atr_v2	ETHUSDT	0.0	0.0	0.0	0.0	0.0	0.0	0	0.0	0.0	discard	exp#349 mtf_15m_supertrend_4h_hma_rsi_atr_v2	train
498b57b	mtf_15m_supertrend_4h_hma_rsi_atr_v2	SOLUSDT	0.0	0.0	0.0	0.0	0.0	0.0	0	0.0	0.0	discard	exp#349 mtf_15m_supertrend_4h_hma_rsi_atr_v2	train
498b57b	mtf_15m_supertrend_4h_hma_rsi_atr_v2	BTCUSDT	0.0	0.0	0.0	0.0	0.0	0.0	0	0.0	0.0	discard	exp#349 mtf_15m_supertrend_4h_hma_rsi_atr_v2	train
498b57b	mtf_15m_supertrend_4h_hma_rsi_atr_v2	ETHUSDT	0.0	0.0	0.0	0.0	0.0	0.0	0	0.0	0.0	discard	exp#349 mtf_15m_supertrend_4h_hma_rsi_atr_v2	train
498b57b	mtf_15m_supertrend_4h_hma_rsi_atr_v2	SOLUSDT	0.0	0.0	0.0	0.0	0.0	0.0	0	0.0	0.0	discard	exp#349 mtf_15m_supertrend_4h_hma_rsi_atr_v2	train
fa7b9da	mtf_30m_kama_4h_hma_rsi7_momentum_atr_v1	BTCUSDT	-15.0064	-98.14	-63.1	-98.16	36.7	0.72	14428	-13.0134	-0.6428	discard	exp#350 mtf_30m_kama_4h_hma_rsi7_momentum_atr_v1	train
fa7b9da	mtf_30m_kama_4h_hma_rsi7_momentum_atr_v1	ETHUSDT	-11.4682	-98.05	-62.65	-98.12	38.2	0.81	14369	-9.7331	-0.6385	discard	exp#350 mtf_30m_kama_4h_hma_rsi7_momentum_atr_v1	train
fa7b9da	mtf_30m_kama_4h_hma_rsi7_momentum_atr_v1	SOLUSDT	-7.2047	-97.97	-62.42	-98.15	42.7	0.88	13990	-5.9767	-0.636	discard	exp#350 mtf_30m_kama_4h_hma_rsi7_momentum_atr_v1	train
fa7b9da	mtf_30m_kama_4h_hma_rsi7_momentum_atr_v1	BTCUSDT	-15.0064	-98.14	-63.1	-98.16	36.7	0.72	14428	-13.0134	-0.6428	discard	exp#350 mtf_30m_kama_4h_hma_rsi7_momentum_atr_v1	train
fa7b9da	mtf_30m_kama_4h_hma_rsi7_momentum_atr_v1	ETHUSDT	-11.4682	-98.05	-62.65	-98.12	38.2	0.81	14369	-9.7331	-0.6385	discard	exp#350 mtf_30m_kama_4h_hma_rsi7_momentum_atr_v1	train
fa7b9da	mtf_30m_kama_4h_hma_rsi7_momentum_atr_v1	SOLUSDT	-7.2047	-97.97	-62.42	-98.15	42.7	0.88	13990	-5.9767	-0.636	discard	exp#350 mtf_30m_kama_4h_hma_rsi7_momentum_atr_v1	train
0c61d50	mtf_1h_hma_4h_trend_rsi_loose_atr_v1	BTCUSDT	-2.2028	-70.93	-26.59	-71.57	34.3	1.15	4656	-2.7453	-0.3715	discard	exp#351 mtf_1h_hma_4h_trend_rsi_loose_atr_v1	train
0c61d50	mtf_1h_hma_4h_trend_rsi_loose_atr_v1	ETHUSDT	-2.2006	-80.28	-33.38	-81.49	35.0	1.1	4736	-2.705	-0.4097	discard	exp#351 mtf_1h_hma_4h_trend_rsi_loose_atr_v1	train
0c61d50	mtf_1h_hma_4h_trend_rsi_loose_atr_v1	SOLUSDT	-0.3708	-38.54	-11.5	-62.49	38.4	1.29	4649	-0.4458	-0.1841	discard	exp#351 mtf_1h_hma_4h_trend_rsi_loose_atr_v1	train
0c61d50	mtf_1h_hma_4h_trend_rsi_loose_atr_v1	BTCUSDT	-2.2028	-70.93	-26.59	-71.57	34.3	1.15	4656	-2.7453	-0.3715	discard	exp#351 mtf_1h_hma_4h_trend_rsi_loose_atr_v1	train
0c61d50	mtf_1h_hma_4h_trend_rsi_loose_atr_v1	ETHUSDT	-2.2006	-80.28	-33.38	-81.49	35.0	1.1	4736	-2.705	-0.4097	discard	exp#351 mtf_1h_hma_4h_trend_rsi_loose_atr_v1	train
0c61d50	mtf_1h_hma_4h_trend_rsi_loose_atr_v1	SOLUSDT	-0.3708	-38.54	-11.5	-62.49	38.4	1.29	4649	-0.4458	-0.1841	discard	exp#351 mtf_1h_hma_4h_trend_rsi_loose_atr_v1	train
e20e36d	mtf_4h_donchian_daily_hma_chop_regime_atr_v1	BTCUSDT	-1.1235	-7.71	-1.99	-18.64	39.7	1.01	529	-0.6168	-0.1066	discard	exp#352 mtf_4h_donchian_daily_hma_chop_regime_atr_v1	train
e20e36d	mtf_4h_donchian_daily_hma_chop_regime_atr_v1	ETHUSDT	-1.3597	-21.81	-5.97	-28.61	40.4	0.87	572	-0.7001	-0.2086	discard	exp#352 mtf_4h_donchian_daily_hma_chop_regime_atr_v1	train
