commit	strategy	symbol	sharpe	return_pct	cagr_pct	max_dd_pct	win_rate	profit_factor	trades	sortino	calmar	status	description	period
727b764	mtf_1h_kama_4h_hma_chop_rsi_v1	BTCUSDT	-1.8596	-47.15	-14.75	-49.29	29.5	1.06	2306	-1.807	-0.2991	discard	exp#051 mtf_1h_kama_4h_hma_chop_rsi_v1	train
727b764	mtf_1h_kama_4h_hma_chop_rsi_v1	ETHUSDT	-1.4155	-46.17	-14.35	-46.99	30.3	1.08	2307	-1.3792	-0.3055	discard	exp#051 mtf_1h_kama_4h_hma_chop_rsi_v1	train
727b764	mtf_1h_kama_4h_hma_chop_rsi_v1	SOLUSDT	-0.6339	-37.59	-11.16	-53.0	33.3	1.21	2354	-0.5956	-0.2106	discard	exp#051 mtf_1h_kama_4h_hma_chop_rsi_v1	train
727b764	mtf_1h_kama_4h_hma_chop_rsi_v1	BTCUSDT	-1.8596	-47.15	-14.75	-49.29	29.5	1.06	2306	-1.807	-0.2991	discard	exp#051 mtf_1h_kama_4h_hma_chop_rsi_v1	train
727b764	mtf_1h_kama_4h_hma_chop_rsi_v1	ETHUSDT	-1.4155	-46.17	-14.35	-46.99	30.3	1.08	2307	-1.3792	-0.3055	discard	exp#051 mtf_1h_kama_4h_hma_chop_rsi_v1	train
727b764	mtf_1h_kama_4h_hma_chop_rsi_v1	SOLUSDT	-0.6339	-37.59	-11.16	-53.0	33.3	1.21	2354	-0.5956	-0.2106	discard	exp#051 mtf_1h_kama_4h_hma_chop_rsi_v1	train
2eb842f	mtf_4h_supertrend_daily_hma_rsi_momentum_v1	BTCUSDT	-0.2467	11.74	2.82	-12.18	33.4	1.67	317	-0.1751	0.2313	discard	exp#052 mtf_4h_supertrend_daily_hma_rsi_momentum_v1	train
2eb842f	mtf_4h_supertrend_daily_hma_rsi_momentum_v1	ETHUSDT	-0.0602	17.15	4.04	-17.32	33.7	1.72	326	-0.0441	0.2332	discard	exp#052 mtf_4h_supertrend_daily_hma_rsi_momentum_v1	train
2eb842f	mtf_4h_supertrend_daily_hma_rsi_momentum_v1	SOLUSDT	0.1425	26.92	6.17	-26.62	36.2	1.76	340	0.1079	0.2316	keep	exp#052 mtf_4h_supertrend_daily_hma_rsi_momentum_v1	train
2eb842f	mtf_4h_supertrend_daily_hma_rsi_momentum_v1	SOLUSDT	-0.4091	-0.11	-0.09	-12.31	33.0	1.41	97	-0.2819	-0.0073	discard	exp#052 mtf_4h_supertrend_daily_hma_rsi_momentum_v1	test
2eb842f	mtf_4h_supertrend_daily_hma_rsi_momentum_v1	BTCUSDT	-0.2467	11.74	2.82	-12.18	33.4	1.67	317	-0.1751	0.2313	discard	exp#052 mtf_4h_supertrend_daily_hma_rsi_momentum_v1	train
2eb842f	mtf_4h_supertrend_daily_hma_rsi_momentum_v1	ETHUSDT	-0.0602	17.15	4.04	-17.32	33.7	1.72	326	-0.0441	0.2332	discard	exp#052 mtf_4h_supertrend_daily_hma_rsi_momentum_v1	train
2eb842f	mtf_4h_supertrend_daily_hma_rsi_momentum_v1	SOLUSDT	0.1425	26.92	6.17	-26.62	36.2	1.76	340	0.1079	0.2316	discard	exp#052 mtf_4h_supertrend_daily_hma_rsi_momentum_v1	train
601be06	mtf_12h_fisher_daily_hma_chop_regime_v1	BTCUSDT	-1.2241	-33.69	-9.76	-38.03	30.7	0.83	502	-1.2645	-0.2568	discard	exp#053 mtf_12h_fisher_daily_hma_chop_regime_v1	train
601be06	mtf_12h_fisher_daily_hma_chop_regime_v1	ETHUSDT	-0.8189	-28.55	-8.06	-36.06	33.5	0.9	507	-0.868	-0.2236	discard	exp#053 mtf_12h_fisher_daily_hma_chop_regime_v1	train
601be06	mtf_12h_fisher_daily_hma_chop_regime_v1	SOLUSDT	-0.1161	-3.07	-0.78	-39.63	38.0	1.06	497	-0.1243	-0.0197	discard	exp#053 mtf_12h_fisher_daily_hma_chop_regime_v1	train
601be06	mtf_12h_fisher_daily_hma_chop_regime_v1	BTCUSDT	-1.2241	-33.69	-9.76	-38.03	30.7	0.83	502	-1.2645	-0.2568	discard	exp#053 mtf_12h_fisher_daily_hma_chop_regime_v1	train
601be06	mtf_12h_fisher_daily_hma_chop_regime_v1	ETHUSDT	-0.8189	-28.55	-8.06	-36.06	33.5	0.9	507	-0.868	-0.2236	discard	exp#053 mtf_12h_fisher_daily_hma_chop_regime_v1	train
601be06	mtf_12h_fisher_daily_hma_chop_regime_v1	SOLUSDT	-0.1161	-3.07	-0.78	-39.63	38.0	1.06	497	-0.1243	-0.0197	discard	exp#053 mtf_12h_fisher_daily_hma_chop_regime_v1	train
62eb9a4	mtf_1d_supertrend_weekly_hma_chop_regime_v1	BTCUSDT	-3.58	2.38	0.59	-0.4	66.7	37.42	3	-1.4048	1.4589	discard	exp#054 mtf_1d_supertrend_weekly_hma_chop_regime_v1	train
62eb9a4	mtf_1d_supertrend_weekly_hma_chop_regime_v1	ETHUSDT	-32.1934	0.29	0.07	-0.01	100.0	inf	1	0.0	5.8609	discard	exp#054 mtf_1d_supertrend_weekly_hma_chop_regime_v1	train
62eb9a4	mtf_1d_supertrend_weekly_hma_chop_regime_v1	SOLUSDT	-4.1419	-5.84	-1.5	-5.84	0.0	0.0	3	-0.4147	-0.2565	discard	exp#054 mtf_1d_supertrend_weekly_hma_chop_regime_v1	train
62eb9a4	mtf_1d_supertrend_weekly_hma_chop_regime_v1	BTCUSDT	-3.58	2.38	0.59	-0.4	66.7	37.42	3	-1.4048	1.4589	discard	exp#054 mtf_1d_supertrend_weekly_hma_chop_regime_v1	train
62eb9a4	mtf_1d_supertrend_weekly_hma_chop_regime_v1	ETHUSDT	-32.1934	0.29	0.07	-0.01	100.0	inf	1	0.0	5.8609	discard	exp#054 mtf_1d_supertrend_weekly_hma_chop_regime_v1	train
62eb9a4	mtf_1d_supertrend_weekly_hma_chop_regime_v1	SOLUSDT	-4.1419	-5.84	-1.5	-5.84	0.0	0.0	3	-0.4147	-0.2565	discard	exp#054 mtf_1d_supertrend_weekly_hma_chop_regime_v1	train
dc8aea8	mtf_15m_supertrend_4h_1h_hma_rsi_volume_v1	BTCUSDT	-3.7945	-67.74	-24.65	-69.02	32.7	1.15	5268	-3.087	-0.3572	discard	exp#055 mtf_15m_supertrend_4h_1h_hma_rsi_volume_v1	train
dc8aea8	mtf_15m_supertrend_4h_1h_hma_rsi_volume_v1	ETHUSDT	-2.9672	-65.87	-23.58	-66.28	35.6	1.19	5352	-2.4128	-0.3558	discard	exp#055 mtf_15m_supertrend_4h_1h_hma_rsi_volume_v1	train
dc8aea8	mtf_15m_supertrend_4h_1h_hma_rsi_volume_v1	SOLUSDT	-0.771	-33.5	-9.74	-54.7	37.1	1.4	5248	-0.6725	-0.178	discard	exp#055 mtf_15m_supertrend_4h_1h_hma_rsi_volume_v1	train
dc8aea8	mtf_15m_supertrend_4h_1h_hma_rsi_volume_v1	BTCUSDT	-3.7945	-67.74	-24.65	-69.02	32.7	1.15	5268	-3.087	-0.3572	discard	exp#055 mtf_15m_supertrend_4h_1h_hma_rsi_volume_v1	train
dc8aea8	mtf_15m_supertrend_4h_1h_hma_rsi_volume_v1	ETHUSDT	-2.9672	-65.87	-23.58	-66.28	35.6	1.19	5352	-2.4128	-0.3558	discard	exp#055 mtf_15m_supertrend_4h_1h_hma_rsi_volume_v1	train
dc8aea8	mtf_15m_supertrend_4h_1h_hma_rsi_volume_v1	SOLUSDT	-0.771	-33.5	-9.74	-54.7	37.1	1.4	5248	-0.6725	-0.178	discard	exp#055 mtf_15m_supertrend_4h_1h_hma_rsi_volume_v1	train
fd6cbc8	mtf_30m_rsi_4h_hma_volume_v1	BTCUSDT	-6.7997	-74.23	-28.76	-74.86	48.8	0.8	5711	-3.6886	-0.3842	discard	exp#056 mtf_30m_rsi_4h_hma_volume_v1	train
fd6cbc8	mtf_30m_rsi_4h_hma_volume_v1	ETHUSDT	-4.4788	-65.89	-23.59	-66.42	50.7	0.9	5691	-2.4506	-0.3552	discard	exp#056 mtf_30m_rsi_4h_hma_volume_v1	train
fd6cbc8	mtf_30m_rsi_4h_hma_volume_v1	SOLUSDT	-2.532	-62.93	-22.05	-63.4	51.5	0.94	5596	-1.3524	-0.3479	discard	exp#056 mtf_30m_rsi_4h_hma_volume_v1	train
fd6cbc8	mtf_30m_rsi_4h_hma_volume_v1	BTCUSDT	-6.7997	-74.23	-28.76	-74.86	48.8	0.8	5711	-3.6886	-0.3842	discard	exp#056 mtf_30m_rsi_4h_hma_volume_v1	train
fd6cbc8	mtf_30m_rsi_4h_hma_volume_v1	ETHUSDT	-4.4788	-65.89	-23.59	-66.42	50.7	0.9	5691	-2.4506	-0.3552	discard	exp#056 mtf_30m_rsi_4h_hma_volume_v1	train
fd6cbc8	mtf_30m_rsi_4h_hma_volume_v1	SOLUSDT	-2.532	-62.93	-22.05	-63.4	51.5	0.94	5596	-1.3524	-0.3479	discard	exp#056 mtf_30m_rsi_4h_hma_volume_v1	train
1491da6	mtf_1h_regime_crsi_fisher_4h_hma_v1	BTCUSDT	-4.0804	-50.87	-16.29	-53.6	55.3	0.81	3021	-2.2766	-0.3039	discard	exp#057 mtf_1h_regime_crsi_fisher_4h_hma_v1	train
1491da6	mtf_1h_regime_crsi_fisher_4h_hma_v1	ETHUSDT	-3.2246	-50.91	-16.31	-55.35	53.7	0.84	3000	-1.8473	-0.2946	discard	exp#057 mtf_1h_regime_crsi_fisher_4h_hma_v1	train
1491da6	mtf_1h_regime_crsi_fisher_4h_hma_v1	SOLUSDT	-1.3806	-33.5	-9.74	-40.55	57.7	0.98	3108	-0.7952	-0.2401	discard	exp#057 mtf_1h_regime_crsi_fisher_4h_hma_v1	train
1491da6	mtf_1h_regime_crsi_fisher_4h_hma_v1	BTCUSDT	-4.0804	-50.87	-16.29	-53.6	55.3	0.81	3021	-2.2766	-0.3039	discard	exp#057 mtf_1h_regime_crsi_fisher_4h_hma_v1	train
1491da6	mtf_1h_regime_crsi_fisher_4h_hma_v1	ETHUSDT	-3.2246	-50.91	-16.31	-55.35	53.7	0.84	3000	-1.8473	-0.2946	discard	exp#057 mtf_1h_regime_crsi_fisher_4h_hma_v1	train
1491da6	mtf_1h_regime_crsi_fisher_4h_hma_v1	SOLUSDT	-1.3806	-33.5	-9.74	-40.55	57.7	0.98	3108	-0.7952	-0.2401	discard	exp#057 mtf_1h_regime_crsi_fisher_4h_hma_v1	train
6d9d3ce	mtf_12h_donchian_daily_weekly_hma_volume_v1	BTCUSDT	-1.034	1.98	0.49	-10.35	55.4	1.13	157	-0.4344	0.0476	discard	exp#059 mtf_12h_donchian_daily_weekly_hma_volume_v1	train
6d9d3ce	mtf_12h_donchian_daily_weekly_hma_volume_v1	ETHUSDT	-0.4241	10.69	2.57	-6.09	51.3	1.32	158	-0.2141	0.4222	discard	exp#059 mtf_12h_donchian_daily_weekly_hma_volume_v1	train
6d9d3ce	mtf_12h_donchian_daily_weekly_hma_volume_v1	SOLUSDT	0.1893	28.19	6.43	-8.69	47.2	1.49	161	0.111	0.7399	keep	exp#059 mtf_12h_donchian_daily_weekly_hma_volume_v1	train
6d9d3ce	mtf_12h_donchian_daily_weekly_hma_volume_v1	SOLUSDT	-0.2833	4.05	3.32	-5.38	50.0	1.31	50	-0.1695	0.6166	discard	exp#059 mtf_12h_donchian_daily_weekly_hma_volume_v1	test
6d9d3ce	mtf_12h_donchian_daily_weekly_hma_volume_v1	BTCUSDT	-1.034	1.98	0.49	-10.35	55.4	1.13	157	-0.4344	0.0476	discard	exp#059 mtf_12h_donchian_daily_weekly_hma_volume_v1	train
6d9d3ce	mtf_12h_donchian_daily_weekly_hma_volume_v1	ETHUSDT	-0.4241	10.69	2.57	-6.09	51.3	1.32	158	-0.2141	0.4222	discard	exp#059 mtf_12h_donchian_daily_weekly_hma_volume_v1	train
6d9d3ce	mtf_12h_donchian_daily_weekly_hma_volume_v1	SOLUSDT	0.1893	28.19	6.43	-8.69	47.2	1.49	161	0.111	0.7399	discard	exp#059 mtf_12h_donchian_daily_weekly_hma_volume_v1	train
4b9a66b	mtf_1d_donchian_weekly_hma_volume_v1	BTCUSDT	-0.7136	0.19	0.05	-11.26	47.6	1.1	82	-0.384	0.0042	discard	exp#060 mtf_1d_donchian_weekly_hma_volume_v1	train
4b9a66b	mtf_1d_donchian_weekly_hma_volume_v1	ETHUSDT	-0.7121	-3.1	-0.78	-13.34	44.6	0.98	74	-0.3264	-0.0588	discard	exp#060 mtf_1d_donchian_weekly_hma_volume_v1	train
4b9a66b	mtf_1d_donchian_weekly_hma_volume_v1	SOLUSDT	-0.1575	5.4	1.33	-26.3	53.0	1.18	83	-0.0788	0.0504	discard	exp#060 mtf_1d_donchian_weekly_hma_volume_v1	train
4b9a66b	mtf_1d_donchian_weekly_hma_volume_v1	BTCUSDT	-0.7136	0.19	0.05	-11.26	47.6	1.1	82	-0.384	0.0042	discard	exp#060 mtf_1d_donchian_weekly_hma_volume_v1	train
4b9a66b	mtf_1d_donchian_weekly_hma_volume_v1	ETHUSDT	-0.7121	-3.1	-0.78	-13.34	44.6	0.98	74	-0.3264	-0.0588	discard	exp#060 mtf_1d_donchian_weekly_hma_volume_v1	train
4b9a66b	mtf_1d_donchian_weekly_hma_volume_v1	SOLUSDT	-0.1575	5.4	1.33	-26.3	53.0	1.18	83	-0.0788	0.0504	discard	exp#060 mtf_1d_donchian_weekly_hma_volume_v1	train
aca0c7e	mtf_15m_fisher_4h_hma_trend_v1	BTCUSDT	-7.7715	-24.91	-6.92	-25.08	40.0	0.7	1244	-1.5195	-0.2757	discard	exp#061 mtf_15m_fisher_4h_hma_trend_v1	train
aca0c7e	mtf_15m_fisher_4h_hma_trend_v1	ETHUSDT	-5.389	-21.78	-5.96	-22.15	41.2	0.81	1198	-1.0998	-0.2691	discard	exp#061 mtf_15m_fisher_4h_hma_trend_v1	train
aca0c7e	mtf_15m_fisher_4h_hma_trend_v1	SOLUSDT	-3.8031	-26.45	-7.42	-26.45	46.9	0.81	1241	-0.6685	-0.2806	discard	exp#061 mtf_15m_fisher_4h_hma_trend_v1	train
aca0c7e	mtf_15m_fisher_4h_hma_trend_v1	BTCUSDT	-7.7715	-24.91	-6.92	-25.08	40.0	0.7	1244	-1.5195	-0.2757	discard	exp#061 mtf_15m_fisher_4h_hma_trend_v1	train
aca0c7e	mtf_15m_fisher_4h_hma_trend_v1	ETHUSDT	-5.389	-21.78	-5.96	-22.15	41.2	0.81	1198	-1.0998	-0.2691	discard	exp#061 mtf_15m_fisher_4h_hma_trend_v1	train
aca0c7e	mtf_15m_fisher_4h_hma_trend_v1	SOLUSDT	-3.8031	-26.45	-7.42	-26.45	46.9	0.81	1241	-0.6685	-0.2806	discard	exp#061 mtf_15m_fisher_4h_hma_trend_v1	train
ec2605f	mtf_30m_regime_adaptive_4h_adx_1d_hma_v1	BTCUSDT	-5.1534	-51.78	-16.68	-52.08	53.8	0.8	2802	-2.6528	-0.3203	discard	exp#062 mtf_30m_regime_adaptive_4h_adx_1d_hma_v1	train
ec2605f	mtf_30m_regime_adaptive_4h_adx_1d_hma_v1	ETHUSDT	-3.7913	-50.03	-15.93	-52.16	55.8	0.88	2846	-1.9225	-0.3054	discard	exp#062 mtf_30m_regime_adaptive_4h_adx_1d_hma_v1	train
ec2605f	mtf_30m_regime_adaptive_4h_adx_1d_hma_v1	SOLUSDT	-1.8251	-43.13	-13.21	-47.99	55.5	0.98	2903	-0.9914	-0.2753	discard	exp#062 mtf_30m_regime_adaptive_4h_adx_1d_hma_v1	train
ec2605f	mtf_30m_regime_adaptive_4h_adx_1d_hma_v1	BTCUSDT	-5.1534	-51.78	-16.68	-52.08	53.8	0.8	2802	-2.6528	-0.3203	discard	exp#062 mtf_30m_regime_adaptive_4h_adx_1d_hma_v1	train
ec2605f	mtf_30m_regime_adaptive_4h_adx_1d_hma_v1	ETHUSDT	-3.7913	-50.03	-15.93	-52.16	55.8	0.88	2846	-1.9225	-0.3054	discard	exp#062 mtf_30m_regime_adaptive_4h_adx_1d_hma_v1	train
ec2605f	mtf_30m_regime_adaptive_4h_adx_1d_hma_v1	SOLUSDT	-1.8251	-43.13	-13.21	-47.99	55.5	0.98	2903	-0.9914	-0.2753	discard	exp#062 mtf_30m_regime_adaptive_4h_adx_1d_hma_v1	train
7e6dd16	mtf_1h_rsi_pullback_4h_hma_adx_v1	BTCUSDT	-3.4276	-53.12	-17.26	-53.99	59.5	0.87	2656	-2.1226	-0.3198	discard	exp#063 mtf_1h_rsi_pullback_4h_hma_adx_v1	train
7e6dd16	mtf_1h_rsi_pullback_4h_hma_adx_v1	ETHUSDT	-2.9166	-55.75	-18.45	-56.55	59.2	0.87	2613	-1.7468	-0.3262	discard	exp#063 mtf_1h_rsi_pullback_4h_hma_adx_v1	train
7e6dd16	mtf_1h_rsi_pullback_4h_hma_adx_v1	SOLUSDT	-1.5393	-46.48	-14.52	-54.64	59.7	0.96	2591	-0.9445	-0.2658	discard	exp#063 mtf_1h_rsi_pullback_4h_hma_adx_v1	train
7e6dd16	mtf_1h_rsi_pullback_4h_hma_adx_v1	BTCUSDT	-3.4276	-53.12	-17.26	-53.99	59.5	0.87	2656	-2.1226	-0.3198	discard	exp#063 mtf_1h_rsi_pullback_4h_hma_adx_v1	train
7e6dd16	mtf_1h_rsi_pullback_4h_hma_adx_v1	ETHUSDT	-2.9166	-55.75	-18.45	-56.55	59.2	0.87	2613	-1.7468	-0.3262	discard	exp#063 mtf_1h_rsi_pullback_4h_hma_adx_v1	train
7e6dd16	mtf_1h_rsi_pullback_4h_hma_adx_v1	SOLUSDT	-1.5393	-46.48	-14.52	-54.64	59.7	0.96	2591	-0.9445	-0.2658	discard	exp#063 mtf_1h_rsi_pullback_4h_hma_adx_v1	train
e197a69	mtf_4h_kama_daily_hma_rsi_momentum_v1	BTCUSDT	-0.8113	-19.81	-5.37	-33.86	31.7	1.12	776	-0.8815	-0.1587	discard	exp#064 mtf_4h_kama_daily_hma_rsi_momentum_v1	train
e197a69	mtf_4h_kama_daily_hma_rsi_momentum_v1	ETHUSDT	-0.3007	-3.65	-0.92	-18.47	32.1	1.31	794	-0.3337	-0.0501	discard	exp#064 mtf_4h_kama_daily_hma_rsi_momentum_v1	train
e197a69	mtf_4h_kama_daily_hma_rsi_momentum_v1	SOLUSDT	0.612	97.94	18.69	-29.74	35.4	1.52	769	0.7187	0.6285	keep	exp#064 mtf_4h_kama_daily_hma_rsi_momentum_v1	train
e197a69	mtf_4h_kama_daily_hma_rsi_momentum_v1	SOLUSDT	-0.9861	-14.19	-11.83	-26.65	33.2	1.02	256	-1.1308	-0.4439	discard	exp#064 mtf_4h_kama_daily_hma_rsi_momentum_v1	test
e197a69	mtf_4h_kama_daily_hma_rsi_momentum_v1	BTCUSDT	-0.8113	-19.81	-5.37	-33.86	31.7	1.12	776	-0.8815	-0.1587	discard	exp#064 mtf_4h_kama_daily_hma_rsi_momentum_v1	train
e197a69	mtf_4h_kama_daily_hma_rsi_momentum_v1	ETHUSDT	-0.3007	-3.65	-0.92	-18.47	32.1	1.31	794	-0.3337	-0.0501	discard	exp#064 mtf_4h_kama_daily_hma_rsi_momentum_v1	train
e197a69	mtf_4h_kama_daily_hma_rsi_momentum_v1	SOLUSDT	0.612	97.94	18.69	-29.74	35.4	1.52	769	0.7187	0.6285	discard	exp#064 mtf_4h_kama_daily_hma_rsi_momentum_v1	train
86a6edd	mtf_12h_macd_ema_daily_hma_adx_v1	BTCUSDT	-0.6018	-3.7	-0.94	-22.07	48.3	1.04	286	-0.4968	-0.0425	discard	exp#065 mtf_12h_macd_ema_daily_hma_adx_v1	train
86a6edd	mtf_12h_macd_ema_daily_hma_adx_v1	ETHUSDT	-0.672	-15.76	-4.2	-23.57	45.6	0.97	340	-0.5822	-0.1781	discard	exp#065 mtf_12h_macd_ema_daily_hma_adx_v1	train
86a6edd	mtf_12h_macd_ema_daily_hma_adx_v1	SOLUSDT	0.4788	62.41	12.94	-23.46	50.9	1.23	320	0.4475	0.5517	keep	exp#065 mtf_12h_macd_ema_daily_hma_adx_v1	train
86a6edd	mtf_12h_macd_ema_daily_hma_adx_v1	SOLUSDT	0.004	4.92	4.03	-10.87	48.5	1.14	99	0.0037	0.3707	keep	exp#065 mtf_12h_macd_ema_daily_hma_adx_v1	test
86a6edd	mtf_12h_macd_ema_daily_hma_adx_v1	BTCUSDT	-0.6018	-3.7	-0.94	-22.07	48.3	1.04	286	-0.4968	-0.0425	discard	exp#065 mtf_12h_macd_ema_daily_hma_adx_v1	train
86a6edd	mtf_12h_macd_ema_daily_hma_adx_v1	ETHUSDT	-0.672	-15.76	-4.2	-23.57	45.6	0.97	340	-0.5822	-0.1781	discard	exp#065 mtf_12h_macd_ema_daily_hma_adx_v1	train
86a6edd	mtf_12h_macd_ema_daily_hma_adx_v1	SOLUSDT	0.4788	62.41	12.94	-23.46	50.9	1.23	320	0.4475	0.5517	keep	exp#065 mtf_12h_macd_ema_daily_hma_adx_v1	train
86a6edd	mtf_12h_macd_ema_daily_hma_adx_v1	SOLUSDT	0.004	4.92	4.03	-10.87	48.5	1.14	99	0.0037	0.3707	keep	exp#065 mtf_12h_macd_ema_daily_hma_adx_v1	test
ee3121c	mtf_1d_hma_rsi_weekly_chop_v1	BTCUSDT	-1.5942	-6.64	-1.7	-11.48	53.4	0.75	58	-0.5249	-0.1483	discard	exp#066 mtf_1d_hma_rsi_weekly_chop_v1	train
ee3121c	mtf_1d_hma_rsi_weekly_chop_v1	ETHUSDT	-1.009	-0.19	-0.05	-11.25	56.4	1.04	55	-0.3589	-0.0043	discard	exp#066 mtf_1d_hma_rsi_weekly_chop_v1	train
ee3121c	mtf_1d_hma_rsi_weekly_chop_v1	SOLUSDT	-0.9374	-11.45	-3.0	-24.49	53.2	0.64	47	-0.3092	-0.1227	discard	exp#066 mtf_1d_hma_rsi_weekly_chop_v1	train
ee3121c	mtf_1d_hma_rsi_weekly_chop_v1	BTCUSDT	-1.5942	-6.64	-1.7	-11.48	53.4	0.75	58	-0.5249	-0.1483	discard	exp#066 mtf_1d_hma_rsi_weekly_chop_v1	train
ee3121c	mtf_1d_hma_rsi_weekly_chop_v1	ETHUSDT	-1.009	-0.19	-0.05	-11.25	56.4	1.04	55	-0.3589	-0.0043	discard	exp#066 mtf_1d_hma_rsi_weekly_chop_v1	train
ee3121c	mtf_1d_hma_rsi_weekly_chop_v1	SOLUSDT	-0.9374	-11.45	-3.0	-24.49	53.2	0.64	47	-0.3092	-0.1227	discard	exp#066 mtf_1d_hma_rsi_weekly_chop_v1	train
faeca04	mtf_30m_kama_4h_1d_hma_volume_v1	BTCUSDT	-3.3364	-76.68	-30.52	-76.73	28.8	1.09	4753	-3.0724	-0.3978	discard	exp#068 mtf_30m_kama_4h_1d_hma_volume_v1	train
faeca04	mtf_30m_kama_4h_1d_hma_volume_v1	ETHUSDT	-2.6349	-76.4	-30.32	-76.8	29.1	1.12	4848	-2.4689	-0.3947	discard	exp#068 mtf_30m_kama_4h_1d_hma_volume_v1	train
faeca04	mtf_30m_kama_4h_1d_hma_volume_v1	SOLUSDT	-0.9533	-56.45	-18.83	-68.53	31.6	1.34	4871	-0.905	-0.2748	discard	exp#068 mtf_30m_kama_4h_1d_hma_volume_v1	train
faeca04	mtf_30m_kama_4h_1d_hma_volume_v1	BTCUSDT	-3.3364	-76.68	-30.52	-76.73	28.8	1.09	4753	-3.0724	-0.3978	discard	exp#068 mtf_30m_kama_4h_1d_hma_volume_v1	train
faeca04	mtf_30m_kama_4h_1d_hma_volume_v1	ETHUSDT	-2.6349	-76.4	-30.32	-76.8	29.1	1.12	4848	-2.4689	-0.3947	discard	exp#068 mtf_30m_kama_4h_1d_hma_volume_v1	train
faeca04	mtf_30m_kama_4h_1d_hma_volume_v1	SOLUSDT	-0.9533	-56.45	-18.83	-68.53	31.6	1.34	4871	-0.905	-0.2748	discard	exp#068 mtf_30m_kama_4h_1d_hma_volume_v1	train
9ab27f9	mtf_1h_macd_momentum_4h_hma_volume_v1	BTCUSDT	-2.4818	-65.96	-23.63	-66.79	27.6	0.89	3922	-2.9843	-0.3538	discard	exp#069 mtf_1h_macd_momentum_4h_hma_volume_v1	train
9ab27f9	mtf_1h_macd_momentum_4h_hma_volume_v1	ETHUSDT	-1.3022	-49.23	-15.6	-49.81	29.7	0.99	3925	-1.5998	-0.3131	discard	exp#069 mtf_1h_macd_momentum_4h_hma_volume_v1	train
9ab27f9	mtf_1h_macd_momentum_4h_hma_volume_v1	SOLUSDT	-0.2868	-20.88	-5.71	-45.52	32.0	1.05	3682	-0.3402	-0.1254	discard	exp#069 mtf_1h_macd_momentum_4h_hma_volume_v1	train
9ab27f9	mtf_1h_macd_momentum_4h_hma_volume_v1	BTCUSDT	-2.4818	-65.96	-23.63	-66.79	27.6	0.89	3922	-2.9843	-0.3538	discard	exp#069 mtf_1h_macd_momentum_4h_hma_volume_v1	train
9ab27f9	mtf_1h_macd_momentum_4h_hma_volume_v1	ETHUSDT	-1.3022	-49.23	-15.6	-49.81	29.7	0.99	3925	-1.5998	-0.3131	discard	exp#069 mtf_1h_macd_momentum_4h_hma_volume_v1	train
9ab27f9	mtf_1h_macd_momentum_4h_hma_volume_v1	SOLUSDT	-0.2868	-20.88	-5.71	-45.52	32.0	1.05	3682	-0.3402	-0.1254	discard	exp#069 mtf_1h_macd_momentum_4h_hma_volume_v1	train
f084fb6	mtf_12h_crsi_chop_regime_daily_hma_v1	BTCUSDT	-1.2432	-1.52	-0.38	-10.23	55.7	1.03	140	-0.5503	-0.0374	discard	exp#071 mtf_12h_crsi_chop_regime_daily_hma_v1	train
f084fb6	mtf_12h_crsi_chop_regime_daily_hma_v1	ETHUSDT	-0.6677	4.17	1.03	-11.2	53.5	1.17	129	-0.289	0.0916	discard	exp#071 mtf_12h_crsi_chop_regime_daily_hma_v1	train
f084fb6	mtf_12h_crsi_chop_regime_daily_hma_v1	SOLUSDT	-0.4446	4.39	1.08	-17.91	55.5	1.1	119	-0.1734	0.0606	discard	exp#071 mtf_12h_crsi_chop_regime_daily_hma_v1	train
f084fb6	mtf_12h_crsi_chop_regime_daily_hma_v1	BTCUSDT	-1.2432	-1.52	-0.38	-10.23	55.7	1.03	140	-0.5503	-0.0374	discard	exp#071 mtf_12h_crsi_chop_regime_daily_hma_v1	train
f084fb6	mtf_12h_crsi_chop_regime_daily_hma_v1	ETHUSDT	-0.6677	4.17	1.03	-11.2	53.5	1.17	129	-0.289	0.0916	discard	exp#071 mtf_12h_crsi_chop_regime_daily_hma_v1	train
f084fb6	mtf_12h_crsi_chop_regime_daily_hma_v1	SOLUSDT	-0.4446	4.39	1.08	-17.91	55.5	1.1	119	-0.1734	0.0606	discard	exp#071 mtf_12h_crsi_chop_regime_daily_hma_v1	train
befc7be	mtf_1d_crsi_weekly_hma_meanrevert_v1	BTCUSDT	-4.4044	-0.98	-0.25	-1.73	70.0	0.75	10	-0.5816	-0.1431	discard	exp#072 mtf_1d_crsi_weekly_hma_meanrevert_v1	train
befc7be	mtf_1d_crsi_weekly_hma_meanrevert_v1	ETHUSDT	-3.1049	-2.05	-0.52	-2.43	50.0	0.69	12	-0.504	-0.2132	discard	exp#072 mtf_1d_crsi_weekly_hma_meanrevert_v1	train
befc7be	mtf_1d_crsi_weekly_hma_meanrevert_v1	SOLUSDT	-1.8592	6.15	1.51	-2.26	78.6	3.27	14	-0.4105	0.6668	discard	exp#072 mtf_1d_crsi_weekly_hma_meanrevert_v1	train
befc7be	mtf_1d_crsi_weekly_hma_meanrevert_v1	BTCUSDT	-4.4044	-0.98	-0.25	-1.73	70.0	0.75	10	-0.5816	-0.1431	discard	exp#072 mtf_1d_crsi_weekly_hma_meanrevert_v1	train
befc7be	mtf_1d_crsi_weekly_hma_meanrevert_v1	ETHUSDT	-3.1049	-2.05	-0.52	-2.43	50.0	0.69	12	-0.504	-0.2132	discard	exp#072 mtf_1d_crsi_weekly_hma_meanrevert_v1	train
befc7be	mtf_1d_crsi_weekly_hma_meanrevert_v1	SOLUSDT	-1.8592	6.15	1.51	-2.26	78.6	3.27	14	-0.4105	0.6668	discard	exp#072 mtf_1d_crsi_weekly_hma_meanrevert_v1	train
d5bd292	mtf_15m_rsi_pullback_4h_hma_1h_adx_v1	BTCUSDT	-5.3454	-95.28	-53.4	-95.55	40.8	1.14	13381	-6.9478	-0.5589	discard	exp#073 mtf_15m_rsi_pullback_4h_hma_1h_adx_v1	train
d5bd292	mtf_15m_rsi_pullback_4h_hma_1h_adx_v1	ETHUSDT	-4.1828	-95.2	-53.22	-95.25	42.7	1.16	13507	-5.363	-0.5588	discard	exp#073 mtf_15m_rsi_pullback_4h_hma_1h_adx_v1	train
d5bd292	mtf_15m_rsi_pullback_4h_hma_1h_adx_v1	SOLUSDT	-1.915	-90.05	-43.97	-91.27	44.1	1.26	13487	-2.4967	-0.4817	discard	exp#073 mtf_15m_rsi_pullback_4h_hma_1h_adx_v1	train
d5bd292	mtf_15m_rsi_pullback_4h_hma_1h_adx_v1	BTCUSDT	-5.3454	-95.28	-53.4	-95.55	40.8	1.14	13381	-6.9478	-0.5589	discard	exp#073 mtf_15m_rsi_pullback_4h_hma_1h_adx_v1	train
d5bd292	mtf_15m_rsi_pullback_4h_hma_1h_adx_v1	ETHUSDT	-4.1828	-95.2	-53.22	-95.25	42.7	1.16	13507	-5.363	-0.5588	discard	exp#073 mtf_15m_rsi_pullback_4h_hma_1h_adx_v1	train
d5bd292	mtf_15m_rsi_pullback_4h_hma_1h_adx_v1	SOLUSDT	-1.915	-90.05	-43.97	-91.27	44.1	1.26	13487	-2.4967	-0.4817	discard	exp#073 mtf_15m_rsi_pullback_4h_hma_1h_adx_v1	train
8af256d	mtf_30m_supertrend_4h_hma_chop_regime_v1	BTCUSDT	-3.3787	-71.64	-27.04	-73.44	37.0	0.9	4096	-3.1372	-0.3682	discard	exp#074 mtf_30m_supertrend_4h_hma_chop_regime_v1	train
8af256d	mtf_30m_supertrend_4h_hma_chop_regime_v1	ETHUSDT	-2.2796	-65.94	-23.62	-66.08	39.4	0.97	4192	-2.156	-0.3574	discard	exp#074 mtf_30m_supertrend_4h_hma_chop_regime_v1	train
8af256d	mtf_30m_supertrend_4h_hma_chop_regime_v1	SOLUSDT	-1.342	-64.77	-23.04	-66.83	40.3	1.03	4159	-1.2642	-0.3447	discard	exp#074 mtf_30m_supertrend_4h_hma_chop_regime_v1	train
8af256d	mtf_30m_supertrend_4h_hma_chop_regime_v1	BTCUSDT	-3.3787	-71.64	-27.04	-73.44	37.0	0.9	4096	-3.1372	-0.3682	discard	exp#074 mtf_30m_supertrend_4h_hma_chop_regime_v1	train
