commit	strategy	symbol	sharpe	return_pct	cagr_pct	max_dd_pct	win_rate	profit_factor	trades	sortino	calmar	status	description	period
23ac239	mtf_12h_fisher_daily_hma_chop_regime_v1	ETHUSDT	-1.2553	9.48	2.29	-1.28	71.4	6.3	28	-0.5135	1.7854	discard	exp#095 mtf_12h_fisher_daily_hma_chop_regime_v1	train
23ac239	mtf_12h_fisher_daily_hma_chop_regime_v1	SOLUSDT	-0.7267	8.45	2.06	-4.64	58.3	1.6	36	-0.1799	0.4432	discard	exp#095 mtf_12h_fisher_daily_hma_chop_regime_v1	train
23ac239	mtf_12h_fisher_daily_hma_chop_regime_v1	BTCUSDT	-1.1038	9.88	2.39	-2.24	65.7	3.69	35	-0.2782	1.0657	discard	exp#095 mtf_12h_fisher_daily_hma_chop_regime_v1	train
23ac239	mtf_12h_fisher_daily_hma_chop_regime_v1	ETHUSDT	-1.2553	9.48	2.29	-1.28	71.4	6.3	28	-0.5135	1.7854	discard	exp#095 mtf_12h_fisher_daily_hma_chop_regime_v1	train
23ac239	mtf_12h_fisher_daily_hma_chop_regime_v1	SOLUSDT	-0.7267	8.45	2.06	-4.64	58.3	1.6	36	-0.1799	0.4432	discard	exp#095 mtf_12h_fisher_daily_hma_chop_regime_v1	train
f5fd190	mtf_1d_rsi_weekly_hma_mr_v1	BTCUSDT	-0.9829	0.22	0.06	-8.06	67.1	1.06	70	-0.4951	0.0069	discard	exp#096 mtf_1d_rsi_weekly_hma_mr_v1	train
f5fd190	mtf_1d_rsi_weekly_hma_mr_v1	ETHUSDT	-1.1831	-10.82	-2.82	-16.34	63.2	0.72	68	-0.5551	-0.1727	discard	exp#096 mtf_1d_rsi_weekly_hma_mr_v1	train
f5fd190	mtf_1d_rsi_weekly_hma_mr_v1	SOLUSDT	-0.1238	15.75	3.74	-5.15	60.6	1.41	71	-0.0827	0.7258	discard	exp#096 mtf_1d_rsi_weekly_hma_mr_v1	train
f5fd190	mtf_1d_rsi_weekly_hma_mr_v1	BTCUSDT	-0.9829	0.22	0.06	-8.06	67.1	1.06	70	-0.4951	0.0069	discard	exp#096 mtf_1d_rsi_weekly_hma_mr_v1	train
f5fd190	mtf_1d_rsi_weekly_hma_mr_v1	ETHUSDT	-1.1831	-10.82	-2.82	-16.34	63.2	0.72	68	-0.5551	-0.1727	discard	exp#096 mtf_1d_rsi_weekly_hma_mr_v1	train
f5fd190	mtf_1d_rsi_weekly_hma_mr_v1	SOLUSDT	-0.1238	15.75	3.74	-5.15	60.6	1.41	71	-0.0827	0.7258	discard	exp#096 mtf_1d_rsi_weekly_hma_mr_v1	train
eb77b7c	mtf_15m_supertrend_4h_hma_rsi_v1	BTCUSDT	-5.8047	-84.45	-37.23	-85.06	44.1	0.86	7376	-5.3247	-0.4377	discard	exp#097 mtf_15m_supertrend_4h_hma_rsi_v1	train
eb77b7c	mtf_15m_supertrend_4h_hma_rsi_v1	ETHUSDT	-4.2057	-81.72	-34.63	-81.84	45.1	0.91	7449	-3.7565	-0.4232	discard	exp#097 mtf_15m_supertrend_4h_hma_rsi_v1	train
eb77b7c	mtf_15m_supertrend_4h_hma_rsi_v1	SOLUSDT	-1.1798	-52.15	-16.89	-66.49	47.2	1.04	7633	-1.1263	-0.2541	discard	exp#097 mtf_15m_supertrend_4h_hma_rsi_v1	train
eb77b7c	mtf_15m_supertrend_4h_hma_rsi_v1	BTCUSDT	-5.8047	-84.45	-37.23	-85.06	44.1	0.86	7376	-5.3247	-0.4377	discard	exp#097 mtf_15m_supertrend_4h_hma_rsi_v1	train
eb77b7c	mtf_15m_supertrend_4h_hma_rsi_v1	ETHUSDT	-4.2057	-81.72	-34.63	-81.84	45.1	0.91	7449	-3.7565	-0.4232	discard	exp#097 mtf_15m_supertrend_4h_hma_rsi_v1	train
eb77b7c	mtf_15m_supertrend_4h_hma_rsi_v1	SOLUSDT	-1.1798	-52.15	-16.89	-66.49	47.2	1.04	7633	-1.1263	-0.2541	discard	exp#097 mtf_15m_supertrend_4h_hma_rsi_v1	train
3066be8	mtf_30m_volbreakout_4h_hma_rsi_v1	BTCUSDT	-8.7143	-87.35	-40.38	-87.87	36.9	0.81	9027	-6.8622	-0.4595	discard	exp#098 mtf_30m_volbreakout_4h_hma_rsi_v1	train
3066be8	mtf_30m_volbreakout_4h_hma_rsi_v1	ETHUSDT	-7.039	-88.51	-41.8	-88.55	37.5	0.85	9093	-5.6411	-0.4721	discard	exp#098 mtf_30m_volbreakout_4h_hma_rsi_v1	train
3066be8	mtf_30m_volbreakout_4h_hma_rsi_v1	SOLUSDT	-4.9456	-89.7	-43.48	-90.23	41.5	0.91	9078	-3.8129	-0.4819	discard	exp#098 mtf_30m_volbreakout_4h_hma_rsi_v1	train
3066be8	mtf_30m_volbreakout_4h_hma_rsi_v1	BTCUSDT	-8.7143	-87.35	-40.38	-87.87	36.9	0.81	9027	-6.8622	-0.4595	discard	exp#098 mtf_30m_volbreakout_4h_hma_rsi_v1	train
3066be8	mtf_30m_volbreakout_4h_hma_rsi_v1	ETHUSDT	-7.039	-88.51	-41.8	-88.55	37.5	0.85	9093	-5.6411	-0.4721	discard	exp#098 mtf_30m_volbreakout_4h_hma_rsi_v1	train
3066be8	mtf_30m_volbreakout_4h_hma_rsi_v1	SOLUSDT	-4.9456	-89.7	-43.48	-90.23	41.5	0.91	9078	-3.8129	-0.4819	discard	exp#098 mtf_30m_volbreakout_4h_hma_rsi_v1	train
5706eeb	mtf_1h_crsi_4h_hma_chop_regime_v1	BTCUSDT	-2.941	-35.32	-10.33	-37.61	58.0	0.95	2798	-1.6326	-0.2746	discard	exp#099 mtf_1h_crsi_4h_hma_chop_regime_v1	train
5706eeb	mtf_1h_crsi_4h_hma_chop_regime_v1	ETHUSDT	-2.574	-39.28	-11.73	-46.35	57.3	0.94	2824	-1.3774	-0.2532	discard	exp#099 mtf_1h_crsi_4h_hma_chop_regime_v1	train
5706eeb	mtf_1h_crsi_4h_hma_chop_regime_v1	SOLUSDT	-0.5052	-4.38	-1.12	-17.51	59.7	1.1	2879	-0.2934	-0.0638	discard	exp#099 mtf_1h_crsi_4h_hma_chop_regime_v1	train
5706eeb	mtf_1h_crsi_4h_hma_chop_regime_v1	BTCUSDT	-2.941	-35.32	-10.33	-37.61	58.0	0.95	2798	-1.6326	-0.2746	discard	exp#099 mtf_1h_crsi_4h_hma_chop_regime_v1	train
5706eeb	mtf_1h_crsi_4h_hma_chop_regime_v1	ETHUSDT	-2.574	-39.28	-11.73	-46.35	57.3	0.94	2824	-1.3774	-0.2532	discard	exp#099 mtf_1h_crsi_4h_hma_chop_regime_v1	train
5706eeb	mtf_1h_crsi_4h_hma_chop_regime_v1	SOLUSDT	-0.5052	-4.38	-1.12	-17.51	59.7	1.1	2879	-0.2934	-0.0638	discard	exp#099 mtf_1h_crsi_4h_hma_chop_regime_v1	train
b9438dc	mtf_4h_rsi_pullback_macd_daily_hma_v1	BTCUSDT	-2.2959	-6.52	-1.67	-8.88	52.4	0.91	252	-0.6706	-0.1884	discard	exp#100 mtf_4h_rsi_pullback_macd_daily_hma_v1	train
b9438dc	mtf_4h_rsi_pullback_macd_daily_hma_v1	ETHUSDT	-1.4772	-2.8	-0.71	-7.25	45.1	1.04	253	-0.5184	-0.0975	discard	exp#100 mtf_4h_rsi_pullback_macd_daily_hma_v1	train
b9438dc	mtf_4h_rsi_pullback_macd_daily_hma_v1	SOLUSDT	-0.7969	-0.09	-0.02	-10.89	54.2	1.08	253	-0.2356	-0.002	discard	exp#100 mtf_4h_rsi_pullback_macd_daily_hma_v1	train
b9438dc	mtf_4h_rsi_pullback_macd_daily_hma_v1	BTCUSDT	-2.2959	-6.52	-1.67	-8.88	52.4	0.91	252	-0.6706	-0.1884	discard	exp#100 mtf_4h_rsi_pullback_macd_daily_hma_v1	train
b9438dc	mtf_4h_rsi_pullback_macd_daily_hma_v1	ETHUSDT	-1.4772	-2.8	-0.71	-7.25	45.1	1.04	253	-0.5184	-0.0975	discard	exp#100 mtf_4h_rsi_pullback_macd_daily_hma_v1	train
b9438dc	mtf_4h_rsi_pullback_macd_daily_hma_v1	SOLUSDT	-0.7969	-0.09	-0.02	-10.89	54.2	1.08	253	-0.2356	-0.002	discard	exp#100 mtf_4h_rsi_pullback_macd_daily_hma_v1	train
2e67b8b	mtf_12h_kama_chop_regime_daily_hma_v1	BTCUSDT	-0.6617	-17.38	-4.66	-31.18	29.1	1.24	395	-0.8725	-0.1495	discard	exp#101 mtf_12h_kama_chop_regime_daily_hma_v1	train
2e67b8b	mtf_12h_kama_chop_regime_daily_hma_v1	ETHUSDT	-0.3808	-11.62	-3.04	-23.8	30.1	1.3	396	-0.5017	-0.1278	discard	exp#101 mtf_12h_kama_chop_regime_daily_hma_v1	train
2e67b8b	mtf_12h_kama_chop_regime_daily_hma_v1	SOLUSDT	0.6519	112.57	20.83	-25.8	35.0	1.83	360	0.875	0.8073	keep	exp#101 mtf_12h_kama_chop_regime_daily_hma_v1	train
2e67b8b	mtf_12h_kama_chop_regime_daily_hma_v1	SOLUSDT	-0.3094	-3.6	-2.97	-20.87	34.6	1.19	130	-0.4228	-0.1425	discard	exp#101 mtf_12h_kama_chop_regime_daily_hma_v1	test
2e67b8b	mtf_12h_kama_chop_regime_daily_hma_v1	BTCUSDT	-0.6617	-17.38	-4.66	-31.18	29.1	1.24	395	-0.8725	-0.1495	discard	exp#101 mtf_12h_kama_chop_regime_daily_hma_v1	train
2e67b8b	mtf_12h_kama_chop_regime_daily_hma_v1	ETHUSDT	-0.3808	-11.62	-3.04	-23.8	30.1	1.3	396	-0.5017	-0.1278	discard	exp#101 mtf_12h_kama_chop_regime_daily_hma_v1	train
2e67b8b	mtf_12h_kama_chop_regime_daily_hma_v1	SOLUSDT	0.6519	112.57	20.83	-25.8	35.0	1.83	360	0.875	0.8073	discard	exp#101 mtf_12h_kama_chop_regime_daily_hma_v1	train
4ea2fc1	mtf_1d_donchian_weekly_hma_adx_v1	BTCUSDT	-2.1718	-2.69	-0.68	-6.15	44.4	0.83	36	-0.6733	-0.1105	discard	exp#102 mtf_1d_donchian_weekly_hma_adx_v1	train
4ea2fc1	mtf_1d_donchian_weekly_hma_adx_v1	ETHUSDT	-1.9144	-5.27	-1.34	-6.79	32.3	0.68	31	-0.595	-0.1979	discard	exp#102 mtf_1d_donchian_weekly_hma_adx_v1	train
4ea2fc1	mtf_1d_donchian_weekly_hma_adx_v1	SOLUSDT	0.5999	47.19	10.18	-3.87	71.0	6.15	31	0.6143	2.6299	keep	exp#102 mtf_1d_donchian_weekly_hma_adx_v1	train
4ea2fc1	mtf_1d_donchian_weekly_hma_adx_v1	SOLUSDT	-2.6198	-0.61	-0.5	-2.54	33.3	0.84	6	-0.6588	-0.1987	discard	exp#102 mtf_1d_donchian_weekly_hma_adx_v1	test
4ea2fc1	mtf_1d_donchian_weekly_hma_adx_v1	BTCUSDT	-2.1718	-2.69	-0.68	-6.15	44.4	0.83	36	-0.6733	-0.1105	discard	exp#102 mtf_1d_donchian_weekly_hma_adx_v1	train
4ea2fc1	mtf_1d_donchian_weekly_hma_adx_v1	ETHUSDT	-1.9144	-5.27	-1.34	-6.79	32.3	0.68	31	-0.595	-0.1979	discard	exp#102 mtf_1d_donchian_weekly_hma_adx_v1	train
4ea2fc1	mtf_1d_donchian_weekly_hma_adx_v1	SOLUSDT	0.5999	47.19	10.18	-3.87	71.0	6.15	31	0.6143	2.6299	discard	exp#102 mtf_1d_donchian_weekly_hma_adx_v1	train
4d4b5de	mtf_15m_momentum_pullback_4h_hma_1h_rsi_v1	BTCUSDT	-7.3478	-87.11	-40.1	-87.59	33.5	0.86	8693	-5.8918	-0.4579	discard	exp#103 mtf_15m_momentum_pullback_4h_hma_1h_rsi_v1	train
4d4b5de	mtf_15m_momentum_pullback_4h_hma_1h_rsi_v1	ETHUSDT	-5.8916	-86.97	-39.94	-87.15	34.2	0.86	8653	-4.5165	-0.4583	discard	exp#103 mtf_15m_momentum_pullback_4h_hma_1h_rsi_v1	train
4d4b5de	mtf_15m_momentum_pullback_4h_hma_1h_rsi_v1	SOLUSDT	-2.1116	-66.23	-23.85	-75.85	37.9	1.02	8567	-1.6816	-0.3145	discard	exp#103 mtf_15m_momentum_pullback_4h_hma_1h_rsi_v1	train
4d4b5de	mtf_15m_momentum_pullback_4h_hma_1h_rsi_v1	BTCUSDT	-7.3478	-87.11	-40.1	-87.59	33.5	0.86	8693	-5.8918	-0.4579	discard	exp#103 mtf_15m_momentum_pullback_4h_hma_1h_rsi_v1	train
4d4b5de	mtf_15m_momentum_pullback_4h_hma_1h_rsi_v1	ETHUSDT	-5.8916	-86.97	-39.94	-87.15	34.2	0.86	8653	-4.5165	-0.4583	discard	exp#103 mtf_15m_momentum_pullback_4h_hma_1h_rsi_v1	train
4d4b5de	mtf_15m_momentum_pullback_4h_hma_1h_rsi_v1	SOLUSDT	-2.1116	-66.23	-23.85	-75.85	37.9	1.02	8567	-1.6816	-0.3145	discard	exp#103 mtf_15m_momentum_pullback_4h_hma_1h_rsi_v1	train
453a0ac	mtf_30m_regime_adaptive_4h_hma_chop_v1	BTCUSDT	-5.1053	-8.22	-2.12	-9.76	55.5	0.84	762	-1.0882	-0.2176	discard	exp#104 mtf_30m_regime_adaptive_4h_hma_chop_v1	train
453a0ac	mtf_30m_regime_adaptive_4h_hma_chop_v1	ETHUSDT	-3.831	-7.92	-2.04	-8.65	59.4	0.87	865	-0.8601	-0.2363	discard	exp#104 mtf_30m_regime_adaptive_4h_hma_chop_v1	train
453a0ac	mtf_30m_regime_adaptive_4h_hma_chop_v1	SOLUSDT	-2.5237	-6.2	-1.59	-8.92	58.6	0.92	793	-0.5518	-0.1787	discard	exp#104 mtf_30m_regime_adaptive_4h_hma_chop_v1	train
453a0ac	mtf_30m_regime_adaptive_4h_hma_chop_v1	BTCUSDT	-5.1053	-8.22	-2.12	-9.76	55.5	0.84	762	-1.0882	-0.2176	discard	exp#104 mtf_30m_regime_adaptive_4h_hma_chop_v1	train
453a0ac	mtf_30m_regime_adaptive_4h_hma_chop_v1	ETHUSDT	-3.831	-7.92	-2.04	-8.65	59.4	0.87	865	-0.8601	-0.2363	discard	exp#104 mtf_30m_regime_adaptive_4h_hma_chop_v1	train
453a0ac	mtf_30m_regime_adaptive_4h_hma_chop_v1	SOLUSDT	-2.5237	-6.2	-1.59	-8.92	58.6	0.92	793	-0.5518	-0.1787	discard	exp#104 mtf_30m_regime_adaptive_4h_hma_chop_v1	train
6f259e2	mtf_1h_rsi_pullback_4h_hma_vol_filter_v1	BTCUSDT	-6.3051	-2.3	-0.58	-4.41	50.0	0.93	144	-0.8888	-0.1318	discard	exp#105 mtf_1h_rsi_pullback_4h_hma_vol_filter_v1	train
6f259e2	mtf_1h_rsi_pullback_4h_hma_vol_filter_v1	ETHUSDT	-5.0708	-7.55	-1.95	-7.84	45.2	0.57	146	-0.5403	-0.2483	discard	exp#105 mtf_1h_rsi_pullback_4h_hma_vol_filter_v1	train
6f259e2	mtf_1h_rsi_pullback_4h_hma_vol_filter_v1	SOLUSDT	-2.4412	0.77	0.19	-3.72	57.1	1.09	140	-0.3197	0.0517	discard	exp#105 mtf_1h_rsi_pullback_4h_hma_vol_filter_v1	train
6f259e2	mtf_1h_rsi_pullback_4h_hma_vol_filter_v1	BTCUSDT	-6.3051	-2.3	-0.58	-4.41	50.0	0.93	144	-0.8888	-0.1318	discard	exp#105 mtf_1h_rsi_pullback_4h_hma_vol_filter_v1	train
6f259e2	mtf_1h_rsi_pullback_4h_hma_vol_filter_v1	ETHUSDT	-5.0708	-7.55	-1.95	-7.84	45.2	0.57	146	-0.5403	-0.2483	discard	exp#105 mtf_1h_rsi_pullback_4h_hma_vol_filter_v1	train
6f259e2	mtf_1h_rsi_pullback_4h_hma_vol_filter_v1	SOLUSDT	-2.4412	0.77	0.19	-3.72	57.1	1.09	140	-0.3197	0.0517	discard	exp#105 mtf_1h_rsi_pullback_4h_hma_vol_filter_v1	train
83f1418	mtf_4h_donchian_daily_hma_v1	BTCUSDT	-1.1976	-3.69	-0.94	-12.76	40.5	1.04	472	-0.6222	-0.0734	discard	exp#106 mtf_4h_donchian_daily_hma_v1	train
83f1418	mtf_4h_donchian_daily_hma_v1	ETHUSDT	-1.6307	-20.16	-5.48	-23.72	39.8	0.84	530	-0.796	-0.2308	discard	exp#106 mtf_4h_donchian_daily_hma_v1	train
83f1418	mtf_4h_donchian_daily_hma_v1	SOLUSDT	-0.8957	-20.86	-5.7	-26.77	41.0	0.9	559	-0.4851	-0.2131	discard	exp#106 mtf_4h_donchian_daily_hma_v1	train
83f1418	mtf_4h_donchian_daily_hma_v1	BTCUSDT	-1.1976	-3.69	-0.94	-12.76	40.5	1.04	472	-0.6222	-0.0734	discard	exp#106 mtf_4h_donchian_daily_hma_v1	train
83f1418	mtf_4h_donchian_daily_hma_v1	ETHUSDT	-1.6307	-20.16	-5.48	-23.72	39.8	0.84	530	-0.796	-0.2308	discard	exp#106 mtf_4h_donchian_daily_hma_v1	train
83f1418	mtf_4h_donchian_daily_hma_v1	SOLUSDT	-0.8957	-20.86	-5.7	-26.77	41.0	0.9	559	-0.4851	-0.2131	discard	exp#106 mtf_4h_donchian_daily_hma_v1	train
abe9566	mtf_12h_kama_rsi_weekly_hma_volume_v1	BTCUSDT	-0.6368	-1.4	-0.35	-11.6	60.6	1.04	175	-0.5272	-0.0304	discard	exp#107 mtf_12h_kama_rsi_weekly_hma_volume_v1	train
abe9566	mtf_12h_kama_rsi_weekly_hma_volume_v1	ETHUSDT	-0.4352	1.28	0.32	-14.77	60.6	1.06	180	-0.3545	0.0216	discard	exp#107 mtf_12h_kama_rsi_weekly_hma_volume_v1	train
abe9566	mtf_12h_kama_rsi_weekly_hma_volume_v1	SOLUSDT	0.2763	36.79	8.18	-20.17	61.9	1.28	181	0.2555	0.4055	keep	exp#107 mtf_12h_kama_rsi_weekly_hma_volume_v1	train
abe9566	mtf_12h_kama_rsi_weekly_hma_volume_v1	SOLUSDT	-1.4161	-10.34	-8.59	-13.68	53.8	0.64	39	-1.0261	-0.6279	discard	exp#107 mtf_12h_kama_rsi_weekly_hma_volume_v1	test
abe9566	mtf_12h_kama_rsi_weekly_hma_volume_v1	BTCUSDT	-0.6368	-1.4	-0.35	-11.6	60.6	1.04	175	-0.5272	-0.0304	discard	exp#107 mtf_12h_kama_rsi_weekly_hma_volume_v1	train
abe9566	mtf_12h_kama_rsi_weekly_hma_volume_v1	ETHUSDT	-0.4352	1.28	0.32	-14.77	60.6	1.06	180	-0.3545	0.0216	discard	exp#107 mtf_12h_kama_rsi_weekly_hma_volume_v1	train
abe9566	mtf_12h_kama_rsi_weekly_hma_volume_v1	SOLUSDT	0.2763	36.79	8.18	-20.17	61.9	1.28	181	0.2555	0.4055	discard	exp#107 mtf_12h_kama_rsi_weekly_hma_volume_v1	train
bda017d	mtf_1d_crsi_chop_regime_weekly_hma_v1	BTCUSDT	-0.7769	6.73	1.64	-4.69	53.7	1.34	95	-0.4016	0.3499	discard	exp#108 mtf_1d_crsi_chop_regime_weekly_hma_v1	train
bda017d	mtf_1d_crsi_chop_regime_weekly_hma_v1	ETHUSDT	-1.9321	-18.22	-4.91	-18.93	46.8	0.58	94	-0.8301	-0.2591	discard	exp#108 mtf_1d_crsi_chop_regime_weekly_hma_v1	train
bda017d	mtf_1d_crsi_chop_regime_weekly_hma_v1	SOLUSDT	-1.6397	-19.84	-5.4	-24.37	47.5	0.63	99	-0.8628	-0.2215	discard	exp#108 mtf_1d_crsi_chop_regime_weekly_hma_v1	train
bda017d	mtf_1d_crsi_chop_regime_weekly_hma_v1	BTCUSDT	-0.7769	6.73	1.64	-4.69	53.7	1.34	95	-0.4016	0.3499	discard	exp#108 mtf_1d_crsi_chop_regime_weekly_hma_v1	train
bda017d	mtf_1d_crsi_chop_regime_weekly_hma_v1	ETHUSDT	-1.9321	-18.22	-4.91	-18.93	46.8	0.58	94	-0.8301	-0.2591	discard	exp#108 mtf_1d_crsi_chop_regime_weekly_hma_v1	train
bda017d	mtf_1d_crsi_chop_regime_weekly_hma_v1	SOLUSDT	-1.6397	-19.84	-5.4	-24.37	47.5	0.63	99	-0.8628	-0.2215	discard	exp#108 mtf_1d_crsi_chop_regime_weekly_hma_v1	train
8f2ece8	mtf_15m_rsi_4h_hma_bb_regime_v1	BTCUSDT	-16.059	-76.28	-30.23	-76.29	35.5	0.52	5425	-6.1109	-0.3963	discard	exp#109 mtf_15m_rsi_4h_hma_bb_regime_v1	train
8f2ece8	mtf_15m_rsi_4h_hma_bb_regime_v1	ETHUSDT	-10.0425	-64.29	-22.71	-64.53	40.7	0.65	4151	-3.2436	-0.3519	discard	exp#109 mtf_15m_rsi_4h_hma_bb_regime_v1	train
8f2ece8	mtf_15m_rsi_4h_hma_bb_regime_v1	SOLUSDT	-3.8943	-38.14	-11.36	-38.64	48.6	0.86	2270	-0.9997	-0.294	discard	exp#109 mtf_15m_rsi_4h_hma_bb_regime_v1	train
8f2ece8	mtf_15m_rsi_4h_hma_bb_regime_v1	BTCUSDT	-16.059	-76.28	-30.23	-76.29	35.5	0.52	5425	-6.1109	-0.3963	discard	exp#109 mtf_15m_rsi_4h_hma_bb_regime_v1	train
8f2ece8	mtf_15m_rsi_4h_hma_bb_regime_v1	ETHUSDT	-10.0425	-64.29	-22.71	-64.53	40.7	0.65	4151	-3.2436	-0.3519	discard	exp#109 mtf_15m_rsi_4h_hma_bb_regime_v1	train
8f2ece8	mtf_15m_rsi_4h_hma_bb_regime_v1	SOLUSDT	-3.8943	-38.14	-11.36	-38.64	48.6	0.86	2270	-0.9997	-0.294	discard	exp#109 mtf_15m_rsi_4h_hma_bb_regime_v1	train
cb84fa9	mtf_30m_fisher_4h_hma_chop_regime_v1	BTCUSDT	-6.8951	-80.38	-33.47	-80.76	45.4	0.83	6623	-4.9835	-0.4144	discard	exp#110 mtf_30m_fisher_4h_hma_chop_regime_v1	train
cb84fa9	mtf_30m_fisher_4h_hma_chop_regime_v1	ETHUSDT	-4.4369	-72.17	-27.38	-73.95	48.5	0.93	6341	-3.0555	-0.3703	discard	exp#110 mtf_30m_fisher_4h_hma_chop_regime_v1	train
cb84fa9	mtf_30m_fisher_4h_hma_chop_regime_v1	SOLUSDT	-2.4294	-69.0	-25.47	-69.51	50.1	0.95	6302	-1.6964	-0.3665	discard	exp#110 mtf_30m_fisher_4h_hma_chop_regime_v1	train
cb84fa9	mtf_30m_fisher_4h_hma_chop_regime_v1	BTCUSDT	-6.8951	-80.38	-33.47	-80.76	45.4	0.83	6623	-4.9835	-0.4144	discard	exp#110 mtf_30m_fisher_4h_hma_chop_regime_v1	train
cb84fa9	mtf_30m_fisher_4h_hma_chop_regime_v1	ETHUSDT	-4.4369	-72.17	-27.38	-73.95	48.5	0.93	6341	-3.0555	-0.3703	discard	exp#110 mtf_30m_fisher_4h_hma_chop_regime_v1	train
cb84fa9	mtf_30m_fisher_4h_hma_chop_regime_v1	SOLUSDT	-2.4294	-69.0	-25.47	-69.51	50.1	0.95	6302	-1.6964	-0.3665	discard	exp#110 mtf_30m_fisher_4h_hma_chop_regime_v1	train
5930bc3	mtf_1h_supertrend_4h_hma_rsi_adx_v1	BTCUSDT	-3.4926	-35.03	-10.23	-37.37	53.7	0.86	1578	-1.4962	-0.2737	discard	exp#111 mtf_1h_supertrend_4h_hma_rsi_adx_v1	train
5930bc3	mtf_1h_supertrend_4h_hma_rsi_adx_v1	ETHUSDT	-3.1478	-36.65	-10.79	-38.21	53.5	0.84	1472	-1.3019	-0.2824	discard	exp#111 mtf_1h_supertrend_4h_hma_rsi_adx_v1	train
5930bc3	mtf_1h_supertrend_4h_hma_rsi_adx_v1	SOLUSDT	-1.1429	-22.01	-6.05	-31.98	54.7	1.01	1599	-0.5178	-0.1892	discard	exp#111 mtf_1h_supertrend_4h_hma_rsi_adx_v1	train
5930bc3	mtf_1h_supertrend_4h_hma_rsi_adx_v1	BTCUSDT	-3.4926	-35.03	-10.23	-37.37	53.7	0.86	1578	-1.4962	-0.2737	discard	exp#111 mtf_1h_supertrend_4h_hma_rsi_adx_v1	train
5930bc3	mtf_1h_supertrend_4h_hma_rsi_adx_v1	ETHUSDT	-3.1478	-36.65	-10.79	-38.21	53.5	0.84	1472	-1.3019	-0.2824	discard	exp#111 mtf_1h_supertrend_4h_hma_rsi_adx_v1	train
5930bc3	mtf_1h_supertrend_4h_hma_rsi_adx_v1	SOLUSDT	-1.1429	-22.01	-6.05	-31.98	54.7	1.01	1599	-0.5178	-0.1892	discard	exp#111 mtf_1h_supertrend_4h_hma_rsi_adx_v1	train
57419ec	mtf_4h_fisher_daily_hma_bbwidth_v1	BTCUSDT	0.0	0.0	0.0	0.0	0.0	0.0	0	0.0	0.0	discard	exp#112 mtf_4h_fisher_daily_hma_bbwidth_v1	train
57419ec	mtf_4h_fisher_daily_hma_bbwidth_v1	ETHUSDT	0.0	0.0	0.0	0.0	0.0	0.0	0	0.0	0.0	discard	exp#112 mtf_4h_fisher_daily_hma_bbwidth_v1	train
57419ec	mtf_4h_fisher_daily_hma_bbwidth_v1	SOLUSDT	0.0	0.0	0.0	0.0	0.0	0.0	0	0.0	0.0	discard	exp#112 mtf_4h_fisher_daily_hma_bbwidth_v1	train
57419ec	mtf_4h_fisher_daily_hma_bbwidth_v1	BTCUSDT	0.0	0.0	0.0	0.0	0.0	0.0	0	0.0	0.0	discard	exp#112 mtf_4h_fisher_daily_hma_bbwidth_v1	train
57419ec	mtf_4h_fisher_daily_hma_bbwidth_v1	ETHUSDT	0.0	0.0	0.0	0.0	0.0	0.0	0	0.0	0.0	discard	exp#112 mtf_4h_fisher_daily_hma_bbwidth_v1	train
57419ec	mtf_4h_fisher_daily_hma_bbwidth_v1	SOLUSDT	0.0	0.0	0.0	0.0	0.0	0.0	0	0.0	0.0	discard	exp#112 mtf_4h_fisher_daily_hma_bbwidth_v1	train
4149381	mtf_1d_supertrend_weekly_hma_rsi_pullback_v1	BTCUSDT	-0.2357	10.86	2.61	-10.78	69.1	1.25	97	-0.193	0.2423	discard	exp#114 mtf_1d_supertrend_weekly_hma_rsi_pullback_v1	train
4149381	mtf_1d_supertrend_weekly_hma_rsi_pullback_v1	ETHUSDT	-0.3326	3.85	0.95	-18.36	66.7	1.12	84	-0.2521	0.0517	discard	exp#114 mtf_1d_supertrend_weekly_hma_rsi_pullback_v1	train
4149381	mtf_1d_supertrend_weekly_hma_rsi_pullback_v1	SOLUSDT	0.4802	54.59	11.55	-14.32	74.2	1.55	97	0.4889	0.8064	keep	exp#114 mtf_1d_supertrend_weekly_hma_rsi_pullback_v1	train
4149381	mtf_1d_supertrend_weekly_hma_rsi_pullback_v1	SOLUSDT	-0.9446	-15.92	-13.3	-25.26	56.6	0.82	53	-1.1852	-0.5264	discard	exp#114 mtf_1d_supertrend_weekly_hma_rsi_pullback_v1	test
4149381	mtf_1d_supertrend_weekly_hma_rsi_pullback_v1	BTCUSDT	-0.2357	10.86	2.61	-10.78	69.1	1.25	97	-0.193	0.2423	discard	exp#114 mtf_1d_supertrend_weekly_hma_rsi_pullback_v1	train
4149381	mtf_1d_supertrend_weekly_hma_rsi_pullback_v1	ETHUSDT	-0.3326	3.85	0.95	-18.36	66.7	1.12	84	-0.2521	0.0517	discard	exp#114 mtf_1d_supertrend_weekly_hma_rsi_pullback_v1	train
4149381	mtf_1d_supertrend_weekly_hma_rsi_pullback_v1	SOLUSDT	0.4802	54.59	11.55	-14.32	74.2	1.55	97	0.4889	0.8064	discard	exp#114 mtf_1d_supertrend_weekly_hma_rsi_pullback_v1	train
ea808eb	mtf_15m_regime_adaptive_4h_hma_1h_rsi_crsi_v1	BTCUSDT	-9.1974	-53.52	-17.44	-54.28	50.8	0.68	3233	-2.7303	-0.3213	discard	exp#115 mtf_15m_regime_adaptive_4h_hma_1h_rsi_crsi_v1	train
ea808eb	mtf_15m_regime_adaptive_4h_hma_1h_rsi_crsi_v1	ETHUSDT	-7.8069	-54.1	-17.7	-54.8	53.8	0.68	3007	-2.099	-0.323	discard	exp#115 mtf_15m_regime_adaptive_4h_hma_1h_rsi_crsi_v1	train
ea808eb	mtf_15m_regime_adaptive_4h_hma_1h_rsi_crsi_v1	SOLUSDT	-4.8118	-55.36	-18.33	-55.72	57.0	0.7	2668	-1.1956	-0.3289	discard	exp#115 mtf_15m_regime_adaptive_4h_hma_1h_rsi_crsi_v1	train
ea808eb	mtf_15m_regime_adaptive_4h_hma_1h_rsi_crsi_v1	BTCUSDT	-9.1974	-53.52	-17.44	-54.28	50.8	0.68	3233	-2.7303	-0.3213	discard	exp#115 mtf_15m_regime_adaptive_4h_hma_1h_rsi_crsi_v1	train
ea808eb	mtf_15m_regime_adaptive_4h_hma_1h_rsi_crsi_v1	ETHUSDT	-7.8069	-54.1	-17.7	-54.8	53.8	0.68	3007	-2.099	-0.323	discard	exp#115 mtf_15m_regime_adaptive_4h_hma_1h_rsi_crsi_v1	train
ea808eb	mtf_15m_regime_adaptive_4h_hma_1h_rsi_crsi_v1	SOLUSDT	-4.8118	-55.36	-18.33	-55.72	57.0	0.7	2668	-1.1956	-0.3289	discard	exp#115 mtf_15m_regime_adaptive_4h_hma_1h_rsi_crsi_v1	train
757368c	mtf_30m_rsi_pullback_4h_hma_v1	BTCUSDT	-4.8973	-62.1	-21.55	-62.92	56.9	0.85	4118	-2.8805	-0.3425	discard	exp#116 mtf_30m_rsi_pullback_4h_hma_v1	train
757368c	mtf_30m_rsi_pullback_4h_hma_v1	ETHUSDT	-3.502	-58.61	-19.8	-58.61	58.4	0.91	4119	-2.0687	-0.3378	discard	exp#116 mtf_30m_rsi_pullback_4h_hma_v1	train
757368c	mtf_30m_rsi_pullback_4h_hma_v1	SOLUSDT	-2.1231	-60.72	-20.91	-61.48	59.1	0.9	4198	-1.2689	-0.3401	discard	exp#116 mtf_30m_rsi_pullback_4h_hma_v1	train
757368c	mtf_30m_rsi_pullback_4h_hma_v1	BTCUSDT	-4.8973	-62.1	-21.55	-62.92	56.9	0.85	4118	-2.8805	-0.3425	discard	exp#116 mtf_30m_rsi_pullback_4h_hma_v1	train
757368c	mtf_30m_rsi_pullback_4h_hma_v1	ETHUSDT	-3.502	-58.61	-19.8	-58.61	58.4	0.91	4119	-2.0687	-0.3378	discard	exp#116 mtf_30m_rsi_pullback_4h_hma_v1	train
757368c	mtf_30m_rsi_pullback_4h_hma_v1	SOLUSDT	-2.1231	-60.72	-20.91	-61.48	59.1	0.9	4198	-1.2689	-0.3401	discard	exp#116 mtf_30m_rsi_pullback_4h_hma_v1	train
95640bc	mtf_1h_kama_4h_hma_volume_atr_v1	BTCUSDT	-2.7123	-55.94	-18.54	-56.84	38.2	0.93	3947	-2.6143	-0.3261	discard	exp#117 mtf_1h_kama_4h_hma_volume_atr_v1	train
95640bc	mtf_1h_kama_4h_hma_volume_atr_v1	ETHUSDT	-2.1025	-55.51	-18.34	-57.51	38.7	0.97	4047	-2.0336	-0.3189	discard	exp#117 mtf_1h_kama_4h_hma_volume_atr_v1	train
