commit	strategy	symbol	sharpe	return_pct	cagr_pct	max_dd_pct	win_rate	profit_factor	trades	sortino	calmar	status	description	period
ada116d	mtf_15m_mr_4h_hma_chop_zscore_atr_v1	ETHUSDT	-8.716	-97.79	-61.47	-97.79	61.3	0.83	15392	-8.1074	-0.6286	discard	exp#433 mtf_15m_mr_4h_hma_chop_zscore_atr_v1	train
ada116d	mtf_15m_mr_4h_hma_chop_zscore_atr_v1	SOLUSDT	-5.124	-96.8	-57.86	-96.81	63.0	0.87	14245	-4.6164	-0.5977	discard	exp#433 mtf_15m_mr_4h_hma_chop_zscore_atr_v1	train
ada116d	mtf_15m_mr_4h_hma_chop_zscore_atr_v1	BTCUSDT	-10.8988	-97.8	-61.52	-97.85	59.6	0.82	15780	-10.631	-0.6287	discard	exp#433 mtf_15m_mr_4h_hma_chop_zscore_atr_v1	train
ada116d	mtf_15m_mr_4h_hma_chop_zscore_atr_v1	ETHUSDT	-8.716	-97.79	-61.47	-97.79	61.3	0.83	15392	-8.1074	-0.6286	discard	exp#433 mtf_15m_mr_4h_hma_chop_zscore_atr_v1	train
ada116d	mtf_15m_mr_4h_hma_chop_zscore_atr_v1	SOLUSDT	-5.124	-96.8	-57.86	-96.81	63.0	0.87	14245	-4.6164	-0.5977	discard	exp#433 mtf_15m_mr_4h_hma_chop_zscore_atr_v1	train
a495d1c	mtf_30m_supertrend_4h_hma_rsi_simple_v1	BTCUSDT	-1.5833	-39.15	-11.69	-42.54	24.2	0.97	2956	-1.5814	-0.2747	discard	exp#434 mtf_30m_supertrend_4h_hma_rsi_simple_v1	train
a495d1c	mtf_30m_supertrend_4h_hma_rsi_simple_v1	ETHUSDT	-0.9731	-28.89	-8.18	-35.92	24.7	1.03	2975	-0.9677	-0.2276	discard	exp#434 mtf_30m_supertrend_4h_hma_rsi_simple_v1	train
a495d1c	mtf_30m_supertrend_4h_hma_rsi_simple_v1	SOLUSDT	0.4642	65.96	13.56	-35.51	25.9	1.15	3013	0.491	0.3819	keep	exp#434 mtf_30m_supertrend_4h_hma_rsi_simple_v1	train
a495d1c	mtf_30m_supertrend_4h_hma_rsi_simple_v1	SOLUSDT	-0.8691	-9.35	-7.76	-20.02	25.3	1.02	957	-0.9075	-0.3876	discard	exp#434 mtf_30m_supertrend_4h_hma_rsi_simple_v1	test
a495d1c	mtf_30m_supertrend_4h_hma_rsi_simple_v1	BTCUSDT	-1.5833	-39.15	-11.69	-42.54	24.2	0.97	2956	-1.5814	-0.2747	discard	exp#434 mtf_30m_supertrend_4h_hma_rsi_simple_v1	train
a495d1c	mtf_30m_supertrend_4h_hma_rsi_simple_v1	ETHUSDT	-0.9731	-28.89	-8.18	-35.92	24.7	1.03	2975	-0.9677	-0.2276	discard	exp#434 mtf_30m_supertrend_4h_hma_rsi_simple_v1	train
a495d1c	mtf_30m_supertrend_4h_hma_rsi_simple_v1	SOLUSDT	0.4642	65.96	13.56	-35.51	25.9	1.15	3013	0.491	0.3819	discard	exp#434 mtf_30m_supertrend_4h_hma_rsi_simple_v1	train
71b3b51	mtf_1h_rsi_pullback_12h_hma_vol_regime_atr_v1	BTCUSDT	-4.8738	-78.71	-32.09	-78.99	41.8	0.89	5647	-4.1873	-0.4062	discard	exp#435 mtf_1h_rsi_pullback_12h_hma_vol_regime_atr_v1	train
71b3b51	mtf_1h_rsi_pullback_12h_hma_vol_regime_atr_v1	ETHUSDT	-3.126	-70.42	-26.27	-72.71	42.7	0.96	5723	-2.7818	-0.3612	discard	exp#435 mtf_1h_rsi_pullback_12h_hma_vol_regime_atr_v1	train
71b3b51	mtf_1h_rsi_pullback_12h_hma_vol_regime_atr_v1	SOLUSDT	-1.5836	-61.67	-21.39	-62.65	44.6	1.01	5899	-1.4278	-0.3415	discard	exp#435 mtf_1h_rsi_pullback_12h_hma_vol_regime_atr_v1	train
71b3b51	mtf_1h_rsi_pullback_12h_hma_vol_regime_atr_v1	BTCUSDT	-4.8738	-78.71	-32.09	-78.99	41.8	0.89	5647	-4.1873	-0.4062	discard	exp#435 mtf_1h_rsi_pullback_12h_hma_vol_regime_atr_v1	train
71b3b51	mtf_1h_rsi_pullback_12h_hma_vol_regime_atr_v1	ETHUSDT	-3.126	-70.42	-26.27	-72.71	42.7	0.96	5723	-2.7818	-0.3612	discard	exp#435 mtf_1h_rsi_pullback_12h_hma_vol_regime_atr_v1	train
71b3b51	mtf_1h_rsi_pullback_12h_hma_vol_regime_atr_v1	SOLUSDT	-1.5836	-61.67	-21.39	-62.65	44.6	1.01	5899	-1.4278	-0.3415	discard	exp#435 mtf_1h_rsi_pullback_12h_hma_vol_regime_atr_v1	train
4d650f6	mtf_4h_supertrend_daily_hma_rsi_pullback_atr_v2	BTCUSDT	-0.9149	-20.55	-5.59	-36.91	42.5	0.95	567	-0.8922	-0.1515	discard	exp#436 mtf_4h_supertrend_daily_hma_rsi_pullback_atr_v2	train
4d650f6	mtf_4h_supertrend_daily_hma_rsi_pullback_atr_v2	ETHUSDT	-0.6237	-13.63	-3.6	-32.15	39.5	1.01	559	-0.6265	-0.1119	discard	exp#436 mtf_4h_supertrend_daily_hma_rsi_pullback_atr_v2	train
4d650f6	mtf_4h_supertrend_daily_hma_rsi_pullback_atr_v2	SOLUSDT	-0.0875	5.21	1.28	-26.47	44.4	1.1	520	-0.0845	0.0485	discard	exp#436 mtf_4h_supertrend_daily_hma_rsi_pullback_atr_v2	train
4d650f6	mtf_4h_supertrend_daily_hma_rsi_pullback_atr_v2	BTCUSDT	-0.9149	-20.55	-5.59	-36.91	42.5	0.95	567	-0.8922	-0.1515	discard	exp#436 mtf_4h_supertrend_daily_hma_rsi_pullback_atr_v2	train
4d650f6	mtf_4h_supertrend_daily_hma_rsi_pullback_atr_v2	ETHUSDT	-0.6237	-13.63	-3.6	-32.15	39.5	1.01	559	-0.6265	-0.1119	discard	exp#436 mtf_4h_supertrend_daily_hma_rsi_pullback_atr_v2	train
4d650f6	mtf_4h_supertrend_daily_hma_rsi_pullback_atr_v2	SOLUSDT	-0.0875	5.21	1.28	-26.47	44.4	1.1	520	-0.0845	0.0485	discard	exp#436 mtf_4h_supertrend_daily_hma_rsi_pullback_atr_v2	train
9035a01	mtf_12h_kama_daily_hma_rsi_adx_pullback_atr_v1	BTCUSDT	-0.2679	-2.59	-0.65	-28.74	33.2	1.34	400	-0.3533	-0.0227	discard	exp#437 mtf_12h_kama_daily_hma_rsi_adx_pullback_atr_v1	train
9035a01	mtf_12h_kama_daily_hma_rsi_adx_pullback_atr_v1	ETHUSDT	-0.3406	-15.03	-3.99	-28.55	31.8	1.22	402	-0.4442	-0.1397	discard	exp#437 mtf_12h_kama_daily_hma_rsi_adx_pullback_atr_v1	train
9035a01	mtf_12h_kama_daily_hma_rsi_adx_pullback_atr_v1	SOLUSDT	0.5697	106.51	19.96	-30.01	34.9	1.81	361	0.7457	0.6651	keep	exp#437 mtf_12h_kama_daily_hma_rsi_adx_pullback_atr_v1	train
9035a01	mtf_12h_kama_daily_hma_rsi_adx_pullback_atr_v1	SOLUSDT	0.0476	4.1	3.36	-23.06	37.8	1.29	119	0.0642	0.1456	keep	exp#437 mtf_12h_kama_daily_hma_rsi_adx_pullback_atr_v1	test
9035a01	mtf_12h_kama_daily_hma_rsi_adx_pullback_atr_v1	BTCUSDT	-0.2679	-2.59	-0.65	-28.74	33.2	1.34	400	-0.3533	-0.0227	discard	exp#437 mtf_12h_kama_daily_hma_rsi_adx_pullback_atr_v1	train
9035a01	mtf_12h_kama_daily_hma_rsi_adx_pullback_atr_v1	ETHUSDT	-0.3406	-15.03	-3.99	-28.55	31.8	1.22	402	-0.4442	-0.1397	discard	exp#437 mtf_12h_kama_daily_hma_rsi_adx_pullback_atr_v1	train
9035a01	mtf_12h_kama_daily_hma_rsi_adx_pullback_atr_v1	SOLUSDT	0.5697	106.51	19.96	-30.01	34.9	1.81	361	0.7457	0.6651	keep	exp#437 mtf_12h_kama_daily_hma_rsi_adx_pullback_atr_v1	train
9035a01	mtf_12h_kama_daily_hma_rsi_adx_pullback_atr_v1	SOLUSDT	0.0476	4.1	3.36	-23.06	37.8	1.29	119	0.0642	0.1456	keep	exp#437 mtf_12h_kama_daily_hma_rsi_adx_pullback_atr_v1	test
2bc52dd	mtf_1d_donchian_weekly_hma_rsi_breakout_atr_v1	BTCUSDT	-0.347	-0.86	-0.22	-23.29	34.2	1.16	114	-0.3959	-0.0093	discard	exp#438 mtf_1d_donchian_weekly_hma_rsi_breakout_atr_v1	train
2bc52dd	mtf_1d_donchian_weekly_hma_rsi_breakout_atr_v1	ETHUSDT	-0.1976	3.4	0.84	-28.79	28.8	1.26	118	-0.2143	0.0292	discard	exp#438 mtf_1d_donchian_weekly_hma_rsi_breakout_atr_v1	train
2bc52dd	mtf_1d_donchian_weekly_hma_rsi_breakout_atr_v1	SOLUSDT	0.8472	149.14	25.73	-21.1	37.1	2.17	105	1.0758	1.2196	keep	exp#438 mtf_1d_donchian_weekly_hma_rsi_breakout_atr_v1	train
2bc52dd	mtf_1d_donchian_weekly_hma_rsi_breakout_atr_v1	SOLUSDT	0.5061	14.02	11.4	-8.49	68.8	2.52	16	0.5669	1.3425	keep	exp#438 mtf_1d_donchian_weekly_hma_rsi_breakout_atr_v1	test
2bc52dd	mtf_1d_donchian_weekly_hma_rsi_breakout_atr_v1	BTCUSDT	-0.347	-0.86	-0.22	-23.29	34.2	1.16	114	-0.3959	-0.0093	discard	exp#438 mtf_1d_donchian_weekly_hma_rsi_breakout_atr_v1	train
2bc52dd	mtf_1d_donchian_weekly_hma_rsi_breakout_atr_v1	ETHUSDT	-0.1976	3.4	0.84	-28.79	28.8	1.26	118	-0.2143	0.0292	discard	exp#438 mtf_1d_donchian_weekly_hma_rsi_breakout_atr_v1	train
2bc52dd	mtf_1d_donchian_weekly_hma_rsi_breakout_atr_v1	SOLUSDT	0.8472	149.14	25.73	-21.1	37.1	2.17	105	1.0758	1.2196	keep	exp#438 mtf_1d_donchian_weekly_hma_rsi_breakout_atr_v1	train
2bc52dd	mtf_1d_donchian_weekly_hma_rsi_breakout_atr_v1	SOLUSDT	0.5061	14.02	11.4	-8.49	68.8	2.52	16	0.5669	1.3425	keep	exp#438 mtf_1d_donchian_weekly_hma_rsi_breakout_atr_v1	test
27d6fef	mtf_15m_hma_4h_bias_1h_rsi_pullback_vol_adx_atr_v1	BTCUSDT	-7.0318	-98.59	-65.54	-98.66	29.3	0.98	15589	-8.6293	-0.6644	discard	exp#439 mtf_15m_hma_4h_bias_1h_rsi_pullback_vol_adx_atr_v1	train
27d6fef	mtf_15m_hma_4h_bias_1h_rsi_pullback_vol_adx_atr_v1	ETHUSDT	-5.1027	-97.97	-62.27	-98.0	31.4	1.04	15593	-6.2563	-0.6355	discard	exp#439 mtf_15m_hma_4h_bias_1h_rsi_pullback_vol_adx_atr_v1	train
27d6fef	mtf_15m_hma_4h_bias_1h_rsi_pullback_vol_adx_atr_v1	SOLUSDT	-3.0746	-97.84	-61.81	-98.22	33.5	1.11	15311	-3.7276	-0.6293	discard	exp#439 mtf_15m_hma_4h_bias_1h_rsi_pullback_vol_adx_atr_v1	train
27d6fef	mtf_15m_hma_4h_bias_1h_rsi_pullback_vol_adx_atr_v1	BTCUSDT	-7.0318	-98.59	-65.54	-98.66	29.3	0.98	15589	-8.6293	-0.6644	discard	exp#439 mtf_15m_hma_4h_bias_1h_rsi_pullback_vol_adx_atr_v1	train
27d6fef	mtf_15m_hma_4h_bias_1h_rsi_pullback_vol_adx_atr_v1	ETHUSDT	-5.1027	-97.97	-62.27	-98.0	31.4	1.04	15593	-6.2563	-0.6355	discard	exp#439 mtf_15m_hma_4h_bias_1h_rsi_pullback_vol_adx_atr_v1	train
27d6fef	mtf_15m_hma_4h_bias_1h_rsi_pullback_vol_adx_atr_v1	SOLUSDT	-3.0746	-97.84	-61.81	-98.22	33.5	1.11	15311	-3.7276	-0.6293	discard	exp#439 mtf_15m_hma_4h_bias_1h_rsi_pullback_vol_adx_atr_v1	train
672a691	mtf_30m_donchian_4h_hma_adx_rsi_breakout_atr_v1	BTCUSDT	-4.6978	-90.82	-44.97	-91.05	25.2	0.95	8352	-5.6759	-0.494	discard	exp#440 mtf_30m_donchian_4h_hma_adx_rsi_breakout_atr_v1	train
672a691	mtf_30m_donchian_4h_hma_adx_rsi_breakout_atr_v1	ETHUSDT	-3.2739	-87.54	-40.61	-87.63	27.2	1.03	8293	-3.9931	-0.4634	discard	exp#440 mtf_30m_donchian_4h_hma_adx_rsi_breakout_atr_v1	train
672a691	mtf_30m_donchian_4h_hma_adx_rsi_breakout_atr_v1	SOLUSDT	-1.8733	-85.55	-38.47	-88.93	29.3	1.12	8121	-2.2852	-0.4326	discard	exp#440 mtf_30m_donchian_4h_hma_adx_rsi_breakout_atr_v1	train
672a691	mtf_30m_donchian_4h_hma_adx_rsi_breakout_atr_v1	BTCUSDT	-4.6978	-90.82	-44.97	-91.05	25.2	0.95	8352	-5.6759	-0.494	discard	exp#440 mtf_30m_donchian_4h_hma_adx_rsi_breakout_atr_v1	train
672a691	mtf_30m_donchian_4h_hma_adx_rsi_breakout_atr_v1	ETHUSDT	-3.2739	-87.54	-40.61	-87.63	27.2	1.03	8293	-3.9931	-0.4634	discard	exp#440 mtf_30m_donchian_4h_hma_adx_rsi_breakout_atr_v1	train
672a691	mtf_30m_donchian_4h_hma_adx_rsi_breakout_atr_v1	SOLUSDT	-1.8733	-85.55	-38.47	-88.93	29.3	1.12	8121	-2.2852	-0.4326	discard	exp#440 mtf_30m_donchian_4h_hma_adx_rsi_breakout_atr_v1	train
2213729	mtf_1h_regime_adaptive_4h_hma_chop_rsi_atr_v1	BTCUSDT	-3.8986	-56.45	-18.78	-57.62	52.5	0.86	3557	-2.5647	-0.3259	discard	exp#441 mtf_1h_regime_adaptive_4h_hma_chop_rsi_atr_v1	train
2213729	mtf_1h_regime_adaptive_4h_hma_chop_rsi_atr_v1	ETHUSDT	-3.2621	-58.56	-19.78	-60.45	51.6	0.89	3540	-2.2828	-0.3272	discard	exp#441 mtf_1h_regime_adaptive_4h_hma_chop_rsi_atr_v1	train
2213729	mtf_1h_regime_adaptive_4h_hma_chop_rsi_atr_v1	SOLUSDT	-0.6903	-18.2	-4.92	-37.97	55.0	1.05	3230	-0.4771	-0.1296	discard	exp#441 mtf_1h_regime_adaptive_4h_hma_chop_rsi_atr_v1	train
2213729	mtf_1h_regime_adaptive_4h_hma_chop_rsi_atr_v1	BTCUSDT	-3.8986	-56.45	-18.78	-57.62	52.5	0.86	3557	-2.5647	-0.3259	discard	exp#441 mtf_1h_regime_adaptive_4h_hma_chop_rsi_atr_v1	train
2213729	mtf_1h_regime_adaptive_4h_hma_chop_rsi_atr_v1	ETHUSDT	-3.2621	-58.56	-19.78	-60.45	51.6	0.89	3540	-2.2828	-0.3272	discard	exp#441 mtf_1h_regime_adaptive_4h_hma_chop_rsi_atr_v1	train
2213729	mtf_1h_regime_adaptive_4h_hma_chop_rsi_atr_v1	SOLUSDT	-0.6903	-18.2	-4.92	-37.97	55.0	1.05	3230	-0.4771	-0.1296	discard	exp#441 mtf_1h_regime_adaptive_4h_hma_chop_rsi_atr_v1	train
3b02037	mtf_4h_kama_fisher_daily_hma_volume_atr_v1	BTCUSDT	-0.9772	-34.63	-10.09	-44.07	36.6	0.97	1402	-1.1599	-0.2289	discard	exp#442 mtf_4h_kama_fisher_daily_hma_volume_atr_v1	train
3b02037	mtf_4h_kama_fisher_daily_hma_volume_atr_v1	ETHUSDT	-1.1183	-51.26	-16.45	-52.57	37.0	0.93	1507	-1.3026	-0.313	discard	exp#442 mtf_4h_kama_fisher_daily_hma_volume_atr_v1	train
3b02037	mtf_4h_kama_fisher_daily_hma_volume_atr_v1	SOLUSDT	0.1151	17.79	4.2	-35.08	39.8	1.1	1393	0.1416	0.1196	keep	exp#442 mtf_4h_kama_fisher_daily_hma_volume_atr_v1	train
3b02037	mtf_4h_kama_fisher_daily_hma_volume_atr_v1	SOLUSDT	0.2842	11.09	9.04	-19.89	38.6	1.13	448	0.3681	0.4544	keep	exp#442 mtf_4h_kama_fisher_daily_hma_volume_atr_v1	test
3b02037	mtf_4h_kama_fisher_daily_hma_volume_atr_v1	BTCUSDT	-0.9772	-34.63	-10.09	-44.07	36.6	0.97	1402	-1.1599	-0.2289	discard	exp#442 mtf_4h_kama_fisher_daily_hma_volume_atr_v1	train
3b02037	mtf_4h_kama_fisher_daily_hma_volume_atr_v1	ETHUSDT	-1.1183	-51.26	-16.45	-52.57	37.0	0.93	1507	-1.3026	-0.313	discard	exp#442 mtf_4h_kama_fisher_daily_hma_volume_atr_v1	train
3b02037	mtf_4h_kama_fisher_daily_hma_volume_atr_v1	SOLUSDT	0.1151	17.79	4.2	-35.08	39.8	1.1	1393	0.1416	0.1196	keep	exp#442 mtf_4h_kama_fisher_daily_hma_volume_atr_v1	train
3b02037	mtf_4h_kama_fisher_daily_hma_volume_atr_v1	SOLUSDT	0.2842	11.09	9.04	-19.89	38.6	1.13	448	0.3681	0.4544	keep	exp#442 mtf_4h_kama_fisher_daily_hma_volume_atr_v1	test
2967c5e	mtf_12h_donchian_daily_hma_weekly_chop_rsi_atr_v1	BTCUSDT	-0.1629	8.24	2.0	-15.67	42.5	1.24	433	-0.1888	0.1276	discard	exp#443 mtf_12h_donchian_daily_hma_weekly_chop_rsi_atr_v1	train
2967c5e	mtf_12h_donchian_daily_hma_weekly_chop_rsi_atr_v1	ETHUSDT	-0.5411	-19.62	-5.31	-37.97	40.9	0.98	435	-0.6439	-0.14	discard	exp#443 mtf_12h_donchian_daily_hma_weekly_chop_rsi_atr_v1	train
2967c5e	mtf_12h_donchian_daily_hma_weekly_chop_rsi_atr_v1	SOLUSDT	0.7835	145.86	25.33	-28.03	46.5	1.33	454	1.0008	0.9036	keep	exp#443 mtf_12h_donchian_daily_hma_weekly_chop_rsi_atr_v1	train
2967c5e	mtf_12h_donchian_daily_hma_weekly_chop_rsi_atr_v1	SOLUSDT	-0.5403	-11.44	-9.51	-27.19	45.7	0.92	151	-0.716	-0.3496	discard	exp#443 mtf_12h_donchian_daily_hma_weekly_chop_rsi_atr_v1	test
2967c5e	mtf_12h_donchian_daily_hma_weekly_chop_rsi_atr_v1	BTCUSDT	-0.1629	8.24	2.0	-15.67	42.5	1.24	433	-0.1888	0.1276	discard	exp#443 mtf_12h_donchian_daily_hma_weekly_chop_rsi_atr_v1	train
2967c5e	mtf_12h_donchian_daily_hma_weekly_chop_rsi_atr_v1	ETHUSDT	-0.5411	-19.62	-5.31	-37.97	40.9	0.98	435	-0.6439	-0.14	discard	exp#443 mtf_12h_donchian_daily_hma_weekly_chop_rsi_atr_v1	train
2967c5e	mtf_12h_donchian_daily_hma_weekly_chop_rsi_atr_v1	SOLUSDT	0.7835	145.86	25.33	-28.03	46.5	1.33	454	1.0008	0.9036	discard	exp#443 mtf_12h_donchian_daily_hma_weekly_chop_rsi_atr_v1	train
8a0c8c9	mtf_1d_crsi_weekly_hma_chop_regime_atr_v1	BTCUSDT	-0.5783	5.61	1.37	-9.62	70.5	1.24	112	-0.3213	0.1428	discard	exp#444 mtf_1d_crsi_weekly_hma_chop_regime_atr_v1	train
8a0c8c9	mtf_1d_crsi_weekly_hma_chop_regime_atr_v1	ETHUSDT	-1.4099	-20.67	-5.63	-22.67	58.5	0.67	118	-0.7705	-0.2481	discard	exp#444 mtf_1d_crsi_weekly_hma_chop_regime_atr_v1	train
8a0c8c9	mtf_1d_crsi_weekly_hma_chop_regime_atr_v1	SOLUSDT	-0.379	-0.07	-0.02	-18.53	67.4	1.03	129	-0.2167	-0.001	discard	exp#444 mtf_1d_crsi_weekly_hma_chop_regime_atr_v1	train
8a0c8c9	mtf_1d_crsi_weekly_hma_chop_regime_atr_v1	BTCUSDT	-0.5783	5.61	1.37	-9.62	70.5	1.24	112	-0.3213	0.1428	discard	exp#444 mtf_1d_crsi_weekly_hma_chop_regime_atr_v1	train
8a0c8c9	mtf_1d_crsi_weekly_hma_chop_regime_atr_v1	ETHUSDT	-1.4099	-20.67	-5.63	-22.67	58.5	0.67	118	-0.7705	-0.2481	discard	exp#444 mtf_1d_crsi_weekly_hma_chop_regime_atr_v1	train
8a0c8c9	mtf_1d_crsi_weekly_hma_chop_regime_atr_v1	SOLUSDT	-0.379	-0.07	-0.02	-18.53	67.4	1.03	129	-0.2167	-0.001	discard	exp#444 mtf_1d_crsi_weekly_hma_chop_regime_atr_v1	train
3084ef6	mtf_15m_4h_hma_1h_rsi_chop_vol_atr_v1	BTCUSDT	-11.4905	-98.02	-62.51	-98.05	41.6	0.76	15051	-8.7952	-0.6376	discard	exp#445 mtf_15m_4h_hma_1h_rsi_chop_vol_atr_v1	train
3084ef6	mtf_15m_4h_hma_1h_rsi_chop_vol_atr_v1	ETHUSDT	-8.7455	-98.04	-62.59	-98.05	42.9	0.79	14850	-6.6399	-0.6383	discard	exp#445 mtf_15m_4h_hma_1h_rsi_chop_vol_atr_v1	train
3084ef6	mtf_15m_4h_hma_1h_rsi_chop_vol_atr_v1	SOLUSDT	-6.1645	-98.66	-66.1	-98.66	46.4	0.79	14897	-4.4089	-0.67	discard	exp#445 mtf_15m_4h_hma_1h_rsi_chop_vol_atr_v1	train
3084ef6	mtf_15m_4h_hma_1h_rsi_chop_vol_atr_v1	BTCUSDT	-11.4905	-98.02	-62.51	-98.05	41.6	0.76	15051	-8.7952	-0.6376	discard	exp#445 mtf_15m_4h_hma_1h_rsi_chop_vol_atr_v1	train
3084ef6	mtf_15m_4h_hma_1h_rsi_chop_vol_atr_v1	ETHUSDT	-8.7455	-98.04	-62.59	-98.05	42.9	0.79	14850	-6.6399	-0.6383	discard	exp#445 mtf_15m_4h_hma_1h_rsi_chop_vol_atr_v1	train
3084ef6	mtf_15m_4h_hma_1h_rsi_chop_vol_atr_v1	SOLUSDT	-6.1645	-98.66	-66.1	-98.66	46.4	0.79	14897	-4.4089	-0.67	discard	exp#445 mtf_15m_4h_hma_1h_rsi_chop_vol_atr_v1	train
f67f413	mtf_30m_bb_meanrev_4h_hma_rsi_extreme_atr_v1	BTCUSDT	-7.0933	-91.23	-45.6	-91.51	53.0	0.79	7640	-4.6508	-0.4984	discard	exp#446 mtf_30m_bb_meanrev_4h_hma_rsi_extreme_atr_v1	train
f67f413	mtf_30m_bb_meanrev_4h_hma_rsi_extreme_atr_v1	ETHUSDT	-5.6824	-91.43	-45.92	-92.46	53.2	0.86	7679	-3.733	-0.4967	discard	exp#446 mtf_30m_bb_meanrev_4h_hma_rsi_extreme_atr_v1	train
f67f413	mtf_30m_bb_meanrev_4h_hma_rsi_extreme_atr_v1	SOLUSDT	-2.4391	-81.49	-34.52	-83.95	55.3	0.94	7428	-1.5884	-0.4112	discard	exp#446 mtf_30m_bb_meanrev_4h_hma_rsi_extreme_atr_v1	train
f67f413	mtf_30m_bb_meanrev_4h_hma_rsi_extreme_atr_v1	BTCUSDT	-7.0933	-91.23	-45.6	-91.51	53.0	0.79	7640	-4.6508	-0.4984	discard	exp#446 mtf_30m_bb_meanrev_4h_hma_rsi_extreme_atr_v1	train
f67f413	mtf_30m_bb_meanrev_4h_hma_rsi_extreme_atr_v1	ETHUSDT	-5.6824	-91.43	-45.92	-92.46	53.2	0.86	7679	-3.733	-0.4967	discard	exp#446 mtf_30m_bb_meanrev_4h_hma_rsi_extreme_atr_v1	train
f67f413	mtf_30m_bb_meanrev_4h_hma_rsi_extreme_atr_v1	SOLUSDT	-2.4391	-81.49	-34.52	-83.95	55.3	0.94	7428	-1.5884	-0.4112	discard	exp#446 mtf_30m_bb_meanrev_4h_hma_rsi_extreme_atr_v1	train
e2a32f6	mtf_1h_crsi_4h_hma_chop_regime_atr_v1	BTCUSDT	-3.8799	-49.09	-15.54	-49.63	56.2	0.79	2214	-2.0349	-0.3131	discard	exp#447 mtf_1h_crsi_4h_hma_chop_regime_atr_v1	train
e2a32f6	mtf_1h_crsi_4h_hma_chop_regime_atr_v1	ETHUSDT	-3.4734	-50.88	-16.29	-51.5	57.7	0.8	2098	-1.6848	-0.3164	discard	exp#447 mtf_1h_crsi_4h_hma_chop_regime_atr_v1	train
e2a32f6	mtf_1h_crsi_4h_hma_chop_regime_atr_v1	SOLUSDT	-1.7193	-39.97	-12.02	-44.03	58.0	0.91	1944	-0.8336	-0.2731	discard	exp#447 mtf_1h_crsi_4h_hma_chop_regime_atr_v1	train
e2a32f6	mtf_1h_crsi_4h_hma_chop_regime_atr_v1	BTCUSDT	-3.8799	-49.09	-15.54	-49.63	56.2	0.79	2214	-2.0349	-0.3131	discard	exp#447 mtf_1h_crsi_4h_hma_chop_regime_atr_v1	train
e2a32f6	mtf_1h_crsi_4h_hma_chop_regime_atr_v1	ETHUSDT	-3.4734	-50.88	-16.29	-51.5	57.7	0.8	2098	-1.6848	-0.3164	discard	exp#447 mtf_1h_crsi_4h_hma_chop_regime_atr_v1	train
e2a32f6	mtf_1h_crsi_4h_hma_chop_regime_atr_v1	SOLUSDT	-1.7193	-39.97	-12.02	-44.03	58.0	0.91	1944	-0.8336	-0.2731	discard	exp#447 mtf_1h_crsi_4h_hma_chop_regime_atr_v1	train
ebf8c94	mtf_4h_regime_chop_weekly_hma_rsi_atr_v1	BTCUSDT	-2.1221	-40.58	-12.21	-44.07	44.4	0.89	1538	-1.8525	-0.277	discard	exp#448 mtf_4h_regime_chop_weekly_hma_rsi_atr_v1	train
ebf8c94	mtf_4h_regime_chop_weekly_hma_rsi_atr_v1	ETHUSDT	-1.3837	-29.98	-8.53	-35.98	46.9	0.96	1458	-1.1669	-0.237	discard	exp#448 mtf_4h_regime_chop_weekly_hma_rsi_atr_v1	train
ebf8c94	mtf_4h_regime_chop_weekly_hma_rsi_atr_v1	SOLUSDT	-1.6282	-57.87	-19.51	-62.7	44.8	0.85	1582	-1.3907	-0.3111	discard	exp#448 mtf_4h_regime_chop_weekly_hma_rsi_atr_v1	train
ebf8c94	mtf_4h_regime_chop_weekly_hma_rsi_atr_v1	BTCUSDT	-2.1221	-40.58	-12.21	-44.07	44.4	0.89	1538	-1.8525	-0.277	discard	exp#448 mtf_4h_regime_chop_weekly_hma_rsi_atr_v1	train
ebf8c94	mtf_4h_regime_chop_weekly_hma_rsi_atr_v1	ETHUSDT	-1.3837	-29.98	-8.53	-35.98	46.9	0.96	1458	-1.1669	-0.237	discard	exp#448 mtf_4h_regime_chop_weekly_hma_rsi_atr_v1	train
ebf8c94	mtf_4h_regime_chop_weekly_hma_rsi_atr_v1	SOLUSDT	-1.6282	-57.87	-19.51	-62.7	44.8	0.85	1582	-1.3907	-0.3111	discard	exp#448 mtf_4h_regime_chop_weekly_hma_rsi_atr_v1	train
b3d228c	mtf_12h_hma_daily_bias_rsi_pullback_atr_v1	BTCUSDT	-0.1079	7.89	1.92	-25.66	33.4	1.25	359	-0.1414	0.0747	discard	exp#449 mtf_12h_hma_daily_bias_rsi_pullback_atr_v1	train
b3d228c	mtf_12h_hma_daily_bias_rsi_pullback_atr_v1	ETHUSDT	-0.2136	-5.09	-1.3	-30.15	30.3	1.14	380	-0.2773	-0.043	discard	exp#449 mtf_12h_hma_daily_bias_rsi_pullback_atr_v1	train
b3d228c	mtf_12h_hma_daily_bias_rsi_pullback_atr_v1	SOLUSDT	0.2926	44.34	9.65	-44.54	37.8	1.27	347	0.3598	0.2166	keep	exp#449 mtf_12h_hma_daily_bias_rsi_pullback_atr_v1	train
b3d228c	mtf_12h_hma_daily_bias_rsi_pullback_atr_v1	SOLUSDT	0.1742	8.06	6.59	-19.86	35.4	1.25	113	0.2356	0.3318	keep	exp#449 mtf_12h_hma_daily_bias_rsi_pullback_atr_v1	test
b3d228c	mtf_12h_hma_daily_bias_rsi_pullback_atr_v1	BTCUSDT	-0.1079	7.89	1.92	-25.66	33.4	1.25	359	-0.1414	0.0747	discard	exp#449 mtf_12h_hma_daily_bias_rsi_pullback_atr_v1	train
b3d228c	mtf_12h_hma_daily_bias_rsi_pullback_atr_v1	ETHUSDT	-0.2136	-5.09	-1.3	-30.15	30.3	1.14	380	-0.2773	-0.043	discard	exp#449 mtf_12h_hma_daily_bias_rsi_pullback_atr_v1	train
b3d228c	mtf_12h_hma_daily_bias_rsi_pullback_atr_v1	SOLUSDT	0.2926	44.34	9.65	-44.54	37.8	1.27	347	0.3598	0.2166	keep	exp#449 mtf_12h_hma_daily_bias_rsi_pullback_atr_v1	train
b3d228c	mtf_12h_hma_daily_bias_rsi_pullback_atr_v1	SOLUSDT	0.1742	8.06	6.59	-19.86	35.4	1.25	113	0.2356	0.3318	keep	exp#449 mtf_12h_hma_daily_bias_rsi_pullback_atr_v1	test
b27681c	mtf_1d_kama_weekly_bias_rsi_pullback_atr_v1	BTCUSDT	-0.3045	1.88	0.47	-24.04	37.3	1.17	118	-0.3625	0.0195	discard	exp#450 mtf_1d_kama_weekly_bias_rsi_pullback_atr_v1	train
b27681c	mtf_1d_kama_weekly_bias_rsi_pullback_atr_v1	ETHUSDT	-0.324	-4.23	-1.07	-33.01	43.8	1.08	128	-0.3599	-0.0325	discard	exp#450 mtf_1d_kama_weekly_bias_rsi_pullback_atr_v1	train
b27681c	mtf_1d_kama_weekly_bias_rsi_pullback_atr_v1	SOLUSDT	0.4519	65.9	13.54	-26.81	35.4	1.47	147	0.5906	0.5051	keep	exp#450 mtf_1d_kama_weekly_bias_rsi_pullback_atr_v1	train
b27681c	mtf_1d_kama_weekly_bias_rsi_pullback_atr_v1	SOLUSDT	-0.4977	-3.17	-2.62	-11.26	40.5	0.99	37	-0.5158	-0.2323	discard	exp#450 mtf_1d_kama_weekly_bias_rsi_pullback_atr_v1	test
b27681c	mtf_1d_kama_weekly_bias_rsi_pullback_atr_v1	BTCUSDT	-0.3045	1.88	0.47	-24.04	37.3	1.17	118	-0.3625	0.0195	discard	exp#450 mtf_1d_kama_weekly_bias_rsi_pullback_atr_v1	train
b27681c	mtf_1d_kama_weekly_bias_rsi_pullback_atr_v1	ETHUSDT	-0.324	-4.23	-1.07	-33.01	43.8	1.08	128	-0.3599	-0.0325	discard	exp#450 mtf_1d_kama_weekly_bias_rsi_pullback_atr_v1	train
b27681c	mtf_1d_kama_weekly_bias_rsi_pullback_atr_v1	SOLUSDT	0.4519	65.9	13.54	-26.81	35.4	1.47	147	0.5906	0.5051	discard	exp#450 mtf_1d_kama_weekly_bias_rsi_pullback_atr_v1	train
f59d56d	mtf_15m_4h_hma_1h_rsi_vol_pullback_atr_v1	BTCUSDT	-7.3586	-97.22	-59.21	-97.32	30.5	0.98	13868	-8.2305	-0.6083	discard	exp#451 mtf_15m_4h_hma_1h_rsi_vol_pullback_atr_v1	train
