commit	strategy	symbol	sharpe	return_pct	cagr_pct	max_dd_pct	win_rate	profit_factor	trades	sortino	calmar	status	description	period
9ad91ed	mtf_4h_donchian_daily_v1	SOLUSDT	0.9913	194.63	31.16	-27.49	51.2	1.23	770	1.1537	1.1334	discard	exp#004 mtf_4h_donchian_daily_v1	train
c0dfd8f	mtf_12h_hma_rsi_daily_v1	BTCUSDT	-1.005	-13.51	-3.56	-20.66	50.9	0.92	277	-0.7103	-0.1725	discard	exp#005 mtf_12h_hma_rsi_daily_v1	train
c0dfd8f	mtf_12h_hma_rsi_daily_v1	ETHUSDT	-0.1415	10.59	2.55	-14.82	49.3	1.15	282	-0.1189	0.172	discard	exp#005 mtf_12h_hma_rsi_daily_v1	train
c0dfd8f	mtf_12h_hma_rsi_daily_v1	SOLUSDT	0.8523	91.82	17.76	-13.96	56.7	1.48	268	0.744	1.2724	keep	exp#005 mtf_12h_hma_rsi_daily_v1	train
c0dfd8f	mtf_12h_hma_rsi_daily_v1	SOLUSDT	0.7429	17.29	14.02	-7.92	52.9	1.57	87	0.6257	1.7695	keep	exp#005 mtf_12h_hma_rsi_daily_v1	test
c0dfd8f	mtf_12h_hma_rsi_daily_v1	BTCUSDT	-1.005	-13.51	-3.56	-20.66	50.9	0.92	277	-0.7103	-0.1725	discard	exp#005 mtf_12h_hma_rsi_daily_v1	train
c0dfd8f	mtf_12h_hma_rsi_daily_v1	ETHUSDT	-0.1415	10.59	2.55	-14.82	49.3	1.15	282	-0.1189	0.172	discard	exp#005 mtf_12h_hma_rsi_daily_v1	train
c0dfd8f	mtf_12h_hma_rsi_daily_v1	SOLUSDT	0.8523	91.82	17.76	-13.96	56.7	1.48	268	0.744	1.2724	keep	exp#005 mtf_12h_hma_rsi_daily_v1	train
c0dfd8f	mtf_12h_hma_rsi_daily_v1	SOLUSDT	0.7429	17.29	14.02	-7.92	52.9	1.57	87	0.6257	1.7695	keep	exp#005 mtf_12h_hma_rsi_daily_v1	test
12d1a7f	daily_ema_weekly_regime_atr_v1	BTCUSDT	0.0299	19.05	4.46	-16.25	57.0	1.3	93	0.0328	0.2741	keep	exp#006 daily_ema_weekly_regime_atr_v1	train
12d1a7f	daily_ema_weekly_regime_atr_v1	BTCUSDT	-0.4113	1.63	1.34	-7.61	53.3	1.15	30	-0.4053	0.1756	discard	exp#006 daily_ema_weekly_regime_atr_v1	test
12d1a7f	daily_ema_weekly_regime_atr_v1	ETHUSDT	-0.6855	-29.99	-8.53	-37.79	42.7	0.86	103	-0.748	-0.2256	discard	exp#006 daily_ema_weekly_regime_atr_v1	train
12d1a7f	daily_ema_weekly_regime_atr_v1	SOLUSDT	0.5114	84.24	16.57	-31.3	53.1	1.35	98	0.6372	0.5292	keep	exp#006 daily_ema_weekly_regime_atr_v1	train
12d1a7f	daily_ema_weekly_regime_atr_v1	SOLUSDT	-0.6587	-7.05	-5.84	-16.04	50.0	0.93	22	-0.5961	-0.3639	discard	exp#006 daily_ema_weekly_regime_atr_v1	test
12d1a7f	daily_ema_weekly_regime_atr_v1	BTCUSDT	0.0299	19.05	4.46	-16.25	57.0	1.3	93	0.0328	0.2741	discard	exp#006 daily_ema_weekly_regime_atr_v1	train
12d1a7f	daily_ema_weekly_regime_atr_v1	ETHUSDT	-0.6855	-29.99	-8.53	-37.79	42.7	0.86	103	-0.748	-0.2256	discard	exp#006 daily_ema_weekly_regime_atr_v1	train
12d1a7f	daily_ema_weekly_regime_atr_v1	SOLUSDT	0.5114	84.24	16.57	-31.3	53.1	1.35	98	0.6372	0.5292	discard	exp#006 daily_ema_weekly_regime_atr_v1	train
90fd58a	mtf_15m_hybrid_rsi_4h_v1	BTCUSDT	-8.3304	-99.0	-68.42	-99.04	56.1	0.89	15936	-9.4252	-0.6909	discard	exp#007 mtf_15m_hybrid_rsi_4h_v1	train
90fd58a	mtf_15m_hybrid_rsi_4h_v1	ETHUSDT	-6.2497	-98.79	-66.86	-98.8	58.1	0.88	15873	-6.8744	-0.6767	discard	exp#007 mtf_15m_hybrid_rsi_4h_v1	train
90fd58a	mtf_15m_hybrid_rsi_4h_v1	SOLUSDT	-3.4312	-98.11	-63.09	-98.14	59.9	0.92	15951	-3.8905	-0.6429	discard	exp#007 mtf_15m_hybrid_rsi_4h_v1	train
90fd58a	mtf_15m_hybrid_rsi_4h_v1	BTCUSDT	-8.3304	-99.0	-68.42	-99.04	56.1	0.89	15936	-9.4252	-0.6909	discard	exp#007 mtf_15m_hybrid_rsi_4h_v1	train
90fd58a	mtf_15m_hybrid_rsi_4h_v1	ETHUSDT	-6.2497	-98.79	-66.86	-98.8	58.1	0.88	15873	-6.8744	-0.6767	discard	exp#007 mtf_15m_hybrid_rsi_4h_v1	train
90fd58a	mtf_15m_hybrid_rsi_4h_v1	SOLUSDT	-3.4312	-98.11	-63.09	-98.14	59.9	0.92	15951	-3.8905	-0.6429	discard	exp#007 mtf_15m_hybrid_rsi_4h_v1	train
536ce36	mtf_30m_regime_adaptive_4h_v1	BTCUSDT	-6.7321	-79.3	-32.56	-79.37	41.9	0.79	5371	-4.3038	-0.4103	discard	exp#008 mtf_30m_regime_adaptive_4h_v1	train
536ce36	mtf_30m_regime_adaptive_4h_v1	ETHUSDT	-6.3088	-80.96	-33.96	-80.96	42.2	0.77	4818	-3.5877	-0.4195	discard	exp#008 mtf_30m_regime_adaptive_4h_v1	train
536ce36	mtf_30m_regime_adaptive_4h_v1	SOLUSDT	-1.964	-52.06	-16.85	-58.53	44.7	0.99	4163	-1.1695	-0.288	discard	exp#008 mtf_30m_regime_adaptive_4h_v1	train
536ce36	mtf_30m_regime_adaptive_4h_v1	BTCUSDT	-6.7321	-79.3	-32.56	-79.37	41.9	0.79	5371	-4.3038	-0.4103	discard	exp#008 mtf_30m_regime_adaptive_4h_v1	train
536ce36	mtf_30m_regime_adaptive_4h_v1	ETHUSDT	-6.3088	-80.96	-33.96	-80.96	42.2	0.77	4818	-3.5877	-0.4195	discard	exp#008 mtf_30m_regime_adaptive_4h_v1	train
536ce36	mtf_30m_regime_adaptive_4h_v1	SOLUSDT	-1.964	-52.06	-16.85	-58.53	44.7	0.99	4163	-1.1695	-0.288	discard	exp#008 mtf_30m_regime_adaptive_4h_v1	train
e6cd370	mtf_1h_fisher_bb_4h_v1	BTCUSDT	-3.7034	-75.35	-29.55	-76.08	59.6	0.83	4586	-2.992	-0.3884	discard	exp#009 mtf_1h_fisher_bb_4h_v1	train
e6cd370	mtf_1h_fisher_bb_4h_v1	ETHUSDT	-2.7966	-73.49	-28.26	-75.36	60.5	0.86	4830	-2.2382	-0.375	discard	exp#009 mtf_1h_fisher_bb_4h_v1	train
e6cd370	mtf_1h_fisher_bb_4h_v1	SOLUSDT	-1.5551	-71.5	-27.03	-75.14	60.8	0.91	4786	-1.3069	-0.3597	discard	exp#009 mtf_1h_fisher_bb_4h_v1	train
e6cd370	mtf_1h_fisher_bb_4h_v1	BTCUSDT	-3.7034	-75.35	-29.55	-76.08	59.6	0.83	4586	-2.992	-0.3884	discard	exp#009 mtf_1h_fisher_bb_4h_v1	train
e6cd370	mtf_1h_fisher_bb_4h_v1	ETHUSDT	-2.7966	-73.49	-28.26	-75.36	60.5	0.86	4830	-2.2382	-0.375	discard	exp#009 mtf_1h_fisher_bb_4h_v1	train
e6cd370	mtf_1h_fisher_bb_4h_v1	SOLUSDT	-1.5551	-71.5	-27.03	-75.14	60.8	0.91	4786	-1.3069	-0.3597	discard	exp#009 mtf_1h_fisher_bb_4h_v1	train
e635353	mtf_12h_donchian_daily_adx_v1	BTCUSDT	-0.4695	9.33	2.26	-7.95	48.9	1.27	190	-0.2669	0.2838	discard	exp#011 mtf_12h_donchian_daily_adx_v1	train
e635353	mtf_12h_donchian_daily_adx_v1	ETHUSDT	-0.987	-9.05	-2.34	-14.28	39.4	0.92	216	-0.5827	-0.1642	discard	exp#011 mtf_12h_donchian_daily_adx_v1	train
e635353	mtf_12h_donchian_daily_adx_v1	SOLUSDT	-0.0481	14.99	3.57	-23.29	43.3	1.21	208	-0.0297	0.1531	discard	exp#011 mtf_12h_donchian_daily_adx_v1	train
e635353	mtf_12h_donchian_daily_adx_v1	BTCUSDT	-0.4695	9.33	2.26	-7.95	48.9	1.27	190	-0.2669	0.2838	discard	exp#011 mtf_12h_donchian_daily_adx_v1	train
e635353	mtf_12h_donchian_daily_adx_v1	ETHUSDT	-0.987	-9.05	-2.34	-14.28	39.4	0.92	216	-0.5827	-0.1642	discard	exp#011 mtf_12h_donchian_daily_adx_v1	train
e635353	mtf_12h_donchian_daily_adx_v1	SOLUSDT	-0.0481	14.99	3.57	-23.29	43.3	1.21	208	-0.0297	0.1531	discard	exp#011 mtf_12h_donchian_daily_adx_v1	train
4d39895	mtf_1d_kama_weekly_rsi_v1	BTCUSDT	-0.2713	10.5	2.53	-12.34	58.2	1.23	165	-0.2371	0.205	discard	exp#012 mtf_1d_kama_weekly_rsi_v1	train
4d39895	mtf_1d_kama_weekly_rsi_v1	ETHUSDT	-0.5157	-0.69	-0.17	-18.98	49.7	1.04	157	-0.4304	-0.0091	discard	exp#012 mtf_1d_kama_weekly_rsi_v1	train
4d39895	mtf_1d_kama_weekly_rsi_v1	SOLUSDT	-0.2649	1.09	0.27	-34.47	53.8	1.01	160	-0.2295	0.0079	discard	exp#012 mtf_1d_kama_weekly_rsi_v1	train
4d39895	mtf_1d_kama_weekly_rsi_v1	BTCUSDT	-0.2713	10.5	2.53	-12.34	58.2	1.23	165	-0.2371	0.205	discard	exp#012 mtf_1d_kama_weekly_rsi_v1	train
4d39895	mtf_1d_kama_weekly_rsi_v1	ETHUSDT	-0.5157	-0.69	-0.17	-18.98	49.7	1.04	157	-0.4304	-0.0091	discard	exp#012 mtf_1d_kama_weekly_rsi_v1	train
4d39895	mtf_1d_kama_weekly_rsi_v1	SOLUSDT	-0.2649	1.09	0.27	-34.47	53.8	1.01	160	-0.2295	0.0079	discard	exp#012 mtf_1d_kama_weekly_rsi_v1	train
546e17d	mtf_15m_regime_rsi_4h_v1	BTCUSDT	-8.3724	-80.06	-33.19	-80.32	39.5	0.77	5395	-3.6748	-0.4132	discard	exp#013 mtf_15m_regime_rsi_4h_v1	train
546e17d	mtf_15m_regime_rsi_4h_v1	ETHUSDT	-6.5681	-79.77	-32.96	-80.05	41.4	0.81	5380	-2.8351	-0.4117	discard	exp#013 mtf_15m_regime_rsi_4h_v1	train
546e17d	mtf_15m_regime_rsi_4h_v1	SOLUSDT	-3.4407	-70.53	-26.41	-71.02	45.7	0.93	5248	-1.4349	-0.3719	discard	exp#013 mtf_15m_regime_rsi_4h_v1	train
546e17d	mtf_15m_regime_rsi_4h_v1	BTCUSDT	-8.3724	-80.06	-33.19	-80.32	39.5	0.77	5395	-3.6748	-0.4132	discard	exp#013 mtf_15m_regime_rsi_4h_v1	train
546e17d	mtf_15m_regime_rsi_4h_v1	ETHUSDT	-6.5681	-79.77	-32.96	-80.05	41.4	0.81	5380	-2.8351	-0.4117	discard	exp#013 mtf_15m_regime_rsi_4h_v1	train
546e17d	mtf_15m_regime_rsi_4h_v1	SOLUSDT	-3.4407	-70.53	-26.41	-71.02	45.7	0.93	5248	-1.4349	-0.3719	discard	exp#013 mtf_15m_regime_rsi_4h_v1	train
53d5246	mtf_30m_mr_chop_4h_v1	BTCUSDT	-5.0209	-91.13	-45.45	-91.3	66.2	0.86	10152	-4.9395	-0.4978	discard	exp#014 mtf_30m_mr_chop_4h_v1	train
53d5246	mtf_30m_mr_chop_4h_v1	ETHUSDT	-4.2259	-92.36	-47.46	-92.77	67.4	0.86	10046	-4.0269	-0.5115	discard	exp#014 mtf_30m_mr_chop_4h_v1	train
53d5246	mtf_30m_mr_chop_4h_v1	SOLUSDT	-2.2688	-89.81	-43.63	-90.21	68.4	0.88	9945	-2.263	-0.4837	discard	exp#014 mtf_30m_mr_chop_4h_v1	train
53d5246	mtf_30m_mr_chop_4h_v1	BTCUSDT	-5.0209	-91.13	-45.45	-91.3	66.2	0.86	10152	-4.9395	-0.4978	discard	exp#014 mtf_30m_mr_chop_4h_v1	train
53d5246	mtf_30m_mr_chop_4h_v1	ETHUSDT	-4.2259	-92.36	-47.46	-92.77	67.4	0.86	10046	-4.0269	-0.5115	discard	exp#014 mtf_30m_mr_chop_4h_v1	train
53d5246	mtf_30m_mr_chop_4h_v1	SOLUSDT	-2.2688	-89.81	-43.63	-90.21	68.4	0.88	9945	-2.263	-0.4837	discard	exp#014 mtf_30m_mr_chop_4h_v1	train
bae8173	mtf_1h_donchian_4h_hma_vol_v1	BTCUSDT	-3.9753	-68.61	-25.16	-69.15	41.5	0.87	4994	-3.3572	-0.3639	discard	exp#015 mtf_1h_donchian_4h_hma_vol_v1	train
bae8173	mtf_1h_donchian_4h_hma_vol_v1	ETHUSDT	-2.6853	-61.57	-21.28	-62.17	42.2	0.96	5138	-2.3918	-0.3422	discard	exp#015 mtf_1h_donchian_4h_hma_vol_v1	train
bae8173	mtf_1h_donchian_4h_hma_vol_v1	SOLUSDT	-1.4249	-59.65	-20.37	-62.44	44.9	1.0	5524	-1.2904	-0.3263	discard	exp#015 mtf_1h_donchian_4h_hma_vol_v1	train
bae8173	mtf_1h_donchian_4h_hma_vol_v1	BTCUSDT	-3.9753	-68.61	-25.16	-69.15	41.5	0.87	4994	-3.3572	-0.3639	discard	exp#015 mtf_1h_donchian_4h_hma_vol_v1	train
bae8173	mtf_1h_donchian_4h_hma_vol_v1	ETHUSDT	-2.6853	-61.57	-21.28	-62.17	42.2	0.96	5138	-2.3918	-0.3422	discard	exp#015 mtf_1h_donchian_4h_hma_vol_v1	train
bae8173	mtf_1h_donchian_4h_hma_vol_v1	SOLUSDT	-1.4249	-59.65	-20.37	-62.44	44.9	1.0	5524	-1.2904	-0.3263	discard	exp#015 mtf_1h_donchian_4h_hma_vol_v1	train
cb91a26	mtf_1d_hma_weekly_regime_vol_v1	BTCUSDT	-0.0514	15.9	3.76	-17.7	38.0	1.37	100	-0.0536	0.2122	discard	exp#018 mtf_1d_hma_weekly_regime_vol_v1	train
cb91a26	mtf_1d_hma_weekly_regime_vol_v1	ETHUSDT	-0.8854	-30.76	-8.78	-35.63	30.6	0.76	108	-0.9133	-0.2465	discard	exp#018 mtf_1d_hma_weekly_regime_vol_v1	train
cb91a26	mtf_1d_hma_weekly_regime_vol_v1	SOLUSDT	1.1817	245.73	36.5	-19.43	38.3	3.18	81	1.4547	1.8786	keep	exp#018 mtf_1d_hma_weekly_regime_vol_v1	train
cb91a26	mtf_1d_hma_weekly_regime_vol_v1	SOLUSDT	-0.8927	-11.82	-9.83	-16.75	39.5	0.73	38	-0.8701	-0.5871	discard	exp#018 mtf_1d_hma_weekly_regime_vol_v1	test
cb91a26	mtf_1d_hma_weekly_regime_vol_v1	BTCUSDT	-0.0514	15.9	3.76	-17.7	38.0	1.37	100	-0.0536	0.2122	discard	exp#018 mtf_1d_hma_weekly_regime_vol_v1	train
cb91a26	mtf_1d_hma_weekly_regime_vol_v1	ETHUSDT	-0.8854	-30.76	-8.78	-35.63	30.6	0.76	108	-0.9133	-0.2465	discard	exp#018 mtf_1d_hma_weekly_regime_vol_v1	train
cb91a26	mtf_1d_hma_weekly_regime_vol_v1	SOLUSDT	1.1817	245.73	36.5	-19.43	38.3	3.18	81	1.4547	1.8786	discard	exp#018 mtf_1d_hma_weekly_regime_vol_v1	train
d5cc2df	mtf_15m_supertrend_4h_hma_vol_v1	BTCUSDT	-7.2641	-75.97	-30.0	-76.74	41.4	0.77	5939	-4.0119	-0.3909	discard	exp#019 mtf_15m_supertrend_4h_hma_vol_v1	train
d5cc2df	mtf_15m_supertrend_4h_hma_vol_v1	ETHUSDT	-6.0509	-76.63	-30.49	-76.71	42.9	0.82	5973	-3.1671	-0.3974	discard	exp#019 mtf_15m_supertrend_4h_hma_vol_v1	train
d5cc2df	mtf_15m_supertrend_4h_hma_vol_v1	SOLUSDT	-2.417	-58.3	-19.71	-60.34	47.0	0.99	5575	-1.3256	-0.3267	discard	exp#019 mtf_15m_supertrend_4h_hma_vol_v1	train
d5cc2df	mtf_15m_supertrend_4h_hma_vol_v1	BTCUSDT	-7.2641	-75.97	-30.0	-76.74	41.4	0.77	5939	-4.0119	-0.3909	discard	exp#019 mtf_15m_supertrend_4h_hma_vol_v1	train
d5cc2df	mtf_15m_supertrend_4h_hma_vol_v1	ETHUSDT	-6.0509	-76.63	-30.49	-76.71	42.9	0.82	5973	-3.1671	-0.3974	discard	exp#019 mtf_15m_supertrend_4h_hma_vol_v1	train
d5cc2df	mtf_15m_supertrend_4h_hma_vol_v1	SOLUSDT	-2.417	-58.3	-19.71	-60.34	47.0	0.99	5575	-1.3256	-0.3267	discard	exp#019 mtf_15m_supertrend_4h_hma_vol_v1	train
91118f6	mtf_30m_regime_chop_rsi_4h_v2	BTCUSDT	-4.4784	-30.24	-8.61	-32.84	42.9	0.86	1829	-1.544	-0.2623	discard	exp#020 mtf_30m_regime_chop_rsi_4h_v2	train
91118f6	mtf_30m_regime_chop_rsi_4h_v2	ETHUSDT	-4.2099	-36.05	-10.58	-37.66	43.8	0.83	1884	-1.3189	-0.281	discard	exp#020 mtf_30m_regime_chop_rsi_4h_v2	train
91118f6	mtf_30m_regime_chop_rsi_4h_v2	SOLUSDT	-1.82	-21.16	-5.79	-27.12	47.1	1.0	1782	-0.6011	-0.2136	discard	exp#020 mtf_30m_regime_chop_rsi_4h_v2	train
91118f6	mtf_30m_regime_chop_rsi_4h_v2	BTCUSDT	-4.4784	-30.24	-8.61	-32.84	42.9	0.86	1829	-1.544	-0.2623	discard	exp#020 mtf_30m_regime_chop_rsi_4h_v2	train
91118f6	mtf_30m_regime_chop_rsi_4h_v2	ETHUSDT	-4.2099	-36.05	-10.58	-37.66	43.8	0.83	1884	-1.3189	-0.281	discard	exp#020 mtf_30m_regime_chop_rsi_4h_v2	train
91118f6	mtf_30m_regime_chop_rsi_4h_v2	SOLUSDT	-1.82	-21.16	-5.79	-27.12	47.1	1.0	1782	-0.6011	-0.2136	discard	exp#020 mtf_30m_regime_chop_rsi_4h_v2	train
ac3eb85	mtf_1h_crsi_4h_hma_v1	BTCUSDT	-3.4618	-60.16	-20.56	-62.44	60.9	0.86	3875	-2.2344	-0.3293	discard	exp#021 mtf_1h_crsi_4h_hma_v1	train
ac3eb85	mtf_1h_crsi_4h_hma_v1	ETHUSDT	-3.2765	-67.8	-24.68	-68.22	61.6	0.86	3994	-2.1061	-0.3618	discard	exp#021 mtf_1h_crsi_4h_hma_v1	train
ac3eb85	mtf_1h_crsi_4h_hma_v1	SOLUSDT	-2.1149	-70.27	-26.25	-73.72	62.3	0.88	4082	-1.3562	-0.3561	discard	exp#021 mtf_1h_crsi_4h_hma_v1	train
ac3eb85	mtf_1h_crsi_4h_hma_v1	BTCUSDT	-3.4618	-60.16	-20.56	-62.44	60.9	0.86	3875	-2.2344	-0.3293	discard	exp#021 mtf_1h_crsi_4h_hma_v1	train
ac3eb85	mtf_1h_crsi_4h_hma_v1	ETHUSDT	-3.2765	-67.8	-24.68	-68.22	61.6	0.86	3994	-2.1061	-0.3618	discard	exp#021 mtf_1h_crsi_4h_hma_v1	train
ac3eb85	mtf_1h_crsi_4h_hma_v1	SOLUSDT	-2.1149	-70.27	-26.25	-73.72	62.3	0.88	4082	-1.3562	-0.3561	discard	exp#021 mtf_1h_crsi_4h_hma_v1	train
736bf95	mtf_4h_supertrend_daily_rsi_v1	BTCUSDT	-0.4835	-3.23	-0.82	-29.22	42.9	1.05	511	-0.4361	-0.028	discard	exp#022 mtf_4h_supertrend_daily_rsi_v1	train
736bf95	mtf_4h_supertrend_daily_rsi_v1	ETHUSDT	0.0709	22.46	5.2	-22.24	43.9	1.16	531	0.0684	0.2337	keep	exp#022 mtf_4h_supertrend_daily_rsi_v1	train
736bf95	mtf_4h_supertrend_daily_rsi_v1	ETHUSDT	-1.9012	-19.98	-16.75	-24.14	38.1	0.76	160	-1.7111	-0.6938	discard	exp#022 mtf_4h_supertrend_daily_rsi_v1	test
736bf95	mtf_4h_supertrend_daily_rsi_v1	SOLUSDT	1.1058	199.91	31.74	-27.93	44.9	1.4	485	1.1612	1.1366	keep	exp#022 mtf_4h_supertrend_daily_rsi_v1	train
736bf95	mtf_4h_supertrend_daily_rsi_v1	SOLUSDT	-0.638	-6.83	-5.65	-20.88	42.0	0.99	176	-0.6042	-0.2707	discard	exp#022 mtf_4h_supertrend_daily_rsi_v1	test
736bf95	mtf_4h_supertrend_daily_rsi_v1	BTCUSDT	-0.4835	-3.23	-0.82	-29.22	42.9	1.05	511	-0.4361	-0.028	discard	exp#022 mtf_4h_supertrend_daily_rsi_v1	train
736bf95	mtf_4h_supertrend_daily_rsi_v1	ETHUSDT	0.0709	22.46	5.2	-22.24	43.9	1.16	531	0.0684	0.2337	discard	exp#022 mtf_4h_supertrend_daily_rsi_v1	train
736bf95	mtf_4h_supertrend_daily_rsi_v1	SOLUSDT	1.1058	199.91	31.74	-27.93	44.9	1.4	485	1.1612	1.1366	discard	exp#022 mtf_4h_supertrend_daily_rsi_v1	train
3292749	mtf_12h_supertrend_daily_rsi_v2	BTCUSDT	-1.3401	-3.39	-0.86	-10.94	45.6	1.02	305	-0.9061	-0.0785	discard	exp#023 mtf_12h_supertrend_daily_rsi_v2	train
3292749	mtf_12h_supertrend_daily_rsi_v2	ETHUSDT	-0.1913	16.09	3.8	-7.48	51.2	1.32	340	-0.1522	0.5079	discard	exp#023 mtf_12h_supertrend_daily_rsi_v2	train
3292749	mtf_12h_supertrend_daily_rsi_v2	SOLUSDT	0.1386	26.01	5.97	-9.43	49.8	1.32	301	0.1008	0.6336	keep	exp#023 mtf_12h_supertrend_daily_rsi_v2	train
3292749	mtf_12h_supertrend_daily_rsi_v2	SOLUSDT	-1.5092	-6.41	-5.31	-8.7	45.4	0.85	119	-0.9924	-0.6104	discard	exp#023 mtf_12h_supertrend_daily_rsi_v2	test
3292749	mtf_12h_supertrend_daily_rsi_v2	BTCUSDT	-1.3401	-3.39	-0.86	-10.94	45.6	1.02	305	-0.9061	-0.0785	discard	exp#023 mtf_12h_supertrend_daily_rsi_v2	train
3292749	mtf_12h_supertrend_daily_rsi_v2	ETHUSDT	-0.1913	16.09	3.8	-7.48	51.2	1.32	340	-0.1522	0.5079	discard	exp#023 mtf_12h_supertrend_daily_rsi_v2	train
3292749	mtf_12h_supertrend_daily_rsi_v2	SOLUSDT	0.1386	26.01	5.97	-9.43	49.8	1.32	301	0.1008	0.6336	discard	exp#023 mtf_12h_supertrend_daily_rsi_v2	train
17d7ad5	mtf_1d_supertrend_weekly_rsi_v1	BTCUSDT	0.3729	42.12	9.18	-20.45	58.2	2.81	208	0.4653	0.4492	keep	exp#024 mtf_1d_supertrend_weekly_rsi_v1	train
17d7ad5	mtf_1d_supertrend_weekly_rsi_v1	BTCUSDT	-1.3468	-12.81	-10.66	-17.49	46.6	1.03	73	-1.5979	-0.6096	discard	exp#024 mtf_1d_supertrend_weekly_rsi_v1	test
17d7ad5	mtf_1d_supertrend_weekly_rsi_v1	ETHUSDT	-0.2279	1.31	0.33	-25.08	50.9	2.74	230	-0.2716	0.013	discard	exp#024 mtf_1d_supertrend_weekly_rsi_v1	train
17d7ad5	mtf_1d_supertrend_weekly_rsi_v1	SOLUSDT	1.0086	176.06	29.01	-25.94	56.5	5.18	209	1.3066	1.1183	keep	exp#024 mtf_1d_supertrend_weekly_rsi_v1	train
17d7ad5	mtf_1d_supertrend_weekly_rsi_v1	SOLUSDT	0.2022	8.93	7.29	-21.22	54.8	2.5	73	0.2866	0.3436	keep	exp#024 mtf_1d_supertrend_weekly_rsi_v1	test
17d7ad5	mtf_1d_supertrend_weekly_rsi_v1	BTCUSDT	0.3729	42.12	9.18	-20.45	58.2	2.81	208	0.4653	0.4492	keep	exp#024 mtf_1d_supertrend_weekly_rsi_v1	train
17d7ad5	mtf_1d_supertrend_weekly_rsi_v1	ETHUSDT	-0.2279	1.31	0.33	-25.08	50.9	2.74	230	-0.2716	0.013	discard	exp#024 mtf_1d_supertrend_weekly_rsi_v1	train
17d7ad5	mtf_1d_supertrend_weekly_rsi_v1	SOLUSDT	1.0086	176.06	29.01	-25.94	56.5	5.18	209	1.3066	1.1183	keep	exp#024 mtf_1d_supertrend_weekly_rsi_v1	train
17d7ad5	mtf_1d_supertrend_weekly_rsi_v1	BTCUSDT	-1.3468	-12.81	-10.66	-17.49	46.6	1.03	73	-1.5979	-0.6096	discard	exp#024 mtf_1d_supertrend_weekly_rsi_v1	test
17d7ad5	mtf_1d_supertrend_weekly_rsi_v1	SOLUSDT	0.2022	8.93	7.29	-21.22	54.8	2.5	73	0.2866	0.3436	keep	exp#024 mtf_1d_supertrend_weekly_rsi_v1	test
7d4f1be	mtf_15m_adaptive_regime_4h_1h_v1	BTCUSDT	-11.012	-96.55	-56.92	-96.6	37.6	0.78	12563	-7.1385	-0.5892	discard	exp#025 mtf_15m_adaptive_regime_4h_1h_v1	train
7d4f1be	mtf_15m_adaptive_regime_4h_1h_v1	ETHUSDT	-8.1628	-95.37	-53.65	-95.44	39.6	0.88	12627	-5.2487	-0.5621	discard	exp#025 mtf_15m_adaptive_regime_4h_1h_v1	train
7d4f1be	mtf_15m_adaptive_regime_4h_1h_v1	SOLUSDT	-6.7043	-98.27	-63.87	-98.38	41.9	0.91	13502	-4.2407	-0.6492	discard	exp#025 mtf_15m_adaptive_regime_4h_1h_v1	train
7d4f1be	mtf_15m_adaptive_regime_4h_1h_v1	BTCUSDT	-11.012	-96.55	-56.92	-96.6	37.6	0.78	12563	-7.1385	-0.5892	discard	exp#025 mtf_15m_adaptive_regime_4h_1h_v1	train
7d4f1be	mtf_15m_adaptive_regime_4h_1h_v1	ETHUSDT	-8.1628	-95.37	-53.65	-95.44	39.6	0.88	12627	-5.2487	-0.5621	discard	exp#025 mtf_15m_adaptive_regime_4h_1h_v1	train
7d4f1be	mtf_15m_adaptive_regime_4h_1h_v1	SOLUSDT	-6.7043	-98.27	-63.87	-98.38	41.9	0.91	13502	-4.2407	-0.6492	discard	exp#025 mtf_15m_adaptive_regime_4h_1h_v1	train
504fd1d	mtf_30m_macd_4h_hma_rsi_v1	BTCUSDT	-5.3461	-87.2	-40.21	-87.75	33.1	0.92	6289	-3.9061	-0.4582	discard	exp#026 mtf_30m_macd_4h_hma_rsi_v1	train
504fd1d	mtf_30m_macd_4h_hma_rsi_v1	ETHUSDT	-4.0489	-85.41	-38.22	-85.43	34.8	1.02	6279	-3.0681	-0.4474	discard	exp#026 mtf_30m_macd_4h_hma_rsi_v1	train
504fd1d	mtf_30m_macd_4h_hma_rsi_v1	SOLUSDT	-2.2626	-83.31	-36.2	-87.43	37.6	1.16	6518	-1.7812	-0.414	discard	exp#026 mtf_30m_macd_4h_hma_rsi_v1	train
504fd1d	mtf_30m_macd_4h_hma_rsi_v1	BTCUSDT	-5.3461	-87.2	-40.21	-87.75	33.1	0.92	6289	-3.9061	-0.4582	discard	exp#026 mtf_30m_macd_4h_hma_rsi_v1	train
504fd1d	mtf_30m_macd_4h_hma_rsi_v1	ETHUSDT	-4.0489	-85.41	-38.22	-85.43	34.8	1.02	6279	-3.0681	-0.4474	discard	exp#026 mtf_30m_macd_4h_hma_rsi_v1	train
504fd1d	mtf_30m_macd_4h_hma_rsi_v1	SOLUSDT	-2.2626	-83.31	-36.2	-87.43	37.6	1.16	6518	-1.7812	-0.414	discard	exp#026 mtf_30m_macd_4h_hma_rsi_v1	train
b426d18	mtf_1h_kama_4h_hma_rsi_v1	BTCUSDT	-2.5221	-71.11	-26.7	-72.85	39.5	1.42	5793	-3.1455	-0.3665	discard	exp#027 mtf_1h_kama_4h_hma_rsi_v1	train
b426d18	mtf_1h_kama_4h_hma_rsi_v1	ETHUSDT	-2.3703	-78.55	-31.97	-79.08	41.0	1.38	5868	-2.8491	-0.4043	discard	exp#027 mtf_1h_kama_4h_hma_rsi_v1	train
b426d18	mtf_1h_kama_4h_hma_rsi_v1	SOLUSDT	-0.6141	-48.52	-15.35	-68.83	44.5	1.72	5812	-0.7532	-0.223	discard	exp#027 mtf_1h_kama_4h_hma_rsi_v1	train
b426d18	mtf_1h_kama_4h_hma_rsi_v1	BTCUSDT	-2.5221	-71.11	-26.7	-72.85	39.5	1.42	5793	-3.1455	-0.3665	discard	exp#027 mtf_1h_kama_4h_hma_rsi_v1	train
b426d18	mtf_1h_kama_4h_hma_rsi_v1	ETHUSDT	-2.3703	-78.55	-31.97	-79.08	41.0	1.38	5868	-2.8491	-0.4043	discard	exp#027 mtf_1h_kama_4h_hma_rsi_v1	train
b426d18	mtf_1h_kama_4h_hma_rsi_v1	SOLUSDT	-0.6141	-48.52	-15.35	-68.83	44.5	1.72	5812	-0.7532	-0.223	discard	exp#027 mtf_1h_kama_4h_hma_rsi_v1	train
f92ebd6	mtf_4h_mr_daily_chop_rsi_v1	BTCUSDT	-2.1319	-39.31	-11.74	-42.94	49.4	0.87	1173	-1.6922	-0.2734	discard	exp#028 mtf_4h_mr_daily_chop_rsi_v1	train
f92ebd6	mtf_4h_mr_daily_chop_rsi_v1	ETHUSDT	-1.4237	-35.67	-10.45	-36.63	52.0	0.91	1132	-1.068	-0.2852	discard	exp#028 mtf_4h_mr_daily_chop_rsi_v1	train
f92ebd6	mtf_4h_mr_daily_chop_rsi_v1	SOLUSDT	-0.8784	-34.6	-10.11	-49.37	51.2	0.95	1173	-0.709	-0.2048	discard	exp#028 mtf_4h_mr_daily_chop_rsi_v1	train
f92ebd6	mtf_4h_mr_daily_chop_rsi_v1	BTCUSDT	-2.1319	-39.31	-11.74	-42.94	49.4	0.87	1173	-1.6922	-0.2734	discard	exp#028 mtf_4h_mr_daily_chop_rsi_v1	train
f92ebd6	mtf_4h_mr_daily_chop_rsi_v1	ETHUSDT	-1.4237	-35.67	-10.45	-36.63	52.0	0.91	1132	-1.068	-0.2852	discard	exp#028 mtf_4h_mr_daily_chop_rsi_v1	train
f92ebd6	mtf_4h_mr_daily_chop_rsi_v1	SOLUSDT	-0.8784	-34.6	-10.11	-49.37	51.2	0.95	1173	-0.709	-0.2048	discard	exp#028 mtf_4h_mr_daily_chop_rsi_v1	train
079ca68	mtf_1d_donchian_weekly_hma_vol_v1	BTCUSDT	-0.6074	-13.19	-3.47	-25.15	41.0	1.31	256	-0.6728	-0.1381	discard	exp#030 mtf_1d_donchian_weekly_hma_vol_v1	train
079ca68	mtf_1d_donchian_weekly_hma_vol_v1	ETHUSDT	0.2288	34.39	7.67	-19.26	45.9	2.02	255	0.2666	0.3981	keep	exp#030 mtf_1d_donchian_weekly_hma_vol_v1	train
079ca68	mtf_1d_donchian_weekly_hma_vol_v1	ETHUSDT	-0.4596	-4.36	-3.6	-14.06	44.2	1.58	77	-0.4838	-0.2558	discard	exp#030 mtf_1d_donchian_weekly_hma_vol_v1	test
079ca68	mtf_1d_donchian_weekly_hma_vol_v1	SOLUSDT	0.5919	97.13	18.56	-28.22	48.3	2.23	232	0.7379	0.6578	keep	exp#030 mtf_1d_donchian_weekly_hma_vol_v1	train
079ca68	mtf_1d_donchian_weekly_hma_vol_v1	SOLUSDT	-0.2773	-2.28	-1.88	-15.15	45.5	1.32	77	-0.326	-0.1242	discard	exp#030 mtf_1d_donchian_weekly_hma_vol_v1	test
