commit	strategy	symbol	sharpe	return_pct	cagr_pct	max_dd_pct	win_rate	profit_factor	trades	sortino	calmar	status	description	period
e20e36d	mtf_4h_donchian_daily_hma_chop_regime_atr_v1	SOLUSDT	-0.8825	-28.16	-7.97	-30.79	39.9	0.89	599	-0.4972	-0.2588	discard	exp#352 mtf_4h_donchian_daily_hma_chop_regime_atr_v1	train
e20e36d	mtf_4h_donchian_daily_hma_chop_regime_atr_v1	BTCUSDT	-1.1235	-7.71	-1.99	-18.64	39.7	1.01	529	-0.6168	-0.1066	discard	exp#352 mtf_4h_donchian_daily_hma_chop_regime_atr_v1	train
e20e36d	mtf_4h_donchian_daily_hma_chop_regime_atr_v1	ETHUSDT	-1.3597	-21.81	-5.97	-28.61	40.4	0.87	572	-0.7001	-0.2086	discard	exp#352 mtf_4h_donchian_daily_hma_chop_regime_atr_v1	train
e20e36d	mtf_4h_donchian_daily_hma_chop_regime_atr_v1	SOLUSDT	-0.8825	-28.16	-7.97	-30.79	39.9	0.89	599	-0.4972	-0.2588	discard	exp#352 mtf_4h_donchian_daily_hma_chop_regime_atr_v1	train
fcce1b6	mtf_12h_donchian_daily_hma_rsi_filter_atr_v1	BTCUSDT	-0.5216	-10.98	-2.87	-27.55	29.6	1.31	334	-0.6779	-0.1041	discard	exp#353 mtf_12h_donchian_daily_hma_rsi_filter_atr_v1	train
fcce1b6	mtf_12h_donchian_daily_hma_rsi_filter_atr_v1	ETHUSDT	-0.0428	11.41	2.74	-18.34	29.6	1.42	338	-0.0574	0.1494	discard	exp#353 mtf_12h_donchian_daily_hma_rsi_filter_atr_v1	train
fcce1b6	mtf_12h_donchian_daily_hma_rsi_filter_atr_v1	SOLUSDT	0.7846	144.94	25.21	-23.82	35.3	2.08	303	1.0579	1.0583	keep	exp#353 mtf_12h_donchian_daily_hma_rsi_filter_atr_v1	train
fcce1b6	mtf_12h_donchian_daily_hma_rsi_filter_atr_v1	SOLUSDT	-0.1141	1.24	1.02	-19.51	33.3	1.33	111	-0.1526	0.0521	discard	exp#353 mtf_12h_donchian_daily_hma_rsi_filter_atr_v1	test
fcce1b6	mtf_12h_donchian_daily_hma_rsi_filter_atr_v1	BTCUSDT	-0.5216	-10.98	-2.87	-27.55	29.6	1.31	334	-0.6779	-0.1041	discard	exp#353 mtf_12h_donchian_daily_hma_rsi_filter_atr_v1	train
fcce1b6	mtf_12h_donchian_daily_hma_rsi_filter_atr_v1	ETHUSDT	-0.0428	11.41	2.74	-18.34	29.6	1.42	338	-0.0574	0.1494	discard	exp#353 mtf_12h_donchian_daily_hma_rsi_filter_atr_v1	train
fcce1b6	mtf_12h_donchian_daily_hma_rsi_filter_atr_v1	SOLUSDT	0.7846	144.94	25.21	-23.82	35.3	2.08	303	1.0579	1.0583	discard	exp#353 mtf_12h_donchian_daily_hma_rsi_filter_atr_v1	train
ab13759	mtf_1d_donchian_weekly_hma_rsi_breakout_atr_v1	BTCUSDT	-0.302	3.91	0.96	-17.26	33.3	1.58	114	-0.3636	0.0558	discard	exp#354 mtf_1d_donchian_weekly_hma_rsi_breakout_atr_v1	train
ab13759	mtf_1d_donchian_weekly_hma_rsi_breakout_atr_v1	ETHUSDT	-0.5008	-11.57	-3.03	-24.11	30.4	1.19	125	-0.5797	-0.1255	discard	exp#354 mtf_1d_donchian_weekly_hma_rsi_breakout_atr_v1	train
ab13759	mtf_1d_donchian_weekly_hma_rsi_breakout_atr_v1	SOLUSDT	0.7636	119.56	21.81	-26.94	39.1	3.32	110	0.945	0.8095	keep	exp#354 mtf_1d_donchian_weekly_hma_rsi_breakout_atr_v1	train
ab13759	mtf_1d_donchian_weekly_hma_rsi_breakout_atr_v1	SOLUSDT	-0.8927	-9.85	-8.18	-19.11	36.4	1.05	44	-0.9407	-0.428	discard	exp#354 mtf_1d_donchian_weekly_hma_rsi_breakout_atr_v1	test
ab13759	mtf_1d_donchian_weekly_hma_rsi_breakout_atr_v1	BTCUSDT	-0.302	3.91	0.96	-17.26	33.3	1.58	114	-0.3636	0.0558	discard	exp#354 mtf_1d_donchian_weekly_hma_rsi_breakout_atr_v1	train
ab13759	mtf_1d_donchian_weekly_hma_rsi_breakout_atr_v1	ETHUSDT	-0.5008	-11.57	-3.03	-24.11	30.4	1.19	125	-0.5797	-0.1255	discard	exp#354 mtf_1d_donchian_weekly_hma_rsi_breakout_atr_v1	train
ab13759	mtf_1d_donchian_weekly_hma_rsi_breakout_atr_v1	SOLUSDT	0.7636	119.56	21.81	-26.94	39.1	3.32	110	0.945	0.8095	discard	exp#354 mtf_1d_donchian_weekly_hma_rsi_breakout_atr_v1	train
5577a6e	mtf_15m_supertrend_1h_4h_hma_rsi_pullback_atr_v1	BTCUSDT	-10.7488	-98.75	-66.61	-98.76	61.9	0.84	18715	-10.0135	-0.6745	discard	exp#355 mtf_15m_supertrend_1h_4h_hma_rsi_pullback_atr_v1	train
5577a6e	mtf_15m_supertrend_1h_4h_hma_rsi_pullback_atr_v1	ETHUSDT	-9.0564	-99.24	-70.54	-99.28	63.5	0.83	18833	-8.1569	-0.7105	discard	exp#355 mtf_15m_supertrend_1h_4h_hma_rsi_pullback_atr_v1	train
5577a6e	mtf_15m_supertrend_1h_4h_hma_rsi_pullback_atr_v1	SOLUSDT	-5.5648	-99.24	-70.63	-99.24	66.0	0.81	18787	-5.2377	-0.7117	discard	exp#355 mtf_15m_supertrend_1h_4h_hma_rsi_pullback_atr_v1	train
5577a6e	mtf_15m_supertrend_1h_4h_hma_rsi_pullback_atr_v1	BTCUSDT	-10.7488	-98.75	-66.61	-98.76	61.9	0.84	18715	-10.0135	-0.6745	discard	exp#355 mtf_15m_supertrend_1h_4h_hma_rsi_pullback_atr_v1	train
5577a6e	mtf_15m_supertrend_1h_4h_hma_rsi_pullback_atr_v1	ETHUSDT	-9.0564	-99.24	-70.54	-99.28	63.5	0.83	18833	-8.1569	-0.7105	discard	exp#355 mtf_15m_supertrend_1h_4h_hma_rsi_pullback_atr_v1	train
5577a6e	mtf_15m_supertrend_1h_4h_hma_rsi_pullback_atr_v1	SOLUSDT	-5.5648	-99.24	-70.63	-99.24	66.0	0.81	18787	-5.2377	-0.7117	discard	exp#355 mtf_15m_supertrend_1h_4h_hma_rsi_pullback_atr_v1	train
3a48842	mtf_30m_fisher_chop_regime_4h_hma_atr_v1	BTCUSDT	-8.4002	-98.01	-62.47	-98.09	31.4	0.84	15273	-9.9335	-0.6368	discard	exp#356 mtf_30m_fisher_chop_regime_4h_hma_atr_v1	train
3a48842	mtf_30m_fisher_chop_regime_4h_hma_atr_v1	ETHUSDT	-5.8262	-96.71	-57.44	-96.78	32.8	0.95	15289	-7.1053	-0.5935	discard	exp#356 mtf_30m_fisher_chop_regime_4h_hma_atr_v1	train
3a48842	mtf_30m_fisher_chop_regime_4h_hma_atr_v1	SOLUSDT	-3.7629	-97.25	-59.43	-97.85	35.5	1.01	15483	-4.4992	-0.6074	discard	exp#356 mtf_30m_fisher_chop_regime_4h_hma_atr_v1	train
3a48842	mtf_30m_fisher_chop_regime_4h_hma_atr_v1	BTCUSDT	-8.4002	-98.01	-62.47	-98.09	31.4	0.84	15273	-9.9335	-0.6368	discard	exp#356 mtf_30m_fisher_chop_regime_4h_hma_atr_v1	train
3a48842	mtf_30m_fisher_chop_regime_4h_hma_atr_v1	ETHUSDT	-5.8262	-96.71	-57.44	-96.78	32.8	0.95	15289	-7.1053	-0.5935	discard	exp#356 mtf_30m_fisher_chop_regime_4h_hma_atr_v1	train
3a48842	mtf_30m_fisher_chop_regime_4h_hma_atr_v1	SOLUSDT	-3.7629	-97.25	-59.43	-97.85	35.5	1.01	15483	-4.4992	-0.6074	discard	exp#356 mtf_30m_fisher_chop_regime_4h_hma_atr_v1	train
c404ffc	mtf_1h_regime_4h_hma_bollinger_rsi_atr_v1	BTCUSDT	-2.136	-50.54	-16.15	-52.82	57.6	0.96	3542	-1.5392	-0.3057	discard	exp#357 mtf_1h_regime_4h_hma_bollinger_rsi_atr_v1	train
c404ffc	mtf_1h_regime_4h_hma_bollinger_rsi_atr_v1	ETHUSDT	-2.5172	-67.52	-24.52	-71.81	56.5	0.87	3620	-1.7867	-0.3415	discard	exp#357 mtf_1h_regime_4h_hma_bollinger_rsi_atr_v1	train
c404ffc	mtf_1h_regime_4h_hma_bollinger_rsi_atr_v1	SOLUSDT	-1.8937	-79.23	-32.6	-82.84	55.9	0.86	3749	-1.3352	-0.3935	discard	exp#357 mtf_1h_regime_4h_hma_bollinger_rsi_atr_v1	train
c404ffc	mtf_1h_regime_4h_hma_bollinger_rsi_atr_v1	BTCUSDT	-2.136	-50.54	-16.15	-52.82	57.6	0.96	3542	-1.5392	-0.3057	discard	exp#357 mtf_1h_regime_4h_hma_bollinger_rsi_atr_v1	train
c404ffc	mtf_1h_regime_4h_hma_bollinger_rsi_atr_v1	ETHUSDT	-2.5172	-67.52	-24.52	-71.81	56.5	0.87	3620	-1.7867	-0.3415	discard	exp#357 mtf_1h_regime_4h_hma_bollinger_rsi_atr_v1	train
c404ffc	mtf_1h_regime_4h_hma_bollinger_rsi_atr_v1	SOLUSDT	-1.8937	-79.23	-32.6	-82.84	55.9	0.86	3749	-1.3352	-0.3935	discard	exp#357 mtf_1h_regime_4h_hma_bollinger_rsi_atr_v1	train
23cce24	mtf_4h_crsi_chop_regime_daily_hma_atr_v1	BTCUSDT	-2.3198	-46.73	-14.58	-47.87	61.3	0.73	881	-1.4313	-0.3045	discard	exp#358 mtf_4h_crsi_chop_regime_daily_hma_atr_v1	train
23cce24	mtf_4h_crsi_chop_regime_daily_hma_atr_v1	ETHUSDT	-1.6221	-40.44	-12.16	-42.13	62.4	0.84	910	-1.0465	-0.2886	discard	exp#358 mtf_4h_crsi_chop_regime_daily_hma_atr_v1	train
23cce24	mtf_4h_crsi_chop_regime_daily_hma_atr_v1	SOLUSDT	-0.8785	-38.31	-11.42	-45.35	65.0	0.9	900	-0.5854	-0.2518	discard	exp#358 mtf_4h_crsi_chop_regime_daily_hma_atr_v1	train
23cce24	mtf_4h_crsi_chop_regime_daily_hma_atr_v1	BTCUSDT	-2.3198	-46.73	-14.58	-47.87	61.3	0.73	881	-1.4313	-0.3045	discard	exp#358 mtf_4h_crsi_chop_regime_daily_hma_atr_v1	train
23cce24	mtf_4h_crsi_chop_regime_daily_hma_atr_v1	ETHUSDT	-1.6221	-40.44	-12.16	-42.13	62.4	0.84	910	-1.0465	-0.2886	discard	exp#358 mtf_4h_crsi_chop_regime_daily_hma_atr_v1	train
23cce24	mtf_4h_crsi_chop_regime_daily_hma_atr_v1	SOLUSDT	-0.8785	-38.31	-11.42	-45.35	65.0	0.9	900	-0.5854	-0.2518	discard	exp#358 mtf_4h_crsi_chop_regime_daily_hma_atr_v1	train
a26e6f0	mtf_12h_donchian_daily_weekly_hma_rsi_momentum_atr_v1	BTCUSDT	-0.6042	-16.82	-4.5	-31.24	40.2	0.98	493	-0.721	-0.1441	discard	exp#359 mtf_12h_donchian_daily_weekly_hma_rsi_momentum_atr_v1	train
a26e6f0	mtf_12h_donchian_daily_weekly_hma_rsi_momentum_atr_v1	ETHUSDT	-0.1641	0.41	0.1	-29.61	40.2	1.08	522	-0.2064	0.0035	discard	exp#359 mtf_12h_donchian_daily_weekly_hma_rsi_momentum_atr_v1	train
a26e6f0	mtf_12h_donchian_daily_weekly_hma_rsi_momentum_atr_v1	SOLUSDT	0.9526	210.45	32.88	-28.18	43.5	1.29	494	1.2527	1.1669	keep	exp#359 mtf_12h_donchian_daily_weekly_hma_rsi_momentum_atr_v1	train
a26e6f0	mtf_12h_donchian_daily_weekly_hma_rsi_momentum_atr_v1	SOLUSDT	0.1858	8.5	6.94	-17.1	43.2	1.14	162	0.2382	0.4059	keep	exp#359 mtf_12h_donchian_daily_weekly_hma_rsi_momentum_atr_v1	test
a26e6f0	mtf_12h_donchian_daily_weekly_hma_rsi_momentum_atr_v1	BTCUSDT	-0.6042	-16.82	-4.5	-31.24	40.2	0.98	493	-0.721	-0.1441	discard	exp#359 mtf_12h_donchian_daily_weekly_hma_rsi_momentum_atr_v1	train
a26e6f0	mtf_12h_donchian_daily_weekly_hma_rsi_momentum_atr_v1	ETHUSDT	-0.1641	0.41	0.1	-29.61	40.2	1.08	522	-0.2064	0.0035	discard	exp#359 mtf_12h_donchian_daily_weekly_hma_rsi_momentum_atr_v1	train
a26e6f0	mtf_12h_donchian_daily_weekly_hma_rsi_momentum_atr_v1	SOLUSDT	0.9526	210.45	32.88	-28.18	43.5	1.29	494	1.2527	1.1669	keep	exp#359 mtf_12h_donchian_daily_weekly_hma_rsi_momentum_atr_v1	train
a26e6f0	mtf_12h_donchian_daily_weekly_hma_rsi_momentum_atr_v1	SOLUSDT	0.1858	8.5	6.94	-17.1	43.2	1.14	162	0.2382	0.4059	keep	exp#359 mtf_12h_donchian_daily_weekly_hma_rsi_momentum_atr_v1	test
c551a9a	mtf_1d_kama_weekly_hma_rsi_chop_regime_atr_v1	BTCUSDT	-0.7321	-14.48	-3.83	-33.28	41.1	0.94	248	-0.7956	-0.1152	discard	exp#360 mtf_1d_kama_weekly_hma_rsi_chop_regime_atr_v1	train
c551a9a	mtf_1d_kama_weekly_hma_rsi_chop_regime_atr_v1	ETHUSDT	-1.3377	-46.36	-14.42	-51.74	36.9	0.75	236	-1.3475	-0.2786	discard	exp#360 mtf_1d_kama_weekly_hma_rsi_chop_regime_atr_v1	train
c551a9a	mtf_1d_kama_weekly_hma_rsi_chop_regime_atr_v1	SOLUSDT	0.0825	20.34	4.75	-41.63	46.8	1.1	284	0.094	0.1142	keep	exp#360 mtf_1d_kama_weekly_hma_rsi_chop_regime_atr_v1	train
c551a9a	mtf_1d_kama_weekly_hma_rsi_chop_regime_atr_v1	SOLUSDT	-0.4128	-3.32	-2.74	-16.21	46.6	0.98	73	-0.4038	-0.169	discard	exp#360 mtf_1d_kama_weekly_hma_rsi_chop_regime_atr_v1	test
c551a9a	mtf_1d_kama_weekly_hma_rsi_chop_regime_atr_v1	BTCUSDT	-0.7321	-14.48	-3.83	-33.28	41.1	0.94	248	-0.7956	-0.1152	discard	exp#360 mtf_1d_kama_weekly_hma_rsi_chop_regime_atr_v1	train
c551a9a	mtf_1d_kama_weekly_hma_rsi_chop_regime_atr_v1	ETHUSDT	-1.3377	-46.36	-14.42	-51.74	36.9	0.75	236	-1.3475	-0.2786	discard	exp#360 mtf_1d_kama_weekly_hma_rsi_chop_regime_atr_v1	train
c551a9a	mtf_1d_kama_weekly_hma_rsi_chop_regime_atr_v1	SOLUSDT	0.0825	20.34	4.75	-41.63	46.8	1.1	284	0.094	0.1142	discard	exp#360 mtf_1d_kama_weekly_hma_rsi_chop_regime_atr_v1	train
5bd7863	mtf_15m_supertrend_4h_hma_rsi_pullback_atr_v2	BTCUSDT	-2.0014	-67.12	-24.29	-71.65	46.3	1.38	6064	-2.5727	-0.339	discard	exp#361 mtf_15m_supertrend_4h_hma_rsi_pullback_atr_v2	train
5bd7863	mtf_15m_supertrend_4h_hma_rsi_pullback_atr_v2	ETHUSDT	-1.378	-62.43	-21.72	-71.64	47.0	1.44	6085	-1.7376	-0.3032	discard	exp#361 mtf_15m_supertrend_4h_hma_rsi_pullback_atr_v2	train
5bd7863	mtf_15m_supertrend_4h_hma_rsi_pullback_atr_v2	SOLUSDT	0.2138	30.88	6.99	-67.56	46.6	1.53	6218	0.2882	0.1035	discard	exp#361 mtf_15m_supertrend_4h_hma_rsi_pullback_atr_v2	train
5bd7863	mtf_15m_supertrend_4h_hma_rsi_pullback_atr_v2	BTCUSDT	-2.0014	-67.12	-24.29	-71.65	46.3	1.38	6064	-2.5727	-0.339	discard	exp#361 mtf_15m_supertrend_4h_hma_rsi_pullback_atr_v2	train
5bd7863	mtf_15m_supertrend_4h_hma_rsi_pullback_atr_v2	ETHUSDT	-1.378	-62.43	-21.72	-71.64	47.0	1.44	6085	-1.7376	-0.3032	discard	exp#361 mtf_15m_supertrend_4h_hma_rsi_pullback_atr_v2	train
5bd7863	mtf_15m_supertrend_4h_hma_rsi_pullback_atr_v2	SOLUSDT	0.2138	30.88	6.99	-67.56	46.6	1.53	6218	0.2882	0.1035	discard	exp#361 mtf_15m_supertrend_4h_hma_rsi_pullback_atr_v2	train
9e82608	mtf_30m_bollinger_mr_4h_hma_rsi7_atr_v1	BTCUSDT	-7.4311	-95.88	-54.98	-96.0	56.1	0.87	11220	-6.1605	-0.5727	discard	exp#362 mtf_30m_bollinger_mr_4h_hma_rsi7_atr_v1	train
9e82608	mtf_30m_bollinger_mr_4h_hma_rsi7_atr_v1	ETHUSDT	-6.5723	-97.13	-58.86	-97.16	56.9	0.84	11182	-5.2806	-0.6058	discard	exp#362 mtf_30m_bollinger_mr_4h_hma_rsi7_atr_v1	train
9e82608	mtf_30m_bollinger_mr_4h_hma_rsi7_atr_v1	SOLUSDT	-3.5857	-95.43	-53.91	-96.07	59.5	0.88	11543	-2.8912	-0.5612	discard	exp#362 mtf_30m_bollinger_mr_4h_hma_rsi7_atr_v1	train
9e82608	mtf_30m_bollinger_mr_4h_hma_rsi7_atr_v1	BTCUSDT	-7.4311	-95.88	-54.98	-96.0	56.1	0.87	11220	-6.1605	-0.5727	discard	exp#362 mtf_30m_bollinger_mr_4h_hma_rsi7_atr_v1	train
9e82608	mtf_30m_bollinger_mr_4h_hma_rsi7_atr_v1	ETHUSDT	-6.5723	-97.13	-58.86	-97.16	56.9	0.84	11182	-5.2806	-0.6058	discard	exp#362 mtf_30m_bollinger_mr_4h_hma_rsi7_atr_v1	train
9e82608	mtf_30m_bollinger_mr_4h_hma_rsi7_atr_v1	SOLUSDT	-3.5857	-95.43	-53.91	-96.07	59.5	0.88	11543	-2.8912	-0.5612	discard	exp#362 mtf_30m_bollinger_mr_4h_hma_rsi7_atr_v1	train
f61c727	mtf_1h_regime_chop_4h_hma_bollinger_rsi_atr_v1	BTCUSDT	-3.6033	-75.53	-29.68	-75.98	47.1	0.89	5562	-3.8331	-0.3907	discard	exp#363 mtf_1h_regime_chop_4h_hma_bollinger_rsi_atr_v1	train
f61c727	mtf_1h_regime_chop_4h_hma_bollinger_rsi_atr_v1	ETHUSDT	-2.5205	-72.48	-27.59	-72.74	47.6	0.93	5604	-2.7273	-0.3792	discard	exp#363 mtf_1h_regime_chop_4h_hma_bollinger_rsi_atr_v1	train
f61c727	mtf_1h_regime_chop_4h_hma_bollinger_rsi_atr_v1	SOLUSDT	-0.9563	-53.87	-17.65	-58.03	49.9	1.0	5764	-1.0239	-0.3042	discard	exp#363 mtf_1h_regime_chop_4h_hma_bollinger_rsi_atr_v1	train
f61c727	mtf_1h_regime_chop_4h_hma_bollinger_rsi_atr_v1	BTCUSDT	-3.6033	-75.53	-29.68	-75.98	47.1	0.89	5562	-3.8331	-0.3907	discard	exp#363 mtf_1h_regime_chop_4h_hma_bollinger_rsi_atr_v1	train
f61c727	mtf_1h_regime_chop_4h_hma_bollinger_rsi_atr_v1	ETHUSDT	-2.5205	-72.48	-27.59	-72.74	47.6	0.93	5604	-2.7273	-0.3792	discard	exp#363 mtf_1h_regime_chop_4h_hma_bollinger_rsi_atr_v1	train
f61c727	mtf_1h_regime_chop_4h_hma_bollinger_rsi_atr_v1	SOLUSDT	-0.9563	-53.87	-17.65	-58.03	49.9	1.0	5764	-1.0239	-0.3042	discard	exp#363 mtf_1h_regime_chop_4h_hma_bollinger_rsi_atr_v1	train
7bae4db	mtf_4h_fisher_kama_daily_hma_chop_regime_atr_v1	BTCUSDT	-0.2109	1.86	0.46	-29.66	30.8	1.54	607	-0.2632	0.0155	discard	exp#364 mtf_4h_fisher_kama_daily_hma_chop_regime_atr_v1	train
7bae4db	mtf_4h_fisher_kama_daily_hma_chop_regime_atr_v1	ETHUSDT	-0.0473	8.49	2.06	-21.96	30.8	1.59	668	-0.0609	0.0938	discard	exp#364 mtf_4h_fisher_kama_daily_hma_chop_regime_atr_v1	train
7bae4db	mtf_4h_fisher_kama_daily_hma_chop_regime_atr_v1	SOLUSDT	0.4709	80.92	16.05	-38.9	32.9	1.78	633	0.6209	0.4124	keep	exp#364 mtf_4h_fisher_kama_daily_hma_chop_regime_atr_v1	train
7bae4db	mtf_4h_fisher_kama_daily_hma_chop_regime_atr_v1	SOLUSDT	-0.1956	-1.57	-1.29	-28.27	35.3	1.5	224	-0.2659	-0.0457	discard	exp#364 mtf_4h_fisher_kama_daily_hma_chop_regime_atr_v1	test
7bae4db	mtf_4h_fisher_kama_daily_hma_chop_regime_atr_v1	BTCUSDT	-0.2109	1.86	0.46	-29.66	30.8	1.54	607	-0.2632	0.0155	discard	exp#364 mtf_4h_fisher_kama_daily_hma_chop_regime_atr_v1	train
7bae4db	mtf_4h_fisher_kama_daily_hma_chop_regime_atr_v1	ETHUSDT	-0.0473	8.49	2.06	-21.96	30.8	1.59	668	-0.0609	0.0938	discard	exp#364 mtf_4h_fisher_kama_daily_hma_chop_regime_atr_v1	train
7bae4db	mtf_4h_fisher_kama_daily_hma_chop_regime_atr_v1	SOLUSDT	0.4709	80.92	16.05	-38.9	32.9	1.78	633	0.6209	0.4124	discard	exp#364 mtf_4h_fisher_kama_daily_hma_chop_regime_atr_v1	train
6cbd45d	mtf_12h_kama_daily_hma_rsi_vol_filter_atr_v1	BTCUSDT	-0.9717	-30.82	-8.8	-41.86	40.8	0.91	544	-1.198	-0.2103	discard	exp#365 mtf_12h_kama_daily_hma_rsi_vol_filter_atr_v1	train
6cbd45d	mtf_12h_kama_daily_hma_rsi_vol_filter_atr_v1	ETHUSDT	-0.0326	12.07	2.89	-26.47	40.4	1.1	537	-0.0425	0.1092	discard	exp#365 mtf_12h_kama_daily_hma_rsi_vol_filter_atr_v1	train
6cbd45d	mtf_12h_kama_daily_hma_rsi_vol_filter_atr_v1	SOLUSDT	0.6474	112.83	20.87	-24.97	43.6	1.25	518	0.8693	0.8359	keep	exp#365 mtf_12h_kama_daily_hma_rsi_vol_filter_atr_v1	train
6cbd45d	mtf_12h_kama_daily_hma_rsi_vol_filter_atr_v1	SOLUSDT	-0.4539	-6.94	-5.75	-20.3	39.6	1.0	169	-0.5392	-0.2831	discard	exp#365 mtf_12h_kama_daily_hma_rsi_vol_filter_atr_v1	test
6cbd45d	mtf_12h_kama_daily_hma_rsi_vol_filter_atr_v1	BTCUSDT	-0.9717	-30.82	-8.8	-41.86	40.8	0.91	544	-1.198	-0.2103	discard	exp#365 mtf_12h_kama_daily_hma_rsi_vol_filter_atr_v1	train
6cbd45d	mtf_12h_kama_daily_hma_rsi_vol_filter_atr_v1	ETHUSDT	-0.0326	12.07	2.89	-26.47	40.4	1.1	537	-0.0425	0.1092	discard	exp#365 mtf_12h_kama_daily_hma_rsi_vol_filter_atr_v1	train
6cbd45d	mtf_12h_kama_daily_hma_rsi_vol_filter_atr_v1	SOLUSDT	0.6474	112.83	20.87	-24.97	43.6	1.25	518	0.8693	0.8359	discard	exp#365 mtf_12h_kama_daily_hma_rsi_vol_filter_atr_v1	train
6ca6ad0	mtf_15m_kama_4h_hma_bollinger_regime_rsi_atr_v1	BTCUSDT	-19.0954	-100.0	-92.4	-100.0	50.8	0.8	40180	-22.6937	-0.924	discard	exp#367 mtf_15m_kama_4h_hma_bollinger_regime_rsi_atr_v1	train
6ca6ad0	mtf_15m_kama_4h_hma_bollinger_regime_rsi_atr_v1	ETHUSDT	-15.1742	-100.0	-91.69	-100.0	51.7	0.83	39329	-18.1288	-0.917	discard	exp#367 mtf_15m_kama_4h_hma_bollinger_regime_rsi_atr_v1	train
6ca6ad0	mtf_15m_kama_4h_hma_bollinger_regime_rsi_atr_v1	SOLUSDT	-9.0874	-99.99	-89.42	-99.99	52.9	0.93	37655	-11.2327	-0.8943	discard	exp#367 mtf_15m_kama_4h_hma_bollinger_regime_rsi_atr_v1	train
6ca6ad0	mtf_15m_kama_4h_hma_bollinger_regime_rsi_atr_v1	BTCUSDT	-19.0954	-100.0	-92.4	-100.0	50.8	0.8	40180	-22.6937	-0.924	discard	exp#367 mtf_15m_kama_4h_hma_bollinger_regime_rsi_atr_v1	train
6ca6ad0	mtf_15m_kama_4h_hma_bollinger_regime_rsi_atr_v1	ETHUSDT	-15.1742	-100.0	-91.69	-100.0	51.7	0.83	39329	-18.1288	-0.917	discard	exp#367 mtf_15m_kama_4h_hma_bollinger_regime_rsi_atr_v1	train
6ca6ad0	mtf_15m_kama_4h_hma_bollinger_regime_rsi_atr_v1	SOLUSDT	-9.0874	-99.99	-89.42	-99.99	52.9	0.93	37655	-11.2327	-0.8943	discard	exp#367 mtf_15m_kama_4h_hma_bollinger_regime_rsi_atr_v1	train
22ebce7	mtf_30m_supertrend_4h_hma_rsi_momentum_atr_v1	BTCUSDT	-16.8566	-99.93	-83.5	-99.93	40.6	0.85	24491	-19.6549	-0.8356	discard	exp#368 mtf_30m_supertrend_4h_hma_rsi_momentum_atr_v1	train
22ebce7	mtf_30m_supertrend_4h_hma_rsi_momentum_atr_v1	ETHUSDT	-13.4147	-99.92	-83.4	-99.92	42.2	0.8	24275	-15.198	-0.8347	discard	exp#368 mtf_30m_supertrend_4h_hma_rsi_momentum_atr_v1	train
22ebce7	mtf_30m_supertrend_4h_hma_rsi_momentum_atr_v1	SOLUSDT	-8.238	-99.92	-83.4	-99.92	45.8	0.9	24574	-9.4813	-0.8347	discard	exp#368 mtf_30m_supertrend_4h_hma_rsi_momentum_atr_v1	train
22ebce7	mtf_30m_supertrend_4h_hma_rsi_momentum_atr_v1	BTCUSDT	-16.8566	-99.93	-83.5	-99.93	40.6	0.85	24491	-19.6549	-0.8356	discard	exp#368 mtf_30m_supertrend_4h_hma_rsi_momentum_atr_v1	train
22ebce7	mtf_30m_supertrend_4h_hma_rsi_momentum_atr_v1	ETHUSDT	-13.4147	-99.92	-83.4	-99.92	42.2	0.8	24275	-15.198	-0.8347	discard	exp#368 mtf_30m_supertrend_4h_hma_rsi_momentum_atr_v1	train
22ebce7	mtf_30m_supertrend_4h_hma_rsi_momentum_atr_v1	SOLUSDT	-8.238	-99.92	-83.4	-99.92	45.8	0.9	24574	-9.4813	-0.8347	discard	exp#368 mtf_30m_supertrend_4h_hma_rsi_momentum_atr_v1	train
1fea2da	mtf_1h_kama_4h_kama_macd_volume_atr_v1	BTCUSDT	-1.8861	-53.82	-17.58	-56.38	28.4	1.24	3333	-2.1048	-0.3117	discard	exp#369 mtf_1h_kama_4h_kama_macd_volume_atr_v1	train
1fea2da	mtf_1h_kama_4h_kama_macd_volume_atr_v1	ETHUSDT	-0.7762	-28.1	-7.92	-43.0	29.9	1.4	3259	-0.8829	-0.1842	discard	exp#369 mtf_1h_kama_4h_kama_macd_volume_atr_v1	train
1fea2da	mtf_1h_kama_4h_kama_macd_volume_atr_v1	SOLUSDT	-0.113	-4.94	-1.26	-39.65	31.2	1.48	3397	-0.1288	-0.0319	discard	exp#369 mtf_1h_kama_4h_kama_macd_volume_atr_v1	train
1fea2da	mtf_1h_kama_4h_kama_macd_volume_atr_v1	BTCUSDT	-1.8861	-53.82	-17.58	-56.38	28.4	1.24	3333	-2.1048	-0.3117	discard	exp#369 mtf_1h_kama_4h_kama_macd_volume_atr_v1	train
1fea2da	mtf_1h_kama_4h_kama_macd_volume_atr_v1	ETHUSDT	-0.7762	-28.1	-7.92	-43.0	29.9	1.4	3259	-0.8829	-0.1842	discard	exp#369 mtf_1h_kama_4h_kama_macd_volume_atr_v1	train
1fea2da	mtf_1h_kama_4h_kama_macd_volume_atr_v1	SOLUSDT	-0.113	-4.94	-1.26	-39.65	31.2	1.48	3397	-0.1288	-0.0319	discard	exp#369 mtf_1h_kama_4h_kama_macd_volume_atr_v1	train
99790e3	mtf_4h_kama_adaptive_daily_weekly_hma_chop_regime_rsi_atr_v1	BTCUSDT	-1.9661	-43.4	-13.27	-46.53	38.3	0.91	1972	-2.1365	-0.2852	discard	exp#370 mtf_4h_kama_adaptive_daily_weekly_hma_chop_regime_rsi_atr_v1	train
99790e3	mtf_4h_kama_adaptive_daily_weekly_hma_chop_regime_rsi_atr_v1	ETHUSDT	-1.1163	-30.51	-8.7	-38.82	40.1	0.99	1985	-1.2228	-0.2242	discard	exp#370 mtf_4h_kama_adaptive_daily_weekly_hma_chop_regime_rsi_atr_v1	train
99790e3	mtf_4h_kama_adaptive_daily_weekly_hma_chop_regime_rsi_atr_v1	SOLUSDT	-0.3237	-10.12	-2.64	-38.92	41.9	1.03	2001	-0.3452	-0.0679	discard	exp#370 mtf_4h_kama_adaptive_daily_weekly_hma_chop_regime_rsi_atr_v1	train
99790e3	mtf_4h_kama_adaptive_daily_weekly_hma_chop_regime_rsi_atr_v1	BTCUSDT	-1.9661	-43.4	-13.27	-46.53	38.3	0.91	1972	-2.1365	-0.2852	discard	exp#370 mtf_4h_kama_adaptive_daily_weekly_hma_chop_regime_rsi_atr_v1	train
99790e3	mtf_4h_kama_adaptive_daily_weekly_hma_chop_regime_rsi_atr_v1	ETHUSDT	-1.1163	-30.51	-8.7	-38.82	40.1	0.99	1985	-1.2228	-0.2242	discard	exp#370 mtf_4h_kama_adaptive_daily_weekly_hma_chop_regime_rsi_atr_v1	train
99790e3	mtf_4h_kama_adaptive_daily_weekly_hma_chop_regime_rsi_atr_v1	SOLUSDT	-0.3237	-10.12	-2.64	-38.92	41.9	1.03	2001	-0.3452	-0.0679	discard	exp#370 mtf_4h_kama_adaptive_daily_weekly_hma_chop_regime_rsi_atr_v1	train
5a5e441	mtf_12h_kama_daily_hma_chop_regime_rsi_atr_v1	BTCUSDT	-0.8784	-32.15	-9.24	-33.51	47.7	0.89	277	-1.0723	-0.2759	discard	exp#371 mtf_12h_kama_daily_hma_chop_regime_rsi_atr_v1	train
5a5e441	mtf_12h_kama_daily_hma_chop_regime_rsi_atr_v1	ETHUSDT	0.1999	32.31	7.25	-18.92	51.6	1.17	277	0.2665	0.3834	keep	exp#371 mtf_12h_kama_daily_hma_chop_regime_rsi_atr_v1	train
5a5e441	mtf_12h_kama_daily_hma_chop_regime_rsi_atr_v1	ETHUSDT	0.3504	12.71	10.35	-14.36	51.9	1.33	79	0.4708	0.7205	keep	exp#371 mtf_12h_kama_daily_hma_chop_regime_rsi_atr_v1	test
